first_release_date,genres,id,name,platforms,summary,storyline,rating
1594598400,"[5, 8, 12, 31, 32]",116100,Neon Abyss,"[6, 48, 49, 130]",Neon Abyss is a frantic roguelike actionplatformer where you run n gun your way into the Abyss as part of the Hades formed Grim Squad Featuring unlimited item synergies and a unique dungeon evolution system each run diversifies the experience and every choice alters the ruleset Get ready to unleash hell  Combining furious run n gun action and deep roguelike mechanics Neon Abyss pits you as a member of the Grim Squad  a task force setup by Hades himself to infiltrate the Abyss and defeat the New Gods Death is not the end as every time you die youll find yourself more empowered than before,Missing,72.30600196109923
1595462400,"[2, 8, 9, 31, 32]",28528,Rki,"[6, 14, 130, 167, 169]",Rki is an adventure game inspired by Scandinavian folklore a dark contemporary fairy tale underpinned by a touching narrative alluring art style ancient puzzles and atmospheric exploration  We join Tove on a fantastical journey to save her family A journey that takes her deep into a hidden and long forgotten world of lost folklore filled with strange locations and even stranger creatures  Explore the ancient wilderness solve its mysteries save your family in this modern adventure game for all  EXPLORE a Living Fairy Tale Forest  Join Tove to Explore a rich and beguiling world of wintry Scandinavian folklore a world alive with detail and life crafted in Rkis signature graphical art style  Make Friends WIth MONSTERS  Seek out the ancient and magical creatures of the Scandinavian wilderness some are friendly some not so much Rki has a rich cast of unique creepybutcute characters to discover our own take on Nordic folklore  SEARCH for Long Forgotten Items  The ancient wilderness holds many secrets Seek out long forgotten items to aid you on your adventure  SOLVE the Riddles of the Wilderness  Rki is a game of brains not brawn Can you unlock ancient pathways and solve the riddles of the ancients  CHART your Journey  Tove charts her progress in her trusty journal its her grail diary Map uncharted regions delve deeper into the rich lore of Scandinavian folklore collect loot and earn unique wilderness explorer badges  An ADVENTURE For ALL  Rki is an adventure game for ALL gamers With its nonviolent gameplay accessible controls and universal themes it is a journey to delight all gamers The game is designed uniquely to pose a challenge but to also offer a helping hand when adventurers need it meaning it can be enjoyed by all A truly modern take on the Adventure game genre,Missing,72.27781479262998
1595894400,"[5, 31]",119257,Destroy All Humans!,"[6, 48, 49, 130, 170]",The cultclassic returns Terrorize the people of 1950s Earth in the role of the evil alien Crypto137 Harvest DNA and bring down the US government in the remake of the legendary alien invasion action adventure Annihilate puny humans using an assortment of alien weaponry and psychic abilities Reduce their cities to rubble with your flying Saucer One giant step on mankind,Humankind is under attack by an alien lifeform that is secretly trying to undermine US democracy bring down its government and harvest the DNA of its citizens And that alien is you  In 1959 Cryptosporidium137 arrives on Earth in search for his predecessor clone Cryptosporidium136 Crypto136 disappeared after Orthopox13 sent him to Earth to prepare the large scale extraction of human DNA  Pox sends Crypto on a mission to harvest human brain stems which contain alien DNA due to an encounter between Furon warriors and humans in ancient times to prevent the Furons from going extinct Furon genitalia have withered away generations ago due to prolonged exposure to their own nuclear weaponry  To accomplish his mission he must battle US forces infiltrate and sabotage secret government facilities and defeat Majestic a shadowy government organization led by a blackclad figure named Silhouette  The invasion is on,70.54579375435308
1595894400,"[9, 31, 32]",127144,Arrog,"[6, 14, 48, 130]",Arrog is an enigmatic puzzle adventure game featuring handdrawn art and set in a bizarre blackandwhite world with color accents The story of the game is about the journey of a man accepting his death through his dreams Arrog is a coproduction between Hermanos Magia and LEAP Game Studios,Missing,70.0
1594857600,"[13, 31, 32]",122372,Before I Forget,"[3, 6, 14, 49, 130, 169]",Explore the present to uncover the past in a short story of love and loss and a life welllived A narrative exploration that examines a world where memories are constantly fading and jumbled A game about dementia and what happens when you cant hold onto the things youve done or the people youve loved,Missing,70.0
1595808000,"[12, 15, 16, 24, 31, 32]",107140,Othercide,"[6, 48, 49, 130]",Othercide is a horror themed tactical turnbased game set in an esoteric world beyond our reality The game will place the player in control of female warriors in a desperate struggle to push back nightmarish creatures and prevent reality from shattering  Using only black white and touch of red the game will drag players into a whole new universe for the genre to experience a journey through a strange and unknown world a world that lays behind the mirror of their own minds,Missing,69.73514823548469
1594857600,"[13, 31, 32, 34]",132400,We should talk.,"[3, 6, 14, 48, 49, 130]",Its not what you say its how you say it We should talk is a shortform narrative game that will make players think carefully about the words they choose  Using a unique narrative choice mechanic players craft sentences in response to the ingame characters in We should talk Through this careful choice of words players express themselves as they discuss ongoing problems about life and romance with their ingame partner over text messages while also chatting with friends and strangers at their favorite local bar about whats on their mind  The combination of words they choose impacts the conversations they have how genuinely they can connect with their partner and whether their relationship can survive the night,Missing,60.0
