first_release_date,genres,id,name,platforms,summary,storyline,rating
1593907200,[8],268713,Stupid BallZ 2.5: Remnant of Brown,[4],Missing,Missing,Missing
1595116800,[8],268690,Master Quest 2 Two: Best Buy Edition,[4],Missing,Missing,Missing
1595376000,[8],268351,A Rushed Project,[19],A Rushed Project is a mini SMW hack with 7 exits in total but with a small twist Each of those levels grabbed a different gimmick graphics and other things and then were made a full complete level in under 1 hour,Missing,Missing
1593820800,[8],268339,Of Jumps and Platforms,[19],Missing,Missing,Missing
1594944000,[9],264100,Sudoku Master,"[34, 130]",Endless number of sudoku puzzles to explore Sudoku Master  Classic Sudoku has different sudoku puzzles and comes in four difficulty levels easy medium hard sudoku and sudoku expert levels Sudoku kingdom for all kinds of sudoku players,Missing,Missing
1595203200,[4],257769,WCW/nWo Revenji,[4],Missing,Missing,Missing
1595980800,[8],249547,Mario and the Rod of Seasons,[4],Missing,Missing,Missing
1593648000,"[12, 31]",249442,Chrono Trigger: Bugfix and Uncensoring Patch,[19],This patch is geared towards fixing bugs and patching up script inconsistencies or censorship The aim is to preserve the original translation while generally improving the game as a whole,Missing,Missing
1594857600,Missing,238337,Gal*Gun 2: Complete DLC Bundle,[130],GalGun 2 the notoriously lewd railshooter is back In case you already own the game itself you can now complete your set by adding all the DLC youre missing to your collection,Missing,Missing
1595894400,Missing,238179,Megadimension Neptunia VII: Party Character - Umio & Nepgya,[130],Missing,Missing,Missing
1595894400,Missing,238178,Megadimension Neptunia VII: Party Character - Nitroplus,[130],Missing,Missing,Missing
1595894400,Missing,238177,Megadimension Neptunia VII: Party Character - God Eater,[130],Missing,Missing,Missing
1595808000,Missing,238006,Talisman: Digital Edition - Character Pack 8,[130],Missing,Missing,Missing
1595376000,Missing,237993,Neon Abyss: The Lovable Rogues Pack,[130],Missing,Missing,Missing
1595462400,Missing,237927,Urban Flow: Expansion Pack,[130],Missing,Missing,Missing
1594598400,Missing,237911,Yoga Master: Dreams Fantasy Bundle,[130],Missing,Missing,Missing
1596067200,Missing,237884,Groove Coaster: Wai Wai Party!!!! - Touhou Project Arrangements Pack 4,[130],Missing,Missing,Missing
1595894400,"[12, 15]",227039,Megadimension Neptunia VII: Nightwear Pack,[130],No rest for the moe But they can dress to rest with this Nightwear Pack,Missing,Missing
1593907200,"[8, 31]",225551,Starlight Mario,[18],A short nightthemed hack consisting of 3 worlds with 12 levels in total Mario has to retrieve the Star Rod to save the Mushroom Kingdom,Missing,Missing
1595548800,Missing,222191,Urban Flow: Extended Edition,[130],Missing,Missing,Missing
1596067200,"[12, 31]",221782,Fairy Tail: Digital Deluxe Edition,"[6, 48, 130]",Magic  Guilds  RPG Based on the fantasy adventure comic about Natsu a Dragon Slayer of the rowdy Fairy Tail magician guild and his unique group of friends battling against no less unique and memorable enemies  From popular fanfavorite episodes to original ingame episodes players can experience the magical world of Earth Land and fight with Fairy Tail in the exhilarating story  Fairy Tails Digital Deluxe Edition comes with  Costume set Grand Magic Games team costumes  Bonus Lacrima set  DDX limited costume Ryza costume for Lucy,Missing,Missing
1595376000,"[5, 7, 9, 15, 32]",209069,Touhou Spell Bubble: Scarlet Devil Land Song Pack,[130],This new music pack Scarlet Devil Land Song Pack contains 6 songs and challenges,Missing,Missing
1595289600,Missing,167977,One Piece: Pirate Warriors 4 - Whole Cake Island Pack,"[49, 130]",Get three new playable characters in this Character Pack Jump into the fray and enjoy allnew One Piece Pirate Warriors action with three characters from the Whole Cake Island Arc,Missing,Missing
1595980800,"[13, 15]",167288,Idle Inventor: Factory Tycoon,"[34, 39, 130]",Churn out massive machines in your finelytuned factory  day and night even while youre not playing,Missing,Missing
1595030400,"[8, 25, 31]",166328,Star Fox Adventures: Amethyst Edition,[21],Star Fox Adventures Amethyst Edition is a mod of Star Fox Adventures GameCube which makes a number of small improvements to the game such autosave gameplay optimization debug options and Krystal as a playable character,Missing,Missing
1594857600,"[12, 31, 32]",166080,Labyrinth of Touhou: Gensoukyo and the Heaven Piercing Tree,"[6, 48, 130]",Long stories Dungeon RPG with girls of Touhou Project Towering HeavenPiercing tree suddenly losing the Amanomurakumo and more Find out mastermind of the simultaneous outbreaks Fight against the powerful enemies Lets dig in the vast dungeon ,Missing,Missing
1595462400,[15],164402,Sid Meier's Civilization VI: Ethiopia Pack,"[6, 48, 49, 130]",Introduces the Ethiopia civilization with Menelik II the Oromo Cavalry unique unit and the RockHewn Church tile improvement,Missing,Missing
1595635200,[8],162831,Donkey Kong Country Mania,[19],Donkey Kong Country Mania is a ROM hackmod of Donkey Kong Country that aims to mix some old and new together much like the game that inspired this hack Sonic Mania Some new levels and ideas are remixed with some reimaginings of levels from DKs handheld past,Missing,Missing
1594771200,"[12, 31]",159195,The Legend of Zelda: Master of Time,[4],Master of Time is a new story in a completely new world Abello where Link must restore the flow of time Abello is a big and dangerous world but Link can count on the help of Nite the fairy  Around 20 hours of gameplay in various areas and dungeons with custom cutscenes songs and much more Good luck finding all 100 skulltula tokens and 20 hearts,After saving both Hyrule and Termina Link found himself without a quest He journeyed long and far without knowing what to do He thought a lot about the time manipulation he had done and asked himself if he was the real hero or if he was just a victim of these stories  The more his obsession of time had grown the more it felt that time was slowing down Until it froze completely condemning his journey to an endless day Just before passing out from exhaustion Link finally found a new country,Missing
1594252800,"[13, 15]",155171,Tropico 6: Lobbyistico,"[6, 49, 130]",Join the EU in their investigations into corruptionomics and unlock new powerful perks in Lobbyistico for Tropico 6,Missing,Missing
1593648000,[12],151650,Toricky S,"[6, 130]",TorickyS is the switch version of the oldschool ActionAdventure game featuring unique mechanics based on fastflying and physics,Missing,Missing
1596153600,"[8, 9, 31, 32, 33]",150502,Naught,"[6, 48, 130]",Naught is a platform videogame with a unique control where you rotate the environment to change gravity and guide the main character Naught through labyrinth levels full of challenges hidden places and secrets  Featuring varied dynamic gameplay Naught explores 70 levels where he must dodge danger and enemies arising from the shadows discover hidden places collect seeds of light that will help him access blocked areas and recover the diamond fragments that possess enormous power  Throughout his adventure he will be accompanied by the Spirit of the Tree who will help him find his way through extremely narrow and complex labyrinths You can also enjoy a time trial challenge on every level  In Naught you will discover an underground world full of lights and shadows connected to the exciting story of our character a soul awakened to face the shadows and protect what he loves the most,Do you like black cats Discover Naught a unique game where you move the environment instead of the character Enjoy amazing labyrinths and secrets with the best soundtrack Help Naught in this fun and challenging indie  Naught is a platform videogame with a unique control where you rotate the environment to change gravity and guide the main character Naught through labyrinth levels full of challenges hidden places and secrets  Featuring varied dynamic gameplay Naught explores 40 levels where he must dodge danger and enemies arising from the shadows discover hidden places collect seeds of light that will help him access blocked areas and recover the diamond fragments that possess enormous power Throughout his adventure he will be accompanied by the Spirit of the Tree who will help him find his way through extremely narrow and complex labyrinths You can also enjoy a time trial challenge on every level  In Naught you will discover an underground world full of lights and shadows connected to the exciting story of our character a soul awakened to face the shadows and protect what he loves the most,Missing
1594252800,"[10, 13, 14]",148001,Gas Station: Highway Services,[130],Buckle up and get ready for the trip of your life When you cruise on an open highway the safety and convenience of your trip depend on the services provided along the road This is a game that lets you explore them,Missing,Missing
1594944000,"[13, 33, 35]",147974,Slots of Poker at Aces Casino,[130],Enjoy Las Vegas casino slots and poker action with Slots of Poker 15 different casino slot machines to play including Gladiators Aliens Cats Treasure Hunt Dogs and more You start with 25000 FREE coins and win more with free bonus spins and level up rewards Plenty of big wins free spins Just take a seat in the casino and spin spin spin while you win win win,Missing,Missing
1595462400,"[15, 32, 33, 35]",147971,Dominate: Board Game,"[3, 6, 14, 130]",The object of the game is to make your pieces constitute a majority of the pieces on the board at the end of the game by converting as many of your opponents pieces as possible You can play against a friend or alone in arcade mode with increasing difficulty The game will test you tactic skills and entertain you and your friends Dominate the board and climb the leaderboard Based on an early 90s arcade game,Missing,Missing
1596153600,"[13, 14, 35]",147921,FootGoal! Tiki Taka,[130],Weve all played and been fascinated by how it works The first official table of the classic popular football game For gamers for football fans A retro fun way to enjoy football Short passes long balls lobs or just shooting Intuitive rapid controls and ball speeds of up to 120 kmh Try out your reflexes skills and strategies Official world competitions and tournaments created by the International Federation in countries such as the USA the UK France China Italy Germany and more show just how popular this game has been for so long Various game modes including quick games World Cup and the classic one vs one against friends Take this opportunity and get playing,Missing,Missing
1595462400,"[5, 14, 33]",147908,Hunt,"[48, 130]",Hunt is a sandbox hunting simulator game where the goal is to hunt as many game in 15 minutes Your hunding gear includes a sniper rifle 9mm pistol shotgun revolver and a semiautomatic machine gun With so many different kinds of animals to hunt no game will be the same Pick the time to go hunting If you hunt during the afternoon beware of the bears wandering around they will attack you and if you are hunting during the night beware of wild attacking wolf packs The animals you can hunt are randomly created in different sizes and colors and sizes and your score is based on the kind of animal and its size and colour,Missing,Missing
1594252800,"[9, 15, 33, 35]",147902,Retro Game Pack,[130],This bundle contains a collection of our favorite retro games Games that we grew up playing or wanting to play as a child All games contain a challenging CPU and local twoplayer modes Travel back in time into the middle of a retro room when we spent hours playing these games Play on the go on the TV or with others locally,Missing,Missing
1595462400,[9],147862,Hamster Bob,[130],Set out on an amazing journey together with Bob the hamster and discover a world that you will draw yourself In the game Bob will be your companion guide and friend with whom you can interact He will help you understand the story and will keep you up to date about what you need to do and when you should do it While playing you will hear a lot of valuable educational sentences Bob will regularly remind you to draw and encourage you to do it,Missing,Missing
1595376000,"[9, 15, 35]",147861,Chess Ace,[130],Chess Ace is a unique puzzle game bridging the gap between two classic games  chess  cards Plan your moves and deal the cards to beat all clubs on a 5x5 chessboard,Missing,Missing
1594857600,"[10, 14, 33]",147857,Super Club Tennis,[130],Ignite the tennis court unleash your sports talents in allout tennis battles with family and friends Whether you play solo or multiplayer intense rallies await Join Tournament to win the Grand Slam trophy Store up the energy to unleash unstoppable power shots and KO your opponents Craft your own signatures styles and strategies to win matches Pit your skills against friends and family in a multiplayer match Accumulate experience points to level up and unlock new minigames Collect keys in minigames to battle Aces from the galaxy Only the best of the bests can defeat the Aces and keep the trophies from across the universe Attend Ace Academy to earn certificate engraved with your nickname Take a snapshot to showoff with friends Train and perfect your slice shot drop shot banana curve top spins with tennis ball launcher Admire all your war trophies and treasures troves from the gallery Remember to collect daily gold handouts to help you with the games A unique mega game waiting for you to discover the gem packed hours of funs,Missing,Missing
1594857600,"[14, 33]",147834,Desktop Volleyball,[130],Enjoy volleyball with easy to learn controls Of course you can play normal style with 6 players but you can even play beach volleyball Choose from over 40 different uniform designs Try out new almost unbelievable stages such as a casino and a pirate ship Strategy and teamwork are the key to victory,Missing,Missing
1594857600,"[14, 33]",147820,Golf,"[48, 130]",Golf is an openworld 18 hole golf simulator game which you can either play alone or with another player Using our unique ball hit engine you decide on the exact point you want to hit the ball giving you a more realistic golf playing experience Choose between four different golf clubs driver iron wood and putter which all have different power levels view the PAR of every single hole on screen and you can move to any hole to practice Golf is playasyou want endless game which will give you hours of fun anytime anywhere,Missing,Missing
1593648000,"[5, 8, 31]",147796,Couch Co-Op Bundle Vol. 2,[130],Its time to get cosy with your best bud again for another round of unmissable coop action This bundle contains the following games all of which feature localcouch coop as well as singleplayer modes Black Paradox Soul Eater Bleed and Vertical Drop Heroes,Missing,Missing
1594944000,"[10, 14, 33]",147786,Power Racing Bundle,[130],Enjoy 2 games in 1 with this irresistible speed games pack Speedway Racing Get ready to feel the speed In Speedway Racing you will enjoy the fastest most spectacular races at over 350 Kmh avoiding multiple collisions against 20 rivals There are several modes available including Championship Arcade and 4player multiplayer WildTrax Racing Get ready to feel the wild In WildTrax Racing you will enjoy the wildest and most spectacular races in natural environments You will have several game modes such as Arcade and 4player multiplayer Features Arcade driving 4Player Multiplayer Online ranking If you prefer you can also purchase them separately in the Nintendo eSHOP,Missing,Missing
1595980800,"[9, 15, 35]",147784,Mini Puzzle Balls,[130],Mini Puzzle Balls is a new addictive puzzle game Move the balls into their corresponding slots Its simple Or is it Look for solutions unlock new mechanics increase your score and have fun,Missing,Missing
1594339200,[9],147745,Lockstone,[130],Descend into the fractured mind of a genius alchemist as you help him unlock the mysteries of life love and the universe itself through over 100 unique handcrafted enigmas in this atmospheric narrative puzzle game With its stunning visual style soundtrack and captivating narrative from author Adam Down Lockstone meshes established mechanics with new twists in an innovative engaging experience,Missing,Missing
1594684800,"[10, 13, 32, 33]",147735,Lawnmower Game: Next Generation,"[6, 130]",In Lanwmower game you drive lawnmower and cut grass in a big open world which contain grass houses and other obstacles Drive lawnmower in open world and cut every cuttable grass right in front of you After cutting all grass it will respawn  the game loop is endless Lawnmower has also fuel consumptio mechanics Pickup Jerry cans and add fuel If you run out of fuel you will respawn at the starting location Enjoy the game cut all the grass and be the Lawnmower King,Missing,Missing
1595289600,"[12, 13, 31, 34]",147719,Jisei: The First Case HD,"[48, 49, 130]",A teenager with no name and no home wanders from one city to the next burdened by the weight of his extraordinary ability When he is accused of murdering a woman that hes never met he sets out to prove his innocence and find the true killer The investigation quickly takes a turn for the complicated when a strange voice appears in his head warning him to watch his step Search for clues interrogate witnesses and find a murderer Even with your extra abilities it will still take solid facts and logic to prove your innocence Enjoy this cult classic indie mystery visual novel with HD art backgrounds and assets,Missing,Missing
1596153600,Missing,147700,Paint your Pet,[130],Paint your Pet allows player to paint different pets You can use a variety of colors and textures to make incredible animals Save your creations and return to it at any time you want to modify it Paint your Pet is fun easy to pick up game suitable for children at any age,Missing,Missing
1594857600,"[9, 15, 33]",147680,Get 10 Quest,"[49, 130]",80 levels 6 different gameplay and the original endless mode,Missing,Missing
1594944000,"[8, 9, 31, 33]",147627,Starlit Adventures Golden Stars,[130],Join Bo  Kikki for singleplayer or multiplayer fun anytime Take on this familyfriendly vertical scrolling adventure with up to three friends as you try to save the Starlits and recover all the stars taken by Nuru Comes with all suits including Unicorn Dino and Dragon Golden Suit as playable characters Three games in one for triple the fun Simple straightforward controls optimized for younger and lessexperienced players make this a perfect choice for anyone looking to introduce their family to the wonderful world of Starlit For multiplayer all a player needs is a JoyCon so two people can team up right out of the box Tackle 144 platforming courses in the two main game modes Story and Challenges Enjoy extra replayability with the game mode Infinite Tower,Missing,Missing
1594857600,"[9, 35]",147618,Sudoku Relax 5 Full Bloom,[130],Flowers in full bloom Let your mind take a break and refresh itself to the mindsoothing effects of Sudoku Relax 5 The popular Sudoku Relax title is coming out with a sequel Sudoku Relax 5 Flowers bloom and then scatterYou can enjoy the effects of transient beauty Choose from EASY NORMAL or HARD modes with over 300 puzzles Exercise your brain and wind down to the relaxing gameplay and music Solving puzzles unlocks new backgrounds and music tracks The game contains 3 backgrounds and 3 music tracks You can choose to pause the game at any time and continue playing at your convenience Simple touch controls make playing easy,Missing,Missing
1594252800,"[9, 33, 35]",147612,Crowdy Farm Puzzle,[130],The Crowdy Farm needs your smart head As farm manager you will have to solve many brainteasers to bring order to this place Sort organize and match Plan fit in and deduce in five different puzzle types Cover grass fields with colors set animals in matching rows and learn the work of shepherd dog But be precise your thinking needs accuracy if you want to meet the challenge,Missing,Missing
1593648000,"[9, 31, 33]",147608,Switchy Road DeluX,[130],The widely popular Switchy Road endless roller now comes in a new enhanced deluxe version The challenging road crossing game now has amazing new levels each with different themes backgrounds designs and music Play starts with the original Switchy Road theme but with skill you will quickly progress through each level to unlock the next unique theme Once you unlock them all you can go back and select whichever level you want to play again Play all the levels or stick with your favorite ones Random generated crossing roads make the challenge different every time you play,Missing,Missing
1596067200,"[10, 14, 33]",147567,Tiny Racer,[130],In this game you will pick your tiny car push the gas down and start the great race Play alone or have fun together with your friends kids or parents,Missing,Missing
1595548800,"[10, 14, 33]",147486,Up Cliff Drive,[130],Drive over hilly tracks collect stars coins and pickups to upgrade your cars and get further Also watch out for various obstacles,Missing,Missing
1595980800,"[13, 14]",147463,Olympic Basketball,"[6, 14, 130]",Show you skills moves and fakes in this fastpaced authentic Basketball game On defense steal ball from your opponents and on attack score 2 or 3 points shoots or dunk Main features  Single Match with Top AI game  Olympic Tournament games  Local 2 players games  Full 3D  Realistics animations  Real Basketball stadiums ambient sounds  Intuitive JoyCon or Pro Controllers Controls Time to enter competition,Missing,Missing
1595376000,[33],147426,Mini Island Challenge Bundle,[130],Choose your character gather powerups and beat the bosses Run through the four worlds and face the threat  run shoot dodge Explore the four islands each with a unique theme and beat their challenges Casualfriendly mechanics straight forward gameplay and the unique art style make the perfect easytograb entertainment No time to waste  choose your arsenal build your character with powerups and beat the Mini Island Challenge Bundle,Missing,Missing
1594771200,"[9, 33, 35]",147124,Travel Mosaics 4: Adventures In Rio,[130],Get ready The Walkers are taking you on an exciting adventure to sunny Rio Join the carnival complete colorful puzzles answer fun trivia questions and collect souvenirs Travel Mosaics is a nonogrampicross puzzle series that takes you all around the world,Missing,Missing
1594857600,[33],147108,Arcade Archives: Kangaroo,"[48, 130]",Kangaroo is an action game released by Sunsoft in 1982 A mama kangaroo must pummel her way through enemy monkeys to save her baby kangaroo Jump and use ladders to make your way up Punch enemy monkeys to defeat them and avoid their attacks to reach the baby kangaroo waiting for you,Missing,Missing
1595376000,"[5, 33]",147107,Arcade Archives: Koutetsu Yousai Strahl,"[48, 130]",Koutetsu Yousai Strahl is a shooting game released by UPL in 1992 Bent on world domination mad scientist Gegeben Funkerun has formed the secret society Aizerun Geist Select from four types of main weapons sub weapons and bombs and use them to destroy the steel fortress Koutetsu Yousai Strahl,Missing,Missing
1595462400,"[4, 33]",146998,Gerrrms,[130],Gerrrms is a party brawl game that puts you in the role of a microorganism fighting against its singlecelled opponents Take part in the eternal battle of the microbes Become one of the sneaky bacteria and tech your friends their place in line This is the best micro brawl game out there Play as one of 11 unlockable characters with different personalities There are as many as seven game modes Deathmatch  this is the classic germ vs germ warfare Flag  grab that flag and hold it tight The longer you hold it the closer you are to victory Bomb  ever tried to hold a hot potato When the timer goes down the bomb will explode Synapse Snatch  everyone has their owncolored corner The task is to grab the ball and carry it with you to your corner Gobble  oh look the delicious germ food is appearing in random locations Make sure you devour as much as you can Antibody  Avoid Barneys angry attacks as long as you can Take Over  pay attention to shiny spots popping up on the fields walls If you bump into them they will turn into your very own spikes Every game mode features a powerup that can give you an edge against your opponents Wait for the powerup timer to fill up and fire No friends coming over No worries The single player mode will keep you hooked for hours,Missing,Missing
1595203200,"[13, 31, 34]",146837,Sakura Succubus 2,"[3, 6, 14, 48, 130, 167]",Ogasawara Hiroki is a thoroughly average man until a photography job changes his life Suddenly a gorgeous actress athlete idol businesswoman and social media star all the girls of his dreams are within his reach Theyre all rich famous and extremely wellendowed and they should be utterly unattainableBut for some reason theyre insatiably attracted to Hiroki Hirokis harem is set to gain even more members But does he have enough time and energy to give these women what they want,Missing,Missing
1595376000,[8],146272,The Legend of Banjo-Kazooie: The Jiggies of Time,[4],The Legend of BanjoKazooie The Jiggies of Time is a ROM hackmod of BanjoKazooie Nintendo 64 In the game Banjo has to traverse the stages based on The Legend of Zelda Ocarina of Time,Missing,Missing
