first_release_date,genres,id,name,platforms,summary,storyline,rating
1593648000,"[5, 33]",135583,Arcade Archives: P-47,"[48, 130]",P47 is a shooting game released by Jaleco in 1988 Use machine guns and special weapons to defeat the enemy troops attacking from the land sea and air With exhilarating great plains seas of clouds shining in the setting sun and the open ocean where battleships 4 screens long appear and more These immersive stages can be enjoyed with 2 people playing simultaneously,Missing,Missing
1593907200,[33],135386,Overcooked! 2: Sun's Out Buns Out,"[6, 48, 49, 130]",Overcooked 2 Suns Out Buns Out is a summerinspired free DLC for Overcooked 2 released as an update,Missing,Missing
1594080000,"[8, 31, 32, 33]",135362,Rite,"[3, 6, 130]",RITE is a highspeed precision platformer where you must conquer a series of demanding trials a rite of passage for every Nim Find the key and reach the exit to move on to the next trial and maybe collect some gold along the way Who knows they could prove valuable to those who like a brutal challenge,Missing,Missing
1594598400,"[14, 33]",134708,Street Power Football,"[6, 48, 49, 130, 170]",Sick style and highenergy action come together in this arcadestyle football experience Face off against street football legends or friends in a variety of overthetop game modes and playgrounds unleashing tricks and crushing Super Powers as you grow your status to become Street King,Missing,Missing
1595980800,"[9, 12, 15, 16, 31, 32, 35]",133093,Cardaclysm,"[6, 49, 130]",Face the Four Horsemen of the Apocalypse in epic card battles Cardaclysm Shards of the Four is a procedurally generated collectible card game mixed with action RPG elements Collect creature and spell cards throughout your journey and unleash their power if anyone opposes you,Missing,Missing
1594944000,"[10, 14, 32, 33]",132538,Tri6: Infinite,"[3, 6, 14, 34, 48, 49, 130, 167]",Tri6 Infinite is a fastpaced endless runner in the Tri6 universe Avoid the obstacles as long as possible beat the top scores from other players and unlock new vehicles and powerups,Missing,Missing
1594166400,"[5, 32, 33]",132218,Contract Killers,"[6, 130]",Fast paced top down shooter you need to be fast and deadly choose your character pick new contract prepare your weapons and kill your target  Get rewarded and buy new more deadly weapons,Missing,Missing
1595808000,"[8, 9, 31, 32]",131622,Ageless,"[6, 130]",Ageless is a story driven puzzle platformer where you must alter the age of animals and plant life around you to progress Play as Kiara a young girl who braves through heartache and loss as she journeys across a mysterious world to discovers its secrets and herself,Missing,Missing
1596153600,"[12, 31, 32]",129999,Cat Quest + Cat Quest II: Pawsome Pack,"[48, 130]",Cat Quest is an openworld actionRPG set in a fantasy realm of cats Sequel to the awardwinning original Cat Quest II now lets you play solo or with a friend as both a cat and dog as you embark on an epic journey Quest in a world filled with magic defeat curious monsters collect statboosting loot and go on a catventure like never before    Expanding on the original with more explosive spells new weapon options and local coop  Cat Quest II improves on all aspects of the universallyadored indie sensation Enjoy both games in one tidy package,Missing,Missing
1596067200,"[8, 9, 12, 13, 31, 32]",129629,Into a Dream,"[3, 6, 14, 48, 130]",In Into A Dream you wake up in a mysterious place devoid of all your memories and come upon a recording addressed to you As you listen to it you realize that your mind has been linked to the dreams of a Luke Williams a man diagnosed with severe depression You are Lukes last hope and must prevent him from fading away  Delving deep into Lukes dreams where memories and symbols are blended together you are expected to disclose the events and actions that have led Luke to his darkness You will meet his close family and friends and must find ways to trick him into letting you access his darker dreams and unveil the emotional powerful and heartbreaking journey of his life  Lukes life is in your hands You have to help him take the first step towards recovery to make him see that his life matters You are his last hope  Key Features A cinematic presentation and unique visual experience An emotional heartbreaking and humane narrative about love hopelessness and depression Beautiful original soundtrack and dreamlike atmosphere Puzzlesolving woven into the games environment Full character voice over A complex story featuring real characters and relationships,You play as John Stevens a man whose mind has been linked to the dreams of Luke Williams who is suffering from depression You were sent there to find Luke understand what happened in his life and help him take the first step out of his darkness For that you will dig into Lukes dreams past and future where memories are mixed with symbolism meet his close family and friends and unveil the powerful emotional and heartbreaking journey of his life,Missing
1594944000,"[13, 31, 32, 34]",126705,White Wings,"[6, 48, 130, 167]",White Wings uses the Japanese emote animation system This is an agonizing wintertime love song Broken families Experiences of bullying Tears concealed by smiles Young men and women three encounters each carries sorrowful secrets in the cold winter Embracing each other and absorbing the earths final small bit of warmth,Missing,Missing
1596067200,"[31, 34]",124953,Root Film,"[48, 130]",Root Film is the successor to Root Letter  Masterful storytelling meets a multitude of interactive elements in the new game from Kadokawa Games,The video artist Rintaro Yakumo is participating in a new TV project Set in the Shimane Prefecture its a mystery drama production that also serves as a PR for tourism The pilot version was filmed 10 years ago and suspended for unknown reasons Now three filmmakers are competing to see who will be able to finish the production once and for all  Yakumo finds out that he is competing against two famous directors and heads over with his staff ready to start recording when a mysterious murder occurs,Missing
1594684800,"[8, 9, 31, 32]",124100,Rez Plz,"[6, 49, 130]",Take control of two wizard brothers who possess the power of resurrection in a gorgeous pixelart world Solve puzzles platforming challenges and encounter dangerous monsters and traps that require you to KILL one of the brothers to advance,Missing,Missing
1594252800,"[4, 8, 31, 32]",122794,Primal Light,"[3, 6, 14, 49, 130]",Inhabit Krog a mysterious blue creature in a red loincloth as he traverses a labyrinth of ladders levers traps and monsters Explore the nooks and crannies of a bizarre and evocative world as you hack and slash your way to victory leaving a graveyard of grotesque bosses in your wake,Missing,Missing
1596067200,"[12, 31]",122248,Fairy Tail,"[6, 48, 130]",Magic x Guilds x RPG Based on the fantasy adventure comic about Natsu a Dragon Slayer of the rowdy Fairy Tail magician guild and his unique group of friends battling against no less unique and memorable enemies  From popular fanfavorite episodes to original ingame episodes players can experience the magical world of Earth Land and fight with Fairy Tail in the exhilarating story,Missing,Missing
1594339200,[31],122232,Deadly Premonition 2: A Blessing in Disguise,"[6, 130]",Deadly Premonition 2 A Blessing in Disguise is a sequel to Deadly Premonition that takes place in presentday Boston Through unique storytelling venture back in time to Le Carr and uncover the mysteries buried within the once peaceful town Serving as both a sequel and prequel to the original Deadly Premonition follow Agents Davis and Jones as they begin a new investigation into the Le Carr serial murders Through the memories of a former FBI agent go back in time to Le Carr and step into the role of Special Agent York to begin unraveling the mystery,Boston 2019 FBI Special Agents Aaliyah Davis and Simon Jones looking into a case longthought solved find themselves on the doorstep of a person of interest Reports of a few missing bodies wouldnt normally interest the FBI but something about this case just doesnt add up  Despite having few leads to go on the pair hope asking this person the right questions about the red tree might get them somewhere But as the saying goes be careful what you wish for  some cases are best left closed  Louisiana 2005 A series of strange murders has blighted the backwater town of Le Carr and the FBI sends one of its young recruits Special Agent Francis York Morgan to investigate Befriended by the sheriffs daughter who seems older than her years the two soon set out together to find the truth  On the surface the peaceful town and its kind residents seem harmless enough But a darkness grows beneath and as casualties mount up Special Agent Morgan must find those responsible before it swallows him too,Missing
1595203200,"[10, 15, 32]",121714,Rock of Ages 3: Make & Break,"[6, 48, 49, 130, 170]",Rock of Ages 3 Make  Break is competitive tower defense and arcade action rolled up with ACE Teams quirky Monty Pythonesque humor into one giant creative game for the ages  Jump into the expansive gutbusting story for an eclectic adventure featuring bizarre and irreverent takes on legendary characters or for the first time create and share your own levels to compete with friends and strangers online in a realtime mix of hectic tower defense and epic boulderracing arcade action,Missing,Missing
1594857600,"[14, 32]",120419,Aeolis Tournament,"[3, 6, 14, 130]",Use the power of the wind to compete in the various games of the Storm Championship in this charmingly chaotic 8player action party game Aeolis Tournament features physicsbased gameplay a tournament mode and local and online multiplayer play,Missing,Missing
1594771200,"[5, 7, 32, 33]",119369,#Funtime,"[3, 6, 14, 48, 49, 130]",Pilot an upgradable ship through waves of photorealistic shapes featuring some of the most exotic colors known to man Swap colors to survive while pumping your favorite tunes and climbing the leaderboard Are you ready to have a Funtime,Missing,Missing
1596153600,[15],119361,CastleStorm II,"[6, 48, 49, 130]",Aim your catapults Command your troops Bloody the battlefield CastleStorms charming genre mashup returns leveling up everything you loved in the original with Unreal Engine 4powered ruthless destruction A whole new metagame of strategic conquest adds turnbased tactical intrigue to mix Dominate six distinct storydriven campaigns  even PvP and coop multiplayer modes  as you plot your path to triumph That is if you can earn it through chaotic carnage and delightful devastation,Missing,Missing
1594252800,"[12, 31]",116805,Sword Art Online: Alicization Lycoris,"[6, 48, 49, 130]",Following the events of the SWORD ART ONLINE Alicization anime series SWORD ART ONLINE Alicization Lycoris finds Kirito in a mysterious but familiar virtual world Underworld where AIs behave like humans As players take control of Kirito they will relive heartpounding scenes from the series through intense combat Players will also encounter fan favorite characters including Eugeo Alice Administrator and many more A wide world awaits Kirito and his friends in this exciting adaptation to the SWORD ART ONLINE Alicization series,Missing,Missing
1594857600,"[9, 31, 32, 33]",116592,Radical Rabbit Stew,"[6, 48, 49, 130]",Radical Rabbit Stew is a hareraising actionarcade game featuring fastpaced whackarabbit gameplay scintillating puzzles supersized boss fights juicy pixel graphics and a sizzling soundtrack perfect for new players and 16bit retro fans alike,Missing,Missing
1595808000,"[12, 13, 31, 32, 34]",116493,Synergia,"[3, 6, 14, 46, 48, 49, 130, 167]",Synergia is a yuri thriller visual novel that takes place in a cyberpunk future wrapped up in a beautifully unique vibrant neon aesthetic At the end of the world sometimes love is the ultimate crime,Missing,Missing
1595289600,"[8, 31, 32, 33]",116195,Panzer Paladin,"[6, 130]",Hop in the Paladin power armor seize melee weapons from the demonic invaders and give them a taste of their own medicine,The sight of giant swords blazing through the night sky might be hairraising but stand your ground The sinister Ravenous and his legions of brutal demons are poised for battle Even all the armies of the world cant stop them but humanity has one final ace in the hole cuttingedge power armor called Paladin  Its now up to a strongwilled android named Flame to become a Squire pilot the Paladin and track down all Weapon Keepers and their diabolical leader The showdown between mankinds technological prowess and the powerful forces of the occult has begun  Seize weapons from the denizens of the Netherworld and give them a taste of their own medicine Show them the power of cuttingedge technology fused with masterful swordplay Slash bash and thrust your way through a series of mindblowing levels around the world all of it rendered in glorious 8bit graphics Hop in your Paladin and take up arms,Missing
1595376000,"[13, 14, 31, 32]",113275,Volleyball Heaven,"[3, 6, 130]",Volleyball Heaven is a unique visual novel focusing on female friendship and love amid the complex social currents of contemporary America,Missing,Missing
1595980800,"[5, 8, 12, 31, 32, 33]",108770,Bite the Bullet,"[3, 6, 14, 48, 49, 130]",Satisfy your appetite for destruction in this roguelite RPG shooter where you must eat to powerup your character weapons and abilities Consume strange species to add new entries to DarwinCorps mysterious Compendium Catalyze crafting fermentations in your belly by eating enemies,Missing,Missing
1594857600,"[8, 10, 15, 31, 32]",107968,Never Breakup,"[6, 130]",This is a twoplayer game where two players are connected by a rope and they need to work together to pass the level The game includes both action and puzzle challenge your skills and brain It should be noted that no matter what the outcome is dont break up with your partner,Missing,Missing
1594684800,"[7, 8, 9, 31, 32]",103408,One Hand Clapping,"[6, 39, 48, 49, 130, 167, 169, 170]",One Hand Clapping is a musical 2D puzzle platformer that requires players to sing into their microphone to solve puzzles,Missing,Missing
1594944000,"[5, 8, 31, 32]",100891,Boom Blaster,"[6, 48, 49, 130, 169]",Boom Blaster is a handdrawn sidescrolling shootem up with intense boss fights Blast your way through each level with a range of weapons and unique hero abilities in this exciting and challenging action game,Get ready to blast your way to freedom in Boom Blaster the ultimate platform combat adventure that will keep you hooked for hours on end As a space prison inmate your destiny is clear kill every obstacle to earn your freedom  Get ready to face a barrage of challenges from tiny insects to massive bosses but dont worry youll have a wide range of skills to resist and overpower them all Each hero has unique strengths so choose wisely to maximize your chances of success  With an incredible array of weapons including machine guns grenades lasers flamethrowers and rockets youll have everything you need to unleash explosive destruction and take down your enemies easily  But the adventure doesnt end there  Boom Blaster also features thrilling rescue missions including highspeed chases intense flights uncovering secret artifacts and experiencing unexpected endings And with an insane amount of content youll never run out of exciting challenges to tackle,Missing
1596153600,"[12, 31, 32]",95616,Monster Crown,"[6, 48, 49, 130]",Monster Crown  Dark Monster Catching Game with True Crossbreeds  Featuring a brand new dynamic breeding system and a deep story in a world filled to the brim with optional content Offer contracts to dangerous beasts and breed them to create new species Travel across Crown Island with your Monsters as you work toward stopping an underground plan to revive the sadistic Philosopher Kings and return them to their thrones,Missing,Missing
1594252800,"[12, 31, 32]",95139,Elden: Path of the Forgotten,"[6, 48, 49, 130]",Elden is a medieval eldritch fantasy game focusing on storytelling through nontraditional indirect methods  like reading a book in a language you dont understand but with pictures,Missing,Missing
1595462400,"[10, 13, 14]",90352,Detective Driver: Miami Files,[130],Become a Detective Driver Drive various Cars and Boats to investigate crimes chase down the gang and save the City from corruption,Missing,Missing
1595980800,"[4, 13, 14, 32]",90231,Fight Crab,"[6, 130]",Welcome to Crab Fight A new 3D action game where you take control of a crab and fight off other giant enemy crabs  In this faroff world These crabs were granted ultimate strength and intelligence from the generous gods Using their newfound strength and wit they armed themselves with human weapons of the finest calibur and took control of the lands Immortal beings of unrelenting horror they cannot be killed with swords or even guns  However there is only one principle fact that rules these lands Those who are flipped onto their shells shall be cooked into a crab cake or mouthwatering rangoon  YesyesCrabs who have embarrassingly been flipped over onto their shells will have no choice but to submit to the pot  You are a crab Aiming to be the best around you embark on a world tour to flip as many crabs as possible,Missing,Missing
1594857600,"[13, 15, 24, 31, 32]",90138,Spyhack,"[6, 130]",Become a hacker that works for an intelligence agency Help agents in the field during their covert operations hack and control any device you encounter Tuxedos underwater bases banquets advanced technologies and heavy weapons  we have all of that and much more,Its year 2111 The world is ruled by technocorporations Their experiments have long exceeded all norms of ethics The best agents of the Advanced Technology Division stand on the guard of technological rule of law Become one of them and protect humanity from selfdestruction,Missing
1594684800,"[9, 13, 15, 16, 31, 32]",59472,Ultra Hat Dimension,"[3, 6, 14, 48, 49, 130]",Ultra Hat Dimension is a violent puzzle game about adorable hats and people getting punched for wearing them The catch is that the player cant punch anyone instead they must use the power of hats to convince others to do the punching for them Find and defeat the Spluff responsible,Missing,Missing
1593648000,"[8, 15, 31, 32, 33]",33626,Dungeon Runner,[37],Dungeon Runner is a 2D platformer with a high quality modernretro design The game is based on surviving several levels and passing them Levels are set into chapters Each chapter provides more difficult levels,Missing,Missing
1594771200,"[12, 13, 31, 32]",27366,Ooblets,"[6, 49, 130, 169]",Ooblets is a farming creature collection and town life game where you build up your farm befriend townsfolk grow ooblets and have danceoffs,Missing,Missing
1594252800,[8],135337,Bloodstained: Curse of the Moon 2,"[6, 48, 49, 130]",Curse of the Moon 2 brings classic 2D action and a dark 8bit aesthetic together with modern playability The multiplescenario structure of the previous title returns with an epic new story supervised by IGA Koji Igarashi himself  Players take control of Zangetsu a swordsman from the far east who bears a deep grudge against demonkind and the alchemists who summoned them Zangetsu must battle his way to the demonic stronghold but he doesnt have to do it alone Zangetsu can ally himself with a brand new cast of characters he meets along the way and add them to the playable roster  Three brandnew playable characters appear in Curse of the Moon 2 including the exorcist Dominique All characters from the original Curse of the Moon game are playable too Each new character adds a variety of gameplay options abilities and ways to complete the games many stages  Players can also create demon hunting duos in 2player local coop available for the first time in the series Work together with a friend mix and match the strengths of two different characters and conquer stages in tons of new and exciting ways,Demonic forces have been unleashed once again and it is up to Zangetsu accompanied by old and new allies to vanquish them,86.24045742022987
1594339200,"[2, 8, 9, 31, 32]",110834,Creaks,"[6, 14, 39, 48, 49, 130]",The ground starts shaking light bulbs are breaking  and something rather unusual is happening right behind the walls of your very room Equipped with nothing but wit and courage you slowly descend into a world inhabited by avian folk and seemingly deadly furniture monsters,Missing,81.6428013433987
1595548800,"[5, 32, 33]",112638,Jets'n'Guns 2,"[6, 48, 130, 167]",Side scrolling shooter with insane level of action and destruction Assume a role of a brave space pilot and jump into an epic adventure across the universe to save it from inevitable doom Unleash arsenal of the deadliest weapons and devices ever installed in a spaceship,Missing,80.0
1595462400,"[9, 31]",87596,Brightstone Mysteries: Paranormal Hotel,[130],Meet the ancient Egyptian cult in a search of almighty artifact Marcus Antonius King Arthur and many others who tried to kept this omnipowerful object hidden away from those who wanted to use its terrible powers for conquering the world and stop the evil from raising from its grave  Lead a young detective and confront the ancient Egyptian cult  Meet King Arthur Cleopatra Marcus Antonius and other historical characters  Explore the mystical old castle and over 50 other locations  Search the underworld and discover the supernatural  Help save the world from the ultimate evil,Missing,80.0
1595894400,"[31, 32]",111544,Maid of Sker,"[6, 48, 49, 130, 167, 169]",Maid of Sker is a firstperson survival horror set in a remote hotel with a macabre history from Welsh folklore Brave the nightmares of the Quiet Men When they arrive do not panic  dont even breathe  Featuring realistic 4k visuals with gameplay focused on story exploration and noweapon survival tactics Experience a multiple thread narrative where your decisions matter unlocking different story paths and multiple endings  A 3D sound based AI system is the core survival gameplay mechanic Hide run creep trap and distract are some of the techniques you need to master to survive enemies with super hearing As you progress enemies become more difficult to avoid to the point where standing still and holding your breath is the only option  Time it correctly and youre safe for now Run out of breath and  suffer,Set in 1892 and based on the haunting true story of Elizabeth Williams you play as Thomas Evans a musician who is thrust into a terrifying battle to save the woman he loves,78.8638050792042
1595462400,"[5, 31]",132164,Crysis Remastered,"[6, 48, 49, 130]",With its 2007 release Crysis set the industry standard for first person shooters with stunning visuals highly evolved gameplay and an enormous sandbox world Crysis Remastered adds new graphic features highquality textures and the CRYENGINEs native hardware and APIagnostic ray tracing solution to update the game for a new generation of hardware,Missing,77.78947697789849
1595462400,"[8, 31, 32]",90055,Carrion,"[3, 6, 14, 48, 49, 130, 167]",Carrion is a reverse horror game in which you assume the role of an amorphous alien being Use your unique otherworldly abilities to your advantage and hunt down your prey,Missing,77.2615671313769
1594944000,"[12, 31]",133923,Paper Mario: The Origami King,[130],Join Mario and his new companion Olivia on a comedic adventure that will take you to the far corners of a papercraft world in Paper Mario The Origami King on Nintendo Switch  Face off against the Origami King and his army of paper invaders team up with some extraordinary companions and master magical powers on your quest to save the world  Unwrap an epic quest  Travel the land repair the damage done by the Folded Soldiers and rescue Toads trapped in all manner of wacky scrapes  With the help of Olivias paperfolding powers use the farreaching 1000 Fold Arms and other paper transformations to save those imprisoned by the Origami Kings henchmen and help restore peace to the world  Put a stop to King Ollys plans by engaging in battles which will put both your tactical thinking and puzzle solving skills to the test  against his origami army as well as humongous bosses under his command,Its tearable The devious King Olly has transformed Princess Peach into origami uprooted her castle and sealed it shut with magical paper streamers Never fear as our moustachioed hero Mario and his new friend Olivia are here to save the day  Journey across the land  from scorching deserts to sailing the high seas  and recruit a revolving cast of wacky travel buddies as you seek to sever these sinister streamers and save your paper pals from being turned into one of the Folded Soldiers,75.54563437636097
1596067200,"[12, 31, 32]",36476,Hellpoint,"[3, 6, 14, 48, 49, 130, 167, 169, 170]",Hellpoint is a dark sci fi action RPG set in the aftermath of a massive quantum cataclysm Every living being quickly lost their mind as their memories and bodies were merged with alternate versions of themselves from parallel universes The accident also attracted entities of immense power that should have been left alone in the depth of other dimensions,Once a pinnacle of human achievement the Irid Novo space station has fallen Its ruins are now overrun by cruel interdimensional entities acting as puppets of the malevolent Cosmic Gods  You have been created by the Author organically printed on Irid Novo and sent on a mission to find out the unholy series of events that led to the catastrophic incident known as the Merge,72.80444669024762
