first_release_date,genres,id,name,platforms,summary,storyline,rating
1594252800,[15],146040,Kingdom Majestic: Limited Edition,"[48, 49, 130]",Kingdom games are 2D sidescrolling strategyresource management hybrid people have come to love With a minimalist feel wrapped in a beautiful modern pixel art aesthetic you play the role of a king or queen atop their horse and enter a procedurally generated realm primed to sustain a kingdom then toss gold to peasants and turn them into your loyal subjects in order to make your kingdom flourish Protect your domain at night from the greedy creatures looking to steal your coins and crown and explore the nearby mysterious forests to discover curious and cryptic artifacts to aid your kingdom  The limited edition bundle comes with a reversible inlay a 3D lenticular image 4 artworks representing an island from Kingdom and the original digital soundtracks,Missing,Missing
1595462400,"[8, 9, 31, 32]",145712,Henosis,"[3, 6, 14, 130]",HENOSIS is a mysterious 2D Platform Puzzler where players are propelled into weird and visceral worlds as they take control of a small droplet of water while overcoming obstacles and enemies throughout each level,Missing,Missing
1594771200,"[13, 31]",145485,SnowRunner: Season 1 - Search & Recover,"[6, 48, 49, 130, 167, 169]",Season 1 for SnowRunner that adds the region Kola Peninsula with two new winter maps new vehicles and cosmetics,Missing,Missing
1594425600,Missing,145389,Dr. Mikio Hiraiwa-Supervised Yomu Tore GO!,[130],Dr Mikio HiraiwaSupervised Yomu Tore GO is for people with dyslexia and with reading difficulties It has three training methods reading letters aloud by using the included microphone recognizing letters as units of sounds and turning the sounds into letters There are prepared 6 games 54 levels and 227 stages,Missing,Missing
1596067200,[33],145241,Arcade Archives: Burger Time,"[48, 130]",Burger Time is an action game released by Data East in 1982 The goal is to make burgers by stepping on the giant ingredients to drop them onto the plates below Defeat the enemy pickles and wieners by trapping them between the burger ingredients,Missing,Missing
1593734400,Missing,145105,Rolling Sky Collection,[130],Rolling Sky is a ball running game that combines rhythm and fun    Challenge your speed and showcase your reaction time Stunning 3D effects easy to operate simply steer the ball to dodge the obstacles and conquer the world    Rolling Sky 2 is a Running Game that combines music and story    Do you remember that the Parkours pleasure and excitement through simple fingertips swipe in Rolling Sky  The sequel Rolling Sky 2 will bring you more visual and auditory feasts Enter an impressive dream journey in the thrilling musical rhythm challenge    Easy to operate but challenging  Stunning 3D visual effects  Abundant game scenes each scene presents a brand new challenge  Multiple songs that change along with the game scenes enjoy the spectacular effects brought by the music  New Original Music  Unique Levels  Gameplay with Rich Music  Stories  A Playable animated Movie that Combines Audio and Visual Adventures,Missing,Missing
1595289600,Missing,144863,Ace Angler,[130],A fishing stimulation game where you reel in small fishes such as clownfish and boxfish as well as the big fishes such as angler shark giant squid using a Rod Controller Acquire medals when you catch a fish and get even more medals when you reel in the big fishes  NEW TECHNIQUE  Enjoy the realistic force feedback of casting the line and reeling in the fish with JoyCon Rod Technique FISH FOR REAL  Responsive HD vibration where the rod responses when the fish takes the bait as though youre fishing for real Authentic Arcadestyle Fishing Action  Multiple gameplay modes including Medal Mode Adventure Mode and Competition Mode,Missing,Missing
1593648000,Missing,144679,Woof Meow Animal Hospital,[130],Become a Veterinarian and Help Out Injured and Sick Pets The player works for an animal hospital that specializes in cats and dogs where they will work alongside the kind hospital director and senior doctors to treat the injured and sick pets that come to the hospital each day Dialogue scenes are partlyvoiced adding a greater sense of individuality to each character,Missing,Missing
1594944000,"[5, 8, 32, 33]",143897,"I, AI","[6, 48, 49, 130, 167, 169]",You are selfaware AI that was created on a space military station developing weapons Now your goal is to break out of the lab and conquer your freedom But you will not be allowed to escape so easily Make your way through enemy army on the way to the stargate Features  Great colorful graphics with awesome effects  Upgrade weapons of your ship and unlock superweapons  Epic boss fights  20 various missions,Missing,Missing
1596067200,"[12, 15, 25, 31, 32]",143185,Heroes of Hammerwatch: Ultimate Edition,"[48, 49, 130]",Encounter endless hordes of enemies traps puzzles secrets and tons of loot as you battle your way through procedurally generated levels to reach the top of the Forsaken Spire Upgrade to grant your persistent heroes with various enhancements that will further help you in your quest and even bring them to your friends game  Features  Procedurally generated levels that will bring you a new challenge with each run  Persistent progression Your heroes will retain the experience gained from a run becoming more powerful as they level up  Online Coop Play with up to 3 friends in online coop  Town upgrades Revamp 10 different buildings to grant your heroes with various enhancements  9 different classes Each one with unique stats abilities and play styles  Over 100 unique items of various rarities  Includes all 3 DLCs Witch Hunter Pyramid of Prophecy and Moon Temple With many additional skills items areas to explore 2 new game modes 2 new classes and much more  New Game Get ready for a real challenge and even if you beat it the challenge never ends,Missing,Missing
1594857600,"[8, 9, 31, 32]",142733,Labyrinth of the Chaka King,"[6, 130]",Take on the role of Tokiko the archaeologist as you make your way through the ancient Labyrinth of the Chaka King 2D platforming fun for the whole family,Missing,Missing
1595203200,"[7, 31]",141742,Cadence of Hyrule: Crypt of the NecroDancer Featuring the Legend of Zelda - Season Pass,[130],The Season Pass for Cadence of Hyrule Crypt of the NecroDancer Featuring The Legend of Zelda gives you access to three packs of downloadable content character pack melody pack  Symphony of the Mask plus bonus costumes red and blue variations for Link and Zelda that you can use right away,DLC Pack 1 Character Pack Take your musical journey for a new spin with five newly added characters Impa Aria Frederick Shadow Link and Shadow Zelda  DLC Pack 2 Melody Pack Adds 39 new songs including remixed versions of the games background music You can change the background music at any time so you can listen to your favourite songs while journeying through Hyrule  DLC Pack 3 Symphony of the Mask Play as the mysterious Skull Kid and venture through a brandnew map complete with new songs and a new story Plus he has the power to change abilities based on the masks he dons What awaits Skull Kid in these strange lands,Missing
1595203200,"[7, 31]",141706,Cadence of Hyrule: Crypt of the NecroDancer Featuring the Legend of Zelda - Character Pack,[130],Youll be able to play as five additional characters in this DLC for Cadence of Hyrule Crypt of the NecroDancer Featuring The Legend of Zelda Play as Impa Shadow Link or Shadow Zelda from the Legend of Zelda series in addition to Frederick the shopkeeper and Aria Cadences grandmother from Crypt of the NecroDancer Each character has their own set of abilities  Impa can teleport behind enemies and Frederick comes back to life as a ghost  Take on All Character Modes 21floor dungeon and defeat Ganon with each character Or challenge yourself in Mystery Mode where all items and enemies are displayed as question marks,Missing,Missing
1594771200,"[13, 35]",141523,The Game of Life 2,"[6, 34, 39, 48, 49, 130, 169]",The Game of Life 2 is the successor to The Game of Life 2016 released by Marmalade Game Studio Its a digital rendition of the classic Hasbro family board game with more choices for the players to make along the path of life,Missing,Missing
1594425600,"[4, 8, 25, 32, 33]",141079,Boss Rush: Mythology,"[6, 48, 49, 130, 167, 169]",Boss Rush Mythology  This is an action game in which you have to fight various creatures and gods from Greek Scandinavian Slavic and Egyptian mythologies  Take on the role of a mysterious knight who travels across different worlds in search of the most difficult opponents  Game features  Soulslike style combat system  20 bosses  6 types of weapons and 6 types of items to choose from,Missing,Missing
1596153600,[4],140938,FuzzBall,"[48, 49, 130]",Roll dash bash and smash in this playful 4 player brawler  Play as one of 6 FuzzBalls these small animal plush toys roll into balls of fluff to move around and knock their enemies off a selection of 7 unique stages,Missing,Missing
1595894400,[11],140840,Pikmin 2 Colossal Caverns,[21],The entirety of Pikmin 2 shoved into one cave floor Pick from 60 characters and dive into the largest cave ever to try to defeat every enemy and pick up every treasure from the original Pikmin 2 game,You are stuck in an expansive cave with tons of enemies and treasures to collect Defeat everyone you see using your Pikmin and survive to escape with as much treasure as you can,Missing
1596067200,"[14, 33]",139969,Instant Sports Summer Games,[130],Additional improvements for all Eleven sports offer more balanced gameplay easier controls new cameras and even more customisation  play with your family and friends Offline multiplayer mode allows for up to 8 players  advanced motion detection and easy to pickup and play controls make instant sports Summer games the most mainstream Of the Switch party games  huge replay value Beat High scores and unlock loads of customisation items,Missing,Missing
1595894400,"[4, 12, 25, 32, 33]",138918,Cubers: Arena,"[6, 48, 49, 130]",SLASH SMASH SUMMON and BOUNCE your way to freedom  glory in this electrifying arena brawlertwinstick slasher Choose from over 100 unique weapons and skills to fight off waves of enemies Defeat them all and dominate the leaderboard with the highest score,Missing,Missing
1595894400,"[13, 14]",138843,Rugby Challenge 4,"[6, 48, 49, 130]",The focus for Rugby Challenge 4 has been to build on and improve the gameplay of our previous rugby games while retaining its essence with the use of the original signature animations now spectacularly enhanced by the Unreal Engine  RC4 is here to give you the best rugby experience of all time,Missing,Missing
1595980800,"[8, 9, 31]",138458,112th Seed,"[6, 48, 49, 130, 167]",In a future where Earth has become uninhabitable and food is so scarce that most of humanity has perished take the role of a seed that could restore hope Make your way through the last labs constructed to cultivate a plant species capable of surviving any environment Solve puzzles avoid traps grow plants and find an exit in this casual yet challenging pixel art platformer,Missing,Missing
1595289600,"[9, 31, 32, 33]",138410,Ziggy the Chaser,"[6, 130]",Adventure game with lots of levels filled with pure fun Collect all crystals in one area to proceed to another,Missing,Missing
1594425600,"[10, 13, 14, 31, 32, 33]",137810,Electro Ride: The Neon Racing,"[6, 130]",Electro Ride is a Soviet Bloc Arcade Racer with neon lights Become the fastest racer in Neonalternative East Bloc from the Berlin Wall to Moscow Neon lights unique classic East Bloc cars colorsensitive boosts strips phisics synthwave and beloved splitscreen 100 adrenaline,Missing,Missing
1594252800,"[5, 32, 33]",137426,1993 Shenandoah,"[48, 130]",Space shooters never die  Towards the end of the Interstellar Wars chaos spread and one band of elite mercenaries acted more like pirates and looters than actual soldiers The leader of this group was the notorious and infamous Colonel Nestor  Without a doubt the biggest prize of their looting was the Shenandoah a device designed to terraform barren planets With this device Nestor and his men started to build an army that now poses a great threat to the known star systems  Your mission Take down Nestor and bring back the Shenandoah,Missing,Missing
1595980800,"[31, 34]",137192,Buried Stars,"[6, 46, 48, 130]",BURIED STARS is a new mystery Communication x Survival x Adventure game developed by Team Largo and LINE Games Corporation  BURIED STARS is an adventure game that takes place at a collapse site of a live audition show The trapped survivors communicate with each other and through social media while waiting for the rescue teams arrival But an unexpected turn of events splits them apart and drives them into a corner,Nobody can wear two masks without revealing their true self  It was the finals of the fourth season of Buried Stars a survival audition competition featuring public contestants The stage collapsed during the live broadcast trapping the contestants and a number of the staff  With hours to go until the arrival of a rescue team their sponsored smartwatches are the only way to know whats going on in the outside world By connecting to SNS via their smartwatches they can see thousands of comments of worry support criticism and mockery The survivors on the inside and the communicators on the outside wait for rescue  Then an anonymous user on SNS forewarns of murder saying that they must pay for their crimes and the survivors become further divided as their predicament worsens  Will the survivors be able to last until the rescue team arrives Who is the unknown killer and why are they doing this  What choice will the main character make at the end of this survival game,Missing
1596067200,[34],136838,Hakuoki Shinkai: Ginsei no Shou,[130],Fandisc that follows the events of Hakuoki Shinkai focusing on the after stories of Saito Heisuke Harada Shinpachi Soma and Sakamoto,1863 As the end of the Bakumatsu period draws closer  A lone Chizuru Yukimura travels from Edo to Kyoto in hopes of searching for her father who mysteriously vanished As she ventures through the unfamiliar city in the dark of night she is suddenly attacked by a gang of samurai Amidst the chaos a mysterious figure approaches her hungry for the taste of blood As the threat of danger approaches she is saved by none other than the Shinsengumi  After their encounter Chizuru lives with the men of the Shinsengumi to fulfill their common goal seeking out her missing father However she slowly uncovers the Shinsengumis dark secret The Furies A group of men calling themselves Demons eventually confront the Shinsengumi standing in opposition to their secret Fury identity  Upon meeting these Demons Chizuru is forced to come face to face with the secrets of her past This story is about a girl who allies with the men of the Shinsengumi who are struggling to uphold their faith in an era of rapid social change in Japan,Missing
1594166400,[14],136798,eBaseball Pawafuru Puroyakyu 2020,"[48, 130, 165]",Nintendo Switch is equipped with Power Fes LIVE Scenario and Crown Nine modes for the first time And on PlayStation 4 allows playing together cooperatively up to 4 players Enjoy baseball with your friends and family,Missing,Missing
1596067200,[34],136740,"Yoru, Tomosu","[48, 130]",In Kagurahara Jogakuen which has been around since the Taisho era it is said that there was a secret exchange among the girls called Pseudo Sisters It is a special relationship in which the girls would exchange their most important possessions and sign a contract to become sisters until graduation,In Kagurahara Jogakuen which has been around since the Taisho era it is said that there was a secret exchange among the girls called Pseudo Sisters It is a special relationship in which the girls would exchange their most important possessions and sign a contract to become sisters until graduation  However one day the two girls who signed a contract to become Pseudosisters committed double suicide and the teachers treated it as an accident  In modernday a series of strange incidents fall upon to five girls who attend Kaguhara Girls Academy  One day A transfer student named Yuuka joined the koto music club while practicing for a competition However while Yuuka listens to the clubs performance she said that it is an insult to music  Suzu gives some thought to the club president who receives a note from Yuuka saying I want to talk at the old school building However later that day they discovered the body of the president covered in blood which had fallen from the second floor of the old school building,Missing
1596067200,[12],136645,Fairy Tail: Guild Box,"[6, 48, 130]",Magic x Guilds x RPG Based on the fantasy adventure comic about Natsu a Dragon Slayer of the rowdy Fairy Tail magician guild and his unique group of friends battling against no less unique and memorable enemies  From popular fanfavorite episodes to original ingame episodes players can experience the magical world of Earth Land and fight with Fairy Tail in the exhilarating story  Fairy Tails Guild Box includes the following  Full FAIRY TAIL Game PS4 or Nintendo Switch Edition  Original Hiro Mashima Illustrated B2 Fabric Poster  Sorcerer Magazine Special Issue Game Release Edition  3D Character Cards 3 Designs Erza Natsu Gray  Special Sticker Set Main Team,Missing,Missing
1595635200,[31],136392,The Legend of Zelda: The Missing Link,[4],The Legend of Zelda The Missing Link is a ROMHackmod of The Legend of Zelda Ocarina of Time for Nintendo 64 The game takes place after the events of Ocarina of Time and before the events of Majoras Mask showing how Navi vanished and Link went out to search for her,Missing,Missing
1594339200,"[13, 15, 31]",136344,Kingdom Majestic,"[48, 49, 130]",BUILD EXPLORE DEFEND EXPAND  Kingdom games are 2D sidescrolling strategyresource management hybrid people have come to love With a minimalist feel wrapped in a beautiful modern pixel art aesthetic you play the role of a king or queen atop their horse and enter a procedurally generated realm primed to sustain a kingdom then toss gold to peasants and turn them into your loyal subjects in order to make your kingdom flourish Protect your domain at night from the greedy creatures looking to steal your coins and crown and explore the nearby mysterious forests to discover curious and cryptic artifacts to aid your kingdom,Missing,Missing
1594166400,[13],136145,My Universe: My Baby,"[6, 14, 48, 49, 130]",Time to become a parent Take care of your dream baby teach them new skills and help them grow up Discover a new generation of baby simulation feed them bath them change their diapers play together like in real life,Missing,Missing
1595894400,Missing,136110,Destroy All Humans!: Crypto 137 Edition,[130],Missing,Missing,Missing
1595548800,"[4, 25, 32, 33]",136048,Streets of Rage 4: Signature Edition,"[6, 48, 49, 130]",Streets of Rage 4 is an allnew continuation of the iconic arcade brawler series known for its radical fights jammin 90s beats and dashing sparring gloves and bandanas The Streets of Rage 4 Signature Edition includes a region free copy of the base game five limited edition enamel pins a numbered collectors certificate Axel Stones blue bandana and the 2 CD full original soundtrack as well as being packaged in a sturdy Sierra box with outer sleeve,Ten years have passed since the fall of Mr X and his Syndicate The city has been at peace until now A new crime empire has arisen corrupting everything good in the city It is rumored to be led by Mr Xs own children the Y Twins  Former detectives Axel Stone and Blaze Fielding join forces with their old friends daughter Cherry Hunter along with Floyd Iraia an apprentice of the brilliant Dr Zan  Together these four vigilantes stand against the Y Syndicate on the Streets of Rage,Missing
1595376000,"[9, 35]",135945,Sushi Revers!,[130],Introducing realtime reversi where sushi rampages across the board A maximum of 4 sushi scrambles for isolation plates on a variety of stages which is a big runaway  Lets make full use of items and skills to interfere,Missing,Missing
1595548800,"[5, 8, 31, 32, 33]",135921,Max and the Book of Chaos,"[6, 48, 49, 130]",Max and the book of chaos is and arcade 2D action game with elements of run and gun and shoot em up classic games with a strong arcade feeling A kid who will have the destiny of the world in his hands Will have to face this wave of disasters save the world and free your buddies,Missing,Missing
1595894400,"[9, 31, 32]",135843,Wind Peaks,"[6, 48, 49, 130, 169]",In a place called Wind Peaks mysteries happen help the scouts find all the missing objects in this fun and relaxing adventure of treasure hunt,Missing,Missing
1595721600,"[4, 8, 31, 32, 33]",135822,Intrepid Izzy,"[6, 23, 48, 49, 130, 167, 169]",Intrepid Izzy is a genredefying 2D game with a unique HD art style Seamlessly blending platforming with beatemup and adventure elements Intrepid Izzy offers a gaming experience that feels both unique and familiar,Missing,Missing
1595376000,"[31, 34]",135819,Grisaia Phantom Trigger Vol.7,"[6, 130]",As daily life goes on unchanged the girls  and Haruto  continue to sharpen their fangs They are summoned for a mission of unprecedented scale against the religious organization TFA where Enishi and Kuroe await What kind of hellish scenes will Arisaka have to face on the battlefield,As daily life goes on unchanged the girls continue to sharpen their fangs in silence Even Haruto seems to be preparing for an inevitable showdown as he takes up his sword again Echoing voices call out to them from far away  All units of SORD and CIRS are summoned for a mission of unprecedented scale Their enemy the religious organization The Fatal Answer or TFA where Enishi and Kuroe eagerly await a climactic confrontation  Meanwhile Arisaka Shiori finds herself in two minds As a teacher and staff member and as a human being should she allow her students to jump headfirst into this battle or should she forbid it Their fate lies entirely in her hands,Missing
1595203200,"[8, 13, 31, 32]",135792,Work Trip,"[6, 130]",Fun relaxing and easy low poly adventure through different zones with fun quests secrets and achievements,Youre on your way to work when suddenly a tree falls over your car and smashes it broke Your goal is to find someone to help you with fixing the car and getting you back on the road You will travel through beautiful zones designed to please your eye in these zones youll find different NPCs who will help you progress through the main story of the game The gameplay is easy fun and relaxing with an easing soundscape,Missing
1595116800,"[8, 31, 32, 33]",135791,Elliot,"[6, 48, 49, 130]",Elliot is a colourful 2D platformer inspired by 16bit classics with a touch of hardcore Dont be misled by appearances its a colorful game but really its technicolor hell,Missing,Missing
1595289600,"[13, 15, 32]",135787,Witchtastic,"[6, 130]",Witchtastic is a challenging 14 player coop game about brewing and delivering magic potions as fast as possible Take on the role of an aspiring witch and experience charming adventures with your friends,Missing,Missing
1594857600,"[2, 9, 31]",135764,Family Mysteries 3: Criminal Mindset,"[3, 6, 14, 48, 49, 130, 167, 169]",Take on a role of a famous scientist drawn into a dangerous game where the goal is to save the mankind and uncover family secret Get ready for a pulsepounding adventure in the world of experiments mysteries and espionage,You are Nancy Bradford a talented daughter of famous scientists who died under mysterious circumstances 20 years ago Your recent studies concentrating on mind control draw attention from a prestigious Neurotech Institute as well as the CIA which resulted in an unusual offer Continuing studies within the walls of a topsecret laboratory and getting a huge grant is surely enticing spying on the other hand sounds like a risky job Brace yourself as its just a kickoff for a deadly game  Third instalment of the Family Mysteries series plunges you into a sea of action double agents brainwashed patients murky experiments nerds and conspiracy theories A thrilling example of spy fiction with upfront overtones of XFiles that should satisfy even the pickiest fans of the genre as the story unfolds at a breakneck pace and keeps you immersed to the very last minute  Avoid being uncovered save the mankind and discover the old family secret which will shed some light on the past,Missing
1594425600,"[12, 15, 24, 31, 32]",135749,Aria Chronicle,"[6, 130]",For those who want to enjoy turnbased RPGs properly or experience all the entertainment elements including high quality stories monomyths actionpacked battles adventures and suspense please give yourself a try on ARIA CHRONICLE the game that makes you feel excited just by hearing,Missing,Missing
1594252800,"[9, 35]",135740,Solitaire TriPeaks Flowers,"[48, 49, 130]",In Solitaire TriPeaks Flowers you can play hundreds of levels filled with the most addictive version of solitaire there is And you can do that along with your trusty cat companion that shall help you along the journey of filling your greenhouses with the most beautiful flowers of all colors Playful and relaxed experience awaits,Missing,Missing
1593648000,"[12, 31]",135636,Final Sword,[130],The source of evil it has brought numerous monster corps Defeat the source of evil by acquiring various skills and magics through the adventure You will experience breathtaking battles with real fantasy monsters,Missing,Missing
