,genres,id,name,platforms,summary,storyline,rating,main,extra,completionist,review_score,review_count,people_polled
102,"[5, 32, 33]",117781,Risk System,"[3, 6, 14, 48, 49, 130]",In the distant future humanity has discovered a method to replicate matter through the use of a Dimensional Gate Industry is revolutionized overnight and a short period of chaos gives way to all warring factions uniting under a common bannerA few years pass and the peace brought about by Gate Technology crumbles once a new threat appears a race of energy parasites that have crossed through the Dimensional Gate by mimicking the very materials humanity had believed they were replicating Mankind is quickly overtaken as their technology is turned against them and the energy emitted by the parasites begins to take control of those exposedIn an act of desperation the experimental RSK9 is constructed a ship made of PreGate materials and technology with the ability to absorb parasite energy and use it to power its incredible arsenal Piloting the RSK9 is Alys an ace pilot previously missing in action that has returned seemingly immune to parasite control Her skill and resistance to the parasite energies influence make her the only pilot capable of preventing the extinction of mankindNOTE FOR LINUX USERS  Due to game engine limitations we are only able to guarantee compatibility with Ubuntu 18042 LTS 64bit or newer It is likely it will function on many other Linux distributions but it is impossible currently to be 100 sure We very much want to support the Linux community and are happy to entertain suggestions on how we may improve compatibility in the futureGAME PLAYIncrease your BMeter  firepower quickly by flying as close to enemy fire as possible and absorbing their energy The closer you fly the more energy you netFire your weapon while flying close to enemy fire and absorbing to perform powerful Risk Shots Enemies destroyed by these powered up shots will turn into energy to power your shield The best defense is a risky offenseFly like an ace pilot and utilize Barrel Rolls to quickly cover vertical space  modify your attackUnleash the Barrier Breaker once the BMeter is full to inflict huge damage on everything in sightPlaying for points is fun again as higher scores are awarded for explosive bursts of destruction and taking risks Destroy multiple enemies at once and utilize Risk Shots to string together combos and increase your score multiplierExperience different facets and paths to the story based on your performance and actions taken during missions,Missing,70.0,0.0,0.0,0.0,78.0,4.0,0.0
103,"[9, 15, 31, 32]",117048,Locomotion,"[6, 130]",Locomotion is a steamy railway puzzler An alien stole your gold and youve got to chase them into space to get it back Haul wagons flick switches and reclaim your lost gold through fiftyone increasingly tricky levels from home on the range to the final frontier,Missing,70.0,0.0,0.0,8.14,80.0,2.0,2.0
104,"[31, 32]",116829,Technosphere Reload,"[6, 130]",Go on a dangerous journey into the heart of asteroid to save humanity from disaster Control the Technosphere roll jump balance solve puzzles and go through the mazes,Missing,70.0,,,,,,
105,"[14, 32, 33]",116486,Super Tennis Blast,"[6, 48, 49, 130]",Remember retrostyled sports games Dust off your racket and set your friends around the couch with Super Tennis Blast A tennis game for tennis enthusiasts made by fans of arcade games Game set match Ready to have a blast,Missing,70.0,0.0,0.0,7.7,60.0,1.0,1.0
106,"[8, 10, 31, 32, 33]",115906,Balancelot,"[6, 48, 49, 130]",Use your controller or keyboard to balance the clumsy but fully functional unicycle Thrust the threatening mythical monsters with your sharpened lance as they set on your way to glory Climbing over the dead enemies with your unicycle may be the last climb you take,Poor squire dreams to attend and conquer kingdom jousting tournament By being poor he cant afford a horse Unicycle happens to be close enough so the epic journey may begin  Use your controller or keyboard to balance the clumsy but fully functional onewheeler unicycle Thrust with your sharpened lance when encountering threats from local mythical monsters Climbing over the dead enemies with your unicycle may be the last climb you take Crush your enemies drive before them and hear the lamentation of your onewheeler,70.0,7.1,0.0,0.0,0.0,0.0,1.0
107,"[9, 15, 31, 32, 35]",115650,Alt-Frequencies,"[6, 14, 34, 39, 130]",AltFrequencies takes players on an audiobased journey where interactive investigation meets podcasting and players are tasked with unravelling a mystery taking place between multiple radio stations among a disparate group of people,Missing,70.0,1.6,1.93,2.7,65.0,15.0,34.0
108,"[12, 31, 32]",113810,Drawngeon: Dungeons of Ink and Paper,"[6, 48, 49, 130]",Inkland  the handdrawn unusual world Reveal the secret of the Mysterious Tower in this oldschool roleplaying game with a firstperson perspective realtime combat and gridbased movement,Missing,70.0,2.07,0.0,3.09,63.0,6.0,3.0
109,"[8, 31]",111558,Bubsy: Paws on Fire!,"[6, 48, 130]",From the developers of the BITTRIP series comes Bubsy Paws on Fire the latest and greatest in bobcatbased gaming  Bubsy is back in his greatest adventure yet Featuring four playable characters with their own unique playstyles new moves never before seen in a Bubsy title and over 100 levels and variations Paws on Fire is a game for Bubsy lovers everywhere,Missing,70.0,5.67,0.0,9.22,60.0,3.0,5.0
110,"[2, 9, 13, 31]",110416,Sumatra: Fate of Yandi,"[6, 48, 49, 130, 167, 169]",Lost and alone after a terrible accident Yandi must find his way home in this old school point and click adventure set deep in the Sumatran jungle What secrets will he uncover along the way A new game from the creators of Football Game Legend of Hand and A Date in the Park,Missing,70.0,3.06,3.19,3.37,74.0,5.0,17.0
111,"[12, 25, 31, 32]",107291,Infected Shelter,"[3, 6, 14, 48, 49, 130]",Dead Cells  Castle Crashers  executions  Infected Shelter  Infected Shelter is a randomly generated roguelite postapocalyptic action RPG shooter  dungeon brawler Singleplayer and coop for up to four players  Every run is different because of the randomly generated content By beating enemies players can loot more than 150 different blueprints of permanent improvements and this is the key to Infected Shelters replayability Instead of just collecting loot to make yourself more powerful during a single run you unlock new weapons clothes skills relics and RPGlike character improvements that change how you play the game in the following runs,You play as a member of a surviving group in a postapocalyptic world On one fateful morning you awake to find the shelter is raided and your people are kidnapped for reasons unknown Leaving your shelter you emerge into the harsh infected land and start looking for the kidnappers and the truth behind the events Your path lead you through randomly generated postapocalyptic areas controlled by different enemy factions with brutal leaders and shelters occupied by infected creatures  You have to use your skills in a fast paced violent and complex 2D brawlerlike combat where lots of firearms and melee weapons are waiting for you to beat and execute your enemies You will unlock new weapons clothes skills relics and RPGlike character improvements during your journey,70.0,0.0,0.0,0.0,0.0,0.0,0.0
112,"[7, 8, 9, 32, 33]",107182,Vectronom,"[6, 14, 34, 39, 130]",A hypnotic video game about music geometry and flow  Vectronom is a music platformer The game combines challenging platforming with rhythm based gameplay The architecture of each level changes with the music players have to memorize patterns and overcome obstacles while dancing through the game world Unlike other beat matching games where the player has to follow prompts in Vectronom players have a larger degree of freedom while playing,Missing,70.0,2.35,3.18,4.74,77.0,14.0,23.0
113,"[9, 13, 31, 32, 33]",105160,Koral,"[6, 130]",Dive into the beautiful underwater world as a current whos mission is bring back to life coral reefs Solve puzzles to heal them and bring back the beauty of the ocean,Missing,70.0,2.08,2.12,2.72,68.0,14.0,20.0
114,"[8, 12, 15, 16, 24, 31, 32]",103811,Blood will be Spilled,"[6, 130]",Blood will be Spilled is a narrative spaghetti western platformer with tactical turnbased combat taking place in a completely hand drawn harsh world inhabited by insects You follow the story of Jack  a mosquito bounty hunter on his path of revenge Soon however he finds himself neckdeep in a vicious scheme that is far more than he bargained for Heavily outgunned and outnumbered Jack will need help from a few rather unusual allies to even the odds And most of all shallow graves for all those who would stand in his way,Missing,70.0,0.0,7.33,15.0,50.0,1.0,2.0
115,"[12, 15, 16, 32]",97932,Banner of the Maid,"[6, 48, 49, 130]",Banner of the Maid is a turnbase strategy game set in the time of the French Revolution You will lead the army to break through the difficulties and experience the different stories of that most uncommon time with wine of salon and the smoke of battlefield,Missing,70.0,37.15,44.3,55.2,65.0,13.0,21.0
116,"[24, 32]",96228,Mowin' & Throwin',"[6, 48, 49, 130]",Mowin  Throwin is a 2 vs 2 local multiplayer game featuring lawnobsessed gnomes who drive riding mowers Each match is a constant tugofwar as you work with your teammate to mow your lawn and sabotage the other team The team who has the least amount of grass on their lawn when time ends wins REQUIRES 4 XBOX CONTROLLERS,Missing,70.0,,,,,,
117,"[8, 25, 31, 32, 33]",82439,Dogurai,"[3, 6, 48, 49, 130]",Dogurai is a retrostyled platormer with animallike characters graphics and soundtrack designed with old portable games in mind  down to the limited color ranges and sprite sizes,Missing,70.0,2.84,3.5,4.22,58.0,14.0,19.0
118,"[9, 31, 32]",53930,Never Again,"[6, 130]",Never Again  Horrorfirstperson Quest The main essence of the game is research locations and puzzles plunging in the dramatic story of a little girl suffering from asthma,Missing,70.0,2.28,3.03,4.11,73.0,3.0,9.0
119,"[12, 31, 32]",36078,Super Cane Magic Zero,"[3, 6, 14, 48, 130]",Super Cane Magic Zero is a comedy action RPG It features a large handcrafted game world full of secrets to explore in addition randomly generated dungeons and local PVP arenas Fight solo or local coop get gear eat bombs crawl ridiculous dungeons and kill all the vegetables,Missing,70.0,,,,,,
120,"[2, 9, 13, 31, 32]",24444,Detective Di: The Silk Rose Murders,"[6, 14, 49, 130]",A beautifully pixelated pointandclick thriller set in ancient China where you play as the legendary detective Di Renjie,Amid lingering political turmoil the first and only female empress of China Wu Zetian rises to power Within months of her ascension to the throne murmurs of discontentment and revolution swell as detractors and enemies begin plotting against her It is against this backdrop that our protagonist newly appointed investigating magistrate Di Renjie must solve a gruesome series of murderswhich will lead him on a collision course with the Imperial court and the empress herself  Will our young detective overcome his own inner demons and his allegiance to the previous emperor What is the connection between the murdered courtesans and the capitals many political secrets YOU must uncover the truth,70.0,4.45,4.89,5.81,69.0,18.0,41.0
121,"[5, 10, 31, 32, 33]",14694,Shakedown: Hawaii,"[5, 6, 9, 37, 41, 46, 48, 130, 167]",Build a legitimate corporation via open world missions shakedowns sabotage and property acquisition,Missing,68.0,6.89,10.29,13.47,74.0,45.0,92.0
122,"[5, 15, 24, 31]",116191,Sniper Elite V2 Remastered,"[6, 48, 49, 130]",In the dark days of the end of World War 2 amidst the ruins of Berlin one bullet can change history Elite sniper Karl Fairburne returns to the front line in the remaster of this awardwinning stealthaction experience Packed with new features contemporary visuals and definitive content,Missing,66.72791852189297,6.17,8.37,12.82,69.0,64.0,106.0
123,"[11, 12, 15, 31, 32]",88250,Undead Horde,"[3, 6, 14, 39, 48, 49, 130, 167]",Be a necromancer raise undead minions and vanquish the living Undead Horde is an action RPG where you get to be the zombies Maraud through the lands of the living and plunder their treasures Lead your undead army towards the ultimate victory,Missing,64.17939686760928,6.96,9.12,11.37,66.0,11.0,19.0
124,"[5, 12, 31, 32]",75158,Blazing Beaks,"[6, 48, 130]",Birds with guns are blazing the way out through the piles of mutants monsters and creepy creatures to stop the invasion Gathering items and artefacts is essential to survive in this fastpaced colorful roguelite Lots of mysteries to unravel secrets to find and levels to explore,Missing,61.89016089116318,12.38,14.47,103.0,68.0,19.0,17.0
125,"[31, 32]",55027,Close to the Sun,"[6, 48, 49, 130]",Close to the Sun is a storydriven horror game that takes place at the turn of the 20th century on a mysterious ship complex created by Nikola Tesla for the sake of knowledge In this alternative version of history his scientific breakthroughs have already had a major impact on the world Youre a young journalist looking for your sister and as you approach this enormous and glorious complex for the first time you quickly realize that something there has gone horribly wrong,Its 1897 Deep in international waters the Helios stands still Dark clouds loom overhead as unforgiving waves crash against the hull Colossal effigies of gold decorated with magnificent finery stretch as far as the eye can see  Born of Nikola Teslas vision the Helios serves as a haven for the greatest scientific minds An unbound utopia for research independent from state and isolated from the gaze of society Free to push the boundaries of matter and time  Journalist Rose Archer steps aboard the Helios in search of her sister Ada She quickly discovers not all is as it seems Grand halls stand empty The stench of rotting flesh lingers in the air Silence A single word is painted across the entrance QUARANTINE,61.80685983615636,4.18,5.16,6.41,64.0,128.0,213.0
126,"[13, 14]",115869,Cricket 19,"[6, 48, 49, 130]",Lead your team to international glory with Cricket 19 The truly global cricket simulation from Big Ant Studios the leading name in authentic realistic cricket action Cricket 19 allows you to take control of your team from club through national level and lead them to T20 ODI or Test Match glory Create your own club stadia sponsor logos and uniforms via Big Ants acclaimed Cricket Academy to recreate your local matches and dramas  Dive into the deepest storydriven career mode in the history of cricket video games Build a rookie players career from their junior years at club cricket Perform well and before you know it youll be leading your nation on to the field,Missing,60.71364088296895,77.5,0.0,0.0,66.0,7.0,2.0
127,"[9, 15, 32, 35]",117051,Happy Words,"[6, 14, 48, 130]",Happy words is a word based online multiplayer board game for 1 to 4 players in which you have to create words and connect them to existing words in order to score more points than your opponents,Missing,60.0,0.0,0.0,0.0,0.0,0.0,0.0
128,"[9, 13, 31, 32]",115004,Legal Dungeon,"[6, 14, 39, 48, 49, 130]",Legal Dungeon is a game about organizing police investigation documents This game has 14 endings and 6 achievements as well as a cute Screen Mate shop Judge the lives of others and collect all items,Missing,60.0,5.8,6.78,8.02,68.0,6.0,10.0
129,"[8, 10, 13, 32, 33]",114475,Snakeybus,"[6, 14, 48, 49, 130]",The length of your bus grows as you pick up more people Snake through the city streets and avoid crashing into yourself,Missing,60.0,1.2,1.38,1.88,69.0,28.0,49.0
130,"[12, 15, 16, 31, 32]",111253,Vambrace: Cold Soul,"[3, 6, 14, 48, 49, 130]",Vambrace Cold Soul is a roguelike fantasyadventure set amidst a frozen landscape Plan your expeditions underground then journey to the cursed city surface with your team of heroes Wield unique powers avoid dangerous traps brave strange encounters and survive deadly combat,The King of Shades has cursed the great city of Icenaire Now cast under a permanent blight of frost fall its former residents have returned from the dead as mad Wraiths Survivors take refuge deep underground where they lead a desperate campaign against this unearthly power Woefully outmatched they are forced into hiding as the King of Shades amasses an army of the undead above them One fateful day a mysterious stranger appears in the city with an enchanted vambrace She may now be their only hope  You are Evelia Lyric bearer of the Aetherbrace and the only human capable of entering Icenaire The survivors now look to you as their best hope against the King of Shades Only one problem youre woefully outmatched and survival is not guaranteed,59.66003544706818,7.66,19.17,33.28,61.0,14.0,22.0
131,"[5, 10, 31, 32]",115785,American Fugitive,"[6, 48, 49, 130]",Set in a sleepy American country town in the 1980s American Fugitive invites you to play as Will Riley Youre no angel but youre not a killer Yet the coldblooded murder of your dad is the crime theyve locked you up for Fuelled by grief and a burning desire for vengeance you must break out of jail to find the real culprit Its payback time,Missing,58.60001371231287,9.17,13.34,21.7,62.0,54.0,94.0
132,"[8, 31, 33]",119509,Geki Yaba Runner: Anniversary Edition,[130],Who are you A charming little gnome Whats your mission To save an innocent princess from her dismal fate To achieve this all you have to do is run Sounds simple enough Lets not forget though that in general gnomes are not what youd normally call the running type But dont be fooled  the blood of a raging beast flows through the veins of this little leprechaun So what are you waiting for Take control of this adorable gnome and save the princess,Missing,57.0,,,,,,
133,"[9, 31, 32]",11668,Dollhouse,"[6, 48, 130]",Delve deep into your mind to unravel the truth However beware that your own conscience is hunting you down with a twist that allows you to see through its eyes at a deadly cost,Missing,51.73438447543966,0.0,7.99,0.0,45.0,4.0,2.0
134,"[5, 10, 15, 31, 32]",82346,Overlanders,"[6, 130]",Four types of vehicles loads of weapons all against the beasts of the universe Alone or with others fight the creatures save the people explore the galaxy Play as one of them and become an Overlander,Missing,50.0,2.8,0.0,0.0,70.0,1.0,1.0
