,genres,id,name,platforms,summary,storyline,rating,main,extra,completionist,review_score,review_count,people_polled
63,"[5, 8, 31, 32, 33]",117445,Thunder Paw,"[6, 46, 48, 49, 130, 309]",This is a pixelart platformer with five different levels and different scenarios as well as a ton of weapons to be used to annihilate each level boss,Thunder was out playing with his ball in the fields when he suddenly heard a loud explosion near his house He rushed home worried about his parents only to find no one was there Just a single letter that said his parents had been kidnapped Its up to Thunder to rescue his parents Dominate your enemies with a trusty weapon by your side Each defeated enemy will drop special gems that make your gun even more powerful,Missing,0.0,0.0,3.71,50.0,3.0,5.0
64,"[9, 31, 32, 33]",117443,Midnight Remastered,"[6, 14, 130]",Collect the seven letters of the deadly sins and repent for your past in this survival horror game,Missing,Missing,,,,,,
65,"[8, 12, 31, 33]",117160,Sega Ages Wonder Boy: Monster Land,[130],The arcade platform action RPG stars a nowteenage TomTom also known as Wonder Boy Having previously saved Wonder Land from clutches of the evil king the hero is called upon again when the evil MEKA dragon invades Its up to Wonder Boy to defeat all the monsters in the nowcalled Monster Land Fight monsters purchase magical weapons and traverse the realm today,After the defeat of the evil king the kingdom of Wonder Land was a paradisefor a time The peace was broken when a ferocious firebreathing dragon struck without warning and took over Wonder Land with a swarm of evil monstrous henchmen turning the oncepeaceful land into the utterly chaotic Monster Land Realizing he is Wonder Lands last hope Wonder Boy sets out on an incredible journey to rid the country of the monsters and defeat the invincible evil dragon,Missing,,,,,,
66,"[13, 32]",116384,House Flipper: Garden DLC,"[6, 14, 130]",When the Garden Flipper DLC launches on May 16 2019 well be able to dig plant and mow our way to better curb appeal Along with flowers trees and bushes the developers are also adding hundreds of new outdoor items to House Flipper ranging from patio furniture to pools to play sets,Missing,Missing,,,,,,
67,"[8, 25, 31, 32]",116151,Hollow Knight: Collector's Edition,"[6, 48, 49, 130, 169]",A 2D metroidvania with an emphasis on close combat and exploration in which the player enters the onceprosperous nowbleak insect kingdom of Hallownest travels through its various districts meets friendly inhabitants fights hostile ones and uncovers the kingdoms history while improving their combat abilities and movement arsenal by fighting bosses and accessing outoftheway areas  The Collectors Edition includes a metal brooch with display stand a wall hook a dualpronged fastener a 14page Quirrel comic book a giftboxstyle case with goldfoil filigree and a clear printed sleeve a Switchexclusive bonus cleaning cloth a goldfoil art print set by Ari Gibson and a physical copy of the game including all DLC Hidden Dreams The Grimm Troupe Lifeblood and Godmaster,Brave the Depths of a Forgotten Kingdom Beneath the fading town of Dirtmouth sleeps a vast ancient kingdom Many are drawn beneath the surface searching for riches or glory or answers to old secrets  As the enigmatic Knight youll traverse the depths unravel its mysteries and conquer its evils,Missing,,,,,,
68,"[9, 31, 32]",116076,Moonrise Fall,"[6, 49, 130, 169]",Moonrise Fall is an atmospheric puzzle game about a boy who finds himself lost in a supernatural forest after losing both parents in a car crash Armed with a clue filled journal a camera and a lantern he must unravel the mysteries of the forest and photograph the strange creatures that reside there,Missing,Missing,0.0,0.0,0.0,0.0,0.0,0.0
69,"[8, 31, 33]",115993,Wonder Boy Returns Remix,"[6, 48, 130]",Wonder Boy was an arcade hit back in 1986 with its intuitive controls and polished game balance  This forever famous sidescrolling action game has been remixed and reborn for Nintendo Switch  Join the adventure of a boy whos doing his best to save his girlfriend Tina  updated with highdef animeinspired visuals,Missing,Missing,3.42,0.0,0.0,57.0,7.0,7.0
70,"[5, 32, 33]",115352,Delta Squad,"[3, 6, 14, 48, 49, 130]",Stop the Dictatorship forces of General Rumanovsky in their attempt to control a mortal virus make your way through different missions in this top down arcade,Missing,Missing,0.0,0.0,6.5,20.0,1.0,1.0
71,"[9, 12, 15, 31, 34]",115184,Kotodama: The 7 Mysteries of Fujisawa,"[6, 48, 130]",Welcome to Fujisawa Academy  an educational institution where nothing is as it seems and every pupil hides a dark secret Having made a pact with a demon fox  and bestowing you with the power to see the truth behind the lies you must uncover the sinister truths behind the seemingly normal façade,Welcome to Fujisawa Academy  an educational institution where nothing is as it seems and every pupil hides a dark secret Having made a pact with a demon fox  and bestowing you with the power to see the truth behind the lies you must infiltrate the secretive Fujisawa Academy and uncover the sinister truths behind the seemingly normal façade,Missing,11.29,12.65,15.41,48.0,22.0,28.0
72,"[12, 15, 32]",112581,Invisible Fist,"[6, 14, 130]",We combined card games and RPGs with all the crazy shit that happens to people in the Late Capitalism Create a billiondollar startup try to pay off your student loans or wait in the line for Food Stamps And fight the Invisible Fist of the Free Market Wishlist today,Missing,Missing,,,,,,
73,Missing,111912,Opus Collection: The Day We Found Earth + Rocket of Whispers,[130],Missing,Missing,Missing,,,,,,
74,[31],111556,Graveyard Keeper: Breaking Dead,"[48, 49, 130]",Introducing Breaking Dead  the first expansion of Graveyard Keeper Create an army of undead workers that automate chores around your Graveyard such as  Automate gathering of stone wood and have zombies craft your items Taking care of your graveyards garden has never been easier when zombies do it for you Create logistics chains where zombies automate sale of merchandise for extra profit Modify and upgrade your zombies they might need better organs to make them more efficient,Missing,Missing,,,,,,
75,"[8, 12]",107260,Lapis x Labyrinth: Limited Edition,"[48, 130]",The limited edition was created for the international release The Nintendo Switch version comes with some extra items  The Limited Edition for PlayStation 4 and Nintendo Switch includes  Lapis x Labyrinth  Lapis x Labyrinth My Labyrinth Photo Album  Lapis x Labyrinth Dango Beats  Collectors Box  The Nintendo Switch version Limited Edition XL also contains  Lapis x Labyrinth Poster  Mayors Special Feast Mini Art Print  Dango Delights Mini Art Print,Missing,Missing,,,,,,
76,"[4, 32, 33]",77536,Brief Battles,"[6, 48, 49, 130]",May your butt reign supreme in Brief Battles Use your underpants to fight your friends in this fastpaced underwearfueled party game,Missing,Missing,,,,,,
77,"[8, 12, 31, 32, 33]",68988,Devious Dungeon 2,"[6, 46, 48, 49, 130]",It is said that great adventures await behind the walls of this dark castle Devious Dungeon 2 is a medieval focused action platformer with RPG styled upgrades,Missing,Missing,3.0,7.5,9.48,67.0,6.0,10.0
78,"[9, 15, 35]",58298,Word Forward,"[6, 14, 39, 130]",A word game from Shane McCafferty,Missing,Missing,0.0,0.0,0.0,0.0,0.0,0.0
79,"[9, 13, 31, 32]",11737,Outer Wilds,"[6, 48, 49, 130, 167, 169]",Outer Wilds is a criticallyacclaimed and awardwinning open world mystery about a solar system trapped in an endless time loop The newest member of the space program in a small village on the planet Timber Hearth the player navigates a space shuttle and travels across their solar system to get to the bottom of its mysteries by exploring the cosmos and gathering the knowledge hidden within each of the systems planets left behind by another civilization in the distant past,Welcome to the Space Program Youre the newest recruit of Outer Wilds Ventures a fledgling space program searching for answers in a strange constantly evolving solar system What lurks in the heart of the ominous Dark Bramble Who built the alien ruins on the Moon Can the endless time loop be stopped Answers await you in the most dangerous reaches of space  The planets of Outer Wilds are packed with hidden locations that change with the passage of time Visit an underground city of before its swallowed by sand or explore the surface of a planet as it crumbles beneath your feet Every secret is guarded by hazardous environments and natural catastrophes  Strap on your hiking boots check your oxygen levels and get ready to venture into space Use a variety of unique gadgets to probe your surroundings track down mysterious signals decipher ancient alien writing and roast the perfect marshmallow,89.48575229928501,16.52,21.85,26.47,91.0,1310.0,1719.0
80,"[2, 9, 31, 32]",6741,Guard Duty,"[3, 6, 14, 46, 48, 49, 130]",Guard Duty is a comedy adventure about love loss and the end of the world Experience an unforgettable story spanning across two radically different time periods,Missing,88.85303120629034,4.59,5.12,5.0,73.0,8.0,20.0
81,"[5, 8, 33]",108254,Gunlord X,"[48, 130]",Gunlord X is a platformer action game with an emphasis on exploring huge worlds and blasting off enemies This game features 9 stages of exciting 2D gameplay with over 45 unique enemy types Blast yourself through giant landscapes explore caverns and reveal all secrets,Missing,88.0,2.85,3.75,0.0,83.0,4.0,4.0
82,"[4, 33]",114135,Guilty Gear 20th Anniversary Edition,[130],The original Guilty Gear and GUILTY GEAR XX ΛCORE PLUS R reunite to celebrate 20 years of 2D anime action,Missing,87.0,,,,,,
83,"[8, 9, 31, 32]",103331,Trover Saves the Universe,"[6, 48, 49, 130, 165, 384, 385, 386]",Wonderful Your dogs have been dognapped by a beaked lunatic who stuffed them into his eye holes and is using their life essence to destroy the universe Does that make any sense Youve partnered with Trover a little purple eye hole monster to save them Find power babies and plug them into his eye holes so that he can absorb their power track down Glorkon and save your dogs and the Universe,Missing,80.73674921436107,5.1,6.36,8.24,74.0,122.0,179.0
84,"[4, 10, 12, 13, 14, 31, 33]",116138,Castlevania Anniversary Collection,"[6, 48, 49, 130]",Konamis Castlevania Anniversary Collection traces the origins of the historic vampire franchise Included is a unique eBook with details provided by developers artists and others inspired by the Castlevania legacy which sheds a fresh light into the world of Castlevania  Released as part of the Konami 50th Anniversary celebration relive these timeless classics that helped define the platformer genre From the Belmont clan to their extended bloodlines and allies the Castlevania Anniversary Collection is the best first step for anyone to take into the world of Castlevania and the fight against Dracula,Missing,79.89897322039255,23.53,27.44,31.7,81.0,36.0,37.0
85,"[8, 31, 32]",117023,Jump King,"[6, 48, 49, 130]",Jump King is a platforming challenge about struggling upwards in search of the legendary smoking hot babe This lonely adventure to reach the top will demand full mastery of the technique of jumping Just try to remember with each fall there is a lesson to be learned,The game is built on a single iconic mechanic charge the height of each jump by holding down the button and release to leap away But beware  once you are in the air there is no way to turn back Though you cannot die your progress is fragile  a single missed jump could lead to your fall and much progress lost Leap through an intriguing world meeting curious characters along the way The handdrawn backgrounds and distinct animations paint a rare picture reminiscent of the old classics The blend of retro sfx beautiful arrangements and high definition ambiences give a peculiar atmosphere  thanks to composerssound designers Nils Eklöf and Elias Thörnlund  This game is a trial that demands skill and willpower mastering the jump and reaching the top will test the limits of your ability Do you think you have what it takes to defeat this game,79.63307554992639,9.92,31.45,85.26,77.0,61.0,105.0
86,"[8, 31, 32]",117747,A Hat in Time: Nyakuza Metro,"[6, 48, 49, 130]",Welcome to the deep underground Nyakuza Metro Its the perfect place for a little lying a little cheating a little stealing Join the Nyakuza and become mad rich  joining a gang never turned out bad right,Missing,79.62078146362524,2.38,2.85,3.1,81.0,67.0,66.0
87,"[2, 9, 31, 32]",106108,Irony Curtain: From Matryoshka with Love,"[3, 6, 14, 48, 49, 130]",Irony Curtain From Matryoshka with Love is a satirical pointandclick inspired by the classic adventure games It smuggles you out of your comfort zone and throws into the middle of a Cold War spy intrigue  and theres an even bigger game being played Experience Matryoshka through Evan  a lowranking goofy journalist involuntarily pulled right into the middle of an espionage standoff between two powers Hop onto the wacky spy adventure uncover secrets of the bizzare communist country and the powerful capitalistic empire witness the story full of unpredictable twists and turns and discover the true agenda of the mysterious Supreme Leader,Missing,77.41025081568553,9.91,9.99,10.18,77.0,11.0,23.0
88,"[4, 9, 32, 33]",101152,Crystal Crisis,"[6, 48, 130]",An allstar cast of heroes has gathered to test their mettle in this cute and chaotic new colormatching combat game for Nintendo Switch Crystal Crisis is presented like a oneonone fighting game but instead of pressing buttons to kick and punch players arrange falling gems into matching colors to clear them from the screen and inflict damage on their opponents Its the ultimate puzzle battle throwdown,Missing,77.0,2.35,0.0,8.0,68.0,5.0,11.0
89,[13],110337,Little Friends: Dogs & Cats,[130],Little Friends Dogs  Cats is an adorable pet simulator that we hope animal lovers of all ages will fall in love with said Katie Clark Product Manager at Sold Out Theres a huge appetite out there for pet simulation titles and were so excited to be releasing the first game of its type on Nintendo Switch We cant wait for players to meet their new little friends,Choose from a variety of puppies and kittens to play with feed pet and dress up in an adorable simulation thats fun for all ages Get to know their personalities and feed them their favorite food Play with them using their favorite new toy or take your puppy out for walks and compete in the flying disc tournament Dress them up in over 600 stylish accessories to make them look their best Care for your new furry friend to develop a longlasting friendship,75.0,10.3,0.0,0.0,50.0,1.0,1.0
90,"[8, 31, 32, 33]",107317,Gato Roboto,"[6, 49, 130]",Pounce inside of your cozy armored mech and set off on a dangerous trek through an alien underworld full of irritable creatures and treacherous obstacles in a valiant effort to save your stranded captain and his crashed spaceship  Tiptoe outside the friendly confines of your technological marvel and follow your feline instincts through tight tunnels and mysterious waterways to scavenge for new weapons and gear Adventure awaits the most curious of cats in Gato Roboto,Missing,74.76509217971254,3.31,3.89,4.39,75.0,380.0,680.0
91,"[5, 15, 33]",111846,Void Bastards,"[6, 14, 48, 49, 130]",Inspired by BioShock and System Shock 2 Void Bastards is a revolutionary new strategyshooter that will test your wits as well as exercise your aim Can you lead the misfit prisoners of the Void Ark through the derelict spaceships and myriad dangers of the Sargasso Nebula,Forget everything you know about firstperson shooters Void Bastards asks you to take charge not just point your gun and fire Your task is to lead the ragtag Void Bastards out of the Sargasso Nebula You make the decisions where to go what to do and who to fight And then you must carry out that strategy in the face of strange and terrible enemies  On board derelict spaceships youll plan your mission taking note of the ship layout what hazards and enemies you might encounter and what terminals and other ship systems you can use to your advantage  Move carefully through the dangerous ships searching for supplies and manipulating control systems React to what you find  will you detour to the generator to bring the power back online or will you fight your way into the security module to disable the ships defenses Choose carefully when to fight when to run and when just to be a bastard  Use your hard won supplies to improvise tools and weapons from the distracting robokitty to the horribly unstable clusterflak  Navigate your tiny escape pod through the vast nebula Flee from void whales and pirates and politely avoid the hungry hermits All the while you must keep scavenging for the food fuel and other resources that keep you alive  Void Bastards features a 1215 hour campaign that you can complete with an endless supply of prisoners each with their own unique traits When one dies another steps forward to carry on the fight Dont worry though as any crafting progress youve made is retained from one to another,74.22210181801918,8.4,13.57,24.66,72.0,168.0,183.0
92,"[10, 33]",103018,Team Sonic Racing,"[6, 48, 49, 130]",Team Sonic Racing combines the best elements of arcade and fastpaced competitive style racing as you faceoff with friends in intense multiplayer racing,Missing,72.9493269100331,8.99,12.17,26.03,67.0,126.0,124.0
93,"[9, 31]",115304,Five Nights at Freddy's: Help Wanted,"[6, 48, 49, 130, 165, 167, 169, 384, 386]",Five Nights at Freddys Help Wanted is a collection of classic and original minigames set in the Five Nights universe Survive terrifying encounters with your favorite killer animatronics in a collection of new and classic Five Nights at Freddys experiences Where fantasy and fun come to life,Fazbear Entertainment has become extremely unpopular due to several incidents and disasters that allegedly occurred at their various locations over the years which have been established as urban legends The problem is aggravated by a horror video game series based on the legends created by an unnamed indie developer In an attempt to overturn the bad reputation these rumors gave the company Fazbear Entertainment commissioned the Freddy Fazbear Virtual Experience a virtual reality game meant to make light of the rumors and convince players that those events were completely fictitious However this narrative is contradicted by sixteen cassette tapes hidden throughout the game which contain logs recorded by one of the games developers  Meant as a warning for future players the tapes expose a lawsuit happening during the games development involving an incident with a past employee Jeremy that put the games completion in jeopardy In addition the tapes reveal that Fazbear Entertainment hired the unnamed indie developer to create the video game series based on the alleged legends before cutting ties with him the games were part of an elaborate ploy to discredit the rumors surrounding the company Most importantly the tapes warn of a malicious code that was uploaded to the game from an old circuit board This code takes the form of a sinister character known as Glitchtrap who appears as a humanoid in a rabbit costume Glitchtrap is ultimately revealed to be attempting to escape from the game by merging with the player  After the nonVR version was released there was a door in a level that leads to a snowy Christmas tree farm In the distance there is a silhouette of a large building being constructed by Fazbear Entertainment with a nearby billboard showing that they are now hiring,71.56831002393045,12.67,13.76,20.77,76.0,32.0,26.0
94,"[2, 9, 12, 31]",116851,Smile For Me,"[6, 14, 48, 49, 130, 167, 169]",A heartbroken clown wayward souls and juicy mechanical lips As The Big Event draws near help the troubled residents of the Habitat and demask the mysterious Doctor Habit before its too late,Missing,71.19238412234503,3.61,4.09,4.89,78.0,60.0,125.0
95,"[13, 31, 32]",90107,Layers of Fear 2,"[6, 48, 49, 130]",Layers of Fear 2 is a firstperson psychological horror game with an emphasis on exploration and story Players control a Hollywood actor who heeds the call of an enigmatic director to take on the lead role in a film shot aboard an ocean liner Beware for all may not truly be what it seems,The cameras are all focused on you the center of the scene Not just in character you are the character The part to play is singularly yours Written just for youYou are met with silence No barking orders from the director No call to action that you need to become this version of yourself The demand to act fills your mind but the script pages hold no words  Your past has helped to mold you into what you are forced upon you the skills required to hone your craft That same past has scraped deep furrowing scars into you not on the outside where the world can see but in a place buried so deep within that it has become shapeless You push those memories down but let the experiences drive you into who or what you must play  Darkness surrounds as you stand silently in the spotlight the only sounds to be heard over your heartbeat are the distant breaking of waves against the hull and the sound of cameras pointed in your direction preserving this moment for eternity  A deep and commanding voice rises from the distance Act  What part will you play,70.50558704552158,5.01,6.05,10.34,64.0,137.0,231.0
96,"[10, 13, 14, 33]",52200,Descenders,"[3, 6, 14, 48, 49, 130]",Descenders is extreme downhill freeriding for the modern era with procedurally generated worlds and where mistakes have real consequences Will you lead your team to glory and become the next legendary Descender,Missing,70.4018799952639,5.14,11.57,73.1,70.0,70.0,51.0
97,"[15, 31, 32]",111033,Project Winter,"[6, 48, 49, 130]",Project Winter is an 8 person multiplayer game focusing on social deception and survival The survivors goal is to work together gather resources and escape Unbeknownst to them traitors are within the group whose only goal is to stop them by any means necessary,Missing,70.2651349457575,9.82,0.0,123.78,71.0,17.0,5.0
98,"[15, 31, 32, 34]",68390,Astrologaster,"[6, 14, 39, 130]",Astrologaster is an astrological comedy game in which you take the role of Simon Forman Elizabethan Astrologer and doctor Cast and interpret astrological charts to answer your patients questions about political intrigues romantic entanglements deadly illnesses and missing spoons,Missing,70.22160703578433,5.93,6.13,7.28,62.0,44.0,65.0
99,"[9, 31]",126782,New York Mysteries: The Outbreak,"[6, 130]",New York Mysteries The Outbreak is an adventure game in the genre of Hidden Objects with unforgettable characters and challenging quests to conquer plenty of minigames and puzzles,Missing,70.0,0.0,5.09,0.0,0.0,0.0,3.0
100,"[9, 13, 15, 32]",118755,Traffix,"[14, 34, 130]",Welcome to the wonderfully chaotic world of Traffix  Control the flow of traffic with the tap of your finger Watch out for obstacles like trains trams  planes as you travel across 30 unique cities Fix the conjestion problem or cause absolute chaos The choice is yours in Traffix,Missing,70.0,3.34,4.5,5.0,70.0,4.0,8.0
101,"[12, 13, 31, 32, 34]",118052,The Language of Love,"[3, 6, 14, 48, 49, 130]",Mitsuki an aimless young man studying to take his university entrance exams falls for a young single mother who lives in his apartment complex A relationship develops between these mismatched social outcasts and then,Missing,70.0,5.78,6.98,7.09,75.0,4.0,6.0
