,genres,id,name,platforms,summary,storyline,main,extra,completionist,review_score,review_count,people_polled
308,"[14, 32]",115634,Real Fishing VR,[6],Real Fishing VR is a fishing game that travels around the world You can easily catch over 100 kinds of fish with simple rhythmic actions,Missing,,,,,,
309,"[31, 32]",115633,Shift Shaft,[6],Take Shaft on his way to find his meaning of existence Shift Shaft is an Indie SideScroller with a variety of gamemodes to play,Missing,,,,,,
310,[15],115631,Minskies,[6],Minskies Furballs is not a port but a spiritual clone of Puyo Puyo In a tournament against a cast of crazy characters you must guide and rotating falling pairs of cats of different colours to make up colour combinations,Missing,0.0,0.0,0.0,0.0,0.0,0.0
311,[32],115629,Grater,[6],A 2D platformer full of riddles collecting shooting and frozen time,Missing,,,,,,
312,[32],115628,Super Space Jump Man,"[3, 6]",Super Space Jump Man is a fun and challenging gravity based runner Traverse from planet to planet while dodging spikes lasers and collecting oxygen,Missing,,,,,,
313,"[13, 32, 34]",115625,Reflections: Dreams and Reality,"[3, 6, 14]",A visual novel about a girl who wishes to escape her fate and those who follow closely behind her,Missing,,,,,,
314,"[31, 32]",115619,Mage VR: The Lost Memories,[6],Maybe you dont remember but some of us do remember that we are Mages Try a gesture see if it starts fire in your hands maybe you are one of us Use this power and please save the world from this new malediction,Missing,,,,,,
315,[32],115617,A way up!,[6],A way up is a simple platformer about throwing a rock WARNING  you may find it really hard,Missing,,,,,,
316,[32],115615,Chocolate makes you happy: Lunar New Year,[6],Casual colorful physical puzzle with sweets jumpers teleports accelerators reverse gravity traps treadmills fires paper lanterns dragons and explosions,Missing,,,,,,
317,"[31, 32]",115612,Furry Chronicles,"[3, 6]",Furry Chronicles is a classic sidescrolling platformer game with challenging levels and puzzles,Missing,,,,,,
318,"[12, 31, 32]",115609,Tales of Nebezem RPG: Red Peril,"[3, 6, 14]",Magical RPG in a rich colorful world with tactical battles and an immersive story,Missing,,,,,,
319,[32],115608,SuperBeam,[6],Super Beam is a fascinating VR rhythm game which has variety of methods to be with fantastic music When targets are coming to you you can slash them out and you will feel fantastic VR experence You can feel like dancing while slashing targets listening to music,Missing,,,,,,
320,[31],115607,Mortadelo y Filemón: Una aventura de cine - Edición especial,[6],The return of the adventures Two sloppy cowboys and Terror horror and fear in a special edition that is the best and most modern work of the Spanish studio Alcachofa Soft in the franchise,Missing,,,,,,
321,"[31, 32]",115604,Quantum Legend - vr show,[6],A sneak action gameThis software only provides visual and survival mode experience,Missing,,,,,,
322,[31],115603,La Fuga,[6],Seven days to escape from prison in this Spanish cult graphic adventure,Missing,,,,,,
323,[31],115598,Mortadelo y Filemón: La Banda de Corvino,[6],Mort  Phil created by Ibáñez return to the charge in the world of the video game of the hand of spanish Alcachofa Soft Three games in one is offers La Banda del Corvino,Missing,,,,,,
324,"[31, 32]",115597,And I Must Scream,[6],And I Must Scream is an experience horror game that takes the player through a journey of kids imagination of how he perceives the world around him Control Max as he navigates the literal and metaphorical landscapes of trauma on his search for strength and acceptance,Missing,,,,,,
325,"[13, 15]",115593,Next Stop 3,"[6, 14]",Margaret needs your help once again You must repair the railway over 50 levels build a sorting center and win in a billiondollar escapade,Missing,,,,,,
326,[32],115587,Nano Driller,[6],A brisk soothing actionpuzzle game At a playtime of 2545 minutes this game offers a condensed yet polished and complete experience and can be enjoyed fresh or replayed at any time of the day,Missing,0.0,0.0,0.0,0.0,0.0,0.0
327,"[4, 14, 31, 32]",115586,Gladiator: Blades of Fury,"[6, 48]",Gladiator Blades of Fury is a melee combat action fighting game set during the medieval period Players can play as a gladiator from four different clans namely the Barbarians the Assassins the Knights and the Dwarves All heroes are unique and have their own weapons skills and fighting styles,Missing,,,,,,
328,"[10, 13, 14, 32]",115582,Extreme Racing on Highway,[6],Race through highway traffic in this new endless racing game where you need to push the acceleration and test your car limits and receive money for your rewards and spend them on upgrades  new cars,Missing,0.0,0.0,0.0,0.0,0.0,0.0
329,"[31, 32]",115577,Pursuer,[6],You are a pursuer and your job is to catch a criminal who has more than 20 victims,Missing,,,,,,
330,"[13, 31, 32]",115574,Symbitic Love,"[6, 14]",寄甡是一款百合向视觉小说游戏讲述了一场现代百合版宛如罗密欧与朱丽叶的凄美爱情故事,Missing,,,,,,
331,[12],115573,Robot Female Hero 1,[6],What if you combined the weird logic and stories of anime and every single RPG ever and smartass American internet humor and reasoning Well you get this old sport,Missing,,,,,,
332,"[13, 31, 32]",115572,Cube Human,[6],Cube Human is a cooperative adventure gamethe city is the main stage of the cube Human,Missing,,,,,,
333,Missing,115562,Gungrave VR U.N,[6],Become the legendary undead gunman Beyond the Grave in this standalone sequel to Gungrave VR featuring new levels enemies and play styles Master Graves punishing arsenal of attacks and abilities to mow down waves of mutant bad guys,Missing,,,,,,
334,"[12, 31, 32]",115561,Save Thine Kingdom,[6],A lighthearted journey of a King trying to save his Kingdom from the malevolent Doombringer,Missing,,,,,,
335,"[2, 32, 34]",115559,Bookend,[6],Harness your childlike imagination to interact with the popup book The Little Witch Explore the books world and help the protagonist the little witch Abigail as shes pursued by an angry mob trying to stop her mission that could either mean saving the worldor ending it,Missing,0.0,0.0,0.23,60.0,1.0,1.0
336,[13],115536,Ultimate Coaster X,[6],Ultimate Coaster X is a free roller coaster simulator built with simplicity and utility in mind The ingame roller coaster and world editors allow you to create and experience rides of many types,Missing,,,,,,
337,"[13, 31, 32]",115528,cockroach Planet Survival,[6],cockroach planet Survival is a Singleplayer survival game Players need to find food and find out how to escape while protecting themselves against enemies and escape,Missing,0.0,0.0,0.0,0.0,0.0,0.0
338,Missing,115527,The Far Kingdoms: Awakening Solitaire,[6],In this addictive solitaire game the Princess of the Kingdom your sister has fallen in a deep sleep for days and no one has been able to wake her Its now clear that this is the work of an evil spell Find the Elixir of Awakening to save her The journey will be long and dangerous but its your sisters only hope,Missing,0.0,0.0,0.0,0.0,0.0,0.0
339,Missing,115525,Winter Solitaire,[6],In this magical Solitaire game you must defeat the Ice Queen before the land is sealed in eternal winter,Missing,0.0,0.0,0.0,0.0,0.0,0.0
340,[35],115524,Luxor Solitaire,[6],The Gods have summoned you to the banks of the Nile Solve SolitaireLevels and use your skills to build the great city of Luxor,Missing,13.3,0.0,0.0,40.0,1.0,1.0
341,Missing,115523,Sacred Grove Solitaire,[6],In a magical land far away there is a beautiful island inhabited by elves A sacred grove has granted these elves powerful magic but one day everything changed A powerful earthquake has destroyed the island along with the sacred grove The Elven Queen seeks your help to restore the island,Missing,,,,,,
342,[32],115517,5.84 Wing,[6],584 Wing  Minimalist actionadventure game with many levels for which you have to overcome a lot of obstacles to collect keys and open doors,Missing,,,,,,
343,"[13, 31, 32]",115516,DooM in the Dark,[6],The space station has undergone an unknown contamination from space the previously unknown X virus mutates almost the entire station crew is infected you need to stop the army of mutants before they break through to Earth and doomsday began,Missing,0.0,0.0,0.0,0.0,0.0,0.0
344,"[4, 32, 33]",115513,Hyperfight,"[3, 6, 14]",Hyperfight is a fighting game where every hit is lethal and every win counts Featuring new characters and modes for maximized battle,Missing,,,,,,
345,[32],115510,Its Fun to Break Things,[6],Its Fun To Break Things is the best way to escape as you smash everything in your vicinity to pieces Be a bull in a china shop and aim for the high score as you progress through the levels Offered up in virtual reality this will really get you moving,Missing,,,,,,
346,[31],115507,EscapeRoute,[6],The robots are in control  things are so tight you think you cant even breath without letting them know You decide to not be part of this and then it happens ,Missing,,,,,,
347,[32],115506,Line Loops - Logic Puzzles,"[6, 14]",Line Loops  Logic Puzzles is a relaxing and challenging logic game where you try to form a single continuous loop to solve a puzzle Use the numbers as clues to loop through thousands of unique logic puzzles Can you solve them all,Missing,,,,,,
348,[32],115504,Bullynoid,[6],Bullynoid  This is a colorful breakout game in which you have to play for a bully Beat the faces of passersby and onlookers Take away their money All of what sometimes you want to do in reality is now available in the game Unlock new Freaky characters,Missing,,,,,,
349,"[5, 31, 32]",115501,Cyborg Invasion Shooter 3: Savior of the World,"[6, 130]",Cyborg Trilogy last part Cyborg has got new human transform Kill different enemies run and try to find teleport to other levels and save the world,Missing,,,,,,
350,Missing,115494,Project Centauri,[6],As you travel to find a new home for a near extinct species you reach Alpha Centauri A safe haven from the zemulons a fierce warrior species but as you arrive to take this home as your own you the native population protect themselves from an invasion of there home world,Missing,,,,,,
351,"[15, 32]",115489,The Three Kingdoms of China,[6],Three Kingdoms of China is a free opensource singlemachine strategy threecountry game developed by the domestic folk team The game does not have any commercial nature hoping to create a dream of Three Kingdoms for the fans of the three kingdoms,Missing,,,,,,
352,"[12, 25]",115463,Path of Exile: Synthesis,"[6, 48, 49]",In Path of Exile Synthesis players will meet Cavas and help him recover his lost memories by fighting their way through them and then stabilising them to collect a fragment of that memory,To help Cavas remember his past you will find fragments of his decaying memories throughout Wraeclast Fight your way through the monsters that inhabit his memories in order to activate stabilisers before the memories collapse around you,,,,,,
353,"[5, 33]",115456,Assault Android Cactus+,"[6, 130]",Assault Android Cactus is an arcade style twin stick shooter set in a vivid sci fi universe Junior Constable Cactus is outside her pay grade when she responds to a distress call and ends up stranded on a crippled space freighter under attack by its own robot workers    The Assault Android Cactus update comes with Campaign new costumes and a new aiming mode,Missing,,,,,,
354,[32],115442,Push Pull,[6],Push Pull is a challenging 2D puzzle game You play as Push and Pull and must work together through a series of simple looking yet challenging puzzles in an unknown test facility Will you persevere and discover what purpose this testing serves Includes over 40 levels and multiple puzzle mechanics,Missing,,,,,,
355,"[12, 31, 32]",115440,Unroaded,[6],Unroaded is a short free visual novel about the living dead man who instead of inaction chosed the road,Missing,0.52,0.0,1.05,75.0,2.0,2.0
356,"[14, 32, 33]",115435,Super Kickers League,"[6, 48]",The best arcade experience and football fantasy are waiting for you in Super Kickers League There are no referees there are no rules everything is allowed the only aim is to score more goals than your rival  Play alone or with friends form a team of captains and combine different skills to win matches competitions and to unlock different game modes Fun and goals are guaranteed in Super Kickers League,Missing,,,,,,
357,[31],115406,Crash Landed,[6],Welcome to Crash Landed The greatest adventure made by one guy Your space ship has crashedYour love is lostIts time for you to step up Guide your hero on a dangerous 16bit style journey on a foreign planet Travel across 20 heart pounding stages to find your lost love,Missing,,,,,,
358,[32],115403,Fold,[6],Fold and expand blocks until only one of each color remains in this original puzzler,Missing,,,,,,
359,"[32, 33]",115402,Uni,"[6, 130]",This consists of 30 minigames that you can enjoy together You can have a happy time with your friends and family However sometimes you may have to prepare for the destruction of friendship,Missing,0.67,0.75,0.83,43.0,3.0,4.0
360,[33],115399,Shop Battle,[6],A colorful game in the style of io for children and adults Start playing in the store and end up in a mall in the entertainment room for teens with a lot of console video games,Missing,,,,,,
361,Missing,115390,Bears in Tanks,[6],Blow your friends away in this freeforall brawl based on the tank games of the past Cooperative play is optional,Missing,,,,,,
362,"[12, 31, 32]",115388,Book of Eos,[6],Take a look into the hearts of monsters in an epic adventure inspired by classic console RPGs,Missing,0.0,0.0,0.0,0.0,0.0,0.0
363,[15],115385,Space Adventure TD,[6],A Tower Defense game made in the best tradition with 35 unique towers 70 upgrades and 8 biomes A 20 level campaign and 2 challenge levels for now with more to come Made by an indie developper,Missing,,,,,,
364,"[12, 14]",115380,The Legend of the Dragonflame High School 2,[6],This game is a 2D action game that high school students fight If you defeat an enemy by punching or kicking or throwing it to annihilate it you can proceed,Missing,0.0,0.0,0.0,0.0,0.0,0.0
365,[32],115368,Deicide,[6],Deicide is a sci fifantasy themed 3rd person team arena brawler featuring fast paced gameplay and unorthodox character designs Grab two of your friends and play in 3 versus 3 last humanoid standing arena,Missing,,,,,,
366,"[15, 32]",115365,Twinship,[6],This little cube is stuck in a parallel world divided between black and white Help him finish the levels and leave this world,Missing,0.0,0.0,0.0,0.0,0.0,0.0
367,[32],115360,Nowhere Station,[6],Crazy Roguelike topdown shooter with innovative movement mechanic insane robocults and lots of bullets to ensure your destruction before you grow a big bad robot,Missing,,,,,,
368,"[14, 32]",115356,Stellar Sphere,"[6, 14]",Stellar Sphere is a scifi sport game an action game and a space game mainly set in zero gravity where the player must find a sphere and throw it against the active wormhole Winning the game will need a combination of skills and using the best tactics in order to survive,Missing,,,,,,
369,[32],115350,Monovert DX,[6],Monovert is a 2d puzzle platformer You play as a square who has an ability to invert the level,Missing,,,,,,
370,[32],115344,Birth of a Hunter,[6],Birth of a Hunter is a metroidvania style 2D platformer with the twist that a huge new map is generated every time you start a new game,Missing,,,,,,
371,Missing,115324,Qubes,[6],Qubes is an online 1v1 game where fast thinking speed and focus are at the core of the gameplay experience Challenge a friend or a random player in a match with a set of randomly generated rules and try to color the majority of the map with the help of different powerups,Missing,,,,,,
372,"[31, 32]",115321,Polygon's Royale,"[3, 6, 14]",Polygons Royal is the battleground survival game for everyone It is a single player last man standing thirdfirst person shooter for low spec pcs with adjustable graphic settings for higher spec pcs,Missing,,,,,,
373,"[12, 15, 31]",115271,Disgaea RPG,"[6, 34, 39]",A departure from the gridbased tactics gameplay of the main series the game uses teams of 5 characters from throughout the series to fight waves of enemies in turnbased battles Characters can have star ratings from 2 to 6 that have various level caps with the end goal of a 6 star character being upgraded to level 9999 The game is region locked in Japan  Originally released in March 2019 with bugs and server issues the game was taken offline to work on fixes and improve the game it was relaunched in November 2019,Missing,0.0,0.0,0.0,50.0,1.0,0.0
374,"[31, 32]",115266,Stayer,[6],Anonymous letter the loss of heart is the beginning of the series of anonymous letter puzzle game mainly tells about the intern detective man because of receiving an anonymous letter and broke the original quiet when the letter instructions came to the abandoned 13 high school found that everything has changed is the trap,Missing,,,,,,
375,[12],115258,Mistero a Villa MilaFlora,"[3, 6, 14]",JRPG isometrico ZeldaLike con una componente Metroidvania tipo Pokemon pe Gameboy pe capisse ambientato a Roma nella facoltà di Filosofia dellUniversità della Sostanza Villa MilaFlora appunto,Missing,,,,,,
376,Missing,115253,Ne Touchez Pas 5,[6],Navigate 100 levels in this very difficult fast paced simple action game,Missing,,,,,,
377,[32],115252,Elephants Can't Jump,[6],Elephants Cant Jump is a sidescrolling puzzle platformer with no jump mechanic did the title give it away Join Akkoro the salty octopus and the rambunctious elephant Pengin as they escape abduction on an alien spaceship,Missing,,,,,,
378,"[15, 31, 32]",115249,The Sea of TianGang XinSu,[6],The sea of TianGang XinSu is an individually developed independent space game The story takes place after the war between the earth and the robot world The earth was reduced to the bargaining chip of the robots and was locked at a place of black holes The core aim of this prelaunched version is to release the earth from the robots,Missing,,,,,,
379,"[12, 31, 32]",115247,TimeOver,[6],On the border between a tribute to retrogaming and the discovery of the videogame world of todayTimeOver will propel you into a universe all in pixel where enemies and dungeons will give you a hard time,Missing,,,,,,
380,"[15, 32]",115224,Space Bound,[6],Retro Strategy Arcade Shooter,Missing,,,,,,
381,"[10, 13, 14, 31, 32]",115221,Need for Spirit: Drink & Drive Simulator - Off-Road Edition,[6],Transporting contraband the good ol booze and cigs across difficult terrain has never looked or felt more captivating Forget about rusty pickup trucks and jeeps What better way to deter the border patrol than transporting your highrisk wares with a freaking tank,Missing,,,,,,
382,"[15, 32]",115215,Glad Valakas Tower Defence 2,[6],2028 Due to the global economic crisis Valeras grandfathers garage is attacked by many enemies who are trying to capture the heros golden bucket Help Valera to repel the attacks of enemies and defend the most valuable thing for him,Missing,,,,,,
383,"[12, 13, 15, 32, 33]",115166,Exocraft,"[6, 14]",Design unique spaceships and build the ultimate space mining fleet as you team up to battle for resources and glory in this massively multiplayer action strategy set in an alien wasteland,Missing,,,,,,
384,Missing,115155,Trash Time,[6],Trash Time is a virtual reality game that can teach you how to recycle in a fun way Burnt trash accumulates CO2 gas that is one of the leading causes of global warming Try to save the Earth by playing as a alien robot with flexible hands recycle trash using powerups and power tools,Missing,,,,,,
385,"[12, 13, 14, 15, 31, 32]",115140,Legend of Girl Friend and GDC,[6],Missing,Missing,,,,,,
386,[32],115127,El Taco Diablo,[6],El Taco Diablo is a hardcore standstill arena shooter with your trusty revolver and shotgun defeat endless waves of UFOs and weaponized tacos Earn your place as the 1 gunslinger with the most accurate and fastest aim ever seen,Only your accuracy and speed will help you survive endless waves of enemies If your skills are high enough survive and face El Diablo himself Compete against your friends or on a global scale where every second matters Practice splitsecond decision making or just warm up before going into battle with your favorite action game,,,,,,
387,"[15, 32]",115119,Tactical Control,[6],Simplified strategy with minimalist graphics and quick intense games Play short matches against random opponents Fight tense battles of stealth anticipation and surprise Win with strategy deception and cleverness not with reflexes and clicking speed,Missing,,,,,,
388,"[31, 32]",115085,Zyphoid,[6],Look though the eyes and visor of bounty hunter Dugon as you follow him on his quest to exterminate the alien parasites called zyphoids and discover the truth about Planet Zyphamin its lost civilization and the horrors that lurk below the surface in the dark waiting to come out,Get ready for an interstellar adventure from the perspective of the bounty hunter Dugon A research satellite above planet Zyphamin has lost all power and its up to you to find out why Travel down to the hostile planet of zyphamin in this first person action adventure shooter From the planets calm open air surface world to its claustrophobic underground caverns loaded with monsters aliens radioactive substances mutants and worse Solve puzzles and mazes to traverse the alien world of Zyphamin Discover secrets unlock new items scan your way to the truth about Zyphamin and what lurks below Zyphoids are a key threat on this planet you must hunt them all down to open new paths and save Zyphamin but beware your not alone down there your being followed Test your self in secret areas hidden away to unlock optional items and discovery new mysteries but better watch out not all is what it seams defeat huge bosses to unlock the true path to the zyphoids nest explore the ruins of a lost civilization to uncover lost knowledge hidden away from time itself What happened on Zyphamin why did the satellite loose power youll have to scan to find out Play again and again to beat special challenges to unlock all the images in the art gallery Dont have an x box one controller switch to controller type B in the options menu to use a play station 4 controller or swop back to controller type A for classic PC gaming on an x box controller Zyphoid offers full controller support with its new controller type option now the player can use one type of controller or the other for more comfortable gameplay no key board or mouse required to play the game Run jump scan blast explore learn and challenge your self in this first person adventure inspired by Metroid prime if you like first person scifi adventures this is the game for you,,,,,,
389,[32],115082,1248,"[6, 14]",the worlds first digital elimination play,Missing,,,,,,
390,"[31, 32]",115081,Matanga,[6],Not all friends returned after a night forest disco The local aborigine  Matanga is always glad to new guests in his lair Do you want to test your ability to survive in a fight with a local maniac unraveling his monstrous secret Fear,Missing,,,,,,
391,"[31, 32]",115074,Katana Soul,[6],Play as the samurai Kan and fight in a dark demoninfested Japan Face this 100 arcade experience without any credits or saves you can only rely on your skills with the katana,Missing,0.0,1.85,0.0,70.0,1.0,1.0
392,"[9, 25, 31]",115019,LEGO Marvel Collection,"[6, 48, 49]",The LEGO Marvel Collection features three actionpacked LEGO Marvel games LEGO Marvel Super Heroes LEGO Marvels Avengers and LEGO Marvel Super Heroes 2 plus all season pass content for each game Join your favorite characters in the actionpacked Marvel Universe,Missing,26.25,0.0,0.0,0.0,0.0,2.0
393,[32],114996,Magic Heart,[6],Eva has a dream to develop magic abilities and return to her homeland but she suddenly develops close relationships with her two female friends instead,Missing,,,,,,
394,[32],114971,TetrotronVR,[6],Nothing can be better than well overlooked old but in new format TetrotronVR is completely new look at the usual Being on the surface of Mars and have limited time you will need to fill the gaps in the wall with the help of familiar figures in the form of square line letters L and Z,Missing,,,,,,
395,"[12, 15, 31, 32]",114970,Redviil,[6],Now its 2143 my name is Alice I was born in a small town called Gwaine I dream to continue the work of my greatgrandfather to find a cure for the red plague and release people living in hundreds of bunkers,Missing,,,,,,
396,[32],114963,Hellink,"[3, 6, 14]",The first visual novel about fake news Investigate in 2044 in a humorous and cyberpunk universe Counter your opponents lies and thwart the plot that threatens NéoSorbonne,Missing,7.42,0.0,0.0,0.0,0.0,1.0
397,[32],114956,Candy Mandy,[6],Classic game in the popular three in a row genre,Missing,,,,,,
398,"[10, 13, 14, 32]",114946,Grits Racing,"[3, 6, 14]",Lugnutchallenged crazy couch game that happens to also be the most realistic TD2D racer to date Stop driving tiny cars that just pivot on center Drive tiny cars that actually steer and crash like a car,Missing,,,,,,
399,[31],114923,Jungle Z,"[6, 130]",Game Introduction Jungle Z  On a ordinary weekend afternoon people were enjoying a leisurely holiday Suddenly zombies came out from nowhere and attacking Everyone is screaming and running nobody knows whats going on until dead,Missing,,,,,,
400,[31],114824,Sakura no Mori Dreamers 2,[6],Missing,Missing,,,,,,
401,"[12, 31, 32]",114803,Torn Earth,[6],Welcome to Torn Earth An open world post apocalyptic adventure where choices matter and survival is key,Missing,,,,,,
