first_release_date,genres,id,name,platforms,summary,storyline,main,extra,completionist,review_score,review_count,people_polled
1610150400,"[8, 10, 32, 33]",147375,Curiosaurios Club: Un Viaje Espacial,"[3, 6, 14, 34]",Space themed casual game for kids On this game Sami and Codi will travel trough Solar System discovering some curiosities about planets,Samy and Cody got lost around the Solar System help them to get safe back to the Earth,nan,nan,nan,nan,nan,nan
1611187200,"[8, 31]",146770,Liminal Ranger,[6],liminal ranger is a first person platformer about talking to spaces and solving their problems  it has volume settings and mouse sensitivity sliders  it has a good amount of original music and 3 levels with light progression mechanics  it has two endings,Missing,1.21,1.22,1.32,67.0,6.0,7.0
1611187200,"[9, 35]",146175,Poker Pretty Girls Battle: Fantasy World Edition,"[6, 48, 130, 167]",Classic Texas Holdem gets a magical twist at the Fantasy World casino where youre invited to play at tables against 16 Pretty Girls from elves and demons to sorceresses and more Each female opponent has her own look and unique style of play along with Japanese voiceovers to let you feel their excitement in the intense poker battles Start out against 4 of these gorgeous players and unlock more as you prove your skills worthy of new challengers  There are 2 game modes to choose from  In Pretty Mode youll collect rewards as you defeat random opponents while in Free Play Mode you can customize the experience by choosing which of the unlocked girls will join your table With so many characters to meet plus traditional mechanics that are fun and familiar this is a fantasy experience that you can revisit time and time again,Missing,nan,nan,nan,nan,nan,nan
1612051200,[7],145267,SynthVR,[6],SynthVR is the synth nerds scifi fantasy A modular synthesizer environment built from the ground up for virtual reality    Based on the Eurorack standard and reimagined for VR SynthVR offers an exciting and accesible path into the world of modular synth music It comes packed with studioquality synth modules including oscillators sequencers effects logic and more If you built something cool you can share it in a heartbeat and if youre looking for inspiration you can surf amazing community patches at random    What will you make today Madscientiststyle electronica ambient drones or hard techno,Missing,nan,nan,nan,nan,nan,nan
1609718400,Missing,145161,Theseus,[6],Theseus never killed the Minotaur He found common cause with Asterion until he didnt anymore A tale of diaspora gender and survival    Theseus is a surrealist narrative game about helping a messy Athenian prince break up with his Minotaur love of five years Navigate a physical labyrinth of all his internalized selfdoubt in this narrative adventure Playtime is around the length of a movie and is meant to be consumed in a single sitting,Missing,1.46,1.98,3.01,53.0,6.0,10.0
1612051200,"[12, 15, 31, 32, 35]",144996,Kyvir: Rebirth,[6],Kyvir Rebirth is a single player card game that combines elements of RPG deck building and roguelike gameplay This game features an original dual deck mechanism hundreds of distinctive items skills and cards for you to experiment with,Missing,nan,nan,nan,nan,nan,nan
1610064000,[33],144883,Endless_Overdrive,[6],LoFi High Octane Arcade Action,Missing,0.0,0.0,0.0,50.0,1.0,0.0
1611792000,[31],144847,Sea of Thieves: Season 1,"[6, 49, 169]",The new year ushers in new ways of ensuring players always have things to do in Sea of Thieves Our first Season delivers a new route to earning rewards by building your Renown a trove of Trials and Deeds to tackle along the way a permanent new Voyage type for the Merchant Alliance new and returning timelimited Events more freebies to grab through Twitch Drops and fresh Pirate Emporium stock including the Plunder Pass,Missing,nan,nan,nan,nan,nan,nan
1611532800,"[12, 25, 31, 32]",144626,Legend of Krannia: Cursed Fate,[6],A topdown fantasy game with deckbuilding elements You play as Vahn who is betrayed by his fellow soldiers and falls in battle Given another chance he finds himself in a small town having to start everything again he must build his strength and stop the darkness that plagues the kingdom and kill the traitors in the process  Collecting skills levelingup customizing your gameplay and managing your stats are its primary elements It has a complex 2D controls with skillswitching blocking and dodging,Missing,nan,nan,nan,nan,nan,nan
1610496000,"[12, 34]",144608,Ascension: Transition and Silver,"[3, 6, 14]",A transgender visual novel loosely based on Tarkovskys STALKER,Missing,0.0,0.0,1.48,60.0,2.0,2.0
1611360000,"[31, 32]",144439,Fiction #F3F,[6],A collection of Colorfictions atmospheric adventure games including Nightline Carcavas That Feeling Blue The Sands of Voltark and æ which was previously available via the Haunted PS1 Madvent Calendar 2020,Missing,nan,nan,nan,nan,nan,nan
1611878400,[32],144383,Partition Sector,[6],Blow up your friends  and snakes  in 6 game modes including Battle Royale Capture the Flag King of the Hill and Snake Hunter Up to 20 players in local multiplayer with online play via Steam Remote Play Together  only one player needs to own the game,Missing,0.0,0.0,0.0,0.0,0.0,0.0
1611792000,[31],144308,Flesh Eating Geriatric Internet Predator,[6],You are a projectionist tasked with assembling a long lost Horror Film for its first screening ever A girl obsessed with vampires ends up meeting the real horrifying thing but hes far from the sparkly man of her dreams,An all new Interactive FMV game    You are a projectionist tasked with assembling a long lost Horror Film for its first screening ever  A girl obsessed with vampires ends up meeting the real horrifying thing but hes far from the sparkly man of her dreams    Featuring     Stylized FMV video   Multiple paths   Multiple endings   Hidden scenes   Secret Music Videos,0.0,0.0,0.0,50.0,1.0,0.0
1609632000,"[8, 9, 31, 32]",144212,Fall Balance Ball,[6],Indie platformer in a 3D setting Balance on platforms jump and pass barriers Collected crystals will give you super powers,Missing,nan,nan,nan,nan,nan,nan
1611360000,"[32, 34]",144194,2econds to Starlivht: My Heart's Reflection,[6],The day I put that uniform on I saw myself in the mirror for the first time And I dared to think maybe just maybe A free VN about standing up to the world to be yourself  Part of the Noisz series and prequel to Noisz Starlivht,Missing,nan,nan,nan,nan,nan,nan
1610928000,"[9, 31, 32]",144124,Puzzle Box Palace,[6],Puzzle Box Palace is an escape room style puzzle game where you are pulled into your grandfathers magical puzzle box Solve puzzles manipulate the puzzle box and jump across furniture as you look for a way out,You find nostalgic letters from your grandfather throughout the puzzle box reminiscing about your relationship with him as you navigate his last gift to you,0.82,0.0,0.0,0.0,0.0,1.0
1610582400,"[31, 33, 34]",144071,Fantasy Tavern Sextet Vol. 2: Adventurer's Days,"[6, 130]",The 2nd part of a 3 part series It is an adventure game where you can enjoy a slapstick love harem play with laughter tears and a little H in a bar in a different world  The Emote engine that can move illustrations smoothly and threedimensionally is used for standing pictures in the game The characters displayed on the screen move as if they were alive,One day several days after our protagonist the young cook in the back of an Akihabara maid cafe got transported to another world our hero gets paid a visit by the lady knight Dahlia at Lupines tavern Dahlia proclaims to the hero I want you to make me a woman which leads to all kinds of misunderstandings with Lupine and Daisy who have a barrage of questions  After getting filled in on what she actually meant its revealed that Dahlias aim is to defeat a monster who only preys on women However for Dahlia who has only ever lived by the sword femininity feels like an alien concept  To help increase her feminine charms Dahlia becomes a waitress at Lupines Tavern and her inexperience leads to all kinds of trouble with the guests  Our hero has no idea that this turn of events will lead him to help Dahlia and Veronica take down their archnemesis from the past,nan,nan,nan,nan,nan,nan
1611100800,[5],144044,Rocket Arena: Season 3,"[6, 48, 49]",New Hero Emotes Totem Companions New Blast Pass and More,Missing,nan,nan,nan,nan,nan,nan
1611100800,"[10, 13, 14, 32]",143841,Down the River,[6],Paddle down scenic rivers enjoy the nature but always be alert It is full of obstacles and dangers If youre not careful you crash into rocks or lose your precious gear Complete the course as fast as you can to make the global high score,Missing,nan,nan,nan,nan,nan,nan
1611187200,"[8, 31, 32]",143840,Lamp Chronicle,[6],Lamp Chronicle is an 2D platformer game that tells the story of a little hero who travels to save a kingdom in crisis Defeat enemies against beautiful backgrounds and enjoy exciting battles with bosses,The evil energy of darkness spread around the world resulting many lives in the kingdom losing their memories or being turned into monsters    On the night of the fall of the kingdom the princess who fought the darkness had to hide a lamp of light which was the treasure of the kingdom that possessed a mysterious power During this chaotic fight the princesss friend Luca happened to took over the lamp and managed to escape the Kingdom He heals his wounds near his hometown and goes on an adventure to save the kingdom Can Luka still a flimsy knight trainee become the true owner of the lamp drive out the darkness and find the missing princess His long and dangerous journey full of monsters is challenging,0.0,0.0,0.0,0.0,0.0,0.0
1610668800,"[8, 31, 32]",143778,Reach the Summit,[6],Reach the Summit is 2D platformer in a pixel retro style The Brave Leah is an novice climber She wants to improve herself and she decided to reach the first hard Summit in her life Help her to climb up and get ready to your first adventure with Leah,Missing,nan,nan,nan,nan,nan,nan
1609718400,"[32, 33]",143775,Puzzle Pieces,"[6, 34]",Puzzle Pieces is easy to learn but hard to master game that will put both your reflexes and perception to test Your goal is to match as many puzzles as possible and in the begining its easy but with every succesfull match the difficulty increases and with it the speed of the game,Missing,nan,nan,nan,nan,nan,nan
1611014400,"[8, 9, 14]",143736,Snolf CD: A Snolf in Time,[6],As with other SNOLF games this hack replaces Sonics ability to move with a golfgame mechanic similar to the kind of thing found in games like Kirbys Dream Course Sonic remains rolled up into a ball under most conditions and can only be launched when he has come to a stop The Rings counter instead counts how many shots you have taken allowing players to compete to get the lowest score  This time Snolf has been hurled into a world where the timespace continuum is a little less rigid and his dark powers have manifested themselves in an unusual way,Missing,nan,nan,nan,nan,nan,nan
1611792000,"[10, 32]",143727,Cargame,[6],Cargame is new type of racing game where you can just drive around of cities and race tracks You can choose what track or city u want a drive and go drive like a furious head Cargame controls from most realistic car driving simulators,Missing,nan,nan,nan,nan,nan,nan
1611014400,[5],143685,Zombie Army 4: Dead War - Mission 6: Dead Zeppelin,"[6, 48, 49, 130]",The resistance airfield might have been saved but a killer Zeppelin is still on the loose The deadhunters only option is to chase that damned aircraft back to its lair and send it back to whichever Hell it came from,Missing,nan,nan,nan,nan,nan,nan
1611187200,"[8, 31, 32]",143652,Dispersio 2,"[3, 6, 14]",Dispersio 2 is a retrostyled metroidvania As you progress through the game you will gain new abilities such as dashing walljumping and more Theres even a hard mode for hardcore players Can you beat the game with only 1 HP,Missing,0.0,0.0,4.5,0.0,0.0,1.0
1609891200,"[8, 31, 32]",143525,Beholder's Lair,[6],Beholders Lair is a difficult 2D platformer that revolves around skillfully avoiding different kinds of enemies Learn the movement patterns of your enemies outsmart them and escape the demons lair,With glory and treasure in mind you journeyed into Zindan an old dungeon located near the ancient desert city of Urf After days of exploring fighting and looting you were captured in your sleep by cultists Turns out the old dungeon had a new inhabitant A beholder recently decided to carve his lair inside the dungeon and you were lucky enough to set camp next to it There is only one way to escape the demons lair Will you be able to escape Or will you share the fate of many others before you,nan,nan,nan,nan,nan,nan
1610409600,"[12, 13, 15, 16]",143523,Heroes of the Three Kingdoms 8,[6],Heroes of the Three Kingdoms 8 is the eighth installment in the Heroes of the Three Kingdoms series of strategic war games based on the classic Chinese novel Romance of the Three Kingdoms The first mainline sequel in over 13 years the game gives the series a new look while staying true to its core formula,Missing,nan,nan,nan,nan,nan,nan
1610755200,[32],143475,Music Room,[6],Music Room is a Japanese horror game in which a friend invites you to go to school to test your courage,The protagonist is invited by his friend to go to school to test his courage but as soon as he arrives at the school his friend blocks the entrance and tells him to go to the music room alone  Whats in the music room Why is it so popular to test your courage at school in class,nan,nan,nan,nan,nan,nan
1610755200,[35],143441,King's Cup,"[6, 14]",Kings Cup is a drinking game played online with friends Players each pull a card from the circle and have to drink give drinks or a minigame is started to determine who should drink Kings Cup comes with default rules or you can host games using your own custom rules,Missing,nan,nan,nan,nan,nan,nan
1611187200,"[5, 32, 33]",143412,Blurple Food Wars,[6],Return to classic 80s shooters while fighting off the fast food horde in this retro space shooter,Missing,nan,nan,nan,nan,nan,nan
1611273600,"[15, 32, 35]",143410,Minesweeper Versus,[6],Minesweeper Versus requires tactics and strategy to uncover hidden mines before your opponent beats you to it Its a modern take on the classic free minesweeper game for two players,The goal of Minesweeper Versus is to uncover more bombs than your opponent The location of most mines is discovered through a logical process but some require guessing usually with a 5050 chance of being correct Clicking on the game board will reveal what is hidden underneath the chosen square or squares a large number of blank squares may be revealed in one go if they are adjacent to each other Some squares are blank while others contain numbers from 1 to 8 with each number being the number of mines adjacent to the uncovered square,nan,nan,nan,nan,nan,nan
1611187200,"[5, 33]",143294,Grand Theft Auto V: Premium Edition Bundle,[6],Grand Theft Auto V takes place five years after Grand Theft Auto IV and is now set in Los Santos It centers around three protagonists Michael Trevor and Franklin New to the series is that the player can switch between the three characters on the fly They each have different missions lives and personalities They also often come together especially for heists a complex type of mission where a large operation needs to be planned and executed by determining a strategy and hiring additional henchmen As with previous games in the series the gameplay involves gunfights and takes place in a sprawling openworld city where players get around by acquiring transport cars boats helicopters etc through less than legal means Players can roam the game world complete story missions and partake in various illegal activities including shooting civilians robbing people destruction of cars and the titular act of car theft These lead to a wanted rating of up to five stars sending in a police force in pursuit Continuing to resist the police will also increase it The wanted status is lost by getting out of sight or by spraying the car,Missing,nan,nan,nan,nan,nan,nan
1611792000,Missing,143287,Uno: Fenyx's Quest,"[6, 48, 49, 130]",The most famous card game hosts a legendary showdown An allnew game mode inspired by the mythical world of Immortals Fenyx Rising UNO Fenyxs Quest plunges you into the marvelous Golden Isle and its mysteries and wonders Avoid the traps of Typhon free the gods from their curse and wield their mighty powers to be the first one to get rid of your hand Olympus awaits you,Missing,nan,nan,nan,nan,nan,nan
1611792000,"[9, 15, 33, 35]",143286,UNO: Ultimate Edition,"[6, 48, 49, 130, 169]",Get the complete collection of one of the most iconic games with the UNO Ultimate Edition containing UNO UNO FLIP UNO Fenyxs Quest plus themed cards featuring Just Dance 2017 Rayman and more,Missing,nan,nan,nan,nan,nan,nan
1611014400,"[9, 32]",143275,"Locust, U.S.A.",[6],Uncover the dark secrets of the small American town of Locust by breaking blocks and hitting switches Gameplay mechanics inspired by Arkanoid clones and various weird pinball machines and aesthetics inspired by Stranger Things World of Horror Tron etc,Missing,nan,nan,nan,nan,nan,nan
1609891200,"[15, 32, 33]",143272,Pretend,[6],Pretend is an arcade game a clone of Among Us and an adaptation of the classic party games Mafia and Werewolf It is a game of murder accusations deceit and survival  Play with 415 players online or via the local network as you attempt to uncover who pretends to be a worker  by completing tasks and discussing with other coworkers,Missing,0.0,0.0,0.0,0.0,0.0,0.0
1611878400,"[8, 31, 32]",143259,Lost Caves,"[6, 14]",A 2D collectathon in which you explore caverns filled with underground ruins to find treasure and to hopefully find your way back to the surface Collecting treasure from chests accumulates your wealth and the wealthier you become you further you can progress,In an attempt to find his fortune young Michael Miner ventures into an old California gold mine to find any gold left over After digging up what he thinks is gold embedded in a wall the entire mine collapses around him and he finds himself tumbling down a deep hole into When reaching the bottom he finds that hes stumbled into a large complex of caverns that houses the ruins of an ancient civilization And where there are ruins theres treasure and Michael is not about to return to the surface empty handed,0.0,0.0,0.0,0.0,0.0,0.0
1612051200,"[10, 33]",143236,MayhemCars2,"[3, 6, 14]",Race across procedurally generated tracks with thousands of cars to unleash total mayhem and destruction At every corner our super AI will make you feel like they will much rather destroy you than win,Missing,nan,nan,nan,nan,nan,nan
1611619200,"[8, 32]",143222,Smol Ame,"[6, 82]",A 2D platformer starring Watson Amelia and her friends based on Walfies smol Ame drawings,Missing,1.18,0.0,0.0,70.0,1.0,1.0
1611878400,[32],143199,Live Inc.,[6],Live Inc is an online 2vs2 heist game where two opposing players play in a cat and mouse scenario and their team members play as overseers of the map Teams can use unique mechanics to interact with the map and must work together to outsmart their opponent,Missing,nan,nan,nan,nan,nan,nan
1611878400,"[8, 12, 31, 32]",143189,Abyss the Forgotten Past,[6],Abyss The Forgotten Past is a 2D platform game with RPGbased mechanics with a large diversity of collectible items increasing the difficulty as you progress The story is based on rediscovering itself after an unfortunate event Leonnor sets out on a journey to discover everything about his past with special abilities where monsters magic and heavenly beings exist Enter a personal search that will surprise you with each discovery ,Play as Leonnor who sets out on a journey to discover everything about his past and his world things are not always what they seem Learn special abilities battle monsters and encounter celestial beings as you explore this beautifully crafted pixel world,nan,nan,nan,nan,nan,nan
1611705600,"[12, 13, 31, 32]",143166,Tale of Immortal,[6],Tale of Immortal is an openworld sandbox based on Chinese mythology and cultivation You will grow to become immortal conquer the beasts from the Classic of Mountains and Season make your choices carefully and grasp your own destiny,Live the mythology With a background based around ancient Chinese myths and stories players will have a variety of interactive options with scenes and ingame NPCs which will affect the storyline of the game and transform the game world  Become Immortal The theme of the game combines the immortal cultivation and the unique cultural background of The Classics of Mountain and Sea Players will experience the journey from a mortal to a strong godlike being,72.0,0.0,0.0,0.0,0.0,1.0
1611878400,"[2, 31, 32]",143159,"A Painter's Tale: Curon, 1950","[6, 14, 48, 49, 130, 167, 169]",A Painters Tale is an adventure game that tells the story of the tiny Südtirol village of Curon Venosta by mixing reality and fiction The old Curon was flooded by the waters of Lake Reschen in 1950 due to the construction of a dam What lies beneath the bell tower still emerging from the lake,A Painters Tale Curon 1950 is a story about love and resistance an adventure game about historical memory The bell tower that comes out of the lake is the last memento of the old village of Curon flooded by the waters of Lake Reschen in 1950 due to the construction of a dam despite the protest of the citizens The plans for the dam started during the Fascist era opposing the interests of a big industrial group to the wellbeing of the villagers who were forced to leave their homes and pastures,2.5,0.0,2.77,80.0,1.0,3.0
1611878400,"[15, 32]",143158,Don't Get Bit,"[6, 14]",Its the zombie apocalypse and Cassie a sarcastic 18 year old armed with only her wits and a kitchen knife must get to her uncles farm Keep Cassie alive in this turnbased strategy game as she battles the undead across thirty levels trying to survive and not get bit,Guide Cassie and her companions through 30 levels as they battle hordes of mutant zombies Each map is unique filled with new challenges requiring different strategies and skill but no luck  Featuring a haunting storyline each level opens with Cassie sharing more of her story and the apocalyptic world around her,nan,nan,nan,nan,nan,nan
1611878400,"[15, 24, 32]",143157,Finger Fortress,[6],We fused typing and strategy to provide you the best experience of a 1v1 typing game Choose your race and lead your soldiers to break through the opponent fortress in the fingers of speed and wisdom,Missing,nan,nan,nan,nan,nan,nan
1611792000,"[31, 32, 34]",143156,Ghost in the pool,[6],A bizarre campus legend take you into the traditional Japanese black and white comic horror story Witness the familiar scenes and contemplate the terrifying moments,It all started from a rumor that the school swimming pool has a ghost in it Every innocent life can be the victim especially when you go there at night The school knows it but keep it quiet and just simply lock the pool after day timeBut there always have some brave people who believe or not believe it and break into the natatorium at night and meet the horrible creature there and with no return back,1.2,1.96,2.93,63.0,3.0,9.0
1611792000,"[2, 13, 15, 31]",143155,Farm Frenzy: Refreshed,"[6, 14, 48, 49, 130]",Grow and make resources to trade with the city care for animals and build your dream ranch in Alawars famous Frenzy Farm with a modern twist,Slip into a pair of overalls and give us your best Yeehaw  From feeding feisty animals to gathering fresh eggs to making delicious pastries youll turn a humble little homestead into a booming agribusiness Youll have to stay on your sunkissed toes though As you race to meet your goals on each level ravenous bears and other animals will try to foil your efforts But dont worry youll have the tools you need to deal with each of these beastly brutes  From sunup to sundown Farm Frenzy is crazy captivating fun,nan,nan,nan,nan,nan,nan
1611792000,[32],143154,Hidden Lands,[6],These lands are paused in time split apart Find their differences to to bring them back to life Discover ancient civilizations through their lost treasures,Missing,6.3,6.45,11.05,60.0,5.0,8.0
