first_release_date,genres,id,name,platforms,summary,storyline,main,extra,completionist,review_score,review_count,people_polled
1611792000,"[12, 31, 32]",143153,Fate of the Storm Gods,"[3, 6, 14]",Harness wind earth fire and all the forces of nature to destroy your enemies Will you stabilize the broken magic of the weather or revel in its chaos,Harness wind earth fire and all the forces of nature to destroy your enemies Will you stabilize the broken magic of the weather or revel in its chaos Fate of the Storm Gods is a 275000word interactive fantasy novel by Bendi Barrett Its entirely textbased without graphics or sound effects and fueled by the vast unstoppable power of your imagination  The worldbelow is the realm of humans mundane shortlived often helpless creatures But you are a Weather Buildera resident of the upperworld controller of all things atmospheric and a veritable Storm God In your Workshop of the Westerly Wind at the peak of Mount Gion you and the Master Builder regulate the weather in the Western lands  When a desperate human royal climbs Mount Gion and breaches your workshop you learn that the weather in the Southern lands has descended into chaos Floods destroy whole cities in highlying areas Fertile plains deteriorate into desert within months Furthermore the Builders loyal automaton servants the homunculi are slaughtering humans without provocation  This must be the work of the Weather Eaters enemies of the Builders since time immemorial The Weather Eaters feed off of maladaptive weather sowing anarchy and strife wherever they can Now your ancient feud threatens to break the weather and tear apart two worlds  Armed with a suite of elemental powers and the aid of your trusty and deadly homunculus you must leave Mount Gion for the first time putting yourself between the will of the Builders the needs of the humans and the ire of your enemies Will you use your elemental powers and your wits to mend this rift before its too late or will you prioritize accumulating power and influence in the midst of growing chaos,nan,nan,nan,nan,nan,nan
1611792000,"[12, 32]",143152,The Book of Shadows,[6],What happens when you and your girlfriend uncover a mysterious book and then accidentally activate it Can you keep Alex one step ahead of those who want the book while at the same time figure out where am I What does this book do Why do these other people want it,What happens when you and your girlfriend uncover a mysterious book and then accidentally activate it  That is what happened to Alex and Talia and now Alex finds himself in the mysterious world of Esteron with the book while Talia is possessed by something In addition others have detected the activation of the book and want it for their own nefarious purposes Can you keep Alex one step ahead of those who want the book while at the same time figure out where am I What does this book do Why do these other people want it,nan,nan,nan,nan,nan,nan
1611792000,"[4, 31, 32]",143150,Miska's Cave,[6],Miskas Cave is a unique actioncentric side scroller with strategic components and animated with pixel art If you love completing challenging games that require varying strategies this game is for you,Missing,nan,nan,nan,nan,nan,nan
1611705600,"[12, 15, 31]",143149,Magellania,[6],Defeat your enemies with the power of love friendship and violent military aggression in Magellania a hardcore tacticsRPG set in outer space,After the rulers of the other planets turn down his birthday invitations Prince Lofty of Pluto decides to invade their kingdoms and force them to attend,0.0,12.75,0.0,0.0,0.0,1.0
1611792000,"[13, 15, 32]",143080,Steel Division 2: Nemesis - Battle of Rimini,[6],Nemesis Battle of Rimini takes place during Operation Olive set in midSeptember 1944 which saw the Allies attempt to break through the Germanheld Gothic defensive line on the Adriatic coast,Missing,nan,nan,nan,nan,nan,nan
1611705600,[34],143049,Megalith,[6],A short story about the last man on Earth Made for a game jam,Missing,nan,nan,nan,nan,nan,nan
1611360000,"[8, 25, 33]",143047,FrenVania,[6],A 2D platformer mixing elements from the Kirby and Castlevania series featuring VargFrenfrom the streams of the Vinesauce collectives Joelas the playable character,Missing,nan,nan,nan,nan,nan,nan
1611619200,"[12, 13, 31]",143026,The Sims 4: Paranormal Stuff,"[6, 14, 48, 49, 167, 169]",Light the candles and prepare the rituals to appease your ghastly new roommates with The Sims 4 Paranormal Stuff Spectral guests cause mischief and mayhem on Haunted House Lots but Sims can perform a séance befriend Guidry the Ghost become a Paranormal Investigator and restore order,Your newtoyou home might be home to someone else too if its one of the new Haunted House Lots Appease the mischievous specters to relax in serenity or let them run amok for scares day and night  If you want to send your new roommates packing Guidry the Ghost is happy to advise you Remove accursed objects perform a séance commune with the dead and receive gifts from specters You can even summon Bonehilda the skeletal maid  Master the Medium skill and impress Guidry to get a Paranormal Investigator license Once youre ready take on some freelance gigs to expel unwelcome visitors for other Sims With spooky activity on the rise its up to your Sim to put a stop to it,nan,nan,nan,nan,nan,nan
1611187200,"[32, 33]",143020,Outer Rat,"[6, 14, 34, 39]",Figure out who is the deserter with your friends or betray them Use abilities as detective and as a deserter to defeat the other team Point out a culprit and give proof of it,Figure out who is the deserter with your friends or betray them Play 310 players invite your friends and show them who is the best liar  Use abilities as detective and as a deserter to defeat the other team  Point out a culprit and give proof of it,nan,nan,nan,nan,nan,nan
1611619200,"[5, 32, 33]",143014,Wholesome Slaughter,[6],Wholesome Slaughter is a retro style FPS set in a fantasy world After stumbling into an unknown dimension you must fight your way through hordes of the cute and innocent inhabitants of the land,Missing,0.69,0.0,0.0,50.0,1.0,2.0
1610323200,"[5, 32, 33]",142997,Aircraft Sketch Shooter,[6],An Arcade Top Scrolling Action Shooter pick from various Aircrafts to play with and challenge Yourself on Airfields and Individual Designed Challenges to Encounter Unique Boss Fights  Compete on the Global Leaderboards with your Scores,Missing,nan,nan,nan,nan,nan,nan
1611964800,[32],142994,Post Cards,"[6, 14]",A collection of three small games  Each one  ocean desert and grove  comes with its own goal and control scheme See if you can complete each one or simply enjoy the scenery,Missing,nan,nan,nan,nan,nan,nan
1611964800,"[5, 31, 32]",142987,Rogue Sentry,"[6, 48, 49, 130, 167, 169]",A difficult twinstick adventure shootemup about a sentry droid who turns rogue to save humanity,AI has spread and taken over the world imprisoning the remaining humans in a highsecurity fortress  An unlikely stem of the machine learning algorithm has found its way into a sentry droid who guards the fortress gate With a spark of empathy or a programming error the sentry droid pines for its maker and opts to abandon its post  Sentry droid you are humanitys last hope Can you reverse the apocalypse save the prisoners and escape the fortress before its too late,0.0,0.0,0.0,0.0,0.0,0.0
1610841600,"[8, 31, 32, 33]",142986,Dadish 2,"[6, 34, 39, 48, 49, 130]",Hes a dad and a radish and hes back in his biggest adventure yet After an impromptu Bring Your Kids To Work Day goes awry Dadish sets off to find his missing children Along the way hell wade through swamps ride rockets climb a big tree and even visit outer space Help reunite Dadish with his missing kids in this charming and challenging platforming adventure,Missing,1.95,2.39,2.77,75.0,28.0,33.0
1611446400,"[2, 31, 32]",142963,The House of Mr Chocolate,[6],A game about loneliness hope and something scary in your house     Like in most adventurepointandclick games you will have a Talk To command but Mr Chocolate is all alone Only by mimicking Mr Chocolates habit will you succeed in completing the game and hopefully you will get to experience his sense of solitude and the emotions he is going through      The game includes    A unique fogofwar system the house is all dark and as you walk through you will be able to see more of its corners    A mystery around the poignant story of a lonely man    A pixelart house to explore with a strong personality and many hidden items    An astonishing number of dialogues for a game with only one character      Good luck,Mr Chocolate lives alone in his house He never goes out slowly loses his memory and he is so lonely that he took the habit of talking to objects But something is happening in this house Explore with him what is disturbing his peaceful retreat and why something is trying to force him out,nan,nan,nan,nan,nan,nan
1610236800,"[15, 32, 33]",142936,Countdown,[6],An asymmetrical multiplayer game with up to 12 players Humans VS Androids Survive and outwit your opponent,Missing,4.0,0.0,0.0,70.0,3.0,2.0
1611273600,"[14, 31, 32]",142924,Prop Hunt,[6],PropHunt is a game in which you have to become a prop or a hunter The props are disguised as objects around the map and merge with the environment The props are trying to hide from the hunters and avoid death Hunters win the round if all props are killed and props win if the time runs out or all hunters die  If you Prop you should hide from hunters To do this take the form of any item that is present on the map  If you are a Hunter you must search and kill props For this you have a weapon But hurry up  you have limited time,Missing,0.0,0.0,0.0,0.0,0.0,0.0
1611878400,"[7, 31, 32]",142923,Everybody Wham Wham,"[6, 14]",Compete to build the best snowman in a storydriven winter adventure Make friends at the festival tune in to the Wham Wham Radio Station and uncover the hidden truth behind Wham Wham the Snowmanman Can you build decorate and sabotage your way to the festival grand prize,Missing,1.61,2.11,2.62,81.0,5.0,12.0
1610668800,"[5, 32, 33]",142906,Dualism,[6],A classic arcade shoot em up mixed with twinstick controls heaps of roguelike and a dab of spiritual philosophy create this addicting challenging and relentless experience where you must control light and dark to succeed Direct your evolution and embrace your dark side to break free,DUALISM is the eternal battle of good and evil right and wrong black and white opposites Its a topdown shoot em up hearkening back to old arcade and 90s console games with a few modern twists With procedurally generated waves and upgrades no two runs are ever the same allowing for countless hours of gameplay You are a rapidly evolving colorchanging dragonfly going against countless hoards of various insectoids  Youve been summoned by the god of Dualism to test your resolve where everything has been divided into two colored groups youll need to balance aggressively attacking the opposite color while absorbing similar colored shots to stay alive  Dualism is an intense shooter bullethell with an advanced upgrade system Occasionally youll be allowed to open the door to new evolutionary paths allowing you access to lightning powers bombs blasts diplomacy and even temporal abilities Defeat a few enemies and youll earn evolutionary upgrades There are over 80 unique upgrades to select from and they stack exponentially meaning youll get more and more powerful with each identical upgrade you select  Dualism Key Features  Shoot your enemies Smash your enemies with your balls Electrocute bomb blast poison slow and screw your enemies Absorb shots of the correct color and unleash a barrage of homing missiles Choose new evolutionary paths each playthrough Powerup with upgrades on those paths Get insanely powerful with upgrades that stack exponentially Take on bosses of crazy capability Meditate on the meaning of existence and your upcoming death,nan,nan,nan,nan,nan,nan
1611878400,"[31, 32]",142902,Manalith,[6],Explore a surreal and mystical island as you search for the ancient Manaliths Discover beautiful vistas secret passages and dozens of items   Walk run climb swim and glide through meadows woods jungles and caverns  Forge your own path exploring the island however you wish  Use your magic to summon mystical torches to light your way sense nearby items blast through secret walls and fasttravel across the island  Collect items that extend your stamina improve your magical abilities and more  Wander and explore at your own pace without dodging traps fighting enemies or scrounging for questionable foods,Missing,nan,nan,nan,nan,nan,nan
1611619200,"[8, 32]",142877,Dead Cells: Fatal Falls,"[3, 6, 14, 34, 39, 48, 49, 130, 169]",Gain a sharp and somewhat overprotective aerial ally as you fight through two new biomes and a boss Challenging level designs will force you to rethink your approach in this new mid game content designed to add variety to your runs and continue support for the development of the game,Missing,3.0,5.0,5.0,71.0,7.0,6.0
1611878400,"[4, 5, 15, 31]",142874,Firescout,[6],Firescout is a Single and Multiplayer Shooter Game Many Gamemodes to Play with your Friends With Randoms and with Bots Open a New World with Firescout,Missing,nan,nan,nan,nan,nan,nan
1611273600,"[30, 32, 33]",142871,Infinity Pinball,"[3, 6, 14, 34, 39]",Infinity Pinball delivers a revolutionary twist on the pinball genre  so the fun never ends Served up in a nostalgic retro style these infinitely long procedurally generated pinball tables live inside a virtual Pocket Game You can continually play your ball up up up and fall down down down the table levels for endless fun as you win coins collect unique balls and unlock new tables  Each infinite pinball table has its own original design theme soundtrack and unique bash toys Get your ball into the side pockets to change the bash toy and unlock a bonus stage where even more coins can be won  Watch your hearts as you only get 3 lives per game,Missing,0.0,0.0,0.0,0.0,0.0,0.0
1611792000,"[9, 12, 31]",142848,Immortals Fenyx Rising: A New God,"[6, 48, 49, 130, 167, 169]",As Fenyx overcome the legendary trials and challenges of the gods of Olympos to change the Greek Pantheon and fulfill your destiny,Missing,nan,nan,nan,nan,nan,nan
1611532800,"[8, 32]",142841,Celeste Classic 2: Lani's Trek,"[3, 6, 14, 82]",A Pico8 platformer about hiking around a mountain made in three days for Celestes third anniversary,Missing,0.64,0.76,0.78,73.0,20.0,24.0
1611360000,[33],142839,Root of Evil: Origins,[6],Horror Survival Youre trapped in your uncles house and you must escape,Root Of Evil  Origins is a spinoff game of the Root Of Evil series made by Red Inc Games set between sometime before Root Of Evil VR Root Of Evil  Origins takes us to an odd looking manor set in the deep forest held captive by your mysterious Uncle you have to find a way to escape,nan,nan,nan,nan,nan,nan
1611532800,"[5, 15, 31, 32, 33]",142824,D-Corp,"[3, 6, 130]",DCorp is a frantic couch coop mix of a scifi shooter and a silly management sim You and your friends juggle a turret defense system with the job of harvesting any natural resources you can find,DCorp the universe most impressive BTier salvaging company travels far and wide to recycle every planet in your local subspace  Governed by the CEO BraininaJar the company sends ships of Bitbots to scrap everything they find and bring it back to the mothership,nan,nan,nan,nan,nan,nan
1611792000,"[10, 14, 32]",142800,Zeepkist,[6],Zeepkist is a bright and colorful physics based soapbox racing game with up to 4player splitscreen multiplayer and an integrated level editor,You race down hills in a soapbox,0.0,0.0,0.0,0.0,0.0,0.0
1611792000,"[9, 32]",142798,Among Stars and Robots,"[3, 6, 14]",Lead Cubot through over 50 challenging puzzles using the commands at your disposal without getting stuck in a loop,Among Stars and Robots is a puzzle game where you control the robot Cubot with visual programming Cubot needs to navigate the tricky terrain with its somewhat limited processing power Use the commands at your disposal to design a loop of instructions that will help Cubot find its way to the exit,nan,nan,nan,nan,nan,nan
1611273600,"[9, 15, 32]",142774,Modulo,"[3, 6, 14]",Modulo is a puzzle game based on modular arithmetic that features daily challenges multiplayer and global leaderboards,Missing,nan,nan,nan,nan,nan,nan
1611273600,"[7, 31]",142746,Video World,"[6, 14, 130]",Video World is a Halloween synthpop musical about working at a video store It is a companion videogame to the EP Video World from Australian synthpop artist Monster Mansion,Video World follows teenage videostore employee Casper who has been tasked with decorating the store for a Halloween sale event After encountering a magical talking pumpkin  Jillo Lantern  and desperate to get a promotion he enlists JIlls help to use magic and music to turn the store into a Halloween wonderland,0.0,0.0,0.34,0.0,0.0,2.0
1611619200,"[9, 15, 32, 35]",142734,Lazy Chess,"[6, 34, 39]",Lazy Chess uses the chess engine Stockfish to narrow your choices down to the best two possible moves per turn The moves provided can always win the game but how strong are your decisions The board plays as a real chess game defend progress capture or castle Those new to Chess will learn creative moves and tactics and those with experience can play with speed against a worldclass neural network Compete against an AI opponent online with strangers or friends or passandplay with the person next to you,Missing,nan,nan,nan,nan,nan,nan
1611878400,"[8, 9, 32, 33]",142687,Annalynn,"[6, 130]",Annalynn is a 2D platformer made in the style of arcade games from the early 80s Collect the coins grab the bonus foods and turn the tables with blinding rubies Think youve got what it takes to go for the high score,Missing,0.88,0.92,20.0,81.0,6.0,13.0
1610496000,"[12, 31, 32]",142680,SinSeed,[6],SinSeed is a battle royale game with no time limits    An island awaits you that you will fight endlessly    A neverending battle royale game you are the only one to rule this world  Think of a battle royale game when you face off against thousands of online players and rule the kingdom you are now their worst enemy    Start with the character class thats right for you    Defeat enemies and survive on SinSeed island    Upgrade your items be the King rule the island,Missing,nan,nan,nan,nan,nan,nan
1612051200,"[9, 15, 24, 32, 35]",142676,Tanto Cuore,[6],Tanto Cuore is a Japanese deckbuilding card game which has a mechanism similar to Dominion  Each player plays as the Lord of a mansion and hires maids to fill out their house to become the King of Maids The end goal is simple enough the player who has the most Victory Points at the end of the game wins Players acquire Victory Points by employing a variety of maids and Love cards that allow for different strategies You can even employ Private Maids that stick around to use their special powers each per turn Some give you a bonus or affect your opponents in a negative way But beware your opponents can make your maids sick or give them bad habits affecting your maids in negative ways and decreasing your Victory Points,Missing,0.0,0.0,0.0,0.0,0.0,0.0
1611964800,"[13, 15, 32]",142675,Dragon Creek,[6],Ever wanted your own dragon Dragon Creek is a dragon raising simulator where every dragon is procedurally generated Enter a seed at the shrine and see your dragon come to life Care for your dragon as you train it for battle and compete in tournaments,Missing,nan,nan,nan,nan,nan,nan
1611878400,"[15, 32, 35]",142674,Big Bia,[6],This world is originated form a Big Bia with many secret waiting for you to discover Collect your heroes and minions and experience a roguelite pixel art style dungeon crawling game Challenge dungeon with different card collected through the game Welcome to a world without a Big Bang,Missing,0.0,0.0,0.0,0.0,0.0,0.0
1611792000,"[13, 32]",142672,Wobbledogs,"[6, 130]",A 3D pet simulation where you raise your own personal hive of mutating dogs physically simulated all the way down to their guts Wobbledogs is a casual and chill sandbox for players of all ages who want to care for their very own virtual pets in a surprising unique and stressfree environment,Dogs have highly variable bodies controlled by a simulated genetics system As they age they periodically enter a pupal state and physically mutate The foods they eat fill their guts with different flora just like in the gif above These flora influence the dogs mutations letting you craft and mold them to fit your own idea of canine imperfection  Dogs need a place to call home and its up to you to create an appealing habitat to help them thrive As you play youll gain access to more and more objects and decorations String together rooms and decorate them however youd like Give your dogs a relaxing place to sleep set up an maze or even cultivate a garden There are no builtin goals so you can prioritize whatever you like the most  The dogs in this game are physically simulated which adds a layer of uniqueness to almost every action they take Two dogs with separate body structures will experience the world in different ways They also have unique personality traits that influence the types of behaviors they tend to run and govern how they interact with other dogs and objects  Wobbledogs is meant to be enjoyable simply to passively observe but its also rewarding to interact with the dogs directly whether thats petting them to relieve some stress tossing a pup around to watch it tumble through the pen or helping your canine companion get free after it wriggled itself into a particularly tight space These dogs try their best but sometimes they need a bit of extra help,6.1,20.0,30.29,72.0,7.0,7.0
1611792000,"[12, 13, 31]",142671,Milkcraft,[6],Milkcraft is a multiplayer RPG social sandbox game In this mysterious world of Norse mythology you can freely build your own territory and village or start a survival adventure to challenge the dark dragon Come with Us,Missing,nan,nan,nan,nan,nan,nan
1611878400,"[5, 31, 32]",142669,Blue Flame,[6],Blue Flame is a fast paced topdown action game set in a medieval fantasy world Take the role of the last pyromancer and restore order to a kingdom in which fires only emit cold,Missing,nan,nan,nan,nan,nan,nan
1611705600,"[12, 15, 25, 34]",142667,B100X: Auto Dungeon RPG,[6],B100X is an auto dungeon RPG that you can easily enjoy during your free time With Full Auto Battle and Anything Synthesis System both easy operation and complicated capture are compatible There is also an automatic lap function so you can enjoy it even during matching of competitive games,In the world before the birth of mankind the heavens were dominated by God and the earth was dominated by demonsThe player becomes a witness who assists the apostle Holly of God and challenges the seal of the Eternal Magic Cave which is a terrifying monsters nest What is a demon What is Gods true purpose What is the relationship between the Holly Apostles and humans,nan,nan,nan,nan,nan,nan
1611792000,"[13, 14, 15, 32]",142666,Handball Manager 2021,[6],Finally state of the art handball management Prove yourself as a manager and trainer in the daily business of professional handball,Feel the pulse when your player starts the decisive throw which will make you a legend It is up to you to immortalize your favorite club and yourself as a manager and coach in national and international professional handball,nan,nan,nan,nan,nan,nan
1611446400,[12],142665,Faye/Sleepwalker,[6],FayeSleepwalker is a vast world of exploration and hectic battles Enjoy a high speed action game and the development of an interesting story in an open world,Missing,0.0,0.0,0.0,60.0,1.0,0.0
1611360000,"[4, 5, 31, 32]",142664,Moolii's Dreamland,"[6, 130]",Mooliis Dreamland is a flight shooting game of landscape mode The player would act as the little fox spirit Moolii to destroy the enemy in dream,Missing,nan,nan,nan,nan,nan,nan
1611273600,"[12, 13, 15, 31, 32]",142663,Home Behind 2,[6],Home Behind 2 is a Roguelike RPG which takes place in Scaria a country engulfed in a civil war for 10 years Lead a patchwork group of revolutionary fighters into the depths of the governments territory as you struggle to overthrow a brutal authoritarian regime,In Home Behind 2 we travel 10 years in the past to Scaria homeland of the protagonist from our previous story Ruled by Akadullah a brutal dictator citizens of Scaria are beginning to call for liberation and revolution As their voices grew louder uprisings began spreading like wildfire across the country      Banan a female college student studying abroad has decided to return to her homeland to participate in the revolution With help from Prince an eclectic agent from the Norto Republic and Haroun the disgraced son of a tribal leader will you be able to face the dangers of western Scaria Can you evade capture by Akadullahs regime and lead a revolution Scarias fate rests upon your shoulders,20.0,0.0,0.0,68.0,3.0,1.0
1611273600,"[13, 15, 32]",142662,Don't Cheat on Me,[6],Dont Cheat on me is a multiplayer game where players play as the Husband the Wife or the Neighbour trying to dominate this marriage,Missing,nan,nan,nan,nan,nan,nan
