,genres,id,name,platforms,summary,storyline,main,extra,completionist,review_score,review_count,people_polled
132,"[13, 31, 34]",119114,Aonatsu Line,[6],Tatsumi and his childhood friends Miki and Chihiro talked every day about what they would do during the upcoming summer vacation By chance they befriended the overlyhonest ojousama Yui who transferred to their school since she admired the coeducation system as well as kouhai Kotone who had failed to make lasting friendships after trying too hard to fit in This new group of five friends  began to plan for a memorable bittersweet summer vacation that happens only once in a lifetime,Tatsumi and his childhood friends Miki and Chihiro talked every day about what they would do during the upcoming summer vacation By chance they befriended the overlyhonest ojousama Yui who transferred to their school since she admired the coeducation system as well as kouhai Kotone who had failed to make lasting friendships after trying too hard to fit in This new group of five friends  began to plan for a memorable bittersweet summer vacation that happens only once in a lifetime,0.0,0.0,0.0,70.0,1.0,0.0
133,"[13, 14, 32]",118634,Golf Defied,"[6, 34, 39]",Golf Defied is a new trend in the sphere already established for many ideas both about Golf and video games We have tried to realize as much possibilities as possible on the base of Golf concept We hope that after trying the game you will most of your requirements,Missing,,,,,,
134,Missing,118484,Fantastic Fetus,[6],Fantastic Fetus is a pregnancy simulator where you are taking care of a pregnant woman and create your dream fetus The game is inspired by the Black Protest movement in Poland,Missing,0.0,0.0,0.0,0.0,0.0,0.0
135,[32],117734,Viva Mortis,"[3, 6, 14]",A fast paced isometric action game with Sinclair Spectrum inspired graphics,Missing,,,,,,
136,[31],117575,The White Diner,"[6, 14]",Missing,Missing,,,,,,
137,"[5, 31]",116968,The Glass Staircase,"[6, 14]",The Glass Staircase is a 2019 survival horror game created by Puppet Combo It is inspired by PS2 survival horror games Silent Hill Rule of Rose the Clock Tower series and Italian zombie movies Specifically Burial Grounds Nights of Terror House by the Cemetery and The Beyond,Its been a long time since youve seen your parents hasnt it Not to worry girls Just listen to the voice on the intercom Do what they say Theyve provided you a home Theyve provided you food They will make you into good girls  This old house has never treated you wrong now has it Now be good girls all of you The Master will need you to be strong during these troubling times  Remember Good girls take their medicine Good girls do their chores Good girls go home,1.84,0.0,0.0,47.0,3.0,3.0
138,[31],116921,Surface: The Soaring City - Collector's Edition,[6],Your brother is kidnapped during an air show Search for him in a beautiful world where the sky is as wide as your imagination,Missing,,,,,,
139,"[5, 31]",116800,Shadow of the Tomb Raider: The Grand Caiman,"[3, 6, 14, 48, 49, 170]",In Shadow of the Tomb Raiders new DLC a ferocious deity threatens the lives of innocent San Juan villagers To save them Lara will battle a deadly group of mercenaries in order to prevent a cataclysmic disaster Solve the new volcanic challenge tomb and reap its powerful rewards  Survive the latest DLC with the Reptile Hide outfit which heightens resistance against projectiles and boosts XP gained from assault kills Players can also equip the Whispering Scourge a suppressed shotgun as well as the Volcano skill that enables crafting incendiary shotgun ammo which sets flammable objects and most enemies ablaze All tombs from the main campaign are all now playable in Score Attack and Time Attack mode,Lara Croft reunited with Jonah Maiava in Mission of San Juan before returning to Paititi He told that some of the Trinity soldiers had found some old and set up a base camp there The ruins were built for priests of Zipacna Many people still visited ruins before the soldiers took over them Abigaile Ortiz thinks it has something to do with the tremors and ash not stopping Lara offered to go see what is going on in the ruins Lara found the Crab Relic amongst the Trinity supplies and decided to take the artefact back where it belonged It however was an ambush Trinity had set up for her Lara killed the Trinity soldiers and returned the Crab relic to the ancient machine which did stop the tremors and ash Lara then returned to Jonah and Abby to let them know what had transpired,0.74,0.83,1.01,71.0,39.0,44.0
140,"[12, 15, 16, 32]",116704,Uriel's Chasm 3: Gelshock,[6],Fear is eternal You wake up the gelatinous adrenochrome saturated subject of an ancient prophecy formulated by a brotherhood of abandoned sentient machines stuck on the cusp of an evolutionary leap,Missing,,,,,,
141,"[12, 31, 32]",116697,The Superlatives: Shattered Worlds,"[3, 6, 14]",Conquer assassins and alien invaders in Superlative London Defend Earth and negotiate interplanetary peace as you race to rescue Queen Victoria in this thrilling sequel to The Superlatives Aetherfall,Missing,0.0,0.0,0.0,0.0,0.0,0.0
142,"[13, 14, 31]",116679,Windstorm: Ari's Arrival,"[6, 48, 130]",There are many new things to discover on Kaltenbach Ranch Ride through exciting adventures on Windstorms back in this video game based on the new movie,The steed Windstorm is suffering from anxiety after surviving a fire and not even Mika is able to help him Until the feisty Ari arrives on the ranch Even though she has no experience in riding horses she quickly befriends Windstorm Mr Kaan teaches the girl how to take care of the horse and how to maintain the right posture on horseback Will Ari learn to ride as fast as her predecessor Mika Will she be able to help Windstorm become his old self What is behind the legend of the horse warrior that Mr Kaan is talking about,,,,,,
143,"[12, 32]",116581,Meccha Zombies,[6],Refreshingly knock out massive impending zombies in this new topdown shooter Clean up zombies and earn gold to boost up your skill and ability and aim for 100 area capture,Missing,,,,,,
144,"[4, 32, 33]",116563,Akuto: Showdown,"[3, 6, 14, 49, 130]",Akuto Showdown is an awardnominated isometric fastpaced action game where players compete with swords and guns in intense versus matches The game is set on low poly diorama arenas where players have to not only watch out for opponents but also for the environment from killing them,Missing,0.17,0.0,0.0,65.0,2.0,1.0
145,[32],116562,ArmZ VR,[6],Think quick but shoot quicker in this insanely dynamic wave shooter where you operate a huge battle mech Defend the city gates at all costs or else doomed creatures from the bottom of the postapocalyptic hell will break through the gates and wipe the last human habitats off the face of the earth,Welcome to a world where technology has sealed our fate and finally led to the World War Those of us who made it are now living in ruined cities behind steel gates that separate the cities from one another and from deadly creatures roaming the wastelands The only thing that stands between us and them are the remotely controlled war machines called ARMZ But no machine no matter how powerful would be of any use without YOU its operator    ArmZ VR is a hellishly dynamic wave shooter that allows you to become one with a huge heavilyarmed Battle Mech Your goal To guard the city walls against constant attacks of horrifying humanmachine hybrids Be sure theyll use all their skills weapons and wont hesitate to sacrifice their life when needed as unlike any living being theyre not driven by a selfpreservation instinct but pure will to kill,,,,,,
146,"[12, 31]",116523,Pathfinder: Kingmaker - Arcane Unleashed,"[3, 6, 14]",Theres no such thing as too much magicThis free DLC adds the following new spells to the gameCreate PitSpiked PitAcid PitHungry PitRift of RuinBattering Blast,Missing,,,,,,
147,Missing,116478,AttackNoids,[6],A review of the classic arcade Break bricks with retro style,Missing,,,,,,
148,"[15, 31, 32]",116471,Prismatic Maze,"[6, 14]",Prismatic Maze is an experimental maze game where maps maps are grown organically naturally arranging themselves into a lockandkey pattern Hidden in each maze are tools treasure and ingredients to make more complex mazes,Missing,,,,,,
149,"[31, 32]",116465,Streng Check,[6],A classic runner is waiting for you in which you will visit dangerous streets and ordeals The character is in the territory contaminated with radiation so in order to survive you will have to collect an antidote Pass the strength test and exceed your results to see the whole dangerous world of our game,Missing,,,,,,
150,[10],116383,Dirt Rally Driver HD,[6],Dirt Rally Driver HD the successful mobile game is now available in PC for free  In Dirt Rally Driver HD you take on challenging tracks from around the world Drift past various bends and whizz through your competitors Be dazzled by realistic car effects from different scenes ranging from dark terrains to snowy tracks As you approach the finishing line unleash your last minute nitro and secure your championship title Are you ready for a race of your life,Missing,,,,,,
151,"[31, 32]",116365,Standard Legend,[6],Standard Legend is a standard legend about the standard hero named Rooster who rescues a standard princess enclosed in a standard fortress fights with standard rogues standard undead and standard dragon,Missing,,,,,,
152,"[10, 13, 14, 32]",116364,Burnout Drift,[6],Are you a drift master Prove your skills in Burnout Drift,Missing,,,,,,
153,"[15, 32]",116335,TheMist,[6],The Mist is a text association decryption game The game has 8 chapters 40 puzzles which can be decrypted by associating with the text prompts of each level and combining with the current scene,Missing,,,,,,
154,[32],116333,BattleCubes: Arena,[6],BattleCubes Arena is an action shooter where the player assumes a role of a single cube set inside a virtual world of an central computer in a secret Facility,Missing,,,,,,
155,"[15, 32]",116328,Asteroid Wars,[6],Asteroid Wars is a strategy game at its core No intro no story minimal settings and just pure gameplay You have your carrier a bunch of fighters and a whole asteroid field to conquer But you are not alone,Missing,,,,,,
156,[32],116327,Recycler's Terminal,[6],To be a recycler newly recruited you have got your major assistent of recycle work the Recyclers Terminal Please use it to do your job recycle resources manufacture products trade on the market complete mission and so on,Missing,,,,,,
157,[32],116324,Brix VR,[6],A breakoutarkanoid style game designed for VR,Missing,,,,,,
158,"[13, 15, 31, 32]",116320,Future Futures - Command Z,[6],Command Z is a virtual reality gallery poised as a space for collaboration founded to engage the exponential digitization of art and its presentation Future Futures is the premier virtual exhibition,Missing,,,,,,
159,"[12, 14, 31]",116314,Lord Democrat Strikes Out!,[6],Stop a donkey politicians vengeful plot to disqualify a baseball team that rejected him,Missing,,,,,,
160,"[15, 32]",116313,Death Rpg,[6],Top Down drag  drop RPG strategy game Help 3 survivor to kill enemies in different worlds using just brains and mouse,Missing,,,,,,
161,"[12, 31, 32]",116312,都市恐怖故事,[6],A diary reveals the adventures of the protagonists unknown In the game players will follow the protagonists pace to explore all kinds of supernatural phenomena and solve all kinds of welldesigned checkpoints Come and experience this game created by a team of four,Missing,,,,,,
162,[32],116307,Legend of Traveller,[6],This is a Roguelike and card combination of the game the enemy and you as weakWho can get stronger and win faster,Missing,,,,,,
163,"[31, 32]",116300,The Rift,[6],A short platforming game about self sacrifice,Missing,,,,,,
164,"[12, 31]",116291,阿津,[6],Missing,Missing,,,,,,
165,[32],116287,Shadow Runner,[6],Shadow Runner is a speedrunoriented platformer where you can use classical gameplay mechanics like dashing or double jumping as well as more complex ones like the ability to switch between light and shadows as your character cannot stay in both,Missing,,,,,,
166,[32],116286,Frank and 10 roots,[6],Frank and 10 Roots  a challenging isometric platformer Put both your abilities and nervous system to the test,Missing,,,,,,
167,"[31, 32]",116284,Pilot Unknown,"[6, 14]",Pilot Unknown launches the roguelike into space This bullet hell shooter consists of equal parts action and mystery Hone your piloting skills to take down enemies hone your strategic plan to take down the dungeon You will need both to survive in Pilot Unknown,Missing,,,,,,
168,[32],116283,BlueGlow,[6],BlueGlow is an arcade like top down shooter You play as the blues on a mission to destroy the reds as you go through several maps and gamemodes Utilize 7 guns from your arsenal all with different traits to blow through the enemy,Missing,,,,,,
169,[32],116275,Becoming a Dandelion Spore,[6], Drag your mouse in the direction of the wind  The flower will fly in the drag direction  Please go to the end  If a conflict occurs start over,Missing,,,,,,
170,"[31, 32]",116269,Gray Memory,[6],Gray Memory is an instant entertainment gameThere are various traps and buttons in the game You have to solve these traps to get to the next level This game has the characteristics of adventure and puzzle It will help to develop your brain,Missing,,,,,,
171,[32],116265,Dodge Bubble,[6],Dodge bubble is a casual survival game where the aim of the game is to not get popped,Missing,,,,,,
172,"[9, 31, 32]",116262,Oops!!! Puzzles!!!,[6],We offer you a puzzle game The meaning of the game  making a mosaic pattern that you want to add up from a variety of fragments of different shapes The greatest interest in this game will cause thrillseekers as it contains scary pictures horror,Missing,,,,,,
173,"[13, 32]",116253,Dark Forest Virtual Chatroom,"[3, 6, 14]",Explore an abandoned virtual chatroom Befriend the bots who live there End a world,Missing,,,,,,
174,Missing,116248,Raid on the Ruhr,[6],Time to blow up some Dams Fly and shoot your way through the rivers of the Ruhr Valley while reliving this incredible feat of daring brilliance and skill,Missing,,,,,,
175,[32],116247,Piczle Lines DX+α,[6],Superaddictive logicpuzzle hit game Piczle Lines DX finally available in its ultimate form,Missing,0.0,22.0,0.0,0.0,0.0,1.0
176,[31],116233,Picross Hansel and Gretel - Nonograms,[6],200 Japanese crosswords that you just cant put down,Missing,39.08,0.0,0.0,0.0,0.0,1.0
177,"[12, 31]",116226,1vs1: Battle Royale for the throne,[6],Enjoy the exciting story of the confrontation of the crown princes in they battle for the throne Complete the test in the ancient temple caves to prove your right to the royal throne,Missing,,,,,,
178,"[31, 32]",116225,Helltower,[6],Helltower is a challenging retro style action platformer Ascend the tower to discover the fiendish traps and gruesome creatures lurking above Can you get to the top,Missing,,,,,,
179,"[31, 32]",116224,Delirium VR,[6],A VR exclusive horror game where you wake up in an eerie abandoned home and discover what insanity prevailed over its history as you uncover the remnants of its past inhabitants Jon and Anna,Missing,,,,,,
180,[32],116221,Robot King Part 2: Boss Battles,[6],The second in a 3 part series Robot King Part 2 continues the journey of a robot on a quest to find his place in a kingdom where everyone seems bent on his destruction Robot King 2 Boss Battles is as the name indicates a series of boss battles,Missing,,,,,,
181,[32],116217,Royale Storm Bowling,[6],Flick  target carefully to save the world,Missing,,,,,,
182,"[12, 31, 32]",116216,The Scuttle,[6],Sail the Caribbean laying siege to naval forts in this short pirate adventure Enhance your galleon lead your crew into battle and maybe drink a little rum along the way,Missing,,,,,,
183,Missing,116210,Pictopix: Mosaics,[6],Missing,Missing,,,,,,
184,[31],116208,Jungle Defence,[6],I came to the jungle to catch Igras I want you to catch 10 Igrass You have to use a variety of magic weapons,Missing,,,,,,
185,[32],116199,Akashicforce,[6],Akashicforce is a puzzlegamelike rhythmgamelike game where you input commands to use moves like in a fighting game The goal is to crush your opponent to a pulp with an immense amount of blocks,Missing,,,,,,
186,"[13, 32]",116189,Hotdog Man,[6],This is a recreational puzzle game,Missing,,,,,,
187,[32],116186,Amaze: Easter,[6],Amaze Easter is a straightforward and surprisingly  difficult celebration of the simple beauty of the maze with Easter art and calm soundtrack,Missing,,,,,,
188,"[15, 31]",116182,Dimense: Chapter 1,[6],After a series of oddity that has been disrupting your sleep you awake one night in an unknown environment that resembles a morgue Warped into an unknown world you strive hard to appease the unspeakable horror trying to find your way out without losing your life,Missing,,,,,,
189,"[12, 15, 32]",116178,Legend of Cina,[6],A SRPG game made from SRPG Studio,Missing,,,,,,
190,"[13, 14]",116171,VireFit,[6],LOAD THE WORLD OF GREAT SPORT Box tennis and basketball try it in virtual reality Get ready for the real training practice strikes and throws develop agility and accuracy set records and compete with friends,Missing,,,,,,
191,[10],116170,Sword Defense,[6],Sword Defense a 3D Chinese style action and leisure game The main content is to cut off all kinds of weapons constantly flying out on the screen It requires players to move quickly and accurately and have endless modes to challenge you,Missing,,,,,,
192,[32],116167,Scuos,"[3, 6]",Scuos is a puzzle game where you need to reproduce patterns from one board on another How many levels can you pass,Missing,,,,,,
193,"[31, 32]",116141,Dead Cells: Rise of the Giant,"[3, 6, 14, 39, 130]",Two new levels two new bosses and stacks more content to explore and unlock If youre good Real good The most challenging installment to the game since we first threw down the gauntlet Kill Die Learn Die some more,Missing,3.0,4.5,8.0,74.0,7.0,4.0
194,[31],116134,The Wizards: Enhanced Edition,"[6, 165]",Become a powerful Wizard and take fate into your own hands Immerse yourself in a beautiful fantasy world and destroy your enemies by casting spells with hand gestures,The Wizards is an awardwinning actionadventure VR game with an unique system of casting spells with hand gestures and acclaimed narration and voice acting by Jason Marnocha  The Enhanced Edition comes with new content and mechanics as the result of many months of hard work to implement everything our players wished for It introduces a brand new level and cutscenes checkpoint system character customization improved performance and many more,,,,,,
195,"[8, 25, 31]",116129,Zero Deaths,"[6, 14]",A postapocalyptic actionadventure about Felixs resurrection from the ashes of the SubBot War of 2019,Missing,0.0,0.0,0.0,60.0,1.0,0.0
196,"[31, 32]",116121,Icesolation,[6],Icesolation is a highly challenging twoplayer local cooperative puzzle and exploration game for VR A pair of researchers were investigating an old topsecret Soviet expedition deep in Siberia when one of them got trapped inside a mysterious mine They must now work together to find a way back outside,Missing,,,,,,
197,"[31, 32]",116120,The Walsingham Files: Chapter 1,"[6, 14]",From the makers of theSilver Creek Falls trilogy comes a new episodic mysteryadventure game series known as The Walsingham Files Follow in the steps of the stalwart Detective Sara Fitzgerald as she tackles a new mindboggling mystery that will keep you at the edge of your seat at all times,Missing,,,,,,
198,"[15, 32]",116116,Goddess of Math,"[6, 14]",This is an actionpuzzle game Find your way to pass the levels A lot of mathematical elements are integrated in the puzzles,Missing,,,,,,
199,"[15, 32]",116113,弹幕那个恶人,[6],Missing,Missing,,,,,,
200,"[13, 32]",116112,细胞战争,[6],Missing,Missing,,,,,,
201,[32],116109,Final Sim,[6],Welcome to the Final Simulation a simulation catered to your fears Short and Shocking Simply complete it to win,Missing,,,,,,
202,[31],116108,Dark Romance: Hunchback of Notre-Dame - Collector's Edition,[6],Can you save the city from the dangerous criminal Quasimodo,Missing,,,,,,
203,[32],116101,Song Animals,[6],A surreal journey of strange animals through handpainted watercolour worlds set to a relaxing soundtrack,Missing,,,,,,
204,Missing,116099,Pokris,[6],A combination of poker and a certain falling blocks game Match cards into pairs straights flushes and more as they drop from the top Beat your high score before the board fills up,Missing,,,,,,
205,[32],116096,Uuu Ska so Smislom,[6],Uuu Ska so Smislom is a simple yet challenging and addictive game It can be played within few seconds anytime to refresh your mind Create your own block puzzle game with this template within few minutes,Missing,,,,,,
206,"[12, 15, 31, 32]",116095,The Secret of Gillwood,[6],The Secret of Gillwood is a single player game set in a dark and mysterious linear world The player takes control of the most faithful Guardian of the gods Your mission is to help the gods of Gillwood to uncover the mystery that suddenly silenced the town,The gods dont hear the prayers of Gillwood so its now up to you to find out whyThe Secret of Gillwood is an single player game with a small open world set in a dark and mysterious world The player takes control over the most faithful Guardian of the gods,,,,,,
207,"[31, 32]",116094,Hard Light Vector,[6],Hard Light Vector is a firstperson action platformer where you traverse an alien environment and fight to protect the memories of the dead from corruption,Missing,0.9,0.0,0.0,60.0,1.0,1.0
208,[32],116091,Bowling Over It,[6],Bowling to the top never stop,Missing,,,,,,
209,[32],116088,NiHonGoToKi,"[3, 6, 14]",NiHonGoToKi helps you learn Japanese by turning boring study into a fun game Memorizing the difficult Japanese alphabets has never been this easy with fun puzzles and challenges to test your brain,Missing,,,,,,
210,"[31, 32]",116087,BreakFest,[6],Play as Waltynn a waffle from the planet Hekta who lost control of his spaceship and crashed on the planet Lylo Help him survive and escape the planet As you explore the planet you realize that youve landed right in the middle of a Apocalypse,Missing,,,,,,
211,[32],116086,Extinction: Alien Invasion,[6],Annihilate waves of aliens build your base improve your mercenary do it all with a sound track bathed in rock Extinction Alien Invasion is an arcade shooter with elements of RPG inspired by games like Shadowgrounds Alien Breed and Alien Swarm,Missing,,,,,,
212,Missing,116084,Human Pinball: Iceage,"[3, 6, 14]",ImmersiveGames brings youHuman Pinball  Iceage,Missing,,,,,,
213,"[31, 32]",116079,Night Catcher,[6],You are the cop who fell asleep in his office Waking up you learn of some psychopath who craves for your death and informs of this through notes Try to get out of the police station avoiding meeting the robot guard,Missing,,,,,,
214,"[12, 15]",116074,You Versus 27 Elves,"[6, 14]",Fight your way through 27 unique elves in a journey that will bring you happiness to your wits end and maybe even to tears As you learn more about these thankless slaves who now wish to conquer the Earth theres only one question you need to ask yourself Will you be the hero the world needs,Missing,,,,,,
215,[32],116073,EggFight,[6],Welcome to EggFight This is a game of fighting other eggs and accomplishing your mission first Use various weapons to crash and disturb the other eggs,Missing,,,,,,
216,[32],116072,Chill II,"[3, 6]",Chill is a puzzle game with relaxing music Find a way out of a Maze with 5 levels of difficulty Enjoy minimalist puzzle game while listening to calm music,Missing,,,,,,
217,"[5, 32, 33]",116069,Gyro Boss DX,"[6, 130]",Dodge an endless assault of weapons as you orbit around the boss on a fixed circle its not as easy as it looks Can you secure bragging rights as the best space pilot to bite the dust against the alien menace,Your home planet is under siege from a band of intergalactic pirates led by the fiendish Gyro Boss  Unfortunately your technology is no match for this deadly beast and his crazy weapons Every game is doomed from the start but youll fight with honour to complete your mission objectives and achieve the best possible score  Dodge an endless assault of weapons as you orbit around the boss on a fixed circle its not as easy as it looks Can you secure bragging rights as the best space pilot to bite the dust against the alien menace,0.0,3.0,0.0,60.0,1.0,1.0
218,"[9, 15, 32]",116064,Bunny Parking,"[6, 48, 49]",Unsual 3d parking puzzle with kicking mechanics Kicking is fun Kick a car from the parking lot alone or with friends And dont think that it will be easy,Missing,0.0,0.0,0.0,50.0,1.0,0.0
219,"[31, 32]",116058,Auf Abwegen,"[3, 6]",Explore the beauty and dangers of nature in this narrative minipuzzleplatformer  a oneman project from Kindman Slip into the role of a red fox in its natural habitat  feed your family and survive the threats of the forest  and humans too,Missing,0.62,0.0,0.0,0.0,0.0,1.0
220,"[31, 32]",116049,Spark of Light,[6],Help Nerow bring back the light to his magical world and search for hidden fireflies that guide him through the darkness Solve the mysteries of the stolen light together with Nerow on a magical journey to rescue the Sunbug and restore the natural balance,Missing,,,,,,
221,"[13, 32]",116047,VehiCraft,[6],This is a vehicle sandbox crafting game that you can build different ground vehicles to fight other vehicles This game gives the maximum freedom for object placement and customisation for your vehicle,Missing,,,,,,
222,"[12, 32]",116043,Grand Battle,[6],In this intense fully featured Action RPG players fight with multiple heroes to save the world And sometimes they chill and do some crafting,Missing,,,,,,
