first_release_date,genres,id,name,platforms,summary,storyline,rating,main,extra,completionist,review_score,review_count,people_polled
1259107200,"[9, 31]",5514,Mystery Case Files: Dire Grove,"[6, 14, 37, 39]",Mystery Case Files Dire Grove is an interactive movie puzzle adventure game developed by Big Fish Studios and distributed by Big Fish Games It is the sixth installment in the Mystery Case Files series The game is available exclusively at Big Fish Games website The Mystery Case Files franchise is the number one brand in casual games and has sold more than 25 million units to date,This story takes place directly after the events in Mystery Case Files Return to Ravenhearst The player is driving through a decrepit town called Dire Grove which appears to be deserted The weather forecast has predicted a heavy snowstorm and the player has no other option but to explore the deserted town for shelter The player sees an abandoned car and finds a camcorder in it The footage shows a teenaged girl crying and pleading the player to save them The player also finds a cryptic note She is real The legend is real As the player explores the surrounding they realize that all the villagers have evacuated due to the snowstorm so the player has to do everything by themself The player learns that the girl in the footage is Alison Sterling a collegiate who has chosen the Celtic legend of the Banshee as a subject for research She arrived here with 3 friends and all four of them are missing The player also learns that Dr Patricia Anderson an archaeologist had unearthed some relics only some days ago The player eventually learns about the legend of the Banshee Apparently a farmer a fisherman a hunter and a blacksmith performed a ritual 1000 years ago to open a portal to talk to their kin in the spirit world When the dead started attacking the living they offered a young woman to appease the ghosts and close the portal This woman became the Banshee and is trying to come back The player also find that all the students have been subdued and hypnotized by the Banshee Dr Andersons recording proves that the relics unearthed by her are maybe the keys to the portal The player is left with only one option open the portal and send the Banshee back to the spirit world Only after opening the portal the player realizes that the Banshee has tricked them into freeing her spirit The player races against time trapping the Banshees spirit again and saved the students In the end Alison gives a lecture about the events at Dire Grove where she is given by a big applause by a huge number of audience including her friends An audience member asks her about your identity but she says That person has asked to remain nameless but I can give you their business card She flashes a card and a Mystery Case Files logo is seen and the credits start rolling,93.73493975903614,4.76,0.0,6.37,60.0,3.0,3.0
1258329600,"[11, 13, 15, 32]",6256,Gratuitous Space Battles,"[3, 6, 14]",Who needs backstory Who needs resourcegathering Diplomacy is so last year Gratuitous Space Battles cuts right to the chase of scifi strategy games and deals with large completely unjustified space battles between huge opposing space fleets,Missing,92.89934557304952,2.77,6.38,14.62,59.0,26.0,22.0
1258416000,"[8, 31]",127,Assassin's Creed II,"[6, 9, 12, 14, 39]",Discover an intriguing and epic story of power revenge and conspiracy set during a pivotal moment in history the Italian Renaissance Experience the freedom and immersion of an all new open world and mission structure with settings such as the rooftops and canals of beautiful Venice Your options in combat assassination and escape are vast with many new weapons settings and gameplay elements,The lineage continues as this new chapter introduces Ezio inheritor of the talents and creed of the Assassins His family murdered by rival families Ezio resolves to learn the ancient art of the Assassin in order to seek revenge He will not do so alone though allying with historical figures such as philosopher and writer Niccolò Machiavelli You will also be able to master the art of the assassin with all new weapons and instruments created by the renowned inventor and genius of the Renaissance Leonardo Da Vinci himself,87.10445528606596,19.18,26.17,35.08,83.0,3760.0,4658.0
1257206400,[12],76,Dragon Age: Origins,"[6, 9, 12, 14]",Dragon Age Origins is a thirdperson roleplaying game described as a spiritual successor to Baldurs Gate and Neverwinter Nights franchises Players create their own character by customizing gender and appearance as well as choosing a race and class Combat is in real time with the ability to pause at any moment tactical options include an editor which allows the player to give the AI detailed instructions on how to behave in every possible situation Although the main storyline is the same for every character created the game features six unique prologues two for each race Dragon Age Origins received critical acclaim upon release with praise mostly directed at its story setting characters music and combat system,Set in the fictional kingdom of Ferelden during a period of civil strife the game puts the player in the role of a warrior mage or rogue coming from an elven human or dwarven background The player character is recruited into the Grey Wardens an ancient order that stands against monstrous forces known as Darkspawn and is tasked with defeating the Archdemon that commands them and ending their invasion,86.56875355942321,40.33,58.5,86.97,86.0,1258.0,1866.0
1258416000,[5],124,Left 4 Dead 2,"[3, 6, 12, 14]",Left 4 Dead 2 is a cooperative firstperson shooter video game the sequel to Valve Corporations Left 4 Dead The Game builds upon cooperatively focused gameplay and Valves proprietary Source engine the same game engine used in the original Left 4 Dead Set during the aftermath of an apocalyptic pandemic Left 4 Dead 2 focuses on four new Survivors fighting against hordes of the Infected who develop severe psychosis and exhibit zombielike tendencies The Survivors must fight their way through five campaigns interspersed with safe houses that act as checkpoints with the goal of escape at each campaigns finale,Missing,81.88601514590815,9.96,25.42,56.62,80.0,1430.0,878.0
1258588800,"[12, 15, 16, 31]",5042,King's Bounty: Armored Princess,"[6, 14]",This new world of Kings Bounty Armored Princess is full of mysteries and dangers The new character the Princess will encounter horrible creatures huge monstrous bosses and a new race the bloodthirsty Pangolins As in the multiaward winning game on which this expansion is based the player has many options to resist these new enemies Various new skills and characteristics of Amelie as well as her chance to fly will help her overcome the hordes attacking the kingdom The Princess is also accompanied by a tamed dragon at the very beginning small and amusing but its abilities develop steadily until it becomes an incredible ally He will do his best to protect the Princess during the battles starting with easy blows and treasure hunting and finishing with battle rage and volcano summoning,Kings Bounty Armored Princess begins 10 years after the previous title with the world of Darion being almost completely overrun by hordes of demons In a lastditch effort to obtain assistance for a besieged kingdom a powerful spell is cast which opens a portal to another world the world of Teana Playing as Princess Amelie the player ventures through this portal in search of the legendary knight Sir Bill Gilbert Upon arriving in this alternate world Bill Gilbert is nowhere to be found but the inhabitants provide a number of their own quests including a search for eight magical stones with the powers of the gods,81.87624188416505,28.25,45.01,73.92,81.0,50.0,53.0
1257811200,[5],559,Call of Duty: Modern Warfare 2,"[6, 9, 12, 14, 20]",Call of Duty Modern Warfare 2 is a firstperson shooter video game developed by Infinity Ward and published by Activision for the Xbox 360 and PlayStation 3 video game consoles and the Microsoft Windows operating system Officially announced on February 11 2009 the game was released worldwide on November 10 2009 It is the sixth installment of the Call of Duty series and the direct sequel to Call of Duty 4 Modern Warfare continuing the same storyline with Call of Duty Modern Warfare 3 set to end the storyline,Despite the efforts of the US Marine Corps and British Special Air Service in the previous game the Ultranationalists seize control of Russia and declare Imran Zakhaev a hero and martyr erecting a statue of him in the heart of Red Square This strains diplomatic relations with the United States Meanwhile Vladimir Makarov one of Zakhaevs former lieutenants begins a campaign of revenge for his death by committing acts of terrorism over the course of five years,81.70306778412753,6.62,10.11,30.61,81.0,2077.0,1850.0
1258070400,"[8, 10, 14, 32]",10472,Jet Car Stunts,"[6, 9, 12, 34, 39, 46, 48, 49, 74]",Race as fast as possible master the most difficult stunts and drive the Jet Cars like no other Jet Car Stunts is a different breed of racing game and a remake of the iOS game of the same name Master difficult stunts set the fastest times and let your Jet Car Stunts skills shine Are you good enough to master all the tracks with elegance or will you get left behind,Missing,80.0,5.33,0.0,8.25,65.0,8.0,6.0
1258934400,"[7, 8, 32, 33]",6777,The Impossible Game,"[3, 6, 9, 12, 14, 34, 38, 39, 46, 74]",The superaddictive and very very hard platform game finally arrives on Steam  its quite possibly the worlds hardest game As well as five classic Impossible Game levels this desktop version includes an EXCLUSIVE new Level Editor,Missing,79.92102293259124,1.88,4.16,5.72,65.0,28.0,25.0
1257206400,"[12, 25, 31]",19637,Star Wars: The Force Unleashed - Ultimate Sith Edition,"[6, 9, 12, 14]",The story and action of Star Wars The Force Unleashed expands with the release of Star Wars The Force Unleashed Ultimate Sith Edition a special new version of the game that will show gamers the deepest darkest side of the Force in a story that puts them on a collision course with Luke Skywalker himself  The Ultimate Sith Edition includes all of the original missions found in Star Wars The Force Unleashed as well as content previously only available via download and an allnew exclusive bonus level  Star Wars The Force Unleashed completely reimagines the scope and scale of the Force and casts players as Darth Vaders Secret Apprentice unveiling new revelations about the Star Wars galaxy seen through the eyes of a mysterious new character armed with unprecedented powers,Missing,77.2118775361694,8.16,11.37,16.34,69.0,293.0,385.0
1258329600,"[12, 13, 15, 31]",898,The Sims 3: World Adventures,"[6, 14, 39]",The Adventure is near Take your Sims on the adventure of their lives with The Sims 3 World Adventures the first expansion pack for The Sims 3 Guide your Sims to acclaimed fortune  or potential doom Take your Sims to exotic destinations to hunt for hidden treasures Uncover new skills experience new personality traits and garner rewards if your Sims succeed Explore ancient tombs in the pyramids of Egypt master martial arts in the Far East and discover rich culture and famous landmarks of France Adventure is on the horizon  what will your Sims discover,After creating your ideal Sim house and family theres only one thing left to do expand your horizons Leave your humble home using The Sims 3 World Adventures to explore an exciting new country  Following the lead of other vacation expansions for The Sims World Adventures lets you cut loose and enjoy three brand new locations Egypt China and France are awaiting your arrival and each country has a new set of skills for your Sims to learn  Visit the pyramids of Egypt and learn all about photography as you explore ancient artifacts the game will actually switch to a first person pointofview so you can snap pictures Study martial arts in China honing your skills for upcoming tournaments And the beauty of France is a site to behold where youll learn how to make sweet nectar But as the title says this game is all about adventure and various quests are linked together by a main story Your expeditions can range from exploring tombs avoid the mummies theyll curse you to collecting valuable treasures That photography skill will come in handy as you capture each and every breathtaking moment,76.11241859789247,0.0,20.0,0.0,71.0,8.0,1.0
1259107200,[10],6947,Crash Time III,"[6, 12]",Like its predecessors Crash Time 3 the new installment of the wellknown action racing game series offers varied gameplay in top quality The German game forge Synetic has once more taken the graphics engine a significant step further,Missing,75.96383408051004,6.21,9.45,14.88,64.0,5.0,18.0
1259020800,"[5, 32]",13180,Serious Sam HD: The First Encounter,"[6, 12]",Serious Sam HD The First Encounter is a visually upgraded and fully Steam supported remake version of the original highadrenaline singleplay and 16player cooperative arcadeaction FPS,In ancient times Earth was involved in a massive conflict between Mental an evil extraterrestrial being who wants to rule the universe and the Sirians a technologically advanced sentient alien race that left many of its artifacts to be discovered by humanity In the 22nd century Mental and his army of grotesquely twisted monsters return to Earth intending to destroy humanity The humans are quickly overwhelmed and driven back to Earth As a last resort humanity uses the TimeLock This mysterious Sirian artifact contains the power to transport a single person back to a chosen point in time Because of his bravery in fighting these monsters Sam Serious Stone is chosen to use the TimeLock in hopes that he will defeat Mental and change the course of history,75.00029213167151,6.2,8.36,16.65,73.0,266.0,372.0
1259193600,"[2, 9, 12, 31]",13228,Runaway 3: A Twist of Fate,"[6, 20, 39]",Runaway A Twist of Fate is a pointandclick graphical adventure It is a game developed by Péndulo Studios SL and the sequel of Runaway 2 The Dream of The Turtle as well as the third and final chapter in the Runaway series,The story begins as an incomplete continuation of the previous chapter It starts out with Gina attending Brians funeral and it is noted that she is the only mourner in sight  Introduction The introduction shows the eye of a crow fading out to show Brians funeral where there are only four people a priest who is speaking in Latin Luane who is the cemeterys manager Ernie who is the Happy Dale Mental Hospital security guard and Gina Brians girlfriend This scene is spliced with flashbacks to a trial where Brian is accused of apparently killing General Kordsmier but due to a case of amnesia he is deemed insane and locked away in a mental institution  Chapter 1 Brian Basco is Dead After the funeral has ended Gina receives a call from Brian who tells her to save him because hes trapped in his own grave He ends the call because his battery is very low Just before the battery dies he sends a message to Gina  Chapter 2 The Art of Running Away Gabbo a friend of Brians from the asylum tells Gina the story about how Brian escapes Gabbo tells Brian a plan but Kurgan steals the plan and runs off to use it himself With a bit of improvisation Brian overcomes these obstacles but stops partway through the escape as he finds Kurgan decapitated  Chapter 3 A Timely Suicide In a cabin out in the woods Gina helps a psychologist investigate the death of a witness that would have exonerated Brian His death had been ruled a suicide  Chapter 4 An Unexpected Ally The story of Brians escape resumes as we learn how he plans on using Kurgans body to look like his own  Chapter 5 Deconstructing Brian We finally learn some of what happened between the ending of Runaway 2 and the opening of this game Also Gina gets tied up as Tarantula catches up with her  Chapter 6 The End is Here Brian comes up with a plan to defeat Tarantula and her goons exonerate himself and rescue Gina The series is brought to a fitting ending,72.47713164179345,nan,nan,nan,nan,nan,nan
1259020800,"[5, 12]",13913,Borderlands: The Zombie Island of Dr. Ned,"[6, 9, 12]",Zombie Island of Dr Ned is DLC for Borderlands,Missing,70.00850248380418,nan,nan,nan,nan,nan,nan
1258675200,"[12, 32]",16339,Avernum 6,"[6, 14, 39]",Avernum is one of the great tales of indie gaming an epic series of fantasy roleplaying adventurers set in an enormous subterranean nation Avernum is a land underground a subterranean nation full of rogues misfits and brigands struggling for survival and wealth in the monsterinfested darkness Avernum 6 is the final chapter in the Great Trials Trilogy three games that tell the tale of your weary lands final destiny,Missing,70.0,0.0,63.42,65.8,70.0,1.0,3.0
1257465600,"[12, 31]",13162,Konung III: Ties of the Dynasty,[6],Konung III is a RPG based on the Scandinavian and Slavic mythology the third game in the Konung series Konung Legends of the North and Konung 2 Blood of Titans The new game brings the player back to the legendary Woodland  the unique and spacious fantasy land that combines parts of known history with classical myths of the Slavs the Scandinavian and the Byzantine as well as the legends of the Chronicles including immortal heroes magical artifacts and ancient sorcery world The Era of Titans the almighty rulers of the Earth has ended Once glorious heroes and great Princes are gone for good The hour of new heroes has come when the throne of the Grand Principality became empty,Missing,70.0,nan,nan,nan,nan,nan,nan
1259020800,"[11, 12, 15]",2038,King Arthur: The Role-Playing Wargame,[6],Critically praised by reviewers and gamers alike King Arthur was received as one of the biggest surprises to emerge on the gaming scene in 2010 Now the FantasyRoleplaying RTS returns in a sequel set to push the boundaries of the genre even further Our story begins long after young Arthur pulled the enchanted sword out of the stone united the wartorn land of Britannia gathered the Knights of the Round Table and secured peace in Camelot aided by the might of the Holy Grail Where legends normally end King Arthur II begins on its own gruesome tale,Missing,69.90921740215673,35.64,46.78,60.27,76.0,8.0,14.0
1257379200,"[12, 31]",17462,Dragon Age: Origins - The Stone Prisoner,"[6, 9, 12]",Download The Stone Prisoner and gain access to Shale a mighty stone golem who can join the party and travel throughout Dragon Age Origins One of the most powerful characters in the game Shale comes with a rich back story extensive voice acting and a unique follower quest to explore The Stone Prisoner also includes new environments items and hours of additional gameplay that adds to the Dragon Age Origins campaign,The darkspawninfested village of Honnleath holds a secret the forgotten stone figure at the towns heart is no statue but a powerful golem frozen in time Recruit the creature to unlock its power and mysterious past,69.59746408322682,nan,nan,nan,nan,nan,nan
1257206400,"[12, 31]",17466,Dragon Age: Origins - Warden's Keep,"[6, 9, 12]",Some claim the fortress of Soldiers Peak is corrupted and overrun by demons Others whisper of betrayal and the spirits of murdered Grey Wardens Whatever the truth Soldiers Peak is no place for the living  Relive the darkest hour of the Grey Wardens with allnew content that adds to the main Dragon Age Origins campaign This downloadable adventure reveals secrets hidden for generations and includes unique achievements unlockable character abilities powerful items and much more  New quests  discover what really happened to the Grey Wardens of old and what led to their expulsion from Ferelden  New features  a base of operations with party storage Inventory full Stash new items as well as loot from the main Dragon Age Origins campaign  New items and abilities  talents and spells from the Power of Blood school unique achievements and powerful items including a set of Grey Warden Commander armor,Centuries before the events of Dragon Age Origins the Grey Wardens of Ferelden took up arms against their kingdoms rulers This tumultuous event led to the expulsion of the Grey Wardens from Ferelden leaving their ancient fortress of Soldiers Peak to the ravages of time This downloadable content provides the Warden with an opportunity to aid Levi Dryden in redeeming his family name by proving that Sophia Dryden his great great grandmother and commander of the Grey Wardens at Soldiers Peak acted honorably,66.9641456819326,nan,nan,nan,nan,nan,nan
1258416000,"[8, 9, 31]",138,LEGO Indiana Jones 2: The Adventure Continues,"[5, 6, 9, 12, 14, 38]",LEGO Indy is back in his biggest adventure yet Battle through all four movies including allnew levels from the original adventures and your favorite new moments from The Kingdom of the Crystal Skull or in true LEGO fashion get creative and build your own levels to play with friends  New modes including twoplayer dropin dropout splitscreen gameplay lets you play together with your friends and family like never before,Missing,65.95026203315552,10.18,17.86,21.62,66.0,174.0,146.0
1257206400,"[11, 12, 15]",24277,SpellForce: Platinum Edition,[6],Includes the original SpellForce The Order of Dawn and both the expansions  SpellForce The Breath of Winter and SpellForce Shadow of the Phoenix,Missing,60.0,64.28,125.94,175.3,73.0,18.0,26.0
1258070400,"[2, 31, 32]",26208,15 Days,[6],A threeman activist group has set out to make the world a better place by stealing famous pieces of art in the worlds most renowned museums selling them to private collectors and donating the money to charity    Though hunted by police forces the group manages to stage one successful coup after another  until one day a mysterious new client appears and the group finds itself in the middle of a political conspiracy,Missing,50.0,6.5,7.25,12.27,48.0,10.0,11.0
1257811200,"[11, 13, 15, 24]",16151,Ironclads: High Seas,"[3, 6]",For over a year the forces of the United States of America Northern States and the Confederates States of America Southern States have fought a bitter war In 1862 the governments of Great Britain France and Spain recognize the Southern States to secure raw materials The Souths economy becomes dependent on trade with Europe The Northern Government imposes a complete blockade of shipping to the South The Confederate Government buys warships from the European powers to protect its trade This sets the stage for a naval conflict for control of the Confederates trade routes Choose a side build a fleet and destroy the enemy,Missing,50.0,0.0,0.0,0.0,0.0,0.0,0.0
1259280000,"[10, 13]",10769,Rig'n'Roll,"[3, 6]",Players will step into the shoes of a young man in the year 2014 as he arrives in California to pursue his dreams of road domination and capture the Californian cargo transportation market,There are miles of highways to conquer and cities and towns to reach as he becomes the greatest trucker on the highways RignRoll is a sequel to the famous Hard Truck series This time the game world is truetolife Gamers can race highpowered Semis along thousands miles of real Californian roads visiting SanFrancisco to San Diego San Jose to Los Angeles RignRoll delivers players the ultimate truck driving experience with authentic models of trucks and their interiors completely new physics and astonishing 3D graphics among numerous features  Players will outrun their opponents to deliver cargo on time or take part in truck races to prove their professional skills giving them the opportunity to improve their rating and authority among other drivers RignRoll also gives gamers an opportunity to test their management skills as they establish their own cargo transportation company Players will recruit staff and hire other drivers to work for them as they expand their business and eliminate their competitors from the transportation market Apart from being the most accurate and innovative truck driving simulation game ever produced RignRoll immerses players in an exciting story with an unexpected finale making new allies and battling treacherous foes as they discover a conspiracy that will test their skills to the limit,50.0,nan,nan,nan,nan,nan,nan
1258502400,"[9, 12]",10385,Gyromancer,"[6, 12]",A new puzzleRPG developed in collaboration between Square Enix and PopCap Blending puzzle elements from Bejeweled Twist with the RPG mastery of Square Enix Gyromancer is an allnew experience that defines the puzzleRPG genre  See for yourself what shocking truths lie in wait within the bewitching Aldemona Wood,The rebel faction Temperance has launched a surprise attack on Count Laertes a member of the kingdoms ruling elite Both the Count and Countess are dead and their son Everett boarded at another manse has gone missing Summoned by royal decree the magician Rivel Arday sets out after Temperance Together with Laska the ranger he ventures into Aldemona Wood,50.0,17.97,24.56,32.43,57.0,10.0,18.0
1259193600,"[5, 24]",564,Rogue Warrior,"[6, 9, 12]",Rogue Warrior is a characterdriven firstpersonshooter featuring Richard Demo Dick Marcinkos explosive personality in an actionpacked single player campaign and intense multiplayer combat,Missing,47.53695518830193,2.26,3.26,5.74,32.0,94.0,120.0
