first_release_date,genres,id,name,platforms,summary,storyline,rating,main,extra,completionist,review_score,review_count,people_polled
851990400,"[2, 31]",145694,In the Intrigue of the Ratings,[6],A title which focused on the incompetent detective Elimelech Egoz voiced by Moshe Ferster who goes on holiday at the fictional Nofei Hadera Hotel only to be greeted by a bizarre murder case The game contained intertextuality inside jokes irony and cynicism In the Interest of Ratings received negative reviews in the press including in Internet Captain קפטן האינטרנט the technologymultimedia branch of the leading Israeli newspaper Haaretz however it received positive reviews in youthoriented newspapers Ultimately the game was relatively popular though it was not financially successful But it led the duo to decide to try to develop a second video game which would become Piposh under their new development company Guillotine גיליוטין,Elimelech Egoz played by Moshe Foster a good for nothing useless detective who gets a vacation from his job at the Even Yehuda police department and arrives at the Hadera Views hotel  the no 1 hotel in Hadera just by the chimneys of the power plant In the hotel are also many celebrates and Elimelech quickly discovers there is a whole web of intrigue and conspiracy between the celebrates causing the disappearance in the first night of Gadi Sichon encore of the host show Live Provocations with Gadi Sichon The weird hotel manager struck with deep dread to the image of his hotel charges Elimeleck with the task of solving this discrete mystery The plot thickens when in the second day arrives a new guest to the hotel Elimelech Egoz who everybody knows have no idea what is going on with him must at the eve of the third day to present in front of the guests of the hotel a detailed and full explanation of the events that happened and point at the suspect in the ordeal,Missing,nan,nan,nan,nan,nan,nan
851990400,[26],144792,You Don't Know Jack: Question Pack,[6],An expansion for the original You Dont Know Jack  It was bundled with the base game for You Dont Know Jack XL in 1996 which was released on Steam as You Dont Know Jack Vol1 XL in 2013,Missing,Missing,nan,nan,nan,nan,nan,nan
851990400,[2],143768,Pixeline: og Hulen i Træet,[6],Pixeline og hulen i træet is the second game in the Pixeline series Play with the toys Pixeline has in her treehouse and partake in a number of activities all based on Danish children songs,Missing,Missing,nan,nan,nan,nan,nan,nan
851990400,[12],143241,The Eternal City,"[3, 6, 14, 82]",This fully textbased roleplaying game takes place in the realisticfantasy world of Iridine The Eternal City inspired by Roman history TEC is wholly immersive and wellworth the investment of getting started  Join for the chance to explore the vast gameworld complex combat and noncombat mechanics Stay for the unparalleled community and immersive roleplay For the right person and the right price Iridine offers the chance to become anything gladiator merchant acolyte hunter bandit legionary entertainer explorer thief and so much more,Iridine is a vast and ancient metropolis its origins lost in myth It is the beloved city of the sun god Ereal said to be raised as a monument to his victories over the eclipsing moons  As the beacon of civilization in the world of Midlight Iridine fights an ongoing war against anarchy and lawlessness Thieves dart through the crowded streets Bandits prowl the swamps and forests of Iridines Republic Cinerans are barely kept at bay by the Legio and concerned civilians No one remembers who built the Harbor of the Moons No one can say when Moonfall took place when the first purplishblack storms appeared roiling through the moonlit countryside in furious silence No one remembers just how old the inner city really is nor to what ends of Midlight its folk were scattered  And the sages say the veil between life and death weakens by the day  that Ravan the Comforter of the Dead from ages forgotten has gone mad  that he stalks the heavens once more seeking to bring the destruction of Moonfall to Midlight,Missing,nan,nan,nan,nan,nan,nan
851990400,[31],142144,Nirvana X-ROM,"[6, 14]",Nirvana XROM is the companion game to the Italian SciFi film Nirvana directed by Gabriele Salvatores It is set after the events of the film VR game developer Jimi Dini has wiped the source code of his latest game Nirvana thus releasing its protagonist Solo from his virtual prison However portions of the game still survive in Jimis archives creating a potential risk of Nirvana being reassembled The player is called upon to investigate Jimis house and archives in search for the lingering game code and destroy it    The gameplay is a mixture of puzzlesolving and exploration viewed from the players perspective The location view can be freely rotated by moving the mouse and several objects are clickable often giving access to secret rooms The bottom bar icons offer several actions such as using scanners connecting to the network and communicating with the artificial intelligence that powers Jimis house Many solutions to the puzzles are found by sifting through Jimis archives which contain audio images and clips from the film as well as program code and other digital objects,Missing,Missing,nan,nan,nan,nan,nan,nan
851990400,[13],141224,Microsoft Flight Simulator 5.1: The Virtual Squadron,"[6, 13]",The Virtual Squadron Thunderbirds Past Present and Future is an unofficial addon for Microsoft Flight Simulator 5X It gives the player all the aircraft flown by the US Thunderbirds air demonstration squadron at the time of its release together with their USAF equivalents and a host of bonus aircraft At the time this addon was released the F22 Lightning was not in service as congressional funding was needed before it could go into production and be deployed hence the Future element in the title,Missing,Missing,nan,nan,nan,nan,nan,nan
851990400,[5],140521,Eternal Doom,[6],Eternal Doom is a 32level megawad first released in 1996 Originally developed by a group known as Team Eternal it was later acquired and worked on by TeamTNT It features arguably some of the largest levels ever designed for vanilla Doom,Missing,Missing,14.57,0.0,0.0,75.0,2.0,2.0
851990400,[9],140498,Treasure Quest,[6],Treasure Quest was a puzzle game in which the player moves from room to room in the mansion of Professor Jonathon William Faulkner who has bequeathed 1 million dollars to any student who can solve the puzzles he has laid out To move from one room to the next players must find a famous quote from visual clues words and anagrams and then derive an ultimate solution to the game,In Treasure Quest the player moves from room to room in the mansion of Professor Jonathon William Faulkner who has bequeathed 1 million dollars to any student who can solve the puzzles he has laid out To move from one room to the next players must find a famous quote from visual clues words and anagrams and then derive an ultimate solution to the game1  The soundtrack featured 11 songs by Jody Marie Gnant daughter of Sirius Publishings CEO Richard A Gnant23 some of which contained clues  In a unique marketing ploy Sirius Publishing Inc offered a 1000000 prize to the first eligible player who could solve the mystery of Treasure Quest and submit an explanation of the solution to the complete satisfaction of a panel of judges7 The contest would end on December 31 1999 if no winner was determined,Missing,nan,nan,nan,nan,nan,nan
851990400,[12],137179,Materia Magica,"[3, 6, 14, 34, 39]",Welcome to Materia Magica an online fantasy game where your imagination is the only system requirement  For over two decades our players have journeyed to the magical world of Alyria for adventures in fun oldschool multiplayer textbased gaming Its completely free to play no ads no inapp purchases required,Missing,Missing,nan,nan,nan,nan,nan,nan
851990400,[2],136510,The Universe According to Virgil Reality,[6],The Universe According to Virgil Reality brings science alive for kids through interactive animated experiments many of which they can perform at home,Missing,Missing,nan,nan,nan,nan,nan,nan
851990400,[2],135910,In Search of the Lost Words,[6],In Search of the Lost Words 1996 is an enchanting educational game geared toward building reading and comprehension skills in older children The graphics are charming and the gameplay quickly becomes immersive drawing the player into a simple but interesting storyline    Gameplay    The interface is intuitive and easy to use a simple point and click selects and names objects some of which are highlighted for later use in a sidebar Each object when clicked will reward you with a cute animation and some are gateways to minigames mostly memory and matchup challenges all the way through the main action that give you extra adverbs and adjectives that come in useful later At the end of each stage there is a section of the story of the egg and by extension the creature that has gaps in it that you must fill with the lost words of the title    Once youve found every word and some of them are not obvious at all like clicking on a large vase only to have it called a parrot because thats what was hiding in it you can proceed to the next phase of your journey,A magical egg was used in ancient days by an evil king with the help of an equally evil of course how could he be otherwise sorcerer to conquer whole countries and enslave their peoples But then the king died and the sorcerer sealed his body in a temple on a distant island while the egg was lost to history    The game starts when the egg hatches into a tiny blue creature with a little red antenna atop his head Now he has to make his way through a series of rooms buildings and outdoor environments until he reaches the far island where he can break the spell that would bring the evil king back to life to enslave the world once again,Missing,nan,nan,nan,nan,nan,nan
851990400,"[8, 9, 33]",135666,Moraff's Escapade,[6],Moraffs Escapade is a single player shareware arcade  puzzle game based on Lode Runner    The game consists of a series of vertical ladders and horizontal platforms Scattered around the game area are gemstones and the object of the game is to collect all the gems on a level in order to progress to the next However the players progress is made more complex by the presence of Flesh Eaters who track the player and attempt to eat himher,Missing,Missing,nan,nan,nan,nan,nan,nan
851990400,"[2, 31]",134166,Victorian Park,[6],Victorian Park is an adventure game that realizes an unprecedented realistic 3D space Characters that move around the game world in a vertical and horizontal direction by the new system Dream Factory Of course the elaborate world created by SGI is also deployed in real time The storys stage Victorian Park is a mysterious amusement park surrounded by darkness that exists only in the world of peoples dreams Inhabitants living in the park do not know the outside world A conversation about the mystery of the amusement park is one of the real pleasures of this game  Eight tips to return to the real world once again Can you really go back,Missing,Missing,nan,nan,nan,nan,nan,nan
850953600,[16],132645,Kichikuou Rance,[6],Kichikuou Rance literally translating to Brutal King Rance is the seventh game in Alicesofts flagship Rance Series It was released in Japan on December 19 1996 It was the first Alicesoft game to be produced for Windows 95 operating systems as well as the first game to use the companys SYSTEM 35 engine and the territory conquest strategy gameplay used in several of its future releases,The game begins at the start of LP0003 some time after the events of Rance 42 The warrior Rance accompanied as always by his faithful slave Sill Plain has been living as the leader of a group of bandits in northern Helman after killing their previous leader as part of a job given to him by the Keith Guild While Rance greatly enjoys the raping and pillaging that comes with being a bandit leader the guiltridden Sill believes that he is in danger of losing what remains of his conscience and genuinely becoming a villain  After attacking the city of Golak Rances group alerts the attention of Ruberan Tser commander of the Helman volunteer army who launches a counterstrike on them during their second attempt at pillaging the city Unable to fight against a genuine army the bandits are quickly destroyed Sill is captured by the Helman Army and Rance is forced to flee for his life  Rance evades the Helman army for several days with both his equipment and health steadily declining all the while before he finally passes out from fatigue along the LeazasHelman border He is found on the verge of death by Kentou Kanami the personal ninja of Leazas queen and Rances longtime admirer Lia Parapara Leazas who brings him to Leazas castle After three days of recovery Rance finally regains consciousness and completely humiliated by his defeat at Helmans hands and desperate to rescue Sill demands that Lia give him the Leazas Army to destroy the enemy nation Finally seeing an opportunity to have Rance to herself Lia agrees on the condition that he first marry her which Rance reluctantly accepts  Rance his mind already corrupted by his time as a bandit leader and his morals even more flexible in Sills absence becomes drunk on power almost immediately after becoming king of Leazas causing him to expand his goal from simply destroying Helman and rescuing Sill to conquering the entire world for himself On the day of his coronation rather than read the prewritten speech given to him by Lias advisor Maris Amaryllis Rance makes the bold declaration that all of the countrys people are required to throw their lives away for the sake of his ambitions causing him to be instantly deemed a tyrant  The very next day Ex Banquet general of the Leazas White Corps forms a rebel army composed of nearly half of the nations forces with the explicit goal of removing Rance from power His dreams of world conquest momentarily halted by the sudden rebel uprising Rance vows to destroy the opposing army without hesitation  So begins the era of the man who would go down in history as the brutal king,Missing,33.58,0.0,0.0,80.0,1.0,4.0
851990400,Missing,130739,X-Men Cartoon Maker,[6],XMen Cartoon Maker is a video game tiein to the 1992 series XMen It is an educational game that allows players to create art,Missing,Missing,nan,nan,nan,nan,nan,nan
851040000,"[11, 15]",130549,Lord Monarch Original,[6],Lord Monarch Original is based on the original game though it uses the algorithms from the Advanced version with some tweaked maps to take the changes into account,Missing,Missing,nan,nan,nan,nan,nan,nan
851990400,Missing,130360,Smarty,"[6, 14, 82]",Smarty is an interactive storybook designed for girls aged 712 However like designer Theresa Duncans earlier game Chop Suey it can be enjoyed by almost anyone It follows a little girl named Mimi who is the smartest kid on her block There are many different activities to play You can also interact with many of the games background items which provide funny animations or fantastical scenes,Missing,Missing,nan,nan,nan,nan,nan,nan
851990400,[15],129480,Caesar: Gold Edition,[6],Caesar Gold Edition contains     Caesar   Caesar II   Sneak preview of Caesar III,Missing,Missing,nan,nan,nan,nan,nan,nan
851990400,[2],129397,Math Blaster Jr.,"[6, 14]",Master Blaster Jr is a 1996 educational video game aimed at ages 47,Missing,Missing,nan,nan,nan,nan,nan,nan
849484800,"[2, 9, 31]",129146,JumpStart Adventures 4th Grade: Haunted Island,"[6, 14]",JumpStart Adventures 4th Grade Haunted Island is a JumpStart game that was made by Knowledge Adventure on December 2 1996 It was later rereleased on November 24 1997 with Map Scroll and Ms Grunkles Hat level indicator added As the title suggests the game is intended to teach a fourth grade curriculum It was later replaced by JumpStart Adventures 4th Grade Sapphire Falls in 1999 In its original release it contained KnowledgeLand as a bonus disc,The user is a fourthgrade student who fortunately missed the day of school when the classs substitute teacher was a witch named Ms Grunkle  After signing in at the schoolhouse the user is transported to Haunted Island With the aid of a large purple bat named Flap and a fortune teller named Madame Pomreeda the user must rescue the thirteen lost classmates by collecting the students most prized possessions from the islands educational activities After these possessions which reveal elements of the kids personality are collected Madame Pomreeda transforms the classmate back with a poem that tells the monster to go away and the child to return,Missing,nan,nan,nan,nan,nan,nan
851990400,Missing,127992,Duck Hunt 2,[6],Tucked down into your blind just off of the river you and your hunting dog JAZZ are ready to take some waterfowl home for dinner A 12 gauge shotgun is the gun that will bring down these ducks Its the crack of dawn and the ducks are moving coming in from the right left and off of the water Youre are sure to have plenty to shoot at Not to mention you dont have to get up at 400 in the morning,Missing,Missing,nan,nan,nan,nan,nan,nan
851990400,"[9, 31]",122568,Nikolai's Pharaohs,"[6, 14]",Nikolais Pharaohs is an entry in the Nikolai series Nikolai and his cat NeowNeow become mighty Pharaohs in ancient Egypt and build their own pyramids but NeowNeow copies Nikolais design and gets lost inside his pyramid The player can discover how the great pyramids of Egypt were built and explore the insides of each pyramid The player can also learn about the beliefs of ancient Egypt and can also play a game with the snake and marbles The game plays as an interactive book for the most part and is targeted to children ages four and up,Missing,Missing,nan,nan,nan,nan,nan,nan
851990400,[15],122309,C&C Level-CD: Vol.3,[6],CC LevelCD Vol3 is an unofficial addon with 400 extra levels for Command  Conquer The CD also includes several editors cheats and hints,Missing,Missing,nan,nan,nan,nan,nan,nan
851990400,[31],121810,Legends,"[6, 13, 16, 114]",Two alien scientist have mischievously traveled back in time Their sole purpose is to destroy the future of our beloved planet By dropping modern weapons on ancient civilizations they have enabled the more dubious humans to rule the world,Missing,Missing,0.0,0.0,0.0,0.0,0.0,0.0
851990400,Missing,120518,Disney's The Hunchback of Notre Dame: Topsy Turvy Games,[6],The game was tied in with the original theatrical films release and features a collection of mini games based on the Festival of Fools that includes a variation from the classic game Balloon Fight,Missing,Missing,nan,nan,nan,nan,nan,nan
851990400,[33],119202,Avoid the Roids,[6],The object of the game is fairly simple move your ship to Avoid the Roids Ever so often you will have to avoid an additional Roid Destroy Roids by having them crash into the sweepers,Missing,Missing,nan,nan,nan,nan,nan,nan
851990400,[31],117600,Dráscula: The Vampire Strikes Back,"[6, 13]",An old Spanish 2D classic point  click style adventure with tons of humor and an easy interface Estate agent John Hacker must save the woman of his dreams from the evil Count Drascula,Missing,Missing,0.0,0.0,0.0,60.0,1.0,0.0
851990400,"[5, 13, 15]",116804,Level-ROM,"[6, 13]",This unofficial shovelware addon disc contains more than 3000 levels and utilities for      Command  Conquer   DOOM   DOOM II   Duke Nukem 3D   Microsoft Flight Simulator v50   Heretic   Hexen Beyond Heretic   US Navy Fighters   NBA Live 95   The Need for Speed   SimCity 2000   SimCity   WarCraft Orcs  Humans   Warcraft II Tides of Darkness,Missing,Missing,nan,nan,nan,nan,nan,nan
851990400,[16],115032,Sid Meier's Civilization II: Conflicts in Civilization,"[6, 14]",An expansion pack to Sid Meiers compelling strategy game Civilization II the rare Scenario Disk Conflicts in Civilization includes 20 bonus scenarios including eight Best of the Net scenarios created by fans of the series,Missing,Missing,nan,nan,nan,nan,nan,nan
851990400,[9],113908,Trivia Munchers Deluxe,[6],The protagonist of this game is the Muncher thus named for his insatiable appetite for knowledge Muncher is presented with a trivia category and a board with 20 possible answers To win at the particular board the player must steer Muncher to the correct answers and devour them,Missing,Missing,nan,nan,nan,nan,nan,nan
851990400,[31],112053,MA-RI-A: The Curse of the Puppet Museum,[6],Missing,Missing,Missing,nan,nan,nan,nan,nan,nan
851990400,"[5, 33]",110599,CyberDome!,[6],Missing,Missing,Missing,nan,nan,nan,nan,nan,nan
851990400,[15],100186,Destiny,[6],The player is in charge of bringing a small group of prehistoric people through the changing world from the first crude working with stone tools to space travel developing them from a simple tribe into a successful modern society Along the way the player races against up to seven other tribes all reaching for the same goal As the player progresses through the game he must lead his tribe to victory using diplomacy and conquest Options include realtime or turnbased play traditional 2D or new 3D views full campaigns or miniscenarios and military or scientific victory conditions,Missing,Missing,12.06,66.04,544.69,72.0,749.0,668.0
851990400,[5],95501,Bedlam,"[6, 7, 13, 14]",Bedlam is a 1996 run and gun video game developed by Mirage and published by GT Interactive for DOS Windows Mac OS and PlayStation in which players use a squad of three huge remote assault tanks RATs against mutated monsters called Biomex,A fast paced action game where you run around a machinegun wielding robot destroying everything in your path There is a multitude of enemies and you can destroy almost every single thing on the map buildings vehicles etc The reason for all this destruction is a revolution led by the robots against their human masters,Missing,4.83,6.64,7.21,59.0,30.0,61.0
851990400,[26],94638,Crosswords & More for Windows,[6],A collection of crossword and word seek puzzles that you can solve on your PC It comes with a crossword editor and import tools for for creating your own crosswords You can save and load a puzzle while solving it Theres a timer and hint mode to enhance game play as well,Missing,Missing,nan,nan,nan,nan,nan,nan
851990400,Missing,94518,A-10 Cuba!,"[6, 14]",Missing,Missing,Missing,nan,nan,nan,nan,nan,nan
851990400,[16],94487,Harpoon Classic '97,[6],Harpoon Classic 97 is a revised version of traditional Harpoon Classic which is in turn based on Larry Bonds original and very popular Harpoon boardgame from 1980 The core gameplay is topdown map and menu based ultrarealistic strategic naval warfare wrapping around scenarios in 4 different theatres North Atlantic GreenlandIceland Indian Ocean and Persian GulfMediterranean,Missing,Missing,nan,nan,nan,nan,nan,nan
851990400,[9],94471,Space Dodge'm,[6],Space Dodgem sic is a shareware conversion of the game of Dodgem a very simple yet complex game invented 1972 by mathematics student Colin Vout The name originates from the fact that youll often have to dodge around the pieces of your opponent to advance your own    This conversion places Vouts abstract board game in a science fiction setting with an added time limit playing in a space station which is about make fatal contact with an asteroid Your goal is to evacuate all your shuttles or landers in time while preventing your opponent to do the same before you    The game is played on a simple square board with players taking turns moving one token to a neighboring square at each turn It is not allowed to move onto an occupied square or backwards only in the direction of the evacuation pads up for shuttles right for landers or sideways Thats it The amazing thing is that these primitive rules produce quite a devilish game where you have to try to block your enemy pieces while taking care not to be blocked yourself Another slight modification has been taken you are not allowed move in a way to make your opponent unable to move in the original game an immobile player won,Missing,Missing,nan,nan,nan,nan,nan,nan
851990400,[30],94423,Angel Egg,"[6, 14]",Angel Egg is a digital pinball game developed by LittleWing and released in 1996 The game is themed around biblical angels and eggs,Missing,Missing,nan,nan,nan,nan,nan,nan
851990400,[14],94330,Kick Off 96,"[6, 13, 16]",Kick Off 96 gives you the chance to take part in the European Championships in England 1996 Kick Off 96 can be played with several perspectives including overhead and isometric and offers the same pacey gameplay that made its predecessors famous If Euro 96 isnt enough you could play with 49 international teams plus 750 club teams totalling 15000 real players with varied skill levels If thats still not enough you can also create your own leagues and teams,Missing,Missing,nan,nan,nan,nan,nan,nan
851990400,"[9, 31]",92959,Woodspell,[6],Woodspell is a mixture of an adventurelike puzzlesolving game and an activity center with educational elements The game contains various puzzles such as matching the sound of a song or the classic fit the right objects in the correct location variant Players also hear stories set in the woodland filled with elves and fairies or even print and color the locations they see The game features handdrawn scenarios and characters and original music by the Italian band Tazenda,Missing,Missing,nan,nan,nan,nan,nan,nan
