,genres,id,name,platforms,summary,storyline,main,extra,completionist,review_score,review_count,people_polled
144,"[13, 32]",125025,Euro Truck Simulator 2: Special Transport,"[3, 6, 14]",Only the most skilled and experienced truck drivers are called to perform Special Transport jobs Are you up to the challenge Experience supersized cargoes with length and width exceeding standard cargo regulations Drive through tight passages requiring millimeterprecision maneuvering    Your route will be secured by two escort vehicles guiding you through the transport job from its start to the place of delivery Its not going to be a piece of cake but if you obey the escort vehicles advice and carefully watch for every inch of the road to deliver the cargo in pristine condition you can consider yourself a real pro a true veteran behind the wheel who can deliver even the most enormous cargoes,Missing,,,,,,
145,"[12, 32]",124877,Zombasite: Orc Schism,"[3, 6, 14]",Zombasite Orc Schism is the first expansion for the unique action RPG Zombasite Adds the Bard class new clans new areas dungeons caves and ruins better control over your recruits  town new monsters Dark Orcs Mutated  Zombie Lords monster recruits and much more,Missing,,,,,,
146,"[12, 31]",124353,Witch's Heart,[6],While playing up in the mountains Claire Elford finds herself taking shelter from the rain in a mansion  Soon she finds four other people some bizarre monsters  and no way back out  In the company of demons the five must figure out how to escape and solve the mystery of the legendary wishgranting treasure the Witchs Heart,While playing up in the mountains Claire Elford finds herself taking shelter from the rain in a mansion  Soon she finds four other people some bizarre monsters  and no way back out  In the company of demons the five must figure out how to escape and solve the mystery of the legendary wishgranting treasure the Witchs Heart,17.59,20.68,0.0,72.0,7.0,6.0
147,"[12, 13, 15, 16, 31]",124312,Wizards of Brandel,"[6, 34, 39, 46, 48, 49, 130]",The young wizard Darius loses his house after he fails to make a loan repayment and ends up living for free in the house of a wanted sorcerer As he meets a female swordsman who has absolutely no sense of direction and a plant girl who shrivels up immediately if she doesnt drink enough water fate decrees to end up traveling together Where will the quarrels over differing principles lead to  Unleash continuous attacks with Limit Burst in turnbased battles and form partnerships with the Familiar Spirits The Magic Lab lets you power up your skills and you can also enjoy setting fields dowsing areas and visit sidejob rooms to get items at the Magical Garden Furthermore explore towns and secret dungeons experience all the achievements you know and love such as weapon strengthening item crafting and the arena,Missing,15.16,16.0,0.0,0.0,0.0,2.0
148,"[9, 15, 32]",121747,Sudoku Universe,"[6, 130]",Sudoku  is a logicbased combinatorial numberplacement puzzle The objective is to fill a 99 grid with digits so that each column each row and each of the nine 33 subgrids that compose the grid also called boxes blocks or regions contains all of the digits from 1 to 9,Missing,9.72,14.92,22.21,65.0,10.0,21.0
149,"[13, 15]",119960,"Cities: Skylines - Carols, Candles and Candy","[3, 6, 14]",Cities Skylines  Carols Candles and Candy is a DLC for the city simulation game Cities Skylines With Carols Candles and Candy yule feel right at home with five new Christmas carols remade in multiple genres Classic Jazz Latin Jazz Country Indie and Indietronica The songs will be randomly played across existing radio stations once you download the free DLC Besides you cant prove Chirpy is not a partridge and Paradox Interactive is spelled with No L Happy holidays citybuilders,Missing,,,,,,
150,"[12, 31, 32]",119152,Noel the Mortal Fate: Season 7 - End of the Paranoid,"[6, 82]",The seventh game in the NOEL the mortal fate series Originally released as a Web Browser and Windows game in 2017  It is available in English and Chinese through Steam as part of the series bundle Noel the Mortal Fate S17 released in 2018,Missing,,,,,,
151,[31],117674,Healthy Breakfast,"[6, 14]",Healthy Breakfast is a short absurd little game about the importance of eating a healthy breakfast,Whatever happened to predictability,,,,,,
152,"[12, 32]",115904,Mad Princess: The Great Gladiators,[6],Choose your own path in this gladiator roleplaying game The player starts off as an incarcerated criminal forced to fight for their life After they leave the prison they will embark on a journey to sharpen their skills  The publisher of this game on Steam is Dlsite Official,Missing,0.0,0.0,0.0,0.0,0.0,0.0
153,[32],115735,Fallen Doll,[6],In summary Fallen Doll is a realtime nextgen hentai game with VR support,Ladies and gentlemen our most valued customers and friends a very fine evening to you  Its the moment weve long been waiting for  the grand opening of the Erotes Nightclub    It is not only a place of comfort and luxury but also a proving ground of a cuttingedge scientific achievement  the stateoftheart bionic humanoid robot codenamed Erika will be at your service to fulfill your wildest desire    The recent breakthrough of synthetic tissue engineering has pushed scientific boundaries far beyond the imagination of our ancestors  and we are delighted to have you here to behold and enjoy such a special experiment    Is that possible to create a synthetic body indistinguishable from a real human    Erika will be the answer Will she be the Aphrodite we all lust for Or merely another lifeless sex doll waiting to be disposed of,0.0,0.0,0.0,90.0,1.0,0.0
154,"[31, 32]",115626,Wenziyu,"[3, 6, 14, 34, 39]",The protagonist is trapped inside a prison please help the protagonist to escape this place by making sentences and unravel the secrets of this prison,Missing,,,,,,
155,[5],114759,Warface: Chernobyl,"[6, 48, 49]",As part of the new special operation Warface operatives will visit Pripyat  one of the most mysterious and historically significant places on Earth According to intelligence reported to the Warface headquarters there is increased seismic activity in this region It is the players task is to investigate what is happening in the region and to confirm if the instability is related to the activities of the evil Blackwood organization that have been seen around the city  Pripyat introduces new mechanics to be aware of in combat such as the energy shields that will be used by individual enemies and defensive installations Players need to ready themselves for the latest creation of Blackwoods robotics department called SED These sinister humanlike androids will pose a serious threat to any squad making precise teamwork essential to bring them down,Missing,,,,,,
156,"[11, 13, 15]",114426,Stellaris: Humanoids,"[6, 48, 49]",One Small Step for Man One Giant Leap for Mankind Stellaris Humanoids Species Pack features a selection of new portraits and ship models for players who wish to forge their path among the stars as the irrepressible human race  or at least as a species that resembles humans to some degree  The pack includes new portraits ship models voiceover sets for VIR and remixed music tracks,Missing,,,,,,
157,"[31, 34]",113205,Silverio Saga Series: Artemis Package,[6],Missing,Missing,,,,,,
158,[13],110336,Farming Simulator 17 big bud pack,"[6, 48, 49]",This Big Bud Pack includes   Big Bud 450 tractor  Big Bud 747 tractor  AGRISEM Cultiplow Platinum cultivator  BEDNAR Swifter SM 18000 cultivator  Brent Avalanche 1596 auger wagon  Brochard Constructeur EV2200 WR manure spreader  FlexiCoil ST820 cultivator  Great Plains YP2425A planter  GrÃ©goireBesson SPSL 9 WR plow  GrÃ©goireBesson Trailed Lifter hitch connector  Hatzenbichler Terminator TH18 toolbar  Hatzenbichler TH1400 Air Cart tank  Seed Hawk 980 Air Cart tank  Seed Hawk XL Air Drill 84FT toolbar,Missing,,,,,,
159,[33],109968,Justice Duel,"[6, 18, 34, 39]",Take to the skies on the back of scientificallyengineered eagles and joust against AI patriots from Americas past Dodge fireworks bear traps and dead presidents in 4Player Local Coop The history might be wrong but the justice is so right   Historically Inaccurate Combat  4 Player Local Coop  Campaign Mode,Missing,0.0,0.0,0.0,0.0,0.0,0.0
160,"[31, 32]",107209,Birds Birds Birds,[6],Throw popcorn to scare the birds of but make sure not to scare to many at ones or loose balance and fall of the mountain,Missing,,,,,,
161,[15],105478,Monkeys Ahoy,[6],Join two young pirate chimps on their quest to make the Ultimate Friendship Smoothie through this bright and lively monkey world,Missing,0.0,0.0,0.0,0.0,0.0,0.0
162,"[9, 31, 34]",103692,Dream Walker,"[6, 14]",Walk through nightmares and help your husband defeat his fears in this hidden object adventure,Enter a surreal dream world as Carrol a dream walker on a quest to save her husband from the evil spirit named Sandman As the Sandman strives to take over ones mind he can use it to break into the real world and cause incomprehensible havoc Walk through nightmares and help your husband defeat his fears in this captivating hidden object adventure,0.0,0.0,5.7,0.0,0.0,2.0
163,[33],103657,Cosmic Chicken,[6],Cosmic Chicken is an audiovisual experience that takes the player on a highspeed ride through the cosmos Avoid obstacles collect coins and survive long enough to reach highscore glory  all while jamming to an electrobumpin soundtrack by the talented Eddy Havok,Missing,,,,,,
164,"[12, 13, 15, 16, 31, 32]",103078,Dragon Lapis,"[6, 34, 37, 39, 48, 49, 130, 167]",A thousand years ago a great battle ensued between two dragons one gold and the other silver where they were sealed away However the real tale begins many centuries later after the Silver Dragon reawakens and launches an assault on a frontier village in the far north There a royal knight by the name of Lucas serves as a guard after being relegated to the rural and much isolated location by the King Yet little does he know he is in fact a descendant of the hero Alaric who once sealed the Gold and Silver Dragons in human form Nonetheless when tragedy strikes he soon finds his place and after teaming up with a band of unlikely companions sets out on an adventure to save the world,Missing,0.0,17.6,0.0,70.0,1.0,1.0
165,"[31, 32, 33]",102063,Borders,"[6, 14, 34]",Missing,Missing,,,,,,
166,"[12, 15, 16, 24]",101707,World's End Chapter 3,[6],The darkly comedic strategy RPG continues Will Tevoran and Company find fortune as they plunge deeper into foreign political strife    Features  Avoid plague spreading corpses endure poison gas and repel invading zealots  New terrain interactions including conveyor belts hidden switches and more strangeness  Flying  mounted enemies remotely detonatable bombs and more new tactical elements  21 new battles and an original soundtrack  Option to continue from Chapter 2 saves,Missing,,,,,,
167,"[5, 7, 31, 32]",100556,Yoiyami Dancers: Twilight Danmaku Dancers,"[6, 130]",Dodge bullets to the rhythm and take down everything that moves A rhythmical danmaku action game based on Touhou Project series,Various disturbances may occur in the Gensokyo over the new game Danmaku Dance which has become popular among the fairiesmaybe,0.0,0.0,0.0,70.0,1.0,0.0
168,"[10, 14, 32, 33]",100441,Photon Highway,"[6, 14]",Photon Highway is an arcade racer in which you drive on a procedurally generated road while trying to reach the end of the universe    On your journey to the end you will be driving through 10 unique areas But beware Many different obstacles block your way and if you crash you have to start from the beginning of the road again    Once you reach certain areas you unlock new vehicles each with its own advantages and disadvantages,Missing,,,,,,
169,Missing,98481,Mahlone One,[6],Missing,Missing,,,,,,
170,"[5, 11, 15]",98300,Project Visitor,[6],Project Visitor is at its heart a hybrid MMO game with both FPS and RTS characteristics It comes from the days when we use to call them PSWs Persistent State Worlds Nowadays most MMO games are really just PSC Persistent State Characters where essentially its just your character that changes and is saved In Project Visitor you build the world around you you attack others and the lands they have built and the whole world is saved to the database Also the world continues to grow and battles happen lands are lost gained etc even while your offline To maintain your land you have to be involved join a protective group called a MDN own mine defend survive    Previously known as 10Six it was Segas first foray into MMOs a persistent online RTS where players signed up for one of four megacorporations aiming to conquer the rogue planet Visitor which has entered the solar system and contains a treasure of valuable resources    Players construct and capture mining sites construct defenses and NPC units to help defend and attack in a fairly traditional RTS mode but much of the game also consists of player on player combat in first or third person modes similar to Battlezone or Planetside    The server infrastructure was designed to be able to handle a million simultaneous players and was hosted through SegaSofts Heatnet but never saw player counts that high After failing to attract a sufficiently large audience Sega shut down the game in June 2002 offering refunds to anybody with subscription time left    A community effort to relaunch the game was started soon after the servers were taken down Conundrum Studios was formed in late 2002 and the game was relaunched under the name Project Visitor in 2003,Missing,,,,,,
171,[12],91422,Arcana Ritter,[6],Only as for SRPG Japanese of the royal road it is given nonresponse English,Missing,0.0,0.0,0.0,0.0,0.0,0.0
172,"[12, 13, 14, 15, 31, 32]",91408,Catch Chicken Games,[6],Time 2 minutes Players Are You Ready to Help Princess Reila grab all the chickens and become master chicken,Missing,,,,,,
173,"[13, 15, 32]",91407,WWII Eiyuu Retsuden: Saikyou no Tora - Kurt Knispel,[6],Missing,Missing,,,,,,
174,[15],91199,Nobunaga's Ambition: Soutenroku with Power Up Kit,[6],NOBUNAGAS AMBITION Soutenroku with Power Up Kit is an expanded version of NOBUNAGAS AMBITION Soutenroku which was released in 2002 as the 10th game in the series With the theme Retainers supplant Lords for the first time in the series players can play as a retainer officer Based in Japans chaotic Warring States period this game portrays even greater battles for power than before In addition in foreign relations different foreign strategies are introduced including encircling powerful enemies with multiple Forces forming alliances between three Forces and much more Also with movement and battles progressing in real time players experience more vividly the give and take of strategic battle The power up kit adds 3 new scenarios a database giving officer and castle introductions and an editing function,Missing,,,,,,
175,"[31, 32]",90075,a Museum of Dubious Splendors,"[3, 6, 14]",a Museum of Dubious Splendors is a storybook from the world of Somewhere  A quiet game about prosaic objects and spurious histories it is an irreverent rumination on the nature of an archive and forms of recollection,Missing,0.39,0.45,0.55,56.0,8.0,15.0
176,"[8, 10, 15, 33]",86513,Meal Escape,"[6, 14, 130]",Meal Escape is a survivalplatformerrunner game  Give a sigh of life to the most representative meals of each country to escape from people who eat too much  You can to put yourself in the shoes of these cute meals using their own skills to escape from the restaurants creating all the possible chaos Because the chaos is fun and as we will also see sometimes it is practical,At the begining of 2016 Krist AlcÃ¡zar a game programming teacher was challenged by a student to create a model based on photogrammetry and animate it seamlessly He accepted the challenge and he promised to do it over the weekend because it happened on friday  He was thinking about what thing he could do it And thinking he turned his head towards the kitchen and saw a leg of cured ham we have to remember that he lives in Spain  That led him to do the photogrammetry rig the model and make a small demo for mobile where with a slide the leg of ham ran through a terrain The result was a bit creepy but at the same time intoxicating and very funny That gave him a great idea to make meal escape  So he decided to propose to some students to make some game assets for this idea It took them 3 months doing it on spare time After that the idea took strength and Krist AlcÃ¡zar decided to review it to carry it out and look for financing to develop it    Features  Have fun doing the hooligan without limits  Find the exit and break the score The basic idea is like the classic board game Chutes and Ladders where depending on where you step you can advance or delay your position If you escape faster you will get achievements You can also break the score exploring the limits of the level or creating more chaos  Hilarious and arbitrary moments Every moment will be unique memorable and fully of humor All the things of the scene will be interactable and each one will have their own mechanic You can create your own gameplay  Transmit your sigh of life and create a legion Life is what makes you different from other meals and you can share it by touching them This will make your score grow creating more chaos with your crowd of meals They will follow you as the leader that you are  Different types of places to eat and hungry people We will have 3 main types of levels the normal restaurant with waiters bringing food to the table the free buffet where people go for the food and the family meal in the dining room of any house Each place will have different food flows and different ways to escape  Explore the hundreds of levels Some levels can be tricky and you will have to find the way to escape out You will travel along the world discovering those levels bonus stages final bosses cooks and secret spots All there is to have fun In this game you do not to kill or die you can have fun with all items of the scene,,,,,,
177,"[9, 13, 15, 26, 35]",85832,Vegas Party,"[6, 46, 48, 49, 130]",The game takes the player into the gamblingfriendly universe of this overthetop version of Las Vegas city  Played as a race the goal is to reach the end of the Strip before anyone else Trust no one and forget the meaning of the word mercy because it does not apply here,Missing,1.0,0.0,0.0,20.0,2.0,1.0
178,"[13, 32]",83872,Dark Empire,[6],Hello Captain I am proud to announce that you are now manager of the mining colony Astra But we are at war and you have been designated to defend this colony An enemy flagship goes to your colony find a way to stop itWelcome to Dark Empire you will take place as manager of a small mining colony It will be your duty to defend the different areas of this colony,Missing,,,,,,
179,"[12, 32]",83815,Croneworld,[6],Croneworld is a fantasystory telling RPG indie game It is a game about humans fighting wizards with flying robot CRONES Its world has Eastern culture Western culture science fiction and magics,Missing,,,,,,
180,"[15, 32]",83530,Tactical,[6],Tactical is a challenging combination of puzzle and topdown shooter You have one objective eliminate all of the security robots The catch is that you must not be discovered and only shots to the back will be effective,Missing,,,,,,
181,[12],83358,Rxcovery,[6],Battle your way through a nightmare hospital to get enough money to pay your bill,You are dreaming  You are unconscious in a hospital bed Your insurance only covers 30 more minutes of life support After that youll be unplugged and that will be the end  But all is not lost You have 30 minutes to explore your dream and collect dream money Maybe you can collect enough and youll live to see another day  in real life this time  It wont be easy though Demonic nurses and orderlies pop up at every turn Fight them with weapons and magic and recruit allies to help you along your way including Recovery the helpful android nurse of your dreams Or nightmares,0.0,0.0,0.0,0.0,0.0,0.0
182,"[5, 32, 33]",83348,Golden Hornet,[6],Golden Hornet is a retro style twinstick shooter inspired by Choplifter Fort Apocalypse and Stern Electronics arcade game Rescue Become a pilot of the multipurpose helicopter Golden Hornet  rescue hostages and destroy enemy outposts,There was a country called Videl divided into North and South after their first civil war And still there was a lot of conflict between them  On May 26th 2020 as the North Videl began to invade in the dawn the Second Videl War broke out To fight against the North Videl army the Golden Hornet  the South Videls most advanced multipurpose helicopter  was put into operation  Being piloted by two elite chopper pilots the mission of the Golden Hornet is to save the prisoners of war and destroy the enemy outposts,0.0,0.0,0.0,0.0,0.0,0.0
183,Missing,83337,Snail Trek: Chapter 2 - A Snail of Two Worlds,[6],An adventure game from Phil Fortier,Relive 1980s nostalgia in this text parser driven graphic adventure game You and your molluscan crew embark on an epic journey to find a new home world In Chapter 2  A Snail Of Two Worlds you are stranded on an alien planet searching for food water and most of all answers,,,,,,
184,"[31, 32]",83302,Mama Possum,"[6, 14, 82]",Two sisters a truck driver and a housewife fend off a Kaiju apocalypse in the Great Smoky Mountains with their mech Mama Possum,Missing,,,,,,
185,"[12, 13, 31, 32]",83206,Sugy the Christmas elf,"[3, 6]",Game for PC Mac and Linux,Missing,,,,,,
186,"[15, 31, 32]",83157,Cinco Paus,"[6, 14, 39]",You have five magic wands but you dont know what they do A Portuguese roguelike from Michael Brough,Missing,0.0,0.0,0.0,0.0,0.0,0.0
187,"[8, 31, 32]",83035,A Small Robot Story,[6],A Small Robot Story is an adventureplatformer where you play as Rae a small robot who activates and has no idea why So you need to set out and find out whats up  With a heavy emphasis on story A Small Robot Story will take you through forests factories caves laboratories and more as you track down and find the source of your sudden activation,Missing,0.0,0.0,0.0,0.0,0.0,0.0
188,"[32, 33]",82853,Puppet Kings,[6],Puppet Kings is a modern take on the Breakout genre taking blockbreaking to new levels of fun by introducing characters boss rush as primary game mode and a roguelike twist,Missing,0.0,0.0,0.0,0.0,0.0,0.0
189,"[9, 15, 32, 35]",82788,Tactical Mind,"[6, 14, 130]",Tactical Mind is an upcoming strategy video game inspired by Chess It is being developed as a joint venture by Drageus Games SA and Qubic Games SA,Missing,0.0,0.0,0.0,0.0,0.0,0.0
190,"[12, 31]",82732,Niplheim's Hunter: Branded Azel,[6],A huntress girl in heat was branded with a lewd emblem by evil creatures Wearing various costumes armors she hunts evil creatures at noon and dcks at night,A huntress girl Azel finally arrived there in the end of her path of pursuit of the evil creature that etched lewd emblems on her body Now she is about to step into Niplheim often referred as the last defense wall against the incoming calamity or that is to say into the front line of the survival competition between the mankind and the creatures,,,,,,
191,"[5, 12]",82386,Destiny 2: Launch Edition,"[6, 48, 49]",Destiny 2 Launch Edition includes a few preorder bonuses for the base game,Missing,,,,,,
192,"[7, 13]",82312,Music Band Manager,[6],Always dreamed of creating your own musical group and making your way to the stars Now your desires can become a reality In our game you can go all the way from rehearsals in the garages to appearances on the stages where worldfamous performers have visited  You will have the opportunity to record songs on different topics give the name of each of them release albums Manage the activities of your newlyborn musicians completely and completely  You have four most popular genres in the music world rock electronic music pop rnb Your musicians can play in all directions so do not have to make a hard choice at the beginning of the game  improve in all these genres  There are three levels of difficulty to choose from but if the game seems to be hard for you you can change your difficulty level at any time With the promotion of the group you will be assisted by several managers each of them has a huge number of ideas on how to do it You will have to face a lot of difficult moral choices which is more important for you money popularity through black PR or the love of people Or do you just want to carry your creativity into the masses and make people happy Managers will give you a huge amount of bonuses if you make the right choice and listen to your heart and head You will have to act smartly and judiciously because some elections can damage your reputation on the contrary  You will be available hundreds of different musical instruments as well as many cool things that you can give to your musicians and each of these items will give a certain bonus  Win many musical awards on the way to the top Compete for a place in the top 100 with other players  Your musicians will often comment on what is happening to them so you definitely will not be bored  Rather start to conquer the whole world with the help of your music,Missing,6.17,12.0,16.0,57.0,3.0,5.0
193,"[9, 15]",82156,Six Match,"[6, 14, 34, 39]",Match three coins in six moves or less,Missing,0.0,0.0,0.0,0.0,0.0,0.0
