first_release_date,genres,id,name,platforms,summary,storyline,main,extra,completionist,review_score,review_count,people_polled
1611273600,"[5, 12]",275624,Deus Ex: Greasel of the Year Edition,[6],Ever wondered how Deus Ex would play out if the main character was a regular greasel instead of a nanoaugmented agent Now you wont have to,Missing,nan,nan,nan,nan,nan,nan
1611446400,[5],274432,Fragor Portum,[6],The year is 208X you wake up in the barracks of the UNSF Fragor Portum to find that something is amiss Fragor Portum is a Boomcompatible 5 map episode for Doom 2,Missing,nan,nan,nan,nan,nan,nan
1609632000,[2],274102,One Week at Freddy's,[6],One Week at Freddys is a joke fnaf fangame based on Five nights at Freddys 2  Doom II by mrbenio,Missing,nan,nan,nan,nan,nan,nan
1610496000,[5],271462,The Circulation of Shadows,[6],Large underground industrial base with rocket silos and conveyor belts and a small start map It was originally started in 2005 for a Nehahra addon episode It uses Daikatana textures and runs on the Rubicon 2 mod included featuring new and modified enemies and effects Also comes with a music track and a custom skybox,Missing,nan,nan,nan,nan,nan,nan
1611792000,[5],271330,Biome: Mr. Self Destruct,[6],Industrialthemed 1024³ level with a lavaflooded foundry a humid cave system and an icy outside area originally started for the Xmas Jam 2019 It uses custom textures from various sources and comes with a new skybox The map source is included,Missing,nan,nan,nan,nan,nan,nan
1611532800,[5],271221,Moving parts,[6],Seven smallish maps with moving objects They are based on the Copper mod included and come with custom skyboxes and two music tracks,Missing,nan,nan,nan,nan,nan,nan
1610928000,[9],269112,Panel Flux,"[6, 82]",The classic match3 puzzle game now with unlimited content Generate puzzles across a wide range of difficulty settings and share the coolest ones with your friends  The gameplay is based on the Panel de Pon series Swap blocks horizontally and match 3 in a row or column to make them disappear Try to clear the entire board with your limited number of moves,Missing,nan,nan,nan,nan,nan,nan
1611705600,"[12, 13]",265887,Mario and Luigi: Superstar Simulator,[6],Mario and Luigi Superstar Simulator focuses on the battle elements of the Mario and Luigi series and enhances them with new enemies to fight and characters to play as The playable characters range from the usual such as Mario Luigi and Bowser but there are also some characters you wouldnt expect in this format such as Paper Mario Sonic or even Peppino from Pizza Tower Each battle has something special and unique to bring to the table like a new mechanic while dodging or a phase 2 that changes things up There are some extra things to do as well like playing minigames or going on bounty missions by collecting wanted posters in the overworldHUB area,Missing,nan,nan,nan,nan,nan,nan
1609632000,[5],261819,Enceladus,[6],Doom1 episode which runs on E4 with new textures based on already existing patches and custom monster behaviour via DEHACKED,Missing,0.0,0.0,0.0,0.0,0.0,0.0
1610928000,[5],261452,Hell's Farthest Shore,[6],Hells Farthest Shore will be a replacement episode for The Shores of Hell with a focus on huge imposing architecture and atmospheric exploration punctuated with frantic combat,Missing,nan,nan,nan,nan,nan,nan
1611878400,[32],260060,FNaF Multiplayer: Forgotten Pizzeria,[6],A freetoplay multiplayer game where the action takes place at night in the insanely big randomly generated Freddy Fazbears Pizza Players are randomly placed in one of the two available roles nightguards and animatronics Guards rush to find tools to complete maintenance work while the animatronics hunt them down with their special abilities,Missing,nan,nan,nan,nan,nan,nan
1609632000,[31],253133,As usual.,"[6, 82]",Today as usual  This is a linear atmospheric game There are no loud scares so please use headphones Some grotesque imagery is present if its not to your liking please refrain from playing,Missing,nan,nan,nan,nan,nan,nan
1611187200,"[10, 15]",252816,Truck Raid,[6],Truck Raid is a retrostyle racing game that will take you back to the glory days of 90s racing games With its vibrant graphics and fastpaced gameplay Truck Raid captures the spirit of classic racing games while bringing new twists to the genre,In the year 20XX in the futuristic city of Neonia the most prestigious race in history is about to take place Drivers from all over the world gather to compete in this spectacular showdown The player takes on the role of a young promising driver who dreams of becoming the Retro Racer champion  Our protagonist a skilled and determined racer sets out on a journey to prove their worth on the retro racing circuit Along the way they encounter a variety of challenging tracks each with its own unique obstacles and hazards From twisting city streets to treacherous mountain passes the player must navigate through these thrilling courses while outmaneuvering their fierce competitors  As the races progress the player forms rivalries with other skilled drivers each with their own distinct personalities and driving styles These rivalries add an extra layer of intensity and competition to the gameplay as the player strives to outperform their opponents and establish their dominance on the retro racing scene  Beyond the exhilarating races the player also discovers a deeper mystery surrounding the Retro Racer championship As they delve into the secrets hidden within the racing world they uncover a nefarious plot that threatens the integrity of the competition Its up to the player to unravel the conspiracy and ensure that fairness and true skill prevail in the Retro Racer championship  Throughout the game the player can upgrade their vehicle unlocking new abilities and customization options With each race won and challenge overcome the player gets one step closer to their ultimate goal to claim the title of Retro Racer champion and etch their name in the annals of racing history  Get ready for a thrilling journey filled with intense races fierce rivalries and a quest for justice in Retro Racer Turbo Thrust Will you have what it takes to conquer the retro racing world and emerge as the champion,nan,nan,nan,nan,nan,nan
1610668800,[34],247570,Crystal Colors,"[3, 6, 14]",Created for Winter VN Jam 2020  Crystal Colors is a game about two girls trying to live normally in a world that is slowly fading away into pure nothingness  Will you be brave enough to saved your loved one or will you be erased too,Missing,nan,nan,nan,nan,nan,nan
1609718400,[34],246697,Digital Seclusion,"[3, 6, 14]",Isolated in a room repurposed into a personal shrine to esoteric Japanese media Our nameless protagonist has dedicated himself to a collection of retro Japanese computer games with a particular fondness for early visual novels Although decaying in a slovenly existence to the untrained eye his retreat into digital life is enriched by the scripted interactions with various charming 2D girls His one purpose in life is to chronicle his thoughts and reflections on each of the digital worlds he immerses himself in However one day while pulling out the box of another visual novel to review a girl leaps straight out of the cover art and begins interacting with him face to face And perhaps most shocking of all to him in a completely unscripted manner,Missing,nan,nan,nan,nan,nan,nan
1610841600,"[8, 9, 31, 32]",244986,Tenchi Shinden,[6],Jump into this platformer with a unique dimensional twist Play as a ninja with the power of Tenchi,As a ninjaintraining you always respected your sensei However one fateful day she taught you the power of 天地 Tenchi  With this power inhand and a thirst for adventure you set out for your closest training temple 天地神殿 Tenchi Shinden to truly harness your new power  What events will unfold as you explore the depths and ruins of this preancient temple trying to reclaim the lost 交換結晶 Koukan Crystal Only time will tell,nan,nan,nan,nan,nan,nan
1610755200,"[9, 31, 33]",239528,Zanzlanz's Collector's Bundle,[6],A bundle of 11 arcadelike games complete with a launcher that tracks all 100 achievements When you win you get a sweet spot on a winners leaderboard,Missing,nan,nan,nan,nan,nan,nan
1611532800,"[2, 9, 15, 33]",238956,Popgoes: Archives,[6],An official collection of all of the major previously released Popgoes content that is now noncanon due to the current reboot Popgoes is a game series based on Five Nights at Freddys,Missing,nan,nan,nan,nan,nan,nan
1609545600,"[13, 32]",236402,Durka Simulator,"[3, 6]",Durka Simulator is a visual novel where you are waiting for adventure and mysteryYou as the main player are being sought to take away your powerYou and mysterious must not let them catch youWith you will always be your friends as a lemur named Zina Mysterious and Larry,Missing,nan,nan,nan,nan,nan,nan
1611532800,"[5, 12, 31]",233221,Andromeda Zombies Colonies,[6],Andromeda Zombies Colonies is an First Person Shooter video game featuring zombies You awaken near a station on a red planet but an experiment turn wrong and now hostile aliens have invaded the colonies and they target you You must survive using the weapons at your disposal,Missing,nan,nan,nan,nan,nan,nan
1610236800,[33],233021,Imposters: Countdown,[6],Complete tasks  minigames Report bodies Call voting sessions Hack the station Overload the reactor Betray your friends An online party game of teamwork and betrayal for 412 playersin third person Escape the ship before the countdown runs out Dont get fooled by the rogue AI,Missing,nan,nan,nan,nan,nan,nan
1611360000,Missing,232806,Portal 1 Multiplayer,[6],Missing,Missing,nan,nan,nan,nan,nan,nan
1611360000,"[2, 31, 32, 34]",231365,Locke(d),"[3, 6, 14]",An algorithm decided to show you this What now,You wake up sitting across from a beautiful stranger  There is nothing I want more than to talk to you right now  And so you talk,0.0,0.0,0.24,64.0,10.0,15.0
1611273600,"[9, 31]",229210,Dawn of Dark Blood,[6],Dawn of Dark Blood is a psychological Thriller puzzle game inspired from old ps1 games like Silent Hill and Resident Evil with a pinch of VHS for effect  Michael son of a poor maid gets a letter from his mother asking him to visit as the person for whom she works has a job for him But when he arrives troubling and horrifying secrets about the Mansion are uncovered,Missing,nan,nan,nan,nan,nan,nan
1612051200,Missing,228751,The Mold Exorcist,[6],You are a mold remediator just doing their job,Missing,0.17,0.0,0.0,70.0,1.0,1.0
1611964800,[5],222677,The Mucus Empire,[6],A fairly challenging slaughter map by me  It could be a little difficult for beginners or somebody who prefer more relaxing gameplay you can just lower the difficulty  Have a good time,Missing,nan,nan,nan,nan,nan,nan
1611705600,[5],222621,Disparate Realities,[6],A set of 9 slaughtermaps designed to be played from pistol starts 10th map is an end map with no gameplay MAP08,Missing,nan,nan,nan,nan,nan,nan
1611619200,[34],218151,Cute Cock Clicker,"[3, 6, 14, 34, 82]",Poke sexy men with objects until they take their clothes off,Missing,0.0,0.0,0.0,0.0,0.0,0.0
1611705600,Missing,216343,Santego Special Unit,[6],Santego Special Unit is a mod for Max Payne 2 The Fall Of Max Payne based on HalfLife Opposing Force,Santego Special Unit continues the story of Shepard from HalfLife Opposing Force,nan,nan,nan,nan,nan,nan
1610150400,"[12, 31, 32]",213254,Undertale: Bits and Pieces,[6],Undertale Bits and Pieces is a mod of Undertale featuring completely overhauled graphics new areas new enemies and remixed music as well as backporting content from its successor Deltarune,Missing,nan,nan,nan,nan,nan,nan
1610668800,[5],209128,Time Tripper,[6],Time Tripper is a WAD developed by Emma Essex The game features a custom protagonist Doomelph who must defeat many of DOOMs monsters alongside new ones and traverse spacetime,Missing,nan,nan,nan,nan,nan,nan
1611705600,"[32, 33]",207173,Breathe In,"[6, 82]",Breathe in is a game about Meditation You control your focus and must navigate your way to the breathe in and breathe out pick ups in order to focus on your breathing Breathing lessens your tension which builds up over time if you let your Tension get too high you will lose the game,Missing,nan,nan,nan,nan,nan,nan
1611705600,[5],205051,Halo: The Master Chief Collection Season 5 - Anvil,"[6, 49, 169]",Titled after both the Anvil Initiative and ANVIL Station Season 5 added the AKIS and Mariner helmets into Halo Reach years after being teased in promotional material for the Defiant Map Pack in 2011 alongside nameplates and additional cosmetic customization options to Halo Reach and Halo 3 including 12 armors from the cancelled Halo Online for the latter,Missing,nan,nan,nan,nan,nan,nan
1610323200,[34],204254,Gran Empire: Amane,[6],Missing,Missing,nan,nan,nan,nan,nan,nan
1611964800,"[7, 32]",203207,Lofi Hip Hop Worlds to Study in,"[6, 14]",Welcome to a bunch of chill 3D worlds full of unique study spots with Lofi Hip Hop music and ASMR sounds You can explore them to relax while you take a break from studying  When its time to study again you can set a timer and put these worlds in the background Nothing is trying to hurt you You dont need to fight anything to win You set your own goals and you can customize your own soundscape to help you meet them,Missing,nan,nan,nan,nan,nan,nan
1610841600,[8],202233,Sonic 1/2 2013 Decompilation,"[3, 6, 14, 34]",A decompilation for Sonic 1  2 the remastered versions making them playable on computers since the original releases were only for mobile platforms The mod also comes with a builtin mod loader,Missing,nan,nan,nan,nan,nan,nan
1611705600,[5],196498,Quake: Torrent of Impurities,[6],Finnish mappers of the first acclaimed SMEJ came back for an episode jam 2 the sequel to Realm of the Lost seven large maps in varying themes based on the Copper mod included It also features four new monsters a new boss a few new sounds and music tracks The map pack then inspired the community to create a SMEJ Map Jam with no intervention from the original SMEJ team,Missing,nan,nan,nan,nan,nan,nan
1611100800,[5],196488,Quake: Blue Monday Jam,[6],Bluethemed community map pack with 15 mostly small to mediumsized levels including a start map It comes with a few highres textures custom skyboxes and music tracks The map sources are included Each of the maps have a blue palette to strands from the usual monotone brown palette of Quake  Note These maps require Quoth 22 and a source port supporting the quoth commandline switch Additionally for some of these maps it must have increased limits andor BSP2 support,Missing,nan,nan,nan,nan,nan,nan
1611187200,"[10, 14, 31, 32]",194522,Interstate Drifter 2000,[6],Drift through the interstates and sideroads of this open game world win street races and try to avoid traffic and police,Missing,nan,nan,nan,nan,nan,nan
1611964800,"[15, 31, 32]",193609,Aladdin: Save the Princess,"[3, 6, 14]",Come and save the princess in this game with exciting new levels Simple to control You can play with one hand very fast Luckily Princesss friend has found you for this job Good Luck Let God be with you,Missing,nan,nan,nan,nan,nan,nan
1611619200,"[32, 33]",191319,Pink or Blue,"[6, 34]",Choose the image in the center if its pink or blue,Choose Pink or blue depending of the image of the center,nan,nan,nan,nan,nan,nan
1611273600,[32],189339,DreamScapes Dimensions,[6],A free to play first person medieval fantasy MMORPG PreAlpha  Solo Indie  Retro Look and Feel  Versatile Character Creation  Tutorial Quests  Harvesting and Crafting  Skills and Spells  Player Building  Procedurally Generated Random Adventures  Daily Gifts,Missing,nan,nan,nan,nan,nan,nan
1610409600,"[5, 31, 32]",187438,Windfolk: Sky Is Just the Beginning,"[6, 48]",Test your flying skills Become the fastest person in Eurian and dont let the enemies stop you Use barrel rolls and acrobatic movements to fly as fast as you can Battle in a unique environment where you have to keep moving in order to dodge the enemies attacks Combine your weapons and skills to create unique effects that will help you defeat your enemies From the tropical seaside with floating islands to the scorching deserts that hold the ruins of an ancient civilization discover the wonderful world of Eurian Go behind enemy lines and explore every corner of each stage,Eurian is a world at war The Coalition seeks to control all the trydian the priceless mineral that keeps the islands floating in the air Esen a soldier in the rebel forces must face them to protect the planet and have her revenge Windfolk is an intense action adventure where you can fly using your jetpack and battle against enemies to achieve victory,nan,nan,nan,nan,nan,nan
1610236800,"[8, 32]",186211,Dino Run,"[6, 34, 82]",Dino Run is a 2D sidescroller made using Flutter and Flame engine It is basically a clone of TRex game that you see in Google Chrome The only difference is this one is much better visually,Missing,0.0,0.0,0.0,0.0,0.0,0.0
1612051200,"[8, 32]",186080,Bounced!,[6],Bounced is a game in which you have to overcome all the levels each level has more difficulties Its a platformaer action and FPS game developed by RMGgames Interactive published in 2021,The game starts at the first level you have to figure out how to reach to the end of each level,nan,nan,nan,nan,nan,nan
1612051200,"[32, 34]",186067,Neo-Programs,"[3, 6, 14]",You are an Angel Your mission is to find and save program WZ07HK Explore the darkness of the simulation until you find it but be wary as deadly threats may come on your way,Missing,nan,nan,nan,nan,nan,nan
1611187200,"[32, 34]",186065,"""Gamer""+ Crossroad of Sympathy","[6, 14]",The definitive visual novel adaptation of the hit web comic Gamer is here This definitive version contains new narration not present in the original narrative along with story changes such as a brand new Character,Missing,0.0,0.0,0.0,0.0,0.0,0.0
1612051200,"[8, 31, 32]",185968,Super Bombinhas,"[3, 6]",A colorful retro 2D platformer open source and created by a solo developer Includes a story mode with 36 carefully designed levels and a level editor,Missing,nan,nan,nan,nan,nan,nan
1609718400,[32],185832,Mending Wall,"[6, 14]",A game inspired by a poem and intended for two playersbut playable solo,Missing,0.0,0.0,0.0,0.0,0.0,0.0
1611100800,"[31, 32, 34]",185808,Você é um Defunto Mecânico,"[3, 6, 14]",Você é um Defunto Mecânico is a short interactive fiction game about a deceased mechanic remembering how he died and the tortured lives that are now left behind,Missing,nan,nan,nan,nan,nan,nan
1611532800,[9],185160,Casadastra,"[6, 14]",Tread with seethrough plan into the ocean of the night,Missing,nan,nan,nan,nan,nan,nan
1609977600,"[8, 31, 32]",184675,Misfortunate Tadpole,[6],A cute onebutton platform adventure,Missing,nan,nan,nan,nan,nan,nan
1610323200,"[31, 32, 33]",184097,Gura's Adventure,"[6, 74]",Heres the best smol and adorable shark Gawr Gura Shes from the mysterious deep sea city Atlantis However the people cant find the city anymore Gura decided to take an adventure Help her to eat some food beat the bad guys and find Atlantis Maybe something still left there then Gura can keep it safe,Missing,nan,nan,nan,nan,nan,nan
1611705600,"[32, 34]",184028,"Liar, Lioness","[6, 14]",Who serves a servant A fairy visual novel about power,Missing,nan,nan,nan,nan,nan,nan
1610323200,"[12, 31, 32]",184025,Orompaquenga,[6],Missing,Missing,nan,nan,nan,nan,nan,nan
1610323200,[9],183682,Znax,"[3, 6]",A Match same tiles puzzle game with 2 gameplay modes and skin support,Missing,0.0,0.0,0.0,0.0,0.0,0.0
1609718400,[32],183613,Super Mumtaz Bros.,"[3, 6, 14, 82]",In Super Mumtaz Bros you join the titular plumbing brothers on their mission to rescue Princess Sana from chickens,Missing,0.31,0.73,0.0,55.0,2.0,4.0
1609977600,"[5, 15]",183499,Crumble and Fall,"[3, 6, 14]",A high tempo build and shoot game,Missing,nan,nan,nan,nan,nan,nan
1611532800,"[9, 33]",182228,Keep Moving Forward,"[6, 14, 34, 82]",Keep Moving Forward is a small arcade game representing the idea of moving forward instead of getting stuck in the past no matter what obstacles may come your way,Missing,0.0,0.0,0.0,0.0,0.0,0.0
1611705600,"[12, 31, 32]",181313,Märchen Forest,"[6, 48, 130]",Mylne an apothecary searches the Mysterious Forest for ingredients so that she can brew her potions But things soon take a dramatic turn from simple errandseventually Mylne finds herself caught up in an unsolved mystery requiring her to take on what lies in the Underground Ruins deep beneath the forest,Missing,0.0,17.44,0.0,0.0,0.0,1.0
1610409600,[8],181240,Pico Sonic,"[3, 6, 14, 82]",1stage demake of Sonic 3 made with PICO8,Missing,nan,nan,nan,nan,nan,nan
1610841600,"[9, 12, 13, 32, 34]",180134,Let's Meat Adam 2,"[3, 6, 14, 34]",LMA2 is a Gay Bara Horror Visual Novel with murder mystery and puzzle elements the sequel to 2017s Lets MEAT Adam,Inseparable friends Adam and River vow to stay in touch once River left to pursue an acting career in LA When he suddenly goes missing Adam leaves his small town life to find him  His trail leads to the most elite gay adult film studio  MANticore Video and its suspiciously tightlipped Director With no help in sight from police or Rivers family naïve Adam opts to go undercover  But once hes thrown in a cavalcade of monstrous depravity and death what lengths will Adam go to save his friend All this culminates to an escape room bloodbath that will drown California in the deepest darkest red,nan,nan,nan,nan,nan,nan
1609545600,Missing,178885,Gura Tambourine,[6],Gawr Gura  Hololive rhythm fangame,Missing,nan,nan,nan,nan,nan,nan
1609718400,[34],178801,Colorful Mirai,"[3, 6, 14]",A VN about a girl going through an art block in the most important moment of her life,Moving to a new city with a best friend and a heart full of hopes This was the perfect scenario for the Heroines new life  She knew from the beginning that fighting for her dream wouldnt be easy but she also wasnt expecting the worst to happen For two years she has fought and endured it all until  One day she woke up and the only thing she could do was stare at the ceiling unable to paint anymore  The girl couldnt feel anything at all She couldnt see the colors or feel her heart beating  Why do I still try  Whats the reason for working so hard on this What Im doing here  Im useless  After all this time fighting against the world the true challenge was about to begin  This isnt just a love story this is about finding your meanings and accepting who you are through the pain and love,nan,nan,nan,nan,nan,nan
1611360000,[34],178722,The Hero's Journey,"[6, 14]",A medieval mystery visual novel,Missing,nan,nan,nan,nan,nan,nan
1609545600,[8],178599,Rayman 4 You,"[3, 6, 14]",Relive your experiences in the colorful world of Rayman Jump around platforms defeat enemies and most important of all find Globox  Rayman belongs to Michel Ancel and Ubisoft Montpellier and this game is not made with lucrative intentions Its a game for the fans by a huge fan of the Rayman saga,Missing,nan,nan,nan,nan,nan,nan
1610323200,[9],178507,B-e-e-t-l-e,"[6, 82]",A relaxing typing game,Missing,0.09,0.0,0.09,67.0,3.0,5.0
1611878400,[32],178289,Demon Doif,[6],The demon Doif requires your assistance minion He is hungry Find the items he wants from amongst the pile Do not get them wrong Feed Doif the correct items If a particular item isnt available stun him and pull the lever to give him memory loss and request a new item,Missing,nan,nan,nan,nan,nan,nan
1612051200,"[9, 31]",177712,Mini Minny and the Missing Magic,[6],Find all of the items and clean up the mess before your mom gets home,In a magical world not too unlike ours a wacky little witch plays with her powers  Using her moms cauldron she tries to brew a potion but something goes wrong and she causes an explosion  And now shes on a mission to find all thats been lost and to bring back the magic no matter the cost,nan,nan,nan,nan,nan,nan
1612051200,"[31, 32]",176710,Riba,"[3, 6, 82]",An interactive atmospheric experience about fishing your grandmas bones,Missing,0.0,0.13,0.0,0.0,0.0,1.0
1610236800,[13],176662,Ruff Times,[6],A cute idle clicker about dogs What could possibly go wrong,As the proprietor of your own kennel its your job to breed and sell dogs to the local pet store Make sure to keep your dogs fed and happy while maintaining your profits,nan,nan,nan,nan,nan,nan
1610236800,"[8, 32]",176125,The Hunt for My GirlFriend,"[3, 6]",A 2D platformer based on GD Quest tutorial,Missing,0.0,0.0,0.0,0.0,0.0,0.0
1610582400,"[12, 31]",174784,Deep Insanity Asylum,"[6, 34, 39]",Set in the near future where humans have to struggle against a sleeping sickness called the Randolph Syndrome The RPG comes as part of the companys Deep Insanity Project which includes an anime titled Deep Insanity THE LOST CHILD and an ongoing manga series,In Deep Insanity ASYLUM players will be thrust into a reality where a massive underground Asylum has appeared in Antarctica The infestation of the Randolph syndrome makes people sleep without waking with over 540 million victims around the world The mysterious occurrence coincides with strange sightings of odd beings that seemingly come from another world one thats too deep underground that humans havent the slightest clue who or what they are,nan,nan,nan,nan,nan,nan
1610668800,[14],174509,BasCatball Jupiter: Basketball & Cat,[6],Play basketball In Jupiter With cats Are you ready for the whole galaxys hardest matches Solve puzzles and win the Bascatball intergalactic championship,Missing,nan,nan,nan,nan,nan,nan
