first_release_date,genres,id,name,platforms,summary,rating,storyline,main,extra,completionist,review_score,review_count,people_polled
780883200,"[2, 13]",93096,Storybook Weaver Deluxe,"[6, 14]",Create your own books with pictures words and sounds  Storybook Weaver deluxe is packed with thousands of storystarting images to stimulate your creativity Write in English or Spanish for hours of creative possibilities And the texttospeech feature lets you hear your story read aloud,Missing,Missing,nan,nan,nan,nan,nan,nan
779414400,"[7, 9]",71297,Vid Grid,"[6, 62, 410]",Vid Grid is a tilematching full motion video puzzle game originally developed by Geffen Records and published by Jasmine Multimedia Publishing for Windows on September 13 1994 It was later ported to the Atari Jaguar CD by High Voltage Software in 1995 where it was included alongside with Blue Lightning as one of the packin games for the peripheral when it launched It is the first entry in the franchise of the same name  In Vid Grid the players have to resolve and finish a jigsaw puzzle in time as their main objective before the music video that is being played on the background ends Conceived by Geffen executive Norman Beil and produced in conjunction with Jasmine Multimedia as a jointventure the game was one of the first titles to use Microsofts Video for Windows multimedia framework which allowed to play and encode digital video up to a maximum resolution of 320x240 pixels  The game includes a total of 10 music videos of different rock genres including grunge rock from Soundgarden and Nirvana hard rock from Van Halen and Aerosmith and heavy metal from Ozzy Osbourne and Metallica During each puzzle the video itself is chopped up into a grid and each piece is scrambled As the video plays players must reassemble the pieces to its original form As players progress through the game each puzzle gets progressively tougher to solve including larger amounts of pieces different puzzle requirements and flipped videos  The game received two spinoff titles Country Vid Grid for country music videos and Kid Vid Grid for cartoons,Missing,Missing,0.67,0.0,0.0,60.0,1.0,1.0
780537600,"[12, 16, 24]",46171,Langrisser II,"[5, 6, 29]",Langrisser II is a turnbased strategy game that was developed by Team Career part of Masaya and published by the parent company NCS Corporation  This version of the game was released on the Nintendo Wii through the Virtual console and was later released for Windows though a classic games service  Unlike the first Langrisser known as Warsong internationally almost all of the other games and remakes in the series have not been released outside of Japan,Missing,Missing,nan,nan,nan,nan,nan,nan
780537600,"[12, 31]",42635,Dragon View,"[6, 19, 58]",Solve puzzles and fight monsters in order to save your love Shes been taken by Giza an evil sorcerror bent on destroying all life in the world Youll journey through different lands in search of clues and powerful items and magic,88.60587494502767,Missing,11.39,12.29,14.36,74.0,8.0,10.0
780883200,"[5, 9]",312,Doom II: Hell on Earth,"[6, 13, 14, 44, 149]",Let the Obsession begin Again This time the entire forces of the netherworld have overrun Earth To save her you must descend into the stygian depths of Hell itself Battle mightier nastier deadlier demons and monsters Use more powerful weapons Survive more mindblowing explosions and more of the bloodiest fiercest most awesome blastfest ever,85.46154287536525,Immediately following the events in Doom the player once again assumes the role of the unnamed space marine After defeating the demon invasion of the Mars moon bases and returning from Hell Doomguy finds that Earth has also been invaded by the demons who have killed billions of people  The humans who survived the attack have developed a plan to build massive spaceships which will carry the remaining survivors into space Once the ships are ready the survivors prepare to evacuate Earth Unfortunately Earths only ground spaceport gets taken over by the demons who place a flame barrier over it preventing any ships from leaving,6.97,9.63,13.51,81.0,652.0,580.0
780278400,"[8, 9, 31]",452,Blackthorne,"[6, 13, 14, 19, 24, 30, 58]",In Blackthorne players take on the role of Kyle Blackthorne a lethal commando equipped with brute strength animal cunning and a mysterious past that he has just begun to remember Thrown onto the futuristic planet of Tuul Blackthorne must contend with a world overrun by mutant monsters and goblin hordes in a valiant attempt to liberate the Androthi people,71.09532290621782,Missing,6.27,7.97,8.7,70.0,32.0,23.0
