,genres,id,name,platforms,summary,storyline,main,extra,completionist,review_score,review_count,people_polled
0,[5],271234,Quakeguy Goes to White Castle,[6],15 speedjam SP levels five custom skyboxes a music track and some map sources,Missing,,,,,,
1,[5],267994,The Antaresian Spacepond,[6],This is a map made for antares031s birthday which was on the 19th,Missing,,,,,,
2,[5],261816,Adonis: Escape from Urania,[6],17map Boom megawad sequel of Urania After defeating the tyrant monster from Urania your spaceship was hit by unknown forces and you had to catapult back to the surface of Urania in the industrial area between the jungle and the mountains Earth coalition ships are under fire and cannot help you Received information from the command center this time the threat comes from the moon of Urania  Adonis The task is to find a way to get to Adonis and destroy the enemies there,Missing,,,,,,
3,[5],257173,Legend of the Hidden Tech,[6],The hottest mesoamericanscifi game show in the ultraverse just got a new contestant But this aint no Price is Right If you want to win the big prizes youll have to fight your way through ancient ruins mysterious tombs notsotranquil lakes and demonic arenas Dont worry though Whether you live or die its all for a good cause entertainment  Legend of the Hidden Tech is a 9map episode for limitremoving ports made by members of Doomer Boards The set features 7 regular maps 1 monsterless progressionstopper and a very special bonus map from SuperCupcakeTactics Props to overlord Big Ol Billy for leading this,Missing,,,,,,
4,"[31, 34]",255115,Maid for Loving You,"[6, 34]",Average guy Yuuma suddenly finds his boring life becoming way more exciting when he encounters a mysterious woman named Eve Join him as he discovers the joys of having a livein maid in this heartwarming visual novel,Yuuma Kitami is your typical wage slave Wake work sleep repeat Robbed of his ambitions by the grind his daily life is filled with endless overtime leaving him little time for a social life let alone a girlfriend But that all changes one midwinter night After catching the last train home he finds a woman unconscious by his front door mere moments from freezing to death  Yuuma acts fast bringing the woman into his home and doing everything in his power to warm her back to life When she eventually comes to the woman introduces herself as Eve and wants to thank him for saving her To Yuumas shock she offers to be his maid Though initially reluctant he soon relents and the two start living together  Eve is a peculiar yet lovely woman with the odd quirk or two and Yuuma finds himself strangely drawn to her Join them on their journey as they learn more about each other themselves and the true meaning of love in Maid for Loving You,,,,,,
5,[12],252909,PersoNO 0,[6],PersoNO 0 is a fulllength original parody of Persona 3 and a sequelprequel to the original and kinda crappy PersoNO that centralizes the themes of death and moving on after loss or maybe it just centralizes an apathetic tender man with one eye trying to get some alone time with his robot girlfriend  Step into the shoes of renameable protagonist Chungus Munshinyour ordinary 17 year old boy with dead parents one eye blue hair and seemingly no emotions Life finally seems like its looking up for Chungus as he transfers to Gekkoukan High School and even receives a personal invitation to stay at the Iwatodai Dorm He even makes some interesting new friends who are eager to pretend like they dont know him  However after an unfortunate incident involving a large blob monster and a gun Chungus learns that hes had a hidden talent all along calling forth a vuvuzelawielding Persona by the name of Orpheus by shooting himself in the head After this little stunt Chungus accidentally ends up leading the group known as SEES in their battles against the entities known as Shadows as they fight to find a way to end the Dark Hour with a reasonably low body count,Missing,,,,,,
6,[31],250642,Saltwater Shells,[6],Play as Loke a small kid from a small island helping your mom collect shells for the decorations in the upcoming town festival Collect shells a pogo stick and other items to help you get as many shells as you can Explore the island and talk to everyone theyll help you reach that perfect score,Missing,,,,,,
7,Missing,248804,Let Your Egg People Grow Into Large Trees,"[6, 14]",interactions are cyclical destruction leads to growth learn to balance,Missing,,,,,,
8,"[5, 32]",246677,Touhou Mukyuushi: Glory of Deep Skies,[6],Touhou fangame developed by Τeam αlternative Σnding and programmed by Kirbio Gizmo the Dragon Aka Kyuketsuki and Lunarethic This game features 3 stages and a 4th unlockable stage instead of the standard 6 The main gameplay mechanic of Glory of Deep Skies is the Elemental Burst system If the player collects Elemental Orbs of the same attribute as the one they chose at the beginning of the game an Elemental Gauge is filled up Once full the Elemental Gauge can be emptied for a boost with various duration and effects depending on the attribute chosen and during this time all items become life and spell pieces,As Halloween night approaches Gensokyo begins experiencing increased frequency of lightrelated phenomena such as rainbows and auroras and an increased potency of magic that results in normallyharmless danmaku battles causing physical damage to their surroundings After hearing reports of mysterious figures violently battling above the Human Village and causing major collateral damage Reimu Hakurei and Marisa Kirisame set out to investigate,,,,,,
9,[32],242511,Dinosaurily,[6],Missing,Missing,,,,,,
10,"[2, 32]",240372,The EdCo Incident,[6],A pointandclick style horror game made in Microsoft PowerPoint over the course of nearly 3 years,Missing,,,,,,
11,"[12, 31]",237701,Assassin's Creed III Remastered,"[6, 48, 49, 130, 170]",Relive the American Revolution or experience it for the first time in Assassins Creed III Remastered with enhanced graphics and improved gameplay mechanics Also includes Assassins Creed Liberation remastered and all solo DLC content  FIGHT FOR FREEDOM 1775 The American Colonies are about to revolt As Connor a Native American Assassin secure liberty for your people and your nation From bustling city streets to the chaotic battlefields assassinate your foes in a variety of deadly ways with a vast array of weaponry  A NEW VISUAL AND GAMEPLAY EXPERIENCE Play the iconic Assassins Creed III with enhanced graphics now featuring 4K resolution new character models polished environment rendering and more The gameplay mechanics have been revamped as well improving your experience and your immersion  ADDITIONAL CONTENT Also includes all the original solo DLC including The Tyranny of King Washington and the full game Assassins Creed Liberation Remastered,Missing,14.37,30.3,53.72,69.0,397.0,634.0
12,"[13, 14, 32]",233834,Fat Prisoner Simulator,[6],Fat Prisoner Simulator  a soccer simulator where you play the role of a prisoner The jail managers have noticed that some prisoners who really like to eat a lot can hardly go through the doors including those of their cells,Missing,,,,,,
13,[31],232769,The Wind,"[6, 82]",The Wind is a short retroinspired pixel horror game based on The Wind from 2019 directed by Emma Tammi  The Wind tells the story of Lizzy a tough and resourceful plainswoman and her struggle against supernatural forces around her isolated home,Missing,,,,,,
14,[13],230123,Senpai Teaches Me Japanese,[6],Do you know any Japanese Based on textbook learning methods at the end of this game you will know how to read Japanese characters sentence structure and 100 words,Missing,,,,,,
15,"[13, 32]",230122,Hyper Mum Ft Adult Gaming,[6],Have you got the skills to overcome the problem that has plagued you all this time Its time to find out Play as yourself complete the game and dont let your mum catch you,Missing,,,,,,
16,[32],228997,We Have a Frog Problem,[6],A circular toy with frogs physics and jokes,Missing,,,,,,
17,"[4, 33]",224472,Fighting EX Layer: Character - Terry,"[6, 48]",Adds Terry Bogard character to the main game,Missing,,,,,,
18,Missing,224422,Tom Clancy's Rainbow Six Siege - Pro League Clash Set,[6],Celebrate the Rainbow Six Siege Pro League with Clashs Gold Chibi charm Celestial Glory uniform Challenger headgear and Halcyon Flux weapon skin for the SPSMG9 and the CCE Shield,Missing,,,,,,
19,Missing,223864,After Solitary,[6],The story of a mans life after solitary confinement,Missing,,,,,,
20,"[31, 34]",222841,Alpha-Nighthawk,[6],Some 380000 kilometers above Earth Consuelo the Space Rose blooms in the moonlight its origins and intentions a mystery It last launched a Thorn five years ago and all thats left of Tokyo today is the lawless Red Zone a slum within a slum sealed off from the world,Bathed in the light of the moon a giant rose blooms in full glory It hangs darkly in the night sky suspended in space some 380000 km from Earth With its true name and nature unknowable we humans have taken to calling it Consuelo  In Bayshore Daiba City life goes on in the Red Zonea lawless slum sealed off and forsaken since a Thorn impacted the Earths surface from space devastating Tokyo and infesting ground zero with monsters It is here that STX Space Force pilot Miriya Hakone first encounters one Ichizo Yodaka a former elite pilot now fighting Consuelo alone from aboard his trusty BattleSHEEP  A new boymeetsgirl scifi adventure series is about to begin,0.0,0.0,0.0,0.0,0.0,0.0
21,[34],221043,Horny Elves and a Moral Orc,[6],ased on a 4panel comic by Tomokichi about the only suvivor of the orc tribe and a pervert elf who gets aroused by the orc,In the past orcs were once feared for pillaging villages and raping the women however they pleased After the Orc and Elf War all but one orc was eliminated Donovan the last surviving orc vowed to the Goddess that he would never have sex with an elf To guarantee that Donovan stays the course a curse was placed on him if Donovan was to fuck an elf he would die Since that day Donovan has kept his vow for years living a quiet and honest life thereafter Unfortunately these quiet days came crashing down when two horny elf sisters hungry for orc cock happened to find him Myshla and Eymie want nothing more than to be ravaged by an orc and theyre willing to go as far as raping Donovan to make it happen Thus begins Donovans desperate battle for his life as he tries to avoid the sisters temptations,,,,,,
22,Missing,221008,Fairy in a Jar,[6],Fairy in a Jar is a short but enchanting fairytale It tells the story of a fairy who lost their memory and was kept in a jar by a human  The fairy awakens in the glass enclosure with no memories From the moment they open their eyes the little fairy sees nothing but white lights They meet Mr Giant who is scary but also a bit clumsy  In a completely unknown world with limited living space and a captor who speaks a different language What should the fairy choose To escape this prison or,Missing,0.0,0.0,0.0,0.0,0.0,0.0
23,[31],220769,Yume no Radio,[6],Yume no Radio is a Japanese Yume Nikki fangame You play as Kakutsuki and explore her dream world The goal is to explore and collect effects which are some objects that glow lights A minigame called Shiwake is accessible by interacting with the device next to the notebook,Missing,,,,,,
24,[34],210406,Hot & Steamy Knights,"[3, 6, 14, 34]",Our heros quest to grow his harem appears to be thwarted after his ship is sunk and he washes up on a mysterious island with nothing but his sword to keep him safe Luckily for him he soon encounters mature  beautiful knights who make perfect candidates to spend some hot and steamy nights,The call of adventure or the urge to meet hot babes burns brightly in our heros heart as he sets out to sea to explore distant lands He quickly finds himself in danger as his ship is sunk by some sort of sea monster Luck is on his side however as he is washed up on an island where he quickly encounters some beautiful warriors who made short work of the beast that sunk his ship So begins our heros plan to spend some hot and steamy nights with these busty mature knights,0.0,0.0,0.0,0.0,0.0,0.0
25,"[11, 13, 15, 31, 32]",210216,Touhou Big Big Battle: The Justice,[6],The Adventure Expansion Pack is a large number of new events that include the adventure mode of the Eastern Wars New levels new bosses new props etc dlc expansion packs,Missing,,,,,,
26,"[9, 31]",209782,Giftscop,[6],Giftscop is a fanmade recreation of the fictional game Petscop from the web series of the same name,Missing,,,,,,
27,[32],208260,Hina-chan Snowtime,"[6, 34]",A doujin game by ISY based on the Touhou Project series,Hinachan comes to play in the snowy mountains because she has no job offers She slips and falls down the slope and becomes a snowman  While asking for help she also asks I wonder how big it will get the spirit of a comedian was on her neck  With the help of other youkai in the area Hinachans silly challenge has begun,,,,,,
28,"[9, 25, 31]",207265,LEGO DC Super-Villains: Batman - The Animated Series Level Pack,"[6, 14, 48, 49, 130]",Download now to get access to Batman The Animated Series This level pack is based on the Mask of the Phantasm Fight Joker and Captain Clown alongside the Phantasm This level pack includes Batman TwoFace Captain Clown Harley Quinn Joker The Phantasm ManBat Mad Hatter,Missing,,,,,,
29,"[9, 31, 32]",205070,Fura-fura Bouken Flan-chan: Kaizoku Zaihou Tanken-tai,[6],A doujin game by Nuu based on the Touhou Project series,A phantom treasure said to have been buried by pirates a long time ago Although stories were passed down there was no one to follow the legend Then word got out that the treasure had been discovered by chance in a certain place With a shovel in hand Flan and her friends set off on a journey through the forest and across the plains sometimes running into bad guys and sometimes getting into a bit of mischief,,,,,,
30,"[5, 31, 32]",199783,Touhou Makuka Sai: Fantastic Danmaku Festival Part II,[6],Touhou Makuka Sai Fantastic Danmaku Festival part II is a danmaku shooting game which is the second part of Touhou Makuka Sai The repeat of incident is coming again Can the girls going to the netherworld solve the mystery,The spring of Gensokyo arrived one month ago Unprecedented blizzard suddenly hit making Gensokyo become colder than Winter Soon Youkais became restless under the overwhelming blizzard Its too similarit shouldnt be a coincidence should it Miko from jinja witch from forest and wind priestess specially comes for the incident gather again They all know something in heart but also full of uncertainty and anxiety To solve the mystery before thing goes worse they have to start off to find out the root of the incident even under the fierce blizzard,,,,,,
31,"[13, 32, 34]",198466,Cherry Kisses,[6],Cherry Kisses is a visual novel dating sim that takes place over the course of one week running your shop for various monstrous companions,Missing,0.0,0.0,0.0,0.0,0.0,0.0
32,Missing,192392,Detritus,[6],Wander through a museum of images scattered across your computer curated by friendly ghosts  Let the ghosts lift up whats left to rot on your computer The messier the computer the better,Missing,,,,,,
33,[2],191650,Grim Tales: The Nomad,"[6, 14]",Your sister Luisa once again needs your investigative help to solve a bizarre series of robberies plaguing her museum and others around the city No one has seen the suspects come and theyve left few clues behind Use your powers to travel to the past and uncover the culprits But be careful youll also uncover a shocking revelation about the Gray family in this heartwarming hiddenobject puzzle adventure game,Missing,,,,,,
34,Missing,186161,Intro Fighters,[6],Intro Fighters is a Twitchtv overlay game that allows your viewers take part in a fighting minigame,Missing,,,,,,
35,[32],186085,Planetary Grapple,[6],Your job is to collect to fallen parts of your old planet to build a new home In addition you can also collect artifacts that are saved across play sessions Among these you can find quite a few easter eggs and some droplets of lore,Missing,0.0,0.0,0.0,0.0,0.0,0.0
36,"[15, 32, 35]",186070,Cantrip,"[6, 14]",Battle build your deck and earn new cards in this roguelite where your hand is your health if you get hit when you dont have any cards its game over If you prevail however you get to draft new cards for your deck before moving on to the next fight,Missing,0.0,0.0,0.0,0.0,0.0,0.0
37,"[9, 32]",186066,_________ (What Even Is That Thing?),"[6, 14]",Close your eyes  Now reach out carefully until you touch something Feel it examine its shape its edges and contours  Now tell me what it is  That is how you play ________,Missing,,,,,,
38,"[8, 32]",184836,Burd.,"[3, 6, 14]",the kingdom of birds has fallen and will not again rise from the ashes,Missing,,,,,,
39,"[9, 34]",183422,Prison of Lies,"[3, 6, 14]",Four innocent prisoners on death row must decide which among them will die to meet the prisons quota,Missing,,,,,,
40,"[5, 9, 12, 31, 32]",183074,Hedon Bloodrite,[6],Immerse yourself in a crystalpunk underworld where the visceral combat of the 90s FPS games blends with the exploration and puzzle solving of classic dungeon crawlers and adventure games,Missing,22.3,30.29,41.24,80.0,11.0,16.0
41,"[12, 31]",182036,Crystal Wish: Classroom Dungeon,[6],Missing,When Serena visited her sisters school the last thing she expected was to be forced with her friends into an RPG game Shrunk to size of pawns and facing dungeons made out of desks and magic the girls will have to face the challanges of a self proclaimed Game Master Genie to get their size and freedom back,,,,,,
42,[13],181537,Streamers Company Tycoon,[6],Missing,Missing,,,,,,
43,"[8, 9, 13, 15, 31, 32]",180370,Head North,"[3, 6, 14]",Welcome To Head North A TopDown FastPaced Puzzle Platformer where you guide our protagonist Fell north by using the ancient power known as Earth Shifting  How far north will you get,Missing,,,,,,
44,"[32, 34]",178788,Crescent Coffee,[6],Find love at a spooky nocturnal café,Missing,,,,,,
45,"[7, 31, 34]",178481,Pilgrimage,"[6, 14]",A visual exploration through abstract landscapes accompanying music  lyrics of Panorama,Missing,,,,,,
46,[32],177706,Femdom Waifu,[6],Femdom Waifu is a JOI Jerk Off Instruction game where the player is controlled by cruel dominatrix,Missing,0.53,0.0,3.0,40.0,1.0,4.0
47,[8],177185,How to Be a Tree,"[6, 14]",How to Be a Tree is a game about the many ways to be a tree,Missing,,,,,,
48,[13],176491,Make Sure It's Closed,"[6, 14]",A minutelong horror game about a childhood fear of mine,Missing,,,,,,
49,Missing,176009,Shadow Corridor,[6],Now on Steam revamped with brand new content Immerse yourself in the latest chapter of the popular Japanese indie horror title Kageroh Shadow Corridor Survive against the onslaught of horrors that lie in wait in eerie traditional Japanese locales that change with every playthrough,Missing,0.0,0.0,0.0,55.0,2.0,0.0
50,"[15, 31]",174415,The Lord of The Rings ACG: The Shadow's Fall Expansion,[6],The Shadows Fall is the first expansion for Lord of the Rings Adventure Card Game Coming with 4 new Heroes packs and continuing the Shadows Reach storyline Dive further into Bilbos journey ,Missing,,,,,,
51,"[9, 12, 31, 32]",172854,Shadow Corridor,"[6, 48, 130]",Chased by the spirits of the cursed Noh mask you must do everything you can to escape Set in traditional Japanese locales Shadow Corridor provides a unique survival horror experience Randomly generated maps filled with a variety of items make every playthrough different Immerse yourself in the darkness for only the determined will survive,Missing,0.0,0.0,0.0,55.0,2.0,0.0
52,"[31, 32]",170909,Caveblazers: Together,[6],Caveblazers Together is an online multiplayer mod for Caveblazers  team up with up to 3 friends on your adventures,Missing,,,,,,
53,"[13, 14]",170447,Fire Pro Wrestling World: Fighting Road - 2017 NJPW Junior Heavyweight Championship,[6],You never forgot the excitement you felt when your father showed you your first junior heavyweight match Now you step into the NJPW dojo to realize your childhood dream of becoming the best junior heavyweight the world has ever seen,Missing,,,,,,
54,[4],168723,SoulCalibur VI: Amy,"[6, 48, 49]",Celebrate 20 years of SOULCALIBUR with an all new playable character Amy,Missing,,,,,,
55,"[13, 32]",167755,Lotus Simulator: München Tram,[6],The first addon for the Lotus Simulator the Munich Tram With the tram R22b of MVG you can virtually drive through the city centre of Munich and explore the scenery along routes 27  28 Detailed reconstructed and perfectly animated Take control at the drivers seat lets go,Missing,,,,,,
56,[32],162598,Coloring Pixels: Animals Pack,"[3, 6, 14]",Unlocks the Animals themed book for Coloring Pixels Includes 20 new animal themed levels to complete Expect images of animals from all walks of life everything from eagles and butterflies to snails and cats,Missing,,,,,,
57,"[31, 32]",162451,Nothing!,[6],What do you play I play nothing,Missing,0.03,0.0,0.11,10.0,2.0,2.0
58,"[13, 14, 15, 32]",162158,Jigsaw Puzzle Pack: Pixel Puzzles Ultimate - USA,[6],Pixel Puzzles Ultimate redefining digital puzzling,Missing,,,,,,
59,[31],161199,DC Universe Online: Episode 34 - Justice League Dark,[6],An ancient evil magic from another plane has surfaced in Episode 34 Justice League Dark A daemonic threat looms over Gotham City Join Constantine Zatanna Shazam and the Justice League Dark to stop the invasion before its too late,Missing,,,,,,
60,"[15, 32, 35]",160296,100% Orange Juice: Iru & Mira Character Pack,[6],This extra character pack for 100 Orange Juice adds 2 new playable characters  the gun expert Iru and the ninjaesque Mira The new characters come fully voiced,Missing,,,,,,
61,"[30, 32]",158470,Zaccaria Pinball: Devil Riders 2019 Table,"[3, 6, 14, 130]",Devil Riders 2019 Table is a modernized version of the original Devil Riders table from 1984,Missing,,,,,,
62,[13],157845,Microsoft Flight Simulator X: Steam Edition - Piper PA-28-181 Archer III,[6],The Archer III is flown all around the world and in addition to our UK research aircraft G CIFY the product will feature liveries from the USA Canada France Australia and Germany,Missing,,,,,,
63,[13],157797,Microsoft Flight Simulator X: Steam Edition - Air Hauler 2,[6],Take charge of operations both in the boardroom and in the cockpit Go global and create your own Virtual Airline and recruit other AH2 pilots to fly for you with attractive payouts or you can join another pilots booming airline and fly for that alongside your own company,Missing,,,,,,
64,[13],157765,Microsoft Flight Simulator X: Steam Edition - P-51H Mustang,[6],The aircraft has been detailed inside and out down to the last rivet and features smooth 3D gauge technology droppable external fuel tanks working 3D collimating gun sight and authentically reproduced Merlin engine sounds,Missing,,,,,,
65,Missing,155441,Dead or Alive 6: Bayman,[6],Download this to use Bayman in DEAD OR ALIVE 6 Core Fighters Note This content is only for the holders of the DEAD OR ALIVE 6 Core Fighters version of the game This content may be offered for free for a limited period of time,Missing,,,,,,
66,[4],155440,Dead or Alive 6: Hayate,[6],Download this to use Hayate in DEAD OR ALIVE 6 Core Fighters Note This content is only for the holders of the DEAD OR ALIVE 6 Core Fighters version of the game This content may be offered for free for a limited period of time,Missing,,,,,,
67,Missing,155439,Dead or Alive 6: Helena,[6],Download this to use Helena in DEAD OR ALIVE 6 Core Fighters Note This content is only for the holders of the DEAD OR ALIVE 6 Core Fighters version of the game This content may be offered for free for a limited period of time,Missing,,,,,,
68,Missing,155437,Dead or Alive 6: Christie,[6],Download this to use Christie in DEAD OR ALIVE 6 Core Fighters Note This content is only for the holders of the DEAD OR ALIVE 6 Core Fighters version of the game This content may be offered for free for a limited period of time,Missing,,,,,,
69,Missing,155436,Dead or Alive 6: Eliot,[6],Download this to use Eliot in DEAD OR ALIVE 6 Core Fighters Note This content is only for the holders of the DEAD OR ALIVE 6 Core Fighters version of the game This content may be offered for free for a limited period of time,Missing,,,,,,
70,Missing,155435,Dead or Alive 6: Phase 4,[6],Download this to use Phase 4 in DEAD OR ALIVE 6 and DEAD OR ALIVE 6 Core Fighters This content may be offered for free for a limited period of time,Missing,,,,,,
71,Missing,155434,Dead or Alive 6: Marie Rose,[6],Download this to use Marie Rose in DEAD OR ALIVE 6 Core Fighters Note This content is only for the holders of the DEAD OR ALIVE 6 Core Fighters version of the game This content may be offered for free for a limited period of time,Missing,,,,,,
72,Missing,155433,Dead or Alive 6: Zack,[6],Download this to use Zack in DEAD OR ALIVE 6 Core Fighters Note This content is only for the holders of the DEAD OR ALIVE 6 Core Fighters version of the game This content may be offered for free for a limited period of time,Missing,,,,,,
73,Missing,155432,Dead or Alive 6: Leifang,[6],Download this to use Leifang in DEAD OR ALIVE 6 Core Fighters Note This content is only for the holders of the DEAD OR ALIVE 6 Core Fighters version of the game This content may be offered for free for a limited period of time,Missing,,,,,,
74,Missing,155431,Dead or Alive 6: Nico,[6],Download this to use NiCO in DEAD OR ALIVE 6 Core Fighters Note This content is only for the holders of the DEAD OR ALIVE 6 Core Fighters version of the game This content may be offered for free for a limited period of time,Missing,,,,,,
