first_release_date,genres,id,name,platforms,storyline,summary,rating,main,extra,completionist,review_score,review_count,people_polled
1286409600,"[5, 8, 32]",35176,Explosionade,"[6, 12]",Missing,Pilot an experimental mech and shoot giant grenades to blow up sneaky aliens Stomp their guts destroy their base and save the day,70.0,0.94,0.0,0.0,55.0,2.0,2.0
1287705600,"[2, 9, 31, 32]",10731,Puzzle Bots,"[3, 6]",Missing,Theres a big secret at Dr Hugos Factory for Making Robots When the inventors arent looking their tiny robots go on big adventures They never expected to stumble onto a plot so diabolical it threatened their very existence With lasers It all starts when Zander  possibly the worlds most absentminded inventor  trips over a metal box buried outside the factory When noone can figure out how to open it the Bots sneak out and try it for themselves Join the robots as they outwit mischievous children curious animals and dysfunctional inventors in their quest to find the truth Will the Bots solve the mystery before its too late,70.0,2.49,3.02,2.62,69.0,10.0,35.0
1286496000,"[8, 31, 32]",9821,Diamond Dan,"[3, 6, 14]",Missing,Dragged into Archeology by his uncle Dan decides to take matters into his own hands He discovers ancient temples with long lost treasures and menacing traps Dan follows the clues found in the temples which leads him on a trip across the world bringing him ever closer to making a sensational discovery You will help Dan navigate past the traps collect treasure and reach the bottom of the temples where Dan can find the treasure map that leads him further on his journey,70.0,nan,nan,nan,nan,nan,nan
1288483200,"[12, 31, 32]",8180,Millennium 3: Cry Wolf,[6],Missing,Time is running out for Marine and her friends She needs to find warriors at all costs but all she seems to stumble into is a mermaid a werewolf a dragon and hordes of crazy orcs can you get her out of trouble in one of the best episodes of the awardwinning Millennium series,70.0,14.4,21.56,0.0,70.0,1.0,3.0
1288051200,"[12, 13, 15, 31]",13112,The Sims 3: Late Night,"[6, 14]",Its time to indulge your Sims inner partyloving rock star Let your Sims explore the hectic craze of city life in a whole new way hit the local dive bars go clubbing and party with some bloodsucking vampires Hey they deserve to have fun too just dont let them near your Sims necks This expansion also includes a new set of career options Your Sims can serve up drinks as a mixologist shred on the guitar in a rock band or become a local celebrity who demands VIP seating wherever they go  Your late night lifestyle will affect your home life and the items you can add to your house Apartments and elevators have been added giving you and your Sim family new housing options As for the Sims themselves theyve been given new customization options too Its not just clothing this time but their physical appearance can be altered with muscle tone and the size of their breasts Trying to seal the deal with that hot Sim standing at the bar Flex those muscles baby  Give your Sims social lives a boost Live the celebrity high life with fancy cars and penthouses build a quiet life where you get together with a few friends or become a trainwreck cause a ruckus and get banned from the best clubs in town  its up to you to decide  Hang out at the hottest spots in town from dive bars to dance clubs to chic lounges complete with bouncers Gain fame and fortune as a member of a music band mixologist director or local celebrity Explore certain areas of town in the thick of the night and you may be initiated into the dark life of a vampire Gain access to exclusive areas and enjoy celebrity perks like penthouse living luxury hot tubs and cars  This expansion pack also introduces the brand new city neighborhood of Bridgeport which is divided into an urbandowntown area a less dense uptown area and a hilly affluent suburb,For the first time ever your Sims can experience late night fun as a VIP in The Sims 3 Late Night Get your Sims an allaccess pass to the hottest spots in town Whether they mingle with celebrities or enjoy a casual night with friends your Sims social lives are getting a boost But keep in mind that some scenes are more exclusive than others so make sure your Sims have the right connections to get past the bouncers at the hottest clubs Wherever your Sims go theyll discover new things to become  adored celebrities allnight partiers rowdy bandmates or vampires What will your Sims get up to after dark,69.85431381067858,0.0,20.0,0.0,70.0,6.0,1.0
1287878400,[14],5151,Shaun White Skateboarding,"[6, 9, 12]",Missing,A skateboarding game starring Shaun White by Ubisoft Montreal Brought to you by Stride gum,69.5566870229167,10.33,10.75,0.0,57.0,17.0,7.0
1286841600,[5],556,Medal of Honor,"[3, 6, 9, 12]",Missing,Operating directly under the National Command Authority a relatively unknown entity of handpicked warriors are selected when it is crucial that a mission must not fail They are the Tier 1 Operators There are over 2 million active soldiers Of those approximately 50 thousand fall under the direct control of the Special Operations Command  The Tier 1 Operator functions on a level above and beyond even the most highly trained Special Operations Forces Their exact numbers while classified hover in the low hundreds They are living breathing precision instruments of war They are experts in the application of violence  The new Medal of Honor is inspired by and developed with actual Tier 1 Operators from this elite community Players step into the boots of these warriors and apply their unique skill sets to fight a new enemy in the most unforgiving and hostile conditions of present day Afghanistan,69.34623921532712,5.03,6.17,8.88,64.0,578.0,676.0
1288051200,"[12, 13, 15, 25, 31]",504,Fable III,"[6, 12]",Your journey to rule the throne of Albion begins 50 years after the events of the last chapter and you play as the child of your hero from Fable II,Set 50 years after the events of Fable II the continent of Albion where the Fable series is set is under the control of Logan a tyrant king and the Heros older brother1 The players character the Hero is forced into a quest to become a revolutionary leader to defeat Logan after he reveals his true personality to the Hero Over the course of the first half of the game the Hero will overthrow Logan and become ruler of Albion themselves During the second half of the game a strange force from Aurora called The Darkness will threaten Albion and the player has to decide how to react to it,67.96344916485667,13.29,25.71,46.24,68.0,536.0,488.0
1286409600,[10],7250,WRC: FIA World Rally Championship,"[6, 9, 12]",Missing,WRC  FIA World Rally Championship is a car racing video game based on the 2010 season of the World Rally Championship WRC It is the first game to be officially licensed by the WRC since 2005s WRC Rally Evolved and is the seventh game to bear the WRC license The game was developed by Milestone Srl and published by Black Bean Games It was released in Australia on October 7 2010 October 8 2010 in Europe and April 14 2011 in Japan for Microsoft Windows PlayStation 3 and Xbox 360 platforms The developer had also created Superstars V8 Racing and Alfa Romeo Racing Italiano  It features the official cars drivers and codrivers from the 2010 season and from the three support classes Production World Rally Championship Super 2000 World Rally Championship and Junior World Rally Championship The game therefore includes 13 rallies including Rally Finland and Rally de Portugal 550 km of stages are included split up into 78 special stages,64.98862462528045,21.8,33.56,39.0,68.0,11.0,11.0
1288051200,"[9, 31, 32]",16942,Haunt the House: Terrortown,"[6, 14, 39, 46, 82]",Missing,A sidescrolling action puzzle game starring ghosts Leave the dusty halls of an abandoned clock tower to haunt your way through a town in the dead of night Possess objects with your ghostly soul to scare people away from a museum a hospital a theatre and a cruise ship Will you be able to scare everyone out and reclaim what has been lost before the night is over,64.86781817560211,1.65,2.13,5.28,66.0,34.0,52.0
1287705600,"[5, 8, 32, 33]",9945,Super Crate Box,"[6, 14, 39, 46, 130]",Missing,Vlambeers SUPER CRATE BOX is coming to bring back the glory of the golden arcade age when all that really mattered was getting on that high score list Grab your baseball cap and loosen your pants its time to fight endless hordes of enemies and collect every weapon crate you can Prepare for an arcade delight with tight controls refreshing game mechanics cracking retro art and a terribly hip chiptune soundtrack,64.58928043184461,1.06,5.26,7.56,58.0,23.0,20.0
1288051200,"[12, 25, 31]",137,Star Wars: The Force Unleashed II,"[3, 5, 6, 9, 12, 20, 39]",A clone of Starkiller is created by Darth Vader But after he escapes his masters grasp he travels across the galaxy to discover who or what he really is,The Star Wars Saga continues with Star Wars The Force Unleashed II the highly anticipated sequel to the fastestselling Star Wars game ever created which has sold more than seven million copies worldwide  In Star Wars The Force Unleashed the world was introduced to Darth Vaders now fugitive apprentice Starkiller  the unlikely hero who would ignite the flames of rebellion in a galaxy so desperately in need of a champion In the sequel Starkiller returns with overthetop Force powers and embarks on a journey to discover his own identity and to reunite with his one true love Juno Eclipse  In Star Wars The Force Unleashed II Starkiller is once again the pawn of Darth Vader  but instead of training his protégée as a ruthless assassin the dark lord is attempting to clone his former apprentice in an attempt to create the Ultimate Sith warrior The chase is on  Starkiller is in pursuit of Juno and Darth Vader is hunting for Starkiller  With allnew devastating Force powers and the ability to dualwield lightsabers Starkiller cuts a swath through deadly new enemies across exciting worlds from the Star Wars movies  all in his desperate search for answers to his past,63.91887165258461,5.21,7.18,11.82,65.0,552.0,567.0
1286928000,"[12, 25, 31]",7887,Vindictus,[6],Missing,Vindictus is an action MMORPG and a prequel to the popular MMORPG Mabinogi and is known as Mabinogi Heroes in Asia Vindictus takes place in the same setting used in Mabinogi but is placed chronologically several hundred years prior to the first game during a period of war and strife Vindictus follows Nexons traditional freetoplay model The game itself is free to download and play and charges no purchase price The game contains a virtual item shop to purchase ingame items with Nexons virtual currency called NX to enhance the players characters appearance and abilities Also the game has only several premade genderlocked characters representing the different classes The game doesnt have a big persistent world instead it is instance based,60.99418586682654,21.0,1000.0,0.0,61.0,12.0,3.0
1287446400,"[2, 9, 31]",10583,Nancy Drew: Shadow at the Water's Edge,"[6, 14]",Missing,Nancy Drew heads for Japan where shes staying at a traditional ryokan inn for a little RR with Bess and George but when reports of a vengeful ghost start scaring away the guests Nancys vacation takes a turn for terror Itll be up to you as Nancy Drew to uncover the secret that lies beneath the surface before the ghost can take its revenge Dare to Play    Nancy Drew Shadow at the Waters Edge is a firstperson perspective pointandclick adventure game The player is Nancy Drew and has to solve a mystery Explore rich environments for clues interrogate suspects and solve puzzles and minigames,60.87630813189544,9.86,12.82,15.25,79.0,14.0,19.0
1288224000,[5],2608,Bloody Good Time,"[6, 12]",Missing,Welcome to Hollywood The home of fame and fortune Thats what the flyer said anyway The reality hasnt proven quite so fruitful All you need is one shot and youll do whatever it takes to get it Fortunately for you the notorious Director X has arrived in town This well known Horror movie producer always manages to astonish his audience with the realism of his scenes,60.03179544453439,2.03,0.0,0.0,66.0,5.0,1.0
1286755200,"[13, 31, 32]",30146,Governor of Poker 2: Premium Edition,[6],Missing,The Premium Edition includes  6 extra cities  10 extra poker locations  5 more Notorious opponents to defeat  5 extra player colours to choose from  Extra Pro difficulty mode  Quick poker game against all 9 Notorious players  Unique interactive wallpaper Windows  Downloadable theme music,60.0,nan,nan,nan,nan,nan,nan
1287705600,[13],11022,Trainz Simulator: Murchison 2,[6],Missing,Murchison 2 is a merging of the original Narrow Gauge Murchison logging layout with an extensive Standard Gauge rail network  By incorporating landscape based on actual electronic map data with the specially developed Nature Series sets animated waterfalls river splines textures cliff splines rail ledge splines rock splines Murchison 2 takes Trainz to a new level of realism The result is a photorealistic layout set in the steamdiesel transition era that users can submerge themselves in for a complete interactive rail experience  Whether a steamera NG enthusiast or solely interested in SG steam or diesel operation the 440 board Murchison 2 layout contains a huge variety of interactive and interrelated industries that will keep the train enthusiast immersed for many hours of operational pleasure,60.0,0.0,0.0,0.0,0.0,0.0,0.0
1286841600,[12],3234,Arcania: Gothic 4,"[3, 6, 12, 48]",War covers over the Southern Islands like a blooddrenched shroud and finally War reaches the idyllic isle of Feshyr in the Southern Seas The protagonist of Arcania Gothic 4 returns from an adventure to find his home and village torched and looted The aggressors ships  with an Eagle displayed on their billowing sails  escape over the horizon Seeking revenge the hero leaves the destroyed village behind and soon realizes that this cowardly attack did not just happen on a corrupt kings whim An evil power lies waiting at the threshold of this world and our hero will need to face this nameless evil Yet the hero is not alone  his fate is linked to that of a beautiful mysterious lady as well as a powerful artifact from the longforgotten distant past,Arcania is a Fantasy Action game set in a rich world where an entire kingdoms future is at stake Build your strength and learn the skills needed to become a hero as you challenge a mighty king and uncover his dark secrets Travel through a land of different climate zones abundant flora and fauna subterranean vaults and unique towns and castles where clouds darken the skies weather effects such as wind and heavy rain influence an endlessly fascinating game world day and night cycles and a stunning display of light and shadow As you battle the monsters and villains of the land and meet a host of unique characters will you be able to right the Kings wrongdoings and above all what choices will lead you there,56.42322586225154,15.6,21.18,34.85,56.0,116.0,174.0
1288051200,"[2, 31]",4781,CSI: Fatal Conspiracy,"[5, 6, 9, 12]",Missing,CSI Fatal Conspiracy is a game based on the TV series CSI Crime Scene Investigation and is the ninth entry in the game series This game corresponds with the events in season 10 and features known characters from the TV show including Dr Raymond Langston Laurence Fishburne,55.71857980040143,8.21,9.22,10.34,53.0,10.0,22.0
1285977600,"[9, 32]",15063,Zen Bound 2,"[3, 6, 14, 130]",The goal of the game is to paint wooden sculptures by wrapping them in rope  a task that may sound simple but has surprising complexity Each of the levels presents a spatial puzzle that becomes obvious through inspection Some levels feature paint bombs that are helpful in covering complex areas of the object,Wrap your way to bliss in Zen Bound 2 the unique downtempo indie game This is a different gaming experience an opportunity to slow down zone out and focus on a task thats challenging but not stressful a set of gentle puzzles for the mind and fingers to solve Enjoy a calm and meditative gameplay experience with tactile dusty visuals and a sublime enveloping soundtrack by the sensational electronic artist Ghost Monkey,51.09400883765484,4.42,6.45,19.82,62.0,14.0,20.0
1287100800,"[12, 15, 16, 24, 32]",18914,Grotesque Tactics: Evil Heroes,"[3, 6]",Missing,Grotesque Tactics is a highly addictive tactical RPG combining elements of popular Western and Asian console RPGs,50.0,12.67,12.75,14.74,58.0,22.0,45.0
1286064000,"[15, 16, 35]",16225,Guardians of Graxia,"[3, 6]",Missing,Guardians of Graxia takes on the form of a cardbased board game set in a floating island environment high in the sky of the Graxia world Releasing with four powerful Guardians that will guide your armies into battle charge onto the battlefield by laying out your forces strategically Gameplay advances in turns by selecting new unit and spell cards to place and move on the tiled map surface Win by completing any of the numerous skirmishes or by defeating Draknal Trueblood in the games initial campaign,50.0,0.0,0.0,29.52,55.0,2.0,1.0
1286150400,"[4, 9, 12, 13, 15, 25, 31, 32]",16218,Clones,"[3, 6]",Missing,Clones is a friendly fun and engaging evolution to the classic Lemmings puzzle genre which includes robust internetmultiplayer with team play different game modes powerups leaderboards and a builtin level editor that was used to create the singleplayer campaign of over 150 clontastic puzzles spanning 11 CloneMaster bosses over 5 regions of the Clones Planet The Intergalactic CloneMaster Organization welcomes you Take the scenic route and solve the fun and challenging problems crafted by the most cunning creatures in the universe Then try the competitive route and test out your strategies headtohead in realtime against other players from around the galaxy,50.0,0.0,0.0,0.0,70.0,1.0,0.0
1286236800,"[2, 9, 31]",16031,Alternativa,"[3, 6]",Missing,Alternativa is a story that will take you to a world much different to what youd expect in 2045 To a world destroyed by war and revolutions a world led by an oppressive and cruel dictatorship Classic point  click adventure game based on the original scificyberpunk script which is composed of a number of shorter stories that lead us through the lives of individual characters as well as the fictional world of the future,50.0,5.9,8.42,8.67,49.0,10.0,10.0
1286236800,[5],16030,Pound of Ground,"[3, 6]",Missing,Pound of Ground story driven crazy shoot em up with red car and LOTS of zombies The game combines action elements  a wide range of advanced weapons fights with various bosses and spectacular endless battles with the crowds of the undead  with a gripping story full of unexpected disclosures and peculiar characters,50.0,6.9,0.0,8.0,45.0,2.0,2.0
1287964800,"[5, 7, 9, 32, 33]",15387,Bit.Trip Fate,"[5, 6, 14, 37, 130]",Missing,BitTrip Fate is the penultimate chapter in the sixpart BitTrip series and will leave you wondering whats next,50.0,1.56,2.12,5.5,61.0,13.0,13.0
1286064000,"[7, 9, 31]",14848,The UnderGarden,"[3, 6, 9, 12]",Missing,The UnderGarden is a casual Zen game that challenges players to explore beautiful underground caverns filled with strange life forms sound music and plenty of hidden secrets Casual gamers with an affinity towards puzzle games will enjoy The UnderGardens modern exploration quest filled with brain teasing games that combine state of the art 3D rendering and physics based puzzles,50.0,5.29,6.34,9.78,61.0,11.0,9.0
1288224000,[11],2073,Woody Two-Legs: Attack of the Zombie Pirates,"[3, 6]",Missing,Meet Woody TwoLegs the least infamous pirate of the Seven Seas Things have never gone quite right for Woody That is until he scored big time and got his hands on a huge treasure Sailing to a remote island Woody was about to bury his treasure just as any good pirate would do Unfortunately it turned out that the original owners of the treasure namely Mr Jones himself and his retinue of undead pirates had caught up with Woody Small he might be but Woody TwoLegs was not going to give up without a fight Help Woody to fight wave after wave of undead pirates defeat deadly bosses collect bonuses and use devastating special weapons     Woody TwoLegs is a casual score chasing arcade shooter that offers players various degrees of unlockable difficulties building gradually on intensity with wave after wave of attack by the retinue of undead pirates and their unholy allies Part of the addiction lies in the fact that these enemies become increasingly nasty as the player unlocks the various difficulty modes ultimately facing up against the man himself in the ultimate boss fight in Nightmare Mode,50.0,0.0,0.0,3.0,45.0,2.0,1.0
1286668800,"[12, 31]",10295,Faery: Legends of Avalon,"[6, 9, 12, 49]",Missing,Faery Legends of Avalon is a big role playing game packed with a very distinctive ambience and graphic style Create your character embark in a great adventure and discover the fantastic world of Avalon  You will have to understand why this magic world is dying and save the kingdom from certain disappearance In a thrilling adventure where your choices will shape the story develop your character his abilities and special powers as well as his equipment through the victorious battles and accomplished quests  Numerous dangers await you and the battles against some of the creatures and monsters of the game promise to be formidable Gain power and experience and assure the support of friendly companions you will meet through your journey Carefully select who will fight at your side and live the incredible experience of being accompanied by a dragon a troll fairies and other fantastic creatures,49.83436961178745,5.6,7.5,9.41,57.0,27.0,53.0
1287100800,"[8, 9, 31, 32]",27900,Doc Clock: The Toasted Sandwich of Time,"[3, 5, 6, 9, 14]",Missing,Invent almost anything out of everything you find from catapults to incredible flying machines,40.0,3.55,5.82,7.7,60.0,5.0,9.0
1286496000,"[11, 12, 15]",2039,The Kings Crusade,"[3, 6]",Missing,The crowned heads of Europe launch a new military campaign to reconquer the Holy Land The time has come for you to assemble your armies and take back the land as Richard the Lionheart Or assume the role of the great Saladin and defend your people against the oncoming invasion Lionheart Kings Crusade gives you the chance to make the dreams of the past a reality,40.0,5.88,0.0,0.0,70.0,1.0,2.0
1286409600,"[8, 31, 33]",9473,Sonic the Hedgehog 4: Episode I,"[5, 6, 9, 12, 34, 39, 73]",With the Death Egg destroyed Sonic heads off to explore new territories alone However antagonist Dr Eggman has survived their last encounter and has revisited and improved some of his creations from previous games attempting to get rid of Sonic as the first part of his new grandiose scheme,The sequel fans have waited 16 years for is finally here  Sonic the Hedgehog 4 Episode I Featuring enhanced gameplay elements including the classic Sonic Spin Dash and the versatile Homing Attack Sonic the Hedgehog 4 Episode I picks up right where Sonic and Knuckles left off Dr Eggmans back and in an effort to finally rid himself of Sonic he revisits  and improves  the very best of his creations Get ready for the next chapter in an all new epic 2D saga built for old and new fans alike,36.42656957882476,2.6,3.54,5.96,52.0,218.0,192.0
