first_release_date,genres,id,name,platforms,storyline,summary,rating,main,extra,completionist,review_score,review_count,people_polled
1288310400,"[13, 31]",22423,Sexy Beach Zero,[6],Missing,Sexy Beach Zero is the fourth game in the pornographic Sexy Beach franchise developed by Illusion Software,Missing,nan,nan,nan,nan,nan,nan
1286236800,"[13, 14]",21738,John Daly's ProStroke Golf,"[6, 9, 12]",Missing,John Dalys ProStroke Golf will feature fully licensed courses which John has played on bringing the real PGA experience into your home John Dalys ProStroke Golf will also include many different game modes realistic golf physics and commentary by the famous voices of golf delivering the complete golfing experience to golf fans sports fans and gamers alike,Missing,0.0,0.0,0.0,0.0,0.0,0.0
1288224000,"[13, 14]",20682,FIFA Manager 11,[6],Missing,EAs SoccerFootball Manager game for the 1011 season,Missing,0.0,0.0,0.0,60.0,3.0,0.0
1285977600,"[2, 9, 31, 32]",15227,Drawn: Dark Flight,"[6, 14]",A young girldestined to rule but pursued by the shadows A trusted friendbroken but not defeated A tyrantwrapped in the darkness ambitious and cruel Three beacons lay cold on the corners of a kingdom With their light comes hope the dawn of a new day If their fires are lit shadows will be cast into the light But if they stay darkThey will be a reminder Of a future Queen and her kingdom Forever ruled by the night,Iris has escaped from the Tower but she still needs your help Explore the Kingdom of Stonebriar and solve the mysteries of the shadows that prowl its streets in this fun Adventure game Enter magical worlds through colorful paintings and meet a host of fantastic characters that will help you on your quest in Drawn The Dark Flight Only someone with the power of imagination can unravel the mysteries of the three beacons and save a future queen that will bring hope back to a people,Missing,2.21,0.0,3.84,70.0,2.0,5.0
1287014400,"[13, 14]",14889,Championship Manager 2011,"[6, 39]",Missing,Revamped and rebuilt the award winning Championship Manager returns to the iPhone and iPad for the 201011 season,Missing,nan,nan,nan,nan,nan,nan
1287273600,"[9, 32]",11339,Entanglement,"[3, 6, 14, 82]",Missing,Entanglement is a tileplacement puzzle game The player tries to make the longest path possible by rotating and placing hexagonal tiles etched with paths to extend a path without running into a wall,Missing,nan,nan,nan,nan,nan,nan
1288396800,"[9, 31, 32]",10926,Steam Heroes,"[6, 12]",Missing,Help three brave adventurers on their quest to stop the diabolical Baron Von Smogs plot to conquer Steam Land However there is an army of evil minions that stand in your way Challenge yourself in this new puzzle strategy game includes 12 actionpacked stages a full soundtrack competitive online  Combining strategy and skill help three brave adventurers on their quest to stop the diabolical Baron Von Smog and his army of minions from conquering Steam Land  Using classic Match3 gameplay use your skill and cunning to give power to your 3 heroes and their unique abilities Matching colours generates steam of that type your character then utilise the Steam to heal attack and defend your party  Unlike many other Match3 games not every match is a good one Think ahead carefully and ensure that your character use their special combo attacks to defeat the bosses,Missing,0.6,0.72,1.13,10.0,2.0,5.0
1288137600,"[15, 32]",8886,AI War: Children of Neinzul,"[3, 6, 14]",Today I am born today I die The Neinzul are an insectoid race of perpetual younglings that live for an extremely short span before dying and being superseded by fullyaware and vicious replacements Their Enclaves form minicollectives with their own personalities goals and desires In this second expansion to AI War players face off against the Neinzul minor factions against new AI types in general and enlist the help of the friendlier members of this new alien presence  Enclave Starships bring a longawaited feature mobile space docks New map types and new capturables add more excitement Optionally Hybrid Hives bring a new type of AI logic to the game these free agents are like a coordinated pack of velociraptors hunting you against the backdrop of the regular AI forces For advanced players the Hybrid Hives provide more cutthroat opposition than ever,Children of Neinzul or CoN is a microexpansion for AI War from which all proceeds from are donated to Childs Play a charity organization for sick children As of early 2011 over fifteen thousand dollars had been raised and donated The Children of Neinzul expansion adds new features to the game including   36 New Ships  6 New AI Special Weapons  6 New AI types  4 New Music Tracks  2 New Map Modes,Missing,nan,nan,nan,nan,nan,nan
1288224000,"[5, 25]",7152,Radirgy Noa Massive,"[6, 12]",Radirgy Noa features a celshaded graphical style very similar to that of its predecessor and 2player coop Screen orientation is horizontal Ruki Mishima a redeemed villain of the first game joins the cast as a player character,A port for Xbox 360 Radirgy Noa Massive is an Action game developed and published by MileStone Inc which was released in Japan in 2010,Missing,nan,nan,nan,nan,nan,nan
1288051200,[14],6908,Backyard Sports: Rookie Rush,"[5, 6, 12, 20]",Missing,Go long Backyard Sports Rookie Rush offers kids the opportunity to get in the huddle with fanfavorite characters Pablo Dmitri and Joey as they block and tackle their way through energetic kidfriendly football games on 12 interactive neighborhood fields many representing each characters home turf and also a My Backyard field mode in which players can unlock items and populate their unique backyard With hard hitting powerups imaginative new fields stylized graphics exciting new array of supercharged gameplay options and a compelling story mode Rookie Rush is well trained and ready to take down the competition  Kids can play pickup football games with their Backyard Sports neighborhood friends in both single game and tournament options or play the game in Backyard Sports inventive new story mode The Backyard Sports Rookie Rush storyline centers on the Backyard kids who must come to terms with the new kid on the block combine their unique talents overcome egos and the odds in order to win a tournament and a big grand prize,Missing,4.0,0.0,5.12,55.0,2.0,4.0
1287360000,[13],5548,Railworks 2: Train Simulator,[6],Missing,This new version of Railworks contains a range of new features and enhancements including enhanced menus the new RS Cab Control driver interface and new RS Career System scenarios RailWorks 2 features the same routes and content as the original game and only one new route TestTraK based on the Test and validation centre WegbergWildenrath a German testing facility that is used to test the performance and driving characteristics of the trains,Missing,nan,nan,nan,nan,nan,nan
1287014400,[13],2154,Cities XL 2011,[6],Missing,Imagine and conceive cities of all types and sizes on Cities XL planet From a several million citizens megalopolis to a hyped seaside resort to an industrial city everything is allowed in Cities XL 2011 Take advantage of an incredible collection of more than 700 buildings and structures 47 different types of maps featuring realistic environments Enjoy never seen before freedom in a citybuilder,Missing,0.0,57.29,0.0,70.0,5.0,6.0
1287100800,"[31, 34]",12198,Umineko no Naku Koro ni,[6],Missing,Umineko no Naku Koro ni takes place in 1986 on October 4 and 5 on a secluded island called Rokkenjima The head of a wealthy family named Ushiromiya Kinzou who lives on and owns Rokkenjima is near death and eleven of his family members arrive on the island to discuss how Kinzous assets will be divided once he is dead Also on the island are five of Kinzous servants and his physician After the eleven family members arrive a typhoon traps them on the island and shortly after people get mysteriously murdered,91.16089706921844,nan,nan,nan,nan,nan,nan
1286236800,[14],5056,NBA 2K11,"[5, 6, 8, 9, 12, 38, 46]",Missing,NBA 2K11 is a basketball video game developed by Visual Concepts and 2K Sports and published by 2K Sports It was released on October 5 2010 on the Xbox 360 PlayStation 2 PlayStation 3 PSP Windows while the Wii version came out on October 21 2010 Michael Jordan is the cover athlete of the game and is featured in the game in different waysNBA 2K11 is the successor to NBA 2K10  NBA 2K11 is widely considered one of the best sports video games of all time and the best basketball simulation of the seventh generation of video game consoles,88.5337935992882,37.67,160.99,688.12,81.0,37.0,15.0
1288051200,"[5, 31]",27912,Grand Theft Auto IV: Complete Edition,"[6, 9, 12]",Missing,This standalone retail title spans three distinct stories interwoven to create one of the most unique and engaging singleplayer experiences of this generation This definitive Grand Theft Auto bundle boasts hundreds of hours of singleplayer gameplay a full suite of openworld multiplayer game types limited only by players creativity dozens of eclectic radio stations with hours of music and original dialogue,87.99920080659169,nan,nan,nan,nan,nan,nan
1287446400,"[5, 12]",16,Fallout: New Vegas,"[6, 9, 12]",The player takes control of the Courier who is hired by a delivery service to take an unknown package across the Mojave Desert to The Strip but intercepted shot in the head and left for dead by a mysterious man who steals the package After being found by a friendly local robot Victor and healed by a man named Doc Mitchell the Courier is thrust back into the desert to seek revenge and recover the stolen package Through doing this the player becomes caught up between various factions competing for control over the desert and its most valuable asset the Hoover Dam ultimately coming to shape the future of its inhabitants,In this firstperson Western RPG the player takes on the role of Courier 6 barely surviving after being robbed of their cargo shot and put into a shallow grave by a New Vegas mob boss The Courier sets out to track down their robbers and retrieve their cargo and winds up getting tangled in the complex ideological and socioeconomic web of the many factions and settlements of postnuclear Nevada,87.04362817598579,27.36,59.94,131.6,87.0,2027.0,2490.0
1288051200,"[12, 15, 31]",27911,Dragon Age: Origins - Ultimate Edition,"[6, 9, 12, 14]",Missing,Dragon Age Origins  Ultimate Edition includes Dragon Age Origins Dragon Age Origins  Awakening and all nine content packs,86.19993995994106,49.54,72.27,106.08,88.0,642.0,934.0
1287532800,"[8, 31, 32]",885,Super Meat Boy,"[3, 5, 6, 12, 14, 41, 46, 48, 130]",Missing,Super Meat Boy is a tough as nails platformer where you play as an animated cube of meat whos trying to save his girlfriend who happens to be made of bandages from an evil fetus in a jar wearing a tux,83.59248603103781,9.55,18.55,43.63,79.0,986.0,885.0
1286150400,"[8, 9, 31]",11782,Shantae: Risky's Revenge,"[6, 20, 34, 37, 39, 41, 48, 159]",Missing,The sequel to the critically acclaimed Shantae is here Fans asked and WayForward has answered with a powder keg of highoctane hairwhipping hipshaking action available only on the Nintendo DSiWare service Shantae Riskys Revenge sets the bar even higher with thousands of frames of animation huge multisprite bosses and a quest so big its bursting at the seams Guide halfgenie Shantae through haunted wastelands burning deserts enchanted forests dripping caverns and deadly labyrinths Discover magical attacks brew zombie coffee save golden babies and master the art of belly dancing to transform Shantae into more powerful creatures Use your powers to foil the lady pirate Risky Boots and save Sequin Land from certain doom With its infectious characters flirtatious humor and deliciously outlandish action Shantae Riskys Revenge offers up all the hairwhipping bellydancing action you can handle,82.13571768857909,5.12,6.98,7.46,73.0,52.0,89.0
1288224000,"[14, 15]",10055,Blood Bowl: Legendary Edition,[6],Missing,Inspired by the Warhammer Fantasy world Blood Bowl is an ultraviolent combination of strategy and sports games      The Legendary Edition features 20 playable races including 11 that are totally new each offering its own game style Make a competitive team train it and buy the best equipment Brutal victory after victory improve your players skills to make them into true Blood Bowl players      This is a no holds barred bonecrunching sport Even if tactics are your favoured route you can also choose from a large selection of incredible and vicious moves bribe the ref devastating spells or illegal weapons      Blood Bowl Legendary Edition also includes new stadiums and new game modes such as the Story mode Here you will learn of Blood Bowls origins and play the sports most legendary matches in its most spectacular stadiums      Blood Bowl can be played online Create your team improve it and lead it to the top of the official rankings Develop your own private internet league to organize your own tournaments,81.06135295289496,nan,nan,nan,nan,nan,nan
1286841600,"[5, 12]",21758,Borderlands: Game of the Year Edition,"[6, 9, 12, 14, 48, 49, 130]",Missing,Lock Load  Face the Madness Get ready for the mindblowing insanity as one of four triggerhappy mercenaries taking out everything that stands in your way With its addictive action frantic first person shooter combat massive arsenal of weaponry RPG elements and fourplayer coop Borderlands is the breakthrough experience that challenges all the conventions of modern shooters Borderlands places you in the role of a mercenary on the lawless and desolate planet of Pandora hell bent on finding a legendary stockpile of powerful alien technology known as The Vault,80.67645065052106,nan,nan,nan,nan,nan,nan
1286236800,"[8, 9, 31]",2538,Enslaved: Odyssey to the West,"[6, 9, 12]",The story is a reimagining of the novel Journey to the West written by Wu Chengen Unlike the original story that was set in a fantastical version of ancient China the game is set 150 years in a future postapocalyptic world following a global war with only remnants of humanity left along with the still active war machines left over from the conflict Like the original story however the plot revolves around someone who forces the help and protection of a warrior with many characters sharing the same names and roles The games story was written by Alex Garland with voice talent and motion capture from Andy Serkis and Lindsey Shaw,Follow a gripping surprisefilled journey as two dissimilar characters form an uneasy partnership in order to survive through a perilous postapocalyptic America 150 years in the future war and destruction have left the world in ruins with few humans remaining and nature having reclaimed the world,80.45197481000562,9.01,10.56,19.35,76.0,806.0,1005.0
1285977600,"[15, 32]",16208,Archon Classic,"[3, 6]",Missing,Inspired by chess but adding combat that YOU control Archon was the original Battle Chess You must try to outmaneuver your opponent using teams of fantasy creatures or monsters in this epic struggle of Light and Dark On the chess board when you challenge a piece you are teleported into a Combat Arena where you fight in REALTIME until only the victor emerges to claim the square on the chess board Conquer your opponent by defeating all of their pieces on the chess board or claim all the Power Squares for a quick victory You can play FreeForAll mode where its everyone for themselves or play using teams and gang up on your opponents pieces in battle 2 vs 1,80.0,0.0,0.0,16.68,40.0,1.0,1.0
1287964800,"[8, 9, 10, 32]",9561,Nimbus,"[3, 6]",Missing,Nimbus is a unique combination of racing  puzzling The player controls a craft with no means of directly propelling itself and needs to use whatever is scattered around the levels to acquire thrust and reach the goal Traverse a world map with several distinct islands in order to recover your lost love Light on story but heavy on gameplay Nimbus offers several hours of increasingly harder challenges,80.0,3.47,9.47,21.44,64.0,9.0,22.0
1287360000,"[11, 13, 32]",2360,Artemis: Spaceship Bridge Simulator,"[6, 34, 39]",Missing,Artemis is a multiplayer multicomputer networked game for Windows computers and now IOS devices too  Artemis simulates a spaceship bridge by networking several computers together One computer runs the simulation and the main screen while the others serve as workstations for the normal jobs a bridge officer might do like Helm Communication Engineering and Weapon Control Artemis is a social game where several players are together in one room bridge  and while they all work together one player plays the Captain a person who sits in the middle doesnt have a workstation and tells everyone what to do,80.0,nan,nan,nan,nan,nan,nan
1286236800,"[25, 31]",491,Castlevania: Lords of Shadow,"[6, 9, 12]",From Wikipedia Gabriel is sent by the Brotherhood of Light to the Lake of Oblivion where his deceased wife Marie tells him that Spirits who founded the Brotherhood said that the Lords of Shadows power will save the world Gabriel meets a man from the Brotherhood called Zobek who states that a prophecy has been kept a secret by a select few which tells of a purehearted warrior who will claim the Lords of Shadows power to overcome evil Zobek says that he and Gabriel must enter the lands of the Dark Lords in order to unite the Heavens with the world again and that with this Gabriel can bring Marie back from the dead Gabriel defeats the werewolf Cornell and the vampire Carmilla for the first two pieces of the God Mask on his journey while learning that they were once two of the three founding members of the Order who fought the spawns of Satan in Gods favor until they transformed into the Spirits with power only second to Gods After they ascended to the Heavens they left behind their dark sides who were known as the Lords of Shadow,Gabriel Belmont learns of a mask with the power to raise the dead and sets out on a mission to obtain it to bring his recently murdered wife back from the dead  Lords of Shadow builds upon the combat systems first explored in this series in 2003s Lament of Innocence and adds more violent kills to the mix Inspiration for these changes seems to have come from 2005s God of War,79.8491802916811,17.98,22.25,39.3,78.0,310.0,310.0
1287446400,"[5, 31]",3218,Vanquish,"[6, 9, 12, 48, 49]",Since the late 20th century the precipitous pace of population rise on Earth pushed the total number of humans on the planet past 10 billion The lack of consumable food and energy for this expanding population led to numerous wars over depleting natural resources It was in this period of fear uncertainty and doubt that America placed her hopes in the skies with the SC01 Providence space colony  The colony was not immune to social evils that had become prevalent on earth The Order of the Russian Star a faction of the Russian military who had taken power in their homeland via coup détat immediately launched a surprise invasion of the colony They began work converting the microwave energy array into a powerful weapon in the skies then unleashed this fearsome power upon the residents of San Francisco The Orders declaration of war via weapon of mass destruction complete they demanded the unconditional surrender of the United States within 10 hours under penalty of the destruction of New York City  In steadfast refusal to cooperate with aggressors the President had no choice but to order a military strike to annihilate the invaders and recapture the colony The strike was to be led by Lt Col Robert Burns,Players take the role of Sam a government agent who must stop the threat before it is too late Armed with a special suit and a plethora of weapons Sam also has an array of martial arts skills that he can use to take down his robot enemies,79.64531419233369,6.08,8.01,16.7,77.0,871.0,1136.0
1288051200,"[5, 8, 9, 31, 32]",9402,The Ball,"[3, 6]",You reveal ancient ruins that have been hidden from outsiders for centuries and discover a mysterious artifact a gold and metal shelled Ball As you progress towards solving the mystery of this amazing place you must unlock the secrets of the Ball and learn to control this ancient artifact Venturing deeper into the volcano you reveal some of mankinds greatest secrets and you will start to encounter not just puzzles and traps but also various strange creatures  the guardians of this mystery These creatures have to be overcome using only the Ball to defend you,The Ball is a first person actionadventure game featuring a full singleplayer experience As a swashbuckling archaeologist working on the slopes of a dormant volcano somewhere in Mexico you get stuck in a cavern It doesnt take long before you realize this is more than just a cave,77.55006414826495,5.95,7.74,13.05,62.0,50.0,99.0
1288310400,[13],3176,Farming Simulator 2011,"[3, 6, 14]",Missing,The sequel to the bestselling worldwide hit Farming Simulator has loads of new features Assume the role of a farmer experiencing the challenge of 18 hour days running a new farm in the middle of beautiful rolling countryside,76.52674737950036,0.0,0.0,93.03,60.0,2.0,1.0
1287446400,"[12, 16, 31]",5637,Costume Quest,"[3, 6, 9, 12, 14, 39]",Missing,Costume Quest is a rollicking AdventureRolePlaying game that unfolds on Halloween night across seemingly peaceful suburban neighborhoods a mysterious village carnival and a monsterinfested shopping mall Created by Double Fines lead animator Tasha Harris the game follows the adventure of a group of young friends who must rid their neighborhood of monsters using only their wits their bravery and their homemade costumes Players go doortodoor collecting candy points cards battle stamps and quest assignments as they prepare themselves for Combat Modewhere they transform into largerthanlife versions of their costumes Each costume that comestolife provides its own unique set of superpowers that players will need to battle Halloweens worst monsters,76.31806690599403,5.55,6.49,7.36,73.0,488.0,884.0
1286841600,"[5, 31]",20316,Alan Wake: The Signal,"[6, 12]",Continuing on where the main game finished Alan finds himself outside the diner in a night time Bright Falls which quickly changes to daytime Entering the diner a surreal déjàvu dream of the events play out similar to when Alan first arrived with everything eerily familiar but out of place Alan is unable to remember where he was prior to this moment but knows he must go to the back of the diner which he forcibly enters Zane talks to Alan and warns him that he should go no further and that Alan must focus Zane plays a video of Alan struggling with reality and even telling of events playing out at the moment Alan realizes where he is The Dark Place,The Signal is an additional Alan Wake episode released via DLC The DLC was free to all those who bought a new copy of Alan Wake Although this episode is known to be in Season One it is said to be a more standalonespecial episode,75.92285895053737,1.43,1.61,1.97,73.0,285.0,393.0
1287100800,"[4, 15, 31]",7098,Naruto Shippuden: Ultimate Ninja Storm 2,"[6, 9, 12, 48, 49, 130]",The games adventure mode covers the original mangas chapter 245 to 450 Chapter 245 in addition to spearheading the start of a new story arc also marks the beginning of the socalled Part II myth arc adapted on television as Naruto Shippuden The main story that focuses on Naruto Uzumaki is told through 8 chapters including a prologue section Clearing them all unlocks an additional fragment chapter detailing Takas failed capture of Killer Bee based on several nonconsecutive manga chapters from 404 to 417,Taking players through the Naruto Shippuden story arc daring ninja warriors must strategically recruit the right support characters to ensure victory against any and all opponents With the winning combination players can easily unleash bigger and more explosive Team Special Techniques to obliterate enemies who stand in the way,74.6899111419433,12.85,20.82,36.04,75.0,355.0,317.0
1287619200,[12],13157,Allods Online,[6],Missing,Allods Online is a freetoplay 3D fantasy MMORPG set in the fantasy space opera universe of Sarnaut developed by Allods Team formerly Astrum Nival and published by MailRu Group It is the fourth opus of the Rage of Mages series which started in the mid90s conquering the minds of millions of gamers around the world,72.20950093663352,70.0,117.5,4032.0,64.0,8.0,5.0
1287619200,"[9, 15, 33]",19275,Angry Birds Seasons,"[6, 14, 34, 39, 73, 74, 82]",Missing,Angry Birds Seasons is a special edition of Angry Birds that takes the furious fowl through the worlds celebrations Enjoy Christmas Halloween Valentines Day St Patricks Day Moon Festival and other great moments with the Angry Birds,70.2799271380554,6.58,11.0,11.5,73.0,23.0,11.0
1286236800,Missing,20416,Left 4 Dead 2: The Sacrifice,"[6, 12]",Missing,This DLC is a port from Left 4 Dead adding the campaigns The Sacrifice and No Mercy Initially it was to be released for the first game alone but since players would have to own Left 4 Dead to experience the events that explain The Passing the developers opted to release it for both games No Mercy was brought over as well because it was the most popular campaign  Both campaigns are available in every game mode Players will still control the original Survivors but will find items and Special Infected from Left 4 Dead 2 Five achievements were added as in Left 4 Dead,70.0497514368541,nan,nan,nan,nan,nan,nan
1286755200,"[9, 13, 16, 31, 35]",9838,Governor of Poker 2,"[3, 6, 34, 39]",Missing,Show them all the Governor is not to be trifled with Where have you been all those years Lots of things have changed Cities have grown new people arrived Its all good but some things cannot be accepted just like that Howdy Finally its there Governor of Poker 2,70.01865763013132,11.0,27.6,0.0,60.0,5.0,2.0
