,genres,id,name,platforms,summary,storyline,main,extra,completionist,review_score,review_count,people_polled
270,"[5, 31]",79801,Atomic Adam: Episode 1,[6],Atomic Adam Episode 1 is a gaming experience packed to the brim with nostalgic retro action Fight fly and shoot your way through a fully 3D world filled with giant rats grey aliens UFOs boss battles and insane combat all with an art style inspired by the retro action games of yesterday As rock star Atomic Adam youll battle your way through Delta City defeating bosses on your hunt for the infamous Deathbot None is more mysterious than Deathbot who traveled to Delta City with his army to usurp the city and its resources Atomic Adam is tasked with finding Mayor Lamowitzs wife who was kidnapped by Deathbot and now held hostage Deathbot now demands Mayor Lamowitz to resign or he will never see his wife again    Do you have what it takes to save Delta City before it falls in to the hands of Deathbot Atomic Adam represents a new story in the Radical Heroes Universe Complete with a new hero game play mechanics story and action all in the retro inspired universe of Radical Heroes,Missing,0.0,0.0,0.0,0.0,0.0,0.0
271,"[13, 15, 31, 32]",79145,Season Match 4,[6],Buckle up Its time for a new round of endless Match3 fun Colorful crystals a gripping story and tons of Match3 fun  this and much more is waiting for you in this longawaited Season Match sequel Episode 4 of this crystalcrash classic is all about the evil Witch Crow who stole a powerful elixir Now she is the only one having access to other lands Can you manage to destroy her dark plans Features  Speedy Match3 levels and additional quests  Highly coveted bonuses for an even higher score  Charming graphics and detailed animations  Dont miss out on this brand new Match3 classic,Missing,0.0,0.0,0.0,0.0,0.0,0.0
272,Missing,79131,Sentinels: High Energy Tower Defense,[6],An exciting TDFPS hybrid  all the strategy of tower defense with the fun of shooting enemies down yourself,Missing,,,,,,
273,[31],79130,Void Excursion,[6],A spaceship speeds through the void of space as you try to reach the edge of it Avoid the planets and debris so you can go as far as you can into the stars,Space An endless area of exploration and imagination with the stars acting as our beacons of destination Continue into the void young explorer and report back with as much information as you can pertaining the limitless mysteries surround the galaxy Take heed traveller for the dangers of space gawk at nothing and remain immovable to the determination of the mightiest space soldiers    How far can you go    Credit A tutorial game made through the guidance of Jimmy Vega,,,,,,
274,"[10, 31]",78628,Wheels0,[6],An endless racing game that i made to learn the basics of unity via a Jimmy Vega tutorial Enjoy,An endless racing game which you can play to see how far we are in our game development skills Expect better games to come along the way as we grow bigger and better Join us for the ride wont you,,,,,,
275,"[13, 33]",78551,Snake VR,"[6, 34]",A virtual reality take on on the classic snake game Eat rats to grow avoid bumping into objects walls or yourself ,Missing,,,,,,
276,"[8, 32, 33]",78548,Percy the Penguin Saves Christmas,"[6, 14]",Percy the Penguin is a platformer designed to mimic old arcade games such as Mario Bros and Bubble Bobble Throw snowballs at rogue Christmas toys to stun them and touch them to wrap them in a present Once every enemy is wrapped up continue on to the next level For 12 players locally on PC and Mac,Uhoh Santas sleigh had a mishap and now the only one who can save Christmas is Percy the Penguin with a little help from his girlfriend PollyÂ  Help Percy stun all the rogue toys and wrap them back in their presents before its too late But watch out rumor has it an evil ghost gang might be behind all this Only you can find out in Percy the Penguin Saves Christmas the oldschool arcade style platformer for 12 players by PixelDough,,,,,,
277,"[4, 14, 25, 32, 33]",77955,Creepy Brawlers,"[6, 18, 130]",Creepy Brawls is a NES homebrew ROM and physical release by Mega Cat Studios The games design and playstyle is reminiscent of PunchOut Released in 2017 the title was ported to Nintendo Switch in 2019,After a spectral hand pulls you out of your seat and into the silver screen you become the underdog in an underworld championship Lace up your gloves and get ready to duck bob and weave as you go toe to toe with a marathon of monsters Better train like hell,0.0,0.0,0.0,0.0,0.0,0.0
278,Missing,77733,Coding for Carrots,[6],A short browser game released for Computer Science Education Week celebrating the quinquagenary of the release of the childrens programming language Logo,Missing,,,,,,
279,[31],77659,Kizuna Kirameku Koi Iroha,"[6, 48]",A visual novel from CRYSTALiA,Touki is a secondyear student at Murakumo Academy who is training as a katana smith He attracts a lot of attention since his ancestor was a famous katana smith but due to a certain reason he spent all his time playing with machines instead    The appearance one day of the goddess Ayase who claimed to be the guardian deity of his family home was the trigger for many fated meetings    The blackhaired transfer student Saya who he met on a moonlit night    His childhood friend Tsubaki who is the schools strongest swordswoman    His kind kouhai Shion who has a habit of breaking her weapons    The fullofcuriosity ojousama Freesia who is an aspiring blacksmith    These meetings rekindled his passion for swordsmithing and his special bonds with the girls grew stronger by way of the swords which he crafted for them,,,,,,
280,"[14, 32]",77477,Jetball,"[3, 6, 14]",A jetpack sports game Score goals against your opponents in this FPS online multiplayer game Fly up in the air with your jetpack Work with your teammates to make incredible plays Practice solo or coop vs bots Play in 1st person or 3rd person view,Missing,,,,,,
281,[13],77437,Train Simulator 2018,[6],Train Simulator is a simulation game where a single player takes control of some of the worlds most popular train routes,Missing,,,,,,
282,[32],77179,Fading,"[6, 14]",Traverse the mind of a troubled man in a minimalist 2D adventure,Missing,,,,,,
283,"[13, 32]",77174,Virtual Reality Girls 2,"[6, 163, 385]",Virtual Reality Girls 2 is experience which will let you feel like real millionaire delighted fast car and living inside amazing apartment All this with company of the beautiful girls  Thanks to perfectly mapped motions of women body using motion capture technology and high quality 3d models we managed to deliver realistic experience of being with women If you need some rest you can relax and watch one of the beautiful girls dancing,Missing,,,,,,
284,"[13, 32]",77171,Cold Cuts,"[6, 163]",Test your skills with a samurai blade and cut objects that will require speed precision and accuracyWe will have this game available for purchase in the near future,Missing,,,,,,
285,[32],77168,Last Day of Fear,[6],Last Day of Fear  the game tells the story about a detective for the County of Rayna He was not an easy task to deal with the difficult situation Near highway 66 was the house where it was quite numerous suicide and murder,Missing,,,,,,
286,"[5, 13]",77164,Bright low,[6],A firstperson shooter,Missing,,,,,,
287,Missing,77161,Disassembly Line,"[3, 6, 14]",Remote control a robot into the evil robot factory to take on the artificial intelligence in combat Upgrade your robot by collecting addons that give you awesome abilities Play together with your friends to stand a chance,Missing,,,,,,
288,[10],77158,Pipes Racer,[6],Racing game with Time Attack events through pipes Avoid obstacles and lasers,Missing,,,,,,
289,[32],77055,Dragon Sin,[6],A medievalstyle fantasy action game themed around dragons You will know a story about a handsome mercenary Greer who is a child of the Dragon Lord Use his ability to kill many DarkDragons,Missing,,,,,,
290,"[12, 13, 14, 15, 32]",76991,Booking Revolution,"[6, 14]",The original 2D wrestling management sim where you must act out entertaining matches for ratings,Missing,,,,,,
291,"[12, 13, 14, 32]",76990,Wrestling Revolution 2D,"[6, 14]",The original 2D wrestling sim where you create your own star and embark on a career full of possibilities,Missing,,,,,,
292,"[12, 13, 32]",76988,EquiMagic: Galashow of Horses,[6],Magnificent horses and glittering costumes Become a star in the Galashow of horses Unique Horseshow Simulation with breathtaking horse dressage grandiose costumes and stage sets,Missing,,,,,,
293,"[13, 15]",76963,Planet Coaster: Adventure Pack,"[6, 14, 49, 169]",Get ready to move into the humid green lush jungle atmosphere with the allnew Planet Coaster Adventure Pack Create your own pyramids temples and other jungle structures Lure your guests into ancient traps and have them encounter some truly scary creatures including crocodiles hippos or even mummies Including the Gold Fever coaster Island Adventure and Land Ahoy rides and a new entertainer Renee Feu Are you ready for an adventure,Missing,,,,,,
294,"[12, 31]",76957,Dungeoneer,[6],Dungeoneer is a prerendered firstpersonperspective interactive cinematic story experience that sees you take on the role of a knight venturing into the dark depths of an unknown dungeon,Missing,,,,,,
295,"[31, 32]",76951,Alien Mayhem,[6],Alien Mayhem is an artificial open world sandbox game developed and created by Supa Serious We simulate a whatif scenario where an alien prankster finds himself in a virtual game world that enables him to prank in a rather unconventional yet stylish way,Missing,,,,,,
296,[13],76948,Kawanakajima no Kassen,[6],Kanakawajima no Kassen was sold 10261981 as the first game developed by Kou Shibusawa It is a Strategy simulation game Players become Shingen Takeda and clash with Kenshin Uesugi at Kawanakajima in an attempt to wipe out his rival,Missing,,,,,,
297,"[8, 31, 32]",76945,Shantae: Half-Genie Hero - Friends to the End,"[6, 41, 46, 48, 49, 130]",The final piece of the Shantae HalfGenie Hero storyline is here  When Shantae falls prey to dark magic its up to Shantaes BFFs Sky Bolo and Rottytops to save her from a Nightmare Realm of her own imagining Conquer remixed locales and new challenge levels using Bolos grapple claw Skys eggtoss and Rottytops brainmunching to beat bad guys solve allnew puzzles and rescue the halfgenie hero Its all possible with the power of friendship,Missing,2.12,2.75,2.79,69.0,22.0,28.0
298,"[10, 32]",76943,Home Alone Girlfriend,"[6, 14]",All your attempts for fall asleep may be destroyed by a single message from your girlfriend Im home alone Come over There is still a part of the night left to enjoy,Missing,0.0,0.0,5.0,40.0,1.0,1.0
299,[13],76938,City Balls VR,[6],The jumpnrun experience for VR Beat the time by completing all games on the rooftops as fast as possible,Missing,,,,,,
300,"[13, 31]",76931,Live and Learn,[6],Live work and play in an animalruled alternate history where humans are just another species Create your own character with intuitive fullbody control and immerse yourself in a physicsdriven sandbox where your real life the only tutorial needed,Missing,,,,,,
301,"[7, 13, 31, 32, 33]",76928,The Ultimate Heist,"[3, 6, 14]",Ever wanted to go on an adventure where you get to infiltrate some of the most High Security Vaults across the world We have you covered use the gadgets at your disposal to neutralize your foes,Missing,0.0,0.0,0.0,0.0,0.0,0.0
302,"[12, 31]",76926,Xploquest,"[3, 6, 14]",Xloquest is a little retro RPG game and is perfect for a break between two big games sessions,Missing,0.0,0.0,0.0,0.0,0.0,0.0
303,[32],76925,WaywaY,[6],WaywaY  A game that tests your skills in dealing with various obstacles while directing a circle ring along a path Along this path you will encounter various and anomalies and bosses,Missing,0.0,0.0,0.0,0.0,0.0,0.0
304,"[5, 31, 32, 33]",76924,Space Defender,"[6, 34]",Protect the Earth from Alien Invasion,Missing,,,,,,
305,"[12, 31, 32]",76919,T-Rex Time Machine,"[3, 6, 14]",Face the worlds fiercest dinosaurs and make it back to the future in one piece Youre a physics student with a dream travel back in time and document the world of dinosaurs Can you survive the terrors of the Tyrannosaurus rex,Missing,,,,,,
306,"[31, 32]",76918,Comets Wake,[6],Come play in the world of Comets wake Explore vast archipelagos of floating islands with infinite variety Find waterfalls lava lakes towers ruins giant mushrooms and more Choose your weapon be it a gun bow sword mace hammer axe shield throwing knives or a mage staff,Missing,0.0,0.0,0.0,0.0,0.0,0.0
307,"[31, 32]",76916,Forest Legends: The Call of Love - Collector's Edition,[6],The Call of Love echoes through an enchanted forest Will you answer,Missing,,,,,,
308,"[31, 32]",76913,Gear Path,"[3, 6, 14]",Gear Path is a small platformer Metroidvanialike game with exploring and powerups  Its perfect for playing while waiting for another game,Missing,0.0,0.0,0.0,0.0,0.0,0.0
309,"[10, 13, 14, 15, 31, 32]",76912,Game Tube,"[3, 6, 14]",A set of mini games to take some time off your everyday routine Arrow shooting 2D space shooter Endless runner Bingo Clicker,Missing,,,,,,
310,"[13, 32]",76892,The Shrouded Isle: Sunken Sins,"[6, 14]",A free DLC update to the game that affectschanges most of the systems and adds some new ones    Sunken Sins adds   A more strategic inquiry system and longer campaign   New purification tower game mechanic   2 new color variants The Shallows and The Deeps   Additional events personality traits art animation and ending   Contagions,Missing,,,,,,
311,[5],76886,Star Wars Battlefront II: The Last Jedi Season,"[6, 48, 49]",It all starts with choosing a side On December 5 youll have an opportunity to align with the First Order or choose to fight for the Resistance Your choice is important as it will allow you to take part in special challenges that will grant your faction specific rewards  Things kick into high gear on December 13 Your favorite stormtrooperturnedhero Finn joins the fight for the Resistance and Captain Phasma steps on to the Battlefront for the First Order They can be purchased with ingame Credits from that week Whichever faction is victorious in completing the most challenges that week will net a reward as well a special Crate of highpower upgrades for Finn or Captain Phasma  New locations and vehicles will also arrive On December 13 the cinematic content from Star Wars The Last Jedi continues with a new planetary map Crait The Starfighter Assault map of DQar will join as well plus a new hero ship  Tallie Lintras RZ2 Awing Poe Damerons T70 Xwing is also upgraded with a new ability inspired by Star Wars The Last Jedi   Iden Versio returns In Star Wars Battlefront II Resurrection youll join Commander Iden Versio during the days of the First Orders rise to power These new chapters of Star Wars Battlefront IIs singleplayer story mode will be available December 13  Your choice of faction will continue to matter Throughout December youll see your chosen factions progress reflected ingame as you fight alongside allies from around the world to swing the tide of battle,In Star Wars Battlefront II Resurrection youll join Commander Iden Versio during the days of the First Orders rise to power,,,,,,
312,"[13, 15, 31]",76857,Roads of Rome: New Generation,[6],Roads of Rome New Generation is a historical strategy game,New settlements new roads and new future for the people have to be built If Marcus can achieve those goals he will prove himself to his epic Father gain respects of the citizens and may be even win the love of a gorgeous girl,0.0,0.0,7.5,0.0,0.0,1.0
313,[5],76855,Neon8,"[6, 163, 385]",Neon8 is a fastpaced First Person Shooter where you run jump fly and shoot your way through levels of increasinglydifficult enemies,Missing,,,,,,
314,"[9, 31, 32]",76845,Vesta,"[6, 48, 49, 130]",Set in a highly technological universe with Vesta you will again feel the challenge of traditional puzzle games mixed with more arcade elements all within a very elaborate and fascinating story  Gears robots mystery humour challenges fun and action  Vesta is that and much more,Missing,0.0,0.0,0.0,40.0,1.0,0.0
315,"[12, 15]",76839,Heroes of Arzar,[6],Heroes of Arzar is a fast paced hybrid TCG Strategy game Control and conquer with an ever expanding roster of heroes all unique with their own skills and powers,Missing,0.0,0.0,0.0,0.0,0.0,0.0
316,[31],76838,Call of the Ocean,[6],VR exploration game with full motion controls set in and around the ocean Swim with a variety of ocean creatures and discover secrets hidden in the depths,Missing,,,,,,
317,"[12, 31]",76830,Dino Scourge,[6],Fly a space ship kill Dinosaurs level up find loot save the rabbits,Missing,0.0,0.0,0.0,0.0,0.0,0.0
318,[31],76828,Google Spotlight Stories: Special Delivery,[6],Emmy awardwinning platform Google Spotlight Stories presents a VR experience by Academy Awardwinning studio Aardman Animations Follow the adventures of a humble caretaker who is disturbed by a mysterious stranger on the roof Whos there,Missing,0.07,0.0,0.0,0.0,0.0,2.0
319,"[13, 15, 31, 32]",76826,God of Failure,[6],Defend your castle from the orcish chavs lure them into your traps and destroy them,Missing,0.0,0.0,0.0,0.0,0.0,0.0
320,[32],76825,Dr. Fizzgigious Fantabulous Carbon Dating Simulacrum,[6],Dr Fizzgigious is a scholar fascinated by carbonated drinks and historical artifacts His passions merged when his latest carbonated concoction brings artifacts to life    Dr Fizzgigious Fantabulous Carbon Dating Simulacrum is quasieducational Potentially Romantic Incredibly Cute    Dr Fizzgigious must prove hes an ace archaeologist and his passion for artifacts by answering questions from the relics themselves    Meet characters based on Edward Lears Complete Nonsense in a silly and cute story with awfully neat artifacts from all eras,Missing,0.0,0.0,0.0,40.0,1.0,0.0
321,"[10, 32]",76824,Go Kart Survival,[6],Karting race game where player target is to survive with different tracks under limited time,Missing,0.0,0.0,0.0,0.0,0.0,0.0
322,[32],76814,AcChen: Tile matching the Arcade way,[6],AcChen is a simple to learn arcade style find the matching tile game Master the 60 different level and various bonus maps in the single player campaign Unlock new levels by beating the clock or play in chill mode without any pressure no timer no score just happy tile hunting,Missing,,,,,,
323,[32],76810,Deadly Contact,[6],A wavebased zombie survival game,Missing,0.0,0.0,0.0,0.0,0.0,0.0
324,[13],76807,Real RC Flight Simulator,"[6, 14]",Are your ready for a new experience in Remote Control for Steam Real RC Flight Simulator is the most epic and realistic radio  remote control simulator in the world,Missing,,,,,,
325,"[12, 31, 32]",76806,Ancient Treasure,[6],Falsus Chronicle Ancient Treasure is a dungeon exploring Anime style action RPG with Roguelike elements In this game dungeon will randomly generate traps monsters and loots With our unique Monster Gem system every different choice of classes weapons and skill sets effects characters raising multiple possibilities to fulfil every single dungeon explore with funs,Missing,,,,,,
326,"[31, 32]",76803,Code Name: Origin,[6],Code Name Origin is a top down action adventure inspired by the classics in the 80s and 90s Youre dispatched alone with a laser shotgun and the wits to uncover what transpired just days before you arrive To survive you will unlock new weapons such as the missile launcher and armor upgrades as the speed boost to increase your mobility Beat area bosses by uncovering their pattern and begin unleashing a volley of bullets to unlock new levels Traverse to different worlds across space to decipher puzzles to throw you further into the events that lead you here,Missing,,,,,,
327,"[12, 31, 32]",76800,Frontier Runner,[6],In Frontier Runner video game you play a character role in the mid22nd century who was selected to travel on one of the first exploration ships that left earth to find new homes to expand mankind faiths and ideologies,Missing,0.0,0.0,0.0,0.0,0.0,0.0
328,"[13, 32]",76795,Battle for the last chicken,[6],As a desperado you join in a very thrilling death game for a large amount of money The game has 100 people involved,Missing,,,,,,
329,[32],76794,3D Hardcore Cube 2,[6],3D Hardcore Cube 2  is a continuation of a fascinating game about clever cube that moves through dangerous obstacles to the portal In the new part of the game was implemented completely new physics control character Were added sounds to improve the atmosphere of the game Original and beautiful achievements that you can decorate your profile,Missing,0.0,0.0,0.86,45.0,2.0,3.0
330,"[10, 32, 33]",76792,Cars with Guns: It's About Time,[6],Travel back in time with your friends in exotic vehicles decked out with guns missiles cannons and more    Explore various time periods and discover blueprints for new weaponry  Work together to save up Credits to unlock new Vehicles and Weapons  Fast paced vehicle combat for 14 players with up to 12 computer opponents and 1 Boss CoOp and FFA modes available,Missing,,,,,,
331,"[31, 32]",76791,Lost In Maze,[6],Will you be able to fully explore each labyrinth and find the key that will get you out  Collect as many gold coins as you can to buy aids in the store that will help you defeat the stronger Slimes at each level,Missing,,,,,,
332,"[12, 31, 32]",76790,Amelon,[6],Its the year 2047 Amelon extracts parts in the waste dump of the factory producing bionic organs After the years he records a message for himself in case of loss of memory This day comes when we first load the game We explore the world and rediscover our past Everything changes,Missing,2.03,0.0,0.0,0.0,0.0,1.0
333,[32],76789,Fruity Smoothie,"[3, 6, 14]",Fruity Smoothie is a coop game where you grow throw and shoot fruit all to save your fruit family from evil fruit and vegetables with an identity crisis    So get a friend and get ready to make some smoothies,Missing,0.0,0.0,0.0,0.0,0.0,0.0
334,[32],76787,Long Live Santa!,"[6, 14]",Santa is dead Now the remaining bearded men of the Norwegian wilderness must fight to the death Will you be the next Santa or die in the snow Punch slice outwit your way to a fulfilling new seasonal job in this online PvP thirdperson fighter,Missing,2.93,4.54,6.0,40.0,4.0,5.0
335,"[13, 31, 32]",76786,Smart Mummy,[6],Smart Mummy  is a quite difficult 2D platformer with elements of survival in which you have to pass various levels for the mummy Your main task in this game is to collect vessels with of bodies for the mummy,Missing,0.0,0.0,0.08,10.0,1.0,1.0
336,"[31, 32, 33]",76784,Ragtag Adventurers,"[6, 130]",RagTag Adventurers is a Boss Rush game that pits 4 heroes against terrible monsters in Shared Screen Multiplayer Play alone or together with your friends against challenging boss fights that will put your skills to the test,Missing,0.0,0.0,0.0,0.0,0.0,0.0
337,"[31, 32]",76780,Caviar: Endless Stress Reliever,"[6, 14]",Caviar is an amazing stress reliever game This indie game is created for kids girls boys and adults Simple one tap control Explore amateur underwater world collect gems to unlock new character caviars,Missing,,,,,,
338,"[15, 32]",76779,Bubble Struggle: Adventures,"[3, 6, 14]",Classic arcade game from the original Bubble Trouble creator,Missing,,,,,,
339,"[12, 13, 31, 32]",76778,Dracula's Library 2,[6],Dracula has again summoned you to help with his library This time however a host of younger vampires have their minds bent on stealing Draculas wealth of knowledge It is your duty to organize and protect Draculas vast collection of books while fighting off those who wish to steal his knowledge    54 increasingly difficult levels  Four symbol types that must be cast to properly organize and seal the tomes  Simpler game play than original game but more challenging concentrationwise,Missing,0.0,0.0,0.03,20.0,1.0,1.0
340,"[12, 15]",76752,Heroes of Myths - Warriors of Gods,[6],Beat back the demonic hordes with your Spartan soldiers in this awesome defence game The gods of Ancient Greece and a cast of legendary heroes will help you defend your chosen deitys temple against your otherworldly foes,Missing,0.0,0.0,0.0,0.0,0.0,0.0
341,"[13, 32]",76750,MuX,[6],Build sound,Missing,,,,,,
342,"[13, 14, 15, 32]",76749,Real Pool 3D - Poolians,[6],Real Pool 3D Poolians is one of the best online pool game Play against the computer or real players all over the world It supports 8 different types of pool games and team play mode,Missing,,,,,,
343,[32],76748,Wordabeasts,"[6, 14]",Wordabeasts is a multiplayer party game that rewards fastpaced wit  After joining the safari players will receive words on their mobile devices think of a single clue word that connects them together and earn points for guessing other players words,Missing,0.0,0.0,0.0,0.0,0.0,0.0
344,"[9, 31, 32]",76746,No Escape,[6],No Escape is a firstperson adventure game with puzzles and a twist of horror  After a car accident in a collapsed tunnel you try to find yourself a way out but that does not seem to be as easy as you thought,Missing,0.0,0.0,0.0,0.0,0.0,0.0
345,"[12, 25, 31]",76745,The Surge: Complete Edition,"[3, 6]",Survive the ultimate and extended experience of the hardcore actionRPG The Surge The Complete Edition includes the full game its expansion and all its DLCs,Missing,,,,,,
346,"[13, 15]",76739,Cities: Skylines - All That Jazz,"[3, 6, 14]",With All That Jazz Paradox is introducing an all new kind of traffic jam in Cities Skylines The briefly internetfamous Jazz Boatman returns as DJ so players can dig harder than a jackhammer at a road repair The new All That Jazz radio station will feature 16 new songs across several smooth genres Classic Latin Funky and ChillOut Jazz,Missing,,,,,,
347,[9],76717,Cosmic Horizon - World First 3D Game Puzzle Ever,"[3, 6, 14, 34]",Cosmic Horizon  Icosahedron Video Game Puzzle,You are in a voyage around the universe,,,,,,
