first_release_date,genres,id,name,platforms,summary,storyline,rating,main,extra,completionist,review_score,review_count,people_polled
851990400,[5],276098,ReVolte,[6],Missing,Missing,Missing,nan,nan,nan,nan,nan,nan
849830400,[5],272037,Polaris Outpost,[6],A space station map of the same quality as the original E2 maps,Missing,Missing,nan,nan,nan,nan,nan,nan
851990400,Missing,270664,Roch Series,[6],A compilation of all 8 maps and 1 secret map of the Roch series,Missing,Missing,nan,nan,nan,nan,nan,nan
851990400,[2],270611,Play-Doh Creations,[6],Your creativity takes shape on PlayDoh Island  Its creativity and showandtell at its best Hop aboard the PlayDoh Island express and travel to four different creation locations Invent all kinds of creatures at the Laboratory Design their costumes and hair styles at the Mini Mall Craft crazy vehicles at the Factory Mix up some delicious PlayDoh treats at the Bakery Thenits showtime at the theater PlayDoh Pete hosts The Great Doh Show musical review starring YOUR animated creations,Missing,Missing,nan,nan,nan,nan,nan,nan
851990400,"[2, 9]",266201,Pyramid: Challenge of the Pharaoh's Dream,[6],Pyramid Challenge of the Pharaohs Dream is a 1996 education adventure game for Windows and Macintosh developed by Knowledge Adventure and published by Edusoft SA published in Sweden by Knowledge Adventure and Levande Böcker,Missing,Missing,nan,nan,nan,nan,nan,nan
851990400,[2],265643,Pettson o Findus i Snickarbon,"[6, 14]",Pettson o Findus i Snickarbon is an edutainment game with a collection of minigames situated in Pettsons workshop Players will choose a guard for their treasure chest and then will be able to collect gold feathers for every completed activity within the game Other things can also be collected if found like pieces of a map,Missing,Missing,nan,nan,nan,nan,nan,nan
851990400,Missing,263937,The Jetsons: Space Race,[6],A simple slick sidescrolling platformer starring The Jetsons everyones favorite space age family George is running late and theres bumpertobumper traffic on the intergalactic interstate But he still has to drop off Elroy at the Little Dipper School Judy at Orbit City High Astro at the Galaxy K9 School and Jane at the Shopping Center All before heading to work Will he make it to Spacely Sprockets on time,Missing,Missing,nan,nan,nan,nan,nan,nan
851990400,[31],261306,Mooky Takes Manhattan!,[6],Missing,Missing,Missing,nan,nan,nan,nan,nan,nan
851990400,[31],261301,Candy Land Adventure,[6],Candy Land Adventure is an adventure game developed by Realtime Associates and published by Hasbro Interactive in 1996,Missing,Missing,nan,nan,nan,nan,nan,nan
851990400,"[2, 9, 31]",256281,Urânio 235,[6],Urânio 235 is a pointandclick adventure game designed to teach basic chemistry to high school students where you have been sent to an abandoned village by a UFO and told about the story of aliens who lived there and how a miscalculated neutron beam has hit a uranium atom destroying most of its population Now your mission is to deactivate the beam,Missing,Missing,nan,nan,nan,nan,nan,nan
851990400,[2],248190,The Jungle Book,[6],IBM produced FMV game starring uncredited chimpanzee and Gary Schwartz  Deep within Indias Black Jungle a scandalous crime has taken place Someone has stolen the jeweled crown of King Louie the orangutan who rules Monkey City Now hes hoppin mad and there will be no peace until his crown is returned Mowgli and his friends are counting on you to help recover this sacred treasure and restore calm to the jungle world,Missing,Missing,2.74,0.0,3.06,59.0,34.0,28.0
851040000,"[2, 31]",245078,The Gate II,"[6, 14]",Missing,Missing,Missing,nan,nan,nan,nan,nan,nan
851990400,"[2, 31]",242887,Silicon Scream,"[6, 14]",First person pointandclick adventure game developed by Off World Communications and published by JVC Advanced Media,Missing,Missing,nan,nan,nan,nan,nan,nan
851990400,"[2, 31]",242868,Sakin II,"[6, 14]",Followup for the album Sakin 砂金 by Kazuyuki Sekiguchi,Missing,Missing,nan,nan,nan,nan,nan,nan
851990400,"[31, 34]",242777,Miss,"[6, 14]",Missing,Missing,Missing,nan,nan,nan,nan,nan,nan
851990400,[9],242747,Flappy 95,[6],Missing,Missing,Missing,nan,nan,nan,nan,nan,nan
851990400,Missing,242642,A Case for Cap & Co,[6],Karen Lucre is in a fix Zak her little dog has been kidnapped  The kidnappers are asking for a huge ransom Zak is in a great danger Time is running out and Karens parents are on holiday its obviously A Case for Cap and Co Together with Cap Billy Karen and Toby you must comb the town of Roseborough for clues Who are the kidnappers Where is poor Zak being held Can you help free him in time,Missing,Missing,nan,nan,nan,nan,nan,nan
851990400,[12],229773,Core MUD,"[3, 6, 14, 34, 39]",Welcome to Core Mud an interactive text MUD set on the planet formal starcharts refer to as Hermes 571G but that everyone in the know refers to simply as Core Core is one of the most distant settlements known to mankind most famous for its lucrative yet oppressive mines But more than mankind can be found here Core is a diverse group of 9 races in total all vying for recognition or profits or both working for The Company the megalithic entity running the colony itself To The Company everything is secondary to profits It is up to you to determine how best to survive in this environment whether that be through combat training superior mining skills or technical prowess  Core MUD is always free to play and features a fun and supportive atmosphere Roleplaying is encouraged but not mandatory Mining is your primary source of income but there are multiple ways to scrape together a few credits or a few million Core Mud also features an economy which is playerdriven players own merchandise shops featuring energy weaponry or useful tools pubs featuring assorted alcoholic of course and nonalcoholic beverages and clinics for healing to name a few Come join us today,Missing,Missing,nan,nan,nan,nan,nan,nan
851990400,"[2, 9]",229378,The Land Before Time: Activity Center,"[6, 14]",The Land Before Time Activity Center is the first educational title based on the The Land Before Time movie series This game features a selection activities featuring trivia quizzes about dinosaurs mazes memory games and building their own dinosaurs and printing them out to share with friends and family Tree stars can be earned to unlock movies to be played in the Movie Theater,Missing,Missing,nan,nan,nan,nan,nan,nan
851990400,[2],229281,Kiyeko and the Lost Night,[6],This wellthoughtout title is an interactive story beautifully narrated by AcademyAward winning actor Ben Kingsley Kingsley in the role of the Story Teller offers a pleasant pleasurable stroll through an Amazon village and its surroundings The story follows jungleboy Kiyekos effort to retrieve the Night stolen by a couple of snakes reminiscent of Disneys badguy animal characters through 11 different animated scenes  from Kiyekos village in the Amazon jungle through the forest to the snakes lair and back again The welldrawn graphics which integrate 3D backgrounds with 3D animations and moviestyle quality of the title are lovely to look at regardless of your age,Missing,Missing,nan,nan,nan,nan,nan,nan
851990400,[12],228745,Alter Aeon,"[3, 6, 14, 82]",Alter Aeon is a fantasy world of adventure and untold possibilities Ours is an enormous fantastic world to explore We have thousands of quest to complete and tens of thousands of enemies to defeat,Missing,Missing,nan,nan,nan,nan,nan,nan
851990400,[12],228700,Toril,"[3, 6, 14, 82]",Toril is a Forgotten Realms MUD,Missing,Missing,nan,nan,nan,nan,nan,nan
851990400,[12],228684,Aardwolf MUD,"[3, 6, 14]",Aardwolf RPG is a unique and free text based roleplaying game Aardwolf is based in the fantasy world of Andolor where magic is common and there are hundreds of exotic realms to explore puzzles to solve and quests to complete Aardwolf features a realistic game world with multiple continents and real geography Each area includes a real time lineofsight overhead map to see other characters and points of interest around you  Create your character from any one of 28 classes including fighter classes such as Soldiers Knights Hunters Barbarians Rangers Archers Assassins and Paladins or select a magic based class including Elementalists Necromancers Healers Priests Witches and Enchanters Once you have choosen your race your guild and your profession then the rest is up to you You have absolute control over your characters actions and there are many ways to play Aardwolf,The Aardwolf adventure is set in Andolor meaning greatest world in ancient tongue Andolor orbits a single sun but unlike other worlds does not rotate Andolors three moons and several large planets between Andolor and its Sun give the impression of rapidly changing day and night There are no seasons or changes in climate Tropical areas stay tropical the frozen land of Gelidus remains frozen  In terms of geography much of the vast Oceans of Andolor remains unexplored Many islands exist within these oceans guarding many mysteries While Andolor is not completely circular head in any direction long enough and you will arrive very close to where you started assuming you survive the journey Four main continents have been discovered so far on Andolor,Missing,nan,nan,nan,nan,nan,nan
851990400,[5],227689,Bust Hillary 3D,[6],Missing,Missing,Missing,nan,nan,nan,nan,nan,nan
851990400,[9],223118,Tiririca Interativo,[6],Missing,Missing,Missing,nan,nan,nan,nan,nan,nan
851990400,"[2, 31]",221928,Izzy's Adventure,[6],Izzys Adventure is an adventure game based on Izzy the Atlanta 1996 Summer Olympics mascot released for the PC in 1996 It is an educational adventure game and notable for being one of the last games by British developer and publisher US Gold,Missing,Missing,nan,nan,nan,nan,nan,nan
851990400,Missing,217880,Firewall: Man vs. Machine,"[6, 50]",Missing,Missing,Missing,nan,nan,nan,nan,nan,nan
851990400,[31],217781,Frobozz Magic Support,"[3, 6, 13, 14]",You play as a novice glyph support clerk but no ones around but an animated burin It seems the more experienced support clerks are either lost got themselves unimplemented or got stuck in a timeloop And of course everyone else in Zork wants assistance too No one said your first day on the job would be easy,Missing,Missing,nan,nan,nan,nan,nan,nan
851990400,[31],217780,Kissing the Buddha's Feet,"[3, 6, 13, 14]",Your roommate is cramming for an important exam and if he doesnt pass youll have to endure his company for another semester You have to clear the apartment of distractionsa task made difficult when four of his friends drop by for an allnight party,Missing,Missing,nan,nan,nan,nan,nan,nan
851990400,[31],217779,Small World,"[3, 6, 13, 14]",A small game set in a tiny solar system where the mechanism that powers the rotation of the Earth approx diameter 8 feet has broken down and must be repaired,Missing,Missing,0.0,8.81,0.0,85.0,2.0,1.0
851990400,Missing,209454,Flipper,"[6, 14]",Missing,Missing,Missing,0.0,0.0,1.27,70.0,1.0,1.0
851990400,Missing,209242,Interplay's Family Favorites,[6],Missing,Missing,Missing,nan,nan,nan,nan,nan,nan
851990400,[10],209107,Road & Track Presents: The Need for Speed - Special Edition,"[6, 13]",Road  Track Presents The Need for Speed  Special Edition is a 1996 retail rerelease of The Need for Speed for PC which includes several improvements over the original 1995 PC release It introduced support for Microsoft Windows 95 whilst capable of running on Microsoft DOS and several improvements to its rendering engine as well as two additional tracks  The complete soundtrack playing during races was also made available on the Special Edition This feature was previously only in the PlayStation and Sega Saturn releases,Missing,Missing,nan,nan,nan,nan,nan,nan
851990400,[12],206985,Threshold RPG,"[3, 6, 14, 82]",Threshold is a high fantasy realtime multiplayer online role playing game Once you step across the Threshold you will be absorbed by the rich detailed highly developed role playing atmosphere that comprises this fantasy realm You become the hero the heroine or even the villain depending on your character and your imagination  On Threshold role playing is required and enforced This policy creates and preserves Thresholds top notch role playing environment Although there are places to communicate out of character within the game after all it is nice to get to know the people you are gaming with outside of such areas players stay completely in character  Threshold RPG opened to the public in June of 1996 It is the oldest role playing enforced MUD currently in operation  Available 24 hours a day 365 days a year this exciting gaming environment is home to thousands of players from all over the world These players are indeed what makes Threshold RPG a truly unique and marvellous gaming community,Threshold a world of adventure glory intrigue romance and excitement It is a world filled with beings of all sorts some friendly and charming others fiendish and desirous of tearing you to pieces and feasting upon your bloody entrails  The Threshold game world is enormous in scope and within it are tremendous opportunities for character development Among such opportunities are numerous types of political economic and social organizations that shape your character and in turn can be shaped by your character,Missing,nan,nan,nan,nan,nan,nan
851990400,Missing,206977,Clue,[6],Missing,Missing,Missing,0.56,0.0,3.5,60.0,6.0,6.0
851990400,Missing,206210,The Adventures of Pinocchio,[6],This is an interactive movie game based on the 1996 live action movie by the same name After Pinocchio realizes his dream of becoming a real boy the evil Lorenzini kidnaps him and turns him back into a puppet You must help Pinocchios creator Geppetto find and rescue him Youll go through Pinocchios home town row a boat through monsterinfested waters and visit Terra Magica the fair where Lorenzini turns boys into donkeys To succeed youll have to dodge deadly traps solve puzzles and outwit Lorenzinis conniving henchmen Sometimes youll have to turn yourself into a puppet a fish a bird or even a donkey to rescue Pinocchio Along the way you must collect six passwords each reflecting a lesson in morality that Pinocchio learns,Missing,Missing,nan,nan,nan,nan,nan,nan
851990400,"[2, 31, 34]",202148,Disney's Animated Storybook: The Hunchback of Notre Dame,[6],Missing,Missing,Missing,nan,nan,nan,nan,nan,nan
851990400,[13],201743,Ezekial S. Jackson's Amazing Truckology,[6],Amazing Truckology is a childrens computer game created by Ezekial S Jackson that teaches children about a variety of trucks There are four places to explore the farm fire station the quarry and the building site Fifteen trucks are included in the game There are also clickable hotspots in some of the scenes There are some video clips and animations that shows the player the trucks on how it does and how they work There are colour photographs on every truck included in the game as well as some technical information  Four TruckARama VR scenes are included in the game as well as 3D animated models of the fifteen trucks included The player can also simulate driving one of the fifteen trucks in the game as well The game features background music which has 40 minutes of songs included Amazing Truckology is suitable for ages 5 and up,Missing,Missing,nan,nan,nan,nan,nan,nan
851990400,Missing,201300,RedCat: De Woeste Woordenbrij,[6],Brutus stole the letters from RedCat during a spaceflight In a chase by RedCat Brutus crashes into a desert planet and RedCat scans the surface to find the letters again Brutus along with Max works against him quite a bit in his attempts to collect the letters,Missing,Missing,nan,nan,nan,nan,nan,nan
851990400,Missing,199236,Bloody Pigs 1996,[6],Bloody Pigs a top down roguelike shooter with stunning 3D graphics and procedural generation coming to your home PC soon The game is so difficult that nobody will ever beat it Its made to crush your spirit and taint your soul,Missing,Missing,nan,nan,nan,nan,nan,nan
851990400,Missing,198384,Eyewitness Virtual Reality: Dinosaur Hunter,"[6, 13]",Missing,Missing,Missing,nan,nan,nan,nan,nan,nan
851990400,[12],196764,Legends of Kesmai,[6],Legends of Kesmai LOK was among the first successful graphical multiplayer online roleplaying games It was based on a slightly stripped down version of Island of Kesmai with 2D sprites replacing IoKs roguelike pseudographics and was available for play at America Online and GameStorm Prior to that Kesmai corporation ran a long open beta for the game as well as hosting the game for a short period of time in the mid 1990s In 1999 Electronic Arts bought Kesmai and in 2000 closed the business,Missing,Missing,nan,nan,nan,nan,nan,nan
851990400,Missing,194772,Games Sampler 2 for Windows 95,[6],Enter into a vortex of whiteknuckled adventure See hear and feel for yourself how Windows 95 elevates PC gaming to a new dimension  through the speed and power of DirectX technology with vivid 3D graphics video and sound and with online and multiplayer capability Use this CD sampler to taste the excitement and fun of some of todays hot new generation of games,Missing,Missing,nan,nan,nan,nan,nan,nan
851990400,[5],188071,PowerSlave,"[3, 6, 13, 14]",An ancient evil force neither of this time nor of this world has remained buried since the Egyptians walked the earth Now it has been exhumed Of course you the hero must find out whats going on in Egypt Your helicopter crashes within this danger zone and you must survive on your own Meet the Egyptian gods and follow their advice,PowerSlave is set in and around the ancient Egyptian city of Karnak in the late 20th century The city has been seized by unknown forces with a special crack team of hardened soldiers sent to the valley of Karnak to uncover the source of this trouble However on the journey there the players helicopter is shot down and the player barely escapes The player is sent in to the valley as the hero to save Karnak and the World The player finds himself battling hordes of extraterrestrial insectoid beings known as the Kilmaat as well as their various minions which include mummies Anubis soldiers scorpions and evil spirits The players course of action is directed by the spirit of King Ramses whose mummy was exhumed from its tomb by the Kilmaat who seek to resurrect him and use his powers to control the world,Missing,10.03,8.6,10.54,80.0,22.0,18.0
851990400,[14],186661,MER Innebandy,[6],MER Innebandy is a game based on Floorball It features the entire Svenska Elitserien  the national league of Sweden  with real teams and actual players as of the 1996 season,Missing,Missing,nan,nan,nan,nan,nan,nan
851990400,[31],186582,Mutation of J.B.,[6],You control a young boy called Johnny Burger who plans to visit his cousin Emanuel for two weeks As he arrives he finds him gone A scientist whos also looking for Johnnys cousin comes by and offers Johnny 500DM Deutsche Mark for an experiment Of course the experiment goes awry During the procedure a mysterious guy flashes the scientists memory The emerging irritation causes the professor to start pushing random buttons which results in Johnnys transformation as a human pig After Johnny wakes up the professor is gone too as he was kidnapped to the Planet Ladea  So Johnnys quest comprises of finding the professor to be transformed back into a normal state and finding out what happened to Emanuel,Missing,Missing,0.0,12.95,0.0,50.0,1.0,1.0
851990400,"[13, 15]",178558,The Conveni: Ano Machi wo Dokusen Seyo,[6],In the Coveni you run a convenience store where the goal is to be successful and beat the competition,Missing,Missing,0.0,0.0,0.0,0.0,0.0,0.0
851990400,[26],176078,Greatest Moments of Our Time,[6],Greatest Moments of Our Time is a reference title produced in 1996 and includes an interesting mix of subjects The main menu has some admin icons plus eight categories one of which is a trivia game The quiz has three levels of difficulty It lasts for three rounds and has five timed multiple choice questions per round all the questions are based on the articles in the reference material on the disc,Missing,Missing,nan,nan,nan,nan,nan,nan
849484800,"[9, 26]",176012,JumpStart Adventures: 3rd Grade - Mystery Mountain,[6],When a little brat girl named Polly Spark sends 25 of her fathers robots in time to change history its up to you and a robot boy named Botley to capture the Robots and bring history back to normal  In Pollys mystery Mountain Mansion you must go around the Mansion playing games and Logic puzzles that teach 2nd 3rd and 4th grade subjects to save the world from crazy history,Missing,Missing,nan,nan,nan,nan,nan,nan
851990400,[9],172145,MindGym,[6],MindGym is a surreal game about creative thinking,Missing,Missing,nan,nan,nan,nan,nan,nan
851990400,[12],171528,Prince of Destruction,[6],Prince of Destruction is a shareware role playing game for either a single player on their own PC or up to four players over a local network for which the game uses MARS the Multiplayer Animated RolePlaying System,The story behind the game begins with archmage Nestar founding a kingdom where people could live in peace Time passes and Nestar has both a son Grishnák and a daughter Imiria The son is expected to follow his father and become ruler but he is a bad sort and Nestar decides that Imiria should rule as queen As Nestar is putting together plans for his succession he dies in mysterious circumstances and Grishnák ascends to the throne His fathers fears were realized rumours Grishnáks involvement in dark deeds black magic and sacrifices abound Only one of Nestars followers remains in office he is The Keeper and he maintains the bridges between Nestaria and the rest of the world The Keeper issues a summons to four of Nestarias heroes The Barbarian The Assassin The Elf and The Macician who are abroad in other lands to return home to save Nestaria and defeat Grishnák aka The Prince Of Destruction,Missing,nan,nan,nan,nan,nan,nan
851990400,[8],159215,Tonko 2,[6],A platformer game for Windows 95 The resolution has doubled from the previsous game and the sountrack is now MIDI based,Missing,Missing,nan,nan,nan,nan,nan,nan
851990400,"[13, 30]",155278,Pinball Gold Pack,"[3, 6, 13, 14]",The Pinball Gold Pack collects all 20 tables from the first five pinball compilations by 21st Century Entertainment onto one CD,Missing,Missing,nan,nan,nan,nan,nan,nan
851990400,"[5, 24]",145949,Terra: Battle for the Outland,[6],Terra is a FREE Massively Multiplayer Online Game MMOG persistent world universe in which Warriors battle with heavy weapons on personal and team levels to conquer the Outlands,Missing,Missing,nan,nan,nan,nan,nan,nan
851990400,[12],145696,Neophyte: The Spirit Master,[6],The Spirit Master is the third and final shareware episode of the Neophyte saga,Neika Mantru is a young warrior with some unusual abilities Neika has just turned 15 and so must undertake a spirit quest which requires her to explore the outside world beyond the secluded clan At the same time Daru Neikas father and clan healer is troubled because he has seen in a vision that a great evil has returned to the world He believes that his daughter is key to stopping this evil So Neika must follow her spirit guide out of the forest and find those who can help her complete this Herculean task,Missing,nan,nan,nan,nan,nan,nan
851990400,[12],145695,Neophyte: Koplio's Story,[6],Koplios Story is the second entry in this classic shareware series,You are Koplio a young monk who is about to receive his Sigil of Passage But all is not well within the monastery Rumors of the reemergence of the Grand Malefactor Vacmatio have traveled even as far as Semident Very recently strange rumblings have been heard from the forbidden basement of the monastery disused for hundreds of years But what is worst of all is the earthquake which hit the monastery last night Part of the building has collapsed including the entrance to the holy vault where the Armor of Gorus should be safely stored Can you Koplio manage to solve the mystery of the earthquake and perhaps recover the Armor of Gorus in the process Without it you can never take your vows Worse yet if the Armor has fallen into the wrong hands it might mean the end of an era of peace,Missing,nan,nan,nan,nan,nan,nan
