first_release_date,id,name,platforms,summary,genres,storyline
1658448000,229776,My Uncle's Garden,[6],You travel to a small hut in the woods because you received a mysterious letter telling you about a uncle you never heard of What can possibly go wrong,"[9, 31]",Missing
1657497600,229774,My Happy Place,[6],The player watches old recordings from their strangely familiar dreams starting from what seems to be a normal day in the streets of your home town,[31],Missing
1656806400,229743,Attic,"[6, 82]",Attic is a Yume Nikki fangame developed as an entry for Dream Diary Jam 6  You explore Aurores dream world The goal of the game is to explore and find effects,[31],Missing
1659139200,229409,Astronomical Club for Queers,"[6, 14, 130]",You are a transgender civet named Louie After the flood at your friends family home you stayed at the family home of your friend a gay fox named Oliver  Listen carefully to the podcast with your buddies  pansexual alligator Miles and lesbian dog Kylie and learn more about the approaching Halleys comet Admire the night sky with the help of a telescope together with asexual cat Darwin,[31],Missing
1658275200,229356,The Floor is Breathing,"[3, 6]",The Floor is Breathing is a short liminal space horror game Play through multiple perspectives as you try to understand the deaths of four innocent people,[32],Missing
1659225600,229218,Cultivating Happiness,"[3, 6, 14, 82]",As you watch TV an odd commercial comes on and it really speaks to you Like directly This game was made for O2A2VNJam 2022,[34],Missing
1657238400,229054,Hat Tricks: Hare in Box,[6],Put magic hats atop objects to change their behaviors and get the rabbits to the carrots,"[9, 32]",Missing
1657929600,228989,"It's Not You, It's Your Trauma",[6],The worlds most prosaic isekai Stuck in an unfamiliar world inside a library that records the entirety of its history through mysteriously magical means Sammy Baxa must dust the shelves Well at least shes got a friend to accompany her while she waits for a way back home,"[12, 31, 32]",Missing
1656979200,228968,Zonnebloem,[6],Zonnebloem is a short 18 visual novel made by soulsoft cappy and insects for the vn cup  Its a story set at the peak of summer all about meeting an old friend again after a long time and realizing youre in love,[34],Missing
1657324800,228911,Carols in July,[6],Carols in July is a Friday Night Funkin mod based on hhgregg,[7],Missing
1657065600,228820,V or B,"[6, 14]",Missing,[34],Missing
1658361600,228797,Walk in the Sun,[6],Claires got one goal  to spend time with her friend Jamie after school  Nothings going to get in the way of that  Made in two weeks for VN Cup,Missing,Missing
1656979200,228743,Tatusino,[6],Tatusino is a visual novel about an arranged marriage and the revelations that come forth through the journey back home  Won 1st place in vncup a contest for short yuri visual novels,Missing,Missing
1658275200,228299,Rock Life: The Rock Simulator,[6],Built from the ground up Rock Life is the next generation of immersion and simulations Live do and experience what it is like to truly become one with nature as a rock,"[13, 32]",Missing
1657756800,227988,Bit Hotel,[6],Bit Hotel is a socialfirst pixelart gaming metaverse in which users can hang out compete for leaderboard rewards and earn income All ingame items NFTs such as characters rooms and furniture have been integrated on a blockchain and all have their own unique perks,[12],Missing
1658102400,227910,De Tres al Cuarto,[6],A deckbuilding comedy game about a couple of smalltime comedians,"[34, 35]",Missing
1658188800,227894,Stationeers: Human Cosmetics Pack,[6],This pack enables new cosmetics for use by players with the Human Species in Stationeers  A stack of cosmetics that you can use when playing as a Human character  Six new heads  Three new bodies  Eight new hair styles  A new beard  Three new moustaches  New old textures all existing and new human heads,Missing,Missing
1656806400,227639,Seiko: High! Low!,[6],Help this stupid girl earn some extra cash by playing a simple game  Seiko High Low is a relatively simple card game in which you help Seiko a girl who although optimistic isnt especially clever earn some extra cash,[35],Missing
1658793600,227568,ToontownRonpa: Citizens of Distrust,"[6, 14]",Toontown home of the silly and fun toons of kinds what could possibly disturb such a way of life The answer is quite simple a game that will threaten the livelihood of Toontowns most wellknown figures including Toontowns current Leader Flippy Who will make it out of this killing game That is for you to find out,"[2, 9, 32, 34]",A group of 15 toons from the retired Disney game Toontown Online are kidnapped made to have their memories erased and trapped with in a killing game à la Danganronpa wherein someone must kill someone to escape their captivity whilst being able to fly under the radar in a collective trial lest they face execution
1658966400,227565,Kiro the Kosmonaut,"[3, 6, 14]",Kiro the Kosmonaut is a casual spacethemed platformer game Embark on a journey through the solar system and prove that you have what it takes to reach Pluto in one piece Youll visit planets pass the asteroid belt evade obstacles while managing your fuel and health,"[8, 31, 32, 33]",Missing
1658966400,227438,Apt. Map,"[3, 6, 14]",Wondrous floating eye game,[32],NA in first person you fly around a series of 3d maps of surreal interior and exterior locations mostly apartment buildings
1658793600,226917,Sniper Elite 5: Landing Force Mission and Weapon Pack,"[6, 48, 49, 167, 169]",Deploy to the South of France where enemy forces have commandeered an island off the coast of Marseille to house a gargantuan gun battery The vast island is a hive of Nazi activity and features docks lighthouse and a ruined keep as well as the huge gun emplacement which must be destroyed in order to help the Allied Landing Force liberate Southern France,[31],Missing
1656979200,225718,Saturn's Rising Temperature,[6],Follow the life of Saturn a warehouse worker living on the manmade planet of SD1409V2 in a universe where space travel is a fad that has long since came and went Recently shes been having strange dreams about the moon that orbits this planet But its probably nothing right,"[32, 34]",Missing
1659139200,225514,Bittersweet Starlight,[6],Sorrel has a conversation with his good friend Aster at the place they always meet What will they talk about,"[32, 34]",Missing
1658361600,225311,Sherbert In A Bottle,[6],Sherbert In A Bottle is a short visual novel about wrestling with decisions relating to ones life path and the positive impact online friends can have on a person,"[32, 34]",Missing
1657152000,225310,Just Kiss Him Already!,[6],Just Kiss Him Already is a fluffy high school boys love story about two idiots who need a gentle push in the right direction to get together  and youre here to help with that,"[32, 34]",Missing
1659225600,225267,Late Night Talks,[6],A short latenight conversation with an exorcist Whos also your boss,"[2, 32, 34]",Missing
1658793600,225235,Life Eternal,[6],A necromancer awakens in a dilapidated tower he once knew as a pristine stronghold for his lord and sorcerer that he was apprenticed under Somehow the necromancer slept through it all in a sleep so sound not even his lords death woke him up But thats all right his lord had foreseen this coming and made sure the necromancer had the knowledge and training so he could raise his dead lord all on his own,[32],Missing
1658966400,225051,DJMax Respect V: Technika Tune & Q Pack,[6],DJMAX RESPECT V  TECHNIKA TUNE  Q PACK Now enjoy the songs of DJMAX TECHNIKA TUNE  Q in DJMAX RESPECT V,[14],Missing
1656892800,223861,Yume no Kirby,[6],Yume no Kirby is an English KirbyYume Nikki fangame created by Ondaja in RPG Maker 2003 It was developed as an entry for Dream Diary Jam 6,[31],Missing
1657411200,223805,11 Hào Xiǎo Zhèn Zōng Hé Zhèng,[6],Missing,"[9, 34]",Missing
1658966400,223454,The Siren's Song,[6],A brief kinetic novel for the O2A2 2022 game jam a marine biologist falls down a trench and meets a siren upon which they develop a rich infatuation,[34],Missing
1658448000,222828,Phil Alone,[6],Phil Alone is a horrorpuzzle game based on old Escape The Room games Try solve this huge puzzle with a lot of different endings,"[9, 32]",Meet Phil Phil is alone in home when he wakes up and wants go out with his friends But first he needs to do all his tasks Help him before the day endsor it doesnt
1659139200,222793,Her Trees,"[6, 82]",Her Trees is a slightly unusual room escape game There is no item acquisition Move things and combine them to unlock the password Solve the mystery of this strange room,"[9, 31]",Missing
1657756800,222132,G-Mode Archives+: Megami Tensei Gaiden - Last Bible New Testament,"[6, 130]",Together with the demon we will open up our destiny The story that is the end of everything and the beginning of everything,[12],Missing
1658534400,221573,Midnight Mercenaries,[6],Midnight Mercenaries is a game that combines the fastpaced gameplay of Hotline Miami with the characters and mechanics from Team Fortress 2 and expands on both concepts,[5],Missing
1658275200,221534,No Man's Sky: Endurance,"[6, 48, 49, 167, 169]",Dramatically expand your capital ship in update 394 Endurance Introducing deeper and more varied freighter base building including exterior platforms and catwalks enhanced nebulae and deep space storms fleets of organic frigates and so much more,[31],Missing
1657497600,221040,Woods of Disturbance,"[3, 6, 14]",You woke up in the middle of the forest next to you is a freshly dug grave your hands are tied and you dont remember how you ended up here You must survive and get out of this forest at any cost,"[5, 31, 32]",Missing
1656806400,221007,Catabasis,[6],Rescue your brother from an untimely demise As you explore circles of the afterlife you may learn a Pentacle These Pentacles can be drawn to bend angels to your will,[31],Missing
1659052800,220887,Vivamus in Fabula,"[6, 14]",Vivamus in Fabula is a short dark fantasy visual novel of around 1000 words including a bonfire medieval Irish art dying people and relaxing music,[34],Be the last witness of a dying clan which is cursed to have their skin and flesh slowly fall off and decide after listening to their story what you want to do with the one responsible for this
1657584000,220221,Zen Blossom,[6],Missing,[9],Missing
1656979200,218792,#Doubleblush,"[6, 14]",By squishymoss and violet lafleur Girl meets girl and shit gets gay,[34],Missing
1657411200,218653,Back to School: My Worst Day,[6],Personal survival story loosely based on real events set in western Ukraine,Missing,Personal survival story loosely based on real events set in western Ukraine
1658016000,218406,Dice Versa,"[6, 14, 34, 39, 82]",Dice Versa is a logic game inspired by Uno Dominoes and Tetris Its deceptively simple to play  Drag dice onto the board Complete rows and columns to score points Adjacent dice must have the same color or value,"[9, 32, 33]",Due to circumstances beyond your control you have found yourself in a battle for your soul against Versa the Demon of Luck  Play her tricky dice matching game for the chance to cheat death at least for a little while longer
1657843200,218137,Harem of Nurses,[6],By chance I acquired a powerful hypnosis device Working as a security guard in a hospital I decided to use this wonderful power to realize my dream a harem with five female protagonists to choose from,[34],Missing
1659052800,217874,Close to You,"[6, 14]",short horror game about waiting for the inevitable  you are seeking shelter from the apocalypse in an abandoned diner you are safe in here but also trapped  no jumpscares  CW rapidly flickering lights and potential motion sickness,[31],Missing
1658966400,217864,Blood of the Covenant,"[3, 6, 14, 82]",You meet someone in a chilly alleyway at night,[34],Missing
1658707200,217850,A Devilish Nightmare,[6],A 20Minute Psychological Horror Experience  Troubled by your traumatic nightmares you play as a little boy who is going to sleep like usual but little does he know that the night is about to get hectic for him once more Tortured by his nightmares the boy is unsure of whats real and whats not The fear is taking over and you must overcome these nightmares or completely lose your sanity and perish in the void,[31],Missing
1659225600,217610,A Portrait of Feathers,"[3, 6, 14]",A Portrait of Feathers is a bitesized visual novel about an angel and someone theyve watched over,"[32, 34]",Missing
1659225600,217541,Her New Memory: BDSM,"[3, 6, 14]",Have the countless romantic moments with your beloved and vanilla sex bored you Have you ever thought about adding some spice and trying out BDSM Then this DLC is for you,[34],Missing
1658707200,216454,Completion LawnCare,"[6, 82]",A short game where you take strange lawnmowing requests and eventually get yourself into some big trouble,"[13, 33]",Missing
1657238400,215790,Entre Laços e Amassos,"[6, 34, 39]",A young woman who wants to find direction in her life moves to a big city There she goes to a festival and has misunderstandings and disasters losing her job home and getting stuck on a farm with a rude Agroboy,[34],The Protagonist is a 19yearold girl who is looking to find a direction for her life From a young age she is passionate about music however her talent leaves something to be desired For these and other reasons she has moved to a big city which has many possibilities for her to grow up and has been living in a small oneroom apartment while working in a department store  After a tiring day at work she decides to go to a festival that takes place annually in several cities in the state mainly in the capital popularly called Pecuária or ExpôGoiânia This festival brings together an amusement park typical food stalls cattle exhibitions and the main one shows by famous country singers  After being completely disappointed that the shows singer uses playback our protagonist decides to leave which is her worst decision of the night  Many misunderstandings and small disasters happen one after the other and leave her without a job housing and trapped inside the farm of a cocky country singer
1659225600,215188,Trapped with Jester,"[3, 6, 14, 34, 82]",You wake up in a carriage with an annoying stranger,"[31, 32, 34]",Your head aches Your memory is in shambles  You hear the clipclop of a horses careful steps  You feel shaking around you and a pair of eyes watching you  You are awakened by a voice An unfamiliar face  Where are you Who are you Why are you here   AND WHY WONT THAT ANNOYING STRANGER SHUT UP
1658188800,215034,Intraquartz,[6],INTRAQUARTZ is a multidimensional experimental maze puzzler where you control a microscopic mining rover inside extraterrestrial crystals,"[9, 32]",Missing
1658880000,214563,Florealia,"[6, 82]",A chance meeting with the divine human in shape but not in thoughts,[34],Missing
1658793600,214468,AnotherQuizzGame,[6],Missing,"[9, 26, 33]",Missing
1658966400,213914,Moonyolk,[6],MOONYOLK is a short tale about two boys floating in the sea and watching a lonely moon A reminder that its never too late to say you love me,Missing,Missing
1657584000,213634,Missing,"[6, 14]",A short VN style game made in RPG Maker in which you try to find out what happened to your missing friend,[34],Missing
1659139200,213184,Coerced Cage,[6],Inspired by the pandemic lockdown our main character goes through a period of isolation Depending on players choices his mental state will result in 3 unique endings Whether he escape his own house or stay in for good it is all up to you,[12],Missing
1659052800,212983,Memory Puzzle: Futanari Boss,[6],Train your brain with this memory game revealing the naughty sexual adventures of a Futanari boss and her coworkers at the office in images hidden behind pairs of cards which you have to match,[32],Missing
1659052800,212880,Freight Hopper,"[3, 6, 14]",A fast paced platformer where you jump from train to train,"[8, 33]",Missing
1657756800,212863,Stones Keeper: King Aurelius,[6],Stones Keeper uses a turnbased combat system which lets you use environmental objects as protection against your enemies As well as the ability to break some of the environmental objects down to move faster which in turn opens up a lot of strategic possibilities  You can customize your squad by recruiting new companions with multiple specializations skills and weapon preferences Missions and battles will be just as diverse Command your warriors to besiege enemy settlements or defend yours protect your orders churches escort civilian wagons lay siege to enemy castles aid your allies and capture new technologies to upgrade your castle,"[12, 16]",The story of King Aureliuss courage and selfsacrifice  leader of the Order of the Griffin The Inquisition guarding the borderlands asks for help as undead units are increasingly infiltrating the territory of the order Aurelius takes on the task of protecting his own lands unaware that this is only a small part of what his entire Order will face in the future
1659225600,212700,Price of Resurrection,[6],An interactive story where you can kill people in your dreams,[34],Hasumi a young girl like any other suffers from sleepwalking It seems that she does things every now and then without meaning to However due to a horrific accident that befalls on her sister Hasumi learns that she is able to kill people in her sleep Only by mastering her powers of affecting the physical world in her dreams may she be able to attempt to resurrect her sister
1658880000,212409,Squeen's Adventure 2: Crash on Mars,[6],Now that Squeen has built his space ship he can get back to his home planet However Squeen forgot that spaceships still run on engines As such when leaving earth he crashes into the surface of Mars Help our alien pal Squeen scrounge up some parts of an engine so he can charge his phone and get back to his home planet,[8],Missing
1657152000,212306,"Oita, Beppu Mystery Annai: Yuganda Tourou","[6, 48, 130]",Missing,[34],Missing
1658102400,212295,Vampire Curse,[6],The Vampire Curse has struck you Play as a vampire who wants to find a way to end his eternal thirst for blood Explore the First Vampires manor and discover its secrets avoid the traps and fight anyone who stands in your way But be quick  Without blood your energy will decrease and you will faint,[31],Missing
1659052800,212293,Hina-chan Breaker: 2nd Break,"[6, 34]",A doujin game by ISY based on the Touhou Project series,"[8, 32]",In the previous work Hinachan tired of not being invited to the original work at all broke into an uninhabited house in the middle of nowhere and started a heinous crime demanding highgrade sweets and a turn at the scene Various humans and youkais gathered to blow Hinachans house down and the case was successfully solved  In this work Hinachan is in a world where no one was able to kick her out of the house Hinachan who was in a good mood strengthened her defense and direction even more and started to recruit humans and youkais who could kick her out She then plans to raise her own profile by broadcasting the event in real time throughout Gensokyo
1658102400,212265,Her Nightmares: Redacted,[6],Dwell deep into her nightmares  uncover the truth,"[2, 8]",Lost in a sea of dark you drift Not knowing why it happened Not knowing where youre going You only know that You want to live
1659139200,212250,Stagnated In Slumber,[6],Wake up go to sleep That is all you have to do  Stagnated In Slumber is a short RPG Maker game about a meaningless life of a meaningless character Play as Agnes a girl stuck at home sleeping through day after day Explore around the house and if you are lucky find something interesting to do,[12],Missing
1658361600,212247,Wings of Glory,"[6, 14]",Rule the skies in strategy dogfights in the digital adaptation of the classic tabletop board game,"[15, 32]",Missing
1659052800,212238,Pretty Girls Breakout! Plus,[6],Pretty Girls Breakout A batting actiontype breakout game that hits hits and hits back is powered up New game modes and new gimmicks have been added to make Pretty Girls Breakout Plus,[14],Missing
1658880000,212212,Wicked Games,[6],To get a Ticket to Paradise while being in Hell A ticket thats obviously worth it A ticket that sends you to the obstacle path What kind of road from Hell to Heaven could it be What difficulties are awaiting you on this road Are you worthy of a chance at redemption,"[31, 32]",Missing
1659052800,212207,Living Legends: Bound by Wishes - Collector's Edition,[6],Every dream can come true for the right price Your husband Jack has gone there but when he doesnt return you follow in his footsteps The town is threatened by enchanted roses that choke the life out of anyone they ensnare Can you save your husband from his deadly contract,[31],Missing
1659052800,212205,One Handed,[6],Short Retro style scifi 3d shooterplatformer with shooting mechanics where you play as a cyborg shooting and escaping from enemies,[32],Missing
1659052800,212202,Cowgirl Adventures,[6],Cowgirl Adventures is a strategy shooting casual puzzle game Players will play the role of a cowgirl to pass through many levels fight against various enemies and finally capture them one by one Adventure story,"[15, 31, 32]",Missing
1659052800,212191,Sweet Office,[6],This is a game that combines relationship simulation and whacaMole modeThe story takes place in the office of a company you will meet three girls with different personalities Help them solve their problems in work and life and win their favor,"[13, 32]",Missing
1658102400,212157,Modern Fantasy: Urban Legends,[6],Can you track the source of the Zombie Epidemic engulfing the rural island youre currently inhabiting before your lost friend falls victim to a deranged scientist Explore a turnbased RPG with action elements while fighting against the undead crazed people enraged animals  unusual mutants,[12],Missing
1658880000,212116,Multiply Factory,"[6, 14]",Multiply Factory is a factory building game Build your own multiplelayer factory within a 3D space with belts inserters factories and stairs Enjoy the fantasy of manufacturing,"[13, 15, 32]",Missing
1658966400,212095,Connect the Dots 3D,[6],Connect the Dots 3D is a casual puzzle game,"[15, 32]",Missing
1658793600,212044,Nash Racing 3: Drifter,[6],Nash racing series is back Tune your drifter car drift and collect achievements in this car tuning simulation game and try to tame this beast and powerful car,"[10, 13, 32]",Missing
1659052800,211966,Empire of Empires,[6],Have you ever thought about what its like to defend your territories from enemies,"[13, 15, 31, 32]",Missing
1659052800,211965,Domum,[6],Unravel the dark past of a once beautiful estate in this disturbing topdown adventure game Solve puzzles unlock multiple endings and experience imagery you will never forget as you determine the fate of those that tormented you,"[31, 32]",Missing
1659052800,211964,Mech Shuffle,[6],Mech Shuffle is a roguelite deck builder where you choose a pilot and a mech to build a unique deck Earn new cards and card upgrades to improve your deck over a run Scout the battlefield secure the beachhead and repel the invasion,"[15, 32]",Missing
1659139200,211961,Cats Yakuza,[6],In this strategic card game you battle with adorable yet quirky cats The rules are similar to mahjongg and poker with a new tactical sense youll love Even though the rules are simple the game is surprisingly deep so the battle of wits and psychological strategies are so fun,[32],Missing
1659139200,211960,Illusion,"[6, 130]",Delivery personnel headed to a condominium building to deliver a package,"[13, 31, 32]",Missing
1658880000,211945,Insurrection: Cyborgs Awakening,[6],Kick some asses in this cooperative retrowave game Use powerful abilities and combos to destroy the evil minions of the Driftonics mega corporation and free humanity from the cyborg threat,[32],Missing
1658448000,211930,Kritika Global,[6],Kritika Global is a hyperstylized anime brawler game featuring overthetop action with giant blades superguns and dazzling acrobatics Fight with friends or rampage solo through hordes of enemies and supersized bosses in an epic fantasy world,[12],Missing
1658880000,211920,Maze of the Gamja,[6],Solve Gamjapuzzles and Acquire Gamjaknowledges Maze Of The Gamja is a free liner puzzle game with Gamja Move or active your Gamja and get sweet potatos 66 stages 193 photos and 75 Gamjaknowledge are waiting for you,[32],Missing
1658880000,211918,Trainz Railroad Simulator 2019: Pro Train - DB BR Class 85 001,[6],This DLC features the DB BR85 001 in PBR quality with a high quality interior The Class 85 was intended for hauling passenger and goods trains They were however also employed as pusher locomotives on the Hoellentalbahn in the Black Forest,[13],Missing
1658188800,211904,Hold Controller,[6],Hold Controller is a VR game similar to electric shock maze Players can use one or two controllers to cross the designed level Carefully observe smoothly control both hands to complete the level and charge the core,"[10, 13, 15, 32]",Missing
1658880000,211779,Virus Protocol,"[6, 14]",Let virus destroy white cells and get to here and there D,[32],Missing
1658793600,211719,Idol Hunter: Hentai,[6],Idol Hunter is a story about hacker who earns money by hacking idols At your service there are dossiers of several girls with different destinies and fetishes Crack them and obtain their nude photos for customer find out their mysteries and keep their pics as a marvelous bonus,"[13, 32]",Missing
1658966400,211687,I Commissioned Some Bees 4,[6],The brief was simple Artists were commissioned to create a fantasy world and hide as many bees as they can inside it Now its your job to find them all With 10 art pieces to choose from and 1000 bees you will have a lot of searching to do,[32],Missing
