first_release_date,genres,id,name,platforms,summary,storyline,rating
1193097600,"[11, 13, 15]",8220,Age of Empires III: The Asian Dynasties,"[6, 14]",Age of Empires III The Asian Dynasties is the second expansion pack for the massively popular Age of Empires III Rule powerful and exotic Japanese Chinese and Indian civilications of the East Battle with Samurai Chinese Banner Armies and devastating war elephant troops and build powerful wonders  Age of Empires III The Asian Dynasties is the second expansion pack for the realtime strategy video game Age of Empires III developed through a collaboration between Ensemble Studios and Big Huge Games and published by Microsoft Game Studios The Mac version was ported over developed and published by Destineers MacSoft The game is the second expansion pack following The WarChiefs The game introduces three new civilizations China Japan and India It also introduced minor people campaigns maps and game modes,Campaigns There are three new campaigns one for each new civilization Furthermore these campaigns return to the historical civilizationbased singleplayer campaigns which are different from the past campaigns in the Age of Empires III series Each campaign consists of five new scenarios They are the first campaigns in the Age of Empires III series to not revolve around the fictional Black family  Japanese campaign  The Japanese campaign focuses on the unification of Japan the beginning of which was also a scenario in Age of Empires II The Conquerors the establishment of the Tokugawa Shogunate which players control and a young general named Sakuma Kichiro Apparently when Kichiro was a baby Tokugawa Ieyasu rescued him from the ruins of his conquered village and raised him as his adopted son The campaign begins when Kichiro meets up with Daimyō Torii Mototada at the siege of Osaka transported from 1615 to 1600 to capture the 5yearold heir of Hideyoshi Kichiro and Mototada ally with the local villagers and storm the castle Next they move to the northeast of Honshu to destroy any villages that might support Tokugawas enemy Uesugi Kagekatsu and defeat Uesugis army After the victory in which they suffer heavy losses Mototada learns that Tokugawas main enemy Ishida Mitsunari is threatening Mototadas estate at Fushimi forcing Mototada to return there Meanwhile Kichiro marches his exhausted army west again to take control of the Tokaido Road trade route In the aftermath of the battle there a defeated samurai of the Oda clan tells Kichiro that Tokugawa has lied to him since his childhood Angered Kichiro kills the samurai but nevertheless is still shaken by his words He returns to Mototada at Fushimi and asks him the truth of his origins Mototada replies that while it was Tokugawa who destroyed his village when he was a baby and sentenced his parents to death he presses Kichiro on obeying the samurai code telling how Tokugawa admired Kichiros skills since he was a boy and has great faith in him to help him in unifying Japan Kichiro remains loyal to Tokugawa and helps Mototada at ensuing battle at Fushimi After Kichiro escorts the noncombatants to safety he is forced to leave Mototada to fight alone As the enemy breaches the final defenses Mototada commits seppuku Kichiro joins Tokugawa at Sekigahara After the Battle of Sekigahara ends in victory for them Tokugawa tells how it was a great achievement for him to become the Shogun and further asks Kichiro what did he as a general gain from it Kichiro says the truth and makes no mention of what he had learnt about his past It concludes with it showing Kichiro riding his horse alone with a voiceover from Mototada on the importance of loyalty to ones master  Chinese campaign  The Chinese campaign focuses loosely on the 1421 hypothesis and is about a Chinese treasure ship discovering the New World before Christopher Columbus The story mainly focuses on Jian Huang a Ming captain who has long dreamed of seeing the outside world and his partner and new friend Lao Chen a large powerful and crude sailor who are given orders to help expand the Ming Empire In the initial release of the game the players emblems and unit models are representative of the Qing Empire despite being set in the Ming period In the beginning the treasure fleet is attacked by Wokou pirates while still under construction On orders of the spoiled and selfish Admiral Jinhai nephew of the unnamed emperor Huang and Chen save the fleet and eliminate the pirates The fleet then embarks westward and is next seen to land in a port on the coast of India There many of the crew including Huang and Chen are attacked by soldiers of the Indian Zamorin and flee with part of the fleet to a nearby island where they set up a new base and mount a rescue mission to save Jinhai and the remaining crew who have been captured by the Zamorins troops and as they discover some Chinese defectors The fleet continues west at Jinhais insistence although many ships turn back and eventually are cast ashore in the Yucatán by a storm Chen and Huang go to rescue crews of the other ships from hostile Aztec soldiers When they return they find that Jinhai has disappeared Huang suspects that he was captured along with many of the fleets crewmembers and mounts a rescue mission Huang and Chen cut through the jungle and rescue many of their comrades but Jinhai is not among them Huangs small army of sailors then enters a nearby Aztec city where they learn that Jinhai has set himself up as an emperor or perhaps a god among the Aztecs and that it was Jinhai who plotted with the Zamorin in India Huang and Chen escape an ambush by Jinhais soldiers and flee back to the coast through a series of caves rescuing more of their crew along the way Once back at the coast they set up a base and counterattack defeating and killing Jinhai After the battle Huang Chen and the surviving crew members scour the beaches for all evidence of their presence and then sail home to China hoping that no one will ever know they were there  Indian campaign  The Indian campaign is about the Indian Rebellion of 1857 and deals with a situation very similar to Chayton Blacks situation in The Warchiefs campaign Shadow The protagonist is Subedar Nanib Sahir a portmanteau name of Nana Sahib a member of the Sepoy regiments who served the British East India Company who slowly becomes disillusioned by its cruel ways and abuse of Indian citizens The campaign begins with Nanib and his superior Colonel George Edwardson regaining British control of the saltpetre trade in the Punjab Nanib and Edwardson then march south to Calcutta and defeat the roving bands of arsonists there At the close of the battle Nanib convinces a group of arsonists to lay down their weapons and leave but Edwardsons men ambush and massacre them leaving Nanib visibly shaken The conflict of Nanibs loyalty comes to a head when he and his men are ordered by the Colonel Edwardson to use new Enfield Rifles despite the cartridges greasing with beef tallow and pork fat which is a taboo to the sepoys Hindu and Muslim beliefs Nanib uses one of the rifles to fire a near miss at Edwardson loosely based on a similar incident involving Mangal Pandey killing one of his soldiers Nanib and fellow sepoy Pravar Patel then lead their regiment of sepoy in an attack on the local Company fort by assaulting weapon caches to cause fires and explosions under its foundations After their victory Nanib and Pravar quickly rally the local citizens and sepoys raising enormous forces Although Nanib denies leadership of the revolt he and Pravar decide to rescue Bahadur Shah II from British captivity when the Shah declares himself supreme ruler of India They sneak into Delhi in the dead of night and destroy weapon caches to cause elephant stampedes which destroy various city gates Along the way they find more rebels who help them battle through Delhi freeing the Shah and escaping into the night Nanib subsequently leads his forces in an assault on a Company fort commanded by Colonel Edwardson Nanib destroys or captures the saltpetre sites and plantations supplying Edwardsons forces inside the fort and fends off three counterattacks Finally he assaults the fort and captures its outer defenses including the fixed guns mortally wounding Edwardson in the process before destroying the forts command post When the heat of battle fades Nanib approaches a dying Edwardson who threatens and curses the Indians saying that the Company is a much larger and more powerful force than all of India Nanib replies by explaining that no military force can kill the Indians passion for their country After Edwardson dies Nanib and Pravar leave to prepare for a long and costly war against the Company and three rebel sepoys are seen lowering the Companys flag from the nearby flagpost,81.57998572239015
1193097600,[13],713,Microsoft Flight Simulator X: Acceleration,[6],Microsoft Flight Simulator X Acceleration is an expansion pack for Microsoft Flight Simulator X This expansion pack brings new multiplayer race mode 20 new missions six new scenery maps including the Red Bull Air Race courses and three new planes FA18A Hornet EH101 Helicopter and P51D Mustang,Missing,81.53846153846153
1192060800,"[12, 15, 16]",372,Heroes of Might and Magic V: Tribes of the East,[6],Tribes of the East is the second expansion pack to the turnbased strategy game Heroes of Might and Magic V  For the first time play as the Orc faction and recruit heroes build armies and manage cities as you explore and conquer legendary lands Use tactics skills and magic to outsmart fantasy armies while developing your heroes and unveiling the dark plot that threatens to tear the world of Ashan apart,Rage of the Tribes  The story begins after a Griffin Empire raid that results in the capture of several Orcs which causes the character Quroq an Orc chief to conquer a renegade Haven city which rouses the attention of the false Queen Isabel The queen sends forth her most trusted servant the zealous Archbishop Alaric to ward off the Orc invasion The events that happen between this and the next time we see the Orcs are unknown though Quroq is killed by Alaric at some point    The Will of Asha  Meanwhile the Necromancer Arantir is driven by his master the Goddess Asha to fight against the demonic corruption in the Haven cities He meets up with a novice Dark Knight named Ornella introduced to him by Giovanni the vampire With Ornella now turned into a Necromancer at his side Arantir sets out towards the city of Flammschrein the holy city which has been desecrated by the demon Orlando After killing Orlando Arantir visits the graves of Flammschrein where he frees a fragment of the true Queen Isabels soul Upon doing so the succubus impostor who had been taking the place of the queen is revealed and she is forced to change plans and take over the capital with brute force  Arantir however learns of the Demon Messiah and leaves to attempt to stop the prophecy leading to his appearance in Dark Messiah of Might and Magic He does not appaear in the final campaign    To Honor Our Fathers  At the same time as it is revealed later the young Orc Gotai takes lead of the Orcs and hopes to crush the demons In order to do so however he must brave many trials the first of which is to gather the support of various tribes To do so Gotai sends Kujin who manages to assemble an army of Orcs Gotai then chooses to respect the soul of Kunyak the greatest of the Orcs who lead them to freedom by going to his burial place in a wizard city After doing so he avenges the death of Quroq by killing Alaric After the false queen was revealed as the Succubus Biara Alaric had actually gone mad and hoped to kill all the Orcs believing that it was all just an illusion and he still was to follow the wishes of his master Though Gotai offers Alaric the chance to die honourably Alaric shows no sign of sanity in his final moments  During Kujins travels it is also revealed that Biara had killed the heir of the Griffin Empire to corrupt the Heart of the Griffin an artifact used to repel demons It now summons demons to bolster Biaras ranks    Flying to the Rescue  After the death of Alaric Gotai and Kujin arrange a meeting with Zehir with whom they ally for their common causes Zehir begins by searching for Raelag who he considers the best source to ask about the rumors surrounding Queen Isabel While he never finds him he allies himself with Ylaya to deal with the renegade Soulscar Clan He then travels to the duchies of the Griffin Empire where he must help Duncan and Freyda fight off the demonic influence He does not participate in the fight directly but he performs a rite that reveals the demons disguised as humans After this event the followers of the false queen realize their mistake and instead join Zehir After Freyda and Duncan manage to fight off the demons they agree to help Zehir in the final battle  Zehir then travels to the dwarven mines to ensure the aid of Wulfstan but the Dwarves who are in constant feud refuse to aid Zehir Wulfstan however tells Zehir that if he manages to find Arkath the fire god of the Dwarves then maybe the Dwarves can ally and aid Zehir After finding the portal to Arkath Zehir is intercepted by Wulfstans brother Rolf who is determined not to let anyone pass until he is declared king Rolf attacks Zehir but is defeated After this victory Zehir Wulfstan and Hangvul the spiritual leader of the Dwarves and Wulfstans remaining enemy confront Arkath Arkath announces that Wulfstan is to be king and that Hangvul must compensate for betraying him With the dispute settled the Dwarves prepare to drive the demons out of the Griffin Empire  Zehir then travels to Talonguard the capitol city of the Griffin Empire now overrun by demons While he makes his way past the guards that defend the way to the city Zehirs allies destroy the surrounding Inferno towns and blockade Biara who has escaped on multiple occasions already After all other Inferno towns are destroyed Zehir besieges Talonguard and finally confronts Biara when the true Queen Isabel appears to finally kill Biara While the Empire has been damaged heavily by her work the demons have also taken major losses through the work of the protagonists losing their cults not only in the Empire but the Silver Cities and YggChall home of the Dark Elves as well Isabel tired of the events then passes the crown to Freyda proclaiming the end of the Griffin Empire and the beginning of the Unicorn empire,81.42202795361527
1192665600,"[13, 14, 15]",946,Football Manager 2008,"[6, 12, 14]",Football Manager 2008 is the principal title of the 2008 edition of the Football Manager series of football management simulation games by Sports Interactive The version for the United States and Canada is entitled Worldwide Soccer Manager 2008 while the South American version is Fútbol Manager 2008 There are over 5000 playable teams from more than 50 countries The demo for Football Manager 2008 was released on 30 September 2007  The game was originally intended to be released on 19 October 2007 but due to early shipments by many retailers carrying their game Sports Interactive moved the release date to 18 October 2007  Several problems surfaced in the game most of which had been reported to SI Games via their issues forum and as a result a Beta Patch was released This patch did not fix all problems but was released early to fix major issues A full patch was set to be released on 9 November 2007 but was delayed and was finally released on 22 November 2007 The second and final patch was released on 14 February 2008 and updated on 20 February to attempt to fix three major issues that remained in the game As with previous games the patch updates the games database with all the latest transfers and fixes many of the games remaining bugs,Missing,80.27581030009786
1193788800,"[5, 12]",325,Hellgate: London,[6],Hellgate London combines the depth of roleplaying games and action of firstperson titles while offering infinite playability with randomly created levels items and events The player creates a heroic character completes quests and battles through innumerable hordes of demons to advance through experience levels and branching skill paths A robust flexible skill and spell system highly customizable appearances and a massive variety of randomly generated equipment allow players to create their own unique hero,Hellgate London takes place in 2038 18 years after the start of a war London has been invaded by demons from Hell These particular hellions are a tireless lot and have been looking for a way into our universe for a long time Up until recently humans have had many champions looking to hold back the flood Various realworld events are referenced in the background of the Hellgate story as averted crossover attempts The Crusades were actually undertaken to fight back the minions of Hell as was the charring of London in the great fire to wipe out the Plague According to the story line the famous Knights Templar were the keepers of knowledge on how to battle these demonic forces Unfortunately these heroes underwent a charring of their own at the hands of a jealous King Phillip IV who hated the power they held in the world at large While the Knights Templar survived as an organization their numbers were severely diminished and were forced to remain in hiding to stay alive,79.64668972400874
1191801600,"[2, 31]",7629,Nancy Drew: Legend of the Crystal Skull,[6],The Search is on for an Unearthly Artifact in New Orleans,Missing,79.4154274667566
1193702400,[9],4981,Luxor 3,"[5, 6, 14]",A brave young Pharaoh killed prematurely by a fierce sandstorm and embodied by the gods as a skillful scarab must battle the powerful god of Chaos Set to free the essences of other Egyptian gods contained within colorful magical spheres  Stop the procession of approaching spheres as they journey through the maze by matching three or more Call upon the gods denoted by color to release specific powerups and purchase upgrades with Ankh coins collected during gameplay Free all the gods from captivity before they reach the pyramid at the end of their path or all is forever lost,Missing,77.17439238160885
1193097600,[5],6939,Clive Barker's Jericho,"[6, 9, 12]",Jericho is a horrorthemed FPS from the mind of screen legend Clive Barker In the game a Jericho Team must fight through a lost city to destroy the evil at its heart,Missing,76.44878750246166
1193356800,"[13, 14]",4647,Pro Evolution Soccer 2008,"[6, 9, 12]",Pro Evolution Soccer 2008 or just PES 2008 is an association football video game in the Pro Evolution Soccer series by Konami The game was officially announced on 18 June 2007 It is the sequel to PES 6  Pro Evolution Soccer 2008 was released for Windows Wii Nintendo DS PlayStation 3 PlayStation 2 PlayStation Portable Xbox 360 and Mobile Its Japanese equivalent Winning Eleven was released earlier in the year and gave an insight into the game This is the first PES game to dropped the North American title for World Soccer Winning Eleven  The game supports online capability for you to challenge your friends or gamers from around the globe,Missing,75.80089152160897
1192406400,"[10, 13]",10380,Race 07,[6],RACE 07  The Official WTCC Game features the full FIA WTCC season of 2007 including all cars and tracks as well as several new support classes and tracks from all over the world The game also features the full WTCC season of 2006 which was included in the games predecessor RACE  The WTCC Game released in 2006 on PC  For the first time ever SimBin is also presenting single seater action with Formula cars Race with the incredibly fast Formula 3000 Formula BMW and in addition also the Radical sports cars with the models SR3 and SR4  To support these new race classes the player will be offered the choice between one or tworaceformat The highly detailed damage system is also adapted to give the Formula cars the vulnerability they have in real life  RACE 07 comes with a score of new tracks and added track variations including several new city tracks alternate track layouts and reversed track option Several new community oriented features game modes and online functionalities will also be announced later  All in all RACE 07 features more than 300 cars in 9 different classes on 32 real life racing tracks and city circuits from all over the world,Missing,75.16221391518047
1192492800,"[2, 31]",4664,Agatha Christie: Evil Under the Sun,"[5, 6]",Famous detective Hercule Poirot is back in typical style turning up at just the right time to begin an investigation into the murder of a famous actress during what should have been the start of a relaxing holiday Taking on the role of Hercule Poirot players can scour a stunning tropical island for clues and delve deeper into the mysterious relationships between over 20 unique characters to search out the killer,Missing,75.01270651469243
1191715200,"[25, 36]",7004,Guilty Gear 2: Overture,"[6, 12]",Two completely different game systems carried out in a fast paced realtime environment Be the commander of your troops and also be the frontline hero of your army battling enemy forces headon while giving out commands,Missing,75.0
1192752000,"[5, 32]",6963,Deathsmiles,"[6, 12, 39, 52]",Deathsmiles is CAVEs bullethell shootemup where you take the role of one of five Angels to defend the magical land of Gilverado from an invasion by Hell itself Eradicate this devilish assault,Missing,73.40990318681338
1193616000,[31],1972,Manhunt 2,"[5, 6, 8, 38]",An experiment at a secret research facility has gone catastrophically wrong Daniel Lamb and Leo Kasper are the only surviving subjects The Pickman Project will stop at nothing to hunt them down and stop the truth from getting out  Demented screams echo around the dank asylum that has caged you for the last six years You open your eyes A whitecoated body slumps to the floor through your shaking hands A bloody syringe slips from your arm Waves of confusion and paranoia crash over you You have no idea who you are or how you got here  The door to your cell is open One choice One chance They took your life Time to take it back,During a severe lightning storm the security systems at the Dixmor Asylum for the Criminally Insane go offline allowing inmates Daniel Lamb and Leo Kasper to escape Daniel is disoriented and amnesiac unable to remember anything about himself Under Leos guidance he makes his way back to the ruins of his old home which is located nearby Inside Daniel recovers drugs which help to clear his head and discovers hints about the details of his former life He and Leo follow a series of clues to unravel the secrets of Daniels past killing anyone who interferes along the way they are pursued by bounty hunters and agents of a mysterious organization called the Project,72.33656314213667
1193702400,"[5, 9]",2030,TimeShift,"[6, 9, 12]",Master time to become the ultimate weapon Dr Aiden Krone has made a Time Jump across the spacetime continuum  a reckless act with frightening consequences Now a disturbing alternate reality has evolved within the bleak and rainsoaked Alpha District,Missing,71.00867706582578
1191628800,[13],76082,Burger Shop,"[6, 14, 34]",Make burgers shakes and more in this exciting foodmaking game that has been enjoyed by millions of fans everywhere,Missing,70.0
1192665600,"[12, 31]",20779,Hard to be a God,[6],The game is based on the novel of the same name by Strugatsky brothers The game is a nonlinear 3D RPG feautiring a branching story with four endings,Missing,70.0
1192492800,"[9, 31]",17829,Disney Princess: Enchanted Journey,"[5, 6, 8]",Meet and interact with the popular Disney Princesses while expanding your creativity and exploring important themes such as courage friendship trust and discovery Customize your own unique heroine character and enter a thrilling adventure through four funfilled levels Help these amazing princesses restore order in their enchanted kingdoms and overcome the forces of evil,Missing,70.0
1192233600,"[12, 31]",9631,Culpa Innata,[6],Culpa Innata Latin Innate Sin or Innate Fault is a third person pointandclick adventure game by Istanbulbased developer Momentum AS and published by Strategy First The game according to the developer was inspired by Alev Alatlıs novel Schrödingers Cat,The game takes place in the year 2047 in the elitist utopian city of Adrianopolis part of a capitalist one world government called World Union composed of most of the major First World countries where disease and felonies have been nearly eliminated World Unions value system is similar to the society established in Aldous Huxleys Brave New World creating a certain level of societal expectations based on numerical indices predefined in the system that only take into account how much a person accumulates Like Brave New World the society is also extremely hedonistic marriage or nuptial contracts as they are called by the World Union are obsolete and relationships are entirely consistent of sexual interest with multiple liaisons and even emotionless promiscuity all of these are regarded as healthy relationships Elements of Objectivism are included with the concept of proselfish attitudes with citizens rated in numerical terms of skillfulness called an HDI Human Development Index  The story is centered on protagonist World Union Peace Officer Phoenix Wallis who is investigating the murder of a fellow World Union citizen in a neighboring Rogue State in Odessa Russia  The game features multiple endings based on the choices and actions of the player,70.0
1193616000,[10],4748,Cars Mater-National Championship,"[5, 6, 8, 9, 12, 20, 24]",Mater is holding a national race festival allowing racers from all around the world to challenge Lightning McQueen Along with racing against the new characters players can explore the world of Radiator Springs and Lightning McQueens racing headquarters,Missing,69.93419352995082
