first_release_date,id,name,platforms,summary,genres,storyline
1658966400,207729,Autonauts vs Piratebots,[6],Create automate and defend an impenetrable base Assemble and command a Bot army to combat an entire Piratebot invasion Build program and battle your way through five different zones,"[13, 15, 32]",Missing
1657843200,207728,Ballex 2: The Hanging Gardens,[6],Ballex² is a thirdperson rolling ball game the sequel to Ballex You will control a ball enjoy the scenery of the four seasons overcome obstacles and solve various puzzles,"[10, 31, 32]",Missing
1657843200,207726,Dango!,[6],Dango is a casual liquid puzzle game You need to pass a variety of levels draw a path through which the liquid will flow and fill the vessel,[32],Missing
1657843200,207716,Real Rage,[6],Are you too calm Do you want to be angry If the answer is yes you have to play this game You have to use all of your skills to complete the stages and defeat the boss There are many traps enemies and other surprises on every level The deathcounter is waiting for you,[32],Missing
1657843200,207708,Kinkoi: Golden Time,[6],Welcome to Noble Private Academy an institution that cultivates the wealthiest most wellconnected students in all of Japan At this boarding school one must be willing to accept all of its refined and dignified teachings or be met with strict opposition,"[13, 31]",Missing
1656892800,207703,Spiderbro,"[3, 6]",Help Spiderbro through a strange dystopia and overcome the shadow spider that is constantly hindering you Collect items and solve puzzles and keep moving dont let the shadow spider get the better of you,"[9, 31, 32]",Missing
1657756800,207702,Burning Requiem: Fates,[6],Burning Requiem Fates is a new 2On2 Indie Fighting Game produced by Project Requiem Seeking to shake up the fighting game formula to bring some new flair Featuring characters coming from the new tie in webcomic series of Burning Requiem,[32],Missing
1657584000,207701,White Paper,[6],What is your subconscious mind trying to tell you when you are mindlessly drawing on a piece of paper Maybe someone trapped there in a dark damp basement and yes screaming for help and trying to break out,"[31, 32]",Missing
1657843200,207700,Five Nights at Sexy's,[6],Welcome to your new summer job at the Sexy Fucking Club where men come to have a good time The main attraction of course is the new generation of sex dolls These are animatronic robots programmed to do whatever you want,"[13, 32]",Missing
1657238400,207698,Sword and Fairy Inn 2,"[6, 48, 130, 167, 169]",Swords and Fairy Inn2  is a game developed by Softstar Entertainment It includes the type of RPG casual simulation in it Many roles of Sword and Fairy series come from different place to work in this Inn live and build a warm peace family together,"[9, 12, 13, 31]",Missing
1657584000,207695,Workaholic,[6],Workaholic is a frantic rougelite FPS where you go on a rampage through a hellish office space as your grasp on reality crumbles,Missing,Missing
1657497600,207693,Smokyflex,[6],Missing,"[13, 14, 32]",Missing
1657238400,207692,Lost Dream: Memories,"[3, 6, 130]",Lost Dream Is back bigger than ever Explore the world as a cute little fox and go on a mission to find your forgotten piece,"[8, 31, 32, 33]",Missing
1657497600,207690,Bots City,[6],Artificial intelligence is out of control Only a Hero can stop this madness The Heros goal is to get to the main computer and disable it thereby disabling all robots Our hero has only one weapon but that wont stop him,"[31, 32]",Missing
1657324800,207689,Castaway of the Ardusta Sea,[6],Going on another solo adventure Aisha sets off by ship Unfortunately a sudden storm and the incursion of a giant sea monster hinders her path Through the turmoil she is thrown overboard and wakes up on an unknown island Aisha must find her way home and survive the pirates and monsters that lurk both above ground and in the deep,"[12, 31, 32]",An adventurer Aisha takes on a quest from the adventurers guild and plunges headfirst into danger once again This time she sets off by ship and is assailed by a sudden storm and a fearsome giant monster The struggle ends as she falls overboard and is cast away to an unknown island However it appears that the pirates controlling the island arent the only threat Theres also a huge sea monster that sinks any ship it encounters to worry about Aisha must now find a safe way home from the Ardusta Sea
1658016000,207685,SnowBrawl,[6],A multiplayer snowball fighting game Choose from different hero characters team up with ur friends and best the opposing team in familiar game modes,"[14, 32]",Missing
1656806400,207682,Ukrainien Agent,[6],You play as a Ukrainian intelligence agent Having penetrated into the lair of the enemy you have to do a heroic deed to divert to themselves the maximum attention,Missing,Missing
1658102400,207679,Light Maze,[6],A simple casual game where you light up floor tiles in a level in order to go to the next level,[32],Missing
1657152000,207669,Special Gulag Rescue Operation,[6],When the barbarians came and took away your people and put them in gulags you knew you had to put down your wrench and pick up a gun Play as an ordinary mechanic from Mariupol in this procedurally generated topdown shooter,Missing,Missing
1659052800,207668,Restart Your Life Adventures of Tylenol,[6],Embark on your adventures in the fantastical land of Tenot The mystical power of tarot will guide you to eradicate evil and darkness after your reincarnation To be a great warrior to increase your strength to explore the unknown to give you infinite joy A Rougelike turnbased FTB game,"[15, 31, 32]",Missing
1658448000,207653,Cosmopoly,[6],Cosmopoly is a multiplayer board game for 16 players Play with friends buy planets and space stations participate in auctions and trade build upgrades and become dominant in space,[32],Missing
1656979200,207649,Scranny,[6],Scranny has locked you in her house best of luck escaping ,"[15, 31, 32]",Missing
1657238400,207637,Beltex,[6],Beltex is a casual factory game played on a hex map Extract numbers Combine them using mathematical operations Deliver them using belts across a huge map Unlock new buildings and upgrades,"[13, 15, 32]",Missing
1659052800,207628,Godumas,[6],Godumas is a coop horror game for 14 players Explore the strange island search for items run or sneak your way through local inhabitants and find a way to escape before you are sacrificed,"[31, 32]",Missing
1658361600,207613,Deer Journey,[6],Deer Journey is a third person walking simulator game Outcasted by the other deers an albino fawn is forced to go deep into the forest to find a place to live Join him on his journey through a world too big for which he may not be yet ready,"[31, 32]",Missing
1659225600,207581,StarMech,[6],Transform your mech to fight upgrade and survive long enough to jump to safety in this bullet hell roguelite,Missing,Missing
1656720000,207553,Space Aces,[6],Space Aces is a video game made for the spring 2022 offering of CAP 4053 at UCF The player controls a space fighter capable of movement in 3 directions and rotation in 3 directions The game supports any controller keyboard and the Thrustmaster 1600M flight stick,"[13, 32]",Missing
1658275200,207551,Toggle Cube,"[3, 6]",Toggle Cubes is a game where you have to guide people to the stars by toggling cubes on and off You have to overcome monsters fireballs and spikes by using keys and teleports,Missing,Missing
1656892800,207547,Pog 8,[6],Cute minimal physical puzzle,[32],Missing
1658016000,207546,Asteroids,[6],Another version of the classic Asteroids game,[32],Missing
1657497600,207545,Pylorus: Footsteps of Greed,[6],A free 2d roguelite where enemies form a living ecosystem with rivalries and alliances This is not your war scavenge some gold and escape with your life Or stay longer to uncover secrets and more riches the choice is yours Strange things happen to those that follow the footsteps of Greed,[32],Missing
1657324800,207541,Pizza Death,[6],Grab a slice of this fastpaced pixel art topdown shooter Pizza Death Made by members of the Australian thrash band Pizza Death the main soundtrack is a NES chiptune cover version of their entire debut album Slice of Death,"[5, 31, 32, 33]",Missing
1657584000,207537,Defenders of Asteria,[6],The time has come to defend your lands from the hordes invading forces Build up your defenses and summon mighty heroes to aid you as you become one of the Defenders of Asteria,"[15, 32]",Missing
1657497600,207535,Platform Roll,[6],PlatformRoll is a game with challenging obstacles including bombs guns and gaps through platforms Maneuver the ball across all the platforms in the dark with only a little light in order to reach the next level Compete against an online leaderboard and see how fast you can complete each level,"[15, 31]",Missing
1657411200,207534,Cutie Tutti Frutti,[6],Cutie Tutti Frutti is a game based on 3 in a row mechanics The goal of match3 puzzles is to make groups lines and rows of 3 or more identical tiles,[32],Missing
1657152000,207533,Barista: Take Away,"[3, 6, 14]",Drag and drop game against the clock where you will try to make the perfect coffee for each client,"[13, 32]",Missing
1657238400,207531,Cards of the Dreaming Dragons,[6],How well do you know your friends Cards of the Dreaming Dragons is the ultimate tabletop game you can play with your friends and family Figure out what they are thinking and deceive them to win,[15],Missing
1657843200,207530,Doctor Nanobot,[6],A microbiology themed retro shootemup,[32],Missing
1657238400,207525,Elemates,[6],Elemates is an actionadventure game about a rebellious girl out to prove her worth in the heroic trials of her tribe There she finds an unlikely ally in her grumpy guide As a team prevail through the mighty god Quetzals temple and use the Band of Humility to unleash powerful elemental spells,[31],Missing
1657843200,207524,WordMaster,"[3, 6, 14]",Create as many words long words as possible within a minute using 7 random letters,[32],Missing
1657929600,207523,Haisonmeguri,[6],Haisonmeguri  is a Jhorror walking simulator game based on a terrifying experience involving an abandoned village,[32],Missing
1657152000,207522,Get Rektorized,[6],Set enemies on fire in this action based antigrav combat racer with an arsenal of heavy and unique weapons Solve puzzles and gain skills to unlock reinterpreted tracks of old racing games new ships neverseenbefore racemodes and other surprises Oh and dont forget to shoot your friends online,"[10, 32]",Missing
1657411200,207521,Ph0b0s,"[3, 6, 14]",Vaporcombat,[32],Missing
1657238400,207519,Courage,[6],Courage is a slasher with RPG elements in a medieval setting with a dark and gloomy atmosphere The goal of the game is to advance through the levels and exterminate all the undead then you can go further,"[31, 32]",Missing
1657238400,207518,The Secret of Rooms,[6],the Secret of Rooms is a dramaoriented puzzlesolving game in a modern setting By searching for the item clues in each roomfind the truth of the case in the gameDifferent choices in the game will unlock different endings and bring players a new puzzle solving experience,[32],Missing
1657152000,207517,Navy War,"[6, 14]",Ready for the naval battle Online ships are waiting for you,[13],Missing
1657584000,207516,Portal Defense,[6],Our game is a basic tower defense game where monsters are coming in through a portal are trying to destroy your tower The only way to stop them is to send out your units level up your tower and try to outwit them,[15],Missing
1657065600,207515,The Snow Fable: Mystery of the Flame,"[6, 48, 49, 130]",Embark on a matchthree adventure of breathtaking magic and boundless imagination A girl embarks on a quest to save her fiery friend But with each step forward she draws closer to an encounter with a dark force she could not have conceived,"[9, 15, 32]",Missing
1657756800,207514,Dalo,[6],Dalo a combination of dot and halo A fun and simple puzzle game where you should find a path that goes through all lines only passing through the same line once,"[15, 32]",Missing
1656979200,207513,U96,[6],U96 is a actionroguelike about deep sea exploration,"[31, 32]",Missing
1659225600,207490,Woodlock Manor,[6],Woodlock Manor is a gridbased puzzle game where you must dodge and outsmart various traps to uncover the secrets hidden in the depths below,"[15, 32]",Missing
1656892800,207489,Brain Exam with Benefits 2,[6],Brain Exam with Benefits 2 is a lighthearted Match 3 game with Mei a sexy brain examiner as your guide Youll get to see her in a variety of sexy outfits Impress her with your smartness to charm her into submission or fail pathetically,Missing,Missing
1658188800,207485,The Clown's Forest,[6],You play as Michael a 17Yearold College Student who had gone camping with his friends over the weekend although unfortunately for them it turned from a peaceful getaway to a fight for survival,"[31, 32]",Missing
1656979200,207476,Vacation Adventures: Cruise Director 7,[6],A great hidden object game set aboard a cruise ship,"[31, 32]",Missing
1657497600,207472,Hoverboy,[6],Explore different worlds and interact with the environment to the sound of a musical playlist showcasing music from Jesse Aidyn MultiMemory Controller and Ginger Breaker,[32],Missing
1659052800,207470,Kiwi Clicker,[6],Deliver more and more kiwis to satiate the kings hunger  sacrifice their pulp and transcend beyond your fruital form,"[13, 15, 32]",Missing
1658361600,207452,Victory 7,[6],Victory 7 is a roguelikestyle game with the theme of slot x deck build,"[15, 32]",Missing
1658361600,207447,Zodiac Fantasy,[6],This is a horizontal board jumping game The player needs to control the character to jump and climb in the scene The ultimate goal of the player is to reach the end point as much as possible,[32],Missing
1659052800,207443,Salamander County Public Television,"[6, 48, 49, 130, 167, 169]",Become a professional thingdoer Complete wacky assignments for Salamander Countys local TV station and solve the mystery of why nearly everyone in the county suddenly disappeared,"[9, 32, 33]",Missing
1657929600,207425,By the Vine,[6],By the Vine is a Christianbased Visual Novel The story follows a young adult named Calum who has to live on his best friends farm after burning down his house What hijinks will ensue as Calum adjust to his new life on the farm,"[13, 32]",Missing
1657670400,207424,Cozy Time,[6],Cozy Time provides you with a cozy environment to focus relax or rest without being disturbed,"[13, 32]",Missing
1657929600,207422,Bombs Away,[6],Are you mentally prepared for bombs away Choose one of 8 different styles of tanks to battle your friends from invisibility to flame throwing tanks Youll need quick reflexes and some carefully planned strategy to be successful in battle Good luck and see in you in Bombs Away,"[15, 32]",Missing
1658361600,207415,Muv-Luv Alternative Total Eclipse Remastered,[6],As mankind races to create new weapons to turn the tide in its war against alien invaders Yuuya a hotheaded American pilot is assigned to work with a beautiful but cold Japanese officer on a topsecret project Can they learn to work together in time to make the weapon that saves us all,"[31, 34]",Missing
1657238400,207400,Kenomaze,[6],Explore a strange maze full of colorful friends and foes When the time comes the path youve chosen will determine your fate and perhaps the fate of others as well,"[15, 31, 32]",Missing
1657843200,207399,Ballads at Midnight,[6],When a sarcastic bard is arrested and exiled to an abandoned castle she expected to be at the mercy of a hungry bloodthirsty vampire She soon discovers that the vampire Lucius is not starving he is gravely bored She may just survive on borrowed time one ballad each midnight,"[31, 32, 34]",Missing
1658966400,207387,The Sims 4: High School Years,"[6, 14, 48, 49, 167, 169]",Class is in session Be a good or bad student join afterschool activities explore aesthetics start trends find your identity and make the most of being a teenager with The Sims 4 High School Years Expansion Pack,"[12, 13, 31]",Experience high school  Experience all the ups and downs of high school Attend classes in person get to know your teachers hang out in the cafeteria and even decorate your locker Your most treasured moments might happen while loitering around with your friends after school  Iconic teen moments  Dance the night away at prom and celebrate your graduation ceremony if you keep up with your schoolwork In addition to those big moments Sims can make lifelong friends participate in afterschool activities and teams and experience the rollercoaster ride of puberty  Shake things up  High school is a time of selfdiscovery Find the confidence to ask out your crush or the guts to skip class dont let the principal catch you Teen Sims will explore their own likes and dislikes and have new opportunities to cause mischief Pranks and sneaking out after dark can have consequences so be careful you dont get caught  Explore your style  Make your bedroom your own plan outfits with clothes designed by Depop sellers and become a Simfluencer Teen Sims can earn money by selling outfits and hyping up looks they design on Trendi right from their bedrooms which are now more interactive than ever Use a tablet read a book in bed or even have a pillow fight
1657929600,207383,FPS Chess,[6],Play an ordinary game of chess against a friend or a stranger However all your intricate strategies will crumble before the enemy rooks sniper trickshot All your practiced openings and counters will amount to nothing before the enemy queens randomly sprayed machine gun You finally checkmate the king Unfortunately it seems you are not ready for this fight 5 seconds in and youve been sliced in half by the kings sword It turns out you are not playing Chess at all but an FPS Just make sure to practice your aim,[15],Missing
1659052800,207359,The Empanada Protocol,"[6, 14]",In this brutal platformer you play as an Empanada trying to escape a dangerous facility filled with traps and fun gimmicks Do you have the skill and precision to escape,"[31, 32]",Missing
1658275200,207357,DreamIsland,[6],This game is an action exploration game where you complete various missions and collect 51 cards The map is an open world and youll have to solve peoples problems and unravel the mysteries of the world from a vast map,"[31, 32]",Missing
1657670400,207354,Worm Runner,[6],Endless runner game where are 6 different maps with obstacles,[32],Missing
1659225600,207351,Cards of Binokee,[6],In this turnbased online trading card game you can face off against different opponents with your deck of cards over and over again With the orbs you earn you can constantly expand your card collection and thus redesign and strengthen your deck,[32],Missing
1658102400,207328,My Trainer is a Futanari,[6],You decided to make the commitment of signing up for a full membership at your local gym Your personal trainer Kendra has abs of steel and shes full of surprises,[34],Missing
1657756800,207321,Mythic Origins,"[3, 6, 14]",Explore an infinite procedurally generated labyrinth Discover a world packed with puzzles enemies bosses and treasure Join forces with fellow heroes to hunt down the gods or strike out alone and be the first to discover uncharted territory Become Mythic,"[12, 31, 32]",Missing
1658707200,207316,DEPO: Death Epileptic Pixel Origins,"[3, 6, 14]",DEPO is a first person 3D platformer where you control a rebel pixel inside a computer with an evil Operating System governing everything Youll find final bosses cinematic scenes arcade minigames 50 huge levels full of surprises and big stories to discover,"[31, 32]",Missing
1657497600,207293,Sabotris,"[3, 6, 14]",Sabotris is a strategic competitive 3D block stacking game but with a twist you can sabotage your opponents but be careful you can also end up sabotaging yourself Choose to play either by yourself to beat your own high score against your friends or other players or even against computer AI,"[15, 32]",Missing
1657065600,207268,Yeah Jam Fury,[6],Yeah Jam Fury tests your speed and ingenuity in over 40 levels of smiling face blocks Utilize all three of your egos to create blocks scale walls and destroy everything in the way of your righteous fruit,"[15, 32]",Missing
1657152000,207201,Mate,[6],Mate is a thirdperson storybased game with a multiending game with puzzles and physical controlsThe protagonist the perpetrator of school violence is anxious that his actions will be revealed to others which leads to psychological hallucinations and nightmares,[32],Missing
1657756800,207198,Tomb Defender,[6],Sandbox tower defense game in the style of a pulp adventure movie With full control over the layout of the tomb Includes challenges and a procedural map generator,[15],Missing
1658707200,207197,Elektrosoul,[6],Awake the droids consciousness taking control on the system against the timer,"[9, 15]",Missing
1658707200,207195,Psychoscopy,[6],Psychoscopy is a 5 player coop horror game that you try to gather evidences about paranormal activities in large areas Make a team with your 4 friends take your equipments and hunt down paranormal activities,[32],Psychoscopy is a 5 player coop horror game that you try to gather evidences about paranormal activities in large areas Make a team with your 4 friends take your equipments and hunt down paranormal activities
1656979200,207193,Inexperienced Driver,[6],Inexperienced Driver is a topdown arcade driving game The player has to drive from point A to point B and if possible collect all the banknotes on the road while avoiding obstacles,"[10, 32]",Missing
1657584000,207192,Nuts Protocol,[6],You might think this is yet another Tower Defense game Well friend you are not wrong The twist Its fastpaced Your greatest resource is positioning  and moving around is a must Also you control an orange Squirrel equipped with morethanmilitarygrade turrets OMG  can it get any better,"[15, 31, 32]",Missing
1657065600,207191,The Legend of Azarias,[6],Play the the Archangel Raphael in your quest to save the girl Sarah from Asmodeuss castle Can you defeat the hordes of demons in this giant castle and save Sarah before its too late You need to travel the giant 13 floors and to get to the top in this action packed first person dungeon crawler,[31],Missing
1656806400,207190,A toad well travelled,[6],A toad well travelled is a short but challenging sidescrolling platformer about a young toad that sets off to explore the world outside the safety of his pond You as the player will guide the inquisitive toad through diverse dangerous environments filled with notsofriendly creatures,[31],Missing
1657843200,207187,Pinball Girlfriend,[6],An alternative to pinball games  Resource allocation shooting skills luck bonus can you fight to the end  Of course beautiful CG girls are also essential,[10],Missing
1656979200,207186,Under the Stars,[6],In the vast space where to go from time to time the enemy crazy and difficult to deal with and how to find a ray of life before energy exhaustion,"[12, 13, 31, 32]",Missing
1657497600,207182,Nell Watson's Founder Life,"[3, 6, 14]",Master your personal resources to achieve startup business success in this pro bono entrepreneurial life simulator game,"[13, 15, 32]",Missing
1656892800,207179,Jim the Spy,[6],Jim The Spy is a sort of metroidvania 2D thirdperson shooter game The player must complete a list of objectives in various levels filled with robots,"[31, 32]",Missing
1658275200,207128,Stranger of Paradise: Final Fantasy Origin - Trials of the Dragon King,"[6, 48, 49, 167, 169]",Trials of the Dragon King includes new jobs weapons accessories and a new category of equipment as well as new areas stories and challenges,[12],Missing
1658016000,207103,Monster Girl,[6],As a casual puzzle game spot the difference it is perfect for training your observation In the game there are numerous hidden spots on the characters accessories and background You need to spot 4 to 8 differences in each stage to complete the mission,"[31, 32]",Missing
1656979200,207089,PomoFarm,"[6, 14]",PomoFarm is half focus timer and half idle farming game As Tomato the Duck grow your farm as you focus on tasks in the real world,[13],Missing
1658102400,207088,Yakuza Undisputed,"[6, 14]",This story follows Goku a yakuza member who spent 12 years in prison for a crime he did not commit After being released he learns that the Tojo clan had taken his belovedxioyu captive for wrongfully been accused of spending the Tojo boss money and now he has to rescue her from the opposing gang,"[31, 32]",Missing
1657152000,207078,Pixel,[6],Pixel is a minimalist platformer  puzzle game Control a being that aims to reach somewhere always jumping dodging avoiding and tricking obstacles that seem not to let you proceed Died Just try one more time D,"[31, 32]",Missing
1657584000,207027,Triennale Game Collection Vol. 2,"[6, 14, 34, 39]",The Triennale Game Collection Volume 2 is a free virtual exhibition of video games created for the 23rd International Exhibition of Triennale Milano by five of the worlds most renowned independent game designers showcasing these artists experimental approach to interactivity,[32],Missing
1657843200,206882,Loud,"[6, 48, 49, 130]",Immerse yourself in the ultimate arcade guitar experience and get lost in its rhythmic beats and beautiful audiovisual effects,"[7, 31, 33]",Missing
1657152000,206865,TTV4,[6],TTV4 is the latest volume of the retro hardcore maze wanderer minigame series Trip to Vinelands,[32],Missing
1656806400,206715,Donut Crabs,[6],Donut Crabs is a physics puzzle game Control the platforms and guide the donut along the trajectory you set Help the crab collect all the donuts on the island and solve the huge amount of relaxing and sometimes hard puzzles,Missing,Missing
