first_release_date,genres,id,name,platforms,summary,storyline,rating
1227139200,[5],274139,Inflation Bay,[6],nflation Bay is a PWAD for Doom II originally containing one level and first released on November 20 2008 It was created by Shadowman with an updated release following on July 22 2010 containing a second map built in collaboration with Lainos The levelset features themes similar to the Hellfire series with the first map being set on a city street and the second one in and around an asylum The WAD comes with cosmetic replacements for the Wolfenstein SS which is turned into the cultist from Blood,Missing,Missing
1226275200,[5],271526,White Room,[6],Medium sized base map with a unique concept keep the usual shapes but take away the textures A biohazard outbreak at this facility adds lots of blood to the mostly white textures,Missing,Missing
1226793600,[8],250067,Super Mario Fangame,[6],Missing,Missing,Missing
1227571200,"[12, 32]",246725,Twisted Mettle,[6],The sequel to Chaotix of Tomorrow,Missing,Missing
1227484800,[31],217588,The Moon Watch,[6],Youre an ordinary Soviet citizen but to your surprise you are selected to play a highly important part in the defense of the Motherland  and then the crisis comes,Missing,Missing
1227571200,Missing,210010,Proffessional Bull Riding: Out of the Chute,"[6, 38]",Missing,Missing,Missing
1227052800,Missing,209901,Hidden Secrets: The Nightmare,[6],Missing,Missing,Missing
1227139200,[31],201190,Yume no Tsuzuki.,[6],Yume no Tsuzuki is an interactive online Yume Nikki fangame Contrary to most fangames it doesnt contain effects The main goal is to simply explore Pikos dream world,Missing,Missing
1227830400,"[5, 31, 32]",199196,Lovecraft Game,[6],Its an extremely simple shooter game You are a nameless wanderer in a nameless land populated by dangerous creatures and strange characters,Missing,Missing
1226534400,[5],199151,Xoldiers,[6],Xoldiers is a shooting game where leading a team of nine xoldiers the players goal on each level is to get past the enemy defensescannons and tanks that shoot occasionally garages that release instantlykilling trucks and barracks that spit out endless waves of enemy infantryand destroy all the enemy bases,Missing,Missing
1227225600,[5],196734,Half-Life: Zombie Edition,[6],Zombie Edition is a mod based on the original HalfLife concept but you will play as a headcrab and what is more interesting as a zombie Zombies can mutate into three types to change their characteristics and each type will have at least six upgrades including new weapons and abilities,Missing,Missing
1227225600,"[31, 34]",186285,Shikkoku no Sharnoth: What a beautiful tomorrow,[6],The player assumes the role of Mary Clarissa Christie Mary has heterochromia eyes her right eye is gold while her left eye is blue She originally had blue eyes but her right eye changed colours one year prior to the games events and she has been seeing strange visions since,The year is 1905 in the capital of the British Empire the Engine City London where the air is so thick with smoke that a mere glimpse of the blue sky is considered a miracle The protagonist Mary Clarissa Christie is a girl living by herself while her mother works abroad She attends university with her friends Angelica Derleth and Charlotte Bronte and lives a peaceful life  However through a chance encounter she finds herself drawn into another side of London spoken of only as rumors of Metacreatures who roam the night and attack people She forms a contract with a strange man in a black suit known as M and begins to help him hunt these creatures,Missing
1227052800,[35],176055,Bienvenue chez les Ch'tis,"[5, 6]",A partygame based on the French movie Bienvenue chez les Chtis,Missing,Missing
1227052800,"[2, 9, 31]",170282,Loftus and the Sky Cap,[6],Inessa is woken by the smell of smoke She races down the stair case to discover the workshop torched and no trace of her Master Loftus The townsfolk are convinced that a dragon must be responsible or that the crazy inventor must simply have blown himself up but Inessa believes otherwise,Missing,Missing
1226448000,[12],145047,BoneTown,[6],Missing,Missing,Missing
1226361600,"[15, 33]",141919,Diner Dash: Flo Through Time,"[6, 14]",Dash through history in this timeless and challenging Diner Dash sequel When Grandma Florence converts Flos microwave into a time machine Flo and Grandma are instantly zapped into the distant past Help them earn their way back as they sling historic hash to make cash in 5 allnew restaurants Bring out your primal waitress at the Caveman Café serve up some chivalry at the All Knight Diner and join the skyhigh futuristic funfest at the Snack to the Future Diner,Missing,Missing
1226448000,[32],141414,Backstage,[6],Hell isnt a place but a state of mind Hell lives within us all    Tom Keller is lost He has gone astray and become trapped in a nightmare world that is a twisted mirror image of our own tormented by horrific abberations haunted by shattered memories He is alone behind the world and to escape he must come to terms with all of his sins Backstage is a classic rm2k3 psychological horror adventure game made in one month in the early spring of 2005 for the first ever Release Something,Missing,Missing
1227830400,"[12, 31]",127916,Die Reise ins All,[6],Missing,Missing,Missing
1227744000,"[10, 14]",126056,Superstar Racing,[6],Superstar Racing is a popular arcadestyle MMO racing game Superstar Racing Features  Invite other players and create your own Racing Team  Create your own personal driver and take it to the track  Race with players around the world and become your own racing superstar,Missing,Missing
1225756800,"[2, 32]",125020,Dovadula's Burn,[6],The story takes place in the imaginary town of Dovadulas where Punkkommando is trying to destroy the town with his bass guitar  The police stop Punkkommandos plan and he runs away  Punkkommando loses his bass guitar and to escape the policeman he assumes the identity of the crazy green man Capitan Fortuna  Then he goes to his music master Matt Freeman to find a method to definitively destroy Dovadulas,The story takes place in the imaginary town of Dovadulas where Punkkommando is trying to destroy the town with his bass guitar  The police stop Punkkommandos plan and he runs away  Punkkommando loses his bass guitar and to escape the policeman he assumes the identity of the crazy green man Capitan Fortuna  Then he goes to his music master Matt Freeman to find a method to definitively destroy Dovadulas Dovadulas Tunnel,Missing
1226966400,Missing,120162,Tomb Raider: Underworld - Limited Edition,"[6, 9, 12]",This Limited Edition comes in a slipcase and contains all the following extras on a bonus DVD  Tomb Raider Underworld  Exclusive behind the scenes documentary  Previously unreleased ingame music  Art gallery  Videos and trailers,Missing,Missing
1226534400,[9],95369,Between,"[3, 6, 14]",Between is a disjunct cooperative multiplayer game that takes place in an abstract sidescrolling world where a character can be controlled In the distance a shimmering image of a tower is shown It consists of blocks each with a different squared pattern of colors The aim of the game is to build the tower according to the pattern but it is impossible to complete it without the help of the other player who has the same goal but who is not visible on the players screen,Missing,Missing
1227744000,[14],94853,RTL Biathlon 2009,"[5, 6, 8]",RTL Biathlon 2009 is a simulation of the Biathlon sport Like the real sport it is basically divided into two sections skiing and shooting During the skiing sections the player steers his athlete into the correct direction and watches his stamina In the middle of the screen is a power bar which gets filled by holding the assigned button  if the bar is too low the athlete gets slow and if it is too high he gets tired Practically this results in steady button pressing to keep it as high as possible During the shooting sequences the player shoots on targets while the cursor is wobbling He can also hold his breath for a short time to steady his aim  In the career mode the player divides points into four categories eg speed or stamina which influence the athlethes capabilities After successful championships he can improve these stats further New in this instalment are superpowers which can be chosen at some point When activated these give a big boost on a stat for a short time eg mountain skiing boosts power when skiing uphill These are available once per race There are overall 15 courses which are partly licensed,Missing,Missing
1226880000,"[2, 31]",81242,Strong Bad's Cool Game for Attractive People Episode 4: Dangeresque 3 - The Criminal Projective,"[5, 6, 9]",Move over generically buff action heroes Strong Bad is here to show you how its done in his handcrafted cinematic masterpiece Dangeresque 3 The Criminal Projective You play Dangeresque a dirty cop in pursuit of a little action and several big sacks of cash Can our hero stay alive long enough to defeat his archnemesis save the world and get the girl Looks like hes gonna have to jump,Missing,Missing
1226966400,[12],78366,EverQuest II: The Shadow Odyssey,[6],The 5th expansion pack in the EverQuest II MMO series,Missing,Missing
1226534400,Missing,74884,Star Wars: The Force Unleashed - Character Pack 1,"[6, 9, 12]",Now that youve unleashed the force you can download 7 brand characters to the make the experience even more memorable Play as characters such as Jedi Knight Anakin Skywalker Jedi Knight ObiWan Kenobi Jedi Knight Luke Skywalker Imperial Commando Darth Sion KiAdiMundi and Kit Fisto Also youll get 3 all new Secret Apprentice costumes including Hooded Combat Gear General Starkiller and Sith Assassin  This pack is included in the Ultimate Sith Edition,Missing,Missing
1227052800,[31],70640,CSI: NY,[6],Solve five different crimes in the first CSI game to be set in New York City,Missing,Missing
1225929600,[15],65350,Top Chef: The Game,[6],A timemanagement game based on the TV show of the same name Top Chef puts you into the shoes of a new contestant on the show The game is divided into 15 episodes with each episode consisting of two Quickfire challenges and one Elimination challenge  Within the Quickfire events you will be asked to create a dish based on certain constraints For example you might be asked to create a salad based on the color white That meal is divided into steps for each step you will need to pick ingredients then process them You have a wide variety of ingredients to choose from and some go together better than others If you pick interesting combinations of ingredients the judges will comment and you will get a better score Also you will receive a chaining bonuses for finishing up with multiple ingredients at around the same time Once all steps are done you will be graded on adhering to the instructions the quality of the food style and time taken  Elimination challenges are similar but require you to make an entire meal instead of just one dish,Missing,Missing
1226361600,"[9, 31]",64728,Treasure Seekers: Visions of Gold,"[6, 39]",Treasure Seekers Visions of Gold is a hidden object game released for PC and mobile platforms It is the first installment of the Treasure Seeker series,Missing,Missing
1227139200,[16],62877,Sengoku Hime: Senran no Yo ni Honoo Tatsu,"[6, 8, 38]",After a big war various feudal lords gain power Hojo Uesugi Imagawa Mouri Otomo Oda Shimazu Satake Date Takeda and so on They fight each other and sometimes ally with others to expand territory for one and only goal Every feudal lords ultimate goal is to conquer and unite the country,Missing,Missing
1225929600,"[4, 12]",57925,Getamped 2,"[6, 39]",GetAmped2 is a Free to Play online fighting game that focuses on a variety of different weapons and playstyles,Missing,Missing
1226448000,[5],55183,Evil Resistance: Morning of the Dead,[6],Missing,Missing,Missing
1226707200,Missing,54043,Finding Doggy,[6],Missing,Missing,Missing
1226016000,"[2, 9, 31]",52384,Alabama Smith in Escape from Pompeii,[6],An adventurehidden object game  Join Alabama Smith as he quests for the timebending Amulet of Ages in this actionpacked Adventure game Solve elaborate puzzles to uncover the location of a lost mystical relic that allows its bearer to travel through time Then step into the role of fateful Anastasia as she races to save Alabama Smith from a cataclysmic disaster Loads of challenging puzzles and magical minigames await you in Alabama Smith Escape from Pompeii,Missing,Missing
1226016000,[9],51399,Can You See What I See?: Curfuffles Collectibles,[6],In Can You See What I See we meet poor Clyde Curfuffle proprietor of Curfuffles Collectibles Hes suffered a fire a flood and a nasty fall thats put him in the hospital The string of bad luck events just wont stop and he needs your help to save his collectibles shop One of his favorite collectibles may sell for a lot of money but you have to find out which one Seymour will help you fill orders find rare items and solve the secret code to unravel the mystery,Missing,Missing
1226016000,[31],51398,Etch a Sketch,[6],The classic drawing toy es to lifeProduct InformationThe timeless drawing toy Etch A Sketch es out of the classic red box andes alive on your puter screen Grizelda the witch has shaken things up inthe Land of Aha and Knobby needs your help Experience the Worlds FavoriteDrawing Toy as you use your mouse to sketch unique masterpieces and help Knobbyon his quest in adventure modeProduct Features Conquer Knobbys Quest and draw your way through the Land of Aha Print or Send and share your pictures from Color Etch and Classic Etch with family and friends Spring through Knobbys Bounce and its three fun arcade game play modes 78 levels of etching fun Minimum Requirements Windows XP Vista Pentium II 600 MHz processor 256 MB of RAM 104 MB free Hard Drive space DirectX 70 or higher DirectX patible 16 or 32 bit Video Card with 64 MB VRAM Direct Sound patible Sound Card CDROM drive,Missing,Missing
1226534400,"[12, 31]",50329,Sacred 2: Fallen Angel - Collector's Edition,[6],Sacred 2 Fallen Angel  Collectors Edition Includes  Additional DVD containing the Elite Texture Pack a set of ultrahigh resolution textures for users of highend computers  The unlockable ingame Carrier Imp a special pet that transports the players treasure and additional inventory to its owner whenever summoned unlock code provided  A foursong music sampler from Nuclear Blast records whose artist Blind Guardian is showcased in the games soundtrack and an exclusive audio interview with the band and the games developer discussing their collaboration to feature the band ingame  A printed map of the world of Ancaria that doubles as poster and electronic version of the Sacred 2 Art and Vision booklet,Missing,Missing
1227744000,"[5, 25]",37048,The Hunt,[6],In yet another nutty future the government have approved a TV show to kill random people for control of the population One lucky winner gets a tracking device implanted while hes not looking and The Hunt is on,Missing,Missing
1226448000,"[25, 31]",27552,Kivi's Underworld,[6],Kivis Underworld is a casual hack and slash game,Missing,Missing
1227657600,[9],26961,Call of Atlantis,"[6, 14, 20, 34, 39]",Atlantis is calling out to a true hero to save it from deadly peril in this longawaited 3rd installment in the hit Atlantis Quest The Rise of Atlantis series offering a unique blend of 3 popular gameplays Set out on an exciting new quest in this spectacular mix of Match3 Hidden Object and Adventure Embark on a fascinating new journey around the ancient lands of Rome Greece Troy Phoenicia Babylon Egypt and Carthage to acquire seven mysterious crystals of power Appease Poseidon the patron god of the Atlanteans and save the legendary continent,Missing,Missing
1227225600,[13],24744,Let's Play Pet Hospital,"[6, 20]",No info,Missing,Missing
1226534400,[12],23788,World of Warcraft: Wrath of the Lich King - Collector's Edition,"[6, 14]",The Lich King Arthas has set in motion events that could lead to the extinction of all life on Azeroth With the armies of the undead and the necromantic power of the plague threatening to sweep across the land only the mightiest heroes can oppose the Lich Kings will and end his reign of terror for all time  Learn the craft of spell augmentation with the new Inscription profession Brave the harsh new continent of Northrend the icy domain of the Lich King Engage in epic siege warfare deploying mighty siege engines to lay waste to destructible buildings in your path Transform your heros look with new charactercustomization options including new hairstyles and dances Explore perilous new dungeons filled with some of the deadliest creatures  and greatest treasures  The Collectors Edition included  The Art of World of Warcraft Wrath of the Lich King a 208page book featuring neverbeforeseen images from the game  An exclusive ingame pet Frosty the baby frost wyrm  A behindthescenes DVD containing over an hour of developer interviews the  Wrath of the Lich King intro cinematic with directors commentary and more  The official soundtrack CD containing 21 epic tracks from the game along with exclusive bonus tracks  A mouse pad featuring a map of the newly opened continent of Northrend  Two World of Warcraft Trading Card Game March of the Legion starter decks along with two exclusive cards available only in the Collectors Edition,For years the heroes of the Alliance and Horde have fought against the evils in Kalimdor and the Eastern Kingdoms against the demons of the Burning Legion in Outland and against each other  all the while unaware that a threat more dangerous than any they had yet encountered was preparing to make its move in the icy continent of Northrend Now the Lich King Arthas Menethil has emerged from Icecrown Citadel to claim the world as his own Heroes of the Alliance and Horde gather in Northrend to make a stand against the malevolent being that dares to declare himself Azeroths one true kingand seeks to scour all life from the world,Missing
1226620800,"[2, 33]",23195,Pranksterz: From Russia With Love,[6],Russian point  click game spiritual successor of Neighbours from Hell series,The fifth installement of the popular series about the cunning protagonist and the harmful neighbor This time the fight is at the highest level The Russian spy Pulin has been given an operational assignment to take out the American spy Arnold Rubinstein  The concept of the game has not changed since the first series only the graphics have become much nicer the traps more cunning and the neighbor  angrier,Missing
1227744000,[12],23034,The Chronicles of Spellborn,[6],Set within a unique postapocalyptic fantasy universe The Chronicles of Spellborn provides an immersive combat system along with a well fleshed out and unique storyline,Missing,Missing
1225756800,[14],21249,Football Manager Live,[6],Football Manager Live is a onlineonly managerial soccer simulation where the player is responsible for the financial and athletic success of his club The main difference to regular games of this genre is that the players dont manage an existing club but create their own,Missing,Missing
1226534400,[31],21134,Agatha Christie: Death on the Nile,[6],Embark on a great Seek and Find adventure which brings a whole new way of enjoying the timeless Agatha Christie story of Death on the Nile Assume the role of renowned detective Hercule Poirot seeking clues to a mysterious murder aboard a ship cruising the River Nile Find hidden objects clues and the hard evidence that youll need to question suspects and uncover the truth behind the Death on the Nile Was it the obvious former fiance Or the diamond thief The answer may surprise you,Missing,Missing
1227744000,"[11, 15]",21119,Officers,[6],Officers is a Real Time Strategy Game for the PC set during World War II and features three distinct campaigns to play,Missing,Missing
1226620800,[31],16160,Book of Legends,"[3, 6]",If the Book of Legends should ever fall into the wrong hands the consequences could be devastating Follow Zoe and Charleston Black as they follow the clues found in the long forgotten Book of Legendsclues that lead them on a hunt for one of the worlds most mysterious legends of all Excalibur Is it real And can they find it before their enemies do Find out as you unravel a mystery that could change the balance of power forever,Missing,Missing
1227052800,"[13, 15, 24, 33]",15860,A Kingdom for Keflings,"[6, 12]",The Keflings need your help Play as a giant and help the tiny Keflings build up and beautify their Kingdom Start out small unlocking new blueprints buildings and tasks as you work towards designing and building a Kefling castle Create your own private medieval world with the help of the little Keflings,Missing,Missing
1228003200,"[12, 31]",14683,Generation Xth: Code Breaker,[6],Code Breaker is the second game in the Generation Xth trilogy   It is a first person dungeon crawling RPG with turn based combat released for PC in Japan You use a team of 6 people to explore the Abyss The game allows you to carry over your save file from the first game to continue the adventure with your original team  The first and second game were later rereleased together on the Playstation Vita in Japan under the name Tokyo Shinseiroku Operation Abyss in 2014 and in North America and Europe under the name Operation Abyss New Tokyo Legacy in 2015,Missing,Missing
1227052800,[15],10286,Europa Universalis: Rome - Vae Victis,[6],This the first expansion pack to Europa Universalis Rome It featues numerous additions to gameplay such as a Senate Political Parties and a new MissionsDecisions system,Missing,Missing
1227225600,[5],9530,AssaultCube,"[3, 6, 14]",AssaultCube is a FREE multiplayer firstperson shooter game based on the CUBE engine Taking place in realistic environments with fast arcade gameplay its addictive and fun,Missing,Missing
1226448000,"[2, 9, 31]",8327,Mortimer Beckett and the Time Paradox,[6],Mortimer Becketts back for an allnew eyepopping adventure Although Mortimer was able to get rid of the ghosts in his last outing his Uncle Jeromes home is now host to another ominous challenge  a time portal Even worse the Time Bomb that Jerome built to close the portal has been scattered across eight different eras Join Mortimer for a wild trip to find the scattered Time Bomb put it back together and close the portal before its too late,Missing,Missing
1226016000,[14],7679,New Star Soccer 4,"[6, 14]",Missing,Missing,Missing
1227571200,"[10, 14]",5303,Yamaha Supercross,"[5, 6, 8, 20]",Missing,You are the promising younger brother of one of the biggest names in Supercross He was hospitalized in the final race of the World Championships in an obviously intentional move by the lead rider of Team Nemeshisu the toughest team to beat and the dirtiest riders in the world of Supercross You must work up through the championships by winning each race to finally meet the man that injured your brother in the World Championships and avenge him by becoming World Champion,Missing
1227830400,[9],5109,Professor Heinz Wolff's Gravity,"[5, 6, 20]",Professor Heinz Wolffs Gravity is an exciting puzzle game released on Nintendo Wii and Nintendo DS Although there are subtle differences between each version they all contain 100 puzzles of varying difficulty for you to solve As the name suggests these puzzles involve using gravity and other properties of physics to solve them Gravity is suitable for the whole family and is a fun way to keep your mind at its sharpest,Missing,Missing
1225756800,[9],4744,Candace Kane's Candy Factory,"[5, 6, 20]",Candie has just inherited her uncles old candy factory and is trying to make her way to the International Candy Cup Championships Working with Candie youll have to speedily create customized candy orders for each customer that enters your shop Upgrade and customize the factory with special machines and gadgets It wont be all sweet treats  youll also need to fend off rivals who attempt to sabotage your career,Missing,Missing
1226534400,[12],228,World of Warcraft: Wrath of the Lich King,"[6, 14]",World of Warcraft Wrath of the Lich King often referred to as WotLK or Wrath is the second expansion set for the massively multiplayer online roleplaying game MMORPG World of Warcraft following The Burning Crusade It adds a substantial amount of content to the game world including the continent of Northrend home of the eponymous Lich King and a new character hero class,For years the heroes of the Alliance and Horde have fought against the evils in Kalimdor and the Eastern Kingdoms against the demons of the Burning Legion in Outland and against each other  all the while unaware that a threat more dangerous than any they had yet encountered was preparing to make its move in the icy continent of Northrend Now the Lich King Arthas Menethil has emerged from Icecrown Citadel to claim the world as his own Heroes of the Alliance and Horde gather in Northrend to make a stand against the malevolent being that dares to declare himself Azeroths one true kingand seeks to scour all life from the world,90.3903925148141
