first_release_date,genres,id,name,platforms,summary,storyline,rating
1193356800,"[2, 33]",23196,Pranksterz: No Rest for the Wicked,[6],Russian point  click game spiritual successor of Neighbours from Hell series,Neighbors always nosing around Poking into your business Now you can get back at them during the best time of the year  their vacation  Using a wide range of props and tricks Pranksterz No Rest for the Wicked lets you play practical jokes and pranks on your pesky neighbors during their holidays to drive them nuts  Mix vinegar in their lemonade lure ants into their bed rig their hammock for a good fall Make sure to take your pranks seriously though youll need to be sneaky not to get caught and you have to be smart to combine several tricks together for extra bonuses  Nonstop antics great cartoonstyle graphics various holiday settings and crazy animations will have you laughing for hours  Pranksterz No vacation should go unpunished,Missing
1193616000,Missing,22121,Mia and the Bugaboos,[6],Missing,Missing,Missing
1192492800,"[13, 15]",21528,Zoo Tycoon 2: Extinct Animals,[6],Shocking News Update Zoo Tycoon scientists report an unprecedented discovery to worldwide astonishment amazement and frankly a few raised eyebrows More than 30 Extinct animals are ready to be brought back to life just for your zoo From the adorable dodo bird to the massive American mastodon the ferocious sabertoothed cat and the terrific T Rex enchant your guests with animals from the past in Zoo Tycoon 2 Extinct Animals,Head out on a paleontology dig to search for fossils assemble your finds and then take them to the Extinct Research Lab to bring your Extinct animals to life Unveil the drama of Extinct landscapes with misty springs tar pits glaciers and maybe even a caveman or two Once youve populated your Extinct zoo you can research and cure diseases and even wrangle a pack of rampaging dinosaurs in firstperson mode  Do your part to bring em back and the thrill of experiencing extinct animals will bring your Zoo guests back for more,Missing
1192752000,"[15, 16]",21191,Hired Guns: The Jagged Edge,[6],There is a price for everything even Life and Death      Hired Guns The Jagged Edge is a turnbased strategy that puts you command of a squad of specialists for hire in the genres biggest gameworld yet the African country Diamond Coast Diamond Coast is a playground for the cruel and corrupt each with their own agenda Choose your friends wisely and buy an army of ruthless mercenaries to unleash mayhem on your foes Choose jobs from different factions and complete them for cash to upgrade your weapons and hire more elite soldiers of fortune      Tons of firepower and plenty of combat experience will give your team the edge when it comes to fighting but smooth talk and a wad of bills can also go a long way towards ensuring success With multiple story lines and endings youre in total control of your own fate,Missing,Missing
1192406400,[31],18242,American Girl: Julie Saves the Eagles,[6],Missing,Missing,Missing
1192147200,"[13, 15, 32]",17547,Wildlife Park 2: Horses,[6],Enjoy all the fantastic aspects of the multi awarded Wildlife Park 2 with a focus on horses and action adventure gameplay Based on the game Wildlife Park 2 Horses focuses on friends and fans of horses and their keeping Besides the farm management the player also participates instunning action adventures where special quests are waiting to be solved on the back of your horses,Missing,Missing
1191715200,"[15, 24]",17023,Hearts of Iron II: Iron Cross,"[6, 14]",Iron Cross is an expansion of Hearts of Iron 2 Armageddon released as a digital download on October 7 2010 developed by Irshappa It expands the number of provinces on the map as well as numerous other additions and can also be installed as an expansion of Arsenal of Democracy and Darkest Hour  Features  Play as one of 200 countries from 1933 to 1964 and interact with real ministers and leaders New map with over 4000 new provinces More than 6000 new events New tech tree featuring 800 technologies with a realistic research system New units and brigades including special units infantry regiment heavy artillery and more New AI offering more options and greater depth New scenarios set in 1933 and 1934 as well as old scenarios adapted to Iron Cross Compatible with HoI II Armageddon Arsenal of Democracy and Darkest Hour,Missing,Missing
1193184000,"[11, 15]",15557,Escape from Paradise City,[6],In Paradise City the player takes on the role of a young ambitious gangster with the single goal of becoming the most successful and influential criminal in the entire city Move through the city robbing intimidating and killing all that stand in your way gaining notoriety and cool cash As the player becomes more and more notorious his influence grows and other criminals flock to him and become the core of this gang his own criminal organization Leading his small but vicious crew of hardcore criminals the player begins to take over the neighbourhoods of the city forcing the innocent citizens to pay him tribute and the local criminals to serve him fighting against his rivals and defending his territories,Missing,Missing
1191542400,"[13, 14]",14840,Championship Manager 2008,[6],Think you can do better Its your decisions that count your budget your buys your formation your tactics your chance to prove it Use your skills and knowledge to manage your club the way you feel it should be  now its your turn  All football fans around the world believe they know more about football than anybody else More than the guy sat next to them at the match more than the people commentating on the game more than the manager of their local team  Championship Manager is the closest youll ever come to the highs and lows of real football management,Missing,Missing
1192147200,"[11, 15, 24]",11107,Blitzkrieg 2: Liberation,[6],The second expansion pack for Blitzkrieg 2,Missing,Missing
1192147200,[13],10740,Rail Simulator,[6],Rail Simulator is a train simulation game developed by Kuju Entertainment and published by EA Players can drive modern and classic trains on a variety of real routes and also create and share new content using editors,Missing,Missing
1192406400,"[11, 15]",8942,Seven Kingdoms: Conquest,[6],Seven Kingdoms Conquest is a new chapter to the series that is based on a campaign between the Demons and Humans,Missing,Missing
1193356800,[14],4958,King of Clubs,"[5, 6, 8, 20, 38]",Miniature golf with an attitude  In King of Clubs youll teeoff against the wackiest golfers this side of Augusta  including Bubba the Elvis impersonator Take advantage of a magic bag full of tricky golf accessories  like special balls and trick clubs  Laugh through 96 competitive mini golf holes that will leave you in stitches  Thank you  Thank you very much,Missing,Missing
1193097600,[7],4790,Dancing with the Stars,"[5, 6, 8, 55]",Missing,Missing,Missing
1193702400,"[8, 31]",3309,Barbie as the Island Princess,"[5, 6, 8]",Barbie as The Island Princess follows the storyline of the popular DVD launch in a fun partystyle format Youll play as Rosella the shipwrecked princess who is raised by a family of animal friends and rescued by Prince Antonio from her tropical island Through a series of minigames featuring music and characters from the movie you will venture from Rosellas island home to the Princes coastal castle in a funfilled adventure,Missing,Missing
1193097600,"[8, 31]",3294,Power Rangers Super Legends,"[6, 8, 20]",Defy gravity juggle enemies into the sky perform massive combos and watch explosions fly Coop play through the entire game with a friend and use the combo system to assist each other in combat Engage in dynamic Zord Battle sequences consisting of timed button inputs and custom battle animations Execute superhuman acrobatics that allow you to double jump air dash and wall jump your way through every level,Missing,Missing
1193616000,"[8, 32]",1019,Marble Arena,"[6, 14]",Missing,Missing,Missing
1191974400,"[5, 9]",339,The Orange Box,"[3, 6, 9, 12, 14]",The Orange Box is a bundle that includes five titles from Valve HalfLife 2 HalfLife 2Episode 1 HalfLife 2 Episode Two Team Fortress 2 the sequel to the game that put classbased multiplayer team warfare on the map and Portal the game that blends puzzles first person action and adventure gaming to produce an experience like no other,Missing,90.15529886883171
1191888000,"[5, 9]",247,Half-Life 2: Episode Two,"[3, 6, 9, 12, 14]",The second episodic sequel to one of the most influential firstperson shooters of its time HalfLife 2,Missing,87.56815487302838
1191974400,"[5, 8, 9]",71,Portal,"[3, 6, 9, 12, 14, 34, 130]",Waking up in a seemingly empty laboratory the player is made to complete various physicsbased puzzle challenges through numerous test chambers in order to test out the new Aperture Science Handheld Portal Device without an explanation as to how why or by whom,Portals plot is revealed to the player via audio messages or announcements from GLaDOS and visual elements inside rooms found in later levels According to The Final Hours of Portal 2 the year is established to be somewhere in 2010twelve years after Aperture Science has been abandoned  The game begins with Chell waking up from a stasis bed and hearing instructions and warnings from GLaDOS an artificial intelligence about upcoming tests Chell enters into distinct chambers that introduce players to the games mechanics sequentially GLaDOSs announcements serve as instructions to Chell and help the player progress through the game but also develops the atmosphere and characterizes the AI as a person4 Chell is promised cake as her reward if she completes all test chambers19  Chell proceeds through the empty Enrichment Center with GLaDOS as her only interaction As the player nears completion GLaDOSs motives and behavior turn more sinister although she is designed to appear encouraging GLaDOSs actions and speech suggest insincerity and callous disregard for the safety and wellbeing of the test subjects The test chambers become increasingly dangerous as Chell proceeds tests including a livefire course designed for military androids as well as some chambers flooded with a hazardous liquid In another chamber GLaDOS notes the importance of the Weighted Companion Cube a waisthigh crate with a single large pink heart on each face for helping Chell to complete the test However GLaDOS declares it must be euthanized in an emergency intelligence incinerator before Chell can continue17 Some later chambers include automated turrets with childlike voices also voiced by McLain that fire at Chell only to sympathize with her after being destroyed or disabled2021  After Chell completes the final test chamber GLaDOS maneuvers Chell into an incinerator in an attempt to kill her Chell escapes with the portal gun and makes her way through the maintenance areas within the Enrichment Center22 GLaDOS panics and insists that she was pretending to kill Chell as part of testing GLaDOS then asks Chell to assume the party escort submission position lying facefirst on the ground so that a party associate can take her to her reward but Chell continues her escape In this section GLaDOS communes with Chell as it becomes clear the AI had killed everyone else in the center1112 Chell makes her way through the maintenance areas and empty office spaces behind the chambers sometimes following graffiti messages which point in the right direction These backstage areas which are in an extremely dilapidated state stand in stark contrast to the pristine test chambers The graffiti includes statements such as the cake is a lie and pastiches of Emily Dickinsons poem The Chariot Henry Wadsworth Longfellows The Reaper and the Flowers and Emily Brontës No Coward Soul Is Mine referring to and mourning the death of the Companion Cube4  GLaDOS attempts to dissuade Chell with threats of physical harm and misleading statements as Chell makes her way deeper into the maintenance areas Chell reaches a large chamber where GLaDOSs hardware hangs overhead GLaDOS continues to threaten Chell but during the exchange a sphere falls off of GLaDOS and Chell drops it in an incinerator GLaDOS reveals that Chell has just destroyed the morality core or her conscience one of the multiple personality cores that Aperture Science employees installed after the AI flooded the enrichment center with neurotoxin gas With it removed she can access its emitters again A sixminute countdown starts as Chell dislodges and incinerates more of GLaDOS personality cores while GLaDOS discourages her both verbally with taunts and juvenile insults and physically by firing rockets at her After Chell destroys the last personality core a malfunction tears the room apart and transports everything to the surface Chell is then seen lying outside the facilitys gates amid the remains of GLaDOS Following the announcement of Portal 2 the ending was expanded in a later update In this retroactive continuity Chell is dragged away from the scene by an unseen entity speaking in a robotic voice thanking her for assuming the party escort submission position1523  The final scene after a long and speedy zoom through the bowels of the facility shows a Black Forest cake24 and the Weighted Companion Cube surrounded by a mix of shelves containing dozens of apparently inactive personality cores The cores begin to light up before a robotic arm descends and extinguishes the candle on the cake causing the room to blackout25 As the credits roll GLaDOS delivers a concluding report the song Still Alive which declares the experiment to be a huge success as well as serving to indicate to the player that GLaDOS is still alive26 that her happy core was not disabled,86.90024661191957
1193529600,"[7, 13]",2671,Guitar Hero III: Legends of Rock,"[5, 6, 8, 9, 12, 14]",Rock out to the third entry in in Red Octanes music series for guitar gods Songs for Guitar Hero III include Barracuda by Heart Sabotage by Beastie Boys Rock And Roll All Nite by Kiss and much more In addition players can experience an incredible number of added features and explosive content including a new multiplayer actioninspired battle mode grueling boss battles a bevy of exclusive unlockable content and authentic rock venues,Missing,84.0109004344827
1191542400,"[5, 8, 9, 31, 32]",14143,I Wanna Be the Guy,[6],I Wanna Be the Guy The Movie The Game is a 2D platform indie freeware video game created by independent developer Michael Kayin OReilly for Microsoft Windows using Multimedia Fusion 2 First released in October 2007 the game is not in active development despite being listed as a beta though the source code for the game was released by Kayin in November 2011  IWBTG is most famous for its difficulty Most of the landscape is engineered specifically to kill the player character Alongside a traditional range of recognizable dangers such as spikes and pits there are many less obvious threats as well most of which are all but impossible to avoid without either previous knowledge or trial and error,I Wanna Be The Guy The Movie The Game is a sardonic loveletter to the halcyon days of early American videogaming packaged as a nailrippingly difficult platform adventure Players fill the role of The Kid a youthful vaguely Megamanesque protagonist on a quest to become The Guy This inscrutable plot however is just a vehicle for a wide variety of inventive welldesigned and frustrating jumpandshoot challenges that pay homage to many of the games you loved as a child The everfragile Kid explodes in a shower of red pixels at the slightest brush from the games many obstacles from traditional spikes and bottomless pits to more unconventional killers such as plantlife and puzzle pieces  Using a multiroute layout not unlike a Metroidvania the game grants a degree of deadly exploration without thoseextraneous upgades meant to make life easier The game provides players with a choice in terms of their deathrate thanks to a variable difficulty setting that changes the number of save points from frequent to nonexistent IWBTG is open to all players knowledge of videogaming history is optional and may not help against the frequently ironic and always sadistic deathtraps located herein And so the question is left up to you  Do YOU have what it takes to be The Guy,82.81950833141458
1193356800,"[12, 31]",80,The Witcher,"[6, 14]",Based on the novel series by Andrzej Sapkowski The Witcher follows Geralt of Rivia an amnesiac witcher problem solver and slayer of monsters whose home the Kaer Morhen citadel is besieged by an organization called the Salamandra who steal their valuable potions and get away Throughout the game Geralt must resolve peoples moral dilemmas connect the dots of his past and track down the Salamandra,The game begins when Geralt of Rivia one of a few remaining witchers  traveling monster hunters for hire gifted with unnatural powers is transported to the witcher stronghold of Kaer Morhen by fellow witchers who had discovered him unconscious in a field Geralt remembers almost nothing of his life before that point He is taken to Kaer Morhen the base of the witchers where he meets a sorceress named Triss Merigold The castle is attacked by a gang of bandits named Salamandra led by a criminal known as the Professor a mage named Savolla who controls a large praying mantislike monster and another mage named Azar Javed The witchers and the sorceress manage to slay the monster and kill Savolla but the Professor and Azar manage to escape with the mutagens that genetically alter the witchers After curing Triss of the wounds she received while fighting Javed Geralt and the rest of the witchers head off in different directions in order to find information on Salamandra,82.45542652374758
1191888000,[5],891,Team Fortress 2,"[3, 6, 9, 12, 14]",One of the most popular online action games of all time Team Fortress 2 delivers constant free updatesnew game modes maps equipment and most importantly hats Nine distinct classes provide a broad range of tactical abilities and personalities and lend themselves to a variety of player skills,The Gravel War  the main setting for Team Fortress 2 A woman by some accounts begins acquiring the worlds largest supply of Australium Radigan Conagher finishes building a Life Extender Machine for Blutarch Mann Saxton Hale fights and captures the last surviving Yeti Charles Darling absconds with the panthers to put them in his new animal dungeon  Administrator hearing the news of her takeover of Mann Co orders her assistant Miss Pauling to reassemble the Mercs recovering Soldier from Hollywood Pyro from Frontier and Demoman from his Badlands home Saxton Hale is released from the Millhaven Ultra Prison for Dangerous Men held there for burning down most of Charles Darlings zoo months earlier The Classic mercenaries arrive at New Zealand with the TF2 Medic killing Sniper and capturing the others TF2 Engineer has been maintaining the Life Extender Machines of an elderly woman in 19th century attire resembling Helen but extremely aged The team escapes killing three Classic mercenaries but are overcome by bloodsucking robots,82.29093708637191
