first_release_date,genres,id,name,platforms,summary,storyline,rating
1193356800,[5],271513,Three Towers And A Sick Base,[6],Large open base map set inside a lava canyon,Missing,Missing
1192924800,"[5, 8]",266554,Scruffy Rides Again,[6],Scruffy Rides Again is a topdown shooter game with platformer elements mixed in,Missing,Missing
1193097600,"[9, 34]",259439,Fatal Hearts,[6],Fatal Hearts is an Englishlanguage visual noveladventure game in which players control a teenage female protagonist who is having strange dreams while people are being murdered It was released in October 2007 for Microsoft Windows,Dreams iceblue eyes calling to you in the night  The howls of wolves echo across empty streets  Young women found dead violently murdered  Love and loneliness  In Fatal Hearts you play the role of Christina Robinson and help her to uncover the secrets behind her dreams As the story unfolds you will be forced to make choices of who to believe who to trust and who to declare an enemy Solve puzzles and conquer challenges but be careful or Christina may become another victim,Missing
1192752000,[5],256856,Sine Die,[6],map01 mainly rusty metal tech map02 clean tech base a bit hellish  Your mission Seek three mystical skulls Use their collective power to destroy the Source of Evil  Notes I recommend to play map02 from pistol start No jumping,Missing,Missing
1191283200,[14],248773,NBA Live 08,"[6, 8]",Missing,Missing,Missing
1191801600,Missing,225347,Kyukkyu-kun Game,[6],Kyukkyukun Game is a Yume Nikkithemed dodging game,Missing,Missing
1193270400,[34],209141,Asu Kano! Asu mo Kanojo to Issho!,[6],An erotic visual novel from PinballMap,Missing,Missing
1193788800,[7],209002,Dance Praise 2: The ReMix,"[6, 14]",Dance Praise 2 The Remix is the sequel to Dance Praise with more songs and support for up to 4 players as well as several singleplayer minigames,Missing,Missing
1193097600,[33],203273,Pac-Motos,"[5, 6, 48, 49, 130]",The player controls PacMan and must knock all of the enemies off of the stage in order to complete the level much like the original Motos The player must traverse through five different worlds each comprised of seven stages The seventh stage features a boss piloted by either member of the Ghost Gang and must be defeated in order to proceed to the next world,Missing,Missing
1193097600,[8],203270,Pac 'n Roll Remix,"[5, 6, 48, 49, 130]",In PacN Roll Remix the inhabitants of PacWorld have been turned into spheres by the evil monster Golvis Ghost Light PacMan must roll his way through GhostLand collecting pellets and confronting Ghosts to save his family and restore peace to PacLand Introducing an innovative new control scheme PacN Roll lets players control PacMan with the Nintendo DS stylus Players can roll and dash around the environment as well as execute maneuvers such as hairpin turns immediate stops and precision rolling with effortless strokes of the stylus In his quest to save PacLand PacMan will venture through stages such as Castle Pac GyroJungle and the Ghost House while facing perilous hazards like moving floors dash panels jump zones and wind zones Along the way PacMan will find powerups like the Winged Chocolate allowing him to fly through the worlds and jump over Ghosts or the Knight Chocolate providing him with armor which grants him the power to crash through walls and withstand more damage,Missing,Missing
1191542400,"[5, 32, 33]",199081,Msoids,"[6, 82]",Msoids is a shooter game based on the Asteroids formula The player controls a small cannon which he can move around with the keyboard using the mouse to blast the square asteroids which split into smaller ones when shot When the cannon is hit by an asteroid its game over,Missing,Missing
1191369600,[5],195496,Classic DOOM 3,[6],The Classic Doom 3 modification is a remake of the original Doom game by id Software The main emphesis is that of brining the older game up to date in a modern graphics engine The project makes use of all of Doom 3s advanced graphical features while retaining the feel and gameplay of the original game,In the future an unnamed marine known as the Doom marine or Doom guy is posted to a deadend assignment on Mars after assaulting a superior officer who ordered his unit to fire on civilians The Union Aerospace Corporation which operates radioactive waste facilities there allows the military to conduct secret teleportation experiments that go terribly wrong A base on Phobos urgently requests military support while Deimos disappears entirely and the marine joins a combat force to secure Phobos He waits at the perimeter as ordered while the entire assault team is wiped out With no way off the moon and armed with only a pistol he enters the base intent on revenge,Missing
1192579200,Missing,175553,Supercow,"[6, 39]",Check out this superdynamic arcade game about the adventures of a new character that deserves everyones attention Supercow The evil professor Duriarti has escaped from the prison and captured the farm in Sunny Valley Now he is creating an army of clones from innocent animals While nobody knows exactly hes plotting the mad professor is continuing his evil experiments his cavelab And only Supercow can stop him,Missing,Missing
1191974400,[5],145151,Epic,[6],Epic is a fivelevel Cacoward winning WAD released in October 2007 created by Eternal,Missing,Missing
1191888000,"[15, 32]",144481,KingMania,"[6, 14]",Kingmania is a quick action strategy game that will test players ability to make quick tactical decisions    Players can control different buildings using their power and the power of troops the buildings produce to defeat their opponents    Each of the buildings in the game has another purpose and can be improved upon  castles produce strong knights and allow players to cast magical spells at enemy buildings or to summon dragons Villages provide food as well as villagers who are weak warriors but attack in hordes and when they turn to berserkers they can gain a destructible force Gold can be gathered at mines mage towers can shoot fireballs and destroy garrisons in enemy houses etc,Missing,Missing
1193788800,[5],143291,Rage Against the Machine,[6],Rage Against the Machine was a fan addon project to create a commercial quality Blood game the title is sometimes shortened as Rage or RATM Episode one was first released on October 31 2007 before being reissued as a New Compact Version on May 16 2008 and is currently the only released portion of Rage Against the Machine    The addon includes a new soundtrack and is intended to add many new levels that are compatible with single player BloodBath and cooperative play    The story is intended to be played out through liveaction cutscenes shown at the end of the episodes It was created by Matthew Daedalus Kallis project leader and mapper Dimebog musician and Filip oBe Walgraef artist and animator As well as a founder of The Postmortem and later Altar of Stone fan sites Daedalus was the previous creator of the Sin Campaign miniepisode which partly utilized assets from BloodLines,Missing,Missing
1192579200,Missing,140560,Talisman Online,"[6, 34]",Talisman Online is a free 3D fantasy MMORPG with equipments scenarios various kinds of quests and PVE  PVP stages,In the ancient orient there is a peaceful and serene continent The people there live and work in peace and contentment Their families are kept there generation by generation However an evil power is preparing to come out behind the peaceful surface,Missing
1193184000,[8],134295,Super Mario Bros. DDX,[6],Super Mario Bros DDX is an unofficial fan game based on the original Super Mario Bros series being a sidescroller platformer  It has a set of original levels sprites and powerups not present in the original games,Missing,Missing
1193616000,[8],134068,Toad Strikes Back,[6],Toad Strikes Back is a fan game developed by Thunder Dragon It is a sidescroller starring Toad with mechanics borrowed from the official games of the Mario series such as Super Mario Bros 2 The game received a sequel in 2015 Toadette Strikes,Missing,Missing
1192665600,[9],132173,Age of Emerald,[6],Help the four magicians by using your match3 skills to build the most splendid city in the entire world Match building materials food gold and magical artifacts to build resources for construction Build a marvelous city for the King and host the Kings birthday party With over 200 levels and 30 buildings to build Age of Emerald has something for everybody Collect over 30 different resources and use 5 magical bonuses to build your grand city,Missing,Missing
1193788800,[31],131928,Afraid of Monsters: Director's Cut,[6],Afraid of Monsters Directors Cut is a survival horror mod for HalfLife 1 It is an enhanced version of the original Afraid of Monsters  Your name is David Leatherhoff and youre addicted to a strange drug Lately you have started to experience illusions dreams picking at your deepest and darkest fears Finally you go to Markland Hospital seeking help First however you make a stop into the bathroom where another bottle of pills awaits you standing out like a beacon in the night in your depraved eyes When will it all stop,Your name is David Leatherhoff and youre addicted to a strange drug Lately you have started to experience illusions dreams picking at your deepest and darkest fears Finally you go to Markland Hospital seeking help First however you make a stop into the bathroom where another bottle of pills awaits you standing out like a beacon in the night in your depraved eyes When will it all stop,Missing
1193184000,"[5, 13, 31]",121733,Climber Girl,[6],Missing,The plot of the game is based on the novels of the famous Russian science fiction writer Oleg Sinitsyn The linguist and at the same time adventurer Alena Ovchinnikova has to overcome a long and dangerous path leading to a powerful artifact belonging to the mysteriously disappeared race of preludes    The whirlpool of events will bring players to the most different corners of the planet and ruthless mercenaries and militants of the transnational corporation will everywhere follow in their wake Firearms skills and the experience of a born climber will help cope with the villains Climber Girl is a game created from the acclaimed film of the same name The charming girl again challenges the cruel criminal world,Missing
1192406400,[12],120642,The Elder Scrolls IV: Oblivion - Fighter's Stronghold,"[6, 12]",Fighters Stronghold is the final official addon for The Elder Scrolls IV Oblivion It adds a new quest where you have to rid Battlehorn Castle of marauders After doing this the castle becomes the players property and has to be upgraded to finish the quest The addon also adds various new items and NPCs The PC version was available for free during a limited time after release,Missing,Missing
1192233600,"[5, 32, 33]",107235,Garden of Coloured Lights,[6],Garden of Coloured Lights is an old school 2D vertical shootemup with some innovative elements Innovative graphics soundtrack and game concept The game itself is very challenging and as you progress you will understand that you are dealing with a true piece of art  It is free open source software It is released under GNU GPL license v3 which means that it is not only free of charge but you may also download the source code and play with it,Missing,Missing
1191628800,"[8, 10, 32]",95422,JellyCar,"[6, 12]",JellyCar originally titled JelloCar is a drivingplatforming game for both Windows and Xbox360 The game is about driving a squishy car through squishy worlds trying to reach the exit The game features soft body physics for all of the objects in the world Also your car can transform for a limited time to aid progression through the level,Missing,Missing
1192060800,"[5, 9]",92029,Tecno: The Base,[6],Tecno The Base is a scifi puzzleFPS set in the eponymously named Tecno Base a remote research outpost An accident in one of the labs causes all the robots to malfunction and attack the human staff Over the course of the game you play two playable characters Alexia and Mika who must solve a series of puzzles to piece together what happened and escape the base,Missing,Missing
1193788800,[31],81226,Pirates of the Caribbean Online,"[6, 14]",Pirates of The Caribbean Online was an MMORPG adaptation of the popular movie and game series of the same name This game goes where no other has gone before and allows you to create and customize your very own pirate who can adventure and start their own crews from all the other online players in order to conquer the seas,The games story occurred between the first and second Pirates of the Caribbean movies The players pirate was a central character in a story involving Jolly Roger and his desire to take over the Caribbean and get revenge against Captain Jack Sparrow for taking his place on the Brethren Court and causing him to become cursed and undead,Missing
1193356800,"[31, 34]",72720,Root After and Another,[6],An adult visual novel and the sequel to H2O Footprints in the Sand This game contains new after stories for the original heroines Yuis and Makis routes and several short stories,Missing,Missing
1193270400,"[5, 32]",71844,Protoganda: Strings,[6],Protoganda Strings is a fastpaced vertical shooter with a visual style somewhat inspired by old Soviet 8mm movies Gameplay consists of sequences of boss fights of which the order can be defined or randomized,Missing,Missing
1193356800,"[31, 34]",69406,Draculius,"[6, 8]",An adult visual novel by mero mero cute on the PS2 is Kyuuketsu Kitan Moonties,Missing,Missing
1192147200,[12],67321,Twelve Sky,[6],Twelve Sky is a Massively MultiPlayer Online Role Playing Game It takes place in a 3Drepresentation of the world of Middle Ages China that players can interact with through their characters  The game features three main homelands one for each faction In this game world players use their characters to explore locations defeat creatures and complete quests among other such activities,Missing,Missing
1192147200,"[16, 35]",64221,Top Trumps: Dogs & Dinosaurs,"[6, 8, 20]",A Top Trumps card game featuring the Dogs  Dinosaurs deck,Missing,Missing
1192060800,[15],54134,Jagged Farm: Birth of a Hero,[6],Animal Farm meets Real Time Strategy Welcome to Jagged Farm Birth of a Hero Plan Fight and Defeat the evil pigs with all available weaponery With courage and strategy to victory,Missing,Missing
1192060800,[11],53928,Company of Heroes: Game of the Year Edition,[6],Company of Heroes Game Of The Year Edition includes  Two new skirmish maps Seine River Docks and Beaux Lowlands,Missing,Missing
1192579200,[15],51250,Liquid War,[6],Gameplay takes place on a 2D battlefield usually with some obstacles Each player 2 to 6 computer or human has an army of particles and a cursor The objective of the game is to assimilate all enemy particles The players can only move their cursors and cannot directly control the particles Each particle follows the shortest path around the obstacles to its teams cursor A player may have several thousands particles at a time giving the collection of particles a look of a liquid blob When a particle moves into a particle from a different team it will fight and if the opponent particle fails to fight back it is not moving in the opposite direction it will eventually be assimilated by its attacker As particles cannot die but only change teams the total number of particles on the map remains constant Since a particle can only fight in one direction at a time towards its teams cursor a player that surrounds its opponents will have a distinct advantage The game ends when one player controls all of the particles or when the time runs out When the time runs out the player with the most particles wins  There are multiple maps which affect the obstacles in the battlefield These obstacles may affect the strategies of the game  Liquid War is a multiplayer game and can be played by up to 6 people on one computer or over the Internet or a LAN A single player mode is available in which the opponents are controlled by the computer The computer AIs strategy is to constantly choose a random point in the enemy and move its cursor to it,Missing,Missing
1193011200,[10],51248,Extreme Tux Racer,"[3, 6, 14]",Extreme Tux Racer is an opensource downhill racing game starring Tux the Linux mascot It follows in the path of Tux Racer and its derivatives,Missing,Missing
1191542400,"[16, 35]",51219,Legends of Norrath,[6],Legends of Norrath is an online Collectible Card Game CCG developed by Sony Online Entertainment It is based on the world of Norrath from EverQuest and EverQuest II,Missing,Missing
1193443200,[12],50459,Scallywag: In the Lair of the Medusa,[6],The Gosling valley was once a valley of peace and prosperity In Gosling it seemed the sun always shined your neighbors smiled and the harvests were bountiful Yes life in the valley was good Factor in the mushrooms and well life wasnt just good it was great    Ah yes the mushrooms The valley was full of them and each one was special There were enormous mushrooms that were used as homes and small ones that could be brewed into liquor including everyones tavern favorite ShroOOom ale Some mushrooms were best buttered and fried while other mushrooms were typically dried and smoked There were mushrooms that healed the sick and even some that could make magic    Then the troubles began Bizarre creatures prowled the valley the wildlife fled and once full larders laid bare The citizens of Gosling smiled at each other no more instead spending their days hiding in terror Worse with the blight upon the land the mushrooms that once provided so much now provided so little Even the casks of ShroOOom ale were almost dry    Big Will an old farmer sought out the source of the evil Nestled high in the hills he found the source a dank and dark cave that oozed evil a terrible open sore in the land that spewed forth nightmares Big Will did not go in though Hed let someone else have all the glory Someone such as YOU    You are Rapius mighty farm laborer The blood of the Gods do not flow in your veins You were not prophesized about a thousand years prior by three blind crones Yet it is you Rapius that will seek out and destroy the source of evil    Rapius grab your lantern and make haste For the good of the people the lands and the mushrooms  especially the mushrooms Have you seen what theyre charging for a pint of ShroOOm ale lately Go forth descend into the earth Leave a tramp and come back a scallywag All of Gosling awaits your triumph  your triumph in the lair of the Medusa    Scallywag In the Lair of the Medusa is a singleplayer action orientated dungeonbash of unlimited potential Taking the role of Rapius players fight their way through eighty levels of randomly generated dungeon exploration braving dozens of unique subterranean dangers in a quest to cleanse the ultimate evil within the catacombs    Down in the dark players will gain gear craft items learn magic eat shrooms turn to stone become invisible get drunk be hungover learn to fly speed up muscle up regenerate smoke fungus get diseased get lost get found and more Careful use of Rapius lantern will allow players to strike from afar or for tough encounters sneak by silently in the dark    Scallywag In the Lair of the Medusa also comes complete with RAGe the Random Adventure Game engine Craft whole new adventures for Rapius or even make entirely new games Everything and we mean everything can be modded with RAGe no programming experience necessary    Do you have what it takes to survive eighty levels of terrible beasts cruel hazards and some mind blowing mushrooms Find out in Scallywag In the Lair of the Medusa,Missing,Missing
1191283200,"[12, 31]",50098,World of Warcraft - Battle Chest,"[6, 14]",World of Warcraft Battle Chest this is obsolete and no longer available as it has been replaced by the World of Warcraft package is a collection of World of Warcraft products released by Blizzard Entertainment on October 2 2007 It combines the DVD versions of World of Warcraft and its first expansion World of Warcraft The Burning Crusade with the BradyGames strategy guides for both titles as well as two Guest Pass Keys in one package at a suggested retail price of 3999 in the United States and 3499 in Europe,Intent on settling in Durotar Thralls Horde expanded its ranks by inviting the undead Forsaken to join orcs tauren and trolls Meanwhile dwarves gnomes and the ancient night elves pledged their loyalties to the Alliance guided by the human kingdom of Stormwind After Stormwinds king Varian Wrynn mysteriously disappeared Highlord Bolvar Fordragon served as Regent but his service was affected by the mind control of the black dragon Onyxia who ruled in disguise as a human noblewoman As heroes investigated Onyxias manipulations the ancient elemental lord Ragnaros resurfaced to endanger both the Horde and Alliance42 The heroes of the Horde and Alliance defeated Onyxia and sent Ragnaros back to the Elemental Plane    Assault on Blackwing Lair  Deep within Blackrock Mountain the black dragon Nefarian conducted twisted experiments with the blood of other dragonflights Intent on seizing the entire area for his own he recruited the remaining Dark Horde a rogue army that embraced the demonic bloodlust of the old Horde These corrupt orcs trolls and other races battled against Ragnaros and the Dark Iron dwarves for control of the mountain Nefarian created the twisted chromatic dragons and a legion of other aberrations in his bid to form an army powerful enough to control Azeroth and continue the legacy of his infamous father Deathwing the Destroyer Nefarian was vanquished by the heroes from the Horde and the Alliance    Rise of the Blood God  Years ago in the ruined temple of AtalHakkar loyal priests of the Blood God Hakkar the Soulflayer attempted to summon the wrathful deitys avatar into the world But his followers the Atalai priesthood discovered that the Soulflayer could only be summoned within the Gurubashi tribes ancient capital ZulGurub Newly reborn in this jungle fortress Hakkar took control of the Gurubashi tribe and mortal champions of the trolls mighty animal gods The Soulflayers dark influence was halted when the Zandalari tribe recruited heroes and invaded ZulGurub    The Gates of AhnQiraj  The great desert fortress of AhnQiraj long sealed behind the Scarab Wall was home to the insectoid qiraji a savage race that had once mounted an assault to devastate the continent of Kalimdor But something far more sinister lurked behind AhnQirajs walls the Old God CThun an ancient entity whose pervasive evil had suffused Azeroth since time immemorial As CThun incited the qiraji to frenzy both the Alliance and Horde prepared for a massive war effort A mixed force of Alliance and Horde soldiers dubbed the Might of Kalimdor opened the gates of AhnQiraj under the command of the orc Varok Saurfang The heroes laid siege to the ruins and temples of AhnQiraj and vanquished CThun    Shadow of the Necropolis  In the Lich Kings haste to spread the plague of undeath over Azeroth he gifted one of his greatest servants the lich KelThuzad with the flying citadel of Naxxramas as a base of operations for the Scourge Consistent attacks from the Scarlet Crusade and Argent Dawn factions weakened the defenses of the floating fortress enabling an incursion from the heroes that led to KelThuzads defeat However a traitor among the ranks of the knightly order of the Argent Dawn ran away with KelThuzads cursed remains and fled to Northrend where the fallen lich could be reanimated,Missing
1193356800,[26],43216,Cheggers' Party Quiz,"[5, 6, 8]",Get the family together and take part in Cheggers Party Quiz loaded with thousands of questions on entertainment subjects,Missing,Missing
1193097600,[14],43208,Backyard Football '08,"[5, 6, 8, 20]",Backyard Football 08 is the sixth iteration of the best selling childrens football video game The only kids game to hold the NFL and NFL Players Inc licenses Backyard Football 08 features a roster full of current NFL Superstars as kids including twotime SuperBowl MVP Tom Brady as the coverhighlight athlete Backyard Football 08 combines authentic NFL plays and strategies with the wild and whacky antics of the Backyard gang to give young football fans a realistic fun sports experience The game gives kids total control of the style location pace and strategy And with multiple levels is easy enough for rookie players yet mega challenging for more seasoned veterans,Missing,Missing
1191888000,"[10, 14]",27578,Mountain Bike Adrenaline,"[6, 8]",Mountain Bike Adrenaline featuring Salomon is a new approach to outdoor sports giving genuine freedom rushes and fullon free rider attitude Attempt the most prestigious ATB slopes in the world Speed dexterity and a daring nature are the only conditions youll need to win beat records and unblock new ATBs locations and modes,Missing,Missing
1193097600,"[5, 24]",27533,Insurgency: Modern Infantry Combat,"[3, 6, 14]",Grab your rifle join your team mates and enter the fight Take to the modern battlefield and engage in intense realistic battles Choose your side between a highly organized conventional army or the partisan insurgents Teamwork tactics bravery and discipline are the keys to your success in a deadly and treacherous modern war environment  Insurgency Modern Infantry Combat represents the modern battlefield on the individual and tactical levels Only the best players will become commanders and get the chance to lead its entire team towards victory This is a game where realworld squad and guerrilla tactics are necessary to stay alive and repel the enemy and is geared towards clans and organized teams of players,Missing,Missing
