first_release_date,id,name,platforms,summary,genres,storyline
1657324800,275929,Chikn Nuggit Nightmare Fwiends,[6],Youre now dreaming of your worst nightmare that Chikn Nuggit and his fwiends are gonna kill you You have to collect all the 10 Chicken Nuggets and then get out of this maze,Missing,Missing
1658275200,274941,Wretched Flesh,[6],Wretched Flesh is a set of 5 boomcompatible complevel 9 maps The wad includes a dehacked file that makes the combat slightly faster paced All of the maps are mostly linear Combat ranges from cramped brawls to wide open skirmishes,[5],Missing
1658793600,274894,Hitman 3: Ambrose Island,"[6, 48, 49, 167, 169]",Ambrose Island is a brand new location for HITMAN 3 and a major release as part of our Year 2 plans Its available now as a free download included with the July Patch  Embark on a new adventure with Agent 47 to a secluded island in the Andaman Sea Located north from the Strait of Malacca Ambrose Island is an isolated harbour packed full of dense vegetation hidden coves twisting paths and perilous bridges  From the lit torches that illuminate narrow passageways to the neon lights that flicker over the bustle of Farahs bar theres a sense of discovery around every corner,[31],Missing
1658793600,273921,Fishing Minigame 2,[6],The pseudovisual novel sequel to the first Fishing Minigame is here The hero Roselle decides to revisit the Fishing Shrine to have a good time and finds herself enraptured by the minigame to the dismay of the shrines sage and another visitor Dark Lord Who cares about that fella,[34],Missing
1658275200,273919,Hand of the Goddess,[6],This was made for IGMC Rebirth and can be finished within an hour as per contest rules The game definitely isnt perfect especially since I stick to the default animations instead of using my own but Im happy with it Ive only been able to work on this game because I was stuck indoors for weeks because I caught Covid Ive spent most of my Covid time working on this and Im kinda exhausted of it Anyway Covid is still here and serious take care of yourselves yall,[12],A short game of a JRPG adventure on fast forward where a boy goes on a journey to stop the resurrection of the Dark Lords god in hopes of resurrecting his goddess May he find peace of mind
1658534400,273540,Nuclear Bunker,[6],Sprawling techbase exploration focused dungeon crawl with mostly low intensity combat though there are a few set piece battles This map was finished in 2007 but I hadnt released it because it was supposed to be part of a miniepisode that was never finished,[5],Missing
1659225600,272078,Hell Girl,[6],A reimagination of Pokémon Emeralds Battle Pike,"[12, 16]",Missing
1657152000,272023,Klonoa 2: Lunatea's Veil,"[6, 48, 49, 130, 167, 169]",Klonoa 2 Lunateas Veil is a remaster of the original 25D platformer game released for modern consoles with enhanced graphics The game was bundled with Klonoa Door to Phantomile in the Phantasy Reverie Series This is actually the first time Lunateas Veil has had any sort of rerelease since its debut on the PS2,"[8, 31]",The game puts players in the role of Klonoa who along with a new cast of friends has stumbled into another adventure this time to save the world of Lunatea and help unveil the mysteries of the enchanted world
1656806400,271968,40oz Bounce,[6],15 small  medium sized maps made in three days with one design constraint only 40 monsters or less Built on Copper v119 already included and map source files are included too,[5],Missing
1656892800,271249,Head Reattachment Trauma,[6],Small short linear single player scifi base map with Makkon textures,[5],Missing
1657929600,271223,Disposal Of Otherworldly Monsters,[6],A large Doom themed map using the SMEJ2 progs already included Contains music from Doom 2 OST,[5],Missing
1657152000,270725,Klonoa: Door to Phantomile,"[6, 48, 49, 130, 167, 169]",Klonoa Door to Phantomile is a remaster of the original 25D platformer game released for modern consoles with enhanced graphics The game was bundled with Klonoa 2 Lunateas Veil in the Phantasy Reverie series This version is actually a remaster of the 2008 Wii remake simply titled Klonoa with the character designs and colors remaining more faithful to the original PS1 game,"[8, 31]",The story follows Klonoa and his friend Huepow in their efforts to save the dream world of Phantomile from an evil spirit intent on turning it into a world of nightmares
1657929600,268725,The Village of Archensheen,[6],A bite sized Heretic level with the restrictions of no more than 100 enemies 100 sectors and 1000 linedefs,[5],Missing
1657670400,267604,Rabbitmaiden Softbook,"[3, 6, 14]",Rabbitmaiden Softbook is a companion visual novel to the mainline rabbitmaiden softworks vns eg heartlovepowertemple,[34],Missing
1657843200,266904,Super Peko 35,"[6, 82]",A 2D pixel shooter hololive fan game,[8],Missing
1658880000,264391,Sonic McOrigins,"[3, 6, 14, 34]",Sonic McOrigins is a fanmade remake collection of the Sonic Heroes McDonalds LCD games,Missing,Missing
1658361600,262982,Beware of Falling Angels,[6],This is an Eternity Engine map with portals and some special effects The gameplay is classic no new monsters or weapons no jumping Freelook is not needed or recommended,[5],Missing
1657670400,262568,Speed Squared,[6],Speed Squared is the eighth edition of PUSS BluePineapple72s semi monthly speedmapping series These maps were built with BigBriks Adventures of Square total conversion Download Square here,[5],Missing
1658707200,261484,The Box of a Thousand Demons,[6],The Box of a Thousand Demons is a brand new 32map Boom megawad targeting DSDADoom as a port and using OTEX as its main texture pack It focuses on variety over visual consistency and explicitly caters to all manners of niche and aberrant gameplay  within you will find lite and fat slaughter key hunts puzzles platforming pacifist maps Tyson maps NoMo maps ammo starvation maps the whole nine yards A little something for everyone Atmosphere was my main concern with streamlined gameplay a distant second,[5],Missing
1658793600,260987,Nectar Wars,[6],When the kingdom of the Bees becomes consumed with greed they declare war in their search for the allpowerful Nectar Led by their Queen Beeatrix the bee army has forged alliances across the globe to expand their reign of terror It is up to the elemental guardians five hummingbird sisters to fend off this attack and restore balance to the land  An explosive Shoot Em Up like no other Nectar focuses on five hummingbird sisters each with their own playstyle Defeat powerful bosses unlock new cosmetics compete in online leaderboards and save the world in this globetrotting adventure,"[5, 32, 33]",Missing
1658534400,260890,"128 Linedefs, 64 Things",[6],A Vanilla Community Project with one rule Each map could at most only have 128 Linedefs and 64 Things  The megawad comes with 32 maps  3 bonus from the Doomworld Community both old and new  All maps were designed with pistol start in mind though continuous play is perfectly fine,[5],Missing
1659225600,260868,Kaiser of Singularity,"[3, 6, 14, 34]",A fourthyear expelled student returns to his hometown hoping to reconnect with old friends While hacking into the abyss of the unconscious he will search for answers to numerous questions how to overcome alienation how to restore the course of time and why this world is imprisoned either in the past or in somebody elses future Surveillance cameras protective rituals videotapes with old films secret networks outside the networks the search for oneself and ones place in reality What of this is real and what is psychosis which resulted from a manmade disaster,[34],Missing
1658016000,260122,Lyssa,[6],Let us live since we must die  Lyssa Is an RPG developed by Vih You will be playing as Alayss a college student warped into the Soul World a world full of demons and deceased spirits Will she be able to find the person who kidnapped her while trying to regain the faith of her late best friend Or will she fall into despair,"[12, 16, 31, 32]",In this game you will meet different types of demons gods ghosts and yokai and experience horror and even romance
1657324800,260095,Delivering Hope,"[3, 6, 34, 82]",Get IRyS flying and deliver hope as far as you can in this hololive fangame,[33],Missing
1657324800,258134,Solar Struggle,[6],Solar Struggle is an Ultimate Doom limitremoving Complevel 3 community project Each map was given a name first and then participants were invited to make a level based of it  The first 3 episodes are comparatively easy and short and the 4th is ramping difficulty up quite a bit The maps are balanced for pistolstart primarily,[5],You are an unnamed convict imprisoned on Titan When demon invasion threatens the Solar System he gets a chance to escape But theres a horde of demons between you and freedom
1656979200,257564,Squid Girl World Ep.0,"[3, 6, 14]",After crash landing on a planet covered in mushrooms Aseroe meets a squid girl named Sepia  This is the first visual novel in Squid Girl World,[34],Missing
1656979200,257557,Chirk,[6],A visual novel about lovers in a city where they cremate the roadkill,[34],Missing
1656979200,257539,A thousand words that I could tell you,[6],After finding a mysterious necklace that allows her to travel back in time a girl decides to use it to fix her troubled past,[34],Missing
1656979200,257538,"End of Verse 23,194,973,137",[6],Follow Vouxeine an immortal being whose sole purpose in life is poetry as they consider an imminent debt weighing down upon them Look a little into the nature of immortal beings confront imminent ideological death and experience girls love,Missing,Missing
1657065600,257537,Akasha Dreams,[6],Akasha Dreams is a short NSFW yuri visual novel made by Prairieland Planet for the 2022 Vncup  a lonely girl finds perfection in the Soulnet but the potential held by real life keeps her on the verge,[34],Missing
1656979200,257523,I'd Look Better With Angel Wings,"[3, 6, 14]",A shutin finds themselves presented with the opportunity to transcend their humanity,[34],Missing
1656979200,257522,Wormgrubber,"[3, 6, 14]",A loser vampire girl who would end the world over a pointless crush,[34],Missing
1656979200,257521,Hazels,"[3, 6]",A gay lesbian visual novel,[34],Missing
1656806400,257520,Rusting Souls,"[3, 6, 34]",Rusting Souls is a visual novel made in 4 days by Youli Clémancipé and KuroYuki for the VN Cup Its a short experience where two women X and Y confront the limits of their own body in a dull atmosphere of a destroyed world,[34],Missing
1656892800,257519,Mystery Cat,[6],Mystery Cat is a linear visual novel about a cat lost in a subterranean utopia,[34],Missing
1657670400,257043,Genshin Impact: Summer Fantasia,"[6, 34, 39, 48, 167]",Version 28 of Genshin Impact which included  New character Shikanoin Heizou  Returning limitedtime area Golden Apple Archipelago  New outfits for Diluc and Fischl  New story quest for Kaedehara Kazuha  New hangout events for Shikanoin Heizou  New main event Summertime Odyssey  and more,"[12, 31]",The height of summer is a wonderful time of the year and there are always many strange interesting events taking place A cursed blade of unknown origin a mysterious unsolved case and the familiar but not too familiar islands far at sea O seasoned warriors fear not the depths of despair and death borne from chaos For the Prinzessin holiest of sovereigns of the kingdom where the night is sacred will therefore declare the verdict of victory And so everyone followed the path of their destiny ready to take on unknown encounters and challenges
1657929600,256084,From the Sun to the Moon,"[6, 82]",Soleil pronounced sohlay and her girlfriend Esmeray pronounced ehzmeray have been together for almost three years Leading up to their third year anniversary Soleil decides the best way to celebrate would be to take Esmeray out on a date each day leading up to their anniversary Will the dates be successful or end in total failure Play now to find out,"[32, 34]",Missing
1658707200,255578,Febilis,[6],This game is a prototype version It has been designed for Xbox controllers but can still be played with mouse and keyboard It features a save system you can use to save your progress and keep playing later on,"[8, 31]",It was a time dominated by war religion and above all by a devastating disease called the Scourge Men seem to lose their humanity mysterious beasts lurk near the cities and even the Three Creators remain silent In this chaos rumours spread that a cleric found an abandoned churchs crypt and discovered the corpse of Febilis God of All Diseases An elite soldier has been sent there to bring answers to the questions asked by the religious authorities
1658448000,255329,Coloring Game: Girls,[6],Missing,Missing,Missing
1658966400,255089,Kao the Kangaroo: Summer Drip,"[6, 130, 167, 169]",Missing,Missing,Missing
1658793600,254265,Minecraft: SpongeBob SquarePants,"[6, 34, 39, 48, 49, 130, 169]",Are you ready kids Its time to join your favourite underthesea chums on an adventure in Minecraft Visit Bikini Bottom and help make today the BEST DAY EVER for SpongeBob Patrick Sandy and friends Complete with 40 skins,"[13, 31]",Missing
1658880000,251352,Stray Doom,[6],Strays cat rips and tears through demonic hordes in brilliant upcoming Doom mod This mod lets you play as the cat from Stray in the original Doom and you can shoot your way through the game as the cat But not only that but you will be playing in thirdperson,[5],Missing
1658707200,251239,The Thing You Can't Defeat,[6],Experimental mod for Ultimate Doom Doomguy has dementia The Thing you cant Defeat lets you replay the first episode of Ultimate Doom as it slowly morphs into a confusing and demented nightmare  This WAD was HEAVILY inspired by the WAD Doom but somethings not right and the album Everywhere at the end of time by The Caretaker,[5],Missing
1658275200,249776,Cube,[6],A short sokoban puzzle game on the theme of dice,[9],Missing
1658016000,249502,Gronk Want Rock,[6],You play as Gronk Gronk likes to collect rocks the best rocks are at the bottom of deep caverns You have to bring Gronks favorite rock up to his house by carefully throwing the rock onto flat platforms on the walls of the cavern,[8],Missing
1658620800,248747,Tecnology War,[6],Youre in a war between Khyren and Skyren You have to help Khyren save Hirstant country of the Skyren invasion You will have to confront Skyrens and go progressing in the battle so you are capable to eliminate the Skyrens and make them leave the territories than they captured,[32],Missing
1658188800,247511,Into the Breach: Advanced Edition,"[6, 130]",Nearly every aspect of the game will be expanded with new content including  New Mechs and Weapons Five new mech squads and nearly forty new weapons  New Challenges More enemies more bosses and more mission objectives that add additional challenge and variety to any run  New Pilot Abilities The expanded roster includes four new pilots and triple the amount of skills any pilot can earn through promotionsWell be elaborating on all of this new content over the coming weeks before launch and cant wait for everyone to check it out,Missing,Missing
1658016000,246706,Dice Catcher,"[6, 82]",Battle your way through the dungeon and collect back all of your magic dice,[9],Missing
1659139200,246287,I'm On a Watcher Duty 5: Returning to Gensokyo,[6],You got requested by Yukari to go back to Gensokyo one more time because anomalies still happening there You accepted the request and head back there immediately You now back to your duty again,"[2, 9]",Missing
1658361600,245997,Nobunaga's Ambition: Awakening,"[6, 48, 130]",Conquer Warring States Japan under one banner,"[13, 15]",Missing
1659052800,243833,We Are Poems,"[6, 34, 39]",A swim through the queerest region of deep space Its inhabitants float and gravitate in bountiful joyous explosions of light embracing the void as a place to thrive,Missing,Missing
1657584000,243832,Wade,"[6, 34, 39]",A stroll along the shore of a wide river that flows into the underworld As the player ventures deeper the scenery starts to shift and they may encounter oddities or curiosities,Missing,Missing
1658361600,243685,Fall Guys: Neigh Neigh Pack,"[6, 48, 49, 130, 167, 169]",Guaranteed to turn your next round into a onehorse race  Bundle Includes Neigh Neigh Whole Costume 600x ShowBucks,[8],Missing
1658361600,243683,Fall Guys: Wildfire Pack,"[6, 48, 49, 130, 167, 169]",Make your next round an ultimate knockout with these ringside rumblers  Bundle Includes Wildfire Whole Costume Blunderdome Sports Live Whole Costume Bean Analyst Whole Costume 2000 x ShowBucks,[8],Missing
1657497600,242337,Demon Speakeasy,[6],Mix drinks and mingle with monster girls Manage a bar staffed by cute waitresses and work hard to earn their affection Take orders make sophisticated smalltalk and get lucky in the wildest ways possible,"[12, 13, 32]",Missing
1656806400,241242,Tower,"[6, 14]",a story about two girl friends on a grey vertical tower,[34],Missing
1659052800,240074,Night of Carnage,[6],Adam is a 13yearold teenager who lives with his mother in a quiet neighborhood When they get the news that theres a murderer on the loose  Adam begins to suspect that his neighbor may be the dreaded killer,Missing,Missing
1657324800,239558,Mold,[6],Mold is a short horror game inspired by 80s trash movies Bringing unique tuning play and a vibe from the golden age of VHS tapes,[5],Missing
1658016000,238659,Dice is the Way,"[6, 82]",Dice is the Way is a deck builder roguelike card game with a twist you can change ANY number on the screen when you using the Roll The Dice card Roll the dice this is the way,Missing,Missing
1658188800,238076,Champ's Nightmare,[6],Champs Nightmare is a horror immersive audio game for the visually impaired which prioritizes ears over eyes,"[13, 31, 32]",Missing
1658880000,237442,Has Your Dream of Dating a Cute Bunny Girl Finally Come True?!,[6],You got hit by a truck and it hurts like hell but things may be okay after all because you wake up and find a bunny girl,[34],You got hit by a truck and it hurts like hell but things may be okay after all because you wake up and find a bunny girl
1658966400,237362,Pretty Girls Breakers! Plus,"[6, 48, 130, 167]",Brickbusting action returns with outfits to unlock for an even larger cast of beautiful companions,"[9, 33]",Missing
1658880000,236453,As Guilty As the Moon,[6],This is a realistic  survival oriented work The murder of a girl in a ridehailing service two years ago brought your 12 fates back together You wake up in a strange room and things are getting weird around you In the fog not everything you see is the truth Is everything real or unreal,"[12, 15, 31, 32]",Missing
1658448000,234837,My Meta Farm,"[6, 14, 34, 39, 82]",My Meta Farm is a blockchainbased decentralized virtual reality platform where users can create own and monetize game experiences It has the concept of a persistent online 3D universe that combines multiple different virtual spaces My Meta Farm metaverse will allow users to work play a game and socialize together in these 3D spaces  The metaverse will be driven by augmented reality with each user controlling a character or avatar For example you might take a mixed reality meeting with a VR headset in your virtual office finish work and relax in a blockchainbased game and then manage your crypto portfolio and finances inside the metaverse,[12],My Meta Farm is not only a farming game but also a metaverse world where citizens may go fishing have a meal go shopping go sightseeing and do tons of interesting activities with new friends from all over the open world Our metaverse city will bring joyful moments to our players while allowing them to create their own world
1658188800,234658,Blade of Darkness,[6],A portal from the abyss appeared in the town In order to protect the town the protagonist of the warrior decided to enter the portal to prevent the invasion of the abyss,"[5, 12, 31, 32]",Missing
1657324800,233963,Fazbear Entertainment: Storage,[6],Fazbear Entertaintment Storage is a total revamp of Fazbears Fright Storage New characters new mechanics a new story and more Taking place in the large gap between FNaF 1 and FNaF 3 FES seeks to merge somewhat seamlessly with the existing FNaF story while also filling in a few gaps,"[2, 32]",Missing
1658880000,233342,You Just Died,[6],You Just Died In this game you play as Davey He wakes up in his childhood home its different yet familliar Where will he end up while wandering through this dreamy interpretation of the afterlife And will you find out the dark truth about his past  Keep your eyes open you wont see everything on the first playthrough,[31],Missing
1659139200,233327,Wake Up,[6],Have you ever been stuck in a nightmare No This time you did Try to find a way to wake up,[31],Missing
1658188800,232766,The Will,[6],Your wicked sister wants to claim all of the inheritance with a fake will In this point and click adventure game you are going to search your fathers house to find his original will to get your share,"[2, 31]",Missing
1656979200,232759,The Vermander Curse,[6],JP Vermander has a problem  In his eyes hes been swindled  With the offending party being none other than the local hospital  And by using the power of a ritualistic curse he will have his revenge,[31],Missing
1658880000,232747,The Roots,"[3, 6, 14]",The Roots is a horroradventure game that tells a story of a courier who after several unsuccessful attempts of knocking in decides to find the recipient and hand the order to him by any means However the moment the character gets inside the mansion  imposing but unkempt  the feeling of being trapped intensifies and it seems to be no way out or,[31],Missing
1659052800,232706,TXXX,[6],Youre running out of time It was just a stop on your way whyd you have to complicate things You shouldnt have stayed in the first place  A bittersweet oneshot set in the world of Quaint One sprite one background image less than 1000 words Made in six days for the O2A2 2022 Visual Novel Jam,[34],Missing
1659139200,232692,Pokémon Gadir,[6],Embark on a new adventure to face the challenge of the gyms in the Gadir region,"[12, 15, 31]",Play as a young trainer who begins the challenge of the Gadir gyms As you progress on your journey youll meet various characters who will help you on your journey through the region as well as stop a villainous organization up to no good
1659225600,232685,Pokémon Altar,[6],Pokémon Altar is a classic game created for the most conservative within the world of Pokémon The difficulty is a little higher than that of the official games and it has a hard mode for the most daring,"[12, 31]",Missing
1657843200,231801,The Catacombs,"[3, 6, 14]",The Catacombs is a found footage game that plays through the perspective of a VHS camera showing a person venturing deep into the Catacombs of Paris After exploring far into the maze that lives under Paris the player begins to feel theyre being followed,[31],Missing
1656720000,231516,The Crypt Terror,[6],The town of Sherdone is cursed and you are sent down to rid them of the evil,[31],Missing
1656979200,231393,Good Morning Is A Social Construct,"[3, 6, 14]",Follow 15 year old Miya Nakaminas daily life in high school where she finds herself increasingly lost and alien Her only friend is growing up past her own pace where does that leave Miya in the world Completely alone forever probably,[34],Missing
1657238400,230250,Atlantis no Puzzle,"[3, 6, 14, 82]",A short exploration puzzleplatformer where you search for items and decide which one to bring over to your next life every time you die,"[8, 9, 31, 32]",Delve into Atlantis and recover its fabled treasure
1656979200,230162,I Die a Lovely Life,"[3, 6, 14]",Long distance girlfriends Uni and Nuña are aching to meet but neither of them can afford the plane tickets Willing to do anything for money Uni participates in a research study to have her brain uploaded into a computer irreversibly Oops But we can still hook up though right,[34],Missing
1658016000,230081,Drowned Lake,[6],Drowned Lake is a horror game that combines exploration with survival elements with a full announcement coming later this year Dredge out the Drowned Lake to find the secrets hidden in the murky waters,[31],Lakeside communities often tell stories about the Waters Caboclo a folkloric denizen of rivers and lakes which they coexist with The Caboclo can help or hinder the local fisherfolk in their work requiring offerings to be appeased representing the will of the river or lake itself  In some remote communities however the offerings are substituted by a gamble with said creature a roll of the dice with survival on the line  In all of these customs the uneasy humanriver tension is replicated in the humanmonster relationship   Geography of Fisherfolk Myths page 48  Amateur reporter Bento hoped to learn more about this folklore during a night fishing trip dutifully documented by his camera What he learned when he gambled with the lake is documented here
1658275200,229870,Dick Killer,[6],Dick Killer is a trash horror game A mix of horror and comedy style old horror movies like Scary Movie Totally over the top,[32],Missing
1657497600,229833,Poop Killer Origins,[6],Did you think Poop Killer was over Were back with the latest game in the franchise in Poop Killer Origins youll find out how this killer who uses a toilet over his head came to be,[32],Harry owns a small hamburger shop and works alone After making a customer infuriated he will have to do everything to survive this crazy guy
1658966400,229779,Negative One,"[6, 14]",Negative One is a firstperson retro horror game where you take the role of Lisa  Lisa discovers a secret abandoned lab beneath her apartment learning some things are left best not found,[31],Missing
