first_release_date,genres,id,name,platforms,summary,storyline,rating
1193356800,[5],1836,Painkiller: Overdose,[6],Painkiller Overdose is the second standalone Painkiller game The story is set just after Daniel kills Lucifer The death of Hells leader allows Belial the prisoner and outcast to escape and start his vendetta against those who imprisoned him demonic beast Cerberus and Sammael an angel who betrayed his own kind Belial starts his journey with killing his prison warden and later using his head as a weapon After traveling through various hellish places and defeating countless demons he kills Cerberus and reaches Samaels lair There Belial defeats the fallen angel and rips his wings off as an act of vengeance,Missing,69.13159210097513
1193270400,"[2, 9, 31]",6863,Sherlock Holmes: Nemesis,[6],Sherlock Holmes Nemesis sends us to 19th Century London where Arséne Lupin a young French burglar with an impressive track record has just challenged Scotland Yard and the most famous of detectives  Sherlock Holmes,Missing,68.8329268045241
1191888000,"[10, 13, 15, 31]",209,Thrillville: Off the Rails,"[5, 6, 8, 12, 20, 38]",Thrillville Off the Rails lives up to its name with 20 deathdefying rides so outrageous they inspire the same word from every park visitor who sees them Whoa Players build these incredible Whoa Coasters to leap from one track to another launch through the air like cannonballs blast through a burning ring of fire and more,Missing,65.04371511053665
1192147200,"[2, 31, 32]",21485,Overclocked: A History of Violence,[6],Set against the backdrop of a catastrophic thunderstorm raging over New York City Overclocked explores an archetypical yet actual condition of mankind violence This psychological thriller mixes frightening fictional thriller elements using innovative narrative structures Overclocked charts the diffuse areas where memories and illusions dreams and reality perpetrators and victims collide  Army psychiatrist David McNamara is called to the Staten Island Forensic Hospital in New York City to consult on a case that requires his expertise in forensic psychiatry Tasked with exploring the minds of five young men and women who were found scared screaming and without memory he makes alarming discoveries as he begins to cautiously explore the psyches of his young patients Throughout the game players will switch between six different characters in this chilling interactive psycho thriller,The game begins when five amnesic collegeaged teens suddenly appear with guns in the middle of New York City Psychiatrist David McNamara from DC is sent to examine the case thanks to his previous work in the US Army dealing with posttraumatic stress disorder Right from the beginning the case seems odd On the first day David discovers that all five patients had the same origins and they were escaping from the same unknown person from an isolated military island As the history is revealed David using a PDA as a tape recorder makes his way through the teens minds piecing together their history while at the same time dealing with his ongoing divorce David himself has serious issues regarding anger management which ended his former relationship  It is revealed in the end that the teens were part of a military experiment for making amnesic assassins and Davids anger issues were only side effects of the previous project back in the Army,63.89950779336295
1191283200,"[8, 25, 31]",5180,Spider-Man: Friend or Foe,"[6, 12]",SpiderMan Friend or Foe is a SpiderMan video game based on the comic book series and SpiderMan movies  According to the company report SpiderMan Friend or Foe is a unique take on the media franchise Inspired by the movies SpiderMan SpiderMan 2 and SpiderMan 3 this actionadventure beat em up game reinterprets bigscreen moments and battles with a humorous twist Players team up with famous heroes from the Marvel Comics universe to combat villains and then convert them to sidekicks after defeating them in epic boss battles The game includes a coop multiplayer mode as SpiderMan or a sidekick in locations around the globe including Tokyo Egypt and Nepal  SpiderMan Friend or Foe along with most other games published by Activision that had used the Marvel licence was delisted and removed from all digital storefronts on January 1 2014,Missing,57.75956636501832
1193702400,[31],4711,Bee Movie Game,"[5, 6, 8, 12]",As Barry B Benson players take on an adventure to save the bees production of honey through New York City Players get to experience Barrys life within the hive and navigate their way around the world from the feature film using many techniques Players can drive through the city using racecars scooters taxicabs and trucks Players can fly Barry at high speed through the sky Using the Pollinator players can Blast through obstacles or they can Buzz to cause a chain reaction Players get to Stop Time by using Barrys bee reflexes The video game features 2person multiplayer mini games,Missing,54.94715483490312
1191456000,"[2, 9, 31]",36163,Sinking Island,[6],This traditional pointandclick adventure game is a classical Who Dunnit As inspector Jack Norm you have to investigate which of the suspects might have a reason to want Walter Jones dead talk to everybody collect evidence or compare fingerprints Your PPA Personal Police Assistant a kind of inventoryrecording device helps you during your inquiries  Sinking Island can be played in two modes in realtime mode its a race against time In adventure mode you can go through each place at your own pace,Walter Jones a billionaire had planned on opening up a resort for the rich and famous but was killed before his dream could be achieved Its up to Detective Jack Norm to crack the case by interviewing the people on Sinking Island to get valuable clues,52.54479793702842
1193097600,[5],16253,Alliance of Valiant Arms,[6],AVA is a freetoplay teambased military shooter that plunges you into the middle of a world at war Fight in brutal 5 vs 5 combat across dozens of maps wielding authentic military weapons Side with the European Union EU or the NeoRussian Federation NRF to determine control of the battlefield Test your skills against your friends and see if you have what it takes to come out on top,Missing,50.0
1193702400,"[12, 31, 32]",9777,Avencast: Rise of the Mage,[6],In a world of wizardry wonder and untold mystery you must undertake some of the most diverse quests to hone your skills in spell casting weaponry and melee combat Your martial skills are soon put to the test as demonic monsters descend upon Avencast turning the academy into a state of chaos and destruction,Armed with countless combat moves and spells and a vast arsenal of equipment you must uncover the source of this evil by vanquishing an onslaught of enemies Treachery and deceit reveal themselves as the vicious army threatens Avencasts very existence Amidst the mayhem an astonishing truth unfolds which will forever change the battle scarred Wizard,50.0
