genres,id,name,platforms,rating,storyline,summary
[5],1937,Killzone: Shadow Fall,[48],69.51759699852903,Killzone Shadow Fall is set 30 years after the events of Killzone 3 Life on the Helghast home planet Helghan has been left in ruins however the war still goes on The Interplanetary Strategic Alliance ISA allows Helghast refugees to resettle on planet Vekta The Vektan and Helghast factions are living in a city which is divided by a large security wall The Helghast are fighting for their right to exist while the Vektans are fighting for survival leading to a Cold War between Vektans and Helghast The story is seen through the perspective of Lucas Kellan an agent of the elite ISA special forces branch known as the Shadow Marshals,Killzone Shadow Fall is the sixth game of the Killzone series Gameplay in Shadow Fall is fairly similar to previous installments though now with more improvements The game is much more openended allowing for multiple ways to reach your target and complete objectives The player is accompanied by a companion drone called the OWL which can help you in many different ways including deploying a zipline or stunning the enemy Using futuristic weapons and gear allows for new stealth gameplay The online multiplayer mode allows for up to 24players to battle at once on any of the games default 10 maps The level system is now challengebased where completing any of the games many challenges will upgrade your rank Warzone returns as an online game mode along with Team Deathmatch and Beacon Retrieval Capture the Flag A new feature allows for the user to create Warzones with their own specific rules and share them with the community to download and play
[14],18238,Sports Champions 2,[9],69.51010179323998,Missing,Using the PlayStation Move motion controller and PlayStation Eye players become part of the event as they use their controllers to compete in a variety of new sporting challenges Building upon the game mechanics of the first title Zindagi Games and Sonys Worldwide San Diego Studio make it easily accessible for players of all levels to jump right into the action Each of the six events will have you energized as you improve your backswing bowl a strike or perfect your left hook  Sports Champions 2 comes with six pulsepounding events including five new games and an update to the beloved Archery event from the first title The new events include Skiing Tennis Boxing Golf and Bowling offering a variety of activities that will appeal to everyone Sports Champions 2 features new game modes including Party Play a new game feature which invites you to compete with your family and friends in custom multisport tournaments It will also include beginner friendly controls without needing to calibrate for easier pickupandplay ensuring competitors of all ages can jump right in and join the fun while seasoned veterans can choose advanced modes for a greater challenge For added fun users can choose the new CreateaPlayer function to customize everything from their characters outfit to their animation and sound As you play unlock new clothing equipment and accessories to keep the creativity flowing
"[13, 15, 31, 32]",11423,This Is the Police,"[3, 6, 14, 34, 39, 48, 49, 130]",69.50636100323264,Missing,Jack Boyd beloved police chief of Freeburg has 180 days before hes forced to retire But Jack wont be going out quietly Over the next six months hell be going all out to fulfill a dream earn half a million dollars any way he can That might be play money for a corrupt cop but up until now Jack has been playing by the book Even with overtime in six months he wouldnt make fifty grand But a police chief has access to all sorts of informal income Bribes weapons and drug sales deals with the Mafia skimming off the budget kickbacks  you name it And Jack is tired of playing nice Hes is ready for anything but only you can decide how far hell go
[4],182278,MultiVersus,"[6, 48, 49, 167, 169]",69.50603004752101,Missing,MultiVersus is a platform fighter that lets you team up with or against your friends using some of the worlds most iconic characters including Batman Shaggy Superman Bugs Bunny  more Use unique coop abilities find your favorite fighter combos and save the Multiverse
"[5, 10, 31, 32, 33]",15276,Retro City Rampage DX,"[3, 5, 6, 9, 14, 34, 37, 38, 39, 46, 48, 130]",69.50389340404533,Missing,Openworld carjacking goes back to the 80s in this 8BIT nostalgic throwback Run missions Outrun the law Rampage the city with weapons powerups and vehicles  This sendup to 80s and 90s video games and popculture includes both a full Story Mode of openworld adventure as well as an Arcade Mode for quick pickupandplay action If thats not enough it also packs an interactive city full of shops minigames customizations collectibles special guest stars and more
"[12, 31]",9919,The Technomancer,"[6, 48, 49]",69.49795351578415,On the run from the Secret Police and confronted by the harsh realities of the Red Planet you must undertake a quest that takes you through tribal communities cities lost under the ice and dystopian shanties sprawled across Mars dusty embrace  Faced with the cruelty of Mars ironfist enforcers and wildlife can you survive long enough to uncover the truth behind The Technomancer,The Technomancer is a Scifi RPG set on Mars during the War of Water where an aspiring Technomancer faces a myriad of questions as his future grows threatened by the secrets of his past    An RPG The Technomancer will offer players actionoriented combat gameplay along four different skill trees focusing on 3 different fighting styles and the destructive electricfocused powers of the Technomancers But all situations arent necessarily to be dealt with brute strength with dynamic conversation dialogue playing a deep role in quests changing the story depending on the decisions you make Craft equipment weapons and armor for yourself and for the companions youll recruit along your adventure nurturing relationships with them
"[8, 15, 31, 32]",37146,Unto the End,"[6, 14, 48, 49, 130, 170]",69.48631026956414,Frigid steel drawn in anger The beast roars tearing away your strength and humanity Blood splashes on the snow Ragged breath streams from an exhausted body Your family is slaughtered You could not protect them You wake You survived Vengeance is all that remains,Unto The End is a 2D cinematic combatadventure that charts a journey of loss and vengeance told through unforgiving encounters skillful combat and stark moments of beauty Fight your way through an indifferent wilderness as you search for the creature that has taken everything from you
"[5, 25, 31]",52190,The LEGO Ninjago Movie Video Game,"[6, 48, 49, 130]",69.46965802803194,Missing,Find your inner ninja with the allnew LEGO Ninjago Movie Video Game Play as your favorite ninjas Lloyd Jay Kai Cole Zane Nya and Master Wu to defend Ninjago City from the evil Lord Garmadon and his Shark Army Master the art of Ninjagility by wallrunning highjumping and battling the foes of Ninjago to rank up and upgrade the ninjas combat skills Only in the LEGO Ninjago Movie Video Game will you experience the film across 8 action packed locations each with its own unique Challenge Dojo And with the Battle Maps play against friends and family in competitions for up to four players
[31],10610,Disney's Donald Duck: Goin' Quackers,[7],69.46859733425536,Missing,Donald Duck Goin Quackers for PlayStation is based heavily on the version on DreamcastNintendo 64 but features new graphics redesigned levels and slightly different gameplay mechanics  To save Daisy Duck from the evil sorcerer Merlock Donald Duck must utilize Gyro Gearlooses teleporter Due to a lack of power the device cant teleport Donald to Merlocks temple where Daisy is held right away Instead Donald must successively install reflector dishes at high points at Duckie Mountain Duckburg and the flying mansion of Magica De Spell before he can reach the temple
"[12, 13, 31]",102585,The Sims 4: Seasons,"[6, 14, 48, 49, 167, 169]",69.46811346790882,Now you can add and control weather events revel in fun seasonal activities and celebrate the holidays in style with The Sims 4 Seasons  Create stories for every season from sweltering summer days to icy winter nights celebrate the holidays and more  Each days forecast can have unique impacts on your Sims choices relationships and daily activities  Enjoy holiday traditions like Love Day and Winterfest or create your own custom holidays for your Sims to celebrate  Go ice skating in the winter or make a splash with a summer pool party  theres something fun to do in every season,Add weather to your Sims lives to tell new stories enjoy seasonal activities and celebrate heartfelt holidays with The Sims 4 Seasons Make the most out of the weather all year round from crisp snowfalls to sweltering heat  every world is affected by seasons in unique ways Create a winter story with ice skating befriend a magical scarecrow at the fall harvest share a spring fling during a downpour or host a summer pool party Gather friends and family to celebrate holidays complete with traditions gifts and special guests Stay warm or keep cool with allnew outfits to brave the elements Even begin a blossoming gardening career as a botanist or by crafting floral arrangements
"[5, 25, 31]",141547,Evil West,"[6, 48, 49, 167, 169]",69.46787900392133,Evil never sleeps but it bleeds A dark menace consumes the American frontier As one of the last agents in a topsecret vampirehunting institute you are the final line between humanity and a deeprooted terror that now emerges from the shadows Rise up to become a Wild West Superhero eradicate the vampire threat and save the United States,A dark menace consumes the Old West In solo or coop fight with style in visceral explosive combat against bloodthirsty monstrosities Eradicate the vampiric hordes with your lightningfueled gauntlet and become a Wild West Superhero  In visceral explosive combat unleash hell with your firearms lightningfueled gauntlet and gadgets Kill bloodthirsty monstrosities in style as a lone hunter or in coop with a friend Explore and fight in a narrativedriven campaign while upgrading your weapons and hunting tools Unlock new perks to evolve your monsterslaying mastery crafting your own playstyle to defeat the supernatural hordes
"[2, 31]",7025,Jurassic Park: The Game,"[6, 9, 12, 14, 39]",69.46086913723603,Missing,Security systems have failed and the creatures of the park roam free Now a rogue corporation will stop at nothing to acquire the dinosaur embryos stolen and lost by Dennis Nedry
[9],3455,Bust-A-Move 2: Arcade Edition,"[4, 6, 7, 13, 14, 32]",69.45882389718494,Missing,Bub and Bob are back Like in Tetris in reverse you shoot bubbles at an array of differentcolored bubbles stuck in an ever descending ceiling attempting to match them up three by three to make them disappear  This edition contains both puzzle challenges multiplayer and normal progressive stages
"[12, 31]",9179,Sword Coast Legends,"[3, 6, 48, 49]",69.45320067179904,Missing,Set in the lush and vibrant world of the Forgotten Realms Sword Coast Legends offers an allnew way to enjoy the timetested magic of playing Dungeons  Dragons as a shared storytelling experience With a deep narrative developed by a team of longtime industry veterans and a partnership with Wizards of the Coast the single player campaign of Sword Coast Legends brings the world of Faerûn home like never before    Sword Coast Legends also brings the roleplaying dynamic between players and Dungeon Masters to life with DM Mode a firstofitskind realtime experience in which Dungeon Masters guide players through unique customizable adventures In DM Mode the Dungeon Master engages players and empowers them to have fun in a way that suits the party best while creating a tailored nonadversarial 4 with 1 experience that any RPG or penandpaper fan will enjoy    As of 25 July 2018 multiplayer servers for the game were taken offline and all stored player data deleted Players owning the game on Steam will still have access to any offline content including the single player campaign
[4],39295,X-Men: Children of the Atom,"[7, 13, 32, 52]",69.4519493674389,Missing,XMEN UNLEASHED Its here Ultimate combat Mutant mayhem XPower Special moves Midair action Big characters Sizzling graphics Exactly like you played in the arcade You will need all your mutant powers all your speed all your strength for this is the ultimate combat Have you got enough to defeat Magneto Omega Red and the Sentinel Are you tough enough for Wolverine powerful enough for Cyclops cool enough for Iceman are you good enough to join the new breed of mutant heroes XMen Children of the Atom  the fighting game to end them all
"[8, 31]",2112,Mirror's Edge Catalyst,"[6, 48, 49]",69.44527784894687,Missing,Mirrors Edge Catalyst is an actionadventure game and the prequel to Mirrors Edge The story in the game explores the past of the protagonist Faith Like in the previous game the main gameplay in Mirrors Edge Catalyst involves traversing the city using parkour to reach certain objectives Unlike the linear levels in Mirrors Edge Mirrors Edge Catalyst features an openworld freeroaming environment Combat has been overhauled and emphasized compared to the first game and Catalyst no longer allows the player to use weapons instead focusing on melee attacks
[5],1916,Lost Planet 3,"[6, 9, 12, 49]",69.44305447589325,Missing,The extreme and unpredictable conditions that characterized the Lost Planet series return harsher than ever before Lost Planet 3 reveals new truths about the foreboding planet and the colonial history of EDN III  Lost Planet 3 introduces Jim Peyton a rig pilot who leaves Earth to take on a hazardous but lucrative contract on EDN III Working for NeoVenus Construction NEVEC who are preparing the planet for colonization Jim joins his fellow pioneers at the Coronis base and begins surveying the uncharted terrain and obtaining samples of the planets energy supply  Thermal Energy  With NEVECs existing Thermal Energy reserve running low the fate of the Coronis mission depends on the natural source of the energy supply being located Realizing that this is a great opportunity for a huge payoff and early ticket home to his family Jim braves the risk of the treacherous environment and threat of the indigenous Akrid  Acting as a home away from home and boasting an array of tools that can assist Jim on the field the utility rig provides Jims safety and is essential not only for his contract work but also his protection against the everchanging climate  Lost Planet 3 will deliver a diverse range of gameplay including onfoot battles and intense first person action With a number of multiplayer modes and a compelling single player experience Lost Planet 3 will delve deeper into the Lost Planet universe uncovering hidden truths within the unique and dynamic environment of EDN III
"[4, 25, 31, 32, 33]",5895,Foul Play,"[3, 6, 12, 14, 46, 48]",69.43820224719101,Missing,Play as the daemonhunter Baron Dashforth in a sidescrolling coop brawler set entirely on the grand spectacle of a theatre stage that rewards performance over pummeling Perform shattering takedowns and reversals
[12],7482,White Knight Chronicles,[9],69.43794818345444,The King of Balandor wishing to put an end to the war invites the duke of Faria to his castle to celebrate his daughters coming of age  But this celebration is sabotaged by the Magi a rogue sect seeking to steal the White Knight an ancient weapon of war sealed beneath Balandor castle in order to take over the world During the ensuing chaos a young man named Leonard accidentally unlocks the power of the White Knight as he attempts to save the princess With this power Leonard manages to fend off the Magi attack but not before they escape with the princess  With the kingdoms in chaos Leonard is entrusted with the mission to find the Magi and rescue the princess With the help of his trusted companions they travel throughout Balandor and beyond on a quest to save the princess before the Magi unlock the other knights The journey is fraught with danger with Magi warriors at every turn mythical beasts and monsters to battle and forbidden powers revealed As Leonard learns more about the power of the Knight he realizes that unsealing all of them could trigger a calamity that could end the world,White Knight Chronicles is a Japanese RPG roleplaying game which allows players to explore an expansive and exciting world of turnbased combat adventure and comradery A PlayStation 3 exclusive it was created by noted Japanese RPG game developer Level5 and features both single player and online multiplayer action the awesome power to assume the shape of the White Knight the ability to build a persistent online townlobby communication via online blogs message boards and quest logs voice chat and beautiful game environments
"[8, 9, 31, 32]",58479,Out of Line,"[6, 48, 49, 130]",69.43674176304546,Out of Line is a 2D sidescrolling puzzle platformer that follows the journey of a child named San on his quest for freedom Along the way players will guide San through many trials as he is introduced to new friends that will help him overcome different obstacles in his life At the end of his journey San will be one step closer to uncovering one of lifes greatest lessons,A unique adventure game filled with beautiful puzzles all handdrawn in an original 2D style  Out of Line follows the adventures of San in a quest to escape the Factory that was once home Dive into a story set in a mysterious world that is revealed through multiple chapters
"[5, 13]",8305,G-Police,"[6, 7, 9]",69.43291189786692,Missing,GPolice is a combat flight simulator set in an hypothetical future in which corporations lead space colonies The player is Jeff Slater a futuristic helicopter pilot which joins the GPolice to investigate his sisters death
[31],36312,Brave,"[5, 6, 9, 12, 14, 20]",69.43048308374925,Missing,Brave invites players to run jump and battle their way through the rugged landscape of mythical and mysterious Scotland By using their wits and bravery gamers will also be able to wield a sword and bow and arrow to defeat fierce enemies break a magical curse and save a kingdom
[8],7901,Croc: Legend of the Gobbos,"[6, 7, 32]",69.42651240457303,Missing,All is not well in Crocs world His friends the Gobbos have been captured by the evil Baron Dante It is your mission in this 3D platformer to search through 42 different levels to save all of your friends before its too late
"[10, 13, 14, 33]",114432,WRC 8,"[6, 48, 49, 130]",69.42202145015068,Missing,Never before has the official WRC simulation been this authentic New offroad physics on all road surfaces completely redesigned career mode dynamic weather 50 teams 14 countries 100 stages weekly challenges and the eSports mode Aim for the top in the most intense WRC experience yet
"[5, 8, 31]",1794,Ratchet & Clank Future: Quest for Booty,[9],69.4171374160967,Missing,Ratchet  Clank Future Quest for Booty known as Ratchet  Clank Quest for Booty in Europe Africa and Australia is a 2008 platform game developed by Insomniac Games and published by Sony Computer Entertainment for the PlayStation 3 The game is the sixth main instalment in the Ratchet  Clank series and the second instalment in its Future saga The game continues from where Tools of Destruction left off where Clank was taken by the Zoni and follows Ratchets quest to find him Due to its length of approximately three to four hours of playtime it was released at a lower price point than most standard retail games
"[13, 15, 16, 35]",23214,Prominence Poker,"[6, 48, 49]",69.41501141067963,Missing,Welcome to Prominence Poker a game that pits players from around the world against each otherand devious AIto build the rep prestige and bankroll needed to be and beat the best of the best
[10],1193,Crash Nitro Kart,"[8, 11, 21, 42]",69.41412367701206,Missing,Crash Bandicoot returns to the karting scene with a host of other characters from the adventure series and this time they have both Neo Cortex and Emperor Velo to worry about Velo has taken the crew to a remote planet forced to race for their lives against Neo Cortex and his many evil doers  Choose from various game modes from the straight into the action Arcade mode to Adventure mode following Crash and the gang in the story to save Earth Race against four friends in multiplayer battle modes plus connect to the Gamecube for extra options and upload your high scores to the internet ranking system
"[4, 31]",153054,Demon Slayer: Kimetsu no Yaiba - The Hinokami Chronicles,"[6, 48, 49, 130, 167, 169]",69.39436784693038,Missing,Become the blade that destroys demons  In Solo Mode follow Tanjiro through the story from the Demon Slayer Kimetsu no Yaibaanime as he faces demons in order to turn his sister Nezuko who has become a demon back into a human  In Versus Mode characters from the anime including Tanjiro and Nezuko can be freely matched against each another in a oneversusone setting with up to two players online or offline Enjoy this simple but exhilarating battle system and become the greatest demon slayer you can
"[10, 31]",78153,Burnout Paradise Remastered,"[6, 48, 49, 130]",69.37474059189847,Missing,Welcome back to Paradise City Make action your middle name as you rule the streets in Burnout Paradise Remastered Tear up the town from hectic downtown avenues to wild mountain roads Relive the highoctane stunts and wanton destruction of one of the greatest arcadedriving games ever  Burnout Paradise Remastered provides the ultimate driving playground for you and your friends to play online This remaster includes the 8 main DLC packs from the Year of Paradise including the Big Surf Island update meticulously recreated and ready to wreck
"[2, 9, 13, 31, 32]",9327,"Please, Don't Touch Anything","[3, 6, 14, 34, 39, 48, 49, 82, 130]",69.3625235977708,Missing,Please Dont Touch Anything is a cryptic brainracking buttonpushing simulation  Covering for a colleague who is taking a bathroom break you find yourself in front of a mysterious panel which only component is a red button And since youve clearly been instructed not to touch anything the only thing you want to do now is push that damn button  Push it and expect to be held liable for any unintended aftermath And there will be many
"[5, 33]",8911,Alpha Mission,"[9, 38, 46, 52]",69.36202673097233,Alpha Missions storyline is very primitive as the game was originally designed for Arcade use The player moves from level to level fighting off waves of enemies that threaten several different space stations A boss must be defeated at the end of each level in order for the player to progress to the next level Powerups upgrades and new weapons can be collected during gameplay but are all lost when the player dies,Alpha Mission is a vertical scrolling shooter that has similarities to Xevious with the use of airtoair and airtoground weapons
"[5, 15, 24, 31, 32]",19136,CastleStorm,"[6, 9, 12, 39, 41, 46, 48, 49, 130]",69.35762847290054,Missing,CastleStorm is a super genre mashup of 2D physics destruction mixed with tower defense brawler The clouds bring rumors of war Its Knights vs Vikings in CastleStorm where medieval warfare meets 2D physicsbased destruction Controlling the battle in real time players will harness the power of medieval artillery manage a fearsome ground attack and cast powerful spells CastleStorm features a storydriven solo campaign a custom castle editor online multiplayer coop modes and more Building castles and knocking them down has never been so much fun
"[31, 32]",83848,Those Who Remain,"[6, 48, 49, 130]",69.35465946849776,Missing,Those Who Remain is a psychological thriller that takes place in Dormont a small town in the US Dormont appears to be a regular and typical American town at first glance However it is cursed by a demon who shrouded everything in darkness Most of the towns population has been trapped inside the darkness with no means of escape Edward Turner is just an ordinary man with troubled past who arrives in the wrong place at the wrong time He soon finds out that something is very wrong in Dormont There are strange creatures roaming in the dark killing everyone that gets close The only way to survive is by staying in the light  The danger in the dark is not the only thing at play in Dormont There are strange portals that emanate a bright light that seem to bring anyone that goes through them to another place similar yet different apparently unreal but very real Actions taken in one place have repercussions in the other
[14],7304,FIFA Street 3,"[9, 12]",69.35409290189169,Missing,FIFA Street 3 is an arcadestyle sports game for the Xbox 360 and Xbox Live PlayStation 3 and Nintendo DS It is the third game in the FIFA Street series created by EA Sports BIG
"[5, 13, 15]",450,Operation Flashpoint: Red River,"[6, 9, 12]",69.3473313567399,Missing,Stand together with the US Marines in Operation Flashpoint Red River the ultimate tactical infantry shooter  Youll play as one of four distinct and complimentary classes in a Marine Fireteam  Grenadier Scout Rifleman and Automatic Rifleman  as you embark on an epic campaign Take on huge sandbox battlefields in the new setting of Tajikistan a geopolitical hotspot bordered by Afghanistan and China Face the unpredictable threat of allnew insurgent enemies and the might of the worlds largest Army the Chinese PLA Use authentic tactics on your own initiative in solo or in four player dropin dropout coop campaign  For extended replayability Operation Flashpoint Red River also includes new class choice loadout personalisation plus standalone coop Fireteam Engagements With a huge range of authentic weapons and the chance to call in devastating airstrikes Operation Flashpoint Red River will put you in the boots of a Marine like never before
