genres,id,name,platforms,rating,storyline,summary
"[5, 31]",3048,The Order: 1886,[48],69.04097472698281,The Order 1886 is set in an alternate history London where an old order of knights keep all of the world safe from half bred monsters who are a combination of animal and man In the games history around the seventh or eighth centuries a small number of humans took on bestial traits The majority of humans feared these half breeds and war broke out Despite the humans outnumbering the half breeds their animal strength gave them the upper hand in centuries of conflict Centuries later humanity finds new hope in King Arthur and the Knights of the Round Table King Arthur and his likeminded knights take the fight to the half breeds but Arthur soon realizes its a losing battle Through a mysterious turn of fate The Knights discover Black Water a mystical liquid that significantly extends their lifetimes and gives them remarkable healing abilities Despite this new advantage the half breeds continue to win battle after battle until the industrial Revolution turns the tide Inventors are far ahead of their time inventing technologies such as thermal imaging Zeppelins and wireless communications New weapons belch electricity ignite clouds of molten metal on top of enemies and fulfil dual functions as Fragmentation grenades and proximity mines By 1886 the war still goes on but the humans almost have martial law A new threat emerges in the form of the lower classes rebelling against the rich and the social order with the Knights supporting the welltodo upper classes and nobles The game features four main protagonists from the same squad who each has a given name and the adopted name of one of the original Knights The oldest is Sebastian Mallory the second to bear the name of Sir Percival and the descendant of Thomas Mallory who in the 1400s wrote Le Morte dArthur the definitive Arthurian Text A close friend of Grayson he is one of the best Knights in the history of the order Grayson is the third to bear the title of Sir Galahad and has battled the orders enemies for centuries He views Mallory as a mentor Lafayette as a friend and Isabeau as a potential love interest Other than that little is known about him so far Isabeau DArgyll is one of the younger Knights in the order but is much older than her appearance of being in her late twenties The latest Lady Igraine Isabeau was Graysons apprentice and if not for her commitment to the order his lover Marquis de Lafayette was a French military officer who fought in the French and American Revolutions His tactical expertise brought him to the orders attention and Mallory approached him and convinced him to join the order Although the groups youngest his globetrotting has given him a whimsical outlook on life that grounds the squad As an apprentice he does not yet bear the name of a Knight,The Order 1886 introduces players to a unique vision of VictorianEra London where Man uses advanced technology to battle a powerful and ancient foe As a member of an elite order of knights join a centuriesold war that will determine the course of history forever
[14],4988,Madden NFL 13,"[9, 12, 46]",69.0300497027975,Missing,Play and manage football matches between real NFL teams featuring the latest player lineups of 2013
"[12, 15, 24]",19163,Grand Kingdom,"[46, 48]",69.028269701406,Missing,After the fall of the onceprosperous Uldein Empire over one hundred years ago the Four Great Nations now wage war to claim dominion over the Resonail continent Battles are no longer fought by honorable knights loyal to a nation but by mercenaries who sell their services to the highest bidder  As the leader of a mercenary squad the player will lead their troops across a battlescarred continent overcoming obstacles and adversaries as they complete quests doled out by each nation In doing so they will unravel the mystery behind the downfall of a mighty empire  With an impressive battle system that combines fastpaced action with strategic planning and featuring robust character creation and customization options Grand Kingdom is a Tactical RPG the likes of which has never been seen before Assemble a squad of mercenaries form an exclusive contract with one of the Four Great Nations and participate in war with other players online for the future of Resonail  But remember in this new age of war there is only room for one Grand Kingdom
[14],5474,2006 FIFA World Cup,"[6, 8, 11, 21]",69.02817158359183,Missing,Celebrating the 2006 FIFA World Cup Germany  the worlds largest sporting event  2006 FIFA World Cup brings you to the games with the worlds superstar players 12 official stadiums that will be used at 2006 FIFA World Cup Germany and stadiums from each qualifying region Gamers can play as their favorite team from qualification right through to a virtual reproduction of the tournament in Germany  In addition to enabling gamers to participate in the 2006 FIFA World Cup Germany by taking control of one of 127 national teams the game features new compelling modes of play including the Global Challenge that recreates classic moments in FIFA World Cup history Furthermore the game supports up to eightway multiplayer matches and boasts a plethora of ingame unlockable content such as legendary players and exclusive apparel
"[12, 31]",32699,Paranormal Activity: The Lost Soul,"[6, 48, 163, 165, 384, 385, 386]",69.02774897875744,Missing,Engineered from conception for VR PARANORMAL ACTIVITY THE LOST SOUL immerses you in a terrifying realistic environment with haunting atmosphere and the need to survive With very limited guidance your freemovement enables you to discover the secrets that lie in this house of horror
"[5, 8, 31, 32]",140801,Fashion Police Squad,"[6, 48, 49, 130, 167, 169]",69.02296213386717,Calling all officers Ive got a Fashion Crime in Progress and Im mobilizing all Fashion Police Squad members Grab your Belt of Justice and your Tailormade Sewing Machine weve got some Fashion Justice to dispense,Fashion Police Squad is a humorous retro FPS where you fight against fashion crime using attire enhancing weaponry Clean the streets off of socks in sandals as Sergeant Des and experience a single player story full of fabulous characters dazzling encounters and fierce runway shows
"[8, 31, 32, 33]",11342,Woah Dave!,"[3, 6, 14, 37, 39, 41, 46, 48]",69.02054675777303,Missing,From the folks behind the BITTRIP series comes the frantic insanity that is Woah Dave Help our hero Dave Lonuts survive an insane alien invasion and line his pockets with shiny pennies  Hurl alien eggs skull bombs and explosive WOAH blocks to stay alive and sky rocket yourself to high score fame and fortune  The Steam and PS4 versions of Woah Dave also feature a local twoplayer competitive mode where two Daves can go headtohead in a battle to collect the most coins We arent exaggerating when we say it could very well result in ruined friendships and unsalvageable marriages Competitive games are good like that  If that isnt enough Dave for you theres also Bonkers Mode with more aliens more lava and more chances to get killed Those who brave the storm will be rewarded with a splendor of precious coinage those who fail will be revoked of their License to Dave  Good luck and may the best Dave win
[7],2678,Band Hero,"[5, 8, 9, 12, 20]",69.0167230631472,Missing,Band Hero is a spinoff video game as part of the Guitar Hero series of music rhythm games released by Activision on November 3 2009 for the PlayStation 2 PlayStation 3 Xbox 360 Wii and Nintendo DS consoles The game is structurally similar to Guitar Hero 5 and supports full band play lead and bass guitar drums and vocals including the dropindropout and insong instrument and difficulty change menus and additional multiplayer modes as Guitar Hero 5 The console versions use instrumentshaped game controllers while the DS version uses either the Guitar Grip introduced with the Guitar Hero On Tour series or a new Drum Skin that comes with the game Like previous games virtual avatars of Taylor Swift Adam Levine and the band No Doubt are presented in the game  Band Hero received mixed reviews from journalists Some considered the game to be an appropriately flavored version of Guitar Hero 5 for the Top 40 pop rock hits while others felt the game was strictly aimed at teenagers They also contested the cost of the full game featuring only 65 songs compared with 85 songs in Guitar Hero 5 and considered if the content would have been better in downloadable form A day after the games release the band No Doubt sued Activision citing similar misuse of their avatars as the Kurt Cobain avatar in Guitar Hero 5
"[5, 31]",1160,Tomb Raider: Chronicles,"[6, 7, 9, 14, 23, 38, 46]",69.01305217542361,Tomb Raider Chronicles opens just days after the events of The Last Revelation Lara is still missing and presumed dead Lara Croft is missing in Egypt  presumed dead Those closest to her gather together at the Croft Estate on a grey rainy day for a memorial service in her honour Afterwards the friends sit quietly together in the study of the Croft Mansion and reminisce about Laras past exploits that have until now remained a secret,Tomb Raider Chronicles is the fifth game in the Tomb Raider series and the sequel to Tomb Raider The Last Revelation It was developed by Core Design and published by Eidos Interactive Like its predecessors Tomb Raider Chronicles is an action game with puzzlesolving and platforming elements The gameplay is very similar to that of the previous games with the addition of a few new skills Lara can now walk on tightropes swing on horizontal bars and somersault forwards from a ledge while crouching A grappling hook has been added to her inventory The game also includes a level editor allowing the player to create new stages for Lara to explore
"[12, 31]",169994,Asterigos: Curse of the Stars,"[6, 48, 49, 167, 169]",69.00565285632533,Discover the long forgotten secrets and hidden paths in this high fantasy world featuring exhilarating battle encounters interconnected maps full of places to explore and an immersive story where every choice matters Play as Hilda  a brave young warrior from the Northwind Legion who embarks on a journey to the cursed city in order to save her lost father The gameplay elements inspired by soulslike games alongside a lighter dynamic combat system create a fresh take on the modern action RPG genre providing you with a harmonious difficulty and exploration balance,Embark on a journey full of danger in this action RPG inspired by Greek and Roman mythologies Explore the breathtaking city of Aphes and forge your way through legions of unique foes and mythical bosses to discover the truth behind the citys curse
"[8, 9, 15, 31, 32]",7897,Chariot,"[6, 9, 41, 48, 49]",69.0,Cariot is the story of a princess whose task is to lay her fathers remains in his final resting place With the help of her fiancé she has to take this heavy chariot holding the kings remains through underground mazes in order to reach a sepulcher fit for His Majesty  However the kings ghost bound to the chariot has quite a temper and insists that he be buried with vast amounts of riches As the couple progresses tunneling deeper and deeper underground theyll have to stray off the main path to get their hands on precious gems,Chariot is a humorous physicsbased couch coop platformer in which a brave princess and her suitor carry a funeral wagon through ancient caves They must fend off swarms of looters while amassing riches to bury the Kings remains in a worthy goldfilled tomb If only that dead King would keep quiet  The Chariots large wheels and long tethers allow the heroes to reach higher ground swing across chasms and perform all sorts of impressive maneuvers Extract riches from the very walls of the caves in multiple environments and make your way to the exit by avoiding envious looters or by beating them back as they attempt to steal your hardearned loot With skilltesting coordination mechanics and thrilling physicsbased stunts required Chariot will definitely please couch coop enthusiasts as teamwork and cooperation unlocks new possibilities
"[10, 14, 31, 33]",4007,Midway Arcade Treasures,"[6, 8, 11, 21]",69.0,Missing,Midway Arcade Treasures is a collection of 24 arcade games developed by Digital Eclipse and released by Midway for the GameCube PlayStation 2 Xbox and PC  Midway followed up the Arcade Treasures with successive compilations featuring different games Midway Arcade Treasures 2 Midway Arcade Treasures 3 the portable Midway Arcade Treasures Extended Play and the Windowsexclusive Midway Arcade Treasures Deluxe Edition  After Midways bankruptcy Warner Bros owns the rights and released another arcade compilation called Midway Arcade Origins for the PlayStation 3 and Xbox 360 which includes 29 select games from Volumes 1 and 2 plus Super Off Road from Volume 3 It also contains Vindicators Part II which replaced the original Vindicators from Midway Arcade Treasures
[14],3957,International Superstar Soccer 2,"[8, 11, 21]",69.0,Missing,ISS 2 is the latest offering from the creators of Konamis successful International Superstar Soccer series Its arcade style gameplay is based on realistic and intuitive football action and ISS 2s fluid and detailed style allows the gamer greater scope for their flexing virtual football talent with the open gameplay ensuring that no two goals or buildup play will be the same With more than 50 international teams and a wealth of game modes ISS 2 is huge Featuring real player names thanks to the FIFPro licence the game allows players to step into the boots of their favorite players to tackle dribble and score their way to glory on every next generation platform
[25],3837,Buffy the Vampire Slayer: Chaos Bleeds,"[8, 11, 21]",69.0,Missing,Buffy and the crew are back for another battle against evil On this occasion set as a missing episode from the TV series fifth season the powerful vampire Kakistos and The First are ready for war and the only ones standing in their way is Buffy the Vampire Slayer and her friends Willow an at times powerful witch Faith a fellow Slayer Spike former evil vampire turned slightly good and Xander caught in the middle of his best friends work  You get the chance to play as each character during the game as you slay vampires solve puzzles and collect items along the way to prepare you for the final showdown Various other characters from the show appear to help you out while some are out to hurt you big time  Multiplayer options are also included for up to 4 players Go rabbit hunting in Bunny Catch be the last person standing against wave after wave of vamps in Survival or battle for control of the arena in Domination
"[5, 8, 31]",1791,Ratchet & Clank: Size Matters,"[8, 38]",68.99879321448647,Missing,Ratchet  Clank Size Matters known as Ratchet  Clank 5 in Japan is a 2007 platformer video game developed by High Impact Games and published by Sony Computer Entertainment for the PlayStation Portable and PlayStation 2 The game is the first Ratchet  Clank title on the PSP handheld Development company High Impact Games was spawned from the original Ratchet  Clank developer Insomniac Games The story is about Ratchet and Clank as they are interrupted from their vacation to search for a kidnapped girl and encounter a forgotten race known as the Technomites
"[12, 31]",7265,3D Dot Game Heroes,[9],68.98903010213795,The game follows a hero on a quest to rid the Dotnia Kingdom of a dark plague caused by the forces of evil in order to restore peace to the land Legend tells of an evil king known as the Dark King Onyx who brought tragedy and darkness to the kingdom by stealing six magical orbs However a hero rose up against the Dark King and with his legendary sword as well as the power of the orbs he sealed Onyx away within another orb However the forces of evil rose again as the Dark Bishop Fuelle stole the orb and threw the Kingdom of Dotnia into a state of chaos once more The games main protagonist is the grandchild of the brave hero who sealed away the Dark King and thus is entrusted with the responsibility to save the land  The kingdom was once a 2D pixelated world but as the King of the Land felt that sprites were outdated he thus decreed for the kingdom to make the switch to 3D This caused the entire world to become 3D while still retaining its original pixelated look,3D Dot Game Heroes is an action adventure title paying a strong homage to 8bit adventure games such as The Legend of Zelda and Final Fantasy Adventures The game uses a unique style presenting 2D retrostyle graphics in a 3D environment using voxels
[5],82435,Resident Evil: Revelations 2 - Episode 1: Penal Colony,"[6, 9, 12, 48, 49]",68.96414844794879,Missing,Resident Evil Revelations 2 follows two interwoven stories of terror across 4 episodes of intense survival horror  Episode One Penal Colony Kidnapped by a unknown group of assailants Claire and Moira awake to find themselves trapped on an isolated island infested with horrifying creatures beyond imagination Now they must desperately struggle to escape the horror  Episode One includes Raid Mode for countless additional hours of gameplay
"[9, 13, 31, 32]",19167,Asemblance,"[6, 48, 49, 130]",68.95846825200701,Missing,You wake to find yourself trapped inside an experimental machine A machine built to simulate memories You have no idea how you got here  But to break the cycle you must look into a past that you may not want to remember   Asemblance is a singleplayer firstperson psychological thriller
"[11, 13, 15]",283,Theme Park,"[6, 7, 13, 14, 16, 19, 29, 32, 50, 58, 62, 78, 114]",68.95820777888217,Missing,You have inherited a fortune from an eccentric aunt and her will states the money can be spend building the world largest and most profitable theme park  Create a wonderful theme part full of thrilling rides and greasy  but delicious  food and start to make the loads of money You are a lucky one who can create the best theme park ever made plus make a fortune  Your park will be compared to 40 rivals all over the world every year Your goal is to become the best park in all categories
"[4, 14]",5836,Fight Night Round 3,"[8, 9, 11, 12, 38]",68.95775455481031,Missing,EA Sports Fight Night Round 3 from EA Chicago lets you make your own fighter train them up and literally take on the world  Start by creating your own champ and customizing how they look what equipment they have their fighting style their weight class their signature move and even their own illegal hit Get equipment and trainers for your fighter to enhance his look and performance  Then take your fighter to career mode where youll play fight your way up from the local gym all the way up to fivestar venues Get trainers to enhance your training and boost your speed and power Play against randomly generated fighters all the way up through the ranks till you beat them in points or to a pulp Certain fights may get you a bit of extra money as an incentive or give you a promotional deal but pick your fights carefully because strategy inside the ring wont matter if you mismanage your fisher outside  Fight smart during the fight by using the total punch control system to throw the punches you want to by using the analog stick The total punch control system maps your fists to the analog stick getting rid of the need for senseless button mashing
"[9, 31]",20602,Naruto: Uzumaki Chronicles,[8],68.95224629619625,Missing,Naruto Uzumaki Chronicles introduces a lush 3D world that will test the players Ninjutsu skills as Naruto the feisty orphan who wants to become the most respected and admired ninja of all time A brand new story drives the missions as players experience the trials and tribulations of a ninjaintraining  fierce competition from fellow students and constant challenges from their teachers Players can collect statusboosting chips and plates to customize all aspects of Narutos abilities and faceoff against multiple enemies using either close combat moves or longrange weapons like shurikens and explosive cards With familiar characters like Kakashi Sasuke and Neji that can swoop in for assistance Naruto Uzumaki Chronicles offers minigames and lethal attacks straight from the popular anime series to satiate any aspiring ninja
"[5, 12, 13, 31, 32]",10239,Ark: Survival Evolved,"[3, 6, 14, 34, 39, 48, 49, 130, 170]",68.95097308371257,Missing,Ark Survival Evolved takes on the survival genre with a unique blend of emergent multiplayer cooperation and competition Players awake naked and starving on the beach of a mysterious island among a herd of other confused humans On ARK they must then hunt harvest craft research technology and build shelters to protect against scorching days freezing nights volatile weather systems dangerous wildlife and potential enemies  Use cunning strategy and tactics to tame and ride the many dinosaurs and other primeval creatures roaming the dynamic persistent ecosystems across land sea air and even underground Build your characters strengths and gain items skills and pet creatures using indepth roleplaying systems Start a tribe with hundreds of other players to survive and dominate competing tribesand ultimately discover the ARKs true purpose
[15],43617,Yu-Gi-Oh! Capsule Monster Coliseum,[8],68.94956588065506,Missing,This 3D board game consists of a series of duels which are played with cards The game has been split up in a Campaign Mode in which you take on all levels of the Monster Coliseum on your own a Free Battle Mode where you play skirmish matches against enemies defeated in the campaign and a versus mode to take on a human opponent Before starting you have to choose a symbol assign parameters to it based on monster points action points and power points and buy a starter kit card deck  In a typical campaign game you start in the entrance hall where you manage your cards and monsters To duel you choose one of the four areas with five levels each and defeat the opponents New monsters are acquired by winning the match The turnbased duels are played as a card game Both characters start with a deck of cards and a number of health points When a health status reaches zero the battle is over You attack your opponent by summoning monsters and assigning abilities to them Trick cards can be used to gain both offensive and defensive advantages Before each duel you have to pick a monster that is up for ante and the fighting is influenced by various parameters including the land form you are playing on
[5],1405,Hawken,"[6, 48, 49]",68.94541852393365,Missing,War is a Machine Pilot hulking death machines and use massive weaponry to destroy your foes in fastpaced FPS gameplay  Hawken is a multiplayer first person shooter that places you inside a mechanized war machine on the battlefield of a dystopian world With tactical fastpaced gameplay in customizable and upgradable mechs across multiple competitive modes Hawken is explosively fun
"[25, 31]",1222,Knights of the Temple: Infernal Crusade,"[6, 8, 11, 21]",68.94307459057129,An evil Bishop has abducted Adelle a mysterious young woman with divine powers With his entourage of disciples and their captive Adelle he embarks on an Unholy crusade moving along the initial routes of the historic crusades,An actionadventure role playing game from the developers behind Chronicles of Riddick and The Darkness The game was never released outside Europe
"[5, 9, 10, 31, 32, 33]",8063,Retro City Rampage,"[5, 6, 9, 12, 37, 46]",68.94180215683906,Missing,Retro City Rampage is a downloadable actionadventure video game for WiiWare Xbox Live Arcade PlayStation Network and Microsoft Windows developed by Vblank Entertainment It is a parody of retro games and 80s and 90s pop culture as well as Grand Theft Auto and similar games It was released on October 9 2012 for PlayStation 3 PlayStation Vita Microsoft Windows on January 2 2013 for Xbox Live Arcade and on February 28 2013 for WiiWare Retro City Rampage was the last original game released for the WiiWare service globally until Deer Drive Legends was ported to the service the following November
"[12, 15, 16, 31, 35]",77176,The Lord of the Rings: Adventure Card Game,"[3, 6, 14, 34, 48, 49, 130]",68.92047568695789,Something stirs within the shadows across Middleearth Who will raise their light against the spread of this darkness Who will stand against the unknown danger that creeps ever closer To where shall we look for heroes,Choose your Heroes build your deck and face the dark forces of Sauron in The Lord of the Rings Adventure Card Game Battle Uruks spiders orcs and more as you journey through the world of Tolkeins fantasy earning cards and devising new tactics along the way Armed with your fully customizable 30card deck you will lead a band of three heroes through campaigns reaching the darkest corners of Middleearth Guide your own fellowship through quests that will test your leadership tactics knowledge and spirit
"[13, 14]",26772,NBA 2K18,"[6, 9, 12, 39, 48, 49, 130]",68.91964270526172,Missing,The highest rated annual sports title of this generation returns with NBA 2K18 featuring unparalleled authenticity and improvements on the court
"[8, 12, 31, 32, 34]",116705,Liberated,"[6, 48, 49, 130]",68.91733871155456,Missing,Players will experience a story about a world where government authorities use advanced technology to manipulate the population Civil rights are a thing of the past with the government engaging in complete surveillance of every citizen in the world Social media activity online payments and GPS location tracking from mobile devices are just some of the ways every single person is being monitored In this world there are insurgents resisting this oppression fighting for their freedom while government agents try to maintain order and control In Liberated players will experience both sides of this conflict with every choice they make changing the course of the story
