genres,id,name,platforms,rating,storyline,summary
"[5, 10, 12, 31, 32]",99302,Rustler,"[6, 48, 49, 130, 167, 169]",69.99960854386036,Rustler is an openworld topdown action game paying tribute to the good old GTA style and gameplay fusing it with a historically inaccurate medieval setting Play as The Guy whose parents apparently were too lazy to give him a proper name Experience feudal injustice inquisition witchhunting and join The Grand Tournament Meet valiant yet incredibly stupid knights Complete a wide variety of twisted missions and quests or dont give a damn about the plot and bring mayhem in the villages and cities Choose to go on foot or by a stolen horse Fight with a sword or pick a fancy automatic crossbow All that spiced up with an inappropriate Monty Python inspired sense of humor  Rustlers world is filled with humor anachronisms and pop culture references Ever been towed for parking in a NO HORSE ZONE Wanna do some cage fights in Medieval Martial Arts Arena Or maybe pimpahorse a little How about joining the RoundEarthers sect  As a poor peasant you really need to get creative in order to win the Grand Tournament Form weird alliances doublecross your foes and dig up dinosaur skeletons in a light easytounderstand and hardtoempathizewith story,Become a medieval thug in a crazy openworld action game full of popculture references Complete insane quests kill heroes steal horses fight guards rob peasants and more All packed in oldschool gameplay style
"[13, 31, 32, 33]",118357,Tools Up!,"[6, 48, 49, 130]",69.99789601919038,Missing,Gather up to 4 players for this fun couch coop experience for people of all skills Renovate the apartments in the mysterious skyscraper while the tenants are away Be sure to follow their wishes left behind on the blueprints Tear off wallpapers bring down walls bust down doors and cover the floor with vibrant carpets and panels  just be sure to do it in time and clean up after yourself
[12],1206,Tales of Legendia,[8],69.99760333677371,Missing,Tales of Legendia is a fantasy roleplaying game that continues the Tales series of games You can play as Senel Coolidge who encounters a giant mysterious ship while adrift in a small boat with his sister As you explore the history of the ship you will encounter epic enemies and engage them using the XLiMBS battle system which lets you fight in real time like in a fighting game The story is beset with unique characters designed by the animator featured in Kill Bill Vol One
"[10, 31]",234256,The Crew: Motorfest,"[6, 48, 49, 167, 169]",69.99759799524212,Missing,Welcome to Motorfest Join a oneofakind festival and enjoy the best experiences car culture has to offer in a beautiful Hawaiian open world
"[2, 7, 9, 31, 32]",119324,When the Past Was Around,"[6, 14, 34, 39, 48, 49, 130]",69.99504608016255,This is the story of Eda a girl in her early 20s Like anyone in her age shes lost She lost her way in the journey to achieve her dreams She lost her way in the journey to find love  That was until she met The Owl  The man that would help her burn her passion the man that would help her find the spark in a relationship and also the man that would teach her about heartbreak,When the Past was Around is an adventure pointandclick puzzle game about love moving on letting go and the joy and pain of everything in between
"[12, 31]",11310,SaGa Frontier,"[7, 9, 38, 46]",69.99427872987803,Missing,Enter a vast frontier where seven quests are taken one hero at a time  A wizards dark destiny a womans revenge even a robots search for his soul Seven amazing adventures that weave into one  yours
"[13, 15, 32]",150512,Two Point Campus,"[3, 6, 14, 48, 49, 130, 167, 169]",69.99368319463285,Its time to spin academia on its head Got a yearning for learning Or just keen to build an educational masterpiece Campus is jampacked with new creative tools to help you build the university of your dreams  For the first time build in the great outdoors as you develop your own delightfully educational campus environment housing the top teaching facilities in the land Whether you prefer building on simple foundations or placing every tree you can build the university you want  Lay down pathways with new easytouse tools Plant glorious collections of outdoor flora Place benches fountains sculptures hedgerows  even picket fences The only limit is your imagination and your ingame bank balance,Build the university of your dreams with Two Point Campus the follow up management sim with a twist from the creators of Two Point Hospital Get to know your students explore their personalities and fulfill their wants and needs Craft buildings choose courses hire the best staff and build an academic institution to stand the test of time
[7],37067,Just Dance 2018,"[5, 9, 12, 41, 48, 49, 130]",69.9925782361292,Whether youre a party starter a dancer in the making or a seasoned pro get ready to turn up the volume and unleash your inner dancer with Just Dance 2018    Dance to 40 of the hottest tracks including 24K Magic by Bruno Mars Side to Side by Ariana Grande Ft Nicki Minaj Despacito by Luis Fonsi  Daddy Yankee Swish Swish by Katy Perry Ft Nicki Minaj Naughty Girl by Beyoncé and many more,No matter where you come from how old you are if you are a panda or a carrot turn up the volume and get ready to unleash your inner dancer because Just Dance 2018 brings out the dancer in everyone The biggest music video game franchise of all time with over 63 million units sold is coming back this fall Whether you are a party starter a young dancer in the making or a pro dancer looking for new challenges its never been so easy to Just Dance
"[4, 25]",18941,Ninja: Shadow of Darkness,[7],69.99250193566145,Missing,Ninja is a fastpaced arcade style actionadventure The game features highly detailed environments a wide range of special effects and huge endoflevel bosses  Assuming the role of the young ninja Kurosawa you must guide him through a series of progressively difficult environments The Ninja is able to collect magic potions scrolls extra lives energy and weapons throughout the levels to help him on his quest
"[4, 14]",4093,Rocky,"[8, 11, 21]",69.99075262960537,Missing,Based on the famous movie series of the same name about good boxer Rocky Balboa played by Sylvester Stallone  The boxing simulator game has several modes including Movie Mode Exhibition and Knockout Tournament In Movie Mode you can follow the movie series starting each part with three minor opponents and finishing the big boss in the end Each character has personal weaknesses Also you can train Rocky prior to each fight
"[8, 9, 31, 32]",105680,Phogs!,"[6, 48, 49, 130, 170]",69.99067502504366,Missing,In Phogs you play as a duo of dogs on a captivating puzzlefilled adventure Linked by a stretchy belly youll need to bark bite and bounce your way through obstacles set across the themed worlds of Food Sleep and Play in coop or singleplayer  Forage through Food World teeming with tasty treats From hot buttered toast to chopped celery even a river of chocolate  Stroll through Sleep World complete with teddy bears cushions and quilts all nestled in the glow of the soothing nightlight  Pounce through the crazy toybox of Play World exploring a beach amusement park a retro arcade and everything in between Woof  Supporting singleplayer and sharedcontroller gameplay plus local and online coop Red and Blue are always ready to play
"[12, 13, 15, 31, 32]",88130,Nexomon,"[3, 6, 14, 34, 39, 48, 49, 130, 167, 169]",69.99004975124377,Missing,Catch evolve and collect over 300 unique Nexomon Assemble the ultimate Nexomon team to save your friends and save the world Clash against legendary champions and become a hero in this epic journey
[15],45232,Asterix: The Gallic War,[7],69.98958273270677,Missing,Asterix The Gallic War is a lighthearted actionstrategy hybrid game featuring the popular Asterix comic book characters You play as Asterix Obelix and the rest of the Celtic Gaul army as they war with the Romans led by Caesar who have seized all but one territory from the Gaul Empire After gathering your army you must capture lands adjacent to yours
[14],45581,FIFA Soccer 96,"[7, 13]",69.98834343648984,Missing,FIFA Soccer 96 is an entry to the FIFA series of video games and was developed by Extended Play Productions and published by Electronic Arts Though it was not the first FIFA game both FIFA Soccer 95 and FIFA International Soccer had come before it FIFA 96 is often considered the first truly successful FIFA game and opened the doors to annual sequels that continue to this day It was released for the Sega Mega Drive Sega 32X and Sega Game Gear with a different version of the game being released on the Sega Saturn
"[5, 31, 33]",5454,Space Ace,"[9, 13, 14, 16, 19, 50, 52, 62, 63, 75, 78, 115, 117, 159, 410]",69.9874290621079,Missing,In Space Ace you play the heroic Ace who must stop the evil Commander Borf from taking over the Earth Borf plans to reduce all of humankind to infants and take over the planet
[5],5583,Earth Defense Force 2017,"[12, 46, 49]",69.98731515656318,Missing,An arcade style TPS which in 53 levels pits you against giant ants giant spiders giant robots and UFOs Luckily for you the game has an arsenal of over 150 different weapons and 4 different vehicles all collectible throughout the game And dont forget every building is destructible And how
"[9, 31, 32]",59252,Darkestville Castle,"[3, 6, 14, 34, 39, 48, 49, 130]",69.98651375605289,Missing,Like any decent demon Cid spends his nights performing all kind of evil deeds to the peaceful people of Darkestville Little does he know that his old arch enemy is about to change his life forever
"[9, 13, 31, 32]",105629,The Shapeshifting Detective,"[6, 14, 39, 48, 49, 130]",69.98626432133042,Dorota Shaw is dead And the prime suspects are three tarot readers with the uncanny ability to predict murder  or commit it Its your job to find out what else they know  but they wont reveal their dark secrets to just anyone Luckily you can be anyone you want to be Even the next victim,The Shapeshifting Detective is a supernaturalnoir murder mystery FMV game where you play as a detective who can shapeshift into other characters allowing you to unlock secret conversations and private encounters
"[31, 34]",18018,Never 7: The End of Infinity,"[6, 8, 14, 23, 34, 38, 39]",69.98570451861521,Missing,Never 7 The End of Infinity is the first title in the Infinity series and is followed by Ever 17 The Out of Infinity Remember 11 The Age of Infinity 12Riven The PsiCliminal of Integral and Code_18  In the game the player takes the role of Makoto Ishihara a college student who attends a seminar camp on an island together with three other students he also befriends three other people who he meets on the island The game takes place over the course of a week and consists of the player reading the story occasionally making choices that affect the direction of the plot on the sixth day one of the female characters dies and the game moves back in time to the beginning letting the player use knowledge from the first set of six days to make new choices to try to prevent the characters death
"[8, 10, 31, 32]",13167,JumpJet Rex,"[3, 6, 14, 48, 49]",69.98468677611841,Missing,JumpJet Rex is a punishing old school 2D platformer where players take control of a Tyrannosaurus Rex with extraterrestrial jump boots to save dinokind from extinction by a giant asteroid  As Rex players will jump drop and dash through more than 40 challenging levels and race against the clock to not only preserve life during the Mesozoic era but also prove their platforming prowess against other dino enthusiasts  Players can explore the galaxy and unlock new worlds alone or team up with a friend in coop mode where players will need to coordinate movements to get past challenges
"[5, 8, 31, 32, 33]",17828,20XX,"[6, 48, 49, 130]",69.98331744485414,Missing,20XX is a coopfriendly action platformer roguelite Explore procedurally generated levels collect new weapons and abilities purchase upgrades and crush ferocious bosses If you are a fan of roguelikes or Mega Man 20XX is for you
"[13, 14]",8836,NBA 2K7,"[9, 12]",69.98283109578924,Missing,NBA 2K7 is a basketball simulation video game developed by Visual Concepts and published by 2K Sports It is the eighth installment in the NBA 2K franchise and the successor to NBA 2K6 It was released in September 2006 for Xbox Xbox 360 PlayStation 2 and PlayStation 3 Shaquille ONeal is the cover athlete of the game NBA 2K7 is the predecessor to NBA 2K8 in the NBA 2K series  The game strives to simulate the experience of the National Basketball Association and attempts to be as realistic as possible Players play NBA basketball games with real life teams in a variety of game modes Players may customize the gameplay as well as the players and can take control of an NBA team as the general manager hiring coaches and making a profit The game features all the main aspects found in the NBA such as commentary realistic crowd animations and halftime shows The games overall gameplay as well as the aesthetics was said to have been significantly improved before release  NBA 2K7 received a positive reception upon release A lot of praise was directed at the games overall presentation some critics called the visuals gorgeous while others said it was spectacular and achieved great visual feats Most other praise was directed at the games improved gameplay as well as the depth and wealth of content Some negative comments were made concerning the models and animations of the players
"[5, 9, 31]",27019,Resident Evil 7: Biohazard - Banned Footage Vol. 2,"[6, 48, 49]",69.98250514827505,Missing,In this DLC this newly unearthed footage exposes further secrets from the dark past of the Baker family
"[9, 10, 13, 14]",7451,MotoGP 14,"[6, 9, 12, 46, 48]",69.9822018525697,Missing,The official video game of the MotoGP hits the track with all the riders from the 2013 and 2014 seasons as well as legendary champions from the history of the MotoGP Race on all the official tracks and take on your adversaries on the brand new Argentina circuit Put yourself to the test with new game modes including online Split Battle and offline Real Events 2013 not forgetting the compelling career mode MotoGP14 has been completely overhauled thanks to the new graphics engine that gives players the opportunity of experiencing all the thrills of being a real MotoGP rider
"[9, 31]",31120,Lost Grimoires: Stolen Kingdom,"[3, 6, 14, 48, 49]",69.98174071819842,Missing,Master alchemy to heal the kingdom
"[13, 14]",814,NHL 2001,"[6, 7, 8]",69.98156548040532,Missing,In NHL 2001 there are five primary game modes exhibition season where players can take a team through a full season and act as the teams general manager tournament involving up to 16 teams playoffs also a 16 team format and shootout where gamers play out the tie breaker format used in international hockey Outside of the season and playoff modes NHL 2001 allows gamers to use a total of 18 international teams and four allstar teams  Several new features have been added to the mix including Big Hit and Big Shot buttons for enhanced gameplay Also new to gameplay is The Momentum Meter where a teams performance is affected by the games momentum Finally similar to the Madden Challenge offered in EAs football title NHL 2001 offers NHL Challenge Mode Here players are rewarded points for achieving certain tasks during gameplay These points can then be used to enhance the abilities of created players
"[2, 9, 31]",20636,Agatha Christie: Murder on the Orient Express,"[6, 48]",69.98014986303386,Missing,The worldfamous mystery novel Murder on the Orient Express by Agatha Christie comes alive in this allnew exciting video game adaptation Murder on the Orient Express is filled with spectacular twistsandturns and also includes a surprise ending that is different from the original novel  Aboard the historic Orient Express as Antoinette a new character introduced in the game you must help the famous Belgian detective Hercule Poirot solve the puzzling murder of Mr Ratchett Is the victim really who he claimed to be What motive would any of the passengers have that would bring them to commit this heinous crime  Its up to YOU to find out
[5],129877,Fortnite: Season 3,"[6, 48, 49]",69.98009950248756,Missing,The storyline began around this season with players spotting a comet later revealed to be a meteor in the sky Many players speculated that the meteor would hit and destroy Tilted Towers and it did destroying one of the central buildings by a small meteor As Season 4 begins a big meteor got rid of Dusty Depot and turning it into Dusty Divot  The games user base increased around this season
"[12, 15, 31, 36]",5607,Smite,"[6, 14, 48, 49, 130]",69.97872204065209,Missing,Smite is the online battleground of the gods Players choose from a diverse cast of deities and use their unique powers to triumph over the opposition in 5v5 team matches Smite is a new take on the MOBA genre rather than observing from above the action the games third person perspective puts players into the thick of combat Instead of clicking the mouse to move players use the familiar WASD keys to move and fight their way through Smites dynamic battlegrounds
"[9, 15]",6377,Diner Dash,"[5, 6, 9, 12, 14, 20, 38, 55]",69.97777728393964,Missing,Diner Dash a popular PC actionpuzzle game has landed on the WiiWare service Guide Flo an office workerturnedrestaurateur as she builds up her empire over four unique diners Go online to face players in headtohead If you feel up to the challenge join up with a friend or another player online for a Team Dash game where your team will take on six other players to see whose diner is the best in town Broadband Internet access is required for online play  Players take direct control of Flo as she runs around to seat patrons take orders deliver food take payment and bus tables as efficiently as possible within the time allowed Players who are fond of traditional control schemes may also use a pointandclick style with hotkeys to aid Flo in her quest for customer satisfaction which is reflected in a heart meter that empties as customers lose patience If the meter empties completely then the customer will leave the restaurant
[31],36834,Little Nightmares: The Depths,"[6, 48, 49]",69.97764457733214,Missing,The first of 3 DLCs that follows a new character The Runaway Kid during the events of the main game  Others lead the escape but the Kid drops down into the Depths of the Maw Little does he know that this murky place is home to The Granny  abandoned to decay and rage she will let noone go He must struggle on if he wants to survive leap from floating debris to avoid being pulled into the treacherous waters and find a way to create a path through the depths
"[8, 31]",19940,Pac-Man and the Ghostly Adventures,"[6, 9, 12, 37, 41]",69.97664006229317,Missing,Pac is back in an allnew experience for a whole new generation of fans Featuring an original storyline inspired by the show as well as all the charming characters from the highly anticipated PACMAN and the Ghostly Adventures animated series created and produced by Avi Arad acclaimed director and
"[5, 8, 12, 31, 32]",112185,Fury Unleashed,"[3, 6, 14, 39, 48, 49, 130]",69.97577988761867,Missing,Fury Unleashed is an action platformer where you shoot your way through the pages of an everchanging comic book Take advantage of unique combo system to unleash your fury and become a whirling tornado of destruction Discover why your creator doubted you and prove him wrong  Your guns are your best friends and ink is your most valuable resource  collect it from defeated enemies to permanently upgrade your hero The more dynamic and brave your play style the greater the rewards But remember to stay focused at all times or you will die sooner than you think and lose everything you looted on your way
[14],4987,Madden NFL 12,"[9, 12]",69.97570252703456,Missing,Play and manage football matches between real NFL teams featuring the latest player lineups of 2012
"[8, 9, 31, 32]",3026,Nihilumbra,"[3, 6, 14, 34, 39, 41, 46, 48, 130]",69.97561257846758,Nihilumbra follows the story of Born who was created from the Void the nothingness When he abandons it and appears in the world he sets up on a long journey where he will learn how to use the colours around him grating him powerful abilities The Void from which Born escaped reclaims him and it will never stop chasing him devouring everything on its path As Born runs for his life he condemns the beautiful places he visits as the Void makes them vanish forever,Nihilumbra is played as a standard platform game by controlling Born as he walks and jumps across the games levels There are multiple enemies that the player needs to avoid since at first there is no way to defeat them The game is divided into the five worlds that Born explores In each of them the player is granted a new colour with which the player can paint on the terrain by touching the screen to modify the behaviour of the environment
[5],18361,Transformers,[8],69.97518610421837,Missing,Battle the Decepticons through eight levels as one of three playable Autobots Optimus Prime Red Alert and Hot Shot Players can transform between robot and vehicle form during the action and collect dozens of MiniCons that can be equipped to upgrade their abilities
[5],7184,Section 8,"[6, 9, 12]",69.97447989880851,Missing,Section 8 is a SciFi firstperson shooter that allows players to dynamically alter the flow of combat utilizing tactical assets and ondemand vehicle delivery Your mission is to scout and secure difficult locations using the most advanced arsenal of military hardware known to man
[5],5584,Earth Defense Force: Insect Armageddon,"[6, 9, 12, 49]",69.97325400605645,Missing,Thousands of giant insects and aliens once again ravage the earth and only the Earth Defense Force can stop them Defend the city of New Detroit against an infestation bigger and meaner than ever before Destroy these monsters at all costs even if it means turning entire city blocks into rubble  Enjoy raw arcade shooter satisfaction on a gigantic modern scale Collect over 300 weapons assault rifles rocket launchers energy weapons sniper rifles grenade launchers and more Play with 4 upgradeable armor types Jetpack Battle Tactical and Trooper Experience Massive replayability through arcade style scoring tons of weapons to collect and multiple difficulty levels in every game mode  In addition the game also features a six player Survival mode that pits a human squad against a nonstop onslaught of the largest enemies the aliens have to offer New Detroits giant bug problem is unavoidable and mankinds last hope lies with the Earth Defense Force Defend the world from the insect invasion even if it means blowing up the entire city as part of the extermination process  Earth Defense Force Insect Armageddon and the soldiers are equipped better than ever in the latest cult classic iteration that follows in the footsteps of Earth Defense Force 2017 Japanese Title Earth Defense Force 3 developed by Sandlot and Earth Defense Force Insect Armageddon continues the rich history and hardcore fun of the series
[33],135826,Super Bomberman R Online,"[6, 48, 49, 130, 170, 203]",69.97290056567097,Missing,Drop bombs and collect powerups to blast your way through Super Bomberman R Online You can compete against up to 64 players from around the world in this explosive survival battle With the new Battle 64 mode move from one area to another and blast away your rivals in an epic online survival battle Fight your way to the end and outlast all other players to be Bomber One
"[9, 12, 31]",4844,LEGO The Hobbit,"[6, 9, 12, 14, 37, 41, 46, 48, 49]",69.97178507497993,Missing,Reclaim the Lost Kingdom brick by brick Join Bilbo Baggins Gandalf Thorin and his company of Dwarves in an epic adventure across Middleearth to recapture the Lonely Mountain in the most expansive LEGO game to date Battle ravenous Trolls dangerous Orcs and many more Combine the Dwarves unique abilities to solve puzzles  often with hilarious results Explore iconic locations in Middleearth from the Shire to Goblintown and beyond
"[5, 9, 31]",8941,Project Eden,"[6, 8]",69.97093672731177,Missing,Due to severe overpopulation the planet Earths diameter is increasing with the growth of towering megacities each inhabited by millions of humans Buildings are growing everupwards interconnected with a thick web of roads walkways and service channels In these giant human hives only the affluent may feel the rays of the sun and breathe the cleaner air Your team has been selected to go down and investigate problems at the Real Meat factory in which all of the equipment has started to simultaneously malfunction Technicians sent to repair the machinery have gone missing without explanation The UPAs Urban Protection Agency orders are clear prepare for the descent  Project Eden is a 3D shooter with an emphasis on puzzlesolving Youll lead a squad consisting of four UPA agents Carter Dorlan Andre Herderman Minoko Molensky and Amber Torrelson Each operative has his or her own special ability that youll need to master in order to progress As Carter use your knack for interrogation and nimble fingers to gain information and unlock doors When you need something fixed and in a hurry Andre is your man Computer terminals are no match for Minokos hacking talents Last but not least Amber can traverse hazardous environments with nary a scratch and shell be your weapons expert Brave the lowest strata and prepare to go through hell in Project Eden If youre looking for some gritty cyberpunkish storytelling challenging puzzles and original gameplay with optional dropin dropout coop this is your game
"[25, 31]",22508,Untold Legends: Brotherhood of the Blade,[38],69.9701623587277,Missing,Untold Legends is a hacknslash game for the PSP
