first_release_date,id,name,platforms,summary,genres,storyline,rating,main,extra,completionist,review_score,review_count,people_polled
1122508800,269492,DoraSlot: Bakuenchi! Kyojin no Hoshi II,[38],DoraSlot Kyojin no Hoshi II is a Pachislot game based on real machines The theme of the game is based on Japanese mangaanime series Star of the Giants The main game consists of 3 different variants of the slot machines which feature two side bars that interact based on how you score and if you activate any bonuses or meet certain conditions These feature characters from the series with voice acting and Japanese humor The library allows users to play with the sounds and music view a catalog about the machine or even view the staging for various transitions without playing through the game repeatedly Although its still up to luck if youll complete it you can hear the voice acting and see the effects that the machine uses in this mode Pachislot games are a cross between pachinko machines and western style slot machines They play more like western style machines although they often feature mechanical enhancements animations minigames and various ways of getting bonuses that are more complex than other some other machines,Missing,Missing,Missing,nan,nan,nan,nan,nan,nan
1121904000,269386,Boukoku no Aegis 2035: Warship Gunner,[8],Boukoku no Aegis 2035 Warship Gunner is a movie tiein video game for the Japanese liveaction summer film Boukoku no Aegis Harutoshi Fukui the author of the base novel personally planned the screenplay for Boukoku no Aegis 2035 The game presents an original sequel to this continuity which has not been referenced in his other works,Missing,Missing,Missing,0.0,0.0,0.0,0.0,0.0,0.0
1120694400,250476,Edo Mono,[8],Edo Mono is a historical simulation game for Playstation 2 released on 2005,[11],Missing,Missing,nan,nan,nan,nan,nan,nan
1121904000,221294,Circuit Blasters,[8],Circuit Blasters is like no other racing game on earth Up to 4 players can battle head to head on over 20 roller coaster race tracks in a choice of spectacular worlds Each track features hairraising jawdropping heartinthemouth dips and drops Add in some turbo speed racing and powerup assisted battling for an awesome experience,[10],Missing,Missing,0.0,0.0,0.0,0.0,0.0,0.0
1122508800,203392,Ururun Quest: Koiyuuki,[8],Ururun Quest  Koiyuuki is a fully voiced Japanese PS2 videogame classified as an Onna no Ko Senyou Girltargeted Love SimulationRPG by its developer It was released in 2005 and marketed as the first RPG targeted towards girls The player acts as the main character Ruri while she adventures around her world with her friends and finding new companions,"[12, 34]",This is a world where humans and beings called magic creatures exist  Once the world was one but suddenly one day a rampant fog divided the world The fog covered the sea and the sky the peoples movements were hindered Before long the people had to think about living in a reduced sphere of habitation  This situation continued for many hundreds of years The people spread out and built towns on various plots of land where they quietly started to live People that were curious about the outside world and other continents were practically extinct  Soi the town where flowers bloom wildly is the town where the protagonist lives  Shes a girl that is full of energy and curiosity For her summer vacation research project assignment she started thinking that she would like to investigate the things outside of the town However outside of town the mist has become even thicker and dangerous monsters have appeared  The protagonist with unrestrained curiosity along with the cooperation of her childhood friends Tsukishiro and Shuka step forward outside of the town They have no idea what could be waiting for them at the start of their great adventure,Missing,nan,nan,nan,nan,nan,nan
1122336000,200997,Delta Force: Black Hawk Down,[8],In late 1993 the United States launched dual military operations in Mogadishu Somalia Delta Force Operatives and Army Rangers were sent in to capture Somali warlords and restore order Experience the intense combat of Operation Restore Hope in this ground breaking first person shooter As a Delta Force operative participate in a number of daring and intense raids against the oppressive Somali warlords in and around Mogadishu,"[5, 24]",Missing,Missing,7.68,8.83,8.88,71.0,49.0,39.0
1121299200,123220,Mahjong Haoh: Battle Royale,[8],Mahjong Haoh Battle Royale is a mahjong game,[35],Missing,Missing,nan,nan,nan,nan,nan,nan
1121644800,96526,Schnappi: 3 Fun-Games,[7],From the depths of the Internets it emerged and was from then on no more from the German medium landscape to be excluded Schnappi the small crocodile of the Nile The single was distinguished in Germany recently with double platinum and also the notGermanlanguage foreign country came in the meantime on the taste In the Netherlands it made itself Schnappi already cosy at place 2 the single Charts No question Schnappi met the correct nerve with young and adults  And now the singing reptile opens itself to show also on the PC  Playstation In three plays the player can make sure of the fact that this crocodile can do more than just singing  In Schnappi snatch Schnappi makes what he can do best it snatches In this case there is insects on which he foresaw it But also with an allegedly so harmless booty highest watchfulness is announced Because in 20 levels are not only harmless Brummer but also stinging wasps  And to the researcher Schnappi may not go also into the net Apart from a good reactivity of the player there above all Schnappis jump strength is in demand  With Schappi think the player must exert the brain a little as birth aids so that Schnappi from its egg can hop  And in Schnappi dance the proof is finally begun that a genuine Popstar must be able to dance evenly also in order to exist in this hard Business  Schnappi  3 Fungames is a successful pastime for all fans of the green medium star,Missing,Missing,Missing,nan,nan,nan,nan,nan,nan
1121212800,80104,Beatmania IIDX 12 Happy Sky,"[8, 52]",Beatmania IIDX 12 Happy Sky is one of the many titles in Konamis IIDX rhythm game series featuring more than 80 tracks primarily from the arcade version of the same title As usual for the beatmania series the player is given seven piano keys and a turntable and must play along with the notes that scroll down the screen to play the music All of the game modes from the previous title have returned Arcade Expert Class Beginners Free Training and Gallery The game also includes support for Internet score ranking now discontinued and custommade Arcade courses,"[7, 33]",Missing,Missing,0.0,10.0,0.0,80.0,3.0,1.0
1122508800,79338,Dai-3-ji Super Robot Taisen Alpha: Shuuen no Ginga he,[8],Missing,[15],Missing,Missing,nan,nan,nan,nan,nan,nan
1121385600,78868,Summer,"[6, 8]",A visual novel from Hooksoft,"[31, 34]",Takumi Kaizu is a normal high school student enjoying his final year in school with the rest of his friends Over the years he has made good memories with these friends of his most of whom are girls though apparently still have no overt feelings of attraction towards any of them When asked by his best male friend Osamu Funada if he likes anyone Takumi starts to think about it though is still confused on what to do next With his last summer in high school quickly approaching Takumi decides to find someone to like by the end of summer vacation,Missing,nan,nan,nan,nan,nan,nan
1121904000,72880,Pop'n Music 11,[8],The 11th game in the Popn Music franchise,[7],Missing,Missing,3.78,0.0,0.0,100.0,1.0,1.0
1122508800,72791,Taito Memories Joukan,[8],A Compilation of Taito games which includes   Space Invaders Color  Lunar Rescue  Alpine Ski  The Fairyland Story  KiKi KaiKai  Bubble Bobble  Rastan Saga  Kuri Kinton  Syvalion  Bonze Adventure  Cameltry  Don Doko Don  Flipull  Ah Eikou No Koshien  Majestic Twelve The Space Invaders Part IV Super Space Invaders 91  Runark Growl  PuLiRuLa  Metal Black  Grid Seeker Project Storm Hammer  Dungeon Magic  Space Invaders DX  Darius Gaiden  Elevator Action Returns  Cleopatra Fortune  Puchi Carat,"[5, 8, 9, 25, 33]",Missing,Missing,nan,nan,nan,nan,nan,nan
1121472000,66877,Simple 2000 Series Ultimate Vol. 31: K-1 World Max 2005 - Sekai Ouja he no Michi,[8],K1 World Max 2005 is a Kickboxing game developed and published by D3 which was released in Japan in 2005,[4],Missing,Missing,nan,nan,nan,nan,nan,nan
1122508800,66831,Sengoku Cannon: Sengoku Ace Episode III,"[6, 38, 130]",Sengoku Cannon Sengoku Ace Episode III is the third entry in Psikyos Sengoku Ace series of shoot em up games,[5],Missing,Missing,0.52,0.0,5.0,67.0,3.0,4.0
1121299200,62357,Jissen Pachi-Slot Hisshouhou! Onimusha 3,[8],Jissen PachiSlot Hisshouhou Onimusha 3 is a pachislot game that simulates a pachislot machine themed after Onimusha 3,[13],Missing,Missing,nan,nan,nan,nan,nan,nan
1122595200,60425,Girlish Grimoire Littlewitch Romanesque,"[6, 8]",As Domino you must mentor Aria and Kaya in their training to become witches mastering the magical arts Take them to the classroom to grow the skills required to master powerful spells Send them on quests to test their progress and show them the dangers that exist in the world,"[13, 34]",An alternate world ruled by swords magic and monsters where four moons can be seen in the sky The dark and chaotic twilight of the Age of Tower ended for this world called Stellamund and it entered the prosperous Age of Crown But the wizards who triggered the great war during the Age of Tower no longer hold the power they used to have and quietly researched the great magics that were lost in a magical academy called Grimoire  This is a story expanding three years of an extraordinary great wizard who was born in such age the girls who become his pupils a ruin from the old age Black Tower that they live in and the people that gather around them  The main character Domino became the 9th great wizard of the Grimoire Academy It was a very special case for a young wizard to be so successful but Domino soon grew tired of the Grimoire The other great wizards were only seeing magic as means for personal success than an important research The research of magic has been put off and all they were doing was fighting over authority  Domino left the capital and decided to live by himself in the sealed Black Tower on the frontier rumored that a great wizard in the Age of Tower lived But the other great wizards didnt think well of that and gave him a test  That test was to Raise a full fledged wizard within three years Normally it would take decades to raise a proper wizard On top of that the two students that he was suppose to look after Aria Vancliff and Kaya Xavier were two of the most troublesome girls in the academy Will Domino be able to complete this difficult task,Missing,nan,nan,nan,nan,nan,nan
1122508800,59346,Mahou Sensei Negima! 2 Jikanme: Tatakau Otometachi! Mahora Daiundoukai SP,[8],The second PS2 game based on the manga series of the same name This visual novel features an original story revolving around a sports festival,"[13, 31, 34]",Missing,Missing,nan,nan,nan,nan,nan,nan
1121904000,57443,Fullmetal Alchemist 3: Kami wo Tsugu Shoujo,[8],Fullmetal Alchemist 3 Kami o Tsugu Shōjo is the third Fullmetal Alchemist video game for the PlayStation 2 and an RPG continuation of the series of Square Enix games The first two games in the series are Fullmetal Alchemist and the Broken Angel and Fullmetal Alchemist 2 Curse of the Crimson Elixir Unlike the first two games this game is not released outside Japan,[12],The setting is Valdolla a large city completely surrounded by snowcapped mountainsEdward Alphonse and Winry meet Sophie Belkman a fourteen year old girl with silver hair and light blue eyes who has been cornered by Leonid the guardian of ice When Edwards attempt to save her from him fails she uses a strange power causing a blinding golden light to light up the entire sky  Afterward Leonid retreats and Sophie passes out The trio run to her aid Soon after theyve learned each others names Sophie takes Edward and Alphonse and presses her seal A transmutation circle shaped like a flower onto Edwards right hand and Alphonses shoulder increasing their alchemic abilities  They sought out the Guardians of Ice Wind Earth and Fire to get closer to solving the mystery of Velza During this time they progress through an ancient castle where on the balcony Sophie experiences strange pulsations accompanied with voices that make her scream A strange transmutation circle is inscribed in the ground right by a rocklike platform that has handcuffs hanging down from chains to suspend someone  Ahead the balcony overlooks the mountains Sophie and the Elric brothers are surprised by Romeo Craigin who are then taken into Custody by Venus Rosemaria and her subordinates Izzy Trigger and Boris Hammer Edward yells for Sophie to escape Alphonse is strapped to an Electrical machine for testing and Edward stripped and locked in a cold jail cell with nothing but his boxers to stay warm but Edward finds a way out and they escape the military base together  Upon fighting and defeating three of the four guardians twice the brothers discover that they lose their power and wither away into dust Sophie saves Leonid who has been lifted from his curse but is only shot and killed by Romeo Craigin moments after the trio leave the area The brothers journey finally comes to a close after reaching the highest level in the Shrine of Velza where they find Sophie who has been possessed by Velza because of the red rock that Zelgius placed in her chest and break her out of the trance  They fight Velza as a disgustingly ugly and enormous monster with a skull for a face Upon defeating Velza she gets sucked into the ground but reemerges again in a human form covered with blood and glowing eyes creating a massive vortex of wind and red light in her rage Sophie approaches her and despite the fact that Velza attacks her twice she still survives almost unharmed except for some bleeding on her forehead Sophie then wraps her arms around the angry Velza crying and her words cause Velza to calm down and she hugs her in return Her eyes are shadowed out but a tear falls and lands on Sophies face where she begins to wither to dust Her gentle eyes are revealed for a split second and her last word being a thank you before vanishing for good  Afterwards all of the monsters that were summoned when Zelgius initially placed the red stone in Sophies chest vanished as well leaving citizens and military soldiers alike thankful and relieved that the terror was finally over Zelgius who is standing on the balcony with Roy Mustang notices that everythings vanished and after saying his final farewell he sets himself on fire and disappears into the air They return to the Church to find Winry and Sophies beautiful white cat Norn and decide to have a nice walk in town since they no longer had anything to worry about  On the way through the empty streets Edward is pushed back by Winry as she is deeply immersed in a conversation with Sophie which causes him to fall behind the other three In a shadowed alley Toriga stands covered with a blanket muttering and holding a large dagger He has gone insane from his friends death by the flying monsters The moment Edward reaches the alley with his friends far ahead Toriga lunges out and stabs Ed in the chest then walks away causing death on impact  Alphonse Sophie and Winry turn around after hearing a thump from behind them and run to Eds side crying in shock After seeing Ed lying motionless Sophie decides to use her power to bring him back to life She places her hands over the wound in his chest and a light starts glowing She meets Edward who is floating upside down in a beautiful looking place with a sunset on one side and the daylight on the other and talks with him Edward screams her name out before she vanishes and realizes that hes alive again reaching out for Sophie  When he turns he sees Sophie sitting with a blank and vacant expression and Winry sobbing uncontrollably by her side He then suddenly realizes that something is wrong and moves to her screaming and touching foreheads together Edward and Alphonse meet Führer Bradley at the Headquarters which turns into a fight where winning or losing will change the ending  Upon losing the battle Edward is struck unconscious by Major Alex Louis Armstrong where he and Mustang speak with the Führer who then enters the HQ and kills Romeo Craigin Winry and the Elric brothers try to speak to Sophie who is vacantly staring out the window not even aware of their existence They leave Valdolla in grief and sorrow  Mustang and Hawkeye are treated for injuries at the Hospital At the very end Norn continually meows trying to get Sophie to come back to reality and just when hope seems lost Sophie stresses out the words Norn and Ed with a smile  If you win the battle the scene with Norn still plays out but she runs from the hospital to the train station recovered Although she first believes her friends have already left she succeeds in reuniting with the gang,Missing,nan,nan,nan,nan,nan,nan
1122681600,51428,Angel's Feather: Kuro no Zanei,[8],Angels Feather Kuro no Zanei is an Adventure game published by GN Software which was released in Japan in 2005,"[12, 31]",Missing,Missing,0.0,0.0,0.0,0.0,0.0,0.0
1122508800,44512,Tenchu: Time Of The Assassins,[38],The Assassins are back  Tenchu Time of the Assassins sees the return of Rikimaru Ayame Rin and Tesshu in their most impressive Ninja adventure to date    Create new storylines with scenario mode  Create and share your own missions  Play story mode or any of 50 standalone missions,Missing,Missing,Missing,8.62,17.12,17.96,58.0,5.0,7.0
1121299200,43649,Arc the Lad: End of Darkness,[8],SCE takes the Arc the Lad series away from its roots and into an Onlineplayable actionadventure game Players become a hunter who must travel the world and take on jobs usually revolving around taking out enemies in real time using magic and special abilities Collect cards from battle and events and equip them to gain new skills all the while following an RPGlike storyline You view the action from overhead with a camera zooming in and out depending on the intensity of the action and occasionally switching to other angles for dramatic effect You attack enemies in real time tapping X once for a simple attack and repeatedly for a combo You can also guard against attack dash at an enemy and press a button to run about the play field faster The game places heavy emphasis on magic use with the magic meter recovering automatically and quickly following each spell,"[12, 31]",Missing,Missing,15.0,18.21,31.23,49.0,7.0,5.0
1121990400,43474,Crazy Golf: World Tour,[8],Crazy family fun for up to 4 players Devious courses Colourful characters Unique and exciting settings Addictive gameplay all adding up to hours of fun for you and your friends Navigate moving obstacles water hazards extreme slopes jumps and more over a range of themed courses crossing the globe from the wild west to a pirates cove,[14],Missing,Missing,1.13,0.0,0.0,20.0,1.0,1.0
1122163200,43337,Shadow of Ganymede,[8],Shadow of Ganymede is an arcadestyle space shooter game  Its the XXIIth century The distant Solar System planets become the centres of mining Since these planets are almost unreachable for humans the mining rights are granted to the Automatic Mining System Corporation AMSC whose control centre is located on Jupiters satellite Ganymede On the 20th of May 2114 the central AMSC computer stops responding to the messages from the Earth On the 21st of May the Jupiters cargo ship arrives in the Earths orbit according to its schedule However instead of minerals the cargo ship brings modified robots which can annihilate all of the Earths orbit patrol in a few seconds The threat of annihilation mounts over The Earth,[5],Missing,Missing,nan,nan,nan,nan,nan,nan
1121385600,43328,Superbike GP,[8],Experience the full on thrills and spills of a highspeed Superbike competition You will have to drive fast play hard and watch your back There are miles and miles of unrelenting track to cover before you can be crowned the champion as you speed through chicanes powerslide around corners as you race for the chequered flag,[10],Missing,Missing,nan,nan,nan,nan,nan,nan
1121385600,43247,Perfect Ace 2: The Championships,[8],Following on from the success of Perfect Ace Pro Tournament Tennis which sold 80000 units across Europe last summer Oxygen Interactive have announced they are to launch a sequel title Perfect Ace 2 The Championships in time for the Wimbledon Championships Featuring new stadiums new player models full player editor new game mechanics and new animations Perfect Ace 2 The Championships offers the finest Tennis simulation yet Perfect Ace 2 takes you on a complete World tour for singles Doubles and mixed Doubles as well as the option of a quick match anywhere in the world inc multiplayer options for up to 4 players,[14],Missing,Missing,nan,nan,nan,nan,nan,nan
1121644800,43239,Yetisports Arctic Adventure,"[6, 8, 11]",Yetisports Arctic Adventure is a Miscellaneous game developed by Pirate Games and published by JoWooD Entertainment AG which was released in Europe in 2005,[14],Missing,Missing,0.0,0.0,0.0,0.0,0.0,0.0
1121904000,42878,Kingdom of Paradise,"[38, 46]",Kingdom of Paradise is a 3D martial arts roleplaying game based on Eastern mythology You can collect various fighting skills and items to tailor the fighting style of your character There are more than 150 skills and items to collect including some that can be downloaded via wireless Infrastructure Mode In addition to the singleplayer story mode you can also challenge other gamers via ad hoc wireless,[12],Missing,Missing,20.87,21.67,0.0,69.0,9.0,6.0
1121904000,22568,Devil Kings,[8],Devil Kings is in the same vein as the Dynasty Warriors series Whereas in Dynasty Warriors however Koei focuses on ancient Chinese history Devil Kings focuses more on feudal Japan but with a fictional setting with the ability to use modern day weapons such as chain guns and shotguns as well as fighting legendary and fictional characters from the past  The story takes place as the Devil King a king possessed by the soul of the Devil has unleashed an unholy army on the world to bend it to his will as the player must stop him along with many of his minions including his wife Lady Butterfly his general the Red Minotaur as well as loyal assassins Scorpio and Venus  The gameplay is more arcade hackandslash style with the ability of using magic spells to wipe out entire waves of enemies and as mentioned before the ability to use modern day weapons along with historical weapons such as spears swords among others There are six playable characters to use as well each with their own story told in CG and anime cutscenes as well as two modes of play Conquest the main story of the game and Free Mode where players can play in any unlocked stage they have completed,[25],Missing,Missing,3.16,20.68,109.0,69.0,22.0,19.0
