,id,name,platforms,summary,genres,storyline,rating,main,extra,completionist,review_score,review_count,people_polled
0,269442,Nogizaka Haruka no Himitsu: Doujinshi Hajimemashita,[38],In this all new story you take the role of Yuuto Harukas most trusted confidante and the one who knows of the school unattainable beauty Harukas secret passion for anime and otaku pastimes In the story of the game Haruka has decided to make her own doujinshi amateur fan comic The only problem is that shes bad at drawing but is so proud of her own work that nobody has the heart to tell her how it really is The four themes youll enjoy on this doujin creation adventure are Maid Costumes from Harukas cosplay adventures Doujinshi as she draws her own Party as you gather with Haruka and your friends to celebrate and Event the Comic Marketstyle doujin convention where Haruka finally is able to sell her books,Missing,Missing,Missing,,,,,,
1,209563,Fort Commander: King's Gambit,"[9, 38]",Missing,Missing,Missing,Missing,,,,,,
2,140459,Front Mission Evolved: Wanzer Pack 3,"[6, 9, 12]",Smash the competition with a wanzer evolved from the Front Mission franchises past Wildgoat and 1 brandnew type ISVPrototype    NOTE There are numbering differences between the Japanese and English releases for the same content Japanese stores released as Wanzer Pack 2 while western stores released as Wanzer Pack 3,"[5, 13]",The game is set in the year 2171 50 years after the events of Front Mission 5 Scars of the War During the 22nd century the worlds superpowers look towards space for expansion and began constructing large structures called orbital elevators With an increasing number of surveillance satellites and spacebased technologies being developed a Cold Warstyle atmosphere sets in as the supranational unions used these technologies to watch over their adversaries on Earth    The plot of Front Mission Evolved revolves around USN engineer Dylan Ramsey As an engineer for the weapons developer Diable Avionics Dylan begins testing of a prototype wanzer on Long Island New York In the midst of the wanzer test unknown forces begin attacking New York City and its orbital elevator Percival Worried about his fathers safety in the city he sets off for New York City inside the prototype As he travels through the city to reach the National Strategic Research Laboratory NSRL Ramsey assists USN forces battling the unknown assailants After battling through numerous enemy wanzers vehicles and aircraft Dylan makes it to the NSRL premises just as missiles are launched into the building With his father seemingly dead he engages the attacker Marcus Seligman of the Apollos Chariot The fight is cut short when the orbital elevator begins crashing down on New York City After Percival collapses Dylan is recruited into the USN Army as it prepares for war against the Oceania Cooperative Union,Missing,,,,,,
3,140458,Front Mission Evolved: Wanzer Pack 2,"[6, 9, 12]",Crush the competition with 2 wanzers from the Front Mission franchise  the Stork Mk IV and Tatou    NOTE There are numbering differences between the Japanese and English releases for the same content Japanese stores released as Wanzer Pack 1 while western stores released as Wanzer Pack 2,"[5, 13]",The game is set in the year 2171 50 years after the events of Front Mission 5 Scars of the War During the 22nd century the worlds superpowers look towards space for expansion and began constructing large structures called orbital elevators With an increasing number of surveillance satellites and spacebased technologies being developed a Cold Warstyle atmosphere sets in as the supranational unions used these technologies to watch over their adversaries on Earth    The plot of Front Mission Evolved revolves around USN engineer Dylan Ramsey As an engineer for the weapons developer Diable Avionics Dylan begins testing of a prototype wanzer on Long Island New York In the midst of the wanzer test unknown forces begin attacking New York City and its orbital elevator Percival Worried about his fathers safety in the city he sets off for New York City inside the prototype As he travels through the city to reach the National Strategic Research Laboratory NSRL Ramsey assists USN forces battling the unknown assailants After battling through numerous enemy wanzers vehicles and aircraft Dylan makes it to the NSRL premises just as missiles are launched into the building With his father seemingly dead he engages the attacker Marcus Seligman of the Apollos Chariot The fight is cut short when the orbital elevator begins crashing down on New York City After Percival collapses Dylan is recruited into the USN Army as it prepares for war against the Oceania Cooperative Union,Missing,,,,,,
4,140457,Front Mission Evolved: Wanzer Weapons Pack 2,"[6, 9, 12]",Blast your enemies with these 3 additional weapons  Bazooka Rock Jack Rocket Launcher Wild Goose and Missile Launcher Goldias,"[5, 13]",The game is set in the year 2171 50 years after the events of Front Mission 5 Scars of the War During the 22nd century the worlds superpowers look towards space for expansion and began constructing large structures called orbital elevators With an increasing number of surveillance satellites and spacebased technologies being developed a Cold Warstyle atmosphere sets in as the supranational unions used these technologies to watch over their adversaries on Earth    The plot of Front Mission Evolved revolves around USN engineer Dylan Ramsey As an engineer for the weapons developer Diable Avionics Dylan begins testing of a prototype wanzer on Long Island New York In the midst of the wanzer test unknown forces begin attacking New York City and its orbital elevator Percival Worried about his fathers safety in the city he sets off for New York City inside the prototype As he travels through the city to reach the National Strategic Research Laboratory NSRL Ramsey assists USN forces battling the unknown assailants After battling through numerous enemy wanzers vehicles and aircraft Dylan makes it to the NSRL premises just as missiles are launched into the building With his father seemingly dead he engages the attacker Marcus Seligman of the Apollos Chariot The fight is cut short when the orbital elevator begins crashing down on New York City After Percival collapses Dylan is recruited into the USN Army as it prepares for war against the Oceania Cooperative Union,Missing,,,,,,
5,140456,Front Mission Evolved: Wanzer Weapons Pack 1,"[9, 12]",Cut down the competition with these 3 new weapons  Machine Gun Dark Hog Shotgun Blackstone and Rifle Sieger,"[5, 13]",The game is set in the year 2171 50 years after the events of Front Mission 5 Scars of the War During the 22nd century the worlds superpowers look towards space for expansion and began constructing large structures called orbital elevators With an increasing number of surveillance satellites and spacebased technologies being developed a Cold Warstyle atmosphere sets in as the supranational unions used these technologies to watch over their adversaries on Earth    The plot of Front Mission Evolved revolves around USN engineer Dylan Ramsey As an engineer for the weapons developer Diable Avionics Dylan begins testing of a prototype wanzer on Long Island New York In the midst of the wanzer test unknown forces begin attacking New York City and its orbital elevator Percival Worried about his fathers safety in the city he sets off for New York City inside the prototype As he travels through the city to reach the National Strategic Research Laboratory NSRL Ramsey assists USN forces battling the unknown assailants After battling through numerous enemy wanzers vehicles and aircraft Dylan makes it to the NSRL premises just as missiles are launched into the building With his father seemingly dead he engages the attacker Marcus Seligman of the Apollos Chariot The fight is cut short when the orbital elevator begins crashing down on New York City After Percival collapses Dylan is recruited into the USN Army as it prepares for war against the Oceania Cooperative Union,Missing,,,,,,
6,138010,2 Games in 1!: Archer Maclean's Mercury / Mercury Meltdown,[38],A compilation of Archer Macleans Mercury Mercury Meltdown,[9],Missing,Missing,,,,,,
7,69420,WackyLands Boss,"[38, 39]",WackyLands Boss is a frenzied virtual monster game where players assume the role of a gigantic creature attempting to destroy the magical kingdom,[25],Missing,Missing,3.5,0.0,0.0,0.0,0.0,1.0
8,67381,No Heroes Allowed!,[38],The third installment of Sonys Yuusha no Kuse ni Namaikida series 3rd Dungeon,[15],Missing,Missing,0.0,0.0,15.0,72.0,6.0,1.0
9,65609,Uncharted 2: Among Thieves - Game of the Year Edition,[9],The Game of the Year Edition of Uncharted 2 Among Thieves includes the following   The game  A Super Voucher that allows you to download the following DLC  PlayStation Heroes Skin Pack  Uncharted Drakes Fortune Multiplayer Pack  Uncharted 2 Siege Expansion Pack  Currency Multiplier which grants Double XP up to level 10 in Multiplayer  Golden Guns option for the AK47 and the 92FS 9mm pistol for use in Multiplayer  Early access to Revenge Booster  Uncharted Eye of Indra  Motion Comic Bundle which includes Episodes 14  Uncharted Eye of Indra  Rika Raja and Daniel Pinkerton Character Skins  Uncharted 2 Among Thieves  Avatar Pack 1  Uncharted 2 Among Thieves  Avatar Pack 2  Uncharted Avatar Pack 3  Uncharted Avatar Pack 4  Pinball Heroes  Uncharted for the PSP,"[5, 8, 31]",Two years after the events of the first game treasure hunter Nathan Drake Nolan North is approached by former associate Harry Flynn Steve Valentine and Flynns girlfriend Chloe Frazer Claudia Black to help steal a Mongolian oil lamp connected to Marco Polos doomed 1292 voyage from China The group plans to cheat Flynns client and take Polos treasure for themselves Unbeknownst to Flynn Chloe and Nate had worked together before and Chloe plans on blackmailing Flynn and escaping with Nate and whatever treasure they find  Nate and Flynn break into a museum in Istanbul and find the lamp which contains a map and flammable resin that reveals Polos fleet was shipwrecked in Borneo and was carrying the Cintamani Stone from the fabled city of Shambhala Flynn doublecrosses Nate leaving him to be arrested  Three months later Chloe helps free Nate with his longtime friend Victor Sullivan Richard McGonagle She reveals that Flynn is working for Zoran Lazarević Graham McTavish a Serbian war criminal seeking the stone In Borneo Nate and Sully infiltrate Lazarevićs camp with Chloe as a mole Nate discovers that the stone never left Shambhala and locates a temple containing the bodies of Polos crew as well as a phurba and map detailing that its carrier will gain passage to Shambhala through a temple in Nepal Nate and Sully escape after being cornered by Flynn and his men,Missing,,,,,,
10,65536,Macross Trial Frontier,[9],This PS3 release is part of the Macross Frontier The Movie The False Songstress Hybrid Pack  This hybrid disc release of the first Macross F movie also includes a special presentation of a then indevelopment Macross game under the title of Macross Trial Frontier The game takes place over five aerial stages where the goal is to survive for five minutes stage 4 or defeat all enemies all other stages In normal mode stages unlock sequentially and each stage has a set vehicle and copilot Upon completing normal mode hard mode stages are unlocked which have hardier and more aggressive enemies as well as the ability to use all vehicles pilots optional gear and copilots in the game The player can also toggle flight controls between Normal where the Valkyrie jet mode moves similarly to its bipedal modes or Real where the jet can bank and spin like an actual aircraft In combat Valkyries and the Large Varja units can shift between their different forms by tapping a direction on the right stick The QueadluunRhea does not have alternate forms but can still change between high speed and maneuverability modes Units will have a primary weapon typically a rifle and a secondary weapon typically missiles a melee attack and speed boost Weapons have unlimited ammunition but limited magazines and must be reloaded when depleted All units can dash in a direction to break missile locks by double tapping and shoot down missiles automatically with the missile defense move as long as they have remaining Anti gauge A Special bar is replenished by gaining sequential hits on targets and can be expended to increase boost turn melee into a charging tackle unleash the vehicles unique ultimate attack or activate the copilots special ability Upon finishing the stage the player is graded on the number of enemies shot down as well as time and health remaining,Missing,Missing,Missing,,,,,,
11,62875,Hakuoki Reimeiroku,[8],Years before the beginning of Hakuouki the Shinsengumi was known as the Mibu Roushigumi A wandering young man named Ibuki Ryuunosuke falls in with the group by chance just after they first come to Kyoto and while grudgingly making friends with the members within witnesses the dawning era of the Shinsengumi,[34],Years before the beginning of Hakuouki the Shinsengumi was known as the Mibu Roushigumi A wandering young man named Ibuki Ryuunosuke falls in with the group by chance just after they first come to Kyoto and while grudgingly making friends with the members within witnesses the dawning era of the Shinsengumi,Missing,,,,,,
12,58844,Pirate Solitaire,"[6, 39, 46]",Pirate themed solitaire,[35],Missing,Missing,,,,,,
13,56771,Kana: Imouto,[38],Kana Imouto is a Japanese PSP game by CyberFront One of the most riveting visual novels ever created Kana  Little Sister is a story from the famous Tanaka Romeo creator of Yume Miru Kusuri and Family Project,[34],Kana has a terrible disease and has spent most of her life in and out of the hospital Takamichi Toudou her older brother would do anything to make her well When he learns the terrible news that Kana can only live another six months at most his frustration and powerlessness come to a boil Despite the jealous attention of his girlfriend Yumi he starts to experience feelings of romantic love for his sister especially after he discovers his familys secret Will he seek for a way to save Kana or surrender to her destiny spending the last of their time together,Missing,,,,,,
14,52194,Hollywood Squares,"[5, 9]",Hollywood Squares is a video game version of the popular syndicated game show and features such celebrities as Brad Garrett and Kathy Griffin,"[9, 15, 35]",Missing,Missing,0.25,0.0,0.0,50.0,1.0,1.0
15,50593,Dragon's Lair Trilogy,"[5, 48, 49, 130]",Dragons Lair Trilogy includes Dragons Lair Dragons Lair II Time Warp and Space Ace,"[9, 31, 33]",Missing,Missing,1.65,1.82,4.11,60.0,11.0,10.0
16,47463,Medal of Honor: Tier 1 Edition,"[6, 9, 12]",The Tier 1 Edition includes   Medal of Honor game  Instant access to assault class Tier 1 operator  Spec ops class camouflage  TOZ194 and 870MCS shotguns  M60 assault rifle  MP7 weapon,[5],Missing,Missing,,,,,,
17,47387,Castlevania: Lords of Shadow - Limited Collector's Edition,"[9, 12]",Gabriel Belmont learns of a mask with the power to raise the dead and sets out on a mission to obtain it to bring his recently murdered wife back from the dead  Lords of Shadow builds upon the combat systems first explored in this series in 2003s Lament of Innocence and adds more violent kills to the mix Inspiration for these changes seems to have come from 2005s God of War  The Collectors Edition of this game comes in a special clear slipcase and includes a soundtrack CD and a 30page art book,"[12, 25, 31]",Missing,Missing,,,,,,
18,46589,Carnage Heart EXA,[38],A followup to the cult classic Carnage Heart EXA puts players in control of giant robots  Overkill Engines OKEs  and pits these menacing mechs against each other in largerthanlife battles You can control your OKE yourself or set up complex programs that automatically command your robobattlers to follow your orders to the letter Choose from either a compelling Story Mode or get right into the action with Battle Mode,"[4, 5, 15]",Missing,Missing,0.0,10.6,0.0,45.0,2.0,1.0
19,44600,Atelier Rorona: The Alchemist of Arland - Limited Edition,[9],Atelier Rorona is the eleventh installment in the Atelier series and it continues the series emphasis on item synthesis The game is the first title in the series to be developed for PlayStation 3 and it is also the first to utilize 3D models as opposed to the 2D sprites in earlier titles A sequel titled Atelier Totori The Adventurer of Arland which takes place five years after the end of Atelier Rorona was released in Japan on June 24 2010,[12],Missing,Missing,,,,,,
20,44586,Buzz! The Ultimate Music Quiz,"[9, 38]",Released in Europe in 2010,[26],Missing,Missing,0.0,0.0,0.0,55.0,2.0,0.0
21,44582,Ken to Mahou to Gakuen Mono. 3,"[9, 38]",Released in Japan in 2010,"[12, 16]",Missing,Missing,,,,,,
22,42980,The X-Factor,"[5, 9, 12]",Grab the mics and prepare to impress the judges with the complete X Factor experience Begin your journey to stardom by competing in the famous XCruciating Auditions Boot Camp XTreme and finally fulfilling your dreams by performing in the XCeptional Live Shows Will you be the winner,[7],Missing,Missing,0.0,0.0,0.0,0.0,0.0,0.0
23,42784,Ace Armstrong vs. The Alien Scumbags!,[38],Ace Armstrong vs the Alien Scumbags is a fastpaced horizontally scrolling shooter with a unique slapstick take on the best of 50s and 60s scifi movies and cartoons The game features a unique weapons system instead of collecting powerups Ace must down enemies using the incredible power of the RecyloRay before turning the Scumbags own weapons against them  The game sees our titular hero blasting into outer space to defeat a race of psychopathic cephalopod invaders intent on wiping Earth from the face of the galaxy if the galaxy even has a face that is Ace must speed across the surface of the earth before blasting into space speeding through a deadly asteroid field taking on a Scumbag Factory Ship and defeating them on their home planet before blasting into the mysterious Dimension X to put an end to the Scumbag menace once and for all phew,[5],Missing,Missing,0.0,0.0,0.0,0.0,0.0,0.0
24,42779,Beach Buzzin Chopper,[38],You control a beachsports chopper that is buzzin private beaches for bikini babes and handsome hunks Some of the babes and hunks are already taken but others are happy to climb on board Avoid the angered beach bodies whose squeezes youve stolen as they pursue you in jet packs and beach buggies armed with rubber bullets trying to get their favourite honey or dude back If youre successful you get to party with the most beautiful girls or hunky guys on the beach,Missing,Missing,Missing,,,,,,
25,41602,Castlevania: Lords of Shadow - Limited Edition,"[9, 12]",Lords of Shadow is a thirdperson actionadventure game in which the player controls the main character Gabriel Belmont The combat involves a retractable chain whip called the Combat Cross The player can perform up to forty unlockable combos with it The commands consist of direct attacks for dealing damage to single enemies and weak area attacks when surrounded by them It is also capable of interactions with secondary weapons such as knives holy water and other items which can be upgraded In addition the Combat Crosss melee skills can be combined with the Light and Shadow magic system which are spells aimed at defense and aggression respectively The whip is upgradeable and can also be used to guard against an opponents attack,"[25, 31]",Missing,Missing,,,,,,
26,26754,TV Superstars,[9],TV Superstars is a party video game in which you get to cook model and boogie your way past 15 minutes of fame and into celebrity stardom,[26],Missing,Missing,1.43,0.0,0.0,35.0,2.0,1.0
27,26582,Malicious,"[9, 46, 48]",In the action game Malicious you are a Spirit Vessel called into the world by the Prophets to vanquish evil Armed with the Mantle of Cinders a cloak that can absorb power from destroyed objects as well as shift form you wage battle with the Malicious  Rather than crawling through lengthy dungeons to find and defeat enemies this game gives you the power to select whichever stage you want and jump directly into epic boss battles in whatever order you please Upon defeating each boss youll absorb its power to obtain new and unique abilities so the choice is yours as to how youll progress In the end however you have one goal  prepare to face the ultimate evil Malicious,[25],The terrible Malicious is about to return  As the Slayer you have been summoned by the prophets to battle it,Missing,1.88,2.92,2.96,55.0,21.0,15.0
28,24286,Phantom Brave: The Hermuda Triangle,[38],Phantom Brave is a strategy RPG which takes place in the world of Ivoire Ivoire consists of vast seas and numerous islands it used to be a peaceful place but an ancient and powerful force is now threatening life in the various lands The character you control in the game is Marona a 13 year old orphaned girl Marona has the ability to communicate with phantoms an ability that brings a lot of resentment from other people but will help her to head out into the world and solve the problems that are occurring A phantom known as Ash acts as Maronas guardian as the game progresses other phantoms will join your party each of which have different capabilities  The game features a turn based combat system During battles Marona is able to attack enemies by herself and she can also summon phantoms in her party to help out To summon phantoms you will need to confine them to an object on the screen such as a rock or tree Once confined to an object you will then be able to control the phantom in battle though phantoms only remain controllable for a limited number of turns The object you confine a phantom to will affect its abilities for example a rock may make a phantom stronger but move slower By defeating enemies in battle you earn experience points allowing to level up and become more powerful,"[12, 15, 16]",Missing,Missing,,,,,,
29,22953,Ferrari: The Race Experience,"[5, 9]",From the creators of Ferrari Challenge comes a brand new Ferrari racing extravaganza Ferrari The Race Experience This amazing new racer features the definitive Ferrari collection which includes such greats as the GTO the Enzo the 599XX and the stunning new 458 Italia The game also features a selection of difficulty settings as well as three car handling settings  Assisted Arcade and Simulation  so that absolutely everyone can enjoy the feel of a Ferrari A threetiered Career mode allows you to split your time across Classics cars Road cars and GT cars with each allowing you to earn allimportant Credits for the Showroom Use your money to buy new cars and then customize the colour and design to your own specifications before showing your creations off in the games 116 player LAN and online multiplayer mode This truly is the ultimate in Ferrari race experiences,"[10, 13]",Missing,Missing,0.0,48.5,0.0,55.0,2.0,1.0
30,21738,John Daly's ProStroke Golf,"[6, 9, 12]",John Dalys ProStroke Golf will feature fully licensed courses which John has played on bringing the real PGA experience into your home John Dalys ProStroke Golf will also include many different game modes realistic golf physics and commentary by the famous voices of golf delivering the complete golfing experience to golf fans sports fans and gamers alike,"[13, 14]",Missing,Missing,0.0,0.0,0.0,0.0,0.0,0.0
31,20449,Time Crisis: Razing Storm,[9],Time Crisis Razing Storm known in Japan as Big 3 Gun Shooting is a compilation of light gun rail shooter video games by Namco for the PlayStation 3 home console Featuring full compatibility with both the GunCon 3 light gun and the PlayStation Move motion control system the compilation consists of ports of various arcade games Developed by Nex Entertainment and published by Namco Bandai Games the compilation was released in North America on October 19 2010 and in Japan on October 21 2010 which is the launch date of the PlayStation Move in Japan It will also be released as part of a bundle with the PlayStation Move PlayStation Eye and the Shooting attachment for the PlayStation Move in Japan and other Asian countries such as Singapore,[5],Missing,Missing,1.26,7.0,0.0,55.0,11.0,13.0
32,20408,The Shoot,[9],Do you have what it takes to become the ultimate action star,"[5, 14]",Missing,Missing,2.92,5.0,8.0,53.0,3.0,5.0
33,15201,SingStar Guitar,[9],SingStar Guitar is a spinoff of the karaokeonly SingStar series It was the first game in the series involving a gameplay element other than karaoke allowing the use of a third party guitar controller such as those used in the Guitar Hero or Rock Band series  Tracklist  3 Doors Down  Kryptonite  Bloc Party  Helicopter  Blur  Song 2  Buzzcocks  Ever Fallen In Love With Someone  Colbie Caillat  Bubbly  David Bowie  The Man Who Sold The World  Elbow  Grounds For Divorce  Florence and the Machine  Kiss With a Fist  Franz Ferdinand  No You Girls  Jamiroquai  Too Young to Die  Kaiser Chiefs  I predict a riot  Kasabian  Fire  KT Tunstall  Suddenly I See  Ladyhawk  My Delirium  Muse  Supermassive Black Hole  Paramore  CrushCrushCrush  Pixies  Debaser  Pulp  Disco 2000  Queen  David Bowie  Under Pressure  Stereophonics  Just Looking  The Stone Roses  Waterfall  The Clash  Rock The Casbah  The Cult  She Sells Sanctuary  The Cure  The Lovecats  The Raconteurs  Steady As She Goes  The Veronicas  Untouched  The White Stripes  Fell In Love With A Girl  Tina Turner  Steamy Windows  U2  Beautiful Day  Vampire Weekend  A Punk,[7],Missing,Missing,0.0,0.0,0.0,0.0,0.0,0.0
