,id,name,platforms,summary,genres,storyline,rating,main,extra,completionist,review_score,review_count,people_polled
34,11624,Get fit with Mel B,"[5, 9, 12]",Get fit with Mel B is a sporty workout game that will bring you right into the action Together with a healthy nutrition plan shaped for your needs Scary Spice will guide you through various modes like dance fit cardio step pump and tone and kickboxing The game also supports a large variety of fitness accessories that will make the workout even more effective,"[13, 14]",Missing,Missing,0.0,0.0,0.0,0.0,0.0,0.0
35,7135,Power Gig: Rise of the SixString,"[9, 12]",Power Gig Rise of the SixString is a rhythm guitar focused game While the game is similar to guitarbased games like Guitar Hero and Rock Band Power Gig ships with a unique guitar game controller that acts as both a standalone sixstringed guitar and game controller with notematching games Because of the nearness of the controller and gameplay to that of a real guitar it has attracted musicians including Eric Clapton Dave Matthews and Kid Rock that have shied away from music games before due to the simplicity of the buttonmashing concept The game is also distributed with the AirStrike a drum controller that works on motion sensing,[7],Missing,Missing,0.0,0.0,0.0,80.0,1.0,0.0
36,5230,Tony Hawk: Shred,"[5, 9, 12]",Tony Hawk Shred is the 2010 sequel to the video game Tony Hawk Ride a spinoff of the Tony Hawk series The game is a peripheralbased motion controlled skateboarding game  Shred introduces a snowboarding mode to the series as well as Avatar and Mii support on the Xbox 360 and Wii versions respectively A surfing mode was worked on for the game but was soon scrapped due to funds and short amount of time to work on it,[14],Missing,Missing,0.0,0.0,0.0,30.0,1.0,0.0
37,5056,NBA 2K11,"[5, 6, 8, 9, 12, 38, 46]",NBA 2K11 is a basketball video game developed by Visual Concepts and 2K Sports and published by 2K Sports It was released on October 5 2010 on the Xbox 360 PlayStation 2 PlayStation 3 PSP Windows while the Wii version came out on October 21 2010 Michael Jordan is the cover athlete of the game and is featured in the game in different waysNBA 2K11 is the successor to NBA 2K10  NBA 2K11 is widely considered one of the best sports video games of all time and the best basketball simulation of the seventh generation of video game consoles,[14],Missing,88.5337935992882,37.67,160.99,688.12,81.0,37.0,15.0
38,27912,Grand Theft Auto IV: Complete Edition,"[6, 9, 12]",This standalone retail title spans three distinct stories interwoven to create one of the most unique and engaging singleplayer experiences of this generation This definitive Grand Theft Auto bundle boasts hundreds of hours of singleplayer gameplay a full suite of openworld multiplayer game types limited only by players creativity dozens of eclectic radio stations with hours of music and original dialogue,"[5, 31]",Missing,87.99920080659169,,,,,,
39,16,Fallout: New Vegas,"[6, 9, 12]",In this firstperson Western RPG the player takes on the role of Courier 6 barely surviving after being robbed of their cargo shot and put into a shallow grave by a New Vegas mob boss The Courier sets out to track down their robbers and retrieve their cargo and winds up getting tangled in the complex ideological and socioeconomic web of the many factions and settlements of postnuclear Nevada,"[5, 12]",The player takes control of the Courier who is hired by a delivery service to take an unknown package across the Mojave Desert to The Strip but intercepted shot in the head and left for dead by a mysterious man who steals the package After being found by a friendly local robot Victor and healed by a man named Doc Mitchell the Courier is thrust back into the desert to seek revenge and recover the stolen package Through doing this the player becomes caught up between various factions competing for control over the desert and its most valuable asset the Hoover Dam ultimately coming to shape the future of its inhabitants,87.04362817598579,27.36,59.94,131.6,87.0,2027.0,2490.0
40,27911,Dragon Age: Origins - Ultimate Edition,"[6, 9, 12, 14]",Dragon Age Origins  Ultimate Edition includes Dragon Age Origins Dragon Age Origins  Awakening and all nine content packs,"[12, 15, 31]",Missing,86.19993995994106,49.54,72.27,106.08,88.0,642.0,934.0
41,3735,Red Dead Redemption: Undead Nightmare,"[9, 12]",Red Dead Redemption Undead Nightmare later released as a standalone game adds a new singleplayer experience in which Marston searches for a cure for an infectious zombie plague that has swept across the Old West,"[5, 31]",Across the vast Western frontier a plague is spreading  When former outlaw John Marston wakes up at his farmhouse he finds a world gone insane overnight deranged hordes have overrun the towns and outposts of the American frontier In a desperate attempt to save his family Marston must traverse a world torn apart by chaos and disorder using every skill he has to survive long enough to find a cure  The Red Dead Redemption Undead Nightmare collection is now available on disc worldwide Take on the Dying and Undead West in multiplayer with exciting CoOp missions and Competitive Modes Attack and defend in Stronghold mode or take over territory in Land Grab Play online as iconic characters from Red Dead Revolver or as the legends from Red Dead Redemption School your friends in Poker Liars Dice and Horse Racing and annihilate your enemies with the deadly Tomahawk and Explosive Rifle,85.35736773934585,7.09,8.25,13.41,77.0,391.0,411.0
42,885,Super Meat Boy,"[3, 5, 6, 12, 14, 41, 46, 48, 130]",Super Meat Boy is a tough as nails platformer where you play as an animated cube of meat whos trying to save his girlfriend who happens to be made of bandages from an evil fetus in a jar wearing a tux,"[8, 31, 32]",Missing,83.59248603103781,9.55,18.55,43.63,79.0,986.0,885.0
43,2691,Rock Band 3,"[5, 9, 12]",Rock Band 3 adds 83 new songs to the Rock Band library and for the first time supports a keyboardkeytar peripheral,[7],Missing,82.5211648791359,8.98,36.61,134.58,85.0,94.0,56.0
44,11782,Shantae: Risky's Revenge,"[6, 20, 34, 37, 39, 41, 48, 159]",The sequel to the critically acclaimed Shantae is here Fans asked and WayForward has answered with a powder keg of highoctane hairwhipping hipshaking action available only on the Nintendo DSiWare service Shantae Riskys Revenge sets the bar even higher with thousands of frames of animation huge multisprite bosses and a quest so big its bursting at the seams Guide halfgenie Shantae through haunted wastelands burning deserts enchanted forests dripping caverns and deadly labyrinths Discover magical attacks brew zombie coffee save golden babies and master the art of belly dancing to transform Shantae into more powerful creatures Use your powers to foil the lady pirate Risky Boots and save Sequin Land from certain doom With its infectious characters flirtatious humor and deliciously outlandish action Shantae Riskys Revenge offers up all the hairwhipping bellydancing action you can handle,"[8, 9, 31]",Missing,82.13571768857909,5.12,6.98,7.46,73.0,52.0,89.0
45,21758,Borderlands: Game of the Year Edition,"[6, 9, 12, 14, 48, 49, 130]",Lock Load  Face the Madness Get ready for the mindblowing insanity as one of four triggerhappy mercenaries taking out everything that stands in your way With its addictive action frantic first person shooter combat massive arsenal of weaponry RPG elements and fourplayer coop Borderlands is the breakthrough experience that challenges all the conventions of modern shooters Borderlands places you in the role of a mercenary on the lawless and desolate planet of Pandora hell bent on finding a legendary stockpile of powerful alien technology known as The Vault,"[5, 12]",Missing,80.67645065052106,,,,,,
46,2538,Enslaved: Odyssey to the West,"[6, 9, 12]",Follow a gripping surprisefilled journey as two dissimilar characters form an uneasy partnership in order to survive through a perilous postapocalyptic America 150 years in the future war and destruction have left the world in ruins with few humans remaining and nature having reclaimed the world,"[8, 9, 31]",The story is a reimagining of the novel Journey to the West written by Wu Chengen Unlike the original story that was set in a fantastical version of ancient China the game is set 150 years in a future postapocalyptic world following a global war with only remnants of humanity left along with the still active war machines left over from the conflict Like the original story however the plot revolves around someone who forces the help and protection of a warrior with many characters sharing the same names and roles The games story was written by Alex Garland with voice talent and motion capture from Andy Serkis and Lindsey Shaw,80.45197481000562,9.01,10.56,19.35,76.0,806.0,1005.0
47,4803,Def Jam Rapstar,"[5, 9, 12]",Def Jam Rapstar is a rapping game developed by 4mm Games The game was released on October 5 2010 in the United States of America US and released on November 26 2010 in Europe An official launch event was held at New Yorks Hudson hotel on October 6 2010 to celebrate the games US release As of October 5 2011 the community site has been shut down with no official word on when or if it will be reopened causing major features of the game to be inaccessible,"[7, 13]",Missing,80.0,4.83,0.0,0.0,70.0,2.0,3.0
48,21574,Monopoly Streets,"[5, 9, 12]",To celebrate its 75th anniversary the world of Monopoly comes to life through a living breathing city that you can build own and monopolize MONOPOLY STREETS has everything you love about the board game presented as a street level tour of Mr Monopolys fully animated world  Engage in a headtohead race to evolve the surrounding city accumulate the most wealth and own it all Play against your friends live and online on Xbox 360 and PS3 New features such as property auctions add new excitement to the classic play  From the cheap motels on Baltic Avenue to the luxurious Boardwalk suites there is excitement around every corner in this remade classic,"[15, 26, 35]",Missing,79.97749933912763,3.03,7.0,13.0,58.0,10.0,6.0
49,491,Castlevania: Lords of Shadow,"[6, 9, 12]",Gabriel Belmont learns of a mask with the power to raise the dead and sets out on a mission to obtain it to bring his recently murdered wife back from the dead  Lords of Shadow builds upon the combat systems first explored in this series in 2003s Lament of Innocence and adds more violent kills to the mix Inspiration for these changes seems to have come from 2005s God of War,"[25, 31]",From Wikipedia Gabriel is sent by the Brotherhood of Light to the Lake of Oblivion where his deceased wife Marie tells him that Spirits who founded the Brotherhood said that the Lords of Shadows power will save the world Gabriel meets a man from the Brotherhood called Zobek who states that a prophecy has been kept a secret by a select few which tells of a purehearted warrior who will claim the Lords of Shadows power to overcome evil Zobek says that he and Gabriel must enter the lands of the Dark Lords in order to unite the Heavens with the world again and that with this Gabriel can bring Marie back from the dead Gabriel defeats the werewolf Cornell and the vampire Carmilla for the first two pieces of the God Mask on his journey while learning that they were once two of the three founding members of the Order who fought the spawns of Satan in Gods favor until they transformed into the Spirits with power only second to Gods After they ascended to the Heavens they left behind their dark sides who were known as the Lords of Shadow,79.8491802916811,17.98,22.25,39.3,78.0,310.0,310.0
50,3218,Vanquish,"[6, 9, 12, 48, 49]",Players take the role of Sam a government agent who must stop the threat before it is too late Armed with a special suit and a plethora of weapons Sam also has an array of martial arts skills that he can use to take down his robot enemies,"[5, 31]",Since the late 20th century the precipitous pace of population rise on Earth pushed the total number of humans on the planet past 10 billion The lack of consumable food and energy for this expanding population led to numerous wars over depleting natural resources It was in this period of fear uncertainty and doubt that America placed her hopes in the skies with the SC01 Providence space colony  The colony was not immune to social evils that had become prevalent on earth The Order of the Russian Star a faction of the Russian military who had taken power in their homeland via coup détat immediately launched a surprise invasion of the colony They began work converting the microwave energy array into a powerful weapon in the skies then unleashed this fearsome power upon the residents of San Francisco The Orders declaration of war via weapon of mass destruction complete they demanded the unconditional surrender of the United States within 10 hours under penalty of the destruction of New York City  In steadfast refusal to cooperate with aggressors the President had no choice but to order a military strike to annihilate the invaders and recapture the colony The strike was to be led by Lt Col Robert Burns,79.64531419233369,6.08,8.01,16.7,77.0,871.0,1136.0
51,6909,Bakugan: Defenders of the Core,"[5, 9, 12, 38]",The game follows a story arc from Bakugan Battle Brawlers New Vestroia not followed in the Anime When Bakugan Interspace has a malfunction the player is sent to an alternate Earth In this Earth the Resistance lost to the Vexos After that the Vexos took over Earth The Resistance has been fighting the Vexos and they got hit with a beam used by the Vexos newest creation the Vexos Crystal which breaks the Resistances Gauntlets and leaves them unable to brawl Due to the player not being affected by the beams he decides to help the Resistance defeat the Vexos and also tries to find a way home This is also your game character,[31],Missing,78.59180476972605,10.23,12.25,20.95,64.0,22.0,27.0
52,6984,EA Sports MMA,"[9, 12, 39]",EA SPORTS MMA brings the authenticity of the worlds most intense combat sport home like never before Choose from the worlds top fighters or climb the ranks of the worldwide circuit with your created prodigy to become the ultimate MMA champion Travel the globe and learn a multitude of fighting techniques and skills from masters in each discipline Select from various weight classes rule sets and take on all challengers in multiple cage types or a ring The challenge continues online with the most robust offering for any MMA videogame including the ability to create and share custom fighters prize fights and more Are you ready Lets get it on,"[4, 14]",Missing,77.37259661229272,13.72,22.0,0.0,66.0,14.0,7.0
53,5637,Costume Quest,"[3, 6, 9, 12, 14, 39]",Costume Quest is a rollicking AdventureRolePlaying game that unfolds on Halloween night across seemingly peaceful suburban neighborhoods a mysterious village carnival and a monsterinfested shopping mall Created by Double Fines lead animator Tasha Harris the game follows the adventure of a group of young friends who must rid their neighborhood of monsters using only their wits their bravery and their homemade costumes Players go doortodoor collecting candy points cards battle stamps and quest assignments as they prepare themselves for Combat Modewhere they transform into largerthanlife versions of their costumes Each costume that comestolife provides its own unique set of superpowers that players will need to battle Halloweens worst monsters,"[12, 16, 31]",Missing,76.31806690599403,5.55,6.49,7.36,73.0,488.0,884.0
54,2680,DJ Hero 2,"[5, 9, 12]",The follow up to the awardwinning 1 new videogame IP of 2009 DJ Hero 2 will transform living rooms into nightclubs all over again with an entirely new musicgaming experience Friends  families can become mix masters and singing sensations to experience hit music like theyve never heard it before With a host of new DJ and vocal multiplayer modes including innovative DJ Battles and 70 mixes featuring the biggest dance pop and hiphop hits DJ Hero 2 delivers the new standard in music gaming,[7],Missing,76.224953628272,7.1,11.09,17.31,77.0,39.0,22.0
55,47434,Hasbro Family Game Night 3,"[5, 9, 12]",The title was released on PlayStation 3 Xbox 360 and Wii and features versions of The Game of Life Clue Twister Mouse Trap and Yahtzee Hands Down The games is hosted by Mr Potato Head and players can use their Mii and Avatar on the Wii and Xbox,"[16, 35]",Missing,75.0,0.0,0.0,20.0,70.0,4.0,1.0
56,4738,Cabela's Dangerous Hunts 2011,"[5, 9, 12, 20]",A global hunting adventure that quickly turns into a terrifying pursuit of the worlds deadliest animals In the ultimate battle of man versus nature American marksman Cole Rainsford and his estranged father go on a safari to hunt for maneating beasts in the heart of the African wilderness,"[5, 13, 14]",Missing,75.0,4.01,0.0,0.0,45.0,2.0,5.0
57,7098,Naruto Shippuden: Ultimate Ninja Storm 2,"[6, 9, 12, 48, 49, 130]",Taking players through the Naruto Shippuden story arc daring ninja warriors must strategically recruit the right support characters to ensure victory against any and all opponents With the winning combination players can easily unleash bigger and more explosive Team Special Techniques to obliterate enemies who stand in the way,"[4, 15, 31]",The games adventure mode covers the original mangas chapter 245 to 450 Chapter 245 in addition to spearheading the start of a new story arc also marks the beginning of the socalled Part II myth arc adapted on television as Naruto Shippuden The main story that focuses on Naruto Uzumaki is told through 8 chapters including a prologue section Clearing them all unlocks an additional fragment chapter detailing Takas failed capture of Killer Bee based on several nonconsecutive manga chapters from 404 to 417,74.6899111419433,12.85,20.82,36.04,75.0,355.0,317.0
58,11852,Gods Eater Burst,"[38, 46]",Gods Eater Burst is an action roleplaying game and an enhanced version of God Eater The enhanced version features an expanded story and new game mechanics The games missionbased singleplayer mode consists of more than 100 missions with cooperative play of up to three teammates over local adhoc wireless multiplayer or AIcontrolled teammates The game features character creation allowing customization of hair style hair color face skin clothing voice and weapons using special materials Equipment is divided into five groups Blade Gun Shield Control Unit and Upgrades Weapons can be switched between melee ranged and shield inmission Along with the second story arc God Eater Burst adds two new gameplay features Bullet Customization and Burst Mode,"[12, 31]",Missing,73.47805161969657,39.58,51.61,85.54,73.0,39.0,26.0
59,2265,WWE SmackDown vs. Raw 2011,"[5, 8, 9, 12, 38]",WWE SmackDown vs Raw 2011 will empower players more than ever to define their destiny and gameplay experiences in a dynamic and everchanging WWE Along the way your decisions will decide gameplay scenarios allowing for more spontaneous WWE action in and out of the ring Enjoy a greater level of interactivity that allows you to customize your WWE experience and control your destinies in allnew Road to WrestleMania storydriven campaigns  Youve seen the Superstars greatest moments on WWE programming Youve shared them and lived through them on television on the web and at the arenas Now its time for you to define your ultimate WWE moment in the most interactive experience in the WWE Universe This is your moment,"[4, 14]",Missing,70.738816044115,21.56,29.14,52.63,72.0,64.0,38.0
60,7060,Lucha Libre AAA: Héroes del Ring,"[9, 12]",Lucha Libre AAA Héroes del Ring is an action sports game based on Mexican sport of Lucha Libre style wrestling Featuring all of the most popular luchadores from Mexicos premiere wrestling federation the game offers fans of existing wrestling franchises an evolved and unique gaming experience which is more acrobatic and fastpaced than those of existing wrestling franchises,"[4, 14]",Missing,70.0,3.4,0.0,0.0,75.0,2.0,1.0
61,5151,Shaun White Skateboarding,"[6, 9, 12]",A skateboarding game starring Shaun White by Ubisoft Montreal Brought to you by Stride gum,[14],Missing,69.5566870229167,10.33,10.75,0.0,57.0,17.0,7.0
62,556,Medal of Honor,"[3, 6, 9, 12]",Operating directly under the National Command Authority a relatively unknown entity of handpicked warriors are selected when it is crucial that a mission must not fail They are the Tier 1 Operators There are over 2 million active soldiers Of those approximately 50 thousand fall under the direct control of the Special Operations Command  The Tier 1 Operator functions on a level above and beyond even the most highly trained Special Operations Forces Their exact numbers while classified hover in the low hundreds They are living breathing precision instruments of war They are experts in the application of violence  The new Medal of Honor is inspired by and developed with actual Tier 1 Operators from this elite community Players step into the boots of these warriors and apply their unique skill sets to fight a new enemy in the most unforgiving and hostile conditions of present day Afghanistan,[5],Missing,69.34623921532712,5.03,6.17,8.88,64.0,578.0,676.0
63,2807,Ben 10 Ultimate Alien: Cosmic Destruction,"[5, 8, 9, 12, 20, 38]",Ben 10 Ultimate AlienCosmic Destruction is a video game based on Ben 10 Ultimate Alien and is the fifth game in the Ben 10 video games series  The game was panned by reviews being criticized by its limited length game mechanics as well as several gameplay and design concepts,[31],The game involves Ben traveling to iconic realworld locations in search of the parts to an ancient Galvan artifact called the Potis Altiare to save the Earth from total destruction by an evil Tokustar,65.82434049269177,7.1,8.49,11.27,64.0,41.0,26.0
64,7163,Rock of the Dead,"[5, 9, 12]",Grab your guitar and get your drums The planet is under attack and the only chance we have is through the power of rock Rock of the Dead lets you use your guitar and drum controllers to annihilate aliens squash mutated insects and smash up the undead zombie hordes  Grab a buddy and play through the storybased campaign in twoplayer competitive coop with guitars drums or both Rock out to a soundtrack featuring metalized versions of Bach Brahms and other classical pieces as well as Rob Zombie and White Zombie hardhitting tracks With a cast of characters voiced by Neil Patrick Harris Felicia Day and Rob Zombie huge boss battles and dozens of unlockables and upgradeable special attacks the fate of the planet is in your hands,"[5, 7]",Missing,65.0,4.0,8.38,17.0,33.0,3.0,4.0
65,7250,WRC: FIA World Rally Championship,"[6, 9, 12]",WRC  FIA World Rally Championship is a car racing video game based on the 2010 season of the World Rally Championship WRC It is the first game to be officially licensed by the WRC since 2005s WRC Rally Evolved and is the seventh game to bear the WRC license The game was developed by Milestone Srl and published by Black Bean Games It was released in Australia on October 7 2010 October 8 2010 in Europe and April 14 2011 in Japan for Microsoft Windows PlayStation 3 and Xbox 360 platforms The developer had also created Superstars V8 Racing and Alfa Romeo Racing Italiano  It features the official cars drivers and codrivers from the 2010 season and from the three support classes Production World Rally Championship Super 2000 World Rally Championship and Junior World Rally Championship The game therefore includes 13 rallies including Rally Finland and Rally de Portugal 550 km of stages are included split up into 78 special stages,[10],Missing,64.98862462528045,21.8,33.56,39.0,68.0,11.0,11.0
66,16942,Haunt the House: Terrortown,"[6, 14, 39, 46, 82]",A sidescrolling action puzzle game starring ghosts Leave the dusty halls of an abandoned clock tower to haunt your way through a town in the dead of night Possess objects with your ghostly soul to scare people away from a museum a hospital a theatre and a cruise ship Will you be able to scare everyone out and reclaim what has been lost before the night is over,"[9, 31, 32]",Missing,64.86781817560211,1.65,2.13,5.28,66.0,34.0,52.0
67,9945,Super Crate Box,"[6, 14, 39, 46, 130]",Vlambeers SUPER CRATE BOX is coming to bring back the glory of the golden arcade age when all that really mattered was getting on that high score list Grab your baseball cap and loosen your pants its time to fight endless hordes of enemies and collect every weapon crate you can Prepare for an arcade delight with tight controls refreshing game mechanics cracking retro art and a terribly hip chiptune soundtrack,"[5, 8, 32, 33]",Missing,64.58928043184461,1.06,5.26,7.56,58.0,23.0,20.0
