first_release_date,genres,id,name,platforms,storyline,summary,rating,main,extra,completionist,review_score,review_count,people_polled
1243296000,[31],228708,Up,"[6, 8, 14, 38]",The story centers on an elderly widower named Carl Fredricksen and an earnest young Wilderness Explorer named Russell who fly to South America in a house suspended by helium balloons  The PlayStation 3 Wii and Xbox 360 versions of the game follow the films plot more tightly spanning eleven levels with some liberties taken The Microsoft Windows Mac OS X PlayStation 2 and PlayStation Portable versions are a much looser adaptation in which Carl and Russell take longer detours through the jungle to attempt to reach the end of Paradise Falls Consequently those versions are over 20 levels long,Journey through the undiscovered jungles of South America in Up the video game  This version of the game is a much looser adaptation in which Carl and Russell take longer detours through the jungle to attempt to reach the end of Paradise Falls These versions also exclusively feature side areas that cannot be accessed the first time around without acquiring a certain tool as well as fastmoving linear levels namely onrails chase sequences played from a reverse angle or river canoeing courses where players cannot backtrack and must carefully avoid accidents that instantly require a restart from a checkpoint,Missing,5.23,6.78,8.52,62.0,25.0,30.0
1243468800,[34],221617,Sora Yume Portable,[38],Morinaga Satsuki is the only daughter of a family that owns an antique store with no special redeeming features she is an extremely normal 2nd year high school student Its the 24th of August with one week left in her summer vacation On the day that her parents leave for a business trip she spontaneously finds a sparkling yellow ring the Chrysoberyl  When Satsuki took that ring and put it on the man sealed inside was summoned into this world He called himself a demon called Ruen Egrandin He semiforcefully asked her to help him find the Thing he was looking for and as a reward he would grant her a wish that wasnt particularly a wish  The thing the demon was looking for was the demon stone Heliotrope which was set in another ring  That is a ring of destruction Right after you put it on no matter how much you struggle you will easily lose your mind and go insane Its that kind of frightening ring However as long as you dont put it on nothing bad will happen  Under pressure from Ruen Satsuki took on the request to find the Heliotrope ring without taking it too seriously  From that day the demon and human would start working together  Since meeting Ruen No More like since finding that ring It seems like the world has been swallowed by a dream,Features additional event CGs Includes the minidrama that was included as a preorder bonus for the PS2 edition Adds epilogue for the 6 characters routes,Missing,nan,nan,nan,nan,nan,nan
1243468800,"[5, 33]",135485,Saints Row 2: Corporate Warfare,"[9, 12]",Missing,There is a civil war brewing within the Ultor Corporation Dex Ultors newly appointed Head of Security is running a black market nuclear weapons operation aided by Ultor management Meanwhile a defected Ultor executive offers the Saints a chance to bring the entire operation down Take revenge in style with new transportation options for aircraft exotic cars and superbikes Redefine your character with all new customization options including brand new outfits and facial bandanas to change your identity Take the battle to the streets with brand new Strong Arm and Gangsta Brawl multiplayer maps or challenge your friends in an all new Coop competitive mode Now its time to put a permanent end to Ultors corruption,Missing,nan,nan,nan,nan,nan,nan
1242172800,[35],92652,Texas Cheat 'Em,"[6, 9, 12]",Missing,This is a casinostyle card game in which players compete against others in a variation of Texas Hold Em poker Players wager simulated money on hands they are dealt and can manipulate hands ie cheat while they are playing Players can also engage in minigames such as roulette slots and horse races to earn cheat points that allow specific advantages eg seeing an opponents cards or changing their hand,Missing,0.0,0.0,10.0,0.0,0.0,1.0
1243468800,[34],92345,Kazeiro Surf,[8],In 1903 a manned airplane successfully fllew in the sky Yes that was the moment when humans got wings As tensions between countries flared airplanes were used as weapons WWI finally broke out in 1914 eventually the war ended but a lot of countries still held animosity with each other In 1923 Erika a mechanic and her family lived in Juktland Her father Anthony was also a mechanic Though he was old he was still called the God of Repair Erika was also a good mechanic One day Anthony received a command from the Juktland Army It was to be a airplane mechanic for the Roby Independent Aerial Platoon Erika didnt want him to overwork himself so she said Ill go in behalf of him Like this she was sent to an air base near the border However when soldiers first saw her some despised her some expected something from her and some felt disappointed No one treated her as a fullfledged mechanic She finally said Im here as a mechanic Give me something to do,Kazeiro Surf is a PS2 visual novel developed and published by Russel which was released in Japan in 2009,Missing,nan,nan,nan,nan,nan,nan
1242691200,[7],91207,Rock Band Track Pack: Classic Rock,"[5, 8, 9, 12]",Missing,Rock Band Track Pack Classic Rock is a standalone title that allows owners of Rock Band and Rock Band 2 to keep the party going with 20 seminal hits from the heyday of classic rock and beyond handpicked with care by Harmonix,Missing,1.54,0.0,0.0,80.0,4.0,1.0
1243036800,Missing,83673,Hanuman: Boy Warrior,[8],Missing,Hanuman Boy Warrior is a 3D action game in which have to save the world and play as Hanuman an immortal being from Hinduism that has the appearance of a human with an ape face  The game offers nine levels in which you have to defeat several creatures from Indian mythology Hanuman is armed with a big mace and has the ability to jump and swing from rope to rope Besides the normal attacks he can also preform special attacks,Missing,0.0,0.0,0.0,20.0,2.0,0.0
1243468800,[9],83207,Hello Kitty: Puzzle Party,[38],Missing,A handheld puzzle game for the PSP featuring Hello Kitty Only released in Europe,Missing,5.46,0.0,7.0,100.0,1.0,3.0
1243468800,[34],77070,Skip Beat!,[8],Kyoko was in love with Shotaro her old friend Shotaro left his hometown to be a TV star after graduating junior high school Kyoko followed him and worked really hard to take care of him A while later Shotaro successfully made his debut as a singer Kyoko thought she would carry on supporting him but Shotaro actually thought her as a housemaid Kyoko decided to take revenge on Shotaro and had an audition to join the LME Production She unfortunately failed but she couldnt give up After twists and turns she joined the team Love Me As she worked as a member of the team she gradually got interested in performing One day Kyoko received a job offer to play a role in a popular drama called Dark Moon When her shooting went well she also received three more job offers at the same time However she could choose only one out of three,Based on the manga of the same name,Missing,nan,nan,nan,nan,nan,nan
1243555200,[34],69054,Hana to Otome ni Shukufuku wo: Harukaze No Okurimono,"[8, 38]",Protagonist Akira finds himself in the situation of going to an allgirls school impersonating his sister Akiko who is sick Amusing antics and sexual intercourse result,Missing,Missing,nan,nan,nan,nan,nan,nan
1242259200,[34],59394,Arcobaleno!,[8],Kayano Yuuna is a student of the Murota Academy technical college for cooking She wants to be a cook because of a childhood memory Ten years ago she ran away from home and was about to collapse due to hunger but she was saved by a cook who served her delicious pescatore  One day she meets Nasu Haruto a substitute teacher Several days later she eats pescatore at the restaurant Haruto works at Arcobaleno and gets surprised Yes it is exactly the same as the one she ate ten years ago Yuuna asks Haruto the shops owner Komatsu Ryuunosuke and the manager Saotome Nichiki to let her work at Arcobaleno The staff objects to it at first but because of Yuunas passion she is allowed to work there But first she must take a cooking test to check her skill along with two of her classmates Kaname and Fuuta,Arcobaleno is a otome game for PS2,Missing,0.0,0.0,0.0,0.0,0.0,0.0
1243555200,"[25, 31]",44669,Infamous: Special Edition,[9],InFamous is set in Empire City a fictional metropolis based on New York City consisting of the Neon District where most of Empire Citys businesses are concentrated the Warren a slum dependent on international shipping activity and the Historic District the location of the city government Each district has an elevated train system and a separate power grid The premise of the game is built around the partial destruction of the Historic District by a mysterious explosion followed by a viral epidemic that forces federal authorities to seal the only bridge leading to the mainland A rise in violent crime overwhelms the police resulting in societal collapse  Characters The protagonist is Cole MacGrath Jason Cottle a courier who is accused of triggering the explosion which leaves him with the ability to absorb and project electricity His closest friend Zeke Jedediah Dunbar Caleb Moody allows Cole to hide on his rooftop despite his envy of the formers powers Trish Dailey October Moore Coles girlfriend abandons him out of anger over the death of her sister Amy while most of Empire Citys residents view him as a terrorist While attempting to escape the city with Zeke Cole is contacted by FBI agent Moya Jones Kimberli Colbourne who offers to clear his name if he helps her find her husband fellow agent John White Phil LaMarr White vanished while investigating a group known as the First Sons who are believed to be responsible for orchestrating the explosion  While working to restore order in the Neon District Cole encounters Sasha Jessica Straus a former member of the First Sons who like Cole is a Conduit an individual given powers by the First Sons Using her ability to control the minds of others via a tarlike substance she has formed a gang known as the Reapers Meanwhile the Warren has been overrun by the Dust Men an army of homeless militants led by Alden Tate also Jason Cottle the original leader of the First Sons who possesses telekinesis Kessler Sam A Mowry the true antagonist of the game is a shadowy figure who controls the First Sons and who takes an obsessive interest in Cole and his powers  Story While the basic story of InFamous remains unchanged whether the player opts for the Good or Evil karma path there are some story elements that change depending on Coles choices  While making a delivery in the Historic District Cole is instructed to open the package In doing so he activates a device known as the Ray Sphere leveling six city blocks and nearly killing him Rescued by Zeke and Trish he teaches himself to control his emerging powers After using them in public to fight off a Reaper attack the locals turn against Cole after he is accused of triggering the explosion forcing him into hiding He and Zeke engineer an assault on the sealed bridge only to be ambushed by government forces Separated from his friend Cole meets Moya who persuades him to return and find John With her help Cole restores the districts power supply earning the attention of Sasha who lures him into her underground lair Cole defeats her but she is abducted by the Sons before he can make her talk Trapped in the Warren Cole assists what remains of the police in battling the Dust Men Alden is arrested and imprisoned but Zekes incompetence in guarding him allows the Dust Men to free him and massacre most of the officers With Alden planning to reactivate the Sphere the two patch things up and confront him with Zeke ending up in possession of the Sphere Giving in to his temptations Zeke deserts Cole and takes the Sphere to Kessler  With Alden on a murderous rampage towards the Historic District Cole defeats him once and for all in a bridge battle Before jumping in the water Alden reveals that Kessler exiled him from the First Sons White who turns out to be an NSA agent with no connection to Moya reaches out to Cole and explains that the Ray Sphere is designed to consume bioenergy from thousands of lives and transfer it to a single user making them a Conduit During their search for the Sphere Kessler publicly challenges Cole to stop a series of bombings across the district ending with him being forced to choose between saving Trish or her colleagues Regardless of which choice he makes Cole fails to keep Trish from dying Determined to punish Kessler Cole tracks the Sphere to a remote pier where he must decide whether to destroy it or use it to become even more powerful Regardless the Sphere releases the last of its energy killing John before disappearing into a vortex,Infamous tells the story of delivery boy Cole McGrath  the day he delivers a mysterious object called the Raysphere which explodes causing him to inherit mysterious electrical super powers As his city begins to fall to bandits it is up to Cole using his new found powers to save the city or to take it for himself  This Special Edition contains  FoldOut Comic Book Style case  Game Disc  Art Book  Gigawatt Blades Weapon DLC,Missing,nan,nan,nan,nan,nan,nan
1241654400,[8],42842,Hammerin' Hero,[38],Missing,If it moves hammer it    The towns been overrun by the Korumoku gang Use hammeres bats fish  whatever it takes to knock them off the streets Jump and smash your way through the gang to take back your local TV station beach ballbark and more Are you Gen enough to handle the job,Missing,5.67,0.0,0.0,67.0,3.0,3.0
1242000000,"[25, 31]",26114,Batman: Arkham Asylum - Dem Bones Challenge Map,"[6, 9, 12, 14]",After the Joker assaults Gotham City Hall he is caught by Batman and taken to Arkham Asylum which temporarily houses many members of the Jokers gang who were transferred after a fire at Blackgate Prison Believing the Joker allowed himself to be captured Batman accompanies him into the asylum The Jokers plan is revealed as Harley Quinn takes control of the security and the Joker escapes into the facility aided by a corrupt guard who kidnaps Commissioner Gordon The Joker threatens to detonate bombs hidden around Gotham City if anyone tries to enter Arkham forcing Batman to work alone Tracking Quinn to the medical facility to rescue Gordon Batman is exposed to the Scarecrows fear toxin and hallucinates seeing Gordons death and the corpses of his parents talking to him After fighting off Scarecrow Batman finds and subdues Quinn before rescuing Gordon The Joker then directs Batman to the captured Bane who has been experimented on by asylum doctor Penelope Young The Joker frees Bane and Batman is forced to fight him during which Quinn escapes Afterward he goes to a secret Batcave installation he had hidden on the island where Batman restocks his gadgets,Enter this villains nightmarish world and experience a unique combat challenge that will test you to the very limits,Missing,nan,nan,nan,nan,nan,nan
1243468800,[5],21673,CellFactor: Psychokinetic Wars,"[6, 9, 12]",Missing,A downloadable FPS from developer Timeline Interactive in which players utilize psipowers to kill their opponents,Missing,4.03,0.0,0.0,60.0,2.0,3.0
1241654400,"[4, 13]",3829,Air Conflicts: Aces of World War II,[38],Missing,Air Conflicts is an arcade flight simulator game set in World War II featuring the aircraft of this period and historically inspired missions The emphasis is on intense dogfights daring bombing raids and exciting aerial missions 13 nonlinear campaigns with more than 240 actionpacked missions patrols manoeuvres strategic bombing air support air superiority interdiction paratroops and supply deployment prevent bombing missions Authentic historical timeline and missions with focus on the gameplay Easy control over aircraft and fun air battles,Missing,0.0,0.0,12.0,0.0,0.0,1.0
1243555200,[10],7179,SBK 09: Superbike World Championship,"[6, 8, 9, 12, 38]",Missing,The Superbike World Championship comes back to life in SBK09 the teams the riders the bikes and the tracks of the worlds most thrilling motorbike competition All the aspects of the Championship have been faithfully reproduced in each aspect of the game the menu graphics and the TV cameras the pit the paddock show the starting grid and the fascinating umbrella girls will contribute to make the gaming experience as involving as possible  Thanks to a series of options its possible to make the game more faithful to the real thing or easier and more accessible based on ones preferences After selecting the preferred riding style between Basic Arcade Advanced Simulation and Extreme its possible to adapt the game to each own needs braking assistance power braking front and rear braking at once or separate control traction control advanced physics off track stability control riders health bike damages tire wear starting help automatic transmission rider position control official rules warm up lap false start penalty ideal trajectory riding help  When selecting the Simulation riding model there are many things that need to be taken into consideration tires wear down brakes can wear down the bike can be damaged and the rider can be injured when an accident occurs Its therefore important to find the best setup for the bike changing suspension setup handling geometry braking chainring length gear ratio and tire type,85.0,nan,nan,nan,nan,nan,nan
1243468800,"[9, 12]",21943,Half-Minute Hero,[38],Missing,You have 0030 seconds to save the world  Prepare for the fastest most frantic gameplay ever Conquer over 100 levels totaling more than 20 hours of gameplay 30 seconds at a time  Challenge the missions on your own or connect wirelessly for blazingfast headtohead competition,83.57511403552182,8.64,12.38,25.57,76.0,65.0,66.0
1241481600,"[9, 11, 13, 15, 24]",1277,Plants vs. Zombies,"[6, 9, 12, 14, 20, 34, 39, 46, 74, 159]",Missing,Zombies are invading your home and the only defense is your arsenal of plants Armed with an alien nurseryworth of zombiezapping plants like peashooters and cherry bombs youll need to think fast and plant faster to stop dozens of types of zombies dead in their tracks,78.58718656312897,8.22,18.61,43.38,82.0,1234.0,1196.0
1243296000,"[5, 8, 12, 31]",523,Infamous,[9],inFAMOUS is set in Empire City a fictional metropolis based on New York City consisting of the Neon District where most of Empire Citys businesses are concentrated the Warren a slum dependent on international shipping activity and the Historic District the location of the city government Each district has an elevated train system and a separate power grid The premise of the game is built around the partial destruction of the Historic District by a mysterious explosion followed by a viral epidemic that forces federal authorities to seal the only bridge leading to the mainland A rise in violent crime overwhelms the police resulting in societal collapse  Characters The protagonist is Cole MacGrath Jason Cottle a courier who is accused of triggering the explosion which leaves him with the ability to absorb and project electricity His closest friend Zeke Jedediah Dunbar Caleb Moody allows Cole to hide on his rooftop despite his envy of the formers powers Trish Dailey October Moore Coles girlfriend abandons him out of anger over the death of her sister Amy while most of Empire Citys residents view him as a terrorist While attempting to escape the city with Zeke Cole is contacted by FBI agent Moya Jones Kimberli Colbourne who offers to clear his name if he helps her find her husband fellow agent John White Phil LaMarr White vanished while investigating a group known as the First Sons who are believed to be responsible for orchestrating the explosion  While working to restore order in the Neon District Cole encounters Sasha Jessica Straus a former member of the First Sons who like Cole is a Conduit an individual given powers by the First Sons Using her ability to control the minds of others via a tarlike substance she has formed a gang known as the Reapers Meanwhile the Warren has been overrun by the Dust Men an army of homeless militants led by Alden Tate also Jason Cottle the original leader of the First Sons who possesses telekinesis Kessler Sam A Mowry the true antagonist of the game is a shadowy figure who controls the First Sons and who takes an obsessive interest in Cole and his powers  Story While the basic story of InFamous remains unchanged whether the player opts for the Good or Evil karma path there are some story elements that change depending on Coles choices  While making a delivery in the Historic District Cole is instructed to open the package In doing so he activates a device known as the Ray Sphere leveling six city blocks and nearly killing him Rescued by Zeke and Trish he teaches himself to control his emerging powers After using them in public to fight off a Reaper attack the locals turn against Cole after he is accused of triggering the explosion forcing him into hiding He and Zeke engineer an assault on the sealed bridge only to be ambushed by government forces Separated from his friend Cole meets Moya who persuades him to return and find John With her help Cole restores the districts power supply earning the attention of Sasha who lures him into her underground lair Cole defeats her but she is abducted by the Sons before he can make her talk Trapped in the Warren Cole assists what remains of the police in battling the Dust Men Alden is arrested and imprisoned but Zekes incompetence in guarding him allows the Dust Men to free him and massacre most of the officers With Alden planning to reactivate the Sphere the two patch things up and confront him with Zeke ending up in possession of the Sphere Giving in to his temptations Zeke deserts Cole and takes the Sphere to Kessler  With Alden on a murderous rampage towards the Historic District Cole defeats him once and for all in a bridge battle Before jumping in the water Alden reveals that Kessler exiled him from the First Sons White who turns out to be an NSA agent with no connection to Moya reaches out to Cole and explains that the Ray Sphere is designed to consume bioenergy from thousands of lives and transfer it to a single user making them a Conduit During their search for the Sphere Kessler publicly challenges Cole to stop a series of bombings across the district ending with him being forced to choose between saving Trish or her colleagues Regardless of which choice he makes Cole fails to keep Trish from dying Determined to punish Kessler Cole tracks the Sphere to a remote pier where he must decide whether to destroy it or use it to become even more powerful Regardless the Sphere releases the last of its energy killing John before disappearing into a vortex,Infamous is a single player openworld actionadventure game that places you in the role of Cole McGrath a once regular guy who in the aftermath of a horrific catastrophe finds himself not only alive but developing a fantastic array of superpowers Going from ordinary to extraordinary overnight isnt something to take lightly With these powers does one exact revenge Protect the innocent Or perhaps dabble in a little of both The choice is yours in Infamous,75.97565335448742,nan,nan,nan,nan,nan,nan
1241481600,"[5, 12]",10299,Fallout 3: Broken Steel,"[6, 9, 12]",Missing,You may have dealt the Enclave a serious blow at Project Purity but their forces are still out there and still pose a grave threat to the people and security of the Capital Wasteland In Broken Steel youll continue your current Fallout 3 character past the events of Project Purity and work with the Brotherhood of Steel to eradicate the Enclave threat once and for all Youll travel to new locations like the Olney Powerworks wield destructive new weapons like the Tesla Cannon fight powerful new creatures like the Super Mutant Overlord marvel at the destructive power of Liberty Prime earn new Perks like the devastating Nuclear Anomaly and play Fallout 3 all the way to level 30,71.81800672875929,nan,nan,nan,nan,nan,nan
1242691200,"[4, 12, 14, 15, 33]",7227,UFC 2009 Undisputed,"[9, 12]",Missing,UFC 2009 Undisputed is an explosive fighting game detailing the action intensity and attitude of the Ultimate Fighting Championship UFC Featuring an authentic and comprehensive UFC atmosphere including an extensive roster of the best mixed martial arts fighters in the world players will push the envelope with a powerful new game engine and put their best fighting disciplines to the test in the world famous Octagon,69.96852286950616,15.8,21.67,35.0,73.0,18.0,10.0
1242691200,"[5, 8, 31]",6914,Bionic Commando,"[6, 9, 12]",Missing,The first true sequel to the classic 1988 Nintendo Entertainment System original Bionic Commando sees the return of the bionicallyenhanced Nathan RAD Spencer Time has not been kind to Spencer Five years after his heroic defeat of the Imperials he has been betrayed by the government he swore to serve imprisoned for crimes he didnt commit and sentenced to death,67.04643757244267,6.9,9.2,17.47,62.0,121.0,133.0
1242259200,"[30, 33]",20730,Zen Pinball,[9],Missing,Zen Pinball is a downloadable pinball game simulator that features realistic physics and vibrant intricate tables,66.0,0.0,0.0,0.0,73.0,3.0,0.0
