first_release_date,genres,id,name,platforms,storyline,summary,rating,main,extra,completionist,review_score,review_count,people_polled
1243296000,"[8, 9, 31]",5254,Up,"[5, 6, 9, 12, 14]",Missing,Journey through the undiscovered jungles of South America in Up the video game  You can control Russell Carl Dug the talking dog and a female bird named Kevin or you can play with a friend through the entire game Aided by Russells wilderness knowledge the four characters must work together to navigate treacherous jungle terrain combat exotic animals and avoid being captured Each character has special abilities that help in their journey During the game you will explore exciting environments overcome obstacles and battle beasts in an effort to stop Muntz from capturing Kevin,65.5975351299688,5.23,6.78,8.52,62.0,25.0,30.0
1243468800,"[15, 25]",19636,Dynasty Warriors 6: Empires,"[9, 12, 38]",Missing,Designed for the legions of Dynasty Warriors fans DYNASTY WARRIORS 6 Empires is game that brings together the best aspects of the action and strategy genres In this latest edition players can experience Ancient Chinas greatest and most glorious war as an allpowerful lord or as an officer As a lord gamers must think strategically By deciding when to attack when to resist invasion or when to initiate policies a lord can expand their power and influence An easytolearn card collecting system lets players enact policies that will increase their empires strength improve the abilities of their forces and more The cards that a player receives will depend on the attributes of the officers and their army Players can also pledge their allegiance to a kingdom to become an officer As an officer players can suggest policies in the kingdoms war council complete missions for rewards or even turn against their ruler should relations sour Most eagerly awaited by fans is a game mode that allows players to create their own warrior DYNASTY WARRIORS 6 Empires features an extensive character editing system with options to customize a warriors gender build skin tone facial features voice clothing weapon and more Whomever players choose to be they can now use mountain ledges and waterways to infiltrate enemy bases and launch surprise attacks on supply depots to change the flow of battle,65.05602228063913,12.25,0.0,29.0,65.0,13.0,8.0
1242950400,"[5, 31]",6952,Damnation,"[6, 9, 12]",Missing,Evolving the shooter genre with its unique and exhilarating combination of fluid action and combat Damnation features huge open environments frenetic combat daredevil acrobatics and highoctane vehiclebased stunts,63.33784667193308,8.19,9.25,10.45,46.0,32.0,35.0
1243468800,"[13, 14]",5257,Virtua Tennis 2009,"[5, 6, 9, 12, 39]",Missing,Virtua Tennis 2009 features several international tennis stars like Roger Federer Boris Becker or Maria Sharapova against which the player needs to compete against or play with in the heart of the game The World Tour The player creates his own character from scratch and plays to reach the number one rank on the world ranking list,60.68880757267123,30.0,35.08,72.0,65.0,8.0,6.0
1241654400,"[5, 31]",4204,Terminator Salvation,"[6, 9, 12, 39]",Missing,The Resistance needs your help You are John Connor a soldier in this post apocalyptic world and its up to you to lead your squad of loyal fighters in a desperate battle for survival against the superior forces of Skynet and its deadly Terminators,37.15077207812038,4.06,5.94,5.95,47.0,99.0,93.0
