first_release_date,id,name,platforms,summary,genres,storyline,rating,main,extra,completionist,review_score,review_count,people_polled
1122508800,21441,Tokyo Xtreme Racer Drift 2,[8],The mountains of Japan are calling  and so are your racing rivals With the mysterious disappearance of the reigning champion the tournament crown is suddenly up for grabs Many will vie only one can win Do you have what it takes to race grind and drift your way to the ultimate racing prize Race in the dangerous mountains of Japan  Hakone Niko Haruna and Akagi  all faithfully recreated using the most advanced laser techniques to maintain every tight twist and turn,[10],The story is set one year after Kaido Battle 2 Chain Reaction and before Tokyo Xtreme Racer 3 as thats when the Thirteen Devils broke up  Intro   The Kaido Circuit extends throughout Japan Highspeed battles unfold as drivers enter all kinds of races seeking to test themselves Striving for the top racers battle one another day after day  At night the dark side of the Circuit emerges a private world known only to racers where Survival of the Fittest is the only rule Gossip leads to rumors and rumors grow into the stiff of legend  One such legendary racer once existed He was called the Emotional King a veritable god in the Kaido World However they say that he suddenly vanished after a race in Aso  With the Emotional King gone from the Kaido night scene two dominant figures emerged Absolute Emperor and Miracles Summit  They came from Category Races and were already legitimate racers These 2 are now rumored to be the best that Kaido has to offer  Then a legendary metropolitan team The Thirteen Devils apparently took it upon themselves to stem the flow of metropolitan racers crossing over into Kaido  Can anyone defeat the Absolute Emperor and Miracles Summit  What has become of the Emotional King  Has the Kaido Circuit really been overrun by the Thirteen Devils  And where is the next legendary racer  As the battle begins a team has been formed to fight against the 13 Devils Kingdom Twelve whom their leaders real identity is mysterious  In the meantime all Slashers Stage 1  MMC Ooaza and World Supremacy Stage 2  Haruna Guardian Lonely Wanderer and Metal Wizard Stage 3  Final Leg New Moon and Global Winner and the double aces Yeti Fang and Murder Supremacy are preparing themselves as the 13 Devils may eventually challenge them  While everyone is ready the player arrives and defeats every Slashers who ask if heshe would join them against the 13 Devils Meanwhile after Global Winners defeat Kyoichi Imaizumi Yeti Fang and Tastu Zoshigaya Supremacy Murder described as 2 witnesses of the last battle discuss about that battle   What did you think of that battle  Hmm He races rough but still fast Hes obviously not from the racing circuit  Yeah I agree He came here on his own and hes out to battle us now Weve got nowhere left to run All we can do now is accept his challenge  Fine Ill make it perfectly clear who the better racer is My technique is tempered by experience its unbeatable What I want to know is where did he come from  Then both the Kingdom Twelve and the Thirteen Devils are being defeated one by one Meanwhile a person begins to doubt about the Kingdoms objective as it seems that the leaders are strangely friendly Furthermore after the player defeats Timber Slash the identity of Kingdom Twelves leader is revealed by her Hamagaki the former Emotional King AKA Kaido President Apparently he lost against Kokami just before Zoshigaya beat him  As both the Absolute Emperor and Miracles Summit were defeated a new course has been opened  Hokkaido where only the best drivers are there By reading the messages the player can see that the 13 Devils leader is here  Motoya Iwasaki AKA Speed King and some legend drivers are here such as God Shift Bunta the High Empress former Lovers leader and someone who drives a black and red Lancer Evolution III but no one can remember his identity  When the Empress is defeated the real goal of the Kingdom Twelve is revealed by her as she was recruited by Hamagaki but declined his offer  Kingdom Twelves ostensible goal is to get all the Tokyo racers and all the highway racers under their thumb Then once theyve conquered the highways theyll transform into the ultimate rally team and make a new start meaning that Hamagaki wants to build his own racing utopia  As Kaido President and Speed King are defeated the black and red Lancer Evolution III is revealed to be the long lost Emotional King  Taiju Kokami who wanted to make a fresh start as Emotional King After his defeat a new team shows up after the great battle  Revival Of Sodom lead by Zaiga Koshigaya who appears to have known Kokami for a long time as he was his friend Even though Zoshigaya is one of the best drivers he lost to them so everyone asked if the player can do something about them as the new legendary racer,Missing,0.0,30.0,0.0,50.0,2.0,1.0
1122336000,5977,Outlaw Tennis,"[8, 11]",Outlaw Tennis is a video game based on the sport of tennis published for the Xbox and PlayStation 2 and the last game in the Outlaw series to be released in 2005 Actor and political satirist Stephen Colbert provides the voice of the games announcer,[14],Missing,Missing,0.0,0.0,0.0,80.0,1.0,0.0
1121040000,5952,NCAA Football 06,"[8, 11]",NCAA Football 06 known colloquially as College Football 2006 is a collegiate American football video game which was released on July 11 2005 It is the successor to NCAA Football 2005 in the NCAA Football series The product features former Michigan Wolverines standout and Heisman Trophy winner Desmond Howard on the cover He is the only cover athlete not to have played the year before their respective game Howard last played at Michigan in 1991 It is the only game in the series as of 2013 to have a music soundtrack as the other games play school fight songs and general band pieces and the last game in the series to feature FCS Division 1AA teams,[14],Missing,Missing,42.25,0.0,0.0,87.0,6.0,1.0
1121126400,5123,Rig Racer 2,"[5, 6, 8]",Get behind the wheel of these mammoth trucks and roll out onto some of the craziest racetracks around Ever wanted to drive a Big Rig How about speed around a racetrack in one Well now you can experience the thrill in Rig Racer 2,[10],Missing,Missing,0.0,0.0,0.0,0.0,0.0,0.0
1121212800,5077,Ninjabread Man,"[5, 6, 8]",Candy Land is under attack  Hordes of snapping cupcakes angry bees and jelly monsters have taken over this once sweet  tasty land Only one man can stop this evil army of monster cakes Hes one tough cookie a guy who wont crumble under the pressure Ninjabread Man is here  Throw ninja stars to stun enemies and then follow up with Ninjabread Mans mighty samurai sword reducing enemies into a quivering pool of raspberry jam  Collect power ups to increase the power and range of Ninjabread Mans weapons and use ninja skills to jump onto high ledges dash past enemies and find the magic candies  Can the Ninjabread Man save the day Candy Lands future depends on you,"[8, 31]",Missing,Missing,0.79,0.0,0.8,23.0,6.0,7.0
1121817600,5007,Mini Desktop Racing,"[5, 6, 8]",Mini Desktop Racing lets you loose with a crazy selection of officially licensed Minis each accurately rendered with distinctive performance abilities Players race in a variety of mini cars around a variety of desktop areas The game offers reasonably interactive courses by allowing players to turn on fans and spill drinks in attempts to hinder opponents,[10],Missing,Missing,0.0,0.0,0.0,0.0,0.0,0.0
1121385600,4902,Hamster Heroes,"[5, 6, 8]",Guide the Hamster Heroes through 15 levels to save them from the sinister Hamster X,[9],Missing,Missing,0.0,0.0,0.0,0.0,0.0,0.0
1121299200,4677,Anubis II,"[5, 6, 8]",A long time ago an evil spirit known as Mummhotep sank the land of Egypt into eternal darkness A deadly curse was spread across the once peaceful civilisation The Gods had to send one man to deal with this threat the warrior of the sand Anubis The player is armed with an arsenal consisting of the scepter of Ra and the Kanopic bombs of fury with this Anubis sets off to save Egypt once and for all In this game the player will have to face off with legions of evil enemies across nine playable levels of gameplay  The player controls Anubis from a thirdperson perspective through levels with platform puzzles and enemies that are taken out by swinging his staff or locking on to them and shooting energy balls In each level Anubis needs to find eight pyramids that open up the portal to end the stage Contrary to the title this is not the sequel to an earlier game,[8],Missing,Missing,1.85,2.0,0.0,15.0,2.0,2.0
1122076800,4658,Action Girlz Racing,"[5, 6, 8]",Action Girlz Racing puts you in the driving seat in a completely new and wonderful way For the first time ever you can pick your favorite Action Girl and take to the roads to race around fairytale castles holiday resorts and even through school corridors while the teachers arent looking Best of all are the Action Girlz themselves Meet Kat an action girl with no fear  she will take anything on Latisha is so cool you have to check her for a pulse  nothing riles this girl Bianca is all about being a professional  she has it all The Action Girlz are here so grab your lipstick start your engines and get ready to race,[10],Missing,Missing,1.5,0.0,0.0,30.0,1.0,1.0
1120608000,6454,We Love Katamari,[8],We Love Katamari is a thirdperson puzzleaction video game where the player controls the Prince the 5centimetertall son of the godlike entity the King of All Cosmos who rolls around a katamari a magical ball that causes objects smaller than it to attach to it Throughout each level the play must collect objects in order to fulfill objectives set by the princes father,"[9, 31]",We Love Katamari tells two stories a selfreferential story of how the King of All Cosmos is reacting to the unexpected success of Katamari Damacy and an origin story of how the King of All Cosmos became the King of All Cosmos met his wife and had his son  Reaction to the success of Katamari Damacy After completing his goal to recreate the stars in the sky the King of All Cosmos was surprised to discover that he had many fans down on Earth Thus begins We Love Katamari where the King of All Cosmos seeks to help fulfill the wishes of his fanswith the help from his son and his sons cousins who again travel Earth rolling things up into a Katamari  The King of All Cosmoss origin The King of All Cosmoss history is told in We Love Katamaris cut scenes interspersed between the games stages The King of All Cosmos was not always the King His father was the previous King of All Cosmos also called Emperor of the Cosmos or Papa The future King of All Cosmos grew up either on Earth itself or a planet very much like it in a giant castle on a hill surrounded by green fields Though early in the game we are to believe all action takes place in a world called The Great Cosmos,87.88286529299883,7.37,9.89,16.12,83.0,140.0,89.0
1120694400,5136,"Sakura Wars: So Long, My Love","[5, 8]",Sakura Wars is a Strategy RPG that features a unique simbased story system An indepth storyline exists much like in any other RPG however the players destiny in the game is not predetermined Character interaction plays a major role and your responses to the various characters in the game can ultimately change the story content and even the final outcome The battle system is divided into two main parts ground combat and air combat Ground combat takes place using twolegged mechanized suits which transform into jet fighters to take the fight to the sky Every mech unit in the game can transform from battle mech mode to jet fighter mode during combat Once transformed weapons and movement methods will change as well For example the heros ground mode utilizes a sword as his main weapon but in jet mode he will use longrange missiles,"[12, 13, 15, 24, 31, 34]",Missing,81.07805581007717,21.55,24.76,28.05,73.0,29.0,34.0
1120435200,15455,Ys: The Oath in Felghana,"[6, 38, 55]",A complete 3D reimagining of the 16bit console classic Ys III Wanderers From Ys Ys The Oath in Felghana is a fastpaced action roleplaying game with tight controls Metroidvaniastyle exploration elements intense combat with epic screenfilling boss battles and a thrashing percussive arranged soundtrack thats been heralded by many as one of the best of all time Based on the original 2005 PC release this classic is finally officially available in English with added Steamworks features such as achievements and cloud saving,"[12, 31]",When redheaded thrillseeker Adol Christin and his eternal bluehaired companion Dogi make an unannounced visit to Dogis homeland of Felghana after an eightyear absence it quickly becomes apparent that things have changed dramatically Hordes of violent monsters roam the outskirts of town a longdormant volcano has suddenly sprung back to life and the new lord of the land has begun mercilessly and inexplicably extorting money from its longsuffering citizens While Dogi seeks out his former combat master for answers Adol tends to the townsfolk  and finds himself embroiled in a world of political conspiracies ancient legacies and unthinkable taboos,80.45360381893381,10.87,13.56,18.27,80.0,287.0,424.0
1122508800,5107,Fatal Frame III: The Tormented,[8],Rei Kurosawa suffers a strange dream each night since she took a photo of her dead boyfriend in an abandoned old mansion  Every night the dream will take her deeper and deeper in an old mansion when she will have to find out what is going on,[31],Missing,80.0558993630541,14.97,15.91,18.02,81.0,68.0,83.0
1121299200,6064,Ape Escape 3,[8],Kei and Yumi take the lead as the new heroes Their quest is to capture all 400 monkeys You control either Kei or Yumi The gameplay involves using various methods and weapons to catch them all The game has many levels with different themes such as a Haunted Castle a Racing level Jungle settings TV studios and other settings You can slow the animals down with various objects such as a stun club or a slingback shooter and then you can capture them with a net  New to the series are the morphing abilities eight in all You can morph into various characters like a knight and perform a powerful attack or a gun fighter and shoot em up or a ninja and run along walls You can also vehicles such as a race car to knock down the monkeys Other features are the familiar Monkeypedia and the unlockable Mesal Gear Solid minigame a Metal Gear Solid spoof,[8],Missing,78.6123497817721,6.34,9.12,12.59,82.0,67.0,63.0
1121299200,3063,Batman Begins,"[8, 11, 21]",Step into the shadows of Gotham Citys perilous criminal underworld as DC Comics legendary Dark Knight in the Batman BeginsTM video game Slated for release day and date with the Warner Bros Pictures film Batman Begins challenges players to use fear as their ultimate weapon  The game explores the origins of the Batman legend and the Dark Knights emergence as a force for good in Gotham Gamers will play as both Bruce Wayne and his alterego Batman hunting evildoers from the shadows using strength intellect and an array of high tech gadgets to fight the sinister forces that threaten the city including classic villains Scarecrow Ras Al Ghul and Carmine Falcone,[31],Missing,66.46551562411402,7.3,8.41,9.04,68.0,49.0,38.0
1122595200,6244,Worms 4: Mayhem,"[6, 8, 11]",The Worms series continues with Worms 4 Mayhem You can engage in the turnbased combat that the series has become known for across predesigned or random 3D maps Worms 4 Mayhem delivers new weapons as well as more customization options allowing you to design your teams and the arsenal that they use You can unlock bonuses in the 25mission story mode or play online against up to four other players,[15],Missing,60.77520998175019,9.73,11.57,19.17,75.0,44.0,12.0
1122681600,43345,Saint Seiya: The Sanctuary,[8],Based on the popular anime series of the same name Saint Seiya Chapter Sanctuary brings the legendary conflict between the Knights of Athena and the Knights of Ares home to the PlayStation 2 Battling over the Golden Cloth of Sagittarius more than 20 different fighters square off against one another across several different modes including those of the Story Versus and Practice variety As an added bonus several of the shows most memorable moments have been recreated using the latest in CG cinematics as well with licensed voiceovers specifically rerecorded for the videogame version of the story Available only in Japan,[4],Missing,59.93498089294383,4.17,7.2,8.0,71.0,18.0,8.0
1120262400,21721,The House of the Dead 4,"[9, 52]",The House of the Dead 4 is a light gun arcade game with a horror theme and the fourth installment of the House of the Dead series of video games developed by Sega The game takes place between the events of The House of the Dead 2 and The House of the Dead III and introduced several new gameplay concepts Players can control characters James Taylor from The House of the Dead 2 or Kate Green a new character to the series    The House of the Dead 4 is the first game to run on the Sega Lindbergh arcade system board A PlayStation 3 version featuring support for PlayStation Move and the two stages from The House of the Dead 4 Special was released on April 17 2012 on the PlayStation Network,[5],In 2003 veteran AMS agent James Taylor and rookie Kate Green gather intelligence at the fifth basement floor of the AMS European headquarters James suspects that the events of the 2000 Goldman case have not ended A sudden earthquake rocks the room collapsing the basement walls and trapping the agents    Several days later while awaiting backup James PDA goes off hordes of creatures appear on the security cameras James and Kate arm themselves and escape In a classified information room they uncover a plot to fire nuclear missiles worldwide within 24 hours time,59.82776197656926,1.78,1.89,2.31,67.0,49.0,41.0
1122508800,4172,Shadow Hearts: From the New World,[8],Shadow Hearts From the New World is the third official game in the Shadow Hearts series  The game series departs from Europe and centers on the New World the Americas It is not directly related to the previous games in the series but it occurs in the same universe The main characters quest is to investigate mysterious windows from which vicious monsters pop out  Gameplay follows that of its predecessors using the Judgment Ring to decide most battle outcomes as well as many other actions throughout the game A new Stock system was made for this game which expands the combination attack system between party members from Shadow Hearts  Covenant and enables double attacks  The Stock system works by filling up a characters stock gauge when heshe performs or receives an attack A maximum of two stock gauge may be stored Stock can then be utilized in many ways For example doing a Double attack a character performs two action on the same turn or starting a Combo consumes one Stock A Double Combo on the other hand consumes two Stock The Judgment Ring system essentially remains the same from Shadow Hearts Covenant with ring customization and added ring effect items being still available  Magic returns in the form of Stellar Charts where characters equip Stellars onto the chart The charts are based on the constellations of the twelve zodiac signs Finding and fitting all the Stellars onto the charts rewards the player with the Melt Crest Stellar the strongest nonelemental magic in the game  Fusion is also back in the game albeit quite differently Unlike Yuri Shania does not possess the power of the Harmonixer where she is able to fuse into different demons She makes spirit pacts with the different Guardian Spirits and draws on their power to transform Shania is only able to fuse into four forms but through acquiring fetishes statues of different animals she is able to learn different techniques by powering them up  Snapping photos is more emphasized in this game Not only can Johnny obtain enemy data through his photographing enemies he can also trade the snap cards obtained for prizes Johnny can also draw upon the power of Malice to transform though this ability comes rather late in the game,[12],The game begins in North America in the year 1929 and features two new main characters a 16yearold New Yorker named Johnny Garland and a 21yearold Native American woman named Shania who has powers of fusion similar to Yuri and Kurando in the previous Shadow Hearts entries although she is not a harmonixer She makes pacts with spirits while Yuri and Kurando turned into demons The story begins with Johnny a private detective being hired by a man named Gilbert to find one Marlow Brown When Johnny finds the man however a mysterious window opens and from it emerges a monster The rest of the game follows Johnny Shania and company as they attempt to uncover the truth about Gilbert and his plans  Meanwhile in Brooklyn a wanted criminal who was severely injured was being pursued by the police He met a mysterious woman who rescued him by finishing off his pursuers with ease Then she healed his wounds with the Kiss of Malice Nobody knows what her intentions or motives are nor did she speak a single word The man who identified himself as Killer called her Lady and thereafter followed her where ever she would go  Shania later teams up with Johnny accompanied by her guardian Natan to investigate the strange happening Johnny has witnessed Arriving at Arkham University they meet Gilbert who reveals his true intentions to open the Gate and rain Malice upon the world Gilbert later teams up with Lady and Killer to achieve his goal Johnny continues his pursuit to stop Gilbert and meets new allies along the way They include Frank a wacky ninja Ricardo a lone guitarist Master Mao a cat specialized in the Drunken Fist and Hildegard Valentine sister of the vampire brothers Joachim and Keith Valentine in the Shadow Hearts series  Together Johnny and his friends travel across the globe to stop the evil plans of Gilbert Lady and Killer Johnny finds out a shocking truth along the way  that he was revived using the Emigre Manuscript and that Lady was actually his sister Grace Garland Their father had revived them after losing them in an accident He was eventually killed by Grace as she had transferred all her Will into Johnny in exchange for his Malice This explains why Lady does not speak she has no memories and is only acting instinctively on the Malice in her body  An epic battle with Killer eventually defeated unlocks Johnnys Awaker powers and Lady calls out Killers name for the first time The ritual to invoke the opening of the Gate of Malice is going underway and Johnny is determined to stop his sister The team battles Gilbert powered by Malice for one last time before the final confrontation with Lady Lady is finally put to rest with Johnny delivering the final blow and she disappears along with Killers body  Months later Johnny receives a case from his detective agency and he proceeds to investigate There are two different endings the Good Ending and the Bad Ending In the Good Ending Shania follows Johnny out of the agency In the Bad Ending Shania watches over from a building with red eyes an evidence that she has been consumed by Malice The Good Ending can be obtained by maxing out all of Shanias fetishes including the ones for the optional fusion,40.76187242565762,39.46,46.26,62.74,75.0,51.0,53.0
1121385600,22449,Charlie and the Chocolate Factory,"[6, 8, 11, 21]",Step inside the magical world of Willy Wonkas famous chocolate factory Based on the Warner Bros film and the classic novel by Roald Dahl Charlie and the Chocolate Factory lets you delve deep inside the factory to relive the classic story as Charlie Bucket Find a golden ticket and along with four other children win a personal tour of Willy Wonkas factory as guided by the notorious and reclusive candy maker himself Discover what happens after the other children greeddriven and unrestrained wreak havoc throughout the factory,[31],Missing,31.0,4.66,0.0,0.0,35.0,9.0,3.0
1121299200,124494,Jikkyou Pawafuru Puroyakyu 12,"[8, 21]",Jikkyō Powerful Pro Yakyū 12 is the 12th installment in the series of baseball games by Konami It features a tournament mode with 12 real professional teams and 15 high school teams exhibition mode for one or two players and the series trademark Success mode where players create a player character and train him to become a professional baseball player,[14],Missing,25.0,nan,nan,nan,nan,nan,nan
