first_release_date,id,name,platforms,genres,summary,storyline,rating,main,extra,completionist,review_score,review_count,people_polled
1410998400,263922,Disney Infinity 2.0 Spider-Man Playset,"[6, 9, 12, 48, 49]",Missing,Missing,Missing,Missing,nan,nan,nan,nan,nan,nan
1411430400,250377,Velocity 2X: Dual Core DLC Pack,"[46, 48]","[5, 9, 33]",So those last few levels tickled your gamer hindbrain Then its time for Dual Core  Control two Quarp Jets at once to weave blast and race through 10 mindmelting levels at the heart of Paroika Prime the Vokh Citadel  Master these levels to upgrade your essential motor neurons enhance your stimulus processing and gain a deeper capacity for intense spatial challenge,Missing,Missing,nan,nan,nan,nan,nan,nan
1409616000,250375,Velocity 2X: Critical Urgency DLC Pack,"[46, 48]","[5, 8, 9, 33]",So youve perfected the art of teleporting at high speed Then youre ready for the Critical Urgency Pack  Six obsessively finetuned speed run levels that will push your teleporting skills beyond the limits of your imagination and into the realm of gaming magic  Master these levels to dazzle your friends and scare your family with freakish talent,Missing,Missing,nan,nan,nan,nan,nan,nan
1411430400,240426,FIFA 15,"[9, 12]",[14],Oldgen version of FIFA 15 running on the Impact Engine,Missing,Missing,61.14,134.42,256.24,71.0,142.0,52.0
1411430400,240424,FIFA 15,[46],[14],PlayStation Vita port of FIFA 15,Missing,Missing,61.14,134.42,256.24,71.0,142.0,52.0
1409616000,223125,Muramasa Rebirth: Genroku Legends - Hell's Where the Heart Is,[46],[25],The fourth of the Genroku Legends additional scenarios for Muramasa Rebirth This addon follows the story of Rajyaki the daughter of the Lord of Hell A former monk named Seikichi accidentally proposes to Rajyaki Already on a mission to recover the sacred treasures of the Seven Gods of Fortune that she misplaced Rajyaki stuffs Seikichi in a magical bag and continues her mission all while being the best fiancée she can be,Missing,Missing,nan,nan,nan,nan,nan,nan
1411603200,221325,Kiniro no Corda 3 AnotherSky feat. Amane Gakuen,[38],[34],AnotherSky allows players to view the narrative from one of the three main rival schools introduced in the third title,One day the protagonist and her childhood friend Kyouya receive a mysterious letter with admission papers for Amane Gakuen The protagonist faintly recalls the boy who gave her the golden violin string seven years prior upon seeing the invitation and has a hunch that she may meet the boy at the school After transferring to Amane Gakuen with Kyouya in tow the pair are soon challenged by Myouga to improve themselves as worthy additions to the school,Missing,nan,nan,nan,nan,nan,nan
1411603200,220574,Satomi Hakkenden Hamaji Hime no Ki,[38],[34],The sequel of Satomi Hakkenden Hachitama no Ki,Where will the demon sword lead To battle or to love  It is a time of war  Inuzuka Shino the protagonist serves the Satomi clan as a warrior Just as she was about to move on from the sadness of losing her childhood friend Hamaji the said childhood friend who was supposed to have died returns as the fiancé of the House of Satomis fifth princess Princess Hamaji  But Im sure Hamaji died  That night Murasamemaru and the Filial Piety bead was stolen Hamaji and the princess disappeared  Who stole the Murasamemaru What is the meaning behind this incident  In order to retrieve Murasamemaru and the bead Shino once again journeys forth with the Hakkenshi  What awaits them as they chase after the two Hamaji,Missing,nan,nan,nan,nan,nan,nan
1410220800,147720,Destiny: Digital Guardian Edition,"[9, 12, 48, 49]","[5, 12]",The Destiny Digital Guardian Edition is an edition of Destiny that can only be obtained as a digital download It is available for PlayStation 4 PlayStation 3 Xbox One and Xbox 360  The Digital Guardian Edition includes the following  Digital download of Destiny  Preorder bonus of early access to several pieces of Vanguard armor and weapons and Vanguard player emblem  Collectors Edition Digital Content The City has provided you with a cache of items to start you on your journey including  A Unique Ghost Casing  An Exclusive Player Emblem  An Exclusive Player Ship Skin  Includes the Destiny Expansion Pass a season pass for two future Destiny expansion packs including The Dark Below and House of Wolves,Setting Destiny is set in the distant future after an event referred to as the Collapse ended the Golden Age that was started by the discovery of The Traveler and pushed humanity to the brink of extinction The force responsible for the Collapse is known as The Darkness and indirectly acts as the primary antagonist Battles against the forces of The Darkness are fought at various locations throughout the Solar System  Plot The game begins with the players Ghost resurrecting them as a Guardian after having been dead for an unknown length of time The Guardian is quickly forced to fight Fallen who have inhabited the ruins of the nearby Cosmodrome in Old Russia The Guardian with the aid of their Ghost is able to secure a jumpship and escape to The Tower that houses the Guardians on The City border  After being outfitted and introduced to the Vanguard and Gunsmith the duo learn from Amanda Holliday that their Arcadia Class Jumpship is missing its Warp Drive a component necessary for interplanetary travel Due to the scarcity of the part and flyable jumpships in general the Guardian is forced to return to where they found the ship in an attempt to find the part,Missing,nan,nan,nan,nan,nan,nan
1410220800,147699,Destiny: Limited Edition,"[9, 12, 48, 49]","[5, 12]",The Limited Edition includes everything thats in the Ghost Edition minus the Ghost replica letter of introduction and Golden Age Relics pack The contents is as follows  Limited Edition SteelBook Case and Game Disc  Guardian Folio containing  Arms and Armament Field Guide Many believe the weapons and armor featured in this record are a myth You will learn the truth  Postcards from the Golden Age Our worlds have been claimed by our enemies Now its time to take them back  Antique Star Chart Explore the wild frontiers of our solar system Discover all that we have lost  Collectors Edition Digital Content The City has provided you with a cache of items to start you on your journey including  A Unique Ghost Casing  An Exclusive Player Emblem  An Exclusive Player Ship Skin  Destiny Expansion Pass  The Destiny Limited Edition also includes the Destiny Expansion Pass  Vanguard Armory  As an added incentive to preorder players will gain early access to the Vanguard Armory which includes nine weapons three helmets and an emblem According to the Bungie these items will be attainable through gameplay for those that choose not to preorder,Setting Destiny is set in the distant future after an event referred to as the Collapse ended the Golden Age that was started by the discovery of The Traveler and pushed humanity to the brink of extinction The force responsible for the Collapse is known as The Darkness and indirectly acts as the primary antagonist Battles against the forces of The Darkness are fought at various locations throughout the Solar System  Plot The game begins with the players Ghost resurrecting them as a Guardian after having been dead for an unknown length of time The Guardian is quickly forced to fight Fallen who have inhabited the ruins of the nearby Cosmodrome in Old Russia The Guardian with the aid of their Ghost is able to secure a jumpship and escape to The Tower that houses the Guardians on The City border  After being outfitted and introduced to the Vanguard and Gunsmith the duo learn from Amanda Holliday that their Arcadia Class Jumpship is missing its Warp Drive a component necessary for interplanetary travel Due to the scarcity of the part and flyable jumpships in general the Guardian is forced to return to where they found the ship in an attempt to find the part,Missing,nan,nan,nan,nan,nan,nan
1410998400,146062,Fate/stay night [Realta Nua],[46],[34],The complicated threads in Fate Stay Night unravels in Realta Nua The series tells some of the most bloody and brutal love stories ever The three heroines Saber Rin and Sakura each has a tale to tell and depending on which path Emiya Shirou takes he can either become the saviour who ends the Holy Grail wars for good or become another heroic spirit bound to be called out when the flames of war start again,Missing,Missing,nan,nan,nan,nan,nan,nan
1409788800,99564,Arcade Archives: Solomon's Key,"[48, 130]","[31, 33]",Arcade Archives Solomons Key is a port of the action game Solomons Key Players make full use of the magic of the main character Dana to collect items in various stages and get the book called Solomons key Unusual for a game in its time an arcade and consumer version were both developed at the same time,Missing,Missing,nan,nan,nan,nan,nan,nan
1410998400,85556,Darts Up,"[41, 130, 167]","[13, 14, 33]",Darts Up is a fun game of darts in which you will have complete control over aiming thanks to the motion sensor You can play with your friends and family up to a maximum of 4 Players,Missing,Missing,0.0,0.0,0.0,0.0,0.0,0.0
1411603200,75701,Arcade Archives: Nova 2001,"[48, 130]","[5, 33]",Arcade Archives Nova 2001 is a port of the shooting game Nova 2001 Players control a fighter which can shoots in all directions And its main purpose is to continue to defeat a variety of enemies that appear in each stage,Missing,Missing,nan,nan,nan,nan,nan,nan
1410912000,68979,Legend of Ixtona,"[6, 34, 39, 48, 49, 167, 169]","[12, 13, 15, 16, 31]",A fullscale Strategy RPG shown at an isometric view Your aim is to change the course of history Utilize a number of different classes and skills to crush your enemies  Story Ixtonas long fight has finally come to an end  Many believed that the leadership of the wise king Lefante would pave the way for an era of peace for Prince Kyle and the people of Ixtona but now  Kyle the compassionate young prince caught up in plots and conspiracies that have thrown him headfirst into a battle that will ultimately decide the fate of his kingdom  The one who waits beyond your battles with powerful adversaries And the future that you and your allies so dearly desire  Character Creation The main character and hired characters Face graphics Battle voice Class can all be assigned andor changed by the player  Strategy Powerful melee and ranged attacks restorative and destructive magic Players can use their skills to the best of their abilities to execute strategies and achieve victory  Village Expansion Players can invest in the village that will serve as their base to research and develop new weapons and armor  Create powerful weapons that will give you an edge in battle  ClassAbility System Increasing your class level will allow you to take on higherlevel classes Equip up to three Abilities onto each character to ensure that youre sending your strongest possible party into the field  Special MovesCombo Attacks Save up SP to unleash a characters Special Move or pair them with another character to unleash a Combo Attack  A splendid cutin will mark the beginning of the end for your enemies,Missing,Missing,8.98,0.0,0.0,0.0,0.0,1.0
1409788800,61944,Binary Star,[46],[34],When she was seven years old what Sorano Fuu the protagonist saw in her living room were the lifeless bodies of her beloved parents who had died at the hands of an unknown culprit  Taken in by a group of people known as Tenshi Fuu asks them why her parents were killed One of the Tenshi said to the young Fuu Your parents were Dealers who are people that sell Hoshi That is why they were killed  Her parents were criminal vendors of the illegaltosell taboo Hoshi on a large scale This truth greatly troubled Fuu and so she made a vow  to atone for her deceased parents crimes  Now the 20yearold Fuu is a Tenshi who protects Akatsuki a town in Cloud  There was something she saw through the many missions she completed with her colleagues That something is their sad pasts all of which revolve around Hoshi  They are still bound by the past will they be able to break free of the curse of their pasts,When she was seven years old what Sorano Fuu the protagonist saw in her living room were the lifeless bodies of her beloved parents who had died at the hands of an unknown culprit  Taken in by a group of people known as Tenshi Fuu asks them why her parents were killed One of the Tenshi said to the young Fuu Your parents were Dealers who are people that sell Hoshi That is why they were killed  Her parents were criminal vendors of the illegaltosell taboo Hoshi on a large scale This truth greatly troubled Fuu and so she made a vow  to atone for her deceased parents crimes  Now the 20yearold Fuu is a Tenshi who protects Akatsuki a town in Cloud  There was something she saw through the many missions she completed with her colleagues That something is their sad pasts all of which revolve around Hoshi  They are still bound by the past will they be able to break free of the curse of their pasts,Missing,0.0,33.33,0.0,50.0,1.0,1.0
1411430400,61822,Disney Infinity: Marvel Super Heroes,[48],Missing,Disney Infinity 20 also known as Disney Infinity Marvel Super Heroes is an actionadventure sandbox toystolife video game developed by Avalanche Software and Heavy Iron Studios and published by Disney Interactive Studios The game features additional work by Studio Gobo and Ninja Theory It is the sequel and successor of the 2013 video game Disney Infinity  Featuring original story material by Brian Michael Bendis Marvel Super Heroes includes three plots and includes characters from both Marvel and Disney properties,Missing,Missing,nan,nan,nan,nan,nan,nan
1410825600,61642,Run Like Hell!,[46],"[8, 33]",A tropically themed runner where the player must escape hordes of hungry cannibals,Missing,Missing,0.0,0.0,0.0,60.0,1.0,0.0
1409616000,59900,Tina's Toy Factory,"[48, 74]","[9, 15]",Tinas Toy Factory is a classic match 3 puzzle game with the addition of local multiplayer You break open crates by matching 3 in a row which releases toy parts You then combine the toy parts to make complete toys,Missing,Missing,0.0,0.0,0.0,0.0,0.0,0.0
1410480000,58719,Knight Solitaire,"[6, 39, 46]","[15, 16, 35]",Medieval themed solitaire,Missing,Missing,0.0,0.0,26.4,60.0,1.0,1.0
1410220800,47492,Destiny: Ghost Edition,"[9, 12, 48, 49]","[5, 12]",This version includes   Limited Edition SteelBook Case and Game Disc  Ghost Replica  Letter of Introduction  Golden Age Relics  Guardian Folio  Postcards from the Golden Age  Antique Star Chart  Collectors Edition Digital Content,Setting Destiny is set in the distant future after an event referred to as the Collapse ended the Golden Age that was started by the discovery of The Traveler and pushed humanity to the brink of extinction The force responsible for the Collapse is known as The Darkness and indirectly acts as the primary antagonist Battles against the forces of The Darkness are fought at various locations throughout the Solar System  Plot The game begins with the players Ghost resurrecting them as a Guardian after having been dead for an unknown length of time The Guardian is quickly forced to fight Fallen who have inhabited the ruins of the nearby Cosmodrome in Old Russia The Guardian with the aid of their Ghost is able to secure a jumpship and escape to The Tower that houses the Guardians on The City border  After being outfitted and introduced to the Vanguard and Gunsmith the duo learn from Amanda Holliday that their Arcadia Class Jumpship is missing its Warp Drive a component necessary for interplanetary travel Due to the scarcity of the part and flyable jumpships in general the Guardian is forced to return to where they found the ship in an attempt to find the part,Missing,nan,nan,nan,nan,nan,nan
1411689600,42898,FIFA 15: Ultimate Team Edition,"[6, 9, 12, 48, 49]",[14],FIFA 15 Ultimate Team Edition in addition to the base game FIFA 15 also contains   40 FUT Gold Packs  Adidas AllStar Team  Messi FUT Loan Player  Adidas Predator Boot Bundle  Historic Kit  Additional goal celebrations,Missing,Missing,nan,nan,nan,nan,nan,nan
1411603200,19119,The Awakened Fate: Ultimatum,[9],[12],The Awakened Fate Ultimatum is the sequel to Nippon Ichis The Guided Fate Paradox Kamisama to Unmei Kakumei no Paradox  PlayStation 3 roleplaying game,An average high schooler Shin Kamikaze becomes God when an angel rescues him from devils As God he can tap into the powers of angels and demons which he must use to help the angels in their endless war against the devils As he learns to wield his powers he is faced with impossible situations where he must constantly choose between two heartwrenching options What will Shin decide And who will he side with in the end,Missing,nan,nan,nan,nan,nan,nan
1409788800,11801,Muv-Luv Photonmelodies,"[6, 9]","[31, 34]",MuvLuv Photonmelodies is one of two sidestory collections in the MuvLuv series of visual novels released in 2014 the other being Photonflowers,Missing,Missing,25.27,35.89,40.58,73.0,8.0,17.0
1410998400,10875,Sniper Elite III: Save Churchill Part 3 - Confrontation,"[6, 48, 49]",[31],Save Churchill Part 3 Confrontation is the final episode and conclusion to the explosive Save Churchill campaign for Sniper Elite 3 featuring the largest environment ever seen in the series  Time is of the essence  British Prime Minster Winston Churchill is enroute to the Casablanca Conference to finalise the terms of Axis surrender but German sniper Raubvogel lies in wait to ambush Churchills convoy and prevent the victory the Allies so desperately need  You must stop Raubvogels assassination attempt ensure Churchills security and allow the Casablanca Conference to run its course  Fight your way through the Axis barricades scattered amongst the foothills battling mortar fire artillery and the formidable Schutzvollstrecker troops Move up into the mountains through the makeshift German garrison flank the enemy encampments and begin your final ascent up the mountain to confront Raubvogel in an epic sniper duel that could decide the fate of a continent  This time its an even playing field as your target is armed with a variety of deadly traps As you scale the mountain stay alert and remain watchful to avoid any unwanted surprises  Raubvogel is no amateur he would have made sure to cover his tracks  Stop Winston Churchills assassin before its too late One bullet can change history,Missing,Missing,nan,nan,nan,nan,nan,nan
1411516800,8665,Best of Board Games,"[9, 37, 46]",[35],Chess Mahjong Solitaire rediscover 3 timeless classics in this scintillating compilation Whether youre a beginner or a professional youll enjoy these classics not only with their traditional rules but also with brand new game modes,Missing,Missing,0.0,0.0,0.0,0.0,0.0,0.0
1411603200,8662,Bakumatsu Rock: Ultra Soul,"[38, 46]","[7, 34]",Bakumatsu Rock is a musicbased rhythmaction battle game based on a story of male characters from the Tokugawa shogunate if they were worldconquering rock idols instead of just warlords,The story is set in the Bakumatsu era at the end of the shoguns rule over Japan in the middle of the 19th century The Tokugawa shogunate uses the brainwashing Heavens Songs by the top idols in Shinsengumi to subjugate the country and its people In this Japan writing or singing any songs besides the Heavens Songs is a capital offense Sakamoto Ryouma and the other rockers rise up and change the world with rock n roll for freedom and justice,Missing,12.0,0.0,0.0,78.0,4.0,1.0
1409616000,8467,Velocity 2X,"[6, 46, 48, 49, 130]","[5, 8, 9, 33]",This critically acclaimed sequel to Velocity Ultra weaves together two classic game formats into one seamless adventure featuring puzzleplatforming action alongside awardwinning topdown shoot emup gameplay,Missing,88.23306469062652,5.35,9.65,26.7,76.0,110.0,112.0
1411516800,20341,Dark Souls II: Crown of the Ivory King,"[6, 9, 12]",[12],Crown of the Ivory King is set in an ancient temple wrung with freezing storms towering walls and a hollowing emptiness Challenged by forces that are one with the freezing elements low visibility and esoteric abilities,Missing,88.20181820103127,4.61,6.0,8.74,75.0,101.0,85.0
1411430400,10184,Defense Grid 2,"[3, 6, 14, 48, 49, 130, 385]","[11, 13, 15, 32]",Defense Grid 2 DG2 is the highlyanticipated sequel to Hidden Path Entertainments 2008 Defense Grid The Awakening Setting the bar as the definitive tower defense game Defense Grid 2 introduces new worlds and threats to test your tower placement strategies With a bold new look a compelling singleplayer campaign and the addition of new game modes online playerversusplayer and multiplayer coop every playthrough brings fun new opportunities and challenges  DG2 comes with a story campaign featuring 21 stunning maps dynamic level movement an expanded story and cast of characters hundreds of challenge mode experiences new multiplayer modes a procedurally driven audio score and the ability for players to build their own levels DG2 also introduces players to DG Architect a level creation tool set connected to Steam Workshop where players can create their own unique levels to share and possibly even sell if selected  DG2 for the PC was funded in part by Dracogen a private investor after a 2012 Kickstarter campaign funded the original games DLC Defense Grid Containment DG2 is developed by Hidden Path Entertainment and published by 505 Games,Missing,87.10171680083845,10.37,16.28,28.77,77.0,71.0,109.0
1410998400,8864,Shadowrun: Dragonfall - Director's Cut,"[3, 6, 14, 34, 39, 48, 49, 130, 167, 169]","[12, 15, 16, 31, 32]",Shadowrun Dragonfall  Directors Cut is a standalone release of Harebrained Schemes criticallyacclaimed Dragonfall campaign which first premiered as a major expansion for Shadowrun Returns The Directors Cut adds a host of new content and enhancements to the original game 5 allnew missions alternate endings new music a redesigned interface team customization options a revamped combat system and more  making it the definitive version of this oneofakind cyberpunk RPG experience,Man Meets Magic  Machine  In 2012 magic returned to our world awakening powerful creatures of myth and legend Among them was the Great Dragon Feuerschwinge who emerged without warning from the mountains of Germany unleashing fire death and untold destruction across the countryside It took German forces nearly four months to finally shoot her down  and when they did their victory became known as The Dragonfall  Its 42 years later  2054  and the world has changed Unchecked advances in technology have blurred the line between man and machine Elves and trolls walk among us ruthless corporations bleed the world dry and Feuerschwinges reign of terror is just a distant memory Germany is splintered  a stable anarchy known as the Flux State controls the city of Berlin Its a place where power is ephemeral almost anything goes and the right connections can be the difference between success and starvation For you and your team of battlescarred shadowrunners theres no better place to earn a quick payday  Now a new threat is rising one that could mean untold chaos and devastation One that soon has you and your team caught on the wrong side of a deadly conspiracy The only clue whispers of the Dragonfall Rumors that the Great Dragon Feuerschwinge may still be alive waiting for the right moment to return,85.1631835943016,20.85,29.37,41.6,81.0,247.0,429.0
1411603200,13558,The Legend of Heroes: Trails of Cold Steel II,"[6, 9, 46, 48]","[12, 16, 31]",The Legend of Heroes Trails of Cold Steel II is a Japanese roleplaying game and the sequel to The Legend of Heroes Trails of Cold Steel,The Legend of Heroes Trails of Cold Steel II picks up one month after the decisive collision that changed the fate of the entire nation of Erebonia The speedy tactical turnbased combat with the newlydeveloped ARCUS system returns with all the bells and whistles players fondly remember along with the new Overdrive mode new means of transportation both across the land and sky new allies new dangers and a renewed sense of hope as Rean tirelessly works to right the wrongs that have led the country to disarray,81.94169070091048,47.18,72.14,101.25,83.0,380.0,579.0
