first_release_date,id,name,platforms,genres,summary,storyline,rating,main,extra,completionist,review_score,review_count,people_polled
1412035200,3025,Middle-earth: Shadow of Mordor,"[3, 6, 9, 12, 14, 48, 49]","[12, 25, 31]",Middleearth Shadow of Mordor is a open world thirdperson action roleplaying video game developed by Monolith Productions and published by Warner Bros Interactive Entertainment which takes place in the world of JRR Tolkiens Legendarium  The game takes place in the 60year gap between the events of Tolkiens The Hobbit and The Lord of The Rings It is a story of revenge slaughter and mystery set entirely in Mordor the Land of Shadows At its center is Talion an ordinary man who loses everything including his mortal life  The game is set in a fully open world and features various roleplaying game elements such as experience points and skills There are various ways the player can complete their main objective Aside from the main storyline there are various side quests and random events the player can complete within Mordor  The melee system is inspired by that of the Batman Arkham series Getting into a good fighting rhythm using both regular attacks and counterattacks will improve the players combo multiplier  A unique feature of Middleearth Shadow of Mordor is the Nemesis system Every enemy in the game has their own name rank and memory These enemies will continue to do their own jobs and tasks even when theyre off screen If the player does not kill an enemy in an encounter this enemy will remember the player and change their tactics and conversations based on the encounter,You are Talion a Ranger of the Black Gate keeping watch over Mordor which has remained undisturbed for ages In the blink of an eye everything is taken from you  your friends your family and even your own life Resurrected by a mysterious vengeful spirit you must now embark on a relentless vendetta against those who have wronged you,80.18049468925837,15.66,23.82,32.49,78.0,2348.0,4216.0
1411948800,5541,Sherlock Holmes: Crimes & Punishments,"[6, 9, 12, 48, 49, 130]","[9, 31]",Crimes  Punishments lets you become the greatest detective of all time Sherlock Holmes Solve six highprofile gripping and varied cases murders disappearances spectacular thefts and sensational cases will sometimes take you to the realms of the fantastic in this stunning game of investigation in the fine tradition of the Conan Doyle novels Crimes  Punishments offers you a large degree of freedom to make moral choices that go beyond merely seeing that justice is done your decisions have a real influence on the game both in terms of your characters reputation and the consequences that arise in a realistic and sometimes unexpected way  Will you listen to your moral sense or will you impartially enforce justice,Missing,80.1159586320844,nan,nan,nan,nan,nan,nan
1410912000,35265,9 Clues 2: The Ward,"[3, 6, 14, 34, 39, 48, 49, 74, 167, 169]","[2, 9, 31]",9 Clues 2 The Ward is the second installment of Tap It Games casual adventure series with hidden object puzzles set in the 1950s America in which a young detective and her partner respond to a distress call from a psychiatric hospital on a secluded island,A young detective and her partner arrive on a lonely rainsoaked island that houses an insane asylum  The island is separated from the rest of society by freezing waters and constant brutal storms Upon their arrival the detectives witness one of the hospitals therapists falling out of the window to his death  Shortly after starting their investigation they learn that much darker things are going on at Mnemosyne Asylum No one is willing to speak of the devastating fire which engulfed the hospital four years ago or the victims who died The fact that the staff does everything they can in order to obscure the asylums story makes everything even more suspicious  Each clue uncovered only raises new questions Who killed Doctor Crow What caused one of the asylums male staff to lose his mind Who is Zed Rascov What connects the doctors death to the name of the little girl Ginger carved into the woodpaneled wall of his office,80.0,3.1,3.22,5.26,68.0,27.0,79.0
1411084800,13675,Cannon Brawl,"[3, 6, 14, 48, 49, 130]","[11, 13, 15, 31, 32]",Cannon Brawl is a 2D action strategy game with big explosions and destructible terrain Command the action from your airship to build cannons capture mines expand your territory and more Choose from a multitude of buildings cannons and towers to assemble a force that will rain destruction from the sky and defeat your enemy Advance your military campaign across the map in single player mode or duke it out in multiplayer mode,Missing,80.0,2.25,3.67,7.29,70.0,4.0,6.0
1409702400,11421,Kitty Powers' Matchmaker,"[6, 14, 39, 48, 49]","[13, 15, 32, 33, 34]",Kitty Powers Matchmaker is a hilarious dating simulator with a difference Manage your own matchmaking agency with the guidance of your fabulous boss drag queen diva Kitty Powers,Missing,80.0,9.46,16.57,39.62,73.0,9.0,12.0
1411948800,4512,Pier Solar and the Great Architects,"[3, 6, 9, 14, 23, 41, 46, 48, 49, 72]","[12, 31]",In the peaceful town of Reja there live three best friends Hoston Alina and Edessot Young and curious they want to go on a herbseeking quest to help cure Hostons fathers illness Little do they know  it will be the beginning of their lifetime journey where they will learn the true meaning of friendship and the thrill of adventure  This journey will demand their courage and wisdom to solve a longlost mystery while they face the evil forces dispatched by a mysterious entity Through this escapade they will be reborn as great heroes to protect the universe from imminent destruction,Missing,80.0,26.39,32.69,40.5,65.0,15.0,19.0
1411430400,24608,Arcana Heart 3: Love Max!!!!!,"[6, 9, 46]",[4],With its own unique battle system and a wide selection of characteristic angels the girls are appearing on Steam for the first time in Arcana Heart 3 LOVE MAX,Missing,77.76435357422659,nan,nan,nan,nan,nan,nan
1409616000,21662,Don't Starve: Giant Edition,"[9, 41, 46, 49]",[31],An uncompromising wilderness survival game full of science and magic,Missing,76.0,nan,nan,nan,nan,nan,nan
1409788800,93620,Minecraft: PlayStation 4 Edition,[48],[31],The critically acclaimed Minecraft comes to PlayStation 4 Create your very own game world and explore build and conquer,Missing,75.97321344766114,nan,nan,nan,nan,nan,nan
1411603200,2939,The Vanishing of Ethan Carter,"[6, 48, 49, 130, 385]","[9, 31, 32]",In The Vanishing of Ethan Carter you play as Paul Prospero an occult detective who receives a disturbing letter from Ethan Carter and realizes that the boy is in grave danger When Paul arrives in Ethans home of Red Creek Valley he realizes things are even worse than he imagined Ethan has vanished in the wake of a brutal murder which Paul comes to see might not be the only murder to investigate Using both regular and supernatural detective skills Paul must figure out what happened to the missing boy,Missing,75.10068757387222,3.8,4.28,4.31,72.0,787.0,1312.0
1410220800,7324,NHL 15,"[9, 12, 48, 49]","[13, 14]",12 PLAYER NHL COLLISION PHYSICS  For the first time in any sports game realworld physics affects every player through every onice collision with the new 12 Player NHL  Collision Physics Utilizing the power of the next generation consoles and building off the criticallyacclaimed NHL Collision Physics system every player on the ice is governed by physics at all times Feel the hardhitting chaos of NHL hockey through truetolife secondary collisions net scrambles and player pileups capturing the desperation of every shift    REAL PUCK PHYSICS  The puck is one of the most complex items in the game to authentically replicate and it finally gets its due in NHL 15 Completely rebuilt puck physics result in a more realistic feel to every puck interaction Everything on the ice including the ice surface itself is live which leads to the unpredictable and authentic puck spins rolls and bounces seen in a real NHL game    AUTHENTIC PLAYER  EQUIPMENT MODELS  The Next Generation Hockey Player has been rebuilt from the ice up Now player models have three distinct layers  the body equipment and jersey Each layer interacts independently making every contact with the puck or other players even more realistic Dynamic Cloth technology adds an extra layer of realism as it reacts to the players movement as they explode up the ice helping bring the speed of the game to life    UNPRECEDENTED PLAYER LIKENESS  Powered by the same technology that brought the most realistic representation of the athlete to EA SPORTS UFC NHL 15 delivers groundbreaking player likeness emotion and animation From the strides a player takes to get up the ice to the emotion on their face after scoring a game winning goal the players are as real as theyve ever been    SUPERSTAR SKILL STICK  Now all the tools of an NHL superstar are in your hands The revolutionary Skill Stick has evolved to give even more control to the player Protect the puck receive passes without breaking stride and discover an arsenal of sweet new dekes all with an intuitive right stick control scheme that is easy to use but packed with depth    AUTHENTIC ARENAS  There is no feeling like being there and we are giving you the best seats in the house The power of the nextgen consoles finally allows the NHL franchise to capture every detail of an NHL arena Unique arena elements from 19000 seat capacities to lighting and player entrance tunnels are captured with a level of detail not possible on the previous generation Now those home games will truly feel like home    NEW COMMENTARY TEAM  New voices for a new generation NHL 15 welcomes the NBC Sports commentary team of Mike Doc Emrick and Eddie Olczyk to the broadcast booth TSN analyst Ray Ferraro will provide game insights at ice level Combined with Real Life Broadcast Integration that will feature realworld pregame video commentary with Doc and Eddie set against ingame visuals NHL 15 takes a revolutionary step forward in sports videogames where the lines between the real world of sport broadcast and the game are blurred    NBC SPORTS GAME DAY PRESENTATION  The most realistic broadcast package in a video game todate is possible because of a new partnership with NBC Sports Set the scene with the NHL on NBC crew welcoming you to the city during the game intros and immerse yourself in an experience that matches what you see on television with NHL on NBC graphics and branding    LIVING CROWDS  NHL 15 sets a new standard in videogames with over 9000 individual crowd models with 4x the animations of previous generations Take a look through the glass and youll see fans hold up signs with your name on them costume wearing superfans or even sections full of team rivals rooting against you Feel their behavior change after dropping the gloves landing a big hit or scoring a clutch goal The crowd is alive    VISION AI  An elevated level of player intelligence Vision AI features evolved awareness with players reading and reacting to potential plays Scoring area recognition pass anticipation and enhanced team breakouts all improve the flow of the game,Missing,75.06848342687879,36.91,69.5,0.0,66.0,24.0,6.0
1412035200,19644,Falling Skies: The Game,"[6, 9, 12, 41]","[12, 15, 16]",Heroes Will Rise Take command of a resistance squadron and outsmart alien enemies using tactical warfare in a battle for mankinds existence,Missing,75.0,0.0,48.81,115.01,40.0,2.0,4.0
1409616000,3212,The Sims 4,"[6, 14, 48, 49, 167, 169]","[12, 13]",Unleash your imagination and create a unique world of Sims thats an expression of you Explore and customize every detail from Sims to homes and much more with The Sims 4 Life and Sims are yours to control Customize your unique Sims design their homes  take them on wild adventures through celebdom romance holidays and more,Choose how Sims look act and dress Determine how theyll live out each day Design and build incredible homes for every family then decorate with your favorite furnishings and décor Travel to different neighborhoods where you can meet other Sims and learn about their lives Discover beautiful locations with distinctive environments and go on spontaneous adventures Manage the ups and downs of Sims everyday lives and see what happens when you play out realistic or fantastical scenarios Tell your stories your way while developing relationships pursuing careers and life aspirations and immersing yourself in an extraordinary game where the possibilities are endless,73.45799065576496,20.2,67.12,290.51,72.0,386.0,95.0
1411689600,8138,Neverending Nightmares,"[3, 6, 14, 46, 48, 72, 130]","[31, 32]",Neverending Nightmares is a psychological horror game inspired by the developers actual battle with mental illness In the game you take on the role of Thomas who awakens from a terrible nightmare only to find that he is still dreaming As he descends deeper through the layers of hellish dreamscapes he must hide from horrifying apparitions and outrun his inner demons He must discover which of the horrors he encounters are a manifestation of his own psychological state and figure out what reality will be when he finally wakes up,Missing,72.89794850626191,1.68,2.25,2.92,59.0,91.0,160.0
1411084800,3101,Wasteland 2,"[3, 6, 14, 48, 49]","[12, 15, 16, 31, 32]",Wasteland 2 is a postapocalyptic roleplaying video game developed by inXile Entertainment and published by Deep Silver It is the sequel to 1988s Wasteland and was successfully crowdfunded through Kickstarter,The game is set in an alternate history timeline in which a nuclear holocaust took place in 1998 in relation to an impact event involving a cluster of meteors that sparked a global nuclear war On the day of the cataclysm a company of US Army Engineers were in the desolate southwestern desert constructing bridges in an area with a number of small survivalist communities and a newly constructed federal death row prison with light industrial facilities The soldiers sought shelter in the prison expelled the inmates and invited nearby survivalists to join them shortly thereafter Years later together they formed the Desert Rangers in the great tradition of the Texas and Arizona Rangers to help other survivors in the desert and beyond it,72.44521656250723,41.36,65.6,101.69,76.0,183.0,275.0
1411430400,7574,FIFA 15,"[48, 49]",[14],FIFA 15 is a football simulation game developed by EA Canada and published by Electronic Arts FIFA 15 is the first of the series to be developed for next generation Xbox One and PS4 consoles and also features the new Ignite game engine,Missing,72.3215928220336,61.14,134.42,256.24,71.0,142.0,52.0
1410220800,1939,Destiny,"[9, 12, 48, 49]","[5, 12]",Bungie has emphasized that the universe of Destiny will be alive Events may happen ingame that are not necessarily controlled or planned by the developer which will help to create a dynamic developing experience for Bungie and a dynamic playing experience for gamers The games style has been described a firstperson shooter that will incorporate massively multiplayer online game MMO elements but Bungie has avoided defining Destiny as a traditional MMO game Instead the game has been referred to as a sharedworld shooter as it lacks many of the characteristics of a traditional MMO game For instance rather than players being able to see and interact with all other players in the game or on a particular serveras is the case in many conventional MMO gamesDestiny will include onthefly matchmaking that will allow players to see and interact only with other players with whom they are matched by the game Destiny will incorporate a new game engine that allows global illuminations and realtime dynamic lighting to occur together An innovation in Bungies hopper technology which has been the backbone for Halos matchmaking system will allow better player matchmaking in order to create a more natural experience in either cooperative or competitive multiplayer modes,Setting Destiny is set in the distant future after an event referred to as the Collapse ended the Golden Age that was started by the discovery of The Traveler and pushed humanity to the brink of extinction The force responsible for the Collapse is known as The Darkness and indirectly acts as the primary antagonist Battles against the forces of The Darkness are fought at various locations throughout the Solar System  Plot The game begins with the players Ghost resurrecting them as a Guardian after having been dead for an unknown length of time The Guardian is quickly forced to fight Fallen who have inhabited the ruins of the nearby Cosmodrome in Old Russia The Guardian with the aid of their Ghost is able to secure a jumpship and escape to The Tower that houses the Guardians on The City border  After being outfitted and introduced to the Vanguard and Gunsmith the duo learn from Amanda Holliday that their Arcadia Class Jumpship is missing its Warp Drive a component necessary for interplanetary travel Due to the scarcity of the part and flyable jumpships in general the Guardian is forced to return to where they found the ship in an attempt to find the part,72.2016620852922,12.06,63.96,547.05,72.0,747.0,667.0
1411689600,113845,Nanairo Reincarnation,"[6, 46]","[31, 34]",Join spirit detective Kagami Makoto and his demon familiars as they hunt down the wandering ghosts disrupting the peace of his small town,Kagami Makoto is in his 3rd year of college when he inherits the estate of his late grandfather and starts planning out what hes going to do with his newfound home However his plans are foiled when his childhood friend Iyo who turns out to be a zashikiwarashi introduces herself looking exactly the same as he remembers her from over a decade ago Then a woman named Kikyou who claims to be a demon also appears before him After that it isnt long before a pretty detective at the police department comes knocking on his door imploring him to take up his familys duty of helping wandering spirits pass on to the afterlife and assist the police with any and all supernatural crimes reported in town But when a case thats bigger than any of them ever imagined comes his way will he be able to handle it With the power of clairvoyance an ability passed down through his family that allows him to see spirits maybe he and his demon familiars can pull through and he can be a proper successor to his familys legacy,70.0,10.8,13.73,17.52,78.0,10.0,14.0
1411603200,35252,Cosmophony,"[3, 6, 9, 14, 39, 41, 46, 48]","[5, 7, 32]",Cosmophony is a musical shooter designed for demanding gamers seeking an original and intense experience,Missing,70.0,0.0,0.0,5.77,60.0,2.0,2.0
1411516800,20294,CastleStorm: Definitive Edition,"[48, 49]","[5, 24, 31, 32]",Super genre mashup CastleStorm Definitive Edition is invading the PlayStation 4 The game will contain the entire original campaign and expansions as well as brand new content including new battles modes spells and features Stay tuned for details,Missing,70.0,nan,nan,nan,nan,nan,nan
1410998400,17818,Disney Infinity 2.0: Marvel Super Heroes,"[6, 9, 12, 34, 39, 41, 46, 48, 49]",[31],In Disney Infinity Marvel Super Heroes players will use realworld interactive Marvel figures to activate original storylines Play Sets in the virtual game worlds of some of Marvels most popular franchises including The Avengers In the Play Sets  penned by awardwinning Marvel comic writer Brian Michael Bendis  players will be able to take on the role of more than 20 Marvel characters including Captain America Iron Man Black Widow Thor Hulk and Hawkeye to battle enemies complete challenging missions solve puzzles and ultimately save the world from destruction,Missing,69.09051283204678,nan,nan,nan,nan,nan,nan
1412035200,7897,Chariot,"[6, 9, 41, 48, 49]","[8, 9, 15, 31, 32]",Chariot is a humorous physicsbased couch coop platformer in which a brave princess and her suitor carry a funeral wagon through ancient caves They must fend off swarms of looters while amassing riches to bury the Kings remains in a worthy goldfilled tomb If only that dead King would keep quiet  The Chariots large wheels and long tethers allow the heroes to reach higher ground swing across chasms and perform all sorts of impressive maneuvers Extract riches from the very walls of the caves in multiple environments and make your way to the exit by avoiding envious looters or by beating them back as they attempt to steal your hardearned loot With skilltesting coordination mechanics and thrilling physicsbased stunts required Chariot will definitely please couch coop enthusiasts as teamwork and cooperation unlocks new possibilities,Cariot is the story of a princess whose task is to lay her fathers remains in his final resting place With the help of her fiancé she has to take this heavy chariot holding the kings remains through underground mazes in order to reach a sepulcher fit for His Majesty  However the kings ghost bound to the chariot has quite a temper and insists that he be buried with vast amounts of riches As the couple progresses tunneling deeper and deeper underground theyll have to stray off the main path to get their hands on precious gems,69.0,12.76,30.0,31.07,61.0,18.0,8.0
1409616000,20058,Warriors Orochi 3: Ultimate,"[9, 46, 48, 49, 130]",[25],Warriors Orochi 3 Ultimate is an enhanced version of the hit action game Warriors Orochi 3 once again combining the much loved heroes of the Dynasty Warriors and Samurai Warriors series The mythology of the Orochi universe expands with a new main storyline which brings the heroes together again into the chaos of battle as they are summoned upon by a mysterious stone The adventure is complemented by side stories offering over 175 scenarios and endings to uncover including the ability to battle from the point of view of various characters and even what if hypothetical stages that exist in a parallel world,Missing,67.89079552146525,nan,nan,nan,nan,nan,nan
1410825600,20059,KickBeat: Special Edition,"[41, 48, 49]","[4, 7, 31]",KickBeat  Special Edition offers up a fulllength singleplayer campaign beautifully handdrawn animations and a strikingly unique art style,Missing,67.0,nan,nan,nan,nan,nan,nan
1411430400,7293,Gauntlet,"[6, 48]","[12, 25, 31]",The classic Gauntlet 4player coop action gameplay returns in a completely new experience Play as one of four distinct heroes in an intense monster filled dungeon brawler with a combination of both uniquely built and randomly generated levels to explore Battle the endless hordes of foes as you and your friends fight for treasure and glory via both local and online coop multiplayer,For ages foolhardy adventurers have been lured by promises of countless treasures in the depths of the Gauntlet yet none have ever made it out alive The corrupt wizard Morak conjures minions and devious traps against wouldbe champions and taunts them all along the way But a new group of heroes looks to succeed where all others have failed  Warrior Valkryie Elf and Wizard  each has their own reason for entering the Gauntlet but all four are bound together for one goal to survive the Gauntlet and claim the ultimate prize,66.1165260276585,6.03,11.17,24.02,67.0,129.0,145.0
1410393600,8479,Naruto Shippuden: Ultimate Ninja Storm Revolution,"[6, 9, 12]","[4, 31]",The latest instalment of the NARUTO SHIPPUDEN Ultimate Ninja STORM series will offer players a new experience in the deep  rich NARUTO environment Tons of new techniques enhanced mechanics over 100 playable characters  Support Ninjas and a brand new exclusive character MechaNaruto designed by Masashi Kishimoto,Missing,66.01168820554689,4.18,19.5,54.18,66.0,130.0,86.0
1411689600,22153,"Run, Sackboy! Run!","[34, 39, 46]",[8],Run like the wind as LittleBigPlanet hero Sackboy dashes off in a fast paced platformer from the Negativitron through The Gardens Avalonia and The Canyons,Missing,65.21266732340499,nan,nan,nan,nan,nan,nan
1411948800,17473,Watch Dogs: Bad Blood,"[6, 9, 12, 48, 49]",[31],Revisit Chicago in a brand new Watch_Dogs adventure Play as TBone Grady the legendary and eccentric hacker and Aiden Pearces trusted comrade Now on the run from Blume TBone only has two choices flee and start a new life elsewhere or fight Blume to save an old friend Face your shady past on your road to redemption,Missing,64.9947942516522,4.25,7.95,16.19,70.0,117.0,159.0
1410998400,15852,Roundabout,"[3, 6, 14, 46, 48, 49]","[9, 31, 32]",Drive a constantly spinning limousine around town Roundabout is a 70s BMovie game where you pick up passengers find secret collectibles take on dangerous missions and fall in love in a far out open world puzzle adventure  all while driving a revolving limo,Missing,63.6395792013904,2.52,4.62,9.4,67.0,87.0,119.0
1410825600,23228,Murasaki Baby,[46],"[8, 9, 31]",Murasaki Baby tells the story of a little girl who wakes up in a weird world populated by childrens fantasies and fears Holding a purple heartshaped balloon in her hand she feels lost homesick and vulnerable She wants her mommy,Missing,60.17604074680686,2.43,2.46,2.47,62.0,37.0,44.0
1411430400,20044,Gauntlet: Slayer Edition,"[6, 48]","[12, 31]",The classic Gauntlet 4player coop action gameplay returns in a completely new experience Battle the endless hordes of foes as you and your friends fight for treasure and glory via both local and online coop multiplayer Invade the Darkness,Missing,60.01926160077679,nan,nan,nan,nan,nan,nan
1411689600,11223,Thief Town,"[3, 6, 14, 34, 39, 48, 130]","[32, 33]",Thief Town is a local multiplayer stealth action game set in a pixelperfect rendition of the Wild West Lurk in the crowd emulate nonplayer characters and achieve backstabbing victory,Missing,60.0,0.0,0.0,17.0,70.0,2.0,1.0
