,id,name,platforms,summary,genres,storyline,rating,main,extra,completionist,review_score,review_count,people_polled
47,81604,Ganbare! Super Strikers,"[3, 6, 14, 46, 48, 49, 130, 167]",Ganbare Super Strikers is an innovative mix between Tactical RPG and Soccer Win matches to level up and earn new equipment that will allow you to learn Special Abilities boost your players stats or protect yourself against Altered Statuses such as Sleep Silence or Poison  The game features a Story Mode where you assume the role of a small town soccer team in Japan on their way to victory Perform well enough and you will be selected to join the Japan National Team where you will need to play alongside old rivals in order to conquer the world There are loads of different characters each with their own strengths and Special Abilities,"[12, 14, 15, 33]",Missing,70.0,0.0,8.2,13.74,65.0,2.0,4.0
48,68364,Mugsters,"[6, 14, 48, 49, 130]",Aliens have taken over the planet and enslaved humanity Only you have the knowhow to drive back the dastardly threat free your fellow Earthlings and SAVE THE WORLD  Mugsters is a physicsbased supercharged actionpacked puzzler with sandbox levels where you must outrun outmanoeuvre and outsmart your enemies by experimenting with different vehicles environmental traps and explosives  Mugsters is focused on the players creativity Break out the prisoners collect the crystals and get the heck out of dodge any way you can,"[8, 9, 31, 32]",Missing,70.0,0.0,0.0,15.0,65.0,4.0,2.0
49,37037,War Tech Fighters,"[6, 48, 49, 130]",War Tech Fighters is a space action game where giant mechs battle against the Zatros empire in a desperate struggle for survival,"[4, 5, 13, 31]",Missing,70.0,0.0,0.0,15.81,30.0,1.0,2.0
50,96065,The Spectrum Retreat,"[6, 48, 49, 130]",Checkin to The Spectrum Retreat for a stay you wont forget Manipulate your way to the truth in this captivating narrativedriven puzzler,"[8, 9, 15, 31, 32]",You awake at The Penrose hotel a peaceful yet unsettling refuge from the outside world All is not as it seems and your desire to unearth the truth is obstructed by an array of colorcoded puzzles mindbending physics challenges and the growing fear of exposing your true intentions,69.81557743386449,4.94,5.1,5.85,65.0,54.0,105.0
51,78149,Adventure Time: Pirates of the Enchiridion,"[6, 48, 49, 130, 170]",The Land of Ooo is underwater and its up to Finn and Jake to find out why Join our heroes as they explore dangerous waters search for clues interrogate pirates and fight bad guys to solve this wet wet mystery and save the day,"[4, 12, 31]",Missing,68.83662734800636,6.11,8.53,11.35,61.0,57.0,92.0
52,104985,Kingdom Come: Deliverance - From the Ashes,"[6, 48, 49]",The first DLC for Kingdom Come Deliverance introduces an entirely new type of adventure You have an opportunity to participate in building a new village from the ground up and experience firsthand what it was like to create a new settlement  As a newly appointed bailiff you must decide what buildings to erect and what people to bring in and you must also settle disputes between the villagers Each building is unique and comes with its own upgrades material and labour requirements so you will face some difficult decisions  A bailiffs lot is not an easy one but he can still enjoy some fun after a hard days work Get yourself one of the new horses available and take it for a ride throw a few dice against seasoned players in your new local tavern match your skills against variously skilled opponents in your combat arena or just rest at home in your own comfortably furnished house,"[12, 31]",Missing,67.57658460614458,5.55,5.64,6.57,75.0,21.0,22.0
53,27208,Mothergunship,"[6, 48, 49]",Our mission is clear our determination strong and our guns are very very big MOTHERGUNSHIP is a bullethell FPS hybrid facing you Earths last hope against the fleets of datahoarding robotic alien invaders Take the fight to the enemy craft gun monstrosities that no reasonable person could ever lift and experience randomized mayhem as you battle your way to the heart of the fleet to destroy the MOTHERGUNSHIP,"[5, 32]",Missing,67.49989083066103,4.54,9.85,16.21,64.0,41.0,34.0
54,96027,Red Faction: Guerrilla Re-Mars-tered,"[6, 48, 49, 130]",Set 50 years after the climactic events of the original Red Faction Red Faction Guerrilla allows players to take the role of an insurgent fighter with the newly reestablished Red Faction movement as they battle for liberation from the oppressive Earth Defense Force Red Faction Guerrilla redefines the limits of destructionbased gameplay with a huge openworld fastpaced guerrillastyle combat and true physicsbased destruction,"[5, 31, 33]",Alec Mason a mining engineer arrives on Mars Tharsis Region to reunite with his brother Dan and begin a new life While on work detail Dan testifies about the Earth Defense Forces EDF cruelty to the Martian people and asks Alec to join the Red Faction of which Dan is a member Dan is soon after gunned down by air support from an EDF assault team Alec is rescued by Red Faction guerrillas and reluctantly becomes a freedom fighter for the group alongside avid inventor Sam Samanya rambling psychotic Randy Jenkins and commander Hugo Daviesalthough in the game known as RF commander Between Daviess command and Alecs skill and bravery the EDF are quickly driven out of the sector known as Parker  The campaign against the EDF continues in the Dust sector and Alec is eventually assigned to routine surveillance of the Marauders a mysterious and violent warrior tribe living in the inhospitable Badlands in hopes of recovering stolen weapons Alec tracks them to an abandoned Ultor base that promptly comes under massive assault from the EDF During the fracas Alec escapes with a device called the Nano Forge This brings attention to Admiral Kobel commander of a powerful warship called the Hydra along with General Roth commander of the EDF forces on Mars who declares Alec Mason an outlaw General Roth turns his attention to Dust and the EDF responds by pulling out of the sector and ordering the artillery base in the Free Fire Zone to bomb Dust into oblivion Alec is tasked with saving members of the Red Faction and intel on the EDF from the bombardment which he succeeds in doing  Alec temporarily loses faith in the movement citing that no matter how determined their efforts are the EDF will simply bomb them to submission However Sam analyzes the Nano Forge and discovers it can create catastrophic nanites that can disintegrate any object She builds a prototype rifle from the device and entrusts it to Alecs care  After determining a series of blind spots in its coverage a successful run against an EDF artillery base commences allowing the group to begin take the fight to EDF territories The Red Faction prepares to launch a massive coordinated offensive against the EDF Consequently the EDF stages an assault against the Red Faction resulting in the abortion of the offensive the annihilation of the Badlands camp and the death of Commander Davies Only Sam Alec and a handful of other fighters survive the assault They learn afterward that the Hydra is nearing Mars with Kobel intending to use its firepower to put an end to the Red Faction and if necessary all planetary life Sam declares that they need support from the Marauders if their campaign is to continue When Alec remains dubious she reveals that she was a Marauder herself The pair head to a Marauder stronghold to meet with their ruler Vasha Sams sister Sam requests the usage of the Marauders particle accelerator technology with plans to combine it with the Nano Forge creating a weapon capable of destroying the Hydra Vasha agrees to let the Red Faction use their technology in exchange for possession of the Nano Forge once the war is finished  After capturing a broadcasting station and using it to regroup the Red Faction Sam and Alec lead the remaining Red Faction and Marauders on a final assault on EDF Central Command The two groups converge on Mt Vogel to assemble the machine however a surprise EDF blitzkrieg led by General Roth wipes out the Marauders guarding the summit end of the accelerator and Vasha along with them Alec storms the mountain with a modified missilepod tank defeating General Roths army and killing Roth Sams plan succeeds and the accelerated Nano Forge is successful in vaporizing the Hydra As the survivors of Mars celebrate Sam declares the war over but Alec responds that the EDF will return stating Well be ready for em Alec and Sam approach the crowds of civilians gathered and Alec raises his hammer in the air showing the sign of the Red Faction and their longwaited victory,66.76712767684562,11.22,17.71,34.82,68.0,83.0,117.0
55,106102,Forsaken Remastered,"[3, 6, 14, 49]",Developed by Probe Entertainment and Iguana Entertainment and first released in 1998 for PlayStation PC and Nintendo 64 Forsaken was a vision of a dystopian future where science has gone out of control Scavengers from all over the known worlds have come to Earth to loot the remains of the technology that can found in underground tunnels But beware You must fight your way past automated defenses and the scum of the universe to find the treasures hidden on each level  As you mount your hoverbike be prepared for deadly combat You are going to quickly learn that the future is Forsaken,"[5, 31]",Missing,60.0,,,,,,
56,105085,Endless Fables 3: Dark Moor,"[3, 6, 14, 48, 49, 130]",During her new adventure Pamela Cavendish goes to a misty and mysterious Scotland where a seemingly innocent landscape of moor quickly reveals its dark nature Spectre from the past and ghostly sounds will force her to follow the amazing legend of the Red Moon,"[2, 9, 31]",Missing,60.0,2.03,2.42,2.88,65.0,11.0,27.0
57,104849,Bring to Light,"[6, 48, 49]",Trapped in the city subway system due to a sudden disaster you explore the depths of the tunnels to find your way out The further you explore the more you realize there is more to this disasterand the lurking shadows are following your every move,"[9, 31, 32]",Missing,60.0,0.0,0.0,0.0,30.0,1.0,0.0
58,52263,All-Star Fruit Racing,"[6, 48, 49, 130]",AllStar Fruit Racing is the kart racing game youve been waiting for Easy to learn but hard to master choose your character customize your kart and play the way that tempts you most,"[10, 14, 32]",Missing,60.0,5.54,9.0,0.0,58.0,5.0,5.0
59,29824,Out of the Box,"[3, 6, 14, 34, 48, 49, 130]",You are Warren Baker the new bouncer in The Box the most exclusive club in town You will have to interact with several different types of customers Some of them match the rules to get in and some of them dont its your job to choose who may come in Throughout many different days Warren will have to make some decissions that will affect his life in many different ways,"[9, 13, 15, 31]",Missing,60.0,5.61,10.42,10.45,68.0,10.0,13.0
60,26945,Guts and Glory,"[3, 6, 14, 48, 49, 130]",Guts and Glory is a game about racing to the finish line while everything tries to kill you and you laugh about it,"[9, 10, 13, 32, 33]",Missing,60.0,4.95,5.1,6.89,50.0,20.0,15.0
61,27186,Earthfall,"[6, 48, 49, 130]",Earthfall is a cooperative shooter for up to four players Using teambased tactics to fortify holdouts and complete objectives players must work together to survive,"[5, 31]",Missing,59.70098275764916,5.37,7.0,0.0,54.0,11.0,7.0
62,104862,Super Destronaut DX,"[6, 46, 48, 49, 130]",Once upon a time arcade shooter gamers where you have to fend off impending waves of an alien menace was all the rage but while retro may be old it is never forgotten So inspired by an arcade classic Super Destronaut DX is retro space shooter that pits you against an enemy more dreaded than a UFO a scoreboard With multiple modes and highscores that can be attained by yourself and players all over the globe this is one game that will put you on the path of achieving as high a score as you can possibly muster,"[32, 33]",Missing,56.22763946957222,0.4,0.0,0.66,62.0,13.0,26.0
63,90082,Far Cry 5: Lost on Mars,"[6, 48, 49]",Lost on Mars transports the franchises insanity from Hope County to the red planet as Nick Rye is teleported to a hostile planet to help his buddy Hurk thwart an alien invasion of Earth This adventure gives players a new arsenal of alien weaponry including the Blaster of Disaster Hellfire and Morphinator while also introducing a new traversal tool with Space Jets Humankinds future is in the hands of the games most notorious gunsforhire Time to squash some bugs,"[5, 31]",Missing,51.85423111785064,4.67,5.16,7.03,61.0,70.0,107.0
64,96254,Mega Man X: Legacy Collection 2,"[6, 48, 49, 130]",Mega Man X Legacy Collection 2 also spans two gaming eras showcasing the evolution of the series with Mega Man X5 Mega Man X6 Mega Man X7 and Mega Man X8 A third playable character Axl joins the cast in Mega Man X7 and Mega Man X8 as the series jumps into a new realm of 3D character models and environments,"[5, 8]",Missing,50.0,,,,,,
65,95116,Thief of Thieves: Season One,"[6, 49, 130]",Thief of Thieves Season One is a story of heists and the people behind them Its time for Celia protege of master thief Redmond to make the leap from apprentice to master A new continent and a new team will you make the cut,"[31, 32]",Missing,50.0,5.39,6.38,9.77,64.0,11.0,11.0
66,90782,Blast Zone! Tournament,"[6, 48, 49]",Blast Zone Tournament is the fastpaced game where fun meets explosive combat 32 player crossplatform multiplayer either local online or combined Ranked and unranked matches to cater to both casual players and hardcore fans 10 solo and teambased multiplayer modes including FreeForAll Team Deathmatch Bomb Blast Treasure Mode King Mode Zombie Mode and more Storydriven singleplayer Challenge Mode with 240 unique challenges 280 multiplayer levels with tweakable options including handicaps lives starting items bomber stats overall match settings and more Create individual characters with over 10 billion unlockable cosmetic and gear item combinations Robust set of social features from friends lists to partying news mail and more to help foster a healthy community and lay the foundations for esports tournaments Pulsating party soundtrack,"[14, 32]",Missing,50.0,0.0,0.0,0.0,20.0,1.0,0.0
67,89554,Defiance 2050,"[6, 48, 49]",Defiance 2050 is a futuristic free to play online shooter set in an extraordinary postapocalyptic world with advanced alien technology Fight on your own or alongside friends as you explore and unlock powerful weapons with extensive skill and customization systems  For the 5th anniversary of Defiance the game is being remade from the ground up  Some account information will be transferable from the original game Account based purchases like character and loadout slots as well as specific unique titles such as Old School will also be transferred over A reward system is also going to be added to the original game with players earning Valor which will also be usable in some way More information on this system will be revealed later,"[5, 12, 31]",Missing,50.0,0.0,10.98,32.4,25.0,2.0,2.0
68,74140,Car Demolition Clicker,"[6, 48, 49, 130]",Ever dreamed of smashing your own car Or maybe a car of your neighbour Well now you have a chance Grab your weapon call out your battle drones and start clicking the car into oblivion Earn cash upgrade your equipment and find more vehicles to destroy,"[13, 32, 33]",Missing,50.0,0.0,0.0,20.07,55.0,4.0,4.0
69,54565,Tempest 4000,"[6, 48, 49, 130]",In Tempest 4000 players are once again in control of the Claw a powerful spacecraft equipped to destroy deadly creatures and other obstructions with rapidfire shots on vibrant geometric prisms With three game modes to choose from and 100 levels to conquer players must eliminate all enemies as quickly as possible to survive and achieve that coveted spot at the top of the leaderboards,"[5, 7, 9, 33]",Tempest 4000 is a visually stunning actionpacked tube shooter based on the classic hit arcade game Tempest Developed by legendary game designer Jeff Minter Tempest 4000 remains faithful to the original fastpaced gameplay by putting you in control of the Claw a powerful spacecraft equipped to destroy deadly creatures and other obstructions with rapidfire shots on vibrant geometric prisms Featuring fantastical graphical environments 100 levels three game modes and more you must eliminate all enemies as fast as possible to survive and compete for the highest score on the leaderboards,50.0,0.0,0.0,0.0,80.0,1.0,0.0
70,33055,Varenje,"[3, 6, 14, 49, 130]",Varenje is a cute colourful adventure with a number of puzzles and minigames made by artists for anyone that considers games to be an art,"[2, 9, 31, 32]",Missing,50.0,3.33,3.6,5.33,71.0,8.0,16.0
71,103367,The Culling II,"[6, 48, 49]",The Culling returns to take Battle Royale to the next level Realworld weapon ballistics A strategically brutal melee combat system Perks to customize your play style Fifty contestants will drop in and compete for glory but only one will be crowned the winner Do you have what it takes,"[5, 32]",Missing,20.0,0.0,0.0,0.0,0.0,0.0,0.0
