first_release_date,genres,id,name,platforms,summary,storyline,rating,main,extra,completionist,review_score,review_count,people_polled
1662422400,"[12, 13, 31]",214448,Disney Dreamlight Valley: Deluxe Edition,"[6, 49, 167, 169]",Disney Dreamlight Valley Deluxe Edition includes   Access to Disney Dreamlight Valley  All the exclusive cosmetic items from the Standard Edition  14500 Moonstones  Exclusive Deluxe Celestial Sea Turtle animal companion  Exclusive Deluxe Clothing Set 5 wearable items  Exclusive Deluxe Ears Headband  Jersey 2 wearable items  Exclusive Deluxe Furniture Set 8 decoration items  Exclusive Deluxe Wall  Floor Coverings 2 decoration items  Exclusive Deluxe Design Motifs 3 motifs to use in the Touch of Magic tool,Missing,Missing,nan,nan,nan,nan,nan,nan
1662508800,"[13, 14]",214247,PBA Pro Bowling 2023,"[6, 48, 49, 130]",The ultimate bowling game is back with PBA Pro Bowling 2023 Become a PBA legend with the completely redesigned single player Career Mode or compete in Online matches and tournaments against your friends and rivals as yourself or as any of todays top PBA bowlers,Missing,Missing,nan,nan,nan,nan,nan,nan
1663804800,[13],214141,Train Life: A Railway Simulator - The Orient-Express Edition,"[48, 49, 130, 167, 169]",The OrientExpress Edition contains the complete Train Life A Railway Simulator game and the 1920s OrientExpress Train DLC Take the controls of the OrientExpress train operated by the Compagnie Internationale des WagonsLits only in Train Life,Missing,Missing,nan,nan,nan,nan,nan,nan
1662508800,"[13, 14, 15, 32]",213436,Axis Football 2023,"[6, 48, 49, 130]",Axis Football is a simulationstyle football game featuring the industrys best franchise mode massive customization and realistic gameplay,Missing,Missing,nan,nan,nan,nan,nan,nan
1664150400,"[10, 13, 14]",213356,World of Outlaws: Dirt Racing,"[48, 49, 167, 169]",Start as a local track racer and work your way up the ranks to become the next World of Outlaws champion Upgrade your car team and facilities to stay competitive with the best of the best  Race in both the premier World of Outlaws Sprint Car and Late Model Series as well as 4 additional DIRTcar classes across more than 40 tracks  Race at iconic realworld venues like Eldora Volusia Williams Grove and more World of Outlaws Dirt Racing features 14 officially licensed tracks and many others inspired by real world venues,Missing,Missing,0.0,0.0,0.0,0.0,0.0,0.0
1662076800,[13],213114,Train Sim World 3: Deluxe Edition,"[6, 49, 169]",Conquer American mountains as you haul tonnage with the workhorses of industry get the British capitals commuters to work in record time race aboard German highspeed traction and navigate the 1950s in the Jubilee Class along the 36mile Spirit of Steam,Missing,Missing,nan,nan,nan,nan,nan,nan
1662422400,"[10, 13]",213113,Train Sim World 3,"[6, 48, 49, 167, 169]",Conquer American mountains as you haul incredible tonnage with the workhorses of industry get the British capitals commuters to work in record time and race statetostate aboard German highspeed traction with Train Sim World 3 Standard Edition,Missing,Missing,0.0,42.17,440.55,51.0,7.0,3.0
1663200000,"[4, 33]",212614,Last Beat Enhanced,"[48, 49, 130]",Amazing Coop mode 9 Different Stages Bonus stages and Secret areas,Missing,Missing,nan,nan,nan,nan,nan,nan
1663718400,"[12, 13, 15]",212339,The DioField Chronicle: Digital Deluxe Edition,"[49, 130, 169]",A gritty and immersive story brought to life with the latest technology Introducing Real Time Tactical Battle RTTB a new deeply strategic realtime battle system,Missing,Missing,nan,nan,nan,nan,nan,nan
1662422400,"[12, 31]",212338,Temtem: Deluxe Edition,"[130, 169]",The Temtem Digital Deluxe Edition includes the game plus  A collection of Deluxe Edition bonus cosmetic content to be revealed at a later date  available when Temtem launches,Missing,Missing,nan,nan,nan,nan,nan,nan
1664409600,[13],209811,FIFA 23: Ultimate Edition,"[6, 48, 49, 167, 169, 170]",Kick off your season with a boost FIFA 23 Ultimate Edition includes Xbox One  Xbox Series XS games plus 4600 FIFA Points,Missing,Missing,nan,nan,nan,nan,nan,nan
1663545600,Missing,208743,Construction Simulator: Day One Edition,"[6, 48, 49, 167, 169]",The Day One Edition of Construction Simulator contains additional designs for your personal protection equipment Customize your helmets with 9 different designs and choose from a selection of ear protection and glasses Additionally you can choose a sleek new sports car to drive around the two huge world maps and find a bobblehead of your good friend Hape on the dashboards of select vehicles,Missing,Missing,nan,nan,nan,nan,nan,nan
1662681600,"[13, 14]",208715,NBA 2K23: Michael Jordan Edition,"[48, 49, 130, 167, 169]",Rise to the occasion in NBA 2K23 Showcase your talent in MyCareer Pair AllStars with timeless legends in MyTeam Build your own dynasty in MyGM or guide the NBA in a new direction with MyLeague Take on NBA or WNBA teams in Play Now and feel truetolife gameplay,Missing,Missing,nan,nan,nan,nan,nan,nan
1664409600,"[9, 12, 13, 15]",208433,Let's Build a Zoo + Dinosaur Island Bundle,"[49, 130, 169]",Experience Springloadeds Zoo management sim Lets Build a Zoo alongside the newest DLC Lets Build a Zoo Dinosaur Island with the ultimate bundle,Missing,Missing,nan,nan,nan,nan,nan,nan
1662508800,"[5, 31, 33]",208040,Game Type DX,"[48, 49]",Help Hoodie Girl fight the evil MediaBalls inane advertisements Its a high score shooter in which each loop increases the speed and difficulty,Missing,Missing,nan,nan,nan,nan,nan,nan
1662076800,"[5, 32, 33]",207574,Overdriven Evolution,"[6, 49, 130]",Destroy Huge Bosses dodge thousand of bullets and resolve quick puzzles with your powerfull space ship  New and remade stages with improved graphics and 3D environments More enemies and more bullets ,Missing,Missing,nan,nan,nan,nan,nan,nan
1663027200,[31],207386,Alfred Hitchcock: Vertigo - Limited Edition,"[6, 48, 49, 130, 167, 169]",This edition includes the following  Game Alfred Hitchcock Vertigo  48Pages Official Artbook  Digital Artbook  Digital Original Soundtrack,Missing,Missing,nan,nan,nan,nan,nan,nan
1663113600,"[8, 9, 13, 31, 32]",206756,Q.U.B.E. 10th Anniversary,"[6, 48, 130, 167, 169]",Entirely rebuilt from the ground up QUBE 10th Anniversary is the ultimate celebration of the decadeold original bringing refined visuals completely redesigned and revised gameplay sections and a whole new chapter to the awardwinning braintwisting firstperson puzzler,Missing,Missing,6.03,6.35,8.53,66.0,7.0,10.0
1664409600,[12],206675,Pathfinder: Wrath of the Righteous - Limited Edition,"[48, 49]",The Limited Edition of Pathfinder Wrath of the Righteous includes an official handbook 4 DLCs and stickers,Missing,Missing,nan,nan,nan,nan,nan,nan
1663632000,"[13, 15]",206188,Construction Simulator,"[6, 48, 49, 167, 169]",Construction Simulator is back  bigger and better than ever Take charge of over 70 machines dozens of them brand new to the franchise and build to your hearts content on two huge maps  on your own or with your friends,On the European map inspired by the idyllic cities of Southwest Germany youll find rolling hills and beautiful riversides In Friedenberg your mission is to help design solutions for renewable energy and improve the citys infrastructure during the campaign Aside from these larger jobs youll get assorted tasks to test out every bit of equipment that you earn Take pride in your accomplishments as you ride through the city,Missing,45.0,48.5,67.5,75.0,2.0,4.0
1664409600,Missing,205781,FIFA 23: Deluxe Edition,"[6, 49, 169]",Missing,Missing,Missing,nan,nan,nan,nan,nan,nan
1662595200,"[12, 25, 31]",205569,Steelrising: Bastille Edition,"[6, 167, 169]",The Bastille Edition includes the base game the MarieAntoinette outfit the access to the exclusive beta from August 25 the Discus Chain weapon and the Cagliostros Secrets DLC when it releases in November,Missing,Missing,nan,nan,nan,nan,nan,nan
1663286400,"[5, 8, 31, 33]",204925,Unichrome: A 1-Bit Unicorn Adventure,"[48, 49, 130, 167]",Runandgun platforming singleplayer arcade action mixed with offkilter comedy Horndash TripleBarrelShotgunBlast MolotovCocktail and RainbowBazookaBlast your enemies to their death Homing bullets automated turrets and icebeams spice up the rainbowcolored carnage,Missing,Missing,nan,nan,nan,nan,nan,nan
1662076800,[4],204756,JoJo's Bizarre Adventure: All-Star Battle R - Deluxe Edition,"[49, 130, 169]",The Deluxe Edition includes  Full game  Season Pass  5 Special Event Outfits  JoJos Bizarre Adventure AllStar Battle R brings Hirohiko Arakis masterpiece to life in fighting game form  Battle with 50 colorful characters from the world of JoJos Bizarre Adventure wielding Stands Hamon and more See how characters who could never meet in the story interact when they come face to face  Even newcomers to the fighting game genre can have fun with onebutton combos and ultimate moves,Missing,Missing,nan,nan,nan,nan,nan,nan
1663200000,"[10, 13, 14]",204630,SBK 22,"[6, 48, 49, 167, 169]",The Official Game of the 2022 MOTUL FIM Superbike World Championship is the perfect replica of what happens in the reallife featuring the event calendar official roster and teams pit environments with absolutely photorealistic effects and animated character models Players will test their skills racing in the boots of the best riders stepping in all the competitive WorldSBK Official tracks meaning unpredictable and adrenaline challenges,Missing,Missing,0.0,0.0,0.0,0.0,0.0,0.0
1662595200,"[12, 13, 15, 31, 32]",204185,The Gallery,"[6, 48, 49, 130]",An art curator is held hostage by a portraitist who threatens to detonate a bomb unless their demands are met The Gallery contains two interactive narratives  set in 1981 with a female protagonist and 2021 with a male protagonist,Missing,Missing,2.05,0.0,0.0,65.0,2.0,3.0
1662508800,[34],204169,Kaichu: The Kaiju Dating Sim,"[6, 14, 48, 49, 167, 169]",Kaichu is a dating sim about kaiju You play the role of Gigachu a gigantic romantic looking for love Meet 6 other eligible kaiju and visit 24 famous landmarks where Gigachu will answer challenging compatibility questions to decide the fate of your relationship,Missing,Missing,nan,nan,nan,nan,nan,nan
1662595200,"[13, 32]",204161,Paper Flight: Super Speed Dash,"[6, 48, 49]",Paper Flight  Super Speed Dash is an interactive game experience that is designed to ease your mind and have fun popping innocent balloons You jump into the role of a little paper plane that is supposed to rescue the world from little but evil balloon demons by dashing through them,Missing,Missing,nan,nan,nan,nan,nan,nan
1663891200,"[15, 32]",203754,Road Defense: Outsiders,"[6, 48, 49, 130, 167, 169]",Protect vehicles on the road and survive Road Defense Outsiders is a game that combines elements of the roguelike and tower defense genres Upgrade the towers and your own skills to be able to annihilate all the life around you,Missing,Missing,nan,nan,nan,nan,nan,nan
1663804800,"[12, 31]",202418,DreamWorks Dragons: Legends of the Nine Realms,"[6, 48, 49, 130, 167, 169]",Unleash your inner dragon and fly beyond the Hidden World on a fiery adventure to rescue Thunders family and save the dragon kingdoms,Missing,Missing,0.0,0.0,0.0,0.0,0.0,0.0
1664496000,"[10, 14]",202417,Paw Patrol: Grand Prix,"[6, 48, 49, 130, 167, 169]",No track is too big no racer too small The PAW Patrol are on their fastest mission yet  To win the Pup Cup Race around iconic locations including Adventure Bay Jakes Snowboarding Resort and The Jungle in this 4playerchampionship to find out who will be crowned the winner,Missing,Missing,1.31,1.55,16.43,42.0,19.0,24.0
1663632000,[12],201781,Soulstice: Deluxe Edition,"[6, 167, 169]",Soulstice Deluxe Edition includes Soulstice Full game Digital Soundtrack Digital Artbook Ashen Blade Item Pack,Missing,Missing,nan,nan,nan,nan,nan,nan
1664409600,"[5, 8, 9, 31, 32]",201711,C.A.R.L.,"[6, 48, 49, 130]",CARL is a retro puzzleplatformer in which players take on the role of a lost robot in a mysterious factory to uncover the secrets within its walls and thwart the plans of its mastermind proprietor,Missing,Missing,nan,nan,nan,nan,nan,nan
1664409600,"[13, 15]",201433,Let's Build a Zoo: Dinosaur Island,"[6, 48, 49, 130, 167, 169]",Escape to a brand new Dinosaur Island and discover a world of prehistoric beasts Start a brand new zoo complete with terrifying and adorable creatures brand new themed shops and a whole host of new decorations to give your guests the ultimate dinosaur experience,Missing,Missing,nan,nan,nan,nan,nan,nan
1662422400,[31],201027,Aliens: Fireteam Elite - Into the Hive Edition,"[49, 130, 169]",Set in the iconic Alien universe Aliens Fireteam Elite is a cooperative thirdperson survival shooter that drops your fireteam of hardened marines into a desperate fight to contain the evolving Xenomorph threat2202 A mysterious distress call reroutes your Marine Assault Unit to LV895 in the outer colonies where deadly Xenomorph legions hidden corporate secrets and ancient alien ruins await your arrival,Missing,Missing,nan,nan,nan,nan,nan,nan
1663804800,"[9, 12, 31, 32]",200905,OneShot: World Machine Edition,"[48, 49, 130]",The World Knows You Exist  Experience an adventure game with puzzles that go beyond its own window and establish a unique bond with the main character  In OneShot World Machine Edition you discover a strange computer operating system with a selfcontained world installed Explore this world to unravel its mysteries and help guide a child on their mission to restore the longdead sun  You hear that saving the world may no longer be possible But its worth a shot you think Now with collectible content and features exclusive to the World Machine Edition,Missing,Missing,nan,nan,nan,nan,nan,nan
1663804800,"[5, 10, 13, 32, 33]",199568,Flashout III,"[3, 6, 14, 48, 49, 130]",Flashout is back Where high speed meets high stakes Where unforgiving combat loud electronic music and addictive boosts of adrenaline mix up to separate winners from losers Where gravitation is nothing more than an empty word Take part in an exciting headtohead fight to the finish,Missing,Missing,0.0,0.0,0.0,0.0,0.0,0.0
1662595200,"[12, 15, 32]",199559,Legend of Keepers: Soul Smugglers,"[49, 130]",Including new master new monsters new game mechanics and more,Missing,Missing,nan,nan,nan,nan,nan,nan
1662422400,"[9, 13, 15, 32, 33, 35]",198623,Railbound,"[6, 14, 34, 39, 49, 130, 169]",A relaxing puzzle game about fixing train connections from the makers of Golf Peaks and inbento,Missing,Missing,3.04,6.57,8.58,78.0,21.0,26.0
1663891200,"[15, 31, 32]",197410,Lord of the Click 3,"[6, 48, 49, 130]",The Orcs are getting closer and very soon they will get so close that it will be impossible to get out of the elf kingdom For the good of the people the king himself is ready to stop the army of monsters It will be difficult to determine how this battle will end if you dont help him,Missing,Missing,0.0,0.0,0.0,0.0,0.0,0.0
1663027200,[5],194823,Isonzo: Deluxe Edition,"[48, 49, 167, 169]",World War One expands to the mountains of the Italian Front  beautiful but deadly in equal measure,Missing,Missing,nan,nan,nan,nan,nan,nan
1663804800,"[12, 13, 15, 16]",194209,The DioField Chronicle,"[6, 48, 49, 130, 167, 169]",The DioField Chronicle is a tale of war and honor Featuring a unique and beautiful world that blends fantasy medieval and modernday influences with a deep yet innovative realtime battle system,The era of myths gives way to an era of great turmoil  The world of men is mired in upheaval as an age of war rages for years on end A mercenary band arise from amidst the flames and the chaos they whos fated deeds will be sung of in ages yet to come  But when all is said and done will the name Blue Fox come to be a byword for hope or darkest tragedy,Missing,23.71,29.61,30.35,68.0,49.0,98.0
1663632000,[5],194205,Gundam Evolution,"[6, 48, 49, 167, 169]",This game is a firstperson teambased shooter with 6v6 combat and three objectivebased game modes Point Capture Domination and Destruction,Missing,Missing,15.0,45.31,79.7,65.0,10.0,4.0
1664323200,"[5, 32, 33]",192774,NeverAwake,"[6, 48, 130, 167, 169]",A girl who never wakes up She has been fighting monsters in her dreams NeverAwake is a nightmarish twinstick shooter with a unique worldview and original game rules,Missing,Missing,4.77,5.61,0.0,88.0,3.0,5.0
1664496000,"[2, 9, 31, 32]",190160,Boxville,"[3, 6, 14, 48, 49, 130]",Boxville is 2in1 an animated film and a puzzle game An adventure and puzzle game with more than 300 hours of artists time spent on every scene,Missing,Missing,1.67,2.16,2.32,72.0,5.0,8.0
1663891200,"[5, 31, 32]",190111,Remoteness,"[6, 48, 49, 167, 169]",New York 2034 back home from a crazy party at the pub you wake up late and immediately understand that something is wrong The district you live in has been evacuated and isolated overnight by the army after an electrical meteor shower hit the Earth,Missing,Missing,nan,nan,nan,nan,nan,nan
1664409600,"[8, 10, 13, 14, 31, 32, 33]",189847,Funtasia,"[6, 49, 130, 169]",Funtasia is a paradise polluted by airborne garbage turning it into a landfill Only a handful of heroes and their goofy machines can help Push the pedal to the metal drive as fast as you can and survive the Furry Road in this unique sidescrolling racing game for single and coop players,Missing,Missing,0.0,0.0,5.67,70.0,1.0,1.0
1662422400,"[12, 15, 16, 24, 32]",185757,Circus Electrique,"[6, 48, 49, 130, 167, 169]",Circus Electrique is part storydriven RPG part tactics part circus management and completely enthralling  all with a steampunk twist When everyday Londoners mysteriously turn into vicious killers only the shows talented performers possess the skills necessary to save the city,Named for the greatest show in Victorian steampunk London Circus Electrique is part storydriven RPG part tactics part circus management and completely enthralling  all with a steampunk twist  When everyday Londoners mysteriously turn into vicious killers only the circus lineup of Strongmen Fire Blowers Clowns and other performers possess the unique talents necessary to save the city Through tactical turnbased battles these unlikely heroes face Bobbies British Sailors gone bad aggressive Posh Girls and other Victorianera archetypes stand in their way  not to mention the occasional menacing Mime or Robobear The games innovative Devotion morale system affects characters performance not only in battles but also for actual circus shows dutifully managed between heroic jaunts through six sprawling districts,Missing,10.25,24.63,50.0,68.0,9.0,8.0
1663286400,"[8, 9, 31, 32, 33]",173262,Amazing Chicken Adventures,"[49, 130]",Embark on an adventure where gravity is your worst enemy  save the world one egg at a time Featuring chickeninappropriate tools and mandatory funny hats Local splitscreen coop 3D physics explorable game world puzzles loot to collect Oh and a chainsaw,Missing,Missing,nan,nan,nan,nan,nan,nan
1663027200,"[5, 13, 15, 32]",158603,Isonzo,"[6, 48, 49, 167, 169]",Ferocious Alpine warfare will test your tactical skills in this authentic WW1 FPS Battle among the scenic peaks rugged valleys and idyllic towns of northern Italy The Great War on the Italian Front is brought to life and elevated to unexpected heights,Missing,Missing,14.3,0.0,115.0,63.0,3.0,4.0
1663545600,"[12, 25, 31]",152262,Soulstice,"[6, 48, 167, 169]",Explore a dark world brimming with hidden mysteries master a diverse combat system and inhabit the dual forces of two sisters in a comingofage fantasy story with fastpaced action vicious enemies and breathtaking boss fights,The balance of the Holy Kingdom of Keidas is compromised when powerful feral creatures known as Wraiths invade from the other side of the Veil threatening to consume the living Wraiths corrupt their victims and can even possess their bodies turning into unstoppable monsters that prey upon the common folk The Chimeras hybrid warriors born of the union of two souls are the only ones who can protect humankind  Briar and Lute are two sisters who have been reborn as a Chimera The transformation has granted Briar superhuman strength and resilience while Lute who was sacrificed in order to bind her soul to her sisters has become a ghost with mystical powers Voiced by Stefanie Joosten Metal Gear Solid 5 Briar and Lute are sent on a mission to reclaim a city in ruins that has been ravaged by the Wraiths only to discover that the Order they belong to has a far more complex plan in mind,Missing,17.43,18.78,24.03,68.0,41.0,64.0
1664496000,"[13, 31, 32, 34]",152184,Witchy Life Story,"[6, 130, 169]",You have two weeks to save the harvest festival Tend your garden and collect plants for spells and rituals to help the villagers of Flora After all if magic isnt for solving everyday problems whats the point of a village witch anyway A cozy story filled with chaos friendship and romance,Youre the youngest member of the illustrious magical von Teasel family but youre not exactly their pride and joy In fact your grandmother has given you one last chance to prove yourself  or no more witch training for you  And so you arrive in the small village of Flora along with your crow familiar Ramsey You have two weeks to help the locals prepare their harvest festival for success and prove your worth to  well everyone,Missing,3.6,6.46,10.03,65.0,7.0,18.0
1663200000,"[5, 11, 12, 15, 25, 31, 32]",145777,Grid Force: Mask of the Goddess,"[6, 49, 130, 169]",Make a decision and live with it Grid Force Mask Of The Goddess is an Action RPG that mixes frenetic realtime gridbased combat with gamechanging choices and branching storylines Recruit level up unlock powerful skills and build the ultimate team to take down the goddesses of a decaying world in epic boss fights,Guide Donna in her journey of selfactualization through a beautifully animated Manga Style narrative Who will Donna trust and who will she betray Its up to you to write the end of her story Grid Force tells a story of inclusion personal growth and responsibility through an epic journey to the multicultural fictional world of Gora  Each playable character in Grid Force has its own paths traumas and aspirations Get to know them and they may help or surprise you Gain enough of their trust and they will join you Their presence in your squad can radically change the course of the story opening previously unavailable paths and revealing deeply hidden secrets  Recruit and level up each individual attribute of your units to unlock a variety of active and passive skillsThe right squad is the key to defeat the Goddesses of Gora and claim their Masks and the ultimate power they contain,Missing,nan,nan,nan,nan,nan,nan
1664409600,"[13, 32]",145287,Brewmaster,"[6, 48, 49, 130, 167, 169]",Discover learn and master the art of homebrewing in the ultimate celebration of craft beer From perfecting authentic chemistrydriven brewing techniques to bottling and labelling and entering competitions become an ultimate brewmaster in the first ever realistic beer brewing game,Discover learn and master the art of homebrewing in the ultimate celebration of craft beer  From perfecting authentic chemistrydriven brewing techniques to naming bottling and labelling  refine your craft to become the ultimate Brewmaster in the first ever realistic beer brewing experience With all the tricks of the trade and the best equipment at your disposal follow a recipe or experiment with a huge variety of realworld ingredients to hone your skills Enter friendly competitions earn beer tokens and upgrade your equipment to become an even better brewer  Choose to experience the storyled Brewmaster mode or throw yourself into Creative Mode a sandbox with everything unlocked  Set up your home brewery Create the ideal space to spend relaxing hours making your perfect beer Unlock your favourite equipment and decorate your brewing space Use beer tokens to buy better equipment to truly make it your own space  Create your recipe Concoct a variety of different types of beer including wheats blondes stouts IPAs and more while improving your brewing skills Perfect recipes improve the taste design your own labels and then submit your beers to local competitions and breweries to gain reputation and beer tokens Built for complete beginners to beer aficionados alike learn the basics of the beer brewing process with a range of recipes to choose from or get creative with total freedom to brew your own unique flavours  Brew your dream beer Mash malts boil hops and pitch yeast to kickstart fermentation Build your repertoire of homebrewing skills with a variety of brewing techniques to master a range of craft beer styles This relaxing and deeply satisfying sim will let you experience the rewarding and unhurried pleasure of homebrewing without worrying about money or space  Realistic and authentic Brewmaster is a detailed authentic game driven by a simulation of real brewing chemistry and a deep understanding of the reallife fermentation processes That doesnt mean you have to have a degree in chemistry The hard formulas happen behind the scenes allowing you to focus on the best bits of beer brewing fun  Refine your craft Once youve produced your ideal brew do your beer justice with an eyecatching label and a memorable name Tweak and personalise every element of your beer and boost your renown at beer festivals As your work becomes respected youll submit to local breweries for batch production expand your network and unlock bigger jobs and more challenging recipes A true Brewmaster is always learning,Missing,nan,nan,nan,nan,nan,nan
