first_release_date,id,name,platforms,summary,genres,rating,storyline,main,extra,completionist,review_score,review_count,people_polled
1463443200,185979,Homefront: The Revolution - Freedom Fighter Bundle,"[48, 49]",The Homefront The Revolution Freedom Fighter Bundle includes the base game and Expansion Pass entitling the holder to major single player expansions and valuable bonuses for your CoOp career,Missing,Missing,Missing,nan,nan,nan,nan,nan,nan
1462838400,172574,LEGO Dimensions: Slimer Ghostbusters Fun Pack,"[9, 12, 41, 48, 49]",Slime your enemies with Slimer from Ghostbusters Construct this glutinous ghost and represent the Ghostbusters in a crazy mashup multiverse of your favorite characters Place Slimer on the Lego Toy Pad to bring him to life in the game Fire his hot dog and activate his Boomerang Sonar Smash Flying Dive Hazard Clean Illumination Mini Access and Hazard Protection abilities to solve puzzles and battle enemies When he needs backup call in the Slime Shooter and rebuild it into a Slime Exploder and Slime Streamer for upgraded ingame powers,"[9, 31]",Missing,Missing,nan,nan,nan,nan,nan,nan
1464652800,171048,One Piece: Burning Blood - Wanted,[49],This amazing Wanted pack gives you access to 6 alternate versions of playable characters 8 new costumes 4 customizable HUDsA perfect mix to gear up for the fight,Missing,Missing,Missing,nan,nan,nan,nan,nan,nan
1464048000,168779,LEGO Marvel's Avengers: Spider-Man Character Pack,"[6, 9, 12, 14, 41, 48, 49]",Fan favourite SpiderMan content is swinging your way Peter Parker Miles Morales and more join the adventure complimentary to all who have purchased LEGO Marvels Avengers This pack features 6 playable characters including SpiderMan from the actionpacked theatrical blockbuster Marvels Captain America Civil War,[31],Missing,Missing,nan,nan,nan,nan,nan,nan
1462233600,168158,Naruto Shippuden: Ultimate Ninja Storm 4 - The Sound Four Characters,"[6, 49]",The Sound Four Extra Playable Characters Pack includes  4 new playable characters  Jirobo  Kidomaru  Sakon Ukon  Tayuya 3 Combination secret techniques  The Seven Ninja Swords Men of the Mist  The Sound Ninja Four  Cold Assault of the Demon Blade Costumes from previous games Matching voice Ninja Info Card Picture Ninja Treasure Finish cutin image,"[4, 31]",Missing,Missing,nan,nan,nan,nan,nan,nan
1462838400,137717,"LEGO Marvel's Avengers: All-New, All-Different Doctor Strange Pack","[6, 9, 12, 14, 41, 48, 49]",Based on the AllNew AllDifferent Doctor Strange comics this DLC adds a brandnew level and eight characters to your LEGO Marvels Avengers journey,"[9, 25, 31]",Missing,Missing,nan,nan,nan,nan,nan,nan
1462233600,137699,LEGO Marvel's Avengers: Classic Black Panther Pack,"[6, 9, 12, 14, 41, 48, 49]",Based on the classic Black Panther comics this DLC adds a brandnew level nine characters and an additional vehicle to your LEGO Marvels Avengers journey,"[9, 25, 31]",Missing,Missing,nan,nan,nan,nan,nan,nan
1463443200,137633,LEGO Marvel's Avengers: Marvel's Agents of S.H.I.E.L.D. Pack,"[6, 9, 12, 14, 41, 48, 49]",Based on season 2 of the Marvels Agents of SHIELD television series this DLC adds a brandnew level eleven characters and an additional vehicle to your LEGO Marvels Avengers journey,"[9, 25, 31]",Missing,Missing,nan,nan,nan,nan,nan,nan
1464652800,128473,The Elder Scrolls Online: Dark Brotherhood,"[6, 14, 48, 49]",Though at the height of their power the Dark Brotherhood faces a grave threat in the form of a mysterious blackarmored warrior capable of bringing down their best agents Venture forth for another exciting adventure in the Elder Scrolls Online as you carve a bloody swath across Tamriel in the name of the Dark Brotherhood,[12],Missing,Missing,9.25,9.87,12.5,56.0,7.0,7.0
1464652800,91022,Hitman: Episode 3 - Marrakesh,"[3, 6, 14, 48, 49]",Episode Three releases for all platforms on May 31st and adds an entirely new destination to Hitman Marrakesh Morocco From the busy souks and shisha cafes to the angry mobs calling for justice outside the Swedish consulate Marrakesh promises Hitman players the lure of voyeurism and the thrill of infiltration,"[5, 24, 31]",Missing,Missing,nan,nan,nan,nan,nan,nan
1463702400,89840,Homefront: The Revolution - Goliath Edition,"[6, 48, 49]",In Homefront The Revolution these is a special edition called Goliath Edition which is based off the vehicle With the pack it includes a steelbook game cover for PS4 Xbox One and PC It also has a radiocontrolled scaled replica Goliath There is also a 32page art book and includes both the Revolutionary Spirit Pack and Expansion Pass DLCs,"[5, 31]",Missing,Missing,nan,nan,nan,nan,nan,nan
1464134400,52164,Crazy Strike Bowling EX,"[48, 49, 130]",Join Aiden Mr Jenkins and a host of other cute funfilled characters in Crazy Strike Bowling EX a wacky bowling game fit for the whole family Get a strike in new and distant bowling lands from the exotic forests of the Amazon to the pyramids of Egypt battle your friends in exhibition or battle mode or dodge obstacles in challenge mode Go crazy and use your characters special move to knock those bowling pins into oblivion while unlocking secret worlds and costumes With levelups Crazy Strike Bowling EX is a strike for all ages  The PlayStation Camera and PlayStation Move motion controller can optionally be used with this game,[14],Missing,Missing,0.0,0.0,0.0,50.0,1.0,0.0
1462492800,42953,Dirt Rally: Legend Edition,"[6, 48, 49]",This edition of DiRT Rally includes a bonus Bluray disc featuring a fulllength documentary on the late rally champion Colin McRae called Colin McRae Rally Legendand tells the story of McRae through his own words,[10],Missing,Missing,nan,nan,nan,nan,nan,nan
1463011200,41637,Dark Souls III: Apocalypse Edition,"[48, 49]",Prepare to die again with the third entry in the brutal blockbuster actionRPG franchise A dark and brooding fantasy adventure awaits players in a vast twisted world full of fearsome beasts devious traps and hidden secrets The embers of a onceproud kingdom set the stage for this new adventure Battle against fearsome enemies and bosses with a variety of weapons and magic through a mysterious land riddled with secrets  Dark Souls III once again gives gamers the trademark sword and sorcery combat and rewarding action RPG gameplay Players will travel across a wide variety of locations in an interconnected world of unrelenting challenge and deep RPG gameplay as they search for a way to survive the coming apocalypse,"[12, 31]",Missing,Missing,nan,nan,nan,nan,nan,nan
1463097600,41614,DOOM: Collector's Edition,"[6, 48, 49]",Created in conjunction with Triforce the DOOM Collectors Edition includes an exclusive fullyrealized 12 tall collectors statue of one of DOOMs most iconic demons the Revenant Made of highquality PVC and modeled from actual ingame 3D files the Revenant stands on an LEDlit base with internal slowspinning turbine from the UAC facility on Mars The DOOM Collectors Edition also includes the highlyanticipated game packaged in an exclusive metal case,[5],Missing,Missing,nan,nan,nan,nan,nan,nan
1463097600,32732,Dyna Bomb,"[6, 14, 48, 49, 130]",Strap on your jetpack and prepare for chaos Dyna Bomb has intuitive arcade action game play with a blast of humor Enjoy,"[8, 31, 32, 33]",Missing,Missing,0.0,0.0,0.0,50.0,1.0,0.0
1462838400,24500,Tom Clancy's Rainbow Six Siege: Operation Dust Line,"[6, 48, 49]",In Operation Dust Line two Navy SEAL Operators join Team Rainbow to secure the Border  our new free map This second major content update also introduces new weapon skins advanced customisation options the ability to change your loadouts between rounds and lots more,"[5, 24]",Missing,Missing,nan,nan,nan,nan,nan,nan
1462492800,19889,Mystery Castle,"[6, 14, 49]",A retroinspired masterpiece Mystery Castle is the one puzzle game that will rule them all,"[9, 31, 32]",Missing,Missing,0.0,11.5,0.0,0.0,0.0,1.0
1463702400,19888,Cubikolor,"[6, 14, 48, 49, 130]",Armed only with your logic and your Kube move through the 150 levels outwitting the traps in the System an evil scheming entity to confront the machine and pass the test,"[9, 32]",Missing,Missing,0.0,0.0,0.0,0.0,0.0,0.0
1464652800,19399,Dead Island Definitive Collection,"[6, 48, 49]",The game that redefined the Zombie genre  fully remastered Paradise meets Hell Welcome to the Zombie Apocalypse experience of a lifetime  and now more beautiful than ever Caught in the midst of an epic zombie outbreak on the tropical island of Banoi your only thought is Survival   Luscious Improved graphics and game models  Glorious 1080p resolution  Photorealistic lighting system with physically based shading  Incl Dead Island Retro Game,"[5, 12, 25, 31]",Missing,Missing,nan,nan,nan,nan,nan,nan
1464566400,13166,The Witcher 3: Wild Hunt - Blood and Wine,"[6, 48, 49, 130, 167, 169]",Blood and Wine is the second major expansion to The Witcher 3 Wild Hunt  The players will accompany Geralt of Rivia to the region of Toussaint one of the few places in the Witcher universe which has remained largely untouched by the war The calm laidback atmosphere holds a dark and bloody secret that only the White Wolf can uncover the expansion features brand new items for us to collect on our adventure and also introduces previously unknown characters,[12],96.44273107918232,Missing,15.22,28.23,40.57,94.0,755.0,977.0
1464048000,24374,Tropico 5: Penultimate Edition,[49],Return to the remote island nation of Tropico in the next installment of the critically acclaimed and hugely popular dictator sim series Expand your Dynastys reign from the early colonial period to beyond the 21st Century facing an allnew set of challenges including advanced trading mechanics technology and scientific research exploration and multiplayer modes  Penultimate Edition Includes The Big Cheese and Hostile Takeover Addon as well as 5 brand new exclusive maps,"[13, 15]",90.0,Missing,nan,nan,nan,nan,nan,nan
1463011200,7351,Doom,"[6, 48, 49]",Developed by id software the studio that pioneered the firstperson shooter genre and created multiplayer Deathmatch Doom returns as a brutally fun and challenging modernday shooter experience Relentless demons impossibly destructive guns and fast fluid movement provide the foundation for intense firstperson combat  whether youre obliterating demon hordes through the depths of Hell in the singleplayer campaign or competing against your friends in numerous multiplayer modes Expand your gameplay experience using Doom SnapMap game editor to easily create play and share your content with the world,"[5, 9]",85.8753052106322,Youve come here for a reason The Union Aerospace Corporations massive research facility on Mars is overwhelmed by fierce and powerful demons and only one person stands between their world and ours As the lone DOOM Marine youve been activated to do one thing  kill them all,11.69,16.44,26.91,84.0,3932.0,5685.0
1464048000,8173,Overwatch,"[6, 48, 49, 130]",Join the fight for the future in the world of Overwatch and choose your hero from a diverse cast of soldiers scientists adventurers and oddities Bend time defy physics and unleash a dizzying array of extraordinary powers and weapons Engage your enemies in iconic locations from around the globe in the ultimate teambased shooter,"[5, 15]",81.92038603595108,Soldiers Scientists Adventurers Oddities  In a time of global crisis an international task force of heroes banded together to restore peace to a wartorn world  OVERWATCH  It ended the crisis and helped to maintain peace in the decades that followed inspiring an era of exploration innovation and discovery But after many years Overwatchs influence waned and it was eventually disbanded  Overwatch is gone but the world still needs heroes,59.42,176.35,576.21,80.0,833.0,132.0
1464048000,82442,OlliOlli2: XL Edition,[49],The iconic skater is going all greenscreen with a stunning new look plucking you from the street and dropping you squarely in the middle of the big screens most bodacious cinematic locations  The sequel boasts all new Ramps and Epic Hills allowing for monster air and multiroute levels Further OlliOllis combo system has been expanded thanks to the joy of Manuals Reverts RevertManuals and GrindSwitching giving you more control and expression than ever before  Play with friends in ComboRush a localmultiplayer mode for 24 players Go headtohead across 100 different levels and Combo your way to the top of the scoreboard NOTICE  Achievement progression is disabled in ComboRush To earn Achievements skate in Singleplayer modes  OlliOlli2 XL Edition introduces the brandnew FreeSkate mode extended chilled levels to learn the ropes nail those Expert tricks or simply cruise and flow like never before,Missing,80.0,Missing,nan,nan,nan,nan,nan,nan
1464048000,82412,The BunnyLord Pro Hater Pack,[49],The BunnyLord Pro Hater Pack gives you two incredible games from Roll7 in one unique bundle,Missing,80.0,Olli Olli2 XL Edition is the definitive edition of the acclaimed skating game It introduces the brandnew FreeSkate mode extended chilled levels to learn the ropes and nail those expert tricks or simply cruise and flow like never before  The sequel boasts all new ramps and epic hills allowing for monster air and multiroute levels plus an expanded combo system giving you more control than ever Play with friends in ComboRush a localmultiplayer mode for 24 players Go headtohead across 100 different levels and Combo your way to the top of the scoreboard  In NOT A HERO SUPER SNAZZY EDITION join the Campaign trail in a funstoppable 225D pixelated action opus from Roll7 Shoot slide and execute your way through 28 levels of incredibly British action and humour as you persuade the world to Vote BunnyLord  Use reasonable force unreasonably in a dynamic mix of runandgun gameplay and coverbased shootouts The intuitive quicksnap cover system lets you slide roll and dive into cover dodging enemy fire before fighting back with tackles executions and hundreds of bullets  Choose between 9 different heroes each with their own distinct gameplay style and crimemurdering abilities Blast the citys scum through doors with Cletus shotgun slice them in half with Kimmys katana dash or simply bash crime in its terrible face with Ronalds hammer  NOT A HERO SUPER SNAZZY EDITION introduces the ME MYSELF  BUNNYLORD Campaign letting you play as the BunnyLord himself Use unreasonable force reasonably to fix his spacetimecontinuum mishaps and restore balance to the universe in this new adventure featuring 3 all new missions with new baddies settings and challenges,nan,nan,nan,nan,nan,nan
1462924800,33503,Super Impossible Road,"[6, 14, 48, 49, 130, 167, 169]",In the future youve got to play a little dirty if you want to win races Master hairpin turns across dangerous courses that twist and coilover beautiful galactic backdrops knocking opponents into the void of space Kick into hyperdrive with temporary speed boosts and use every opportunity to jump off the paths of the rollercoasterlike tracks Bypass gates and checkpoints and roll over competitors on the way to first place  The spiritual sequel to the awardwinning Impossible Road is back and more ferocious than ever with allnew modes 60 FPS local multiplayer insane online play and much more So whatre you waiting for Crack those knuckles and jump into the fastest craziest most spectacular racer youve ever played,"[10, 14, 32, 33]",80.0,Missing,3.0,0.0,9.0,40.0,1.0,2.0
1463616000,33333,A Little Lily Princess,"[3, 6, 14, 48, 49, 130, 167, 169]",Newly arrived at a boarding school in Victorian England Sara Crewe uses her love of books and storytelling to build new relationships But what happens to a fairytale princess when she loses everything,"[13, 31, 32, 34]",80.0,Missing,6.66,13.21,15.11,82.0,5.0,14.0
1462752000,32736,Shaolin vs Wutang,"[6, 48, 49, 130]",Shaolin vs Wutang is a real indie love letter to classic 70s and 80s Kung Fu films Features include hand to hand and weapon combat and licensed music from authentic Kung Fu films,"[4, 32, 33]",80.0,Missing,0.85,5.96,0.0,77.0,3.0,5.0
1464048000,32038,Not a Hero: Super Snazzy Edition,"[49, 130]",Join the Campaign trail in this funstoppable 225D pixelated political opus from Roll7 Shoot slide and execute your way through 28 levels of incredibly British action and humour as you persuade the world to Vote BunnyLord Use reasonable force unreasonably in a dynamic mix of runandgun gameplay and coverbased shootouts    The intuitive quicksnap cover system lets you slide roll and dive into cover dodging enemy fire before fighting back with tackles executions and hundreds of bullets Choose between 9 different heroes each with their own distinct gameplay style and crimemurdering abilities Blast the citys scum through doors with Cletus shotgun slice them in half with Kimmys katana dash or simply bash crime in its terrible face with Ronalds hammer    Go ham on primary objectives and sometimes random secondary goals but be prepared for unexpected midlevel events that turn the tables on the antiheroes in an instant SWAT teams guntoting elderly helicopter gunships pandas pugs and suicidal samurais stand between you and election victory    NOT A HERO SUPER SNAZZY EDITION introduces the ME MYSELF  BUNNYLORD Campaign letting you play as the BunnyLord himself Use unreasonable force reasonably to fix his spacetimecontinuum mishaps and restore balance to the universe in this new adventure featuring 3 all new missions with new baddies settings and challenges,"[5, 24, 31, 32, 33]",80.0,Missing,nan,nan,nan,nan,nan,nan
1462924800,19848,Raiden V,[49],A quartercentury after the arcade hit Raiden first left its mark on the shooting genre the series now comes to the Xbox One in its most modern and advanced form yet Join the war for Earths future where the tide of battle holds constant surprises in this game thats easy to learn but difficult to master Using Xbox One cloud functionality to its fullest now all players can easily access their data allowing you and your comradesinarms to enter the fray sidebyside,[5],80.0,Missing,1.38,0.0,0.0,73.0,4.0,6.0
1464307200,19481,Skautfold: Shrouded in Sanity,"[6, 48, 49, 130, 167]",A survivalhorror game inspired by Resident Evil 1 Dark Souls and Eternal Darkness  Shrouded in Sanity is an isometric survival horror action game with minimal rpg elements and an open world approach Immersion is the focus here avoiding non diegetic sounds and music Heavily inspired by the souls series of games but focusing much more on survival and horror,"[12, 31, 32]",80.0,Set in the alternative historical setting of 1897 Angelic Empire of Britannia your contract will order you to eliminate the source of the unnatural fog enveloping the Berelai Manor  Discover the secrets of the estate as you look for answers among the violent inhabitants  A strange and repelling madness took hold of the servants roaming the halls and they will attack on sight for their madness is one rooted in a deeper understanding of cosmic insignificance  To repel the maddening horrors your Iaito cane and Waltham A9 hand canon will aid you To mend your injuries your Vitae concoctions will offer healing  Beware whatever unearthly events have transpired your sanity will be tested as the truth unfolds in this hungry allconsuming Fog,3.02,0.0,8.3,65.0,4.0,7.0
1463616000,19250,Lastfight,"[3, 6, 14, 48, 49, 130]",LASTFIGHT is bringing 2v2 3D fighting back to your living room Pick up any available object in one of the 8 stages and teach your opponents a lesson Play in local multiplayer mode for up to 4 players or oneplayer story mode with a cast of 10 characters inspired by the comic book LASTMAN,"[4, 14, 25, 32, 33]",80.0,Missing,nan,nan,nan,nan,nan,nan
1464652800,34951,Dead Island: Definitive Edition,"[3, 6, 48, 49]",Welcome to the zombie apocalypse experience of a lifetime  and now more beautiful than ever Caught in the midst of an epic zombie outbreak on the tropical island of Banoi your only thought is Survive,"[5, 25]",79.95089287965794,The island of Banoi is a lush tropical paradise in the South Pacific where its flagship Royal Palms Resort serves as the ultimate getaway for vacationers with money to burn However all good things must soon come to an end  and the picturesque resort falls into madness carnage and chaos after a mysterious and contagious zombie outbreak claims its once peaceful atmosphere Cut off from the rest of the world only four individuals who strangely find themselves immune to zombification have the power to protect the remaining survivors from the horrors of the island to discover whats really going on and find a way to escape before their own fatal ends,15.86,25.26,51.32,69.0,317.0,387.0
1463184000,58295,Mekorama,"[34, 39, 46, 48, 49, 130]",A puzzle game from Martin Magni  Help a tiny robot stumble home through 50 puzzling mechanical dioramas   Relaxing gameplay  Charming robots  Collectible level cards  Diorama maker  Small install size,"[8, 9]",79.43382155983727,Puzzling Mechanical Dioramas  Mekorama is a mobile puzzle game where you help a tiny robot stumble home featuring  50 tiny mechanical dioramas to explore Thousands of fanmade levels to collect FAQ Building blocks for making your own levels,2.49,0.0,3.11,58.0,10.0,9.0
1462752000,11582,Stellaris,"[3, 6, 14, 48, 49]",Explore a galaxy full of wonders in this scifi grand strategy game from Paradox Development Studios Interact with diverse alien races discover strange new worlds with unexpected events and expand the reach of your empire Each new adventure holds almost limitless possibilities,"[11, 13, 15]",78.20994226000136,Missing,31.1,70.01,276.71,80.0,181.0,102.0
1464652800,24311,Dead Island: Riptide - Definitive Edition,"[3, 6, 48, 49]",Welcome to the zombie apocalypse experience of a lifetime  more beautiful than ever Caught in an epic zombie outbreak on the tropical island of Banoi your only thought is Survive,"[5, 12]",78.01929965317443,Missing,9.69,17.12,30.89,66.0,99.0,118.0
1463616000,18031,Fallout 4: Far Harbor,"[6, 48, 49]",A new case from Valentines Detective Agency leads you on a search for a young woman and a secret colony of synths Travel off the coast of Maine to the mysterious island of Far Harbor where higher levels of radiation have created a more feral world Navigate through the growing conflict between the synths the Children of Atom and the local townspeople Will you work towards bringing peace to Far Harbor and at what cost Far Harbor features the largest landmass for an addon that weve ever created filled with new faction quests settlements lethal creatures and dungeons Become more powerful with new higherlevel armor and weapons The choices are all yours,"[5, 12]",76.52342389047968,Missing,nan,nan,nan,nan,nan,nan
1463961600,28061,Overwatch: Collector's Edition,"[6, 48, 49]",The Overwatch Collectors Edition is packed full of goods to enhance your experience along with all of the ingame bonuses and Origin Skins bundled in Overwatch Origins Edition The Overwatch Collectors Edition includes everything in Overwatch Origins Edition plus Visual Sourcebook Soundtrack and Soldier 76 Statue,"[5, 12, 15]",74.86902661592492,Missing,nan,nan,nan,nan,nan,nan
1462492800,47484,Project CARS: Game of the Year Edition,[49],Project CARS Game Of The Year Edition is the ultimate choice for serious racing fans  created by gamers tested by real racing drivers and the preferred choice of Esports pros Featuring all the elements of the original core experience that made Project CARS the most authentic beautiful intense and technicallyadvanced racing game on the planet the Game Of The Year Edition also includes an additional   50 cars 125 total  4 tracks 35 unique locations 100 layouts total  60 communitycreated liveries  500 features and improvements All this plus two special and exclusive items  the iconic Nurburgring Combined Nordschieife  GP circuit and two exclusive vehicles from Pagani  the Zonda Revolucion and Huayra BC,"[10, 13, 14]",70.0,Missing,nan,nan,nan,nan,nan,nan
1462320000,34511,I and Me,"[6, 46, 48, 49, 130]",If there were another me Observing myself from the perspective of a spectator How would I regard another me,"[8, 9, 32]",70.0,Missing,4.5,6.0,7.0,77.0,3.0,5.0
1464652800,23425,Demetrios: The Big Cynical Adventure,"[3, 6, 14, 34, 39, 46, 48, 49, 130]",Demetrios is a quirky point and click adventure game inspired by classics like Broken Sword packed with tons of humor  Bjorn Thonen a slob of an antique dealer living in Paris is robbed one night after coming home drunk Forced to conduct his own investigation with the help of his neighbor Sandra he ends up involved in a murky mysterious affair Will these unlikely heroes be able to rise up and discover ancient secrets  The game offers situations and puzzles for beginners and experts alike with a high degree of interactivity Explore ridiculous item combinations just to see what happens,"[2, 9, 31, 32]",70.0,Missing,8.8,9.5,10.75,62.0,16.0,35.0
1463011200,19175,Rocket Fist,"[3, 6, 14, 41, 48, 49, 130]",Rocket Fist is an arena game with crazy robots in chaotic rocket fist battles Aim against your frenemies and prove your dexterity by killing each other with rocket propelled fists in this frenetic mix of dodgeball and billiards Easy to learn hard to master Rocket Fists quick rounds will keep you coming back for more Its the perfect game to bring out when your friends are over and in need of some explosive action,"[4, 14, 32, 33]",70.0,Missing,0.0,0.0,0.0,10.0,1.0,0.0
