,id,name,platforms,summary,genres,storyline,rating,main,extra,completionist,review_score,review_count,people_polled
0,222778,No Man's Sky: Next,"[6, 48, 49]",Update 15 NEXT introduces a full multiplayer experience nearunlimited base building command of freighter armadas a graphical overhaul and more  This update marks the two year anniversary of No Mans Sky and a lot has changed Please see Atlas Rises Pathfinder and Foundation for previous major updates  This is an important next step on our journey,Missing,Missing,Missing,,,,,,
1,221879,Minecraft: Update Aquatic,"[3, 6, 9, 12, 14, 34, 39, 41, 46, 48, 49, 74, 130, 132, 388]",Minecraft Update Aquatic is a major update to Minecraft that focuses on revamping the oceans in the game adding many new aquatic mobs blocks items and structures,"[13, 31]",Missing,Missing,,,,,,
2,200826,Cities: Skylines + Surviving Mars,[49],Cities Skylines and Surviving Mars are taking on the town together in a new bundle that merges more management mayhem than ever,Missing,Missing,Missing,,,,,,
3,178308,Lady in a Leotard With a Gun,"[6, 48, 49, 167]",Short thirdperson shooter where you shoot all the enemies and go to the exit,"[5, 31]",Missing,Missing,0.86,0.0,1.17,10.0,2.0,5.0
4,168783,LEGO Marvel Super Heroes 2: Marvel's Ant-Man and the Wasp Level and Character Pack,"[6, 14, 48, 49, 130]",Download now to get access to the Marvels AntMan and the Wasp Character and Level Pack This actionpacked level takes AntMan and the Wasp to Hank Pyms forgotten research lab Players are tasked with battling Eggheads goons in an unforgettable adventure,"[9, 25, 31]",Missing,Missing,,,,,,
5,164855,Sonic Mania: Encore,"[6, 48, 49, 130]",Get the Encore Pack to experience the allnew Encore Mode two new playable characters Mighty and Ray and four player Competition Mode,"[8, 31]",Missing,Missing,,,,,,
6,162055,Extinction: Skybound Sentinel,[49],Sprint climb and soar across the city of Dolorum to reach your opponents chaining combos together to reach your rivals in the most efficient way possible,[31],Missing,Missing,,,,,,
7,123736,Gene Rain: Wind Tower,"[6, 49]",Gene Rain Wind Tower is a TPS game come from China In the two worlds of real world and mechanical world you can freely upgrade armor and make armor with the picked items Upgrade the main weapon and the machine gun tower the games compact Plot flow and sandbox weapon system will allow you to immerse yourself in the,"[12, 31, 32]",Missing,Missing,,,,,,
8,119075,Warhammer: Vermintide 2 - Premium Edition,[49],Premium Edition includes   3 Exclusive Heroic Deeds  Helmgart Heraldry Themed Skins  Premium Edition Portrait Frame  Keep Decorations,Missing,Missing,Missing,,,,,,
9,115025,Unravel: Yarny Bundle,"[48, 49]",Discover the delightful adventures of Unravel and Unravel Two with the Unravel Yarny Bundle,"[8, 9, 31]",In Unravel join Yarny a lovable and endearing character made from a single thread of yarn that slowly unravels as he embarks on a seemingly larger than life journey Inspired by the unique and breathtaking environments of Northern Scandinavia Unravel is a visually stunning physicsbased puzzle platformer about love hope and the journey of life  In Unravel Two create a Yarny of your very own Then build relationships with other Yarns in local coop or as a single player fostering friendship and support as you journey together Begin your adventure in a cold and imposing land then watch your surroundings blossom with new life as you chase the spark of adventure,Missing,,,,,,
10,107195,Dude Cops,"[6, 34, 49]",Dude Cops is a point n click adventure game that follows the shenanigans of detectives Choco and HT Bunz as they travel around town solving cases,"[2, 31, 32]",Choco and HT Bunz are detectives in a small town They solve cases like saving a cat from a tree and helping an old lady across the street,Missing,0.17,0.2,0.25,50.0,2.0,7.0
11,106685,Maximum Football 2018,"[48, 49]",This is North American football with your teams and your rules Maximum Football 2018 allows you to play with Canadian or American football rules customizable teams and players,[14],Missing,Missing,,,,,,
12,106296,The Council: Episode 3 - Ripples,"[6, 48, 49]",The Council is an episodic game that delivers a fresh new take on the narrative adventure genre Make hardhitting decisions develop an array of skills and directly impact how the story unfolds With permanent longlasting consequences there is no going back  Continue your adventure in The Council Episode 3 Ripples where plots are laid bare characters reach their breaking points and an unexpected terrifying truth is uncovered,"[12, 31]",Louis de Richet continues his investigations and adventures on Lord Mortimers island where he seeks his mother After endless intrigue Mortimer is finally starting to unveil his ultimate plan,Missing,,,,,,
13,106008,Train Sim World: Digital Deluxe Edition,"[6, 48, 49]",Train Sim World Digital Deluxe Edition  by purchasing this bundle youll get the CSX GP402 upon release which enhances the Northeast Corridor New York experience by giving you a choice of freight locomotives to operate in Service Mode The CSX GP402 additionally features scenarios and Service Mode compatibility for CSX Heavy Haul PC only,[13],Missing,Missing,,,,,,
14,105987,The Unknown City (Episode 1),"[6, 48, 49]",Missing,Missing,Missing,Missing,,,,,,
15,105930,Werewolf Pinball,"[6, 48, 49, 130, 167, 169]",The curse of the Werewolf its back in this Pinball survive the night and try to hunt him down,"[13, 30, 33]",Missing,Missing,,,,,,
16,105501,ACA Neo Geo: League Bowling,"[48, 49, 130]",League Bowling is a bowling game released by SNK in 1990 You are able to select your dominant arm and ball weight using precise controls to play just like real bowling Choose from one of three modes REGULATION FLASH and STRIKE 90,"[14, 33]",Missing,Missing,,,,,,
17,105300,DayD: Through Time,"[6, 48, 49, 130]",Want a dinosaur farm Well give you a time machine and a park to restore Journey into the past and deal with the villain,[15],Missing,Missing,0.0,0.0,0.0,0.0,0.0,0.0
18,105269,Gene Rain,"[6, 48, 49]",Gene Rain is a nextgen 3D third person shooter game The story is set in a futuristic world with a linear narrative structure and uses shocking visual effects to present a brand new world for the players  enjoyment,"[5, 12, 31, 32]",Missing,Missing,3.29,0.0,0.0,0.0,0.0,2.0
19,105122,ACA Neo Geo: The Super Spy,"[6, 48, 49, 130]",The Super Spy is an action game released by SNK in 1990 Punch kick and use guns to fight off terrorists as you make your way through the building to rescue their captives Defeating enemies earns experience which can be used in a Role Playing Gamelike feature to level up,[33],Missing,Missing,,,,,,
20,105118,Rekkr,"[6, 48, 49, 130]",REKKR is a 4episode total conversion created by Matthew Little Revae with a full soundtrack created by Tom Jensen HexenMapper sound effects provided by TerminusEst13 additional textures by Chris Kassap lupinxKassman and additional mapping by Angry Saint Brayden Hart AD_79 Bzzrak Ktazzz Chris Kassap James Paddock Jimmy Jaws in Space SuperCupcakeTactics TerminusEst13 and Velcrosasquatch The mod is distributed as both a PWAD for Ultimate Doom or Freedoom since all content is replaced it does not matter which one and a standalone IWAD version,[5],Missing,Missing,,,,,,
21,104998,Wheelspin Frenzy,[49],Missing,Missing,Missing,Missing,,,,,,
22,104993,ACA Neo Geo: Samurai Shodown V,"[6, 48, 49, 130]",Samurai Shodown V is a fighting game released by SNK in 2003 Yoshitora Tokugawa Mina Majikina and more join the cast of twentyfour warriors New systems available include the Sword Gauge and Concentration One for even more swordswinging action,"[4, 33]",Missing,Missing,,,,,,
23,104965,Sword Art Online: Fatal Bullet - Betrayal of Comrades,"[6, 48, 49]",SWORD ART ONLINE FATAL BULLET Downloadable Content 2 This DLC adds new stories characters weapons outfits and more  New stories and dungeons New Home Expansion System and ArFAsys Speech Patterns New characters Shirley and Clarence New bosses New weapons outfits accesssories hair styles and face styles  You and the group are in pursuit of the mysterious Copy ArFAsys As if copies of Zeliska Itsuki and Kureha werent enough it seems that there are now copies of Kirito and Asuna running around causing havoc as well Find the new dungeon and uncover the truth behind the Copy ArFAsys,[12],Missing,Missing,,,,,,
24,104794,The Z Axis: Continuum,"[6, 49]",Escape a bizarre world by rotating the universe Use portals physics time and clones as floors become walls walls become ceilings left becomes down and right becomes up You manipulate time and space at will but do you have the mind to solve the warped reality that imprisons you,"[8, 9, 32]",Missing,Missing,,,,,,
25,103284,Sea of Thieves: Cursed Sails,"[6, 49]",Cursed Sails is the second free DLC for Sea of Thieves The update features AI skeleton controlled ships 3 player Brigantine ship and an alliance system New ship customizations and cosmetic items have been added to the stores This includes the Hunter Set and the Bone Crusher Set,[31],Pirate dominion over the waters is being challenged by crews of skeletons united by their warped desire for vengeance on the living Each region will be called out so prepare to fight to protect your favourite Outposts Form Alliances to share the rewards of cooperation or perhaps the new threeperson Brigantine ship will help to even the odds    Meanwhile piece together the origins of these cursed vessels by investigating a certain rogue trader This update includes both permanent new content and timelimited events so jump in during the campaign to fully enjoy the spoils of war,Missing,,,,,,
26,96369,The Banner Saga Trilogy: Bonus Edition,"[48, 49]",Weave your own thread through this epic Viking RPG adventure Guide your caravan across the landscape of a breaking world where the sun has stopped in the sky and the gods are dead Bold leadership decisions wise use of resources and skillful battle tactics are vital to ensure that you and your clans make it through alive Bonus Edition Includes   Banner Saga 123  Best of Soundtrack  Mini Art Book  Collectible Poster  Horn of Lichbaen InGame Item,"[12, 16, 31, 32]",Missing,Missing,,,,,,
27,96248,Mega Man X: Legacy Collection 1+2,"[6, 48, 49, 130]",Mega Man X Legacy Collection includes the legendary 16bit titles and the series exciting foray into 32bits Mega Man X Mega Man X2 Mega Man X3 and Mega Man X4 The heroic robot grows stronger as he takes down Mavericks and steals their weapons and also has the ability to dash and wall jump for thrilling fastpaced combat Mega Man Xs mysterious friend Zero also joins the fray as a playable character later in this collection  Mega Man X Legacy Collection 2 also spans two gaming eras showcasing the evolution of the series with Mega Man X5 Mega Man X6 Mega Man X7 and Mega Man X8 A third playable character Axl joins the cast in Mega Man X7 and Mega Man X8 as the series jumps into a new realm of 3D character models and environments  In addition to eight iconic Mega Man X titles both Mega Man X Legacy Collection and Mega Man Legacy Collection 2 come with an armory of new features Test your Maverickhunting skills in the new X Challenge mode which pits players against two deadly bosses in a series of twoonone battles Think you can take down the slippery Chill Penguin and hulking Frost Walrus simultaneously Give it your best shot Additionally Mega Man X Legacy Collection includes a huge museum filled with rare production art catalogs of classic merchandise a playlist of nostalgic commercials and more The collection also includes an animated a prequel film starring the origins of Mega Man X villain Sigma,"[5, 8]",Missing,Missing,,,,,,
28,86151,Hotel Transylvania 3: Monsters Overboard,"[6, 48, 49, 130]",Dracula Mavis and their monster friends are marooned on the mysterious Lost Islands  and only you in command of lovable little creatures the Impa can save them Explore the islands discover new Impa abilities and rescue Frankenstein Murray and Wayne from fearsome enemies But hurry  the DracPacks lives are at stake,"[8, 12, 31, 33]",Missing,Missing,0.0,0.0,6.74,53.0,3.0,6.0
29,68864,The Path of Motus,"[6, 48, 49, 130]",Will you let other people stop you from pursuing your dreams The Path of Motus is a game where words hurt literally,"[8, 9, 31, 32]",Missing,Missing,0.0,1.84,2.17,0.0,0.0,3.0
30,55216,Epic Loon,"[6, 48, 49, 130]",Dive into the bizarre world of Epic Loon a quirky physics platformer for up to 4 players playable in couch coop or battle mode  An offbeat tribute to scifi classic movies players lead a group of aliens to take over Joes TV after they are rudely awakened from their home an oldschool cleaning VHStape  Features   A retro couch party game experience  A tribute to the beloved movies of the 8090s  Godzilla Nosferatu Jurrasic Park Alien Youll play in parodies of famous movies of the 8090s in scenes that its possible to recognize if youre a movie fan  A user friendly gameplay simple to learn but with a real challenge for every type of players thanks to the different games mode  Story Speedrun Hardcore and Battle  More than 350 levels to master  An original soundtrack composed by the famous Rococo core band Pryapisme,"[8, 32, 33]",My name is Joey Ernie Chips Douglas but my friends just call me Joe I am what you might call a cinephile I know the classics like the backs of my hands Im the real deal VHS expert science fiction fantasy comedy thriller and horror nothing gets past me Ive got the biggest VHS collection in all of Wyoming Im pretty proud of that fact I record every program running on the cable night and day to the point where my grandma calls me The Cable Guy All was well in my life until that night in August 1994 It was a Thursday I think I was finishing for the third time that afternoon the excellent Space Vampires Versus Zombie Dinosaurs in Color and I noted all the best quotes in my journal when my VCR a dependable and sturdy JVCC BP5000 began messing up out of the blue The image off and on disgusting sound and glitches all around I knew I had to act on it and fast  I knew of only one person that could help me at this time of night Mr Wing the old sketchy chinese owner of the local corner hardware store This is precisely the time that my problems really began  He saw the panic and fear in my eye and ended up selling me a VCR cleaning cassette It wasnt easy and it required that I guarantee that i follow a few rules of usage before What a strange object it was the VCR cleaner Complete with a huge thick users manual in a strange language I didnt understand some sort of Dutch or something Inside it contained a list of crucial precautions to follow such as never expose the VHS to sunlight dont get it wet never insert it into the VCR after midnight I had the impression that I had bought a Mogwai What bullshit This geezer must have been starting to get senile  But I should have listened I should have heeded his warnings Because now Im in deep shit Since I inserted this cursed VHS in my JVCC it would seem as if a group of stupid aliens took control of it I have a hard time believing a hard time convincing myself ive not gone completely crazy I dont know where this cleaning cassette came from and theres no way to contact the old chinese guy he seems to have disappeared Im scared to talk to anyone about this The police They dont know anything My grandma Shes faint of heart The FBI I have too many illegal recordings at home  In the meantime until I find a solution Im condemned to spend my days with them Luckily they dont seem too malicious pretty annoying but certainly not evil They spend their time ruining my favorite movies Ive thought about it and the only hope left is finding THE VHS that will reduce them to nothing A monster movie a disaster movie anything dangerous I have no choice,Missing,0.0,0.0,0.0,70.0,1.0,0.0
31,94873,Sonic Mania Plus,"[48, 49, 130]",Sonic Mania Plus is an updated version of Sonic Mania that includes the Encore DLC Digital versions of Sonic Mania on all platforms can be upgraded to Sonic Mania Plus by purchasing the Encore DLC separately  Plus is also available as a physical release and marks the first time any version of Sonic Mania was available on physical media Released for Xbox One PlayStation 4 and Switch in addition to including the complete version of Sonic Mania Plus on a disccartridge it also comes packaged with a reversible cover with alternate box art an art book and a holographic outer sleeve,[8],Missing,95.07474728870214,4.99,10.15,26.78,82.0,177.0,186.0
32,26940,The Banner Saga 3,"[6, 14, 34, 39, 48, 49, 130]",Banner Saga 3 is the final dramatic chapter in the mature storydriven Viking RPG series which has won over 20 awards and has been nominated for 4 BAFTA awards As the world continues to crumble around you who can you trust how will you protect your allies and what choices will you make as the Darkness draws near,"[12, 13, 15, 16, 24, 32]",Witness the Banner Saga as youve never seen it before as a dark force takes over and effects everything youve come to know in the beautifully handpainted finale of the trilogy  Choose new playable characters to join your party including dredge heroes Take advantage of new upgrade options as they progress in battle  Deeper strategic combat with the new battle waves system against a myriad of new enemiesThe valka spear and heroic titles let players customize their playstyle even further  Drive your own narrative as you carry over your choices from both Banner Sagas 1  2 leading to different climatic endings in this final chapter No hero is safe,89.2591640635772,9.64,13.2,19.32,79.0,157.0,221.0
33,96252,Mega Man X: Legacy Collection,"[6, 48, 49, 130]",Mega Man X Legacy Collection includes the legendary 16bit titles and the series exciting foray into 32bits Mega Man X Mega Man X2 Mega Man X3 and Mega Man X4 The heroic robot grows stronger as he takes down Mavericks and steals their weapons and also has the ability to dash and wall jump for thrilling fastpaced combat Mega Man Xs mysterious friend Zero also joins the fray as a playable character later in this collection,"[5, 8]",Missing,87.24483709314822,,,,,,
34,109108,The Banner Saga Trilogy,"[6, 49, 130]",Weave your own thread through this epic strategy RPG adventure Guide your caravan across the landsacpe of a breaking world where tough choices bold leadership decisions wise use of resources and skillful battle tactics all matter in this desperate struggle for survival,"[15, 32]",Missing,87.0,,,,,,
35,7937,La-Mulana 2,"[6, 14, 48, 49, 130]",In LaMulana 2 you will take on the role of Lumisa Kosugi on a mission to find the entrance to the ruins of EgLana which is rumored to be the source of recent monster appearances The ruins themselves are compromised of a variety of areas as well as huge boss creatures known as Guardians Who knows what lies in wait at the end of EgLana,"[8, 9, 31, 32]",Missing,80.0,47.26,53.62,62.46,86.0,13.0,32.0
36,26765,Octopath Traveler,"[6, 49, 130, 170]",A roleplaying game from the Bravely Default team is being developed exclusively for the Nintendo Switch They have brought a new world to life through a mix of CG pixel art and HD2D visuals,"[12, 31]",Embark on a vast new roleplaying adventure as one of eight travelers all with their own origins paths and goals Where to begin Who to team up with Where to go next Only you can decide  Each traveler can use a distinct Path Action a specialized way of achieving objectives and interacting with people you encounter The warrior can challenge people to a duel whereas the dancer can allure others to follow her even into battle,79.96000204917534,60.66,80.25,103.54,80.0,941.0,1395.0
37,105422,South Park: The Fractured But Whole - Bring the Crunch,"[6, 48, 49, 130]",An idyllic summer at Lake Tardicaca turns into a nightmare when the camp counselors go missing Team up with FastPass Dr Timothy Professor Chaos and a new member Mintberry Crunch to save summer camp Embrace the new Final Girl class and overcome the odds to survive,[12],Missing,79.91205180245481,2.57,3.19,3.88,74.0,59.0,96.0
38,129875,Fortnite: Season 5,"[6, 48, 49, 130]",Drop into Season 5 where were introducing all kinds of changes to the map A viking ship desert outpost and ancient statues have appeared on the island changing the world of Fortnite as we know it On top of that Fortnites first four person vehicle has arrived Hop in a zippy ATK All Terrain Kart with your squad and uncover all new mysteries and locations the possibilities are endless,[5],Missing,76.0,,,,,,
39,3222,Chasm,"[3, 6, 14, 46, 48, 49, 130]",Chasm is a procedurallygenerated RPG Platformer for PC Win Mac  Linux Playstation 4 and Nintendo Switch Taking equal inspiration from hack n slash dungeon crawlers and Metroidvaniastyle platformers it will immerse you in a procedurallygenerated fantasy world full of exciting treasure deadly enemies and abundant secrets,"[8, 12, 31, 32]",When a small mining community falls silent a young soldier named Daltyn is sent to investigate Upon arriving in the remote mountain town of Karthas he discovers that paranormal forces have sealed the town off from the outside world Now trapped hes left with no option but to explore the mines below the town and uncover the source of the disturbances Six huge procedurallygenerated areas await each lovingly crafted in a retro pixel art style Help Daltyn gain new abilities and equipment evade dangerous traps and defeat hordes of deadly enemies in order to save Karthas  and possibly the world,75.38062177767054,8.69,10.72,13.0,70.0,103.0,176.0
40,84486,This Is the Police 2,"[3, 6, 14, 34, 39, 48, 49, 130]",Interpret the law as you see fit in This Is the Police 2 sequel to the acclaimed noir drama This Is the Police Run the sheriffs department manage your cops investigate interrogate and incarcerate Make tough decisions  and try to keep out of prison yourself  in this storydriven mixture of adventure strategy and turnbased tactical combat Is it a simulation A management game A tactical challenge A visual novel A puzzle Its all of these and more,"[13, 15, 16, 24, 31, 32, 34]",Welcome to Sharpwood where people know their neighbors by name and faithfully keep to their traditions no matter how barbaric those traditions might be Smugglers gangs and screaming populists call this town their home Despair grows like a cancer hand in hand with violence Its a hell of a job for the new sheriff Lilly Reed voiced by Sarah Hamilton of the celebrated adventure saga The Longest Journey Shes struggling to maintain order and peace while her subordinates are uncouth men who arent used to taking commands from a young woman But everything changes when a mysterious stranger calling himself Warren Nash appears in Sharpwood And no one knows what hell bring to the town salvation or perdition  Just like the first game This Is the Police 2 is a mixture of adventure and management genres and this time it enjoys further unexpected mechanics that will strengthen both the strategic and tactical parts of the game It wont be enough just managing the equipment of your policemen and keeping in mind their individual skills Every challenge requires the players direct participation and the outcomes will depend on every decision you make Now your subordinates arent just some resource they are living people with their own strengths weaknesses fears and prejudices and youll have to reckon with all these things in order to survive,73.90356758592182,21.3,25.56,32.05,70.0,32.0,33.0
41,105274,Super Volley Blast,"[6, 48, 49, 130]",Super Volley Blast brings back the spirit of the oldschool superfun sport games Set your friends at the court with the powerful character editor and play with or against them in the story mode or in custom matches and tournaments,"[14, 32, 33]",Missing,70.0,0.0,0.0,0.0,0.0,0.0,0.0
42,105237,Music Racer,"[6, 48, 49, 130]",Music Racer is a musical arcade game where you get to race at full speed while dodging obstacles to the rhythm of the music,"[7, 10, 32, 33]",Missing,70.0,2.22,4.16,4.37,54.0,9.0,15.0
43,104866,Black Paradox,"[6, 14, 34, 39, 48, 49, 130]",Fast paced roguelike shoot em up game with an amazing pixel art and SynthWave soundtrack Play as Black Paradox a fierce bounty hunter and defeat the biggest criminal organization in space The Hellraisers and its 7 leaders,"[5, 8, 31, 32, 33]",Missing,70.0,15.5,0.0,27.51,90.0,1.0,4.0
44,104231,Danger Zone 2,"[6, 48, 49]",Danger Zone 2 takes the crash testing action out of the Test Area and onto real public roads    A high speed driving game featuring speed traffic and crashes Danger Zone 2 lets players loose onto the Freeways of the USA the Motorways of the UK and the Autovias of Spain    Using advanced real world physics and the power of Unreal Engine Danger Zone 2 lets players crash for cash and compete against each other to cause the most chaos on the road,"[10, 32, 33]",Missing,70.0,1.64,2.32,4.53,70.0,8.0,12.0
45,103256,Escape From Tethys,"[6, 14, 48, 49, 130]",Youre trapped alone and cold on a distant planet Pursued by a droid with only one purpose killing everything You must find an escape Explore the hostile environment find secret upgrades and new weapons and finally make your escape from this dark hostile planet,"[8, 9, 31]",Missing,70.0,5.85,6.57,8.59,70.0,4.0,11.0
46,90417,The Tower of Beatrice,"[6, 46, 48, 49, 130]",This is the Adventure  Room Escape game about an unlucky Thief who stole a quite babbling book,"[9, 31, 32]",Missing,70.0,2.83,4.78,5.42,47.0,3.0,4.0
