first_release_date,genres,id,name,platforms,summary,rating,storyline
954460800,"[13, 14]",69229,All-Star Baseball 2001,[4],The last AllStar Baseball release on the N64 once again includes some new features as well as improvements in relation to previous play modes  options For 2001 a new team is included The Coopertown Legends featuring a selection of some of the finest players to ever grace the MLB including Yogi Berra Willie Stargell and Reggie Jackson Along with the legends team you can choose from every player team and stadium from the real 2000 MLB season Each player includes facial expressions and looks inspired to realism plus motioncaptured player movements batting stances and reactions to key events during play,Missing,Missing
953769600,[33],44059,Mario Artist: Talent Studio,[416],In Mario Artist Talent Studio the player can create their own characters in 3D customizing features such as hair skin and eye color voice clothes facial features and body size and type The process is similar to Nintendos later Miis but much more detailed The characters can then be inserted into movies and animations Events during these movies can be controlled by pressing the Ztrigger Images from external video can be imported using the Capture Cartridge,Missing,Missing
954460800,"[13, 14]",37976,Itoi Shigesato no Bass Tsuri No. 1: Definitive Edition!,[4],Itoi Shigesato no Bass Tsuri No 1 Definitive Edition is a Sports game developed by Hal Laboratory and published by Nintendo It is the Definitive Edition of the Super Famicom game Itoi Shigesato no Bass Tsuri No 1,Missing,Missing
953251200,"[10, 14]",3615,Top Gear Hyper-Bike,[4],Motorbike racer set in the Top Gear series The Championship mode has you alternating between dirt and street racing as you compete for points You earn new bikes and courses along the way like many other games but interesting twist is going from one kind of racing to the other The physics of each type of racing are very different and youll have to switch back and forth between dirt and racing tactics on the fly The dirt bike racing is a lot more arcadey with all of the jumps and wide open tracks You can earn turbo by pulling off tricks and theres really nothing to stop you from testing your stunt skills while racing except your own nerve and imagination In this way Hyperbike is like Hydro Thunder where youre expected to lean on that turbo button the whole time and its up to your racing skills to ensure theres turbo available,Missing,Missing
953596800,[8],1698,Wario Land 3,"[22, 37]",Trapped inside a magical music box the invincible Wario is on a dangerous quest to help a mysterious figure recover its lost powers Smash bash and crash your way through more than two dozen gigantic levels in search of hidden keys valuable treasures and mystical music boxes Test your wits on puzzle after intricate puzzle and flex your muscles in actionpacked boss fights Be wary of Wanderin Gooms Hammerbots Mad Scienstein and more as you plunge into one of the largest most dazzling adventures ever to hit Game Boy Color,80.12791886071642,One day Wario is flying with his plane over the woods until it runs out of gas and crashes Unharmed Wario then stumbles upon a mysterious cave Inside the cave he discovers a magical music box He wants to take a closer look and that causes him to be suddenly sucked into the music box In the music box a mysterious figure informs Wario that he is a god who once protected the world inside the music box until an evil being sealed away his magical powers in five music boxes In exchange for freeing it the figure promises to send Wario back to his own world and let him keep any treasure he finds With his mind on the money and the fact he can return to his own world Wario departs on his quest in search of the music boxes and the many treasures of this mysterious land
953856000,"[8, 31]",2713,Kirby 64: The Crystal Shards,"[4, 5, 41]",Kirbys first 3D adventure is also his Nintendo 64 debut and it finds the alwaysversatile hero battling a new enemy called Dark Matter Dark Matter is after a distant lands powerful crystal but a young fairy named Ribbon attempts to save it by escaping with the gem to Dream Land Now the crystal has been broken and its scattered around the world Take control of Kirby and help him journey across six worlds battling a wide variety of enemies and challenging bosses as he tries to collect all 100 pieces of the shattered crystal,74.64016492054826,On the planet of Ripple Star lives a group of kind and peaceful fairies The planet itself is protected from danger by the power of the great Crystal which watches over Ripple Star This power however draws the attention of Dark Matter who wishes to use the great Crystal for its own evil agenda Its gigantic mass attacks and searches for the Crystal blackening the sky and sending the fairies into panic In response to the threat Dark Matter presents the queen of Ripple Star orders a fairy named Ribbon to take the Crystal to a safe place Ribbon tries to fly away with the Crystal in tow but is stopped by three orbs sent by Dark Matter The Crystal shatters into 74 shards scattered throughout several planets and Ribbon crashes onto Planet Popstar Kirby finds one shard and gives it to Ribbon whereupon the two set out to find the others Once Kirby and his friends collect every Crystal Shard and defeat Miracle Matter Dark Matter flees Ripple Star and explodes The victory is cut short however as the Crystal detects a powerful presence of Dark Matter energy within the Fairy Queen and expels it from her manifesting over the planet to create Dark Star Kirby and his friends infiltrate Dark Star and King Dedede launches them up to challenge 02 Kirby and Ribbon armed with their Shard Gun destroyed 02 and the Dark Star
