first_release_date,genres,id,name,platforms,summary,storyline,rating
1443484800,[33],242953,Monopoly Plus: My Little Pony,"[9, 12, 48, 49]",The Rainbow power invades Monopoly Add some fun friendship and joy on your board with My Little Pony This DLC contains a whole customized board with an animated token Its time to saddle up for the rainbow power and Monopoly,Missing,Missing
1442880000,[14],240448,FIFA 16,"[9, 12]",Port of FIFA 16 for oldgen consoles PS3 and Xbox 360,Missing,Missing
1443312000,"[9, 31]",172584,LEGO Dimensions: Scooby-Doo Team Pack,"[9, 12, 41, 48, 49]",Zoinks The Lego worlds have been mashed up into a crazy topsyturvy multiverse and someone needs to help figure out whats going on Build and place ScoobyDoo and Shaggy on the Lego Toy Pad and bring them to life in the game Then activate their special abilities and help them solve the Lego Dimensions mysteries Call in The Mystery Machine and giant Scooby Snack and rebuild them for upgraded ingame abilities,Missing,Missing
1443312000,"[9, 31]",172579,LEGO Dimensions: Homer Simpson Level Pack,"[9, 12, 41, 48, 49]",Despite Marges advice Homer has consumed a plate of Chief Wiggums Guatemalan Insanity Peppers at the Springfield Chili CookOff and needs your help to uncover the riddles of the Coyote and seek out his soul mate Attach Homer to the Lego Toy Tag and place him on the Lego Toy Pad to see him spring to life in the game Activate his Sonar Smash and Big Transform abilities to overcome obstacles and defeat enemies When Springfields favorite dad needs assistance send in the rebuildable 3in1 Homers Car and TauntoVision to help save the day and win back the affections of Marge and the rest of the Simpson family in this exciting puzzlefilled world,Missing,Missing
1443312000,"[9, 31]",172570,LEGO Dimensions: Back to the Future Marty McFly Level Pack,"[9, 12, 41, 48, 49]",Marty McFly has been catapulted back to 1950s Hill Valley when an experiment carried out by his oddball scientist friend Doc Brown goes wrong Now he needs your help to find a way of traveling back to the future to rescue his friend Build Marty attach him to his Lego Toy Tag and place him on the Lego Toy Pad to see him come to life in the game Activate his special Sonar Smash ability to help him solve ingame puzzles and overpower enemies and when he needs a timetraveling boost add the rebuildable 3in1 DeLorean Time Machine and Hoverboard into the game,Missing,Missing
1443312000,"[9, 31]",172568,LEGO Dimensions: Owen and ACU Trooper (Jurrasic World) Team Pack,"[9, 12, 41, 48, 49]",Build Owen and the ACU and place them on the Lego Toy Pad to launch them into the Lego Dimensions multiverse Use their weapons and activate their powerful special abilities to battle enemies and solve exciting puzzles When things get tough send in Owens Velociraptor and the ACUs Gyrosphere and then rebuild them for upgraded ingame abilities,Missing,Missing
1443312000,"[9, 31]",172561,LEGO Dimensions: Portal 2 Level Pack,"[9, 12, 41, 48, 49]",Armed with only her portal gun and her wits journey as Chell and battle through the newly rebuilt Portal 2 Aperture Science Test Labs filled with puzzles thermal discouragement beams neurotoxins and GLaDOS Build Chell attach her to the Lego Toy Tag and place her on the Lego Toy Pad to see her spring to life in the game Activate her special Acrobat and Portal Gun abilities to overcome obstacles and defeat enemies and if shes in a tight spot call in the rebuildable 3in1 Companion Cube and Sentry Turret to help her escape from GLaDOS and Portals puzzlefilled world,Missing,Missing
1442448000,Missing,145085,Saki Zenkoku-hen,[46],Missing,Missing,Missing
1442448000,"[31, 34]",144684,Tokyo Onmyouji: Tengenjibashi Rei no Baai - V Edition,[46],Allages Vita port of the original PC game,I am an onmyoji after all  It is the year 2014 in the Shinjuku ward of Tokyo Japan  The capital having remained largely unscathed by major air raids for the duration of World War II has settled into an enthralling blend of the remnants of the old days and the developments of the new over time Although the country should be at peace lately it has been afflicted by horrifying incidents of assaults by ayakashisupernatural creatures and spiritsagainst humans  Though previously banned at the close of the war the practice of the onmyojimasters of spirits and divinationhas been approved once again in order to combat the ongoing supernatural threat  With hollow souls roaming the streets of Tokyo freely the world is on the brink of collapsing into chaos While it has been discovered that most of these malicious spirits were once human the dark truth behind the origin of these disturbing transformations has yet to reveal itself  Only by resolving these strange incidents in this metropolis of turbulent clashing emotions will the answers eventually be made clear  Or will they,Missing
1443139200,[34],136433,Teikoku Kaigun Koibojou: Meiji Yokosuka Koushinkyoku,[46],A Vita otome game,The Meiji period  Around the time the damages caused by the First SinoJapanese War were beginning to heal Mihagi Sonoo had graduated from a regular school Unable to find employment she found herself in poverty  Then an opportunity had arisen Not far from her home was the Yokosuka Military Base and they were looking to hire artists Having learned of this Sonoo headed for a job interview with the drawings she had made However while she was lost in the building she accidentally witnessed the military band working as spies they were in a meeting and to top it off she got caught doing so  With the military band not wanting their secret to get leaked and with Sonoo looking for work they came to an agreement she became the military bands artistcumspy apprentice and became a member  For a while she was tasked with drawing posters and did some general work on the side One day her superior officer Iyobe summoned and ordered her to join the other band members to engage in actual spy missions  And that was how the first mission of her life began,Missing
1441324800,"[2, 31]",136170,Broken Sword 5: The Serpent's Curse - Premium Edition,"[48, 49]",Broken Sword 5 The Serpents Curse is a classical point  click adventure It abandons 3D graphics and direct control which were used in the two predecessors and returns to the style of the first two games The only major technical differences are a higher resolution and that the characters are modelled instead of drawn,Missing,Missing
1442534400,"[13, 14]",136036,Pro Evolution Soccer 2016: 20th Anniversary Edition,[48],The 20th Anniversary Edition includes a collectors SteelBook and exclusive digital content for myClub,Missing,Missing
1442448000,[34],130010,Genji Koi Emaki,[46],Genji Koi Emaki was released in 2015 for the PSVita,The graceful capital city ancient Kyoto  A beautiful noble daughter was born between the emperor and his consort Kiritsubo who had gained his favour That beautiful daughter is known as Hikaru no Miya The Princess of Light due to her unparalleled beauty that is likened to her casting light The only men that are allowed to approach the beautiful princess are men chosen by the imeprial court who are collectively known as the Gekkou Go Kunshi The Five Noble Men of Moonlight Every night a secret rendezvous with the five men takes place in which they read traditional Japanese poems to one another  The protagonist Chikage is Hikarus servant lady Though she looks just like Hikaru Chikage has no interest in things relating to herself She has lived each and everyday relying on the joy that serving her master had provided her  It happened so suddenly A letter written in kana was left behind Her master Hikaru had disappeared If the emperor finds out about this the female servants will get dismissed Hikarus reputation will take a hit and it would threaten her happiness  In order to protect her colleagues and her master Chikage decides to disguise herself as Hikaru and take her place  Where is the princess  What lies ahead of this dreamlike rendezvous,Missing
1442275200,"[12, 15, 16, 31, 32]",115418,Braveland Trilogy,"[6, 48, 49, 130]",Braveland is a turnbased adventure game inspired by oldschool turnbased games such as Kings Bounty and Heroes of Might  Magic In Braveland you start as a humble warriors son whose village was cruelly raided  and work your way to becoming the commander of a powerful army Handcrafted art complements a wonderful fantasybased story where your young hero recruits allies to aid in the cause while learning spells and battling bosses on his way to becoming the ultimate protector of the land,Missing,Missing
1443139200,Missing,97432,The Idolmaster: Cinderella Girls - Gravure for You! Vol.5,[9],This volume continues the ability to take pictures of two idols at a time and to add music from CDs into the BGM list Additionally the player can move the selected idol around the Hotel Pool area from the poolside to the diving block the Dream Swimsuit outfit also comes with a coverupoff option Idol Focus Mio Honda Costumes Dream Swimsuit Traditional Maid Summer Cool School Locations Hotel Pool WesternStyle Cafe Day Off Classroom,Missing,Missing
1442275200,"[4, 25, 33]",76639,Knights of Valour,[48],Knights of Valour is a freetoplay online game for PlayStation 4 It combines the aspects of a stagebased multiplayer action game with the charm of a classic arcade beatem up experience,Missing,Missing
1441324800,"[5, 33]",75707,Arcade Archives: Star Force,"[48, 130]",Arcade Archives Star Force is a port of the shooting game Star Force It was very popular due to its variety of hidden bonuses as well as competition for achieving high scores,Missing,Missing
1443139200,Missing,60222,Genkai Tokki Moero Crystal,[46],Another dungeon RPG in Compile Hearts monster girl themed Genkai Tokki series,Missing,Missing
1442793600,"[9, 15]",59735,Mahjong Carnival,"[46, 48]",Festival themed mahjong solitaire,Missing,Missing
1442880000,[26],52154,Battle Trivia Knockout,"[9, 48]",Battle headtohead in this fastpaced trivia action game and knock out the competition Over 1000 new questions are both presented on screen and spoken by the Trivia Sensei,Missing,Missing
1441929600,[15],44532,Toy Soldiers: War Chest - Hall of Fame Edition,[48],The Toy Soldiers War Chest Hall of Fame Edition is the paramount Toy Soldier experience This fastpaced genrebending mix of strategy defense and action game brings to life the iconic action figures from your childhood like HeManTM GI Joe and Cobra and four other toyinspired armies    With eight unique armies to protect your toy box with  all with distinct strengths and personalities  theres a faction for every play style Customize your loadout before battle and earn new items while conquering and exploring over 15 unique maps    Whose toys are best Grab up to three other friends and find out Multiplayer includes up to 2v2 survival mode and youll be able to play any of the modes cooperatively locally on one console or online    New challenges arrive every seven days with the new Weekly War Mode Earn new content and items when you complete all five maps for the week,Missing,Missing
1443398400,[31],43001,Syberia: Complete Collection,[9],This compilation pack contains two adventure titles from acclaimed designer Benoît Sokal Included are both Syberia and Syberia II  SYBERIA  A journey beyond compare For the young Kate Walker an ambitious lawyer the Voralberg toy company acquisition seemed like a textbook case  a quick stopover to a small alpine village in France to buyout an old automaton factory then straight back home to New York Her journey across land and time throws all she values into question while the deal she set out to sign turns into a pact with destiny  SYBERIA II  Embarking on a desperate search for Hans Voralberg Kate Walker crosses Europe from West to East She has left behind all her worldly possessions with the express purpose of joining the heir of the Voralberg family on his journey Together through mystical and enchanting lands they will find their way to the mythical Syberia land of the forgotten mammoths Make your way to Syberia overcome many difficult obstacles on the way and deal with shady characters to uncover clues vital to the continuation of the quest The game features four different worlds to explore and an updated graphics engine with dynamic lighting effects,Missing,Missing
1443139200,[31],42947,Until Dawn: Extended Edition,[48],When eight friends become trapped on a remote mountain getaway gone wrong things quickly turn sinister and they start to suspect they arent alone Gripped by fear and with tensions in the group running high youll be forced to make snap decisions that could mean life or death for everyone involved Every choice you make while playing as each of the eight friends  even the seemingly trivial ones  will carve out your own unique story  Spinetingling performances from a Hollywood cast including Hayden Panettiere are brought to life with the power of PlayStation 4  your actions alone will decide who survives Until Dawn  The Extended Edition included a different game cover and a new exclusive scene,Missing,Missing
1442534400,[5],42926,Helldivers: Super Earth Ultimate Edition,[48],Join the elite Helldivers mankinds last line of defense in a war against a ruthless alien race in this topdown shooter with a satirical sense of humor Take to the battlefield with advanced weaponry and call in vehicle and air strikes to cover your squad mates The reward for success is a place in Federation legend,Missing,Missing
1441152000,"[12, 13, 15, 31]",38981,Asdivine Dios,"[6, 34, 39, 46, 48, 49, 130]",Welcome to the new Asdivine and get ready as a tale about divine encounters with mankind and mankinds encounters with the divine is about to unfold  An Adventure of Divine Proportions Among the many worlds the deities have created there is one world that abounds with life known as Asdivine But when a spate of disturbances erupts across the globe and an ever spreading murk threatens to destroy it Izayoi the deity of Asdivine himself takes up his cause to save the world he created with his own hands Unfortunately suffering from a loss of his own divine powers is there any hope he can he succeed Find out as the curtain raises on this adventure of divine proportions,Missing,Missing
1441929600,"[8, 31, 32, 33]",35855,Crash Dummy,"[3, 6, 14, 48, 130]",A challenging 2D platformer with numerous and pure mechanics to keep you interested throughout its unique adventure Blast burn freeze your way through a storydriven adventure with a unique set of endearing characters Jump long distances and do wallruns for some stylish ninja action,Missing,Missing
1442880000,"[10, 14, 32, 33]",33424,Rally Copters,"[6, 46, 48]",Rally Copters is an intense physicsdriven helicopter racing game that will push you to the limit Pilot your way through 27 courses jampacked with perilous obstacles and deadly corridors Unlock a variety of helicopters to blaze through new levels and crush your record times Compete against the world in online leaderboards,Missing,Missing
1441670400,"[8, 31]",24219,Tearaway: Unfolded - Crafted Edition,[48],Join forces with Atoi the messenger in a daring quest to deliver a topsecret message Unfold her magical papery world save her pals in peril and battle the monsters trying to stop her delivery,While following a similar story of the messenger taking daring quest to reach You to deliver their message Tearaway Unfolded features familiar  new content exclusive to the PlayStation 4 that utilises the PS4s features  Atoi is created from an envelope and some paper Now shes on an adventure to reach the Face in The Sun to deliver her message  Oh wait shes being attacked by Scraps and You need to help her After you help her she has to find hidden Scraps that are shadowing the sky  She finds a Guide that is asking Atoi to move into Wassail Orchard to reach the Sun,Missing
1441238400,[5],20892,Call of Duty: Advanced Warfare - Reckoning,"[6, 9, 12, 48, 49]",Brace yourself for Reckoning the final downloadable content pack for Call of Duty Advanced Warfare Drone swarms plasma lamp explosions and crumbling glaciers dial up the excitement in four new MP maps The Exo Grapple Playlist delivers more carnage and more fastpaced MP combat than ever before The culmination of the Exo Zombies saga Descent delivers an allnew map fused zombie enemies and the Trident Reflected Energy Weapon Discover the true cause of the global pandemic and the terrible secret that Atlas has been hiding,Missing,Missing
1442275200,"[5, 12]",20860,Destiny: The Taken King - Legendary Edition,"[9, 12, 48, 49]",Destiny The Taken King Legendary Edition features the complete Destiny experience including The Taken King the next great Destiny adventure Destiny Expansion I The Dark Below and Expansion II House of Wolves Unite with 20 million Guardians in the fight to defend our universe and Become Legend,Prior to the events of The Taken King Guardians crippled the Hive invasion force on Earth and the Moon by methodically taking down their field commanders and strategists including Sardon and Omnigul The Guardians then banished Crotas soul and eventually killed Crota himself They also destroyed a Shrine communing with Oryx and killed its protector Sardok  Eris Morn alerted Mara Sov of Oryxs arrival and the Queen set out with the Awoken Armada to Saturn where the Taken Kings Dreadnaught had stopped to refuel Uldren Sov led his fighter wings to attack the Dreadnaught and engage the fleet of Tombships protecting it with the Queen and Oryx presiding over the battle from their respective flagships  With help from her Coven of Techeun Witches the Queen summoned her Harbingers deadly orbs that could decimate an army in seconds The Harbingers bombarded the Dreadnaught but after the explosions faded away there seemed to be no lasting marks on the battlecruiser Oryx then fired the ships superweapon which ripped a hole through the rings of Saturn and completely destroyed the Awoken fleet Queen Mara and many other major parts of the Reefs leadership including Paladin Abra Zire and Techeun Shuro Chi have since disappeared and are considered MIA while Petra Venj has advised a remaining Paladin to declare all of them dead  Attack on Phobos Meanwhile the Vanguard intercepted a distress signal on all channels broadcasted from the Skyburners fortress Fleetbase Korus on Phobos A Guardian is dispatched to Phobos and they witness a strange new enemy slaughtering the Skyburners Oryx contacts the Guardians willing into existence an army of corrupted Cabal and Hive called the Taken The Guardian defeats these Taken overcoming Syrok Word of Oryx They then attempt to escape the Skyburner Keep via the Aerodrome landing pad which is riddled with Taken The Guardian reaches the landing pad and escapes Phobos in their ship  From then Oryxs master plan is revealed He will enslave as many Cabal Vex Fallen and his own Hive as he can and use them to bring the system into ruin Initially one of his consorts Ecthar who also fluently speaks English tells him to only retrieve the strongest of the four races and bring the rest to nighextinction but Oryx objects to Ecthars advice  Realizing that the Taken are too deadly a threat to take lightly the Vanguard send Guardians to rediscover lost powers of their forebearers The Hunter gains the Nightstalker class and the Shadowshot super ability the Warlock gains the Stormcaller class and the Stormtrance super ability and the Titan gains the Sunbreaker class and the Hammer of Sol super ability,Missing
1442880000,[31],20030,Afro Samurai 2: Revenge of Kuma,"[6, 48]",The sequel to 2009s Afro Samurai was considered so unfinished and poorly done that it was pulled from digital distributors less than two months after its release and all purchases were refunded,Missing,Missing
1443139200,[12],19796,The Witch and the Hundred Knight: Revival Edition,[48],An enhanced version of the original The Witch and the Hundred Knight,Missing,Missing
1442275200,Missing,18024,Battlefield Hardline: Robbery,"[6, 9, 12, 48, 49]",The top gangs are drawing up plans stockpiling gear and risking it all to pull off the boldest craziest heists ever in Battlefield Hardline Robbery the second expansion pack for Battlefield Hardline  The theme of this pack is the Big Score how to steal it or how to stop it The new maps and game mode in Battlefield Hardline Robbery are designed to let criminal teams plan and execute the perfect heist or for law enforcement to get the crooks in cuffs before they can pull it off,Missing,Missing
1442880000,"[25, 31]",15525,Batman: Arkham Knight - Original Arkham Batman Skin,"[6, 48, 49]",Fight the war against Gotham City with the original Arkham Asylum Batman costume,Missing,Missing
1442448000,"[31, 34]",13019,Yunoha na Spring!: Welcome to Fukujuro,[46],Yunoha na Spring is a Japanese otome visual novel,The protagonist Yunoha is the onlychild of the owner of the Fukujurou bath house in Ayagawakai Onsen She longs for the big city life so one day she decided to ignore her parents disprovals and leave the countryside  However once Yunoha heard news that her mother had fallen she returned to her home Once she arrived she learned that her familys bath house business was supposed to be thriving but it was barren of customers It appeared that the new resorts built around the area were overshadowing the traditional small businesses  But our business has its quirks you know  And thus she became the temporary landlady of the bath house with solid determination  With unique employees and customers with their own reasons for staying her days are becoming busy as she tries to earn profit for her family while dealing with love Its all confusing but at the same time its full of heartpounding moments What will become of her future,Missing
1442448000,"[4, 31]",12892,World Trigger: Borderless Mission,[46],World Trigger Borderless Mission is a battle action game based on the World Trigger manga series The game features 80 missions which can be played either solo or by adhoc or online coop the game also features 23 playable characters all of whom will be voice acted,Missing,Missing
1442880000,"[9, 31, 32]",12814,Subaeria,"[6, 48, 49]",A roguelike action puzzler where players manipulate robots into destroying each other,Missing,Missing
1443139200,[12],11494,Moero Crystal,[46],Moero Crystal is a roleplaying video game developed by Compile Heart for the PlayStation Vita It is part of the Genkai Tokki series and the sequel to Moe Chronicle The player will need to make a team of five monster girls for battle The protagonist Zenox cant attack but hell help provide support with power ups The new Insert command also lets you move ahead one of the characters in the attacking order Upon defeating a monster girl youll get to recruit them through its touchscreen scratching feature There are also some items that will allow you to get them to join you later without having to do the scratch feature They will allow you to instead give them a scratch later on your own time,Missing,Missing
1443571200,[12],11455,Tokyo Xanadu,[46],Tokyo Xanadu is an upcoming Japanese roleplaying video game for the PlayStation Vita The game plays as an action roleplaying video game with many elements from the Persona series of games It has a partybased battle system with randomly generated dungeons    An enhanced version titled Tokyo Xanadu eX was developed for PS4 and Windows It has a new playable character with new scenarios enemies bosses and dungeons It also includes two new play modes Time Attack and Boss Rush,10 years ago a colossal earthquake devastated Tokyo and changed the lives of its inhabitants forever The city has since been rebuilt and life has slowly returned to a semblance of normalcy However behind the veil of this newly rebuilt metropolis lies another world one with a sinister secret The earthquake that originally destroyed Tokyo was actually caused by the emergence of a mysterious and lethal shadow world known as Xanadu Now action must be taken to thwart the legions of Xanadu and ensure the protection of Tokyo,Missing
1442188800,"[8, 31, 33]",88563,Croc's World 3,"[6, 48, 74, 130]",Crocs World 3 is a really nice jumpnrun with 60 incredible levels and many challenging enemies It features  60 incredible levels  Nice graphics  2 different themes  many challenging enemies  4 evil endbosses Instructions Jump and run through the levels and dodge all enemies Collect a helmet to crush stoneblocks Collect the stonebag to throw stones Collect the special stonebag to throw autohoming stones Collect special items like Firehelmet walk through fire or Shield Invincible for 10 seconds If you collect 100 diamonds youll get an extra life,Missing,90.0
1441670400,"[8, 9, 31]",24042,Leo's Fortune HD Edition,"[6, 14, 34, 39, 48, 49]",Leos Fortune is an awardwinning platform adventure game where you hunt down the cunning and mysterious thief that stole your gold Beautifully handcrafted levels bring the story of Leo to life in this epic adventure,Missing,90.0
