first_release_date,genres,id,name,platforms,summary,storyline,rating
1559174400,[5],254462,Duck Hunt Remake,[46],A clone of Duck Hunt popular classic NES game for PSVITAPSTV,Missing,Missing
1558483200,Missing,215291,A Night in the Forum,"[48, 165]",A Night in The Forum is an educational environmental narrative game based on scientific reconstructions of Augustan Rome,Missing,Missing
1557792000,"[9, 25, 31]",208251,LEGO DC Super-Villains: Young Justice Level Pack,"[6, 14, 48, 49, 130]",It is now up to you to take the role of members of the Young Justice League and defeat members of the The Light What will the final fate of Aqualad and The Light be Play as Aqualad Artemis Miss Martian Kid Flash and more to find out,Missing,Missing
1558396800,"[13, 31, 32]",201658,Bonfire,"[165, 384, 386]",Youre Scout 817 a member of the not so elite Space Force Youve just crashed your spaceship on a strange planet Your only tools for survival are a fading bonfire a robot and a limited supply of nourishment cylinders And whats that sneaking around out there in the dark alien jungle,Missing,Missing
1558483200,"[5, 12, 25]",198496,Warframe: The Jovian Concord,"[6, 48, 49, 130]",Rumors are circulating of an alliance between Alad V and our most feared enemy  the Sentients Infiltrate the remastered Corpus Gas City on Jupiter drive your blade through Amalgam horrors unlock the power of the Wisp Warframe and shine a light on this sinister Corpus plot,Missing,Missing
1556755200,"[4, 25]",154723,For Honor: Season 10 - Sakura,"[6, 48, 49]",A series of chilling incidents has plagued the Myre and many believe they all began with Sakura an infamous Hitokiri Years ago the Samurai executioner was taskedto sentence a peasant fisherman who had committed an odious crime As Sakura rose her axe to deliver justice she fell into a trance and slaughtered every living soul in the village Many years have passed and yet Kaidan is still rumored to be haunted by Sakuras victims Some unfortunate warriors recently fought in the abandoned village but only a few lived to tell the tale They have seen things most people would not believe,Missing,Missing
1558396800,"[9, 13, 15, 32]",146725,Mega Mall Story 2,"[6, 34, 48, 130]",A business management sim where you can make a mall thats right for you Everythings been expanded since the last game  build bigger build higher Enjoy more freedom and customization than ever Add public transport stations to bring in customers from farther away Visitors can come by bus subway helicopter and even on UFOs Meet new mall visitors bursting with personality I could go for a bowl of ramen and a good book Its a managers job to make sure customers leave satisfied Build stores that will delight your regulars Create enough great stores And you can even attract VIPs New tenants stores exclusive to this title Set up exhibitions a movie theater pool and even an indoor farm Stores come in different shapes and sizes  the combinations are limitless Create combos by placing related stores on the same floor Take advantage of weather and scenery to attract more customers and compete with other stores to be the best mall in town A new challenger steps into the world of business management dreaming of one day running a 5star mall The skys the limit in Mega Mall Story 2 Try searching for Kairosoft to see all of our games,Missing,Missing
1559260800,Missing,140744,Aikano: Yukizora no Triangle,"[6, 48, 130]",The former track and field club member Shun attended school with his childhood friend Shizuri and close friend Koharu However they had just one more year together before they graduate and possibly go their separate ways  Both girls had feelings for him and decided to confess to him on Valentines Day while they still had a chance It so happened that he was asked to meet them at different places at the same time How will he respond to their confessions and what will become of their uneven triangle relationship,Missing,Missing
1557878400,"[5, 31, 32, 33]",138916,Takotan,"[6, 46, 48, 49, 130, 167, 169]",The world has been taken over by an alien invasion On the eve of destruction humanity calls out for help Takotan is a retro shootem up inspired by 16bit classics Save the world from alien invasion by shooting and dodging your way through 8 actionpacked levels with sinister bosses Collect a variety of powerups including lasers bowling balls and ninja stars to take down enemies and defend the planet,Missing,Missing
1558051200,"[11, 13, 15]",138059,Dungeons 3: Famous Last Words,"[3, 6, 14, 48, 49, 130]",The Spirit of the Absolute Evil will run forever  Evil evil everywhere and theres absolutely nothing Good left to conquer No paladins queens nor goddesses could stop the evil armys triumphal march and it will still be a while until the next generation of heroes will be come of age So now its time for the FinallyBoredToDeath Evil to hang up its armour But it wouldnt be Dungeons if it didnt end with the biggest of all bangs  While the Absolute Evil is making an excursion into the asyet unconquered depths of its own nose in Famous Last Words  out of pure boredom obviously  a very heated discussion between Thalya and our beloved narrator erupts Who will emerge victorious when these two luminous figures wrestle it out to become the ultimate warrior on the battlefield of evil Its time to find out,Missing,Missing
1559260800,[34],135306,E School Life,"[6, 48, 130]",Missing,Ryoutarou had been forced to live and study overseas for the past six years due to his parents work He confided to his childhood friend Tooru who was living in Japan that he hated it  Im surrounded by the guys in the class and cant even get a chance to talk to the girls I dont want my teenage years to end like this  Tooru sympathized with Ryoutarou upon hearing his difficulty with the language barrier and desire to return to Japan and talked with his parents about the possibility of bringing him back After convincing his parents Ryoutarou was able to return and live in a room share with Tooru He was thrilled to be back on native soil but more importantly that he will be able to talk with girls Hell be able to fall in love at his new school  Why did you plan on doing when you came back to Japan Of course fall in love I want girl friends,Missing
1558396800,[31],125987,Vader Immortal: A Star Wars VR Series,"[162, 165, 384, 385, 386]",Step inside a galaxy far far away with Vader Immortal A Star Wars VR Series You are a smuggler operating near Mustafar the fiery world Darth Vader calls home When you are unexpectedly pulled out of hyperspace you find yourself uncovering an ancient mystery at the behest of the Sith Lord himself  With the help of your droid companion ZOE3 youll navigate the dangers of the fortress hone your lightsaber skills and meet new characters along the way as you discover what Vader is up to,Missing,Missing
1557360000,"[15, 16, 32]",124963,Battle Brothers: Warriors of the North,"[6, 48, 49, 130]",The Warriors of the North DLC for Battle Brothers expands the game with a more distinct northern region as well as different starting scenarios to pick for your mercenary company Face an entirely new faction of barbarians in battle and wear new viking and rus themed gear,Missing,Missing
1558396800,"[9, 31]",123157,Shadow Point,"[162, 165, 384, 386]",Built for VR Shadow Point is a storydriven puzzle game set between a mountaintop observatory and an everchanging fantasy world Explore a vibrant kingdom cast shadows and solve mindbending puzzles as you uncover the mystery of missing schoolgirl Lorna McCabe who vanished from Shadow Point Observatory twelve years ago  Features Over 80 mindbending puzzles Full freedom of movement and hand tracking A powerful and compelling story Full voice cast featuring Sir Patrick Stewart English Voice over support for French German Spanish Japanese and Korean,You are Alex Burkett Guided by the journal of Edgar Mansfield  narrated by Sir Patrick Stewart  you will ascend via cable car to the abandoned summit and discover a portal to another realm  As your adventure unfolds you will manipulate gravity play with your own reflection walk on walls peer through a magical lens to reveal an alternate reality and much more,Missing
1557792000,Missing,120207,Star Trek Online: Rise of Discovery,"[6, 48, 49]",Missing,Missing,Missing
1557187200,"[8, 10, 13, 31, 32, 33]",120041,Hero Express,"[6, 14, 39, 48, 49, 130]",When the hero needs saving who will save the day The Hero Exprres Buckle up and get driving Try to reach the end of the tracks ALIVE Powerup your vehicles and drive around every corner of the globe Heroic deliveries right on time,Missing,Missing
1558396800,"[13, 15]",119954,Cities: Skylines - Campus,"[3, 6, 14, 48, 49, 167, 169]",Back to school In Cities Skylines  Campus university life abounds with new area types for any sort of student  Trade School Liberal Arts and University Increase the reputation of your campus by attracting students and creating Academic Works to unlock new buildings Build five types of varsity sports arenas and nine unique faculties employ seven new policies earn seven new achievements and take on five new maps Campus takes higher education to new heights with everything you need to graduate magna cum laude,Missing,Missing
1559174400,"[14, 33]",119218,Arcade Archives: Alpine Ski,"[48, 130]",Arcade Archives Alpine Ski is a port of the 80s arcade sports game Alpine Ski Hit the silver slopes and glide across 3 different stages Look out for obstacles other skiers and snowmobiles Nail the correct timing on the ski jump to score bonus points,Missing,Missing
1558569600,"[5, 33]",119087,Arcade Archives: Image Fight,"[48, 130]",Arcade Archives Image Fight is a port of the late scrolling shoot em up game Image Fight Clear the VR training course then take the fight up into outer space After you clear each stage you can check and see how many ships you destroyed If you still dont have a good score after clearing stage 5 you may have to take a supplementary course,Missing,Missing
1557273600,"[5, 32, 33]",118682,Darkness Rollercoaster: Ultimate Shooter Edition,"[6, 48]",The ultimate rail shooter in this corner of the Galaxy ,Missing,Missing
1558483200,"[9, 31]",118676,The Last Door: Complete Edition,"[48, 49, 130]",Feel what its truly like to be alone in the dark with this lowres highsuspense pointandclick horror adventure  Set in Victorian England when Jeremiah Devitt receives a letter from his old schoolmate Anthony Beechworth with a hidden cryptic message he knows something is wrong His journey to an abandoned manor is only the beginning as he starts to remember a longburied secret from his youth discovering things man was not meant to know and opening doors that should have remained closed,Missing,Missing
1559001600,"[13, 15, 32]",118670,Rescue HQ: The Tycoon,"[6, 48, 49]",Build up your headquarters from scratch and design your own masterpiece In Rescue HQ you build organize and manage a joint station for firefighters police and ambulance Manage your resources wisely and master challenging emergencies to keep your city safe Are you up to the challenge,Missing,Missing
1557360000,[13],118379,To Be A Dummy Head VR: Ferris Wheel Story,"[48, 165]",An audio drama created using a dummy head recording for a more immersive experience Originally released on mobile devices together the stories were split up for PlayStation VR The VR mode has video of the voice actors during the recording while a visual novel style version can be watched without the VR headset,Missing,Missing
1557360000,[13],118378,To Be A Dummy Head VR: Hotel Elevator Story,"[48, 165]",An audio drama created using a dummy head recording for a more immersive experience Originally released on mobile devices together the stories were split up for PlayStation VR The VR mode has video of the voice actors during the recording while a visual novel style version can be watched without the VR headset,Missing,Missing
1557360000,[33],118286,Arcade Archives: Ninja Gaiden,"[48, 130]",Arcade Archives Ninja Gaiden is a port of the late 80s action game Ninja Gaiden Play as a ninja using the Five Ninja Fighting Arts passed on from the chaotic times of feudal Japan as you take out an assassin organization through the horrifying stage Jungle an American city Perform a Phoenix Backflip off of obstacles or walls to land behind enemies and then defeat them with a Triple Blow Combination or Flying Neck Throw,Missing,Missing
1557360000,"[12, 31]",118280,Titan Quest: Atlantis,"[6, 48, 49, 130]",Play a classic Titan Quest adventure in single player or with up to 6 players in coop Survive the Tartarus an endless wavebased challenge mode Unlock new skills spend all your excess ingame money on random loot and enjoy graphic and QOL improvements,The Hero meets an explorer that is searching for the mythical kingdom of Atlantis and together they set out on a journey across the western Mediterranean The key lies in the legendary Diary of Herakles rumored to be in the Phoenician City of Gadir but their journey will take them beyond the edges of the known world,Missing
1557187200,[31],118202,Immortal: Unchained - Storm Breaker,"[6, 48, 49]",The fall of Apexion was swift and brutal The unstoppable hordes of Undead pierced the defenses of the outpost Storm Break and continued their relentless invasion Eliminate the threat and discover the Sea of Scars an allnew area of Immortal Unchained  Traverse the Sea of Scars mysterious seabed and explore the ruins of Storm Break to locate undiscovered secrets guarded by challenging new enemies and creatures Engage in monumental boss fights with powerful new weapons including the legendary Brightreaver a devastating weapon capable of destroying its victims with supercharged lightning,Missing,Missing
1557446400,Missing,118174,Just Shapes & Beats: Hardcore Edition,[48],Missing,Missing,Missing
1559174400,"[8, 31, 32, 33]",118024,Cold Silence,"[6, 48, 49, 130]",This is minimalistic horror platformer about survival at snowy mountains Follow the mysterious voice from the radio fight your fears and reveal the truth,Missing,Missing
1557446400,"[13, 30, 33]",117938,Dragon Pinball,"[6, 48, 49, 130, 167, 169]",The most entertaining Pinball is back Enjoy Dragon Pinball a perfect reproduction of a real pinball machine with all the graphic details and sounds  Discover all the secrets complete all the missions and become number 1 in the world or the best among your Friends posting your high score on the online leaderboard,Missing,Missing
1559174400,"[10, 33]",117835,Retro Pixel Racers,"[6, 48, 49, 130, 167, 169]",Retro Pixel Racers is a fun topdown arcade racing game with a retro style graphics where you control of little cars racing over exciting tracks Start your engines and prepare for the craziest and most addictive racing game ever Fastpaced racing game with a fresh interpretation of the 16bit style,Missing,Missing
1556755200,Missing,117614,Party Bingo,"[6, 167]",This game is four kinds of party games arranged Bingo,Missing,Missing
1557187200,"[5, 8, 31, 32, 33]",117445,Thunder Paw,"[6, 46, 48, 49, 130, 309]",This is a pixelart platformer with five different levels and different scenarios as well as a ton of weapons to be used to annihilate each level boss,Thunder was out playing with his ball in the fields when he suddenly heard a loud explosion near his house He rushed home worried about his parents only to find no one was there Just a single letter that said his parents had been kidnapped Its up to Thunder to rescue his parents Dominate your enemies with a trusty weapon by your side Each defeated enemy will drop special gems that make your gun even more powerful,Missing
1559174400,"[11, 15, 32]",117358,Lornsword Winter Chronicle,"[6, 48, 49, 167, 169]",Lornsword Winter Chronicle is a storydriven action strategy game Be the general on the battlefield and take direct action to command your soldiers and set up your economy The Lorn Empire counts on you keep your mind pure and your Lornsword sharp,Missing,Missing
1557964800,"[13, 15]",117300,Surviving Mars: Green Planet,"[3, 6, 14, 48, 49]",The Green Planet expansion includes a wide range of gameplay features that will change the way players approach life on the Red Planet For example players can seed vegetation across the surface to give Mars a breathable atmosphere and use landscaping tools to shape the land to fit their needs Green Planet continues Haemimont Games and Paradox Interactives support for Surviving Mars and their commitment to enhancing the core gameplay experience for all players including a free update launching alongside the paid expansion,Missing,Missing
1557360000,[31],116540,Life is Strange 2: Episode 3 - Wastelands,"[3, 6, 14, 48, 49]",In Episode 3 Wastelands the long journey from Seattle to Mexico continues a few months after their dramatic escape from Beaver Creek as Sean and Daniel Diaz arrive in the Redwood Forests of California  The brothers experience life on the fringes of society as they reunite with Cassidy and Finn befriend a closeknit community of drifters and runaways and begin working on an illegal farm in an attempt to scrape together enough money to continue their journey  New friendships relationships and mentors influence Sean and Daniel encouraging them to learn more about themselves and each other Their resolve is tested once again as friction arises between them Uncertain about their once united purpose will their strong bond survive,Missing,Missing
1558396800,[5],116387,Killing Floor: Double Feature,[48],Fight the Zed across two realities in this brutal Double Feature containing Tripwires beloved KILLING FLOOR 2 and KILLING FLOOR Incursion on PlayStation4 and PlayStationVR at one great price In addition to free seasonal content Mrs Foster joins the slaughter as bonus fan favorite DLC included free in the retail version as part KILLING FLOOR Double Feature,Missing,Missing
1559260800,"[8, 25, 31, 32]",116151,Hollow Knight: Collector's Edition,"[6, 48, 49, 130, 169]",A 2D metroidvania with an emphasis on close combat and exploration in which the player enters the onceprosperous nowbleak insect kingdom of Hallownest travels through its various districts meets friendly inhabitants fights hostile ones and uncovers the kingdoms history while improving their combat abilities and movement arsenal by fighting bosses and accessing outoftheway areas  The Collectors Edition includes a metal brooch with display stand a wall hook a dualpronged fastener a 14page Quirrel comic book a giftboxstyle case with goldfoil filigree and a clear printed sleeve a Switchexclusive bonus cleaning cloth a goldfoil art print set by Ari Gibson and a physical copy of the game including all DLC Hidden Dreams The Grimm Troupe Lifeblood and Godmaster,Brave the Depths of a Forgotten Kingdom Beneath the fading town of Dirtmouth sleeps a vast ancient kingdom Many are drawn beneath the surface searching for riches or glory or answers to old secrets  As the enigmatic Knight youll traverse the depths unravel its mysteries and conquer its evils,Missing
1558569600,"[8, 31, 33]",115993,Wonder Boy Returns Remix,"[6, 48, 130]",Wonder Boy was an arcade hit back in 1986 with its intuitive controls and polished game balance  This forever famous sidescrolling action game has been remixed and reborn for Nintendo Switch  Join the adventure of a boy whos doing his best to save his girlfriend Tina  updated with highdef animeinspired visuals,Missing,Missing
1559088000,"[5, 32, 33]",115352,Delta Squad,"[3, 6, 14, 48, 49, 130]",Stop the Dictatorship forces of General Rumanovsky in their attempt to control a mortal virus make your way through different missions in this top down arcade,Missing,Missing
1559260800,"[9, 12, 15, 31, 34]",115184,Kotodama: The 7 Mysteries of Fujisawa,"[6, 48, 130]",Welcome to Fujisawa Academy  an educational institution where nothing is as it seems and every pupil hides a dark secret Having made a pact with a demon fox  and bestowing you with the power to see the truth behind the lies you must uncover the sinister truths behind the seemingly normal façade,Welcome to Fujisawa Academy  an educational institution where nothing is as it seems and every pupil hides a dark secret Having made a pact with a demon fox  and bestowing you with the power to see the truth behind the lies you must infiltrate the secretive Fujisawa Academy and uncover the sinister truths behind the seemingly normal façade,Missing
1559260800,"[12, 25]",115065,Warhammer: Chaosbane - Magnus Edition,"[6, 48, 49]",In a world ravaged by war and dominated by magic you must rise up to face the Chaos hordes Playing solo or with up to four in local or online coop choose a hero from four character classes and prepare for epic battles wielding some of the most powerful artefacts of the Old World    Warhammer Chaosbane  Magnus Edition includes the base game the Deluxe pack the Season Pass and early access to the game,In Warhammer Chaosbane the player will be plunged into the middle of Old World history as they embody a human a high elf a wood elf or a dwarf and discover several iconic locations such as the cursed city of Praag or Nuln the old capital of the Empire,Missing
1559260800,"[12, 25]",115064,Warhammer: Chaosbane - Deluxe Edition,"[6, 48, 49]",In a world ravaged by war and dominated by magic you must rise up to face the Chaos hordes Playing solo or with up to four in local or online coop choose a hero from four character classes and prepare for epic battles wielding some of the most powerful artefacts of the Old World    Warhammer Chaosbane  Deluxe Edition includes the base game the Deluxe Pack and early access to the game,In Warhammer Chaosbane the player will be plunged into the middle of Old World history as they embody a human a high elf a wood elf or a dwarf and discover several iconic locations such as the cursed city of Praag or Nuln the old capital of the Empire,Missing
1559260800,"[12, 25, 31]",114144,Dark Souls Trilogy: Collector's Edition,"[48, 49]",The Dark Souls Trilogy includes Dark Souls Remastered Dark Souls II Scholar of The First Sin Dark Souls III The Fire Fades plus all DLC content for all three games a highquality numbered and handpainted 34cm Elite Knight at the Bonfire statue the Dark Souls Trilogy soundtrack  featuring 6 soundtrack CDs with music from all three games and a 460page Dark Souls Trilogy compendium  containing illustrated maps with boss and NPC locations item encyclopedia bestiary of enemies and bosses and a manuscript of all dialogue from each game reiterate,Missing,Missing
1559174400,[31],111556,Graveyard Keeper: Breaking Dead,"[48, 49, 130]",Introducing Breaking Dead  the first expansion of Graveyard Keeper Create an army of undead workers that automate chores around your Graveyard such as  Automate gathering of stone wood and have zombies craft your items Taking care of your graveyards garden has never been easier when zombies do it for you Create logistics chains where zombies automate sale of merchandise for extra profit Modify and upgrade your zombies they might need better organs to make them more efficient,Missing,Missing
1558396800,"[13, 14]",109273,Everybody's Golf VR,[165],Step on to the course like never before in the most immersive Everybodys Golf experience yet,Missing,Missing
1559001600,"[8, 12]",107260,Lapis x Labyrinth: Limited Edition,"[48, 130]",The limited edition was created for the international release The Nintendo Switch version comes with some extra items  The Limited Edition for PlayStation 4 and Nintendo Switch includes  Lapis x Labyrinth  Lapis x Labyrinth My Labyrinth Photo Album  Lapis x Labyrinth Dango Beats  Collectors Box  The Nintendo Switch version Limited Edition XL also contains  Lapis x Labyrinth Poster  Mayors Special Feast Mini Art Print  Dango Delights Mini Art Print,Missing,Missing
1557187200,"[4, 32, 33]",77536,Brief Battles,"[6, 48, 49, 130]",May your butt reign supreme in Brief Battles Use your underpants to fight your friends in this fastpaced underwearfueled party game,Missing,Missing
1559001600,"[5, 31]",75242,Blood & Truth,[165],Put on your PlayStation VR headset and ready yourself for hardhitting action in the gritty and glamorous London underworld You are elite Special Forces soldier Ryan Marks on a desperate mission to save his family from a ruthless criminal overlord  Grab your PS Move motion controllers and blast anyone in your way as you go face to face with enemies uncover secrets and experience the thrill of the chase in a highoctane action narrative inspired by PlayStation VR Worlds The London Heist experience,Missing,Missing
1557792000,"[8, 12, 31, 32, 33]",68988,Devious Dungeon 2,"[6, 46, 48, 49, 130]",It is said that great adventures await behind the walls of this dark castle Devious Dungeon 2 is a medieval focused action platformer with RPG styled upgrades,Missing,Missing
1558569600,"[12, 31, 32]",55322,Pathologic 2,"[6, 48, 49]",Pathologic 2 is a narrativedriven dramatic thriller about fighting a deadly outbreak in a secluded rural town You are a healer and to save anyone youll have to survive in this bleak and strange world where even food and medicine are scarce,Missing,93.99177573386508
