first_release_date,genres,id,name,platforms,summary,storyline,rating
1543363200,"[13, 14, 32]",112499,Goalkeeper VR Challenge,"[6, 165]",Have you ever got frustrated with a goalkeeper Think you could do better Congratulations this immersive virtual reality experience offers you a challenge Protect the gate like a pro You can choose a standard mode for a realistic feel as well as many alternativeones to goof around in,Missing,Missing
1543363200,"[8, 31, 32]",112387,Chop is Dish,"[6, 48, 49, 130]",Chop is Dish2ddimensional platformer where you conroll an angry masterchef who was lost piece of meatit was stolen Looking in the root of their troubles hero plunges into the mysterious world of strange creatures which is fraught with many traps and dangers,Missing,Missing
1542240000,"[4, 5, 31, 33]",112117,Johnny Turbo's Arcade: Heavy Barrel,"[6, 48, 130]",In this arcade classic for one to two players collect pieces to assemble the ultimate weapon as you fight through waves of terrorists that have occupied the control center of a nuclear missile site,Missing,Missing
1542931200,[15],111971,Royal Roads,"[6, 14, 48, 49, 130]",The princess embarks on an exciting adventure to hunt down the evil witch and turn back into her true self Get ready for vibrant locations exciting levels fun characters simple gameplay for any age great music and a storyline youll never forget Adventure awaits on the Royal Roads,Missing,Missing
1541116800,"[12, 15, 31]",111917,Elemental Knights R,"[34, 39, 48, 130]",Lets start Elemental Knights R Make your own characters and start on a magnificent adventure with a beautiful fantasy world You can dress up and adventure as you wish with your favorite Cosplay and skills Even one person can play freely There are also fullfledged features to customize the character freely with many classes and growing functions It is an online roleplaying game that you can adventure with players all over the world via the Internet MMORPG  The PS4 version is an independent world that will not be linked to other platforms,Missing,Missing
1541548800,"[25, 31, 33]",111909,Roarr!: Jurassic Edition,"[6, 48, 49, 130]",An arcade game with a coop mode in which an angry female TRex must defeat space invaders Stylish cartoon polygonal graphics and murderous opponents from the universe  this is just a real Jurassic adventure,When the aliens arrived they didnt come in peace  The invasion was immediate and so overwhelming that humans didnt stand a chance One thing it wasnt though was quiet  A terrible rumble from upstairs woke Sue the Rex up from her slumber For millennia she was hibernating in her cozy cave but the incessant crescendo of the alien invasion was too much to sleep through It was time for Rex to go upstairs and give her new neighbors a piece of her mind,Missing
1541635200,"[10, 33]",111836,ACA Neo Geo: Thrash Rally,"[48, 49, 130]",Thrash Rally is an original racing game released by SNK in 1991 Two game modes World Rally Championship Mode and Rally Mode have been featured Travel through cities and the countryside as you make your way through the various course,Missing,Missing
1542326400,"[5, 13, 33]",111712,Mars: Chaos Menace,"[6, 48, 49, 130]",Humanity is terraforming Mars but chaos and destruction threaten the planet Battle your way through innumerable hordes of enemies that wish to destroy you and face the most terrible and powerful monsters in the galaxy Our destiny is in your hands,Missing,Missing
1543449600,"[13, 14]",111579,Pro Fishing Simulator,"[6, 48, 49]",An authentic sport fishing simulation for both beginners and avid anglers Explore the most beautiful fishing spots in the world and reel in the best catches by combining technique and the best official equipment,Missing,Missing
1543363200,"[5, 32, 33]",111576,Zeroptian Invasion,"[6, 46, 48, 49, 130]",Zeroptian Invasion is a classic shoot em up with mechanics from other arcades of the 80s Travel back in time with this unique pixilated experience with an incredible soundtrack in chiptune,Missing,Missing
1542067200,[32],111543,Aces of the Luftwaffe: Squadron - The Nebelgeschwader,"[6, 48, 49, 130]",AOTLSN is an actionpacked DLC campaign with a fully voiced narrative Experience 25 new levels defeat waves of enemies take on six brand new epic bosses and upgrade each of the unique characters in your squadron via personal skill trees But dont go to war alone Experience the thrilling storyline with up to three friends in an epic 4player local coop battle,As The Aces of the Luftwaffe begin their assault on mainland USA you are charged with leading a ragtag squadron of German elite pilots on a secret mission of their own Embark on an epic aerial adventure of intrigue and deceit from a secret base in the Bermuda Triangle and turn the page on a new chapter in history A chapter that could very well be the final one for what is known as the United States of America,Missing
1542067200,"[8, 12, 32]",111470,Emerald Shores,"[3, 6, 46, 48]",Emerald Shores is a challenging SNESinspired platformer with a bunch of twists Level up take on rewarding sidequests play a variety of minigames unlock secret levels raise a pet monster and more Can you liberate the floating island world of Emerald Shores from its captors,Missing,Missing
1542672000,"[8, 9, 15, 31]",111451,Squishies,"[6, 165]",Help stranded Squishies find their way back home in a fantastic miniature 3D universe Squishies is a single player puzzle platform experience built exclusively for PlayStation VR Solve puzzles and save Squishies or be creative and build your own levelsthen share them with the community,Missing,Missing
1542067200,Missing,111449,Spyro + Crash Remastered Game Bundle,"[48, 49]",Your favourite Dragon and Bandicoot are back With the Spyro  Crash Remastered Game Bundle you get two fully remastered trilogies for a total of six iconic games  Includes   Spyro the Dragon  Spyro 2 Riptos Rage  Spyro Year of the Dragon  Crash Bandicoot  Crash Bandicoot 2 Cortex Strikes Back  Crash Bandicoot Warped,Missing,Missing
1541548800,"[13, 31, 32]",111432,Drowning,"[3, 6, 14, 46, 48, 130, 167]",Walk in the shoes of this teenage boy who learns to live with his inner demon,Missing,Missing
1541721600,"[9, 13, 15, 32, 35]",111384,Bunny Mahjo,"[6, 48, 130]",Classic Mahjong Solitaire is not singleplayer game anymore You can play with friends in 3denvironment Play together win together unlock more figures together,Missing,Missing
1541635200,"[5, 33]",111344,The Walking Vegetables: Radical! Edition,"[48, 49, 130]",The games content is overflowing A single playthrough merely scratches the surface on what The Walking Vegetables has to offer Randomized buildings sections enemies bosses weapons and items will make every game a completely unique experience Combine this with the abundance of achievable skills and unlockable goodies and you are guaranteed to stay engaged and entertained for a long time,A twinstick shooter The Walking Vegetables Radical Edition sees players battling mutated zombie fruit and veg Armed initially with a simple pistol players can upgrade their arsenal with a myriad of weapons and gadgets they uncover as they take on the lethal legumes  Journeying between cities players experience double the firepower by buddyingup with a friend To save mankind players will need to defeat end of level vegetable kingpins before progressing to the vegetableridden alien headquarters and the formidable mothership,Missing
1541635200,"[5, 12, 31]",111285,Warframe: Fortuna,"[6, 48, 49, 130]",Down in the underground city of Fortuna youll meet the Solaris a society of bodyaugmented individuals who live in debtinternment under Corpus rule The Solaris live in fear of being repossessed  cybernetic limb and organ removal by Nef Anyos repo squads Despite living in terror and debt the Solaris are a hopeful community who pride themselves in their efforts to terraform Venus,Welcome to Fortuna Explore the frigid landscape of Venus populated with new Corpus threats subterranean mysteries and an ecosystem on the brink of destruction,Missing
1541116800,"[15, 31]",111226,Lost Artifacts: Time Machine,"[6, 14, 48, 49, 130]",Lost Artifacts Time Machine is an exciting strategy game about time traveling Fix time paradoxes,Missing,Missing
1542326400,"[5, 12, 13, 14, 31]",110839,Fortnite: Deep Freeze Bundle,"[6, 48, 49, 130]",The Fortnite Deep Freeze Bundle will include the Fortnite Battle Royale game and premium content including the Frostbite Outfit Cold Front Glider ChillAxe Pickaxe Freezing Point Back Bling and 1000 VBucks which can be used to purchase ingame items such as outfits and the Premium Battle Pass,Missing,Missing
1541980800,"[10, 13, 14]",110686,Bibi & Tina: Adventures with Horses,"[6, 48, 130]",Explore the beautiful surroundings of Martinshof riding over hedge and ditch with Bibi or Tina Keep on training with your horse to improve your riding skills Master countless challenges and show your skills and what youre made of in the final decisive race through the corn labyrinth,Missing,Missing
1542499200,"[10, 13]",110685,Bibi Blocksberg: Big Broom Race 3,"[6, 48, 130, 167]",Take to the air A wild witch rally begins Bibi and her friends leap onto their broomsticks and explore exciting worlds With mysterious witches potions and turbulent aerial maneuvers they zoom through the age of the dinosaurs the Orient and Transylvania Whizzwhizz and off they go,Missing,Missing
1541548800,[13],110288,Sharknado VR: Eye of the Storm,"[6, 162, 163, 165]",Fight your way through swarms of hungry flying sharks in Sharknado VR Slice them with the Chainsaw shred them with machine guns or explode them with the RPG,Missing,Missing
1541635200,"[15, 35]",110104,Vegas Infinite by PokerStars,"[6, 162, 163, 165, 384, 386, 390]",PokerStars presents Vegas Infinite a world of entertainment with no limits Leap into virtual reality or coming soon sit back and play on PC with no headset required  Take on the house at actionpacked blackjack and roulette Light up the dice with your friends at craps Choose from a dazzling selection of slots and challenge real opponents in cash Spin  Go Sit  Go and multitable tournament poker  From luxury casino floors private suites and galactic space stations to soaring skylines and exclusive rooftop escapes lose yourself in stunning environments while you play  Be yourself with a giant collection of customizable accessories and apparel and add a touch of magic to your gameplay with an endless supply of props  Your seat is open,Missing,Missing
1543104000,Missing,110017,Sayonara UmiharaKawase ++,[46],Missing,Missing,Missing
1543449600,"[13, 14, 31]",109006,My Little Riding Champion,"[6, 48, 49, 130]",Your horse Your passion Get ready to fulfil your dreams at a gallop Choose your favourite horse take care of it train it and win medals for your club,Missing,Missing
1542844800,[34],107270,Hatsujou Sprinkle,"[46, 48]",Missing,Missing,Missing
1543449600,[5],106850,Ketsui Deathtiny: Kizuna Jigoku Tachi,[48],Overcome despair with ketsuidetermination  Originally released in 2003 at the cutting edge of hardcore shoot em ups Ketsui Kizuna Jigoku Tachi returns as the fourth entry in the M2 Shot Triggers series  Features seven modes the most in series history  Arcade Mode The ultimate recreation of the arcade game Super Easy Mode An enjoyable entryway into the world of Ketsui Arcade Challenge Practice stages in bitesized chunks A handy rewind function guides you from total beginner to grand master Bonds of Growth Practice your weakest areas gathered from your actual play data Deathtiny Mode A new remixed version of Ketsui with hyperdestructive gameplay  Whether youre a beginner or a seasoned veteran theres a mode for everyone  M2 Gadgets make their triumphant return Lay bare the inner workings of the game to help your skills reach the next level  From total beginners to grand masters this is a Ketsui for the entire human race,Missing,Missing
1542240000,[12],104818,Yuuna and the Haunted Hot Springs: Steam Dungeon,[48],Yuuna and the Haunted Hot Springs Steam Dungeon is an orthodox roguelike RPG where players become Yuuna Sagiri Nonko Yaya and Oboro and make their way through mysterious dungeons while defeating monsters in order to save Kogarashi Players will progress through the story via fully voiced adventure parts while enjoying all sorts of events that can be played any number of times The dungeons in dungeon parts are automatically generated The game also has a completely original story The equipment and items gathered in the dungeon can be used to strengthen the characters Players can experience dungeons with a lot to do and all sorts of events,Missing,Missing
1543190400,"[9, 31, 32]",104436,Incredible Mandy,"[6, 39, 48, 130]",Experience a fantastic adventure across vast landscapes From mountain top to canyon deep from sea shores to hidden corridors search for clues and solve the creative puzzles never seen elsewhere use the sword in your hand and wisdom in your mind to challenge the overwhelmingly huge foes,Missing,Missing
1541462400,"[12, 31, 32]",103515,Ark: Extinction,"[3, 6, 14, 48, 49]",Finish your journey through the worlds of ARK in Extinction where the story began and ends on Earth itself An Elementinfested ravaged planet filled with fantastical creatures both organic  technological Earth holds both the secrets of the past and the keys to its salvation As a veteran Survivor who has conquered all previous obstacles your ultimate challenge awaits can you defeat the gigantic roaming Titans which dominate the planet and complete the ARK cycle to save Earths future,Missing,Missing
1542067200,"[8, 33]",103404,Chimparty,[48],Announced as part of Sonys latest PlayLink E3 2018 Trailer,Missing,Missing
1542067200,[35],103397,Just deal with it!,[48],Announced as part of Sonys latest PlayLink E3 2018 Trailer,Missing,Missing
1542153600,[26],103388,Wordhunters,[48],Use the free Wordhunters smart device App as a game controller to compete in 15 partyplay word games suitable for the whole family Test both your skills and your brain power in fun challenges like Word Sushi Alphabetty Forgetty and Disemvowelled with endless replayability,The globetrotting party word game for PlayLink  Dive into a whole new world of competitive word games with your guide Amy the Aviator Fly around the globe to different cities win rounds and claim letters from each location while blocking your opponents,Missing
1541462400,[31],103332,Déraciné,[165],Déraciné is a brand new story adventure created by the renowned Bloodborne developer FromSoftware available exclusively on PSVR  As a spirit summoned by a young girl in a secluded boarding school the player must prove its existence and build a unique bond with the students through clever interactions As the mystery of the story unfolds the spirit must use its ability to manipulate the forces of life and time to change the fate of the pupils,Missing,Missing
1542153600,[12],103308,Fallout 76: Tricentennial Edition,"[48, 49]",Celebrate 300 years of freedom with the allnew Fallout 76 Tricentennial Edition commemorating the opening of Vault 76 Our good friends at VaultTec have pulled double shifts working around the clock to assemble this oneofa kind compilationfor you Be the talk of the town when you emerge from Vault 76 fully prepared and patriotically styled in the new American frontier    In addition to the highly anticipated game the Fallout 76 Tricentennial Edition includes bonus ingame items   Tricentennial Power Armor Customization for the T51 T45 T60 and X01 Power Armors    Tricentennial Weapon Customization for the 10MM Pistol Hatchet and Laser Rifle   Spectacularly Handsome Vault Boy Mascot Head   Patriotic Uncle Sam Outfit   Celebratory Vault Boy Saluting Emote   FirstClass Tricentennial Workshop Posters   Tricentennial Commemorative Photo Frame   Access to the Fallout 76 BETA BreakIt Early Test Application,Missing,Missing
1542153600,"[31, 32]",102518,Descending,"[6, 48, 167]",Descending is a hardcore open world survival in which you are alone in a struggle for survival against these creatures which appeared when the fog came,Missing,Missing
1542326400,[5],89571,Battlefield V: Deluxe Edition,"[6, 48, 49]",The Deluxe Edition of Battlefield V gives you early access to the base game five sets of paratrooper outfits special assignments and 20 weekly items with airlift,With the Battlefield V Deluxe Edition youll be able to customize your Company of soldiers with Special Soldier Sets containing stunning weapon skins camo patterns head gear and face paint for the British Special Air Service and German Airborne troops  No special forces unit is more storied than the British SAS who dropped behind enemy lines during some of the most perilous missions of the war Similarly the German Fallschirmjäger troops defended their air bases from invaders The Battlefield V Deluxe Edition lets you bring in these special forces from the beginning of your journey,Missing
1542672000,"[14, 32]",88022,Boxing Apocalypse,"[6, 165]",This VR boxer has fully immersive futuristic fighting environments like a cage fight that takes place aboard the mothership Youll beat up ugly toothy aliens with an easy to understand combat system welcoming to VR newbies and hard enough for a boxing pro simply hold the controllers and punch,Missing,Missing
1543276800,"[12, 25, 31]",45985,Darksiders III: Collector's Edition,"[6, 48, 49]",Darksiders III Collectors Edition includes   Premium Box  Fury Figurine about 29cm  11 high  Original Steelbook  Artbook  Soundtrack  Darksiders III Game  Exclusive Armor DLC completely original skin replacing Furys base armor set purely aesthetic no gameplay impact  Features   Play as FURY  a mage who must rely on her whip and magic to restore the balance between good and evil on Earth  Harness FURYs magic to unleash her various forms  each granting her access to new weapons moves and traversal abilities  Explore an openended living freeform game world in which FURY moves back and forth between environments to uncover secrets while advancing the story  Defeat the Seven Deadly Sins and their servants who range from mystical creatures to degenerated beings  Darksiders signature art style  expansive postapocalyptic environments that take the player from the heights of heaven to the depths of hell dilapidated by war and decay and overrun by nature,Return to an apocalyptic planet Earth in Darksiders III a hacknslash action adventure where players take on the role of FURY in her quest to hunt down and dispose of the Seven Deadly Sins The Charred Council calls upon Fury to battle from the heights of heaven down through the depths of hell in a quest to restore humanity and prove that she is the most powerful of the Horsemen As a mage FURY relies on her whip and magic to restore the balance between good and evil The expansive Darksiders III game world is presented as an openended living freeform planet Earth that is dilapidated by war and decay and overrun by nature FURY will move back and forth between environments to uncover secrets while advancing the Darksiders III story,Missing
1543276800,"[12, 25, 31]",38657,Darksiders III: Apocalypse Edition,"[6, 48, 49]",Darksiders III Apocalypse Edition includes a copy of Darksiders III in a premium box along with a fabric wall scroll with hanger 4 figurines a heavy weight amulet an original Steelbook an art book the original soundtrack and an exclusive armor DLC,Return to an apocalyptic planet Earth in Darksiders III a hacknslash action adventure where players take on the role of FURY in her quest to hunt down and dispose of the Seven Deadly Sins The Charred Council calls upon Fury to battle from the heights of heaven down through the depths of hell in a quest to restore humanity and prove that she is the most powerful of the Horsemen As a mage FURY relies on her whip and magic to restore the balance between good and evil The expansive Darksiders III game world is presented as an openended living freeform planet Earth that is dilapidated by war and decay and overrun by nature FURY will move back and forth between environments to uncover secrets while advancing the Darksiders III story,Missing
1543449600,"[12, 15, 25, 31, 32]",28009,Hell Warders,"[6, 48, 49, 130]",For as long as mankind can remember the Warders gave their lives fighting back the forces of darkness An eternal war waged by mortals against a seemingly ceaseless legion As one fell another Warder shall fill his ranks With every generation of Warders new heroes and tales are born   Will your generation finally put an end to this everlasting struggle and seal the gates of Hell,For as long as mankind can remember the Warders gave their lives fighting back the forces of darkness An eternal war waged by mortals against a seemingly ceaseless legion As one fell another Warder shall fill his ranks With every generation of Warders new heroes and tales are born   Will your generation finally put an end to this everlasting struggle and seal the gates of Hell,Missing
1541462400,"[4, 32, 33]",27070,Omen of Sorrow,"[6, 48, 49, 130, 167, 169]",Omen of Sorrow is a classic 2D fourbutton fighting game with Unreal Engine 4 powered graphics a cast of 12 characters inspired by classical horror fantasy and mythology and a battle system designed from the ground up to leverage player skill rather than stats or random chance featuring deep combat mechanics that favor movement and spacing over tight execution to provide an engaging experience for pros and newcomers alike,In a hidden underworld ruled by creatures of the night a new terror has awakened Omen of Sorrow brings monsters of horror literature and mythology together for a fighting game experience unlike any other Inspired by numerous arcade classics but offering its own unique innovations and mature aesthetics Omen of Sorrow positively bleeds style,Missing
1543449600,"[12, 25, 31, 32]",22002,Crimson Keep,"[6, 48, 49, 130]",A first person hack and slash dungeon crawler with random level generation,Missing,Missing
1541721600,"[7, 9]",103221,Tetris Effect,"[6, 48, 163, 165, 384, 385, 390]",Named after a realworld phenomenon where players brains are so engrossed that images of the iconic falling Tetrimino blocks linger in their vision thoughts and even dreams Tetris Effect amplifies this magical feeling of total immersion by surrounding you with fantastic fully threedimensional worlds that react and evolve based on how you play Music backgrounds sounds special effects  everything down to the Tetris pieces themselves pulse dance shimmer and explode in perfect sync with how youre playing,Tetris Effect is Tetris like youve never seen it or heard it or felt it beforean incredibly addictive unique and breathtakingly gorgeous reinvention of one of the most popular puzzle games of all time from the people who brought you the awardwinning Rez Infinite and legendary puzzle game Lumines Fully playable on either a standard displaywith unlocked resolution and uncapped framerate with Vsync disabledor optionally in mindblowing 3D on Oculus Rift and HTC VIVE  As the ultimate version of Tetris Effect the PC version is capable of running at resolutions of 4K or more with an uncapped framerate if Vsync is disabled and includes ultrawide monitor support as well as other expanded game and graphical options for both 2D and VR play including adjustable particle volume and size texture filtering and more not found in the PlayStation 4 console release  Music backgrounds sounds special effectseverything down to the Tetriminos themselves pulse dance shimmer and explode in perfect sync with how youre playing making any of the games 30 stages and 10 modes something youll want to experience over and over again  A challenge for the mind and a feast for all the senses Tetris Effect is the perfect excuse to play Tetris again and againand again and again and again and again and again and again and again and again and  VR Optional Playable on your PC desktop or in full VR with your Oculus Rift or HTC VIVE headset and accompanying controllers standard gamepads VIVE Controllers and Oculus Remote and Touch controllers are all supported  Allnew Zone Mechanic Players can stop time and Tetriminos falling by entering the Zone and either get out of a sticky situation that could otherwise lead to Game Over or rack up extra Line Clears for bonus scoring rewards  Over 30 Different Stages Each with its own music sound effects graphical style and background that all evolve and change as you play through them  Enhanced PC Visuals  More Unlocked resolution and uncapped framerate if Vsync is disabled increased texture and particle effect options support for super highresolution and ultrawide monitors and more  Created by Monstars Inc and Resonair,88.1700986412346
1542067200,"[9, 31, 32]",27499,Distraint 2,"[6, 34, 39, 48, 49, 130]",You are Price a man who sold his humanity to get a partnership from a leading company McDade Bruton  Moore Distraint 2 follows on from the events of the first game Its a sinister tale about restoring hope and finding your purpose,Missing,87.3099577951428
1543449600,"[8, 12]",109233,Lapis x Labyrinth,"[48, 130]",The game takes place in a rural town located on the frontier of a small kingdom In the depths of the dense woodlands that extend over this land it is said that there exists a Golden Forest where the trees produce gold Many adventurers have sought out this huge fortune but none have yet found it and the area has since become completely deserted  Unsurprisingly youll be exploring this area with a group of adventurers with eight classes of playable character available to choose from Each class has different traits usable weapons and fighting styles so players are able to choose a character which truly matches their play style Those classes are Hunter Necromancer Shielder Maid Gunner Wizard Destroyer and Bishop,Missing,87.0
