first_release_date,genres,id,name,platforms,summary,storyline,rating
1557705600,"[5, 10, 12, 31]",101211,Rage 2,"[6, 48, 49, 170]",Dive headfirst into a dystopian world devoid of society law and order Rage 2 brings together a true open world FPS experience where you can go anywhere shoot anything and explode everything,An asteroid has annihilated 80 of the earths population and humanitys numbers are dwindling Ruthless and bloodthirsty gangs roam the open roads and the tyrannical Authority seek to rule with an iron fist As Walker the last Ranger of the wasteland and a threat to their power you have been robbed of your home and left for dead Now youll have to rage for justice and freedom With ludicrous vehicle combat superpowered firstperson mayhem and an open world full of emergent madness you will tear across an unforgiving wasteland battling sadistic gangs to find the tools and tech needed to crush the oppressive rule of The Authority once and for all,69.68683894372627
1557187200,"[5, 10, 31, 32, 33]",14694,Shakedown: Hawaii,"[5, 6, 9, 37, 41, 46, 48, 130, 167]",Build a legitimate corporation via open world missions shakedowns sabotage and property acquisition,Missing,68.0
1559088000,"[9, 31, 32]",9835,Draugen,"[6, 48, 49]",Draugen is a firstperson psychological horror adventure set amongst the deep fjords and towering mountains of Norways aweinspiring west coast  The game is a dark and disturbing journey into the pitch black heart of Norwegian national romanticism as seen through the eyes of an American nature photographer botanist and entomologist,Draugen is set in the early 1920s and delves into the deepest darkest secrets of a remote fishing community where every single soul has mysteriously vanished As the player explores the tiny settlement gathering clues and memories and unearthing the truth behind a terrible tragedy they will learn more about the history of the village and its inhabitants And they will come to see that behind even the most innocent of facades lurks the potential for malice  But there is more to this place than meets the eye  From time to time a woman in black can be spotted in the distance Who is she and what is her connection to this place Who is the little girl singing broken lullabies as the sky begins to darken And when night falls and those last few precious drops of kerosene in the lamp feed a fragile flickering flame what hides out there in the darkness and in the cold black sea,67.53457050464375
1558396800,[12],113996,The Elder Scrolls Online: Elsweyr,"[6, 14, 48, 49]",Dragons return to Tamriel in The Elder Scrolls Online Elsweyr part of the Season of the Dragon yearlong adventure Explore sunblessed savannahs and canyons defend the Khajiiti homeland and command the merciless undead with the Necromancer class in this allnew Chapter of The Elder Scrolls Online saga,Missing,67.04295284210181
1557792000,"[5, 15, 24, 31]",116191,Sniper Elite V2 Remastered,"[6, 48, 49, 130]",In the dark days of the end of World War 2 amidst the ruins of Berlin one bullet can change history Elite sniper Karl Fairburne returns to the front line in the remaster of this awardwinning stealthaction experience Packed with new features contemporary visuals and definitive content,Missing,66.72791852189297
1557878400,"[11, 12, 15, 31, 32]",88250,Undead Horde,"[3, 6, 14, 39, 48, 49, 130, 167]",Be a necromancer raise undead minions and vanquish the living Undead Horde is an action RPG where you get to be the zombies Maraud through the lands of the living and plunder their treasures Lead your undead army towards the ultimate victory,Missing,64.17939686760928
1558396800,[31],110419,Vader Immortal: Episode I,"[165, 384, 385, 386]",Step inside a galaxy far far away with Vader Immortal Episode I You are a smuggler operating near Mustafar the fiery world Darth Vader calls home When you are unexpectedly pulled out of hyperspace you find yourself uncovering an ancient mystery at the behest of the Sith Lord himself  With the help of your droid companion ZOE3 youll navigate the dangers of the fortress hone your lightsaber skills and meet new characters along the way as you discover what Vader is up to,Missing,62.51824336618013
1557446400,"[5, 12, 31, 32]",75158,Blazing Beaks,"[6, 48, 130]",Birds with guns are blazing the way out through the piles of mutants monsters and creepy creatures to stop the invasion Gathering items and artefacts is essential to survive in this fastpaced colorful roguelite Lots of mysteries to unravel secrets to find and levels to explore,Missing,61.89016089116318
1556755200,"[31, 32]",55027,Close to the Sun,"[6, 48, 49, 130]",Close to the Sun is a storydriven horror game that takes place at the turn of the 20th century on a mysterious ship complex created by Nikola Tesla for the sake of knowledge In this alternative version of history his scientific breakthroughs have already had a major impact on the world Youre a young journalist looking for your sister and as you approach this enormous and glorious complex for the first time you quickly realize that something there has gone horribly wrong,Its 1897 Deep in international waters the Helios stands still Dark clouds loom overhead as unforgiving waves crash against the hull Colossal effigies of gold decorated with magnificent finery stretch as far as the eye can see  Born of Nikola Teslas vision the Helios serves as a haven for the greatest scientific minds An unbound utopia for research independent from state and isolated from the gaze of society Free to push the boundaries of matter and time  Journalist Rose Archer steps aboard the Helios in search of her sister Ada She quickly discovers not all is as it seems Grand halls stand empty The stench of rotting flesh lingers in the air Silence A single word is painted across the entrance QUARANTINE,61.80685983615636
1559001600,"[13, 14]",115869,Cricket 19,"[6, 48, 49, 130]",Lead your team to international glory with Cricket 19 The truly global cricket simulation from Big Ant Studios the leading name in authentic realistic cricket action Cricket 19 allows you to take control of your team from club through national level and lead them to T20 ODI or Test Match glory Create your own club stadia sponsor logos and uniforms via Big Ants acclaimed Cricket Academy to recreate your local matches and dramas  Dive into the deepest storydriven career mode in the history of cricket video games Build a rookie players career from their junior years at club cricket Perform well and before you know it youll be leading your nation on to the field,Missing,60.71364088296895
1557964800,"[9, 15, 32, 35]",117051,Happy Words,"[6, 14, 48, 130]",Happy words is a word based online multiplayer board game for 1 to 4 players in which you have to create words and connect them to existing words in order to score more points than your opponents,Missing,60.0
1557100800,"[9, 13, 31, 32]",115004,Legal Dungeon,"[6, 14, 39, 48, 49, 130]",Legal Dungeon is a game about organizing police investigation documents This game has 14 endings and 6 achievements as well as a cute Screen Mate shop Judge the lives of others and collect all items,Missing,60.0
1557446400,"[8, 10, 13, 32, 33]",114475,Snakeybus,"[6, 14, 48, 49, 130]",The length of your bus grows as you pick up more people Snake through the city streets and avoid crashing into yourself,Missing,60.0
1559001600,"[12, 15, 16, 31, 32]",111253,Vambrace: Cold Soul,"[3, 6, 14, 48, 49, 130]",Vambrace Cold Soul is a roguelike fantasyadventure set amidst a frozen landscape Plan your expeditions underground then journey to the cursed city surface with your team of heroes Wield unique powers avoid dangerous traps brave strange encounters and survive deadly combat,The King of Shades has cursed the great city of Icenaire Now cast under a permanent blight of frost fall its former residents have returned from the dead as mad Wraiths Survivors take refuge deep underground where they lead a desperate campaign against this unearthly power Woefully outmatched they are forced into hiding as the King of Shades amasses an army of the undead above them One fateful day a mysterious stranger appears in the city with an enchanted vambrace She may now be their only hope  You are Evelia Lyric bearer of the Aetherbrace and the only human capable of entering Icenaire The survivors now look to you as their best hope against the King of Shades Only one problem youre woefully outmatched and survival is not guaranteed,59.66003544706818
1558396800,"[5, 10, 31, 32]",115785,American Fugitive,"[6, 48, 49, 130]",Set in a sleepy American country town in the 1980s American Fugitive invites you to play as Will Riley Youre no angel but youre not a killer Yet the coldblooded murder of your dad is the crime theyve locked you up for Fuelled by grief and a burning desire for vengeance you must break out of jail to find the real culprit Its payback time,Missing,58.60001371231287
1558569600,"[5, 32]",17446,Battalion Legacy,"[6, 48, 49]",Battalion Legacy recaptures the core of classic multiplayer shooters and propels WW2 into the next generation Battalion Legacy utilizes the most advanced industry technology to create a visceral and heartthumping multiplayer experience that has been crafted by the designers who have grown up playing Medal of Honor and Call of Duty 2  Fight in real world locations such as the streets of Carentan the forests of Bastogne and many more in our spiritual successor to the great multiplayer shooters of the past Precise aim with your Kar98 covering fire with your M1 Garand and quick thinking with your Thompson are key to your success all packaged into a competitive multiplayer environment In short Battalion Legacy is an infantry based first person shooter with an emphasis on raw skill No grinding no exosuits just you and your skill as a player  Join a Battalion and compete season to season with BattleRank our global competition system Contribute to your Battalions season objective to earn cosmetic rewards for your character weapons and accessories within our realistic art style Flaunt your success through your player profile to become a renowned player within the community BattleRanks highly tuned stat tracking system enables Battalion Legacy to go beyond the standard mould of shooters gone by and enables players to compete globally for rewards glory and honour  Fuelled by the power of Unreal Engine 4 Battalion Legacy resurges World War 2 back into the modern gaming spotlight in our spiritual successor to the great multiplayer shooters of the past such as Call of Duty 2 and Enemy Territory On BattleRank its down to skilled soldiers like you to fight for your battalion,Missing,56.01730328134073
1558656000,"[9, 31, 32]",11668,Dollhouse,"[6, 48, 130]",Delve deep into your mind to unravel the truth However beware that your own conscience is hunting you down with a twist that allows you to see through its eyes at a deadly cost,Missing,51.73438447543966
1557360000,[5],129871,Fortnite: Season 9,"[6, 48, 49]",The volcano has erupted and forever changed some long lasting locations  from the ashes Neo Tilted rises Grab the squad to explore the bright lights of new attractions like Peelys Banana Stand and Nugget Hut Catch a ride and quickly traverse areas by flying in and out of the new Slipstream wind transportation system Use the new Air Vents to quickly navigate from building to building Take a glide over to the new Mega Mall to do some shopping before the storm hits The future is yours in Season 9,Missing,42.0
