first_release_date,genres,id,name,platforms,summary,storyline,rating
1559001600,"[9, 13, 31, 32]",11737,Outer Wilds,"[6, 48, 49, 130, 167, 169]",Outer Wilds is a criticallyacclaimed and awardwinning open world mystery about a solar system trapped in an endless time loop The newest member of the space program in a small village on the planet Timber Hearth the player navigates a space shuttle and travels across their solar system to get to the bottom of its mysteries by exploring the cosmos and gathering the knowledge hidden within each of the systems planets left behind by another civilization in the distant past,Welcome to the Space Program Youre the newest recruit of Outer Wilds Ventures a fledgling space program searching for answers in a strange constantly evolving solar system What lurks in the heart of the ominous Dark Bramble Who built the alien ruins on the Moon Can the endless time loop be stopped Answers await you in the most dangerous reaches of space  The planets of Outer Wilds are packed with hidden locations that change with the passage of time Visit an underground city of before its swallowed by sand or explore the surface of a planet as it crumbles beneath your feet Every secret is guarded by hazardous environments and natural catastrophes  Strap on your hiking boots check your oxygen levels and get ready to venture into space Use a variety of unique gadgets to probe your surroundings track down mysterious signals decipher ancient alien writing and roast the perfect marshmallow,89.48575229928501
1556755200,"[2, 9, 31, 32]",6741,Guard Duty,"[3, 6, 14, 46, 48, 49, 130]",Guard Duty is a comedy adventure about love loss and the end of the world Experience an unforgettable story spanning across two radically different time periods,Missing,88.85303120629034
1558483200,"[5, 8, 33]",108254,Gunlord X,"[48, 130]",Gunlord X is a platformer action game with an emphasis on exploring huge worlds and blasting off enemies This game features 9 stages of exciting 2D gameplay with over 45 unique enemy types Blast yourself through giant landscapes explore caverns and reveal all secrets,Missing,88.0
1558396800,"[7, 14, 32]",83731,Beat Saber,"[161, 162, 163, 165, 384, 385, 386, 390]",Beat Saber is an immersive rhythm experience you have never seen before Enjoy tons of handcrafted levels and swing your way through the pulsing music beats surrounded by a futuristic world Use your sabers to slash the beats as they come flying at you  every beat indicates which saber you need to use and the direction you need to match With Beat Saber you become a dancing superhero,History The development started in 2016 when we found out there is no great rhythm based game on VR The game was showcased on many places and almost 700 people tried it so far The response is overwhelming positive  Features Unique gameplay with a great feel  Beat Saber combines the satisfying feeling of cutting with emergent perception of rhythm Handcrafted levels  music  All the basic levels and music in the game will be handcrafted to emphasise the music rhythm The results are incomparable to similar games with generated content Game longevity  The game can be played in short few minutes sessions in quick play mode or for many hours in career mode Game accessibility  Anyone can understand basic game principles and play the game in just a few seconds,85.19899085334907
1557792000,"[12, 31]",27316,A Plague Tale: Innocence,"[6, 48, 49, 167, 169]",A Plague Tale Innocence on PlayStation 4 Xbox One and PC tells the grim story of two siblings fighting together for survival in the darkest hours of History This new video game from Asobo Studio sends you on an emotional journey through the 14th century France with gameplay combining adventure action and stealth supported by a compelling story Follow the young Amicia and her little brother Hugo who face the brutality of a ravaged world as they discover their purpose to expose a dark secret On the run from the Inquisitions soldiers surrounded by unstoppable swarms of rats incarnating the Black Death Amicia and Hugo will learn to know and trust each other as they struggle for their lives against all odds,Missing,81.63869711184833
1559260800,"[8, 9, 31, 32]",103331,Trover Saves the Universe,"[6, 48, 49, 130, 165, 384, 385, 386]",Wonderful Your dogs have been dognapped by a beaked lunatic who stuffed them into his eye holes and is using their life essence to destroy the universe Does that make any sense Youve partnered with Trover a little purple eye hole monster to save them Find power babies and plug them into his eye holes so that he can absorb their power track down Glorkon and save your dogs and the Universe,Missing,80.73674921436107
1559088000,"[10, 13]",171274,Assetto Corsa Competizione,"[6, 167, 169]",Assetto Corsa Competizione the official GT World Challenge videogame Thanks to the extraordinary quality of simulation you will experience the atmosphere of the GT3 championship Compete against official drivers teams cars and official circuits reproduced to the highest quality ever seen,Missing,79.91034059201044
1557964800,"[4, 10, 12, 13, 14, 31, 33]",116138,Castlevania Anniversary Collection,"[6, 48, 49, 130]",Konamis Castlevania Anniversary Collection traces the origins of the historic vampire franchise Included is a unique eBook with details provided by developers artists and others inspired by the Castlevania legacy which sheds a fresh light into the world of Castlevania  Released as part of the Konami 50th Anniversary celebration relive these timeless classics that helped define the platformer genre From the Belmont clan to their extended bloodlines and allies the Castlevania Anniversary Collection is the best first step for anyone to take into the world of Castlevania and the fight against Dracula,Missing,79.89897322039255
1556841600,"[8, 31, 32]",117023,Jump King,"[6, 48, 49, 130]",Jump King is a platforming challenge about struggling upwards in search of the legendary smoking hot babe This lonely adventure to reach the top will demand full mastery of the technique of jumping Just try to remember with each fall there is a lesson to be learned,The game is built on a single iconic mechanic charge the height of each jump by holding down the button and release to leap away But beware  once you are in the air there is no way to turn back Though you cannot die your progress is fragile  a single missed jump could lead to your fall and much progress lost Leap through an intriguing world meeting curious characters along the way The handdrawn backgrounds and distinct animations paint a rare picture reminiscent of the old classics The blend of retro sfx beautiful arrangements and high definition ambiences give a peculiar atmosphere  thanks to composerssound designers Nils Eklöf and Elias Thörnlund  This game is a trial that demands skill and willpower mastering the jump and reaching the top will test the limits of your ability Do you think you have what it takes to defeat this game,79.63307554992639
1557446400,"[8, 31, 32]",117747,A Hat in Time: Nyakuza Metro,"[6, 48, 49, 130]",Welcome to the deep underground Nyakuza Metro Its the perfect place for a little lying a little cheating a little stealing Join the Nyakuza and become mad rich  joining a gang never turned out bad right,Missing,79.62078146362524
1557964800,"[2, 9, 31, 32]",106108,Irony Curtain: From Matryoshka with Love,"[3, 6, 14, 48, 49, 130]",Irony Curtain From Matryoshka with Love is a satirical pointandclick inspired by the classic adventure games It smuggles you out of your comfort zone and throws into the middle of a Cold War spy intrigue  and theres an even bigger game being played Experience Matryoshka through Evan  a lowranking goofy journalist involuntarily pulled right into the middle of an espionage standoff between two powers Hop onto the wacky spy adventure uncover secrets of the bizzare communist country and the powerful capitalistic empire witness the story full of unpredictable twists and turns and discover the true agenda of the mysterious Supreme Leader,Missing,77.41025081568553
1559001600,"[4, 9, 32, 33]",101152,Crystal Crisis,"[6, 48, 130]",An allstar cast of heroes has gathered to test their mettle in this cute and chaotic new colormatching combat game for Nintendo Switch Crystal Crisis is presented like a oneonone fighting game but instead of pressing buttons to kick and punch players arrange falling gems into matching colors to clear them from the screen and inflict damage on their opponents Its the ultimate puzzle battle throwdown,Missing,77.0
1558396800,"[9, 13, 31, 32]",110807,Observation,"[6, 48, 49]",Observation is a scifi thriller uncovering what happened to Dr Emma Fisher and the crew of her mission through the lens of the stations artificial intelligence SAM,Missing,76.6388941319626
1559088000,"[10, 13, 14]",89444,Assetto Corsa Competizione,"[6, 48, 49]",Assetto Corsa Competizione the official GT World Challenge videogame Thanks to the extraordinary quality of simulation you will experience the atmosphere of the GT3 championship Compete against official drivers teams cars and official circuits reproduced to the highest quality ever seen,Missing,74.4379267515436
1559001600,"[5, 15, 33]",111846,Void Bastards,"[6, 14, 48, 49, 130]",Inspired by BioShock and System Shock 2 Void Bastards is a revolutionary new strategyshooter that will test your wits as well as exercise your aim Can you lead the misfit prisoners of the Void Ark through the derelict spaceships and myriad dangers of the Sargasso Nebula,Forget everything you know about firstperson shooters Void Bastards asks you to take charge not just point your gun and fire Your task is to lead the ragtag Void Bastards out of the Sargasso Nebula You make the decisions where to go what to do and who to fight And then you must carry out that strategy in the face of strange and terrible enemies  On board derelict spaceships youll plan your mission taking note of the ship layout what hazards and enemies you might encounter and what terminals and other ship systems you can use to your advantage  Move carefully through the dangerous ships searching for supplies and manipulating control systems React to what you find  will you detour to the generator to bring the power back online or will you fight your way into the security module to disable the ships defenses Choose carefully when to fight when to run and when just to be a bastard  Use your hard won supplies to improvise tools and weapons from the distracting robokitty to the horribly unstable clusterflak  Navigate your tiny escape pod through the vast nebula Flee from void whales and pirates and politely avoid the hungry hermits All the while you must keep scavenging for the food fuel and other resources that keep you alive  Void Bastards features a 1215 hour campaign that you can complete with an endless supply of prisoners each with their own unique traits When one dies another steps forward to carry on the fight Dont worry though as any crafting progress youve made is retained from one to another,74.22210181801918
1557878400,"[5, 13, 31]",141338,Red Dead Online,"[6, 48, 49, 169, 170]",Step into the vibrant everevolving world of Red Dead Online and experience life in frontier America Chase down bounties battle outlaw gangs and other players hunt fish and trade search for exotic treasures run Moonshine and much more to discover in a world of astounding depth and detail,Missing,74.15078566382384
1558396800,"[10, 33]",103018,Team Sonic Racing,"[6, 48, 49, 130]",Team Sonic Racing combines the best elements of arcade and fastpaced competitive style racing as you faceoff with friends in intense multiplayer racing,Missing,72.9493269100331
1558483200,[5],114684,Splitgate,"[6, 48, 49, 167, 169]",Splitgate is a freetoplay fastpaced multiplayer shooter that features playercontrolled portals This scifi shooter takes the FPS genre to a new dimension with its portal mechanics delivering highflying multidimensional combat Evoking memories of the most revered shooters of the past two decades Splitgate embraces the classic and familiar feel of closequarters combat while adding a unique twist,Missing,72.80024026242165
1559001600,"[9, 31]",115304,Five Nights at Freddy's: Help Wanted,"[6, 48, 49, 130, 165, 167, 169, 384, 386]",Five Nights at Freddys Help Wanted is a collection of classic and original minigames set in the Five Nights universe Survive terrifying encounters with your favorite killer animatronics in a collection of new and classic Five Nights at Freddys experiences Where fantasy and fun come to life,Fazbear Entertainment has become extremely unpopular due to several incidents and disasters that allegedly occurred at their various locations over the years which have been established as urban legends The problem is aggravated by a horror video game series based on the legends created by an unnamed indie developer In an attempt to overturn the bad reputation these rumors gave the company Fazbear Entertainment commissioned the Freddy Fazbear Virtual Experience a virtual reality game meant to make light of the rumors and convince players that those events were completely fictitious However this narrative is contradicted by sixteen cassette tapes hidden throughout the game which contain logs recorded by one of the games developers  Meant as a warning for future players the tapes expose a lawsuit happening during the games development involving an incident with a past employee Jeremy that put the games completion in jeopardy In addition the tapes reveal that Fazbear Entertainment hired the unnamed indie developer to create the video game series based on the alleged legends before cutting ties with him the games were part of an elaborate ploy to discredit the rumors surrounding the company Most importantly the tapes warn of a malicious code that was uploaded to the game from an old circuit board This code takes the form of a sinister character known as Glitchtrap who appears as a humanoid in a rabbit costume Glitchtrap is ultimately revealed to be attempting to escape from the game by merging with the player  After the nonVR version was released there was a door in a level that leads to a snowy Christmas tree farm In the distance there is a silhouette of a large building being constructed by Fazbear Entertainment with a nearby billboard showing that they are now hiring,71.56831002393045
1559260800,"[2, 9, 12, 31]",116851,Smile For Me,"[6, 14, 48, 49, 130, 167, 169]",A heartbroken clown wayward souls and juicy mechanical lips As The Big Event draws near help the troubled residents of the Habitat and demask the mysterious Doctor Habit before its too late,Missing,71.19238412234503
1559001600,"[13, 31, 32]",90107,Layers of Fear 2,"[6, 48, 49, 130]",Layers of Fear 2 is a firstperson psychological horror game with an emphasis on exploration and story Players control a Hollywood actor who heeds the call of an enigmatic director to take on the lead role in a film shot aboard an ocean liner Beware for all may not truly be what it seems,The cameras are all focused on you the center of the scene Not just in character you are the character The part to play is singularly yours Written just for youYou are met with silence No barking orders from the director No call to action that you need to become this version of yourself The demand to act fills your mind but the script pages hold no words  Your past has helped to mold you into what you are forced upon you the skills required to hone your craft That same past has scraped deep furrowing scars into you not on the outside where the world can see but in a place buried so deep within that it has become shapeless You push those memories down but let the experiences drive you into who or what you must play  Darkness surrounds as you stand silently in the spotlight the only sounds to be heard over your heartbeat are the distant breaking of waves against the hull and the sound of cameras pointed in your direction preserving this moment for eternity  A deep and commanding voice rises from the distance Act  What part will you play,70.50558704552158
1557187200,"[10, 13, 14, 33]",52200,Descenders,"[3, 6, 14, 48, 49, 130]",Descenders is extreme downhill freeriding for the modern era with procedurally generated worlds and where mistakes have real consequences Will you lead your team to glory and become the next legendary Descender,Missing,70.4018799952639
1558569600,"[15, 31, 32]",111033,Project Winter,"[6, 48, 49, 130]",Project Winter is an 8 person multiplayer game focusing on social deception and survival The survivors goal is to work together gather resources and escape Unbeknownst to them traitors are within the group whose only goal is to stop them by any means necessary,Missing,70.2651349457575
1559001600,"[12, 13, 31, 32, 34]",118052,The Language of Love,"[3, 6, 14, 48, 49, 130]",Mitsuki an aimless young man studying to take his university entrance exams falls for a young single mother who lives in his apartment complex A relationship develops between these mismatched social outcasts and then,Missing,70.0
1559174400,"[13, 31, 32]",117797,FreeDiver: Triton Down,"[6, 48, 165, 384]",Freediver Triton Down is a fullyinteractive singleplayer experience with deep roots in ocean adventure cinema Freediver delivers the whirlwind fun and thrills of a disaster blockbuster all in a bingeworthy package,Missing,70.0
1557792000,"[5, 32, 33]",117781,Risk System,"[3, 6, 14, 48, 49, 130]",In the distant future humanity has discovered a method to replicate matter through the use of a Dimensional Gate Industry is revolutionized overnight and a short period of chaos gives way to all warring factions uniting under a common bannerA few years pass and the peace brought about by Gate Technology crumbles once a new threat appears a race of energy parasites that have crossed through the Dimensional Gate by mimicking the very materials humanity had believed they were replicating Mankind is quickly overtaken as their technology is turned against them and the energy emitted by the parasites begins to take control of those exposedIn an act of desperation the experimental RSK9 is constructed a ship made of PreGate materials and technology with the ability to absorb parasite energy and use it to power its incredible arsenal Piloting the RSK9 is Alys an ace pilot previously missing in action that has returned seemingly immune to parasite control Her skill and resistance to the parasite energies influence make her the only pilot capable of preventing the extinction of mankindNOTE FOR LINUX USERS  Due to game engine limitations we are only able to guarantee compatibility with Ubuntu 18042 LTS 64bit or newer It is likely it will function on many other Linux distributions but it is impossible currently to be 100 sure We very much want to support the Linux community and are happy to entertain suggestions on how we may improve compatibility in the futureGAME PLAYIncrease your BMeter  firepower quickly by flying as close to enemy fire as possible and absorbing their energy The closer you fly the more energy you netFire your weapon while flying close to enemy fire and absorbing to perform powerful Risk Shots Enemies destroyed by these powered up shots will turn into energy to power your shield The best defense is a risky offenseFly like an ace pilot and utilize Barrel Rolls to quickly cover vertical space  modify your attackUnleash the Barrier Breaker once the BMeter is full to inflict huge damage on everything in sightPlaying for points is fun again as higher scores are awarded for explosive bursts of destruction and taking risks Destroy multiple enemies at once and utilize Risk Shots to string together combos and increase your score multiplierExperience different facets and paths to the story based on your performance and actions taken during missions,Missing,70.0
1558656000,"[14, 32, 33]",116486,Super Tennis Blast,"[6, 48, 49, 130]",Remember retrostyled sports games Dust off your racket and set your friends around the couch with Super Tennis Blast A tennis game for tennis enthusiasts made by fans of arcade games Game set match Ready to have a blast,Missing,70.0
1558569600,"[8, 10, 31, 32, 33]",115906,Balancelot,"[6, 48, 49, 130]",Use your controller or keyboard to balance the clumsy but fully functional unicycle Thrust the threatening mythical monsters with your sharpened lance as they set on your way to glory Climbing over the dead enemies with your unicycle may be the last climb you take,Poor squire dreams to attend and conquer kingdom jousting tournament By being poor he cant afford a horse Unicycle happens to be close enough so the epic journey may begin  Use your controller or keyboard to balance the clumsy but fully functional onewheeler unicycle Thrust with your sharpened lance when encountering threats from local mythical monsters Climbing over the dead enemies with your unicycle may be the last climb you take Crush your enemies drive before them and hear the lamentation of your onewheeler,70.0
1558656000,"[12, 31, 32]",113810,Drawngeon: Dungeons of Ink and Paper,"[6, 48, 49, 130]",Inkland  the handdrawn unusual world Reveal the secret of the Mysterious Tower in this oldschool roleplaying game with a firstperson perspective realtime combat and gridbased movement,Missing,70.0
1557964800,"[8, 31]",111558,Bubsy: Paws on Fire!,"[6, 48, 130]",From the developers of the BITTRIP series comes Bubsy Paws on Fire the latest and greatest in bobcatbased gaming  Bubsy is back in his greatest adventure yet Featuring four playable characters with their own unique playstyles new moves never before seen in a Bubsy title and over 100 levels and variations Paws on Fire is a game for Bubsy lovers everywhere,Missing,70.0
1557792000,"[2, 9, 13, 31]",110416,Sumatra: Fate of Yandi,"[6, 48, 49, 130, 167, 169]",Lost and alone after a terrible accident Yandi must find his way home in this old school point and click adventure set deep in the Sumatran jungle What secrets will he uncover along the way A new game from the creators of Football Game Legend of Hand and A Date in the Park,Missing,70.0
1557273600,"[12, 25, 31, 32]",107291,Infected Shelter,"[3, 6, 14, 48, 49, 130]",Dead Cells  Castle Crashers  executions  Infected Shelter  Infected Shelter is a randomly generated roguelite postapocalyptic action RPG shooter  dungeon brawler Singleplayer and coop for up to four players  Every run is different because of the randomly generated content By beating enemies players can loot more than 150 different blueprints of permanent improvements and this is the key to Infected Shelters replayability Instead of just collecting loot to make yourself more powerful during a single run you unlock new weapons clothes skills relics and RPGlike character improvements that change how you play the game in the following runs,You play as a member of a surviving group in a postapocalyptic world On one fateful morning you awake to find the shelter is raided and your people are kidnapped for reasons unknown Leaving your shelter you emerge into the harsh infected land and start looking for the kidnappers and the truth behind the events Your path lead you through randomly generated postapocalyptic areas controlled by different enemy factions with brutal leaders and shelters occupied by infected creatures  You have to use your skills in a fast paced violent and complex 2D brawlerlike combat where lots of firearms and melee weapons are waiting for you to beat and execute your enemies You will unlock new weapons clothes skills relics and RPGlike character improvements during your journey,70.0
1558915200,"[12, 15, 16, 32]",97932,Banner of the Maid,"[6, 48, 49, 130]",Banner of the Maid is a turnbase strategy game set in the time of the French Revolution You will lead the army to break through the difficulties and experience the different stories of that most uncommon time with wine of salon and the smoke of battlefield,Missing,70.0
1559260800,"[24, 32]",96228,Mowin' & Throwin',"[6, 48, 49, 130]",Mowin  Throwin is a 2 vs 2 local multiplayer game featuring lawnobsessed gnomes who drive riding mowers Each match is a constant tugofwar as you work with your teammate to mow your lawn and sabotage the other team The team who has the least amount of grass on their lawn when time ends wins REQUIRES 4 XBOX CONTROLLERS,Missing,70.0
1557705600,"[12, 13, 15, 31, 32]",91057,Light Fairytale Episode 1,"[3, 6, 14, 48, 49, 169]",A turnbased JRPG series with a classic feel but modern visuals Episode 1 starts the journey to the lost sky with Haru and Kuroko,Missing,70.0
1558915200,"[8, 25, 31, 32, 33]",82439,Dogurai,"[3, 6, 48, 49, 130]",Dogurai is a retrostyled platormer with animallike characters graphics and soundtrack designed with old portable games in mind  down to the limited color ranges and sprite sizes,Missing,70.0
1557446400,"[5, 31, 32]",51594,TwinCop,"[6, 14, 48, 49]",TwinCop is an actionpacked cooperative twinstick shooter with a retro vibe You and a friend are TwinCop one player controls the right arm the other controls the left arm and both of you control the feet,Missing,70.0
1559174400,"[12, 31, 32]",36078,Super Cane Magic Zero,"[3, 6, 14, 48, 130]",Super Cane Magic Zero is a comedy action RPG It features a large handcrafted game world full of secrets to explore in addition randomly generated dungeons and local PVP arenas Fight solo or local coop get gear eat bombs crawl ridiculous dungeons and kill all the vegetables,Missing,70.0
