first_release_date,genres,id,name,platforms,summary,storyline,rating
1630368000,"[12, 31, 32]",162622,Maneater: Truth Quest,"[6, 48, 49, 167, 169]",Maneater Truth Quest DLC takes players to a brandnew island off the coast of Port Clovis  and comes packed with new evolutions challenges wildlife and more Players will once again take control of the apex predator of the sea to Eat Explore and Evolve their way to the top of the food chain,Starring the titular and evolved bull shark protagonist and investigative journalistnarrator Trip Westhaven Maneater Truth Quest will take players down the rabbit hole of dark secrets and conspiracies surrounding Port Clovis and the Naval Wildlife Organization NWO The original stories of animals growing bone like armor emitting flesheating toxins or using electricity as a weapon were simply just old fishermans tales That is until conspiracy theorists everywhere pointed to the original Maneater as solid proof of a Government coverup Trip Westhaven driven the brink of madness fires up his ViewTube channel Truth Quest to take his followers the Questers into deep waters in an effort to uncover the dark secrets behind this whale of a tale  Maneater Truth Quest DLC takes players to a brandnew island off the coast of Port Clovis  and comes packed with new evolutions challenges wildlife and more Players will once again take control of the apex predator of the sea to Eat Explore and Evolve their way to the top of the food chain Those interested in testing the water can also look forward to a free pilot episode showcasing some of the new objectives players can sink their teeth into while uncovering the mysteries that lie below This pilot episode features approximately 1015 minutes of gameplay and is intended to provide a small taste of whats to come with the full version of Maneater Truth Quest,Missing
1627948800,[5],162621,Zombie Army 4: Dead War - Mission 9: Return to Hell,"[6, 48, 49, 169]",This is the third and final mission in Return to Hell a horrifying threepart Zombie Army 4 Dead War campaign Explore the realm of the damned in this new 14 player mission complete with horrifying enemies collectibles and more Youve come this far but can you live through hell itself,Its time to finish this Learn the sinister secrets that set the Zombie apocalypse in motion and venture deep into Hell itself as you sprint to rescue a fallen ally from a fate worse than death  a space known only as the Void Will the forces of the occult have their final victory or will the bell toll for them,Missing
1629590400,"[13, 15, 32]",161333,Dps Idle,"[6, 49, 169]",Collect cards upgrade cards defeat monsters join guilds and hire heroes Raise your DPS,Missing,Missing
1629072000,"[5, 8, 31, 32, 33]",159731,Radioactive Dwarfs: Evil From the Sewers,"[6, 48, 49, 130]",Blast through the sewers in Radioactive Dwarfs Retro topdown shooter with NESstyle pixel graphics and chiptune music Help armed heroine search for her brother in underground dwarven settlement Many enemies items secrets and bonus levels Thrilling adventure awaits,Missing,Missing
1627948800,"[8, 31]",159377,Enter Digiton: Heart of Corruption,"[48, 49, 130, 167]",Take the role of one of Digitons few survivors Armed with only a shield and tasked with banishing the demon lords its up to you to explore the dark mysteries of the corrupted kingdom and restore its former glory Uncover longhidden secrets and discover the truth behind the enigma known as an AHAB unit,Missing,Missing
1627948800,[5],159117,Apex Legends: Emergence,"[6, 48, 49, 130, 167, 169]",Meet a new legend With microdrones and an artists eye Seer spots opportunities that other Legends might miss and seizes them in the most beautiful way he can  Season 10 also comes with new weapons ranked arenas and new scenery,Missing,Missing
1630368000,"[9, 31, 32]",158161,Don't Touch this Button!,"[6, 48, 49, 130, 167, 169]",Dont Touch this Button is a minimalistic puzzle game with a firstperson point of view,Missing,Missing
1628553600,"[11, 15]",155457,Age of Empires II: Definitive Edition - Dawn of the Dukes,"[6, 49, 169]",Dawn of the Dukes the second new official expansion to Age of Empires II Definitive Edition will be available in August 2021,Missing,Missing
1629763200,"[12, 15, 16, 31]",155100,King's Bounty II: Lord's Edition,"[6, 48, 49, 130, 167, 169]",The Kings Bounty turnbased tactics series returns with Kings Bounty 2 In addition to the tactical depth fans expect from its combat immerse yourself in the fantasy world of Antara with a whole new nonlinear narrative and deep RPG mechanics that give weight to your every decision  The Kings Bounty II Lords Edition contains the Main game and the following content  Rod of Deception  Frosthammer  Staff of Harmony  Tyrants Sword  Armor of the Hollow  Heroes  Villains Premium Pack,Missing,Missing
1629158400,"[13, 14, 15]",155098,Madden NFL 22: Dynasty Edition,"[6, 48, 49, 167, 169]",The Dynasty Edition comes with  3 Day early access  Dual Entitlement  Franchise 100 Staff Points  Face of the Franchise  The Yard The General Player Class starting at Level 10  Tom Brady Gear Capsule  Choice of 1 out of 32 NFL Stars  Choice of Brady or Mahomes Elite Item  Exclusive Challenges during early access window  Choice of Brady or Mahomes Curated Legends Pack  22 Team Fantasy Packs,Missing,Missing
1630022400,[14],154788,Instant Sports Paradise,"[48, 49, 130, 167, 169]",Instant Sports Paradise makes the sun shine bright on your family workouts Travel to the other side of the planet and enjoy an experience up to to 4 local players all on your cosy couch,Missing,Missing
1629763200,[5],154709,Aliens: Fireteam Elite - Deluxe Edition,"[6, 48, 49, 167, 169]",The Deluxe Edition includes the Endeavor Pass  Endeavor Veteran Pack essentially granting players additional customization options and all future DLC,Missing,Missing
1630368000,"[8, 9, 15, 32, 33]",154118,Tricks Magician,"[6, 48, 49, 130, 167, 169]",Tricks Magician is a game about a magician who has been trapped in an alternate reality because of his assistant rabbits revenge and now must overcome several challenges with a defying gravity and return to your normal world,Missing,Missing
1630022400,"[5, 13, 32]",154057,Drone Gladiator,"[6, 49, 169]",New era of gladiator battle shows has come era of robots And you have a chance to participate in it Drone Gladiator is an arena shooter where you upgrade your drone fight giant bosses and participate in random events,Missing,Missing
1629763200,"[31, 34]",154032,Embraced by Autumn,"[6, 14, 48, 49, 130, 167, 169]",A sweet romance story with four heroines set in an allgirls boarding school in France in 1896 featuring a crossdressing male protagonist,Missing,Missing
1628208000,"[8, 31, 32]",154002,Super Onion Boy 2,"[6, 48, 49, 130, 167, 169]",Super Onion Boy 2 is a 2D adventure game in retro style platformer Defeat enemies on the way with the help of superpowers and epic transformations collect coins and stars to earn extra lives find chests with magic potions and defeat all the terrible bosses until you reach the final boss,Your mission is to save your friend who was captured by a terrible monster with psychic powers Defeat enemies on the way with the help of superpowers and epic transformations collect coins and stars to earn extra lives find chests with magic potions and defeat all the terrible bosses until you reach the final boss  After saving a princess from the clutches of a terrible monster the Onion Boy wakes up in the forest and is not sure if everything was real or just a dream he decides to go to the place where he saved her,Missing
1628121600,"[5, 32, 33]",153512,Star Hunter DX,"[6, 48, 49, 130]",Betrayed by her cutthroat crew Luna Starr  former Space Pirate Captain turned bounty hunter  has a score to settle As Luna travel to 5 exotic planets to track down your mutinous mates and face them in Bullet Hell dogfights to the death,Outnumbered and outgunned its a good thing Luna has an ace up her sleeve a space fighter craft that can alter the flow of time itself Power up the Bullet Time gauge by destroying enemies or catching their attacks in a bomb blast then enter Bullet Time Enemies and their projectiles will move in slow motion while you can still fly and shoot at normal speed,Missing
1629158400,"[13, 14, 15]",153048,Madden NFL 22: MVP Edition,"[6, 48, 49, 167, 169]",The MVP Edition includes  3 Day early access  Dual Entitlement  Franchise 60 Staff points  Face of the Franchise  The Yard The General player class starting at Level 10  Tom Brady gear capsule  Choice of 1 out of 32 NFL Stars  Choice of Brady or Mahomes Elite Item  Exclusive Challenges during early access window  11 Team Fantasy packs,Missing,Missing
1629763200,[16],153021,King's Bounty II: King Collector's Edition,"[6, 48, 49, 130]",This edition includes the following Game Kings Bounty II Day One Edition Bonus DLCs  Rod of Deception Frosthammer Staff of Harmony Tyrants Sword Armor of the Hollow armor set Heroes  Villains Premium Pack and Kings Watchdogs unit Kings Crown A collectible item Poster Doublesided poster featuring artwork  map Soundtrack Selection of ingame music Artbook Hardcover Artbook,Missing,Missing
1629936000,"[13, 14, 15, 32]",153011,Axis Football 2021,"[3, 6, 14, 48, 49]",Axis Football is a simulationstyle football game featuring the industrys best franchise mode massive customization and realistic gameplay,Missing,Missing
1629849600,"[25, 31, 32]",152415,Rogue Spirit,"[6, 167, 169]",Rogue Spirit is a 3D roguelite action game with light stealth elements Play as the Ghost of the Prince of the Kingdom of Midra possess enemy characters and absorb their unique skills to fight the evil presence that has corrupted your land,Reality and the spirit world are now intertwined defeat the armies of Chaos to save the people of the Kingdom of Midra from demonic invaders You play as the Ghost the summoned Spirit of the Prince of the Kingdom of Midra wandering your land Passing through your kingdoms villages forests and marshes youll have to defeat and possess your foes to acquire their skills and adapt your combat style to different circumstances Each defeated enemy is an opportunity for a body with better chance of survival,Missing
1628726400,[8],152302,Paw Patrol the Movie: Adventure City Calls,"[6, 48, 49, 130, 167, 170]",So long Adventure Bay PAW Patrol is on a rollto Adventure CITY When the pups learn that Humdinger has become mayor of a buzzing metropolis they must race into action to save Adventure City from his selfish scheming Play as your favorite pups on exciting rescue missions Explore new locations level up with vehicles and gadgets play minigames and save the day,Missing,Missing
1629244800,"[12, 31, 32]",152119,Mortal Shell: The Virtuous Cycle,"[6, 48, 49, 167, 169]",Mortal Shell will be getting a DLC expansion called The Virtuous Cycle  In a teaser revealed at IGN Expo 2021 the soulslike RPG offered us a look at a rainswept building a forest of moving trees and a character with what looks to be a new weapon that can switch freely between spear axe and dual sword forms,Mortal Shell is a deep actionRPG that tests your sanity and resilience in a shattered world As the remains of humanity wither and rot zealous foes fester in the ruins They spare no mercy with survival demanding superior awareness precision and instincts Track down hidden sanctums of devout followers and discover your true purpose,Missing
1629763200,"[31, 32]",149631,Soul Shifter,"[6, 49, 169]",In Soul Shifter the player breaks through the ruins of what was once the most glorious of the castles and discovers the secrets behind the magical elemental energy that brought prosperity but also disgrace to the kingdom,Missing,Missing
1629331200,"[5, 31, 32]",146806,Yuoni,"[6, 48, 49, 167, 169]",Yuoni is a firstperson narrative horror game that whisks you away to a sunsetstained world to play a deadly game of hide and seek As gradeschooler Ai navigate authentic Japanese environments and utilise every hiding space you can find to survive the horrors ahead And if they find you run,Yuoni is a firstperson horror action game set in Japan in the year 1990 As Ai a gradeschooler yet to realize how closed off she is you are forced to play childrens games in a world of permanent dusk There Ais life hangs in the balance as you are attacked day after day by shadowy entities and eyeball monsters among other horrors Eventually monsters start to bleed into the real world where Ai discovers that she too  Test your courage in a dangerous game of hide and seek before initiating a terrifyingly twisted version of tag with abominations not of this world Use the items youve gathered to flee your sunset hell but be sure to remember the paths youve taken or risk being trapped there forever  Experience an unnerving mix of beauty fear and nostalgia in a mysterious world where a Japanese house school and hospital are all inexplicably connected Explore corridors dyed twilight crimson witness the ethereal glow of amber through paper walls of a traditional Japanese house and escape creeping black shadows in hospital rooms where the power is somehow always out  10yearold Ai has no defensive measures to defeat the enemies you face instead you must take advantage of each spirits weaknesses to survive Hold your breath to sneak past blind foes or dash past deaf ones as quick as your little legs can carry you And if you cant get away in time prepare to suffer a dire fate at the hands of unimaginable forces  Upon clearing the game another ending will become available to you What story will this new path unveil Slipping back into the terrifying world of Yuoni will see you face considerably more challenging foes for an even greater reward,Missing
1629763200,"[5, 12, 31, 32, 33]",146624,Calturin,"[3, 6, 14, 48, 49, 130]",Calturin is a Bullet Hell Boss Rush game where you are resurrected by a necromancer who now holds you in his power Promised your freedom if you do his bidding you must traverse the Gauntlet of Portals to unknown lands and conquer deadly beings   10 unique boss fights and 2 paths of pain  A compelling story told through fully voiced NPCs  Choose how to improve your skills as you become stronger  Designed to be suitable for both normal playthrough and speedrunning  The Gauntlet of Portals Awaits,Calturin is a Bullet Hell Boss Rush game where you are resurrected by a necromancer who now holds you in his power Promised your freedom if you do his bidding you must traverse the Gauntlet of Portals to unknown lands and conquer deadly beings,Missing
1629763200,"[12, 15, 16, 31]",146330,King's Bounty II: Day One Edition,"[6, 48, 49, 130, 167, 169]",Legend returns Kings Bounty II is the longawaited sequel to the legendary Kings Bounty video games franchise one of the most iconic representatives of the turnbased RPG genre  Day One Edition includes  Elite Guard Premium Pack  Armored Princes Shield  Firehand Golems unit  Flaming Eagles unit  Hounds of War Warhorse,Missing,Missing
1628553600,"[12, 15, 16, 24, 32, 35]",145929,Mech Armada,"[6, 48, 49, 130, 167, 169]",Mech Armada provides a fresh combination of turnbased tactics deckbuilding and roguelikes You are in command of a team of custombuilt Mechs Push your strategic skills to the limit as you save whats left of the Earth from the Swarm  Youll need to plan carefully if you want to overpower the invading Swarm in a series of small tactical battles Upgrade and build your deck of available Mechs manage your resources and leverage your territory wisely Get it wrong and its game over Start again with a whole new experience as monsters maps resources and rewards are all randomly generated,The world as we knew it ended when the Swarm came Hordes of terrifying creatures out of our worst nightmares ravaged the Earth destroying every living thing in sight  We few survivors fled underground desperately searching for the tech and resources to survive  and fight back To battle the monsters we created an armada of war machines called Mechs  Thanks to groundbreaking replicator tech these Mechs could be generated almost instantly in the battlefield turning the tide of what seemed to be an unwinnable war As we pushed back we used every resource to power our way forward to destroy the Swarm,Missing
1628035200,"[8, 9, 15, 31, 32]",145437,Orbals,"[48, 49, 130]",Orbals is a fastpaced rolling adventure puzzle game with wonderful graphics and sound Quickly solve puzzles to master the Mojometer find new Orbals characters and unlock special abilities,Missing,Missing
1628553600,[13],145134,Lawn Mowing Simulator,"[6, 48, 49, 167, 169]",Experience the beauty and detail of mowing the Great British countryside in Lawn Mowing Simulator the only simulator that allows you to ride an authentic and expansive roster of realworld licensed lawn mowers from prestigious manufacturers Toro SCAG and STIGA as you manage your business,Missing,Missing
1629158400,"[12, 25, 31]",144774,Marvel's Avengers: Black Panther - War for Wakanda,"[6, 48, 49, 167, 169, 170]",Black Panther  War for Wakanda is an expansion for Marvels Avengers It introduces a new playable character Black Panther complete with his own gear and cosmetics This expansion also includes new Villains like Klaw a new enemy Faction the new Wakandan Jungle Biome a new Outpost a Power Level cap increase and much more,Missing,Missing
1629936000,"[5, 12, 25, 31, 33]",144065,Ampersat,"[3, 6, 14, 48, 49, 130, 167, 169]",A shooty slashy RPGy game mixing retro and modern sensibilities A blend of influences from Gauntlet  Smash TV to Zelda  Angband battle ASCII creatures in colorful areas  free letters to return language to the village,Ampersat is a shooty slashy RPGy game mixing oldschoolretro and modern sensibilities A blend of influences from Gauntlet and Smash TV to Zelda and a dash of Angband this is a handcrafted adventure with much appeal to fans of Roguelites A labor of love from a solo developer Ampersat distills some favorite childhood gaming experiences into a fresh fun hybrid that sees you killing a lot of monsters finding a lot of loot freeing captured letters um what and growing from a worldweary warrior mage into a powerful smashingblasting machine,Missing
1629244800,"[4, 25, 32, 33]",143858,Mayhem Brawler,"[6, 48, 49, 130, 167, 169]",Mayhem Brawler is an urban fantasy themed beat em up that brings back the 90s arcade vibe to the present day With comic book style art and kickass soundtracks it offers a unique experience that you can tackle solo or as coop with friends while defining the next step in the story with your choices The game is developed by Hero Concept studios,While answering a routine call on a patrol Dolphin Star and Trouble the most popular officers of the superpowered law enforcement agency Stronghold find themselves in a sequence of events that will alter the fate of the entire city,Missing
1629936000,"[5, 32]",143638,Marfusha,"[6, 48, 49, 130, 167]",A hightempo shooting game with simple controls Upgrade your character with cards and defend the gates from your enemies,Missing,Missing
1628726400,"[9, 12, 31, 32]",143423,Faraday Protocol,"[6, 48, 49, 130]",Faraday Protocol is a firstperson storydriven puzzle game that will award you with a solid sense of accomplishment when overcoming its challenges You are Raug Zeekon interstellar archeologist from planet Cunor You have been sent by your company to investigate the source of a mysterious signal coming from an unexplored star system,Missing,Missing
1628726400,"[2, 9, 31, 32]",143100,The Plane Effect,"[6, 48, 130, 167, 169]",Players take on the role of Solo a lonely office worker whos trying to get home to his family after his last day of work Somewhat worryingly it seems Solo experiences some trouble remembering his family and also has to contend with the shifting balance of space and time,Missing,Missing
1630022400,"[5, 32]",141140,Space Station Sprint,"[6, 49, 169]",Space Station Sprint is a fast paced scifi first person shooter Infiltrate each space station and complete your objective before your escape ship is spotted by the enemy space station Find permanent upgrades secondary objectives and secrets in each level,Missing,Missing
1629244800,"[14, 32, 33]",139423,World Soccer Strikers'91,"[6, 48, 49, 130]",WSS91 is here Welcome to the 90s kid Action and graphics on par with the arcades Up to 8 players at the same time in your own living room A huge bunch of teams like at least 40 Game modes like tournaments leagues  everything What if we both pay for half and swap it every other week,WSS91 is a physicsbased retrostyle soccer game No magnetic feet is what makes WSS91 different You cannot depend on the games engine doing everything for you Youll have to aim dribble and shoot all by yourself We have included different difficulty levels in case you are just not good enough,Missing
1630368000,"[12, 13, 31, 32]",138138,Monster Harvest,"[6, 48, 49, 130, 167]",Monster Harvest is a monster collecting and farming action RPG with a twist Grow collect and mutate your crops then take them into battle Filled with places to discover and multiple ways to build your farm get ready to craft explore and battle across the vibrant world of Planimal Point,Missing,Missing
1628553600,"[12, 31, 32, 33, 34]",136980,Button City,"[6, 14, 130, 167, 169]",Button City is a colorful low poly adventure game about cute animals and an arcade Play as Fennel the fox as you explore a diorama world play exciting arcade games and meet cute animal friends Explore a highjinks story to save the arcade from a greedy fat cat who threatens to tear it down,Missing,Missing
1629331200,"[10, 13, 14]",135668,Rims Racing,"[6, 48, 49, 130, 167, 169]",The first motorbike simulation that combines a realistic racing challenge with engineering and mechanics Ride the worlds most powerful motorbikes and optimise their performance by swapping out parts and analysing data in real time,Missing,Missing
1628726400,"[5, 12, 31, 32]",134579,Foreclosed,"[6, 48, 49, 130, 167, 169, 170]",Foreclosed is a Cyberpunk actionshooter set in a comic book world Follow the events of Evan Kapnos in this original comic book styled game and discover how losing your identity is all too possible,Missing,Missing
1628208000,"[2, 9, 31, 32]",133022,Almost My Floor,"[3, 6, 14, 48, 49, 167]",Almost my floor  classic pointclick adventure with horror atmosphere Alex main character is a simple man who lives a simple life But one day everything will change Is he actually so simple This story tells about a long way to home Through child fears on an edge of fiction and reality There is no way back if you step into the elevator A common day turned adventure from which Alex has to get out,This story tells about a long way to home Through child fears on an edge of fiction and reality There is no way back if you step into the elevator A common day turned adventure from which Alex has to get out,Missing
1630368000,"[31, 32]",132756,Song of Iron,"[6, 49]",Song of Iron is a moody and provoking action adventure A dive into a dark Nordic world full of mystery and danger Your journey will take you far across the land of myths toward the home of the gods Fight your way through man monster and nature itself to reach the end,Missing,Missing
1628553600,"[12, 13, 15, 16, 32]",131760,Library of Ruina,"[6, 49]",May you find your book in this place Combat between the guests and the librarians breaks out as if it were on a stage Defeated guests turn into books and the Library grows onward And eventually get your hands on The one singular perfect book,Missing,Missing
1630022400,"[4, 13, 25, 32]",130517,Mad Streets,"[6, 49, 169, 170]",A physicsbased couch multiplayer fighter game casting a wide variety of characters and combat to bring a memorable beatemup party experience Pick up some controllers and settle the score in Mad Streets,Missing,Missing
1629936000,"[9, 12, 31, 32, 34]",130256,Hermitage: Strange Case Files,"[6, 48, 49, 130, 167]",This gripping paranormal horror adventure revolves around Hermitage the sinister bookstore that attracts most unusual customers  all of whom seem to be involved in mysterious cases bordering on the paranormal,This gripping paranormal horror adventure revolves around Hermitage the sinister bookstore that attracts most unusual customers  all of whom seem to be involved in mysterious cases bordering on the paranormal,Missing
1629936000,"[5, 24]",127353,Nine to Five,"[6, 48, 49, 170]",Nine to Five is a tactical firstperson shooter where smart teamwork triumphs over brute force and reflexes In the games nearfuture world its the corporations that rule and being a mercenary for them is just another job,In Nine to Five three teams of three players compete against each other over three intense rounds Each rounds outcome influences how the next one starts so if you want to complete the everchanging objectives the corporations set you youll need to constantly adapt your approach  With the emphasis on outsmarting the competition rather than outgunning them Nine to Five is a dynamic new take on tactical shooters It gives you a chance to find your role in the team and have fun  even if you have only 15 minutes to spare,Missing
1629331200,"[12, 31, 32, 34]",123473,Arietta of Spirits,"[6, 48, 49, 130]",Arietta of Spirits is a storydriven actionadventure game following Arietta on her journey to unveil the mysteries of the Spirit Realm Immerse yourself in a story filled with emotion and surprising turns,The game tells the story of Arietta and her family visiting their Grandmothers cabin for the first time after her passing away a year prior  However the family trip takes an unexpected turn when Arietta meets a mysterious new friend and gains the ability to see the strange beings that inhabit the island,Missing
